video_id,title,channel_title,publish_time,views,likes,dislikes,comment_count,Region,category_title
oZYT_vC4-pc,КВН 2017 Высшая лига Вторая 1/2 (12.11.2017) ИГРА ЦЕЛИКОМ Full HD,Официальный канал КВН,2017-11-12,442228,3194,5985,3218,RU,Comedy
3KdggIRWiR0,Яценюк. НЕпопулист. Вернулся,Анатолий Шарий,2017-11-13,419835,27738,656,4681,RU,Comedy
6X4YapxVq0A,ПИПЛТØК - PARALON (дисс на PHARAOH),PEOPLETALK,2017-11-13,64303,1864,1856,263,RU,Comedy
sI2Mpp9AWRg,ЗАЧЕМ ПУТИН ПОЙДЕТ НА ВЫБОРЫ?,kamikadzedead,2017-11-13,210181,34370,26569,5828,RU,Comedy
qHL7mEzDxhI,"КОРОЧЕ ГОВОРЯ, РЕПЕТИТОР - ТимТим.",Tим Тим,2017-11-12,738654,38917,1724,2339,RU,Comedy
mLFHz-aej9U,Осенний розыгрыш,Видеомемы,2017-11-13,95171,1047,135,67,RU,Comedy
ZEk1GefMvwM,Теща и морячок - По тещьему велению - Уральские Пельмени (2017),Уральские Пельмени,2017-11-12,237457,2957,353,195,RU,Comedy
V_PNqKNu12o,Званый Ужин ТРЭШ-ОБЗОР (Беззубая Королева),Looks Show,2017-11-13,47457,4507,245,522,RU,Comedy
79cuYqSnVYE,Ивановы Ивановы - комедийный сериал HD - 16 и 17 серии,molodejjtv,2017-11-13,55601,512,18,52,RU,Comedy
"#NAME?","Что, если тупость была бы преступлением?",МЁD,2017-11-14,352235,29932,674,1008,RU,Comedy
_WLZY6X2EgY,Как вам промыли мозг,Анатолий Шарий,2017-11-14,336940,22138,1092,2808,RU,Comedy
SctfeNke0HM,ЧП - Кирилл Терешин,Slacker,2017-11-13,787765,3708,1879,2188,RU,Comedy
OIrV2p2E6PA,Приключения Трампа и Медведева в Маниле. Доня и Димон - братья навек. MOUNT SHOW #118,MOUNT SHOW,2017-11-14,138119,16517,217,827,RU,Comedy
cx6mTuRxQ4Y,Супергерой Валера - По тещьему велению - Уральские Пельмени (2017),Уральские Пельмени,2017-11-14,112939,2298,196,115,RU,Comedy
Oxv2qWNdN-o,Ивановы Ивановы - комедийный сериал HD - 17 и 18 серии,molodejjtv,2017-11-14,103664,805,52,93,RU,Comedy
0fIxRHp2Reo,ФОНБЕТ СТАВКИ НА СПОРТ: Серёжа и микрофон #18,sergeymeza,2017-11-14,49863,3549,488,897,RU,Comedy
6X4YapxVq0A,ПИПЛТОК - PARALON,PEOPLETALK,2017-11-13,148830,2309,4901,462,RU,Comedy
8ytwoVOr69A,100-летие Революции | Класс народа,Денис Чужой,2017-11-14,36487,4580,108,338,RU,Comedy
6gzXYKBEWD0,"ПОЛИЦИЯ: БОЖЕ, ЦАРЯ ХРАНИ!",kamikadzedead,2017-11-14,197265,39361,61036,4900,RU,Comedy
t8Jq6NqCQ1o,WORLD PREMIERE TRAILER – Jimmy Kimmel’s The Terrific Ten,Jimmy Kimmel Live,2017-11-14,864242,20686,273,980,RU,Comedy
UdKOh7n2MpE,"КЕННЕТ БРАНА, ДЖОННИ ДЕПП, ДЖУДИ ДЕНЧ, МИШЕЛЬ ПФАЙФФЕР, ДЖОШ ГАД [s22e06] | ШОУ ГРЭМА НОРТОНА",BlackSerj Production / BSP Studio,2017-11-14,21737,1638,9,133,RU,Comedy
i6u4bG9Q38U,Студентские Мутки | 1 часть,Просто Озвучка,2017-11-14,26641,2294,41,163,RU,Comedy
mLFHz-aej9U,Осенний розыгрыш,Видеомемы,2017-11-13,132345,1342,226,85,RU,Comedy
sGottNbwGao,Убойный танец - это нужно видеть! Ржал весь зал! УГАР,Канал Смеха,2017-11-14,11612,239,39,15,RU,Comedy
oZYT_vC4-pc,КВН 2017 Высшая лига Вторая 1/2 (12.11.2017) ИГРА ЦЕЛИКОМ Full HD,Официальный канал КВН,2017-11-12,715780,4336,8077,4376,RU,Comedy
iNnC0k0P1_s,Сорвало башню | ПОТРАЧЕНО,ПОТРАЧЕНО,2017-11-14,101191,3792,231,292,RU,Comedy
TdFBEtydE5w,КАЖДАЯ КОСТЮМИРОВАННАЯ ВЕЧЕРИНКА ТАКАЯ,RusSmosh,2017-11-14,14734,1040,15,50,RU,Comedy
HeusiuWG8lQ,"Короче говоря, лотерейный билет",Room Factory,2017-11-15,715628,52663,697,1342,RU,Comedy
Vjg9reOLClg,BIG RUSSIAN BOSS. ПАРОДИЯ #14,Satyr,2017-11-15,327697,42684,2081,2732,RU,Comedy
x7ED1UwgQ8I,Игра трендов (Переозвучка) (спойлеры из сериала),TheNafig,2017-11-15,286234,32661,966,1616,RU,Comedy
h-5bMYY5ikY,Почему вата аплодировала в Киеве?,Анатолий Шарий,2017-11-15,253127,20511,475,2800,RU,Comedy
JByixoJQh9Q,Ивановы Ивановы - комедийный сериал HD - 18 и 19 серии,molodejjtv,2017-11-15,99132,696,42,76,RU,Comedy
oFd8-hRy9lg,ГУБЕРНАТОР: ВАРИТЕ ТУШЕНКУ (18+),kamikadzedead,2017-11-15,242811,48423,39215,6298,RU,Comedy
"#NAME?","Что, если тупость была бы преступлением?",МЁD,2017-11-14,496686,37145,991,1171,RU,Comedy
L1o3KgTFz88,Подборка приколов за октябрь - самое смешные приколы из Дизель шоу | Дизель cтудио Украина,Дизель Студио,2017-11-15,29129,381,48,27,RU,Comedy
cx6mTuRxQ4Y,Супергерой Валера - По тещьему велению - Уральские Пельмени (2017),Уральские Пельмени,2017-11-14,214931,3274,333,150,RU,Comedy
OIrV2p2E6PA,Приключения Трампа и Медведева в Маниле. Доня и Димон - братья навек. MOUNT SHOW #118,MOUNT SHOW,2017-11-14,220186,21496,353,1064,RU,Comedy
SctfeNke0HM,ЧП - Кирилл Терешин,Slacker,2017-11-13,1128968,5288,2714,3016,RU,Comedy
yJpiMUVxhOs,КВН  Спарта - 2017 Высшая лига Вторая 1/2 Приветствие,Официальный канал КВН,2017-11-15,142364,2260,204,424,RU,Comedy
"#NAME?",Фарион и урок языка,Анатолий Шарий,2017-11-17,165051,19254,234,2930,RU,Comedy
m73mRIwCWgE,Ограбление автосалона - По тещьему велению - Уральские Пельмени (2017),Уральские Пельмени,2017-11-16,141015,2581,251,117,RU,Comedy
A4Yh8MiV_Dc,БАЙКИ ХОВАНСКОГО v 2.0 [Как я создал канал / Взял кредит / Тусил у Маликова],Юрий Хованский,2017-11-16,179302,21238,1314,1210,RU,Comedy
HeusiuWG8lQ,"Короче говоря, лотерейный билет",Room Factory,2017-11-15,1059280,66788,1180,1664,RU,Comedy
_Mmp11-W_Yg,Ивановы Ивановы - комедийный сериал HD - 19 и 20 серии,molodejjtv,2017-11-16,105447,1110,64,195,RU,Comedy
QaRBT9bVSJc,ЛУЧШИЕ ПРИКОЛЫ 2017 НОЯБРЬ #51 | Лучшая Подборка Приколов | ТОПОВЫЕ ПРИКОЛЫ,АКАДЕМИЯ СМЕХА,2017-11-16,110539,4891,395,950,RU,Comedy
x7ED1UwgQ8I,Игра трендов (Переозвучка) (спойлеры из сериала),TheNafig,2017-11-15,366168,37258,1195,1843,RU,Comedy
SoXgW1vehBI,ТЫ МЕНЯ СЛЫШИШЬ - TheBrianMaps (Брайн Мапс) | Реакция,Майни,2017-11-16,37606,2029,93,278,RU,Comedy
Uqu0Rddp-TA,Непосредственно Каха -- ТРЕЙЛЕР 4 сезон 5 серия,KTV,2017-11-16,87165,3240,43,124,RU,Comedy
KstndSY3_-s,A Boatload of Fails: Throwback Fails (November 2017) | FailArmy,FailArmy,2017-11-16,736556,14610,852,708,RU,Comedy
L1o3KgTFz88,Подборка приколов за октябрь - самое смешные приколы из Дизель шоу | Дизель cтудио Украина,Дизель Студио,2017-11-15,53586,528,71,36,RU,Comedy
oFd8-hRy9lg,ГУБЕРНАТОР: ВАРИТЕ ТУШЕНКУ (18+),kamikadzedead,2017-11-15,265566,53549,65078,6938,RU,Comedy
m8HjBSRsD3o,BEST CUBE #173 - RUSSIAN EDITION,BEST CUBE 2.0,2017-11-16,119535,2306,309,127,RU,Comedy
TEldgX-Hyfc,Пранк с бесконечным шампунем!,Citizen Cat Pranks,2017-11-17,25014,1806,175,176,RU,Comedy
EN_bSc1-OLU,АНДРЕЙ ПОЙМАЛ МОПСА | МОПС ИЗВИНЯЕТСЯ ЗА ОСКОРБЛЕНИЯ | МОПС ПЛАЧЕТ,Мопс и Компания,2017-11-16,79371,1160,381,238,RU,Comedy
Ikc6YY2k0YU,Hojiboy Tojiboyev - Armiyada General ishlaydi lekin Ded va Denbil deganlari ishlamas ekan,YangiKulgu,2017-11-16,24824,251,20,12,RU,Comedy
PfeWX-6Y6Xo,+100500 - Передёргивание На Первом,AdamThomasMoran,2017-11-17,992183,109366,3794,36390,RU,Comedy
E056wbwWVx8,Конгресс США и мифотворчество + English Subtitles,Анатолий Шарий,2017-11-17,444637,37492,1056,9296,RU,Comedy
nfnVmzAVOfM,Я попала в ролик к Соболеву / Ответка Коле Соболеву [некто не пришел на фан встречу],Morana Battory,2017-11-17,36281,5237,1188,993,RU,Comedy
m73mRIwCWgE,Ограбление автосалона - По тещьему велению - Уральские Пельмени (2017),Уральские Пельмени,2017-11-16,266081,3555,438,172,RU,Comedy
PvQ8MdvtJUQ,Your Tooth Is Missing: Best Fails of the Week (November 2017) | FailArmy,FailArmy,2017-11-17,1178163,21696,668,942,RU,Comedy
SOE83yetX3I,Мастер маскировки | ПОТРАЧЕНО,ПОТРАЧЕНО,2017-11-17,90480,3231,353,208,RU,Comedy
_Mmp11-W_Yg,Ивановы Ивановы - комедийный сериал HD - 19 и 20 серии,molodejjtv,2017-11-16,267977,1799,118,280,RU,Comedy
A4Yh8MiV_Dc,БАЙКИ ХОВАНСКОГО v 2.0 [Как я создал канал / Взял кредит / Тусил у Маликова],Юрий Хованский,2017-11-16,247022,25732,1748,1516,RU,Comedy
tP1PTpdOM7s,"Լավ երեկո (Ելենա Եսենինա, Սեբու) 17.11.2017",Հանրային հեռուստաընկերություն,2017-11-17,32256,816,26,0,RU,Comedy
QaRBT9bVSJc,ЛУЧШИЕ ПРИКОЛЫ 2017 НОЯБРЬ #51 | Лучшая Подборка Приколов | ТОПОВЫЕ ПРИКОЛЫ,АКАДЕМИЯ СМЕХА,2017-11-16,227573,6984,652,1250,RU,Comedy
EVUTtPZ4-18,Порараз Бирацца в Казани,Stand-Up Club #1,2017-11-16,23585,1806,24,202,RU,Comedy
yqfTqmak12s,ВидеоОбзор#3 - РЕСТОРАТОР,NEMAGIA,2017-11-18,1170020,142010,8928,14731,RU,Comedy
PfeWX-6Y6Xo,+100500 - Передёргивание На Первом,AdamThomasMoran,2017-11-17,1696189,147218,6004,51156,RU,Comedy
D61KGzTn3cE,Простой Навальный Ч1,Анатолий Шарий,2017-11-18,189528,17157,1415,4038,RU,Comedy
mvkdvVxfNyw,"Дизель шоу 2017 - лучшие приколюхи, новый сезон. Дизель cтудио Украина, приколы и Виктория Булитко",Дизель Студио,2017-11-18,53171,450,95,39,RU,Comedy
p7dVxF8qD8U,Dizayn jamoasi - Davron Kabulov muxlislarni mot xolatiga olib keldi,Dizayn Jamoasi,2017-11-18,58830,440,76,38,RU,Comedy
f60ssTG5Owk,КТО ИЗ ВАС ? / БИНЕТ СЕНН / С КЕМ МУТИТЬ ?,Mark Makarov,2017-11-18,97163,10106,83,736,RU,Comedy
1diOcIX0dcU,"ХЬЮ ГРАНТ, ДЖЕЙСОН МОМОА, САРА МИЛЛИКАН, КЕЛЛИ КЛАРКСОН [s22e07] | ШОУ ГРЭМА НОРТОНА",BlackSerj Production / BSP Studio,2017-11-18,19995,1330,14,103,RU,Comedy
2KMrBpD4Cd0,Новый Рассмеши Комика 2017 - 14 сезон - выпуск #11,Рассмеши Комика - Официальный Канал,2017-11-18,52810,544,48,77,RU,Comedy
KQ13DnEICy8,Венчание Максима Галкина и Аллы Пугачевой,ShockСontent,2017-11-18,5379,20,3,7,RU,Comedy
fHr2KsBrdgU,ТИЗЕР [Плохбастер Шоу] (feat. IKOTIKA) Звездные Войны: Скрытая Угроза,Ikotika,2017-11-18,17462,2437,56,172,RU,Comedy
nfnVmzAVOfM,Я попала в ролик к Соболеву / Ответка Коле Соболеву [некто не пришел на фан встречу],Morana Battory,2017-11-17,109553,8636,3704,1959,RU,Comedy
5jRh0Nh9fHg,COMEDY CLUB 17.11.17 КАМЕДИ КЛАБ - Последний выпуск,БУДЬ В КУРСЕ,2017-11-17,86478,308,126,42,RU,Comedy
yqfTqmak12s,ВидеоОбзор#3 - РЕСТОРАТОР,NEMAGIA,2017-11-18,2142953,200252,14617,20317,RU,Comedy
js64w6_Kyyo,Как стать крутым Видеоблоггером № 1,RED21,2017-11-19,312576,25606,3910,4456,RU,Comedy
YMYbFXV-D5M,Стрим МОПСА,Мопс Официальный,2017-11-19,112248,4031,4853,206,RU,Comedy
8kuKndqCmFc,Половинки ОБЗОР (Сорокалетний НЕ ДЕВСТВЕННИК),Looks Show,2017-11-19,100859,7198,258,673,RU,Comedy
Glzpht8WkRI,Ответы на вопросы Ч1,Анатолий Шарий,2017-11-20,92563,7198,277,1043,RU,Comedy
STjlZUhdnXI,ОТВЕТ ЛАРИНУ / ПРАВДА НА ТВ,kamikadzedead,2017-11-19,253168,42229,29360,5914,RU,Comedy
NNpem5tl2UA,ЛУЧШИЕ ПРИКОЛЫ 2017 НОЯБРЬ #52 | Лучшая Подборка Приколов | ТОПОВЫЕ ПРИКОЛЫ,АКАДЕМИЯ СМЕХА,2017-11-19,72483,2764,365,469,RU,Comedy
PfeWX-6Y6Xo,+100500 - Передёргивание На Первом,AdamThomasMoran,2017-11-17,1993982,159829,6778,57373,RU,Comedy
NSGjeusehfI,BEST CUBE # 200,Best VIDEOS Лучшее видео,2017-11-19,87921,2929,245,305,RU,Comedy
mvkdvVxfNyw,"Дизель шоу 2017 - лучшие приколюхи, новый сезон. Дизель cтудио Украина, приколы и Виктория Булитко",Дизель Студио,2017-11-18,100106,625,159,45,RU,Comedy
NOwDv2hebDg,+50 000 - Хитрая кошка родила куски пенопласта,Рассмеши Комика - Официальный Канал,2017-11-18,169823,2462,345,171,RU,Comedy
Dp_-fZT5-04,ЛУЧШИЕ ПРИКОЛЫ SAMYY KLASS (ВЫПУСК 535),SAMYY KLASS,2017-11-19,89538,1969,121,128,RU,Comedy
ByzaymYZsZs,Приколы за неделю #35 | ПОТРАЧЕНО,ПОТРАЧЕНО,2017-11-19,98042,4424,286,268,RU,Comedy
JDCUWcNhQic,💥БОЛЬШОЙ  ФЕСТИВАЛЬ ЮМОРА. УМОРИТЕЛЬНОГО СМЕХА ДО СЛЕЗ!😂,РЖАЧ ПОЗИТИВ,2017-11-19,16347,112,22,6,RU,Comedy
nixKOg0C9eA,"10 минут смеха , 10 min of laughter№19",Techno,2017-11-19,5511,54,5,7,RU,Comedy
d5woC-LQI68,Т9 В РЕАЛЬНОЙ ЖИЗНИ,Room Factory,2017-11-20,758563,50404,1957,3050,RU,Comedy
6oNqagXzTck,Актер Петр и морские гребешки,Анатолий Шарий,2017-11-20,227786,18924,284,3158,RU,Comedy
yqfTqmak12s,ВидеоОбзор#3 - РЕСТОРАТОР,NEMAGIA,2017-11-18,2575104,221396,16819,22411,RU,Comedy
wUgTcRxG5vQ,ПУТИН МОЙ ПРЕЗИДЕНТ! (18+),kamikadzedead,2017-11-20,192861,43808,35478,6911,RU,Comedy
js64w6_Kyyo,Как стать крутым Видеоблоггером № 1,RED21,2017-11-19,404678,29273,5693,5311,RU,Comedy
NrjxqGVlNl4,Сечин не явился в суд. Захоронение Ленина. RNT #61,Russia Not Today,2017-11-20,56257,7042,103,312,RU,Comedy
cAsv2KIOz6Y,"Гоголь в чате. Господин, товарищ, барин.",Вовремя,2017-11-20,3599,303,6,23,RU,Comedy
NNpem5tl2UA,ЛУЧШИЕ ПРИКОЛЫ 2017 НОЯБРЬ #52 | Лучшая Подборка Приколов | ТОПОВЫЕ ПРИКОЛЫ,АКАДЕМИЯ СМЕХА,2017-11-19,187877,5320,697,721,RU,Comedy
YMYbFXV-D5M,Стрим МОПСА,Мопс Официальный,2017-11-19,137655,4283,5315,310,RU,Comedy
AFRFKPdvxi0,Отель Элеон  - финальный сезон - 1 и 2 серии,molodejjtv,2017-11-20,55121,804,36,142,RU,Comedy
UoaaIzjrCRM,Смертельная двоечка!,Slacker,2017-11-20,27922,314,558,347,RU,Comedy
UNHzf5Lzehg,Кшиштан о фильме ЛИГА СПРАВЕДЛИВОСТИ,Канал Кшиштовского,2017-11-21,104869,16924,681,1086,RU,Comedy
Pj8aoT9_FMU,"Что, если бы все наши страхи сбывались?",МЁD,2017-11-21,303136,30888,802,1064,RU,Comedy
vFqWv-3BiXg,Не совок,Анатолий Шарий,2017-11-21,275377,21399,421,4698,RU,Comedy
i_vCKE2lkaA,Кощей Бессмертный и брат-депутат - По тещьему велению - Уральские Пельмени (2017),Уральские Пельмени,2017-11-21,117168,2368,218,113,RU,Comedy
A8EQiwtVqhc,Незалежная космическая держава / Школьник в Бундестаге / Райкин / Дюжев. MOUNT SHOW #119,MOUNT SHOW,2017-11-21,147905,17919,317,1425,RU,Comedy
c7BVCtRQcRw,"Иностранные агенты, Russia Today. Гость — Монеточка | Класс народа",Денис Чужой,2017-11-21,22851,3894,143,288,RU,Comedy
d5woC-LQI68,Т9 В РЕАЛЬНОЙ ЖИЗНИ,Room Factory,2017-11-20,1012183,59953,2620,3365,RU,Comedy
jJF1In-Ay-o,Анекдот про дырку. Угар и юмор.,Анекдоты от Алексеевича,2017-11-21,67429,1454,101,70,RU,Comedy
le7AtjtYHls,Эротичный инструктаж | ПОТРАЧЕНО,ПОТРАЧЕНО,2017-11-21,119319,3516,424,273,RU,Comedy
NrjxqGVlNl4,Сечин не явился в суд. Захоронение Ленина. RNT #61,Russia Not Today,2017-11-20,68153,7998,122,412,RU,Comedy
l8kqzDhM6BE,"Кама пуля показывает Кириллу, как правильно бить двоечку",Slacker,2017-11-21,56963,938,136,312,RU,Comedy
APZ8d-5Z0tM,Импровизация 3 сезон 21 серия Сабуров (21.11.17 год) фотослайды,Тоня Андреева,2017-11-21,4485,30,9,9,RU,Comedy
0tCDyIQYFcA,Мужчины ПАШИТЕ и Содержите Женщин!,AndreyVodonaev Разоблачения,2017-11-21,3220,242,6,144,RU,Comedy
KKZLnlV2yCw,Смешные кошки приколы про кошек и котов 2017 #89 (Старенькое смешное видео МатроскинТВ ТОП приколы),Смешные Кошки - МатроскинТВ,2017-11-21,4252,100,12,10,RU,Comedy
i_zbNGfL294,"Короче говоря, IPHONE X",Room Factory,2017-11-22,910507,59796,1265,2359,RU,Comedy
RzmH3IrsCPE,ТИПЫ ЛЮДЕЙ В ЛИФТЕ,Максим Старосвитский,2017-11-22,240855,10583,1086,1544,RU,Comedy
JLNhVH8wt6g,Что дал Майдан Ч1  Нам указали путь,Анатолий Шарий,2017-11-22,328424,17427,516,2762,RU,Comedy
UNHzf5Lzehg,Кшиштан о фильме ЛИГА СПРАВЕДЛИВОСТИ,Канал Кшиштовского,2017-11-21,248992,30640,1421,1607,RU,Comedy
kTD7qi8s-zY,НАИТУПЕЙШИЙ БАБСКИЙ ПАБЛИК - ОБЗОР [Спасибо папе за характер],Майор,2017-11-22,61410,10243,498,413,RU,Comedy
Ghp6UVigtno,NIXELPIXEL И ТАЙНЫЕ МЕНСТРУАЛЬНЫЕ ЧАШИ | Обзор и реакция,Genderfluid Helisexual,2017-11-22,57166,7527,1924,1605,RU,Comedy
R7TJ0DsWH-A,ПРОВАЛ ПРОПАГАНДЫ,kamikadzedead,2017-11-22,175171,43777,36780,4017,RU,Comedy
Pj8aoT9_FMU,"Что, если бы все наши страхи сбывались?",МЁD,2017-11-21,407588,37827,1081,1227,RU,Comedy
kZNMmFDjBAA,LIKE A BOSS COMPILATION #7,ТЕРРИТОРИЯ СМЕХА,2017-11-21,503589,9312,678,1090,RU,Comedy
A8EQiwtVqhc,Незалежная космическая держава / Школьник в Бундестаге / Райкин / Дюжев. MOUNT SHOW #119,MOUNT SHOW,2017-11-21,233771,23706,470,1762,RU,Comedy
i_vCKE2lkaA,Кощей Бессмертный и брат-депутат - По тещьему велению - Уральские Пельмени (2017),Уральские Пельмени,2017-11-21,208800,3373,356,151,RU,Comedy
EpYZwIabhX8,Отель Элеон - финальный сезон - 3 и 4 серии,molodejjtv,2017-11-22,32710,242,28,54,RU,Comedy
h3n3xn7PswI,Когда батю вызвали в школу,ГвоздиShow,2017-11-22,72443,6480,145,242,RU,Comedy
m0CM0fzwqJ0,Видео прибытия Плотницкого в Москву,Константин Долгов,2017-11-23,203332,362,361,533,RU,Comedy
NfFsstWdZXU,Владимир Зеленский: Накипело!,Студия Квартал 95 Online,2017-11-23,599289,58984,2877,7968,RU,Comedy
6GOrAb3KfWo,Atlas: Восстание машин,This is Хорошо,2017-11-24,83560,8065,293,509,RU,Comedy
WLNGnd0Lunc,"Короче говоря, скидки",Room Factory,2017-11-23,719296,50292,3449,2047,RU,Comedy
1cXcQkyZC6g,Переписка на совещании - По тещьему велению - Уральские Пельмени (2017),Уральские Пельмени,2017-11-23,138113,3443,187,159,RU,Comedy
W5aoEcr5dmQ,Следственный Комитет РФ таки пробил дно,Анатолий Шарий,2017-11-23,266973,26884,910,7291,RU,Comedy
RzmH3IrsCPE,ТИПЫ ЛЮДЕЙ В ЛИФТЕ,Максим Старосвитский,2017-11-22,399980,13887,2089,2111,RU,Comedy
Y9GLCXFd62o,Курские новости — что с ними не так? | Денис Чужой,Денис Чужой,2017-11-23,20567,2518,16,163,RU,Comedy
Ghp6UVigtno,NIXELPIXEL И ТАЙНЫЕ МЕНСТРУАЛЬНЫЕ ЧАШИ | Обзор и реакция,Genderfluid Helisexual,2017-11-22,72327,8487,2421,1794,RU,Comedy
"#NAME?",MEME REVIEW: Stolen Bike Meme,PewDiePie,2017-11-23,1294899,139606,2040,14323,RU,Comedy
DrdsjWZTCcc,🎙 Я ЗАБИЛ НА YOUTUBE?,Данила Поперечный,2017-11-24,571809,52821,1836,1937,RU,Comedy
m0CM0fzwqJ0,Видео прибытия Плотницкого в Москву,Константин Долгов,2017-11-23,589833,727,2760,1232,RU,Comedy
SAeyP4A3z3M,"КОРОЧЕ ГОВОРЯ, Я В СССР",OneTwo,2017-11-24,519300,37666,1538,2951,RU,Comedy
xCdMOEIB3Q4,СОБОЛЕВ СНЯЛ ПРО МЕНЯ ВИДЕО / ДЕВОЧКА-АМОРАЛКА,Morana Battory,2017-11-24,150869,13597,5362,2486,RU,Comedy
6GOrAb3KfWo,Atlas: Восстание машин,This is Хорошо,2017-11-24,378201,22656,1046,1177,RU,Comedy
NfFsstWdZXU,Владимир Зеленский: Накипело!,Студия Квартал 95 Online,2017-11-23,1276111,84594,6727,13505,RU,Comedy
KJPXKJUR0tQ,"Дочь Корнета. Здравствуй, совок",Анатолий Шарий,2017-11-24,362249,22351,1024,4251,RU,Comedy
EZCdy4D9Pf0,ЗАЧЕМ БЛОГЕРЫ ЛЕЗУТ НА ТВ?,Юрий Хованский,2017-11-24,181248,11306,2486,1158,RU,Comedy
Q5ztgcdKTMo,Звездный час - Финал Лиги Смеха от 24.11.2017,Лига Смеха,2017-11-24,216957,5102,451,1525,RU,Comedy
1cXcQkyZC6g,Переписка на совещании - По тещьему велению - Уральские Пельмени (2017),Уральские Пельмени,2017-11-23,249218,4788,293,201,RU,Comedy
Ud1_b6wNt74,Импровизация 3 сезон 21 серия Нурлан Сабуров (21.11.17 год) HD ПОЛНЫЙ ВЫПУСК,Тоня Андреева,2017-11-24,8861,152,5,10,RU,Comedy
9An6CdD3l9Y,Силовые растут и растут)),Slacker,2017-11-24,42486,269,1722,975,RU,Comedy
Soo-9sOqvRY,СОБОЛЕВ ИЛЬЯ - СОБОЛЕВ ИЛЬЯ ПРОТИВ НИКОЛАЯ СОБОЛЕВА,Соболев Илья,2017-11-24,60163,6229,768,583,RU,Comedy
l4wzkMRNSdE,"Whip It, Whip It Real Good: Fails of the Month (November 2017) | FailArmy",FailArmy,2017-11-24,872427,17327,689,966,RU,Comedy
pYVzWFFqS1Q,Замуровали демоны | ПОТРАЧЕНО,ПОТРАЧЕНО,2017-11-24,90254,3416,235,179,RU,Comedy
D4ERrUte1Tk,Навальный про радиоактивное облако над Россией и молчание властей про это,TRUE,2017-11-23,81123,3945,3144,759,RU,Comedy
k6cx9Xh-ZtY,ТРЭШ ЛОТО: ВОКРУГ СВЕТА - ДИКИЙ ЗАПАД,КЛИККЛАК,2017-11-25,1143146,107466,5453,4371,RU,Comedy
5m6OWW7zwjs,ПрожекторПерисХилтон  25.11.2017 Маргарита Симоньян,Лучшее смешное видео,2017-11-25,147280,2233,599,410,RU,Comedy
VQz9jwcjfAA,Бабушка в тату-салоне - По тещьему велению - Уральские Пельмени (2017),Уральские Пельмени,2017-11-25,179276,3627,443,193,RU,Comedy
gz6YkIPNinU,"В нас видели не партнеров, а конкурентов",Анатолий Шарий,2017-11-25,237815,14914,441,3279,RU,Comedy
DrdsjWZTCcc,🎙 Я ЗАБИЛ НА YOUTUBE?,Данила Поперечный,2017-11-24,738997,60073,2355,2206,RU,Comedy
xCdMOEIB3Q4,СОБОЛЕВ СНЯЛ ПРО МЕНЯ ВИДЕО / ДЕВОЧКА-АМОРАЛКА,Morana Battory,2017-11-24,271086,17469,10247,3484,RU,Comedy
m0CM0fzwqJ0,Видео прибытия Плотницкого в Москву,Константин Долгов,2017-11-23,728206,861,3413,1484,RU,Comedy
SAeyP4A3z3M,"КОРОЧЕ ГОВОРЯ, Я В СССР",OneTwo,2017-11-24,731642,44114,2311,3776,RU,Comedy
RFRgcLbiYzw,Лучшие моменты из Дизель шоу - подборка самого смешного юмора осени | Дизель cтудио -   Украина,Дизель Студио,2017-11-25,60630,601,61,47,RU,Comedy
"#NAME?",КАЖДАЯ ШКОЛЬНАЯ ГРУППИРОВКА ТАКАЯ,RusSmosh,2017-11-25,20656,1310,20,34,RU,Comedy
Ud1_b6wNt74,Импровизация 3 сезон 21 серия Нурлан Сабуров (21.11.17 год) фотообзор,Тоня Андреева,2017-11-24,68532,700,57,44,RU,Comedy
NPL3Vcp0vjI,Отогрев авто зимой,ГвоздиShow,2017-11-26,35800,3525,56,170,RU,Comedy
6GOrAb3KfWo,Atlas: Восстание машин,This is Хорошо,2017-11-24,448417,25013,1253,1152,RU,Comedy
Cbctw98rWI8,Анекдот про скорость.,Анекдоты от Алексеевича,2017-11-25,62303,1390,126,74,RU,Comedy
NfFsstWdZXU,Владимир Зеленский: Накипело!,Студия Квартал 95 Online,2017-11-23,1620645,96808,8403,15874,RU,Comedy
460HPt65DHw,ВЛАДИМИР РЫЖКОВ ДА ПУТИН НЕ ПОЙДЕТ НА ВЫБОРЫ ЕГО ТУДА ПОГОНЯТ ЕДИНОРОСЫ,V V,2017-11-25,5753,55,20,42,RU,Comedy
9An6CdD3l9Y,Силовые растут и растут)),Slacker,2017-11-24,84898,426,3426,1575,RU,Comedy
EZCdy4D9Pf0,ЗАЧЕМ БЛОГЕРЫ ЛЕЗУТ НА ТВ?,Юрий Хованский,2017-11-24,250096,13567,3151,1359,RU,Comedy
Q5ztgcdKTMo,Звездный час - Финал Лиги Смеха от 24.11.2017,Лига Смеха,2017-11-24,806193,10397,968,2714,RU,Comedy
AvNXTzhFkxI,ТРЕНДЫ ЮТУБА (ЗА 1 МИНУТУ),DegraTube,2017-11-26,137354,19157,692,898,RU,Comedy
zzu-ytbHGR8,Ультимативно не растерялся - [Бумага],Мартеллиада,2017-11-26,276587,31699,681,1605,RU,Comedy
8Il1bsZfUzY,ТАЙНА ЗАСТОЯ YOUTUBE feat. ANOIR,ЕГОР,2017-11-26,98226,18191,276,1109,RU,Comedy
wpsm_ihUUHY,Что нам мешает вступить в ЕС,Анатолий Шарий,2017-11-26,321197,19708,715,2352,RU,Comedy
k6cx9Xh-ZtY,ТРЭШ ЛОТО: ВОКРУГ СВЕТА - ДИКИЙ ЗАПАД,КЛИККЛАК,2017-11-25,1724149,136020,7654,5516,RU,Comedy
VQz9jwcjfAA,Бабушка в тату-салоне - По тещьему велению - Уральские Пельмени (2017),Уральские Пельмени,2017-11-25,401988,5523,882,306,RU,Comedy
ZghIi994IO4,Порошенко сболтнул об антиПутинском мятеже и наврал о голодоморе,Aleksandr Semchenko,2017-11-26,69668,2919,113,887,RU,Comedy
QkLYEUkL1h8,КАЖДЫЙ ПЕРВЫЙ ДЕНЬ В ШКОЛЕ ТАКОЙ,RusSmosh,2017-11-26,32814,1825,56,48,RU,Comedy
6oC_Pfv_BEE,ЛУНТИК УБИЙЦА - TheBrianMaps (Брайн Мапс) | Реакция,Майни,2017-11-26,46226,2379,87,328,RU,Comedy
7mQSWfBtDe0,Юрий Хованский - Всё ещё не смешной (2017),Юрий Хованский,2017-11-26,160689,8614,2533,1140,RU,Comedy
p5w6u_RL1uQ,ДЕНЬГИ ИЗ ТРУСОВ - ПРАНК / КОНКУРС на Samsung Galaxy S8,Иван Эфиров,2017-11-26,165930,14353,675,2240,RU,Comedy
6RxMO9q78cY,BEST CUBE #178,BEST CUBE 2.0,2017-11-26,116949,1783,316,127,RU,Comedy
988KpIw8eg0,Эдуард Суровый неизданное 2017 (Без цензуры!),Яб Купил,2017-11-26,29227,265,34,7,RU,Comedy
gZmiNTt7Pv0,Приколы за неделю #36 | ПОТРАЧЕНО,ПОТРАЧЕНО,2017-11-26,92322,3911,319,261,RU,Comedy
b6p2a_mRjKo,"КОРОЧЕ ГОВОРЯ, Я ЗНАМЕНИТЫЙ - ТимТим.",Tим Тим,2017-11-27,366110,28243,395,2126,RU,Comedy
AvNXTzhFkxI,ТРЕНДЫ ЮТУБА (ЗА 1 МИНУТУ),DegraTube,2017-11-26,316925,31644,1275,1215,RU,Comedy
nj8g5n4n4Yk,Кремлевский заказ на адвоката Сущенко,Анатолий Шарий,2017-11-27,329886,24614,593,4047,RU,Comedy
EnY-IpmApf4,Приколы с котами - ТОПовая подборка!,Корпорация Зла,2017-11-27,86434,3861,256,193,RU,Comedy
WvL--3LIBts,"АХ, КОТЫ... Сыендук sndk | Реакция",Майни,2017-11-27,57434,3035,267,711,RU,Comedy
zzu-ytbHGR8,Ультимативно не растерялся - [Бумага],Мартеллиада,2017-11-26,379805,36882,880,1883,RU,Comedy
8Il1bsZfUzY,ТАЙНА ЗАСТОЯ YOUTUBE feat. ANOIR,ЕГОР,2017-11-26,176155,25026,482,1534,RU,Comedy
Pegb5zy8wx0,Кот в душе моется - Кот самостоятельно принимает душ - Смешные кошки МатроскинТВ,Смешные Кошки - МатроскинТВ,2017-11-27,11962,261,20,16,RU,Comedy
_0nmgSOxiz8,ЛУЧШИЕ ПРИКОЛЫ SAMYY KLASS (ВЫПУСК 538),SAMYY KLASS,2017-11-27,104280,1978,221,71,RU,Comedy
9XJOYhSRN5c,МОПС ДЯДЯ ПЕС СТРИМ ДОНАТ В ОПИСАНИИ,Мопс и Малыш,2017-11-28,41075,2180,1813,66,RU,Comedy
KpBAl5Mf7dQ,Реальная история: ТАТАРО-МОНГОЛЬСКОЕ ИГО,Данила Поперечный,2017-11-28,535134,128586,2508,7242,RU,Comedy
VmuNbmLvrCU,ЖАЖДА ДЕНЕГ / Мишка в эфире,Мишка в эфире,2017-11-28,103105,2714,591,145,RU,Comedy
KLv9NF8_PQ8,Не пишите мне про Вову,Анатолий Шарий,2017-11-28,265380,29593,791,3735,RU,Comedy
wu57pkOsrGE,Конкурс социалистической песни - По тещьему велению - Уральские Пельмени (2017),Уральские Пельмени,2017-11-28,91886,1677,179,198,RU,Comedy
b6p2a_mRjKo,"КОРОЧЕ ГОВОРЯ, Я ЗНАМЕНИТЫЙ - ТимТим.",Tим Тим,2017-11-27,594024,37468,729,2552,RU,Comedy
N25aRJAMalA,Николай Десятниченко. Гость — Залина Маршенкулова (Breaking Mad) | Класс народа,Денис Чужой,2017-11-28,34325,4039,221,425,RU,Comedy
EnY-IpmApf4,Приколы с котами - ТОПовая подборка!,Корпорация Зла,2017-11-27,182887,5720,507,307,RU,Comedy
j02oaotYYE4,Импровизация 3 сезон 22 серия Сергей Лазарев (28.11.17 год) ФотоАнонс,Тоня Андреева,2017-11-28,3770,85,4,2,RU,Comedy
nq2Svuqzmfo,"Конец света, тетрадь Захарченко и уши Павла Дурова. RNT #62",Russia Not Today,2017-11-28,51099,7709,45,289,RU,Comedy
wADnQsygxyA,Поджог именинницы | ПОТРАЧЕНО,ПОТРАЧЕНО,2017-11-28,90215,3516,208,193,RU,Comedy
OpMlq3YCFQY,Отель Элеон  - финальный сезон - 6 и 7 серии,molodejjtv,2017-11-28,12952,130,7,15,RU,Comedy
JKwzTnVA8Vc,It's a Jungle Out There!: Wild Animal Fails (November 2017) | FailArmy,FailArmy,2017-11-28,834620,18697,849,1149,RU,Comedy
0pVH-zwx3Ls,Анекдот - комедия. Best of the best.,Анекдоты от Алексеевича,2017-11-28,53998,1700,71,69,RU,Comedy
KpBAl5Mf7dQ,Реальная история: ТАТАРО-МОНГОЛЬСКОЕ ИГО,Данила Поперечный,2017-11-28,903495,168799,4419,9482,RU,Comedy
4qQ0Kcs_Vio,Кремль неудачно заблокировал Андроид,Анатолий Шарий,2017-11-29,338789,22761,1924,3848,RU,Comedy
qro7PYbkOoQ,Непосредственно Каха -- Каху приняли ТРЕЙЛЕР  4 сезон 7 серия,KTV,2017-11-29,169368,5057,184,272,RU,Comedy
N-Fdm9hu8cM,ГЛАВНЫЙ БАГ НАШЕГО YOUTUBE,kamikadzedead,2017-11-29,152753,31066,14666,3473,RU,Comedy
rXurTLtQ1r8,Мстители: Война бесконечности – МОЯ РЕАКЦИЯ НА ТРЕЙЛЕР | Денис Чужой,Денис Чужой,2017-11-29,17136,3047,227,180,RU,Comedy
QoYciZ0SEv4,Военком VS Призывник,ГвоздиShow,2017-11-29,69847,6181,301,353,RU,Comedy
NY7OcMS3oZ4,КВН 2017 Кубок мэра Москвы - Анонс,Официальный канал КВН,2017-11-29,51907,863,191,155,RU,Comedy
nq2Svuqzmfo,"Конец света, тетрадь Захарченко и уши Павла Дурова. RNT #62",Russia Not Today,2017-11-28,64070,8965,59,335,RU,Comedy
zk6x_j2lUTI,МУЖ И ЖЕНА - СЕМЕЙНЫЕ ПРИКОЛЫ на отдыхе – Дизель Шоу лучшее | ЮМОР ICTV,ДИЗЕЛЬ ШОУ - ЮМОР ICTV - Официальный канал,2017-11-29,42561,445,38,32,RU,Comedy
sLj3YxqBUXQ,Отель Элеон - финальный сезон - 7 и 8 серии,molodejjtv,2017-11-29,16583,177,14,33,RU,Comedy
wu57pkOsrGE,Конкурс социалистической песни - По тещьему велению - Уральские Пельмени (2017),Уральские Пельмени,2017-11-28,159328,2261,286,234,RU,Comedy
ve-CQMlJLs4,Анекдот про беспринципных мужиков.,Анекдоты от Алексеевича,2017-11-29,43214,1148,48,53,RU,Comedy
lZ7J6vVqmcs,Новое шоу - Тизер,Канал Кшиштовского,2017-11-30,66740,9157,137,426,RU,Comedy
K-F0PgHn9R0,"Борьба с футболистами, с кино, с ЧСВН...",Анатолий Шарий,2017-11-30,328072,29688,379,7064,RU,Comedy
b5Rw4yz2ooQ,"Короче говоря, бабушка",Room Factory,2017-11-30,715476,61417,636,2054,RU,Comedy
0FWDI-EUHkU,Мечты Навального,Гараж Дубляж,2017-11-30,65330,2347,3653,635,RU,Comedy
fr4HP7_9hYI,"Avaz Oxun - E'lon, e'r sotiladi buzilmaydigon e'rlar",YangiKulgu,2017-11-30,124609,1227,132,96,RU,Comedy
N-Fdm9hu8cM,ГЛАВНЫЙ БАГ НАШЕГО YOUTUBE,kamikadzedead,2017-11-29,238333,39648,19026,4519,RU,Comedy
tLKkqdluPi8,Неофициальный ответ Владимира Зеленского,Студия Квартал 95 Online,2017-11-30,213170,10720,782,1631,RU,Comedy
KpBAl5Mf7dQ,Реальная история: ТАТАРО-МОНГОЛЬСКОЕ ИГО,Данила Поперечный,2017-11-28,1003292,177240,4883,10131,RU,Comedy
qro7PYbkOoQ,Непосредственно Каха -- Каху приняли ТРЕЙЛЕР  4 сезон 7 серия,KTV,2017-11-29,235302,5962,248,331,RU,Comedy
InjpyITAJPo,Отель Элеон - финальный сезон - 8 и 9 серии,molodejjtv,2017-11-30,24030,245,17,39,RU,Comedy
jiWP-JhBx-s,Гоголь в чате. Хватит жировать!,Вовремя,2017-11-30,3745,251,1,42,RU,Comedy
3p60clTMVrw,Украина унизила Армению на сессии ПАЧЭС || Дипломатический CKAHДAЛ!,Aleksandr Semchenko,2017-11-29,58226,2352,78,680,RU,Comedy
uE-eCIJp4qY,Непосредственно Каха -- Каху приняли 4 сезон 7 серия,KTV,2017-12-01,614106,29070,1420,1763,RU,Comedy
sKxJUsfVubM,КАПСУЛА ВРЕМЕНИ - Eugene Sagaz,EugeneSagaz,2017-12-01,278539,55216,347,11006,RU,Comedy
NH1MtPxojo8,Третий транш и привет Нацкорпусу,Анатолий Шарий,2017-12-01,293146,26797,539,3805,RU,Comedy
Djr8ZjLjT1g,LIKE A BOSS COMPILATION #8,ТЕРРИТОРИЯ СМЕХА,2017-12-01,994108,18087,1466,1852,RU,Comedy
oDdVhgDrpyM,Это чудо! iPhone из 90х и музыка будущего,Это чудо!,2017-12-01,94851,2381,480,123,RU,Comedy
1muP4U4bHPQ,ПУТИН-БУРГЕР vs СОБЧАК-БУРГЕР. Где больше вранья?,kamikadzedead,2017-12-01,153557,31102,26759,3597,RU,Comedy
5_lgybsUIqA,"Լավ երեկո (Նազենի Հովհաննիսյան, Ռալֆ Յիրիկյան) 1.12.2017",Հանրային հեռուստաընկերություն,2017-12-01,49560,797,44,0,RU,Comedy
6XOkT_MeUrs,ЛУЧШИЕ ПРИКОЛЫ 2017 ДЕКАБРЬ — Сунул нос куда не надо,Корпорация Зла,2017-12-01,81790,4046,193,103,RU,Comedy
b5Rw4yz2ooQ,"Короче говоря, бабушка",Room Factory,2017-11-30,998409,75936,871,2390,RU,Comedy
sJ6n19818dk,Чё стало. Русский рэп VS невербальная коммуникация. Куда катится новая молодёжь? 16+,Мысли Солнцева,2017-11-30,78059,427,36,62,RU,Comedy
lZ7J6vVqmcs,Новое шоу - Тизер,Канал Кшиштовского,2017-11-30,98263,11428,200,480,RU,Comedy
fr4HP7_9hYI,"Avaz Oxun - E'lon, e'r sotiladi buzilmaydigon e'rlar",YangiKulgu,2017-11-30,201106,1628,198,124,RU,Comedy
8xEieaTFU0U,Зеленский сам обыграл себя в напёрстки. СВАТЫ - продолжение,Aleksandr Semchenko,2017-11-30,43259,3346,201,598,RU,Comedy
Pj6hs1Mmsbg,СИНТОЛОВЫЕ РУКИ-БАЗУКИ (ЗА 1 МИНУТУ),DegraTube,2017-12-02,204602,14147,1916,663,RU,Comedy
lCSdgG2O53Q,София в России - 1 серия: Робот и шашлыки,Студия Сбитый Лось,2017-12-02,101282,1388,841,106,RU,Comedy
uE-eCIJp4qY,Непосредственно Каха -- Каху приняли 4 сезон 7 серия,KTV,2017-12-01,1287345,41228,2700,2202,RU,Comedy
QwBUiuaJj0g,А может ее обменять?,Анатолий Шарий,2017-12-02,305651,19208,448,4475,RU,Comedy
JZJXHU2VyN8,"КОРОЧЕ ГОВОРЯ, ДЕПРЕССИЯ",OneTwo,2017-12-02,304157,19490,503,1595,RU,Comedy
Djr8ZjLjT1g,LIKE A BOSS COMPILATION #8,ТЕРРИТОРИЯ СМЕХА,2017-12-01,1632589,25920,2392,2665,RU,Comedy
HH8WDM6z-hg,171202 MelonMusicAwards BTS V focus (OST Nominate Reaction),ako 0a0k0o,2017-12-02,95951,4543,21,201,RU,Comedy
CWUzzy_ommY,Шарий и Навальный. Стрим с Даниелем Кайгермазовым в Periscope,MOUNT SHOW,2017-12-02,60805,5585,1060,1065,RU,Comedy
WSiuh5mpdhE,Новый Рассмеши Комика 2017 - 14 сезон - выпуск #12,Рассмеши Комика - Официальный Канал,2017-12-02,44673,555,63,104,RU,Comedy
sKxJUsfVubM,КАПСУЛА ВРЕМЕНИ - Eugene Sagaz,EugeneSagaz,2017-12-01,389714,67284,467,12794,RU,Comedy
qG_c6pCIygs,Мстители: Война бесконечности - разбор трейлера от Дэдпула,Супергеройский Блог,2017-12-02,20849,1999,56,127,RU,Comedy
OKkmhH8xcDI,Идиоты и Победители 80 уровня =) Лучшие приколы 2016 2017 #21,Darth Vader,2017-12-02,5866,155,18,28,RU,Comedy
oIq9R77brpU,Анекдот про зависть.,Анекдоты от Алексеевича,2017-12-02,37148,966,78,56,RU,Comedy
5KBjSIek5EA,BEST CUBE # 203,Best VIDEOS Лучшее видео,2017-12-02,89886,3375,318,251,RU,Comedy
1muP4U4bHPQ,ПУТИН-БУРГЕР vs СОБЧАК-БУРГЕР. Где больше вранья?,kamikadzedead,2017-12-01,185772,36330,37342,3978,RU,Comedy
E-pOCqryX44,Дизайн жамоаси (Кобил Каримбердиев) Тикилиб ётган киз яхши киз булмайди,YangiKulgu,2017-12-01,197231,1242,228,88,RU,Comedy
0Lnja3AR1Q4,ВОЛШЕБНЫЕ ДУХИ,TheBrianMaps,2017-12-03,1759818,129483,4841,14925,RU,Comedy
n3DJwX_Bq8I,🎙 ЮТУБ ПРАВДА ПОД КОЛПАКОМ?,Данила Поперечный,2017-12-03,365907,50083,2680,3419,RU,Comedy
bHuSnn_6Gf0,КОГДА СКАЗАЛ ДЕВУШКЕ НАРЯЖАТЬ ЁЛКУ,Room Factory,2017-12-03,701345,55920,2536,3762,RU,Comedy
Pj6hs1Mmsbg,СИНТОЛОВЫЕ РУКИ-БАЗУКИ (ЗА 1 МИНУТУ),DegraTube,2017-12-02,341739,18147,2766,835,RU,Comedy
X9jUv5MhYKQ,ТОП-6 САМЫХ ЗАЕДАЮЩИХ ПЕСЕН 2017,Палата 6,2017-12-03,67031,8174,341,1417,RU,Comedy
BT-NGYphRvk,КТО ВИНОВАТ В БЕДАХ РОССИИ?,kamikadzedead,2017-12-03,123749,29434,33398,4425,RU,Comedy
wl3x6YSOGVM,Кто стоит за блокадой телеканала NewsOne,Aleksandr Semchenko,2017-12-03,40049,2227,129,584,RU,Comedy
y4c3imXMDRQ,Million jamoasi - Xovlida va Restoranda bo'lgan to'ylar parodiyasi,YangiKulgu,2017-12-03,102532,902,110,123,RU,Comedy
rdW5mpd-mS4,КВН 2017 Спецпроект Кубок мэра Москвы (03.12.2017) ИГРА ЦЕЛИКОМ Full HD,Официальный канал КВН,2017-12-03,101482,2065,507,748,RU,Comedy
0KheW8kzgHE,ВОЛШЕБНЫЕ ДУХИ - TheBrianMaps (Брайн Мапс) | Реакция,Майни,2017-12-03,20385,1508,34,413,RU,Comedy
JZJXHU2VyN8,"КОРОЧЕ ГОВОРЯ, ДЕПРЕССИЯ",OneTwo,2017-12-02,400121,22349,654,1740,RU,Comedy
QwBUiuaJj0g,А может ее обменять?,Анатолий Шарий,2017-12-02,452059,24034,692,5484,RU,Comedy
uE-eCIJp4qY,Непосредственно Каха -- Каху приняли 4 сезон 7 серия,KTV,2017-12-01,1552926,44919,2962,2278,RU,Comedy
oIq9R77brpU,Анекдот про зависть.,Анекдоты от Алексеевича,2017-12-02,62332,1265,96,73,RU,Comedy
UsXOSg0IaiA,Приколы за неделю #37 | ПОТРАЧЕНО,ПОТРАЧЕНО,2017-12-03,64832,3203,268,135,RU,Comedy
"#NAME?",Йогурт | БорщЖоу | #вжопумилонова,Borsch,2017-12-03,64822,4811,209,722,RU,Comedy
tf9kZt-OyS0,Grandmas vs Grandpas: FailArmy Versus (December 2017) || FailArmy,FailArmy,2017-12-03,594062,16927,646,928,RU,Comedy
n3DJwX_Bq8I,🎙 ЮТУБ ПРАВДА ПОД КОЛПАКОМ?,Данила Поперечный,2017-12-03,804761,81563,6105,5608,RU,Comedy
0Lnja3AR1Q4,ВОЛШЕБНЫЕ ДУХИ,TheBrianMaps,2017-12-03,2248271,143956,7181,16523,RU,Comedy
rdW5mpd-mS4,КВН 2017 Спецпроект Кубок мэра Москвы (03.12.2017) ИГРА ЦЕЛИКОМ Full HD,Официальный канал КВН,2017-12-03,749832,7037,2035,2021,RU,Comedy
ZQytmS1I1SE,Блокирование NewsOne,Анатолий Шарий,2017-12-04,548161,36695,1053,9549,RU,Comedy
UpBKMV1u800,"ПЛОХОЙ, ПЛОХОЙ НАВАЛЬНЫЙ",kamikadzedead,2017-12-04,169359,39084,24876,6492,RU,Comedy
X9jUv5MhYKQ,ТОП-6 САМЫХ ЗАЕДАЮЩИХ ПЕСЕН 2017,Палата 6,2017-12-03,124659,11967,627,1980,RU,Comedy
bHuSnn_6Gf0,КОГДА СКАЗАЛ ДЕВУШКЕ НАРЯЖАТЬ ЁЛКУ,Room Factory,2017-12-03,988496,69220,3531,4360,RU,Comedy
1RkJ_I8izKo,Москвада Аскар Акаевди Алмаз Шаршенович эмес Алмаз Шаадаев бетинен өөп кайтты,Super Tamashalar,2017-12-04,27561,357,67,159,RU,Comedy
wl3x6YSOGVM,Кто стоит за блокадой телеканала NewsOne,Aleksandr Semchenko,2017-12-03,81634,2978,256,786,RU,Comedy
HI7_cNVj62U,"КОРОЧЕ ГОВОРЯ, типы лучших друзей",Andrey Glazunov,2017-12-04,55910,3371,72,167,RU,Comedy
y4c3imXMDRQ,Million jamoasi - Xovlida va Restoranda bo'lgan to'ylar parodiyasi,YangiKulgu,2017-12-03,144550,1113,138,147,RU,Comedy
Pj6hs1Mmsbg,СИНТОЛОВЫЕ РУКИ-БАЗУКИ (ЗА 1 МИНУТУ),DegraTube,2017-12-02,394138,19269,2986,884,RU,Comedy
5LXFPoZAEh4,Баги YOUTUBE: ОПРОВЕРЖЕНИЕ!,Данила Поперечный,2017-12-05,358720,52833,1495,2504,RU,Comedy
WWhajJfk2f0,О сериалах за 25 секунд,RED21,2017-12-05,199925,15357,943,720,RU,Comedy
FBvBd9QWqJ4,"Что, если горячие клавиши работали бы в жизни?",МЁD,2017-12-05,177487,15351,364,672,RU,Comedy
L0tcUpnzDGQ,КАК Я ПРОСРАЛА 95 000 РУБЛЕЙ?,Morana Battory,2017-12-05,94276,7732,3046,1171,RU,Comedy
fvNgTl0nEiU,"Алексей, это зашквар даже для тебя",Анатолий Шарий,2017-12-05,392795,45060,2334,6969,RU,Comedy
yLDGsVHAXgs,ТИПЫ ЛЮДЕЙ В ПАРИКМАХЕРСКОЙ,Room Factory,2017-12-05,732097,49730,1052,2919,RU,Comedy
c2BRCBDHOrg,"Саакашвили, который живет на крыше. MOUNT SHOW #121",MOUNT SHOW,2017-12-05,120980,16119,370,1131,RU,Comedy
3p2gM-bRdLs,"Жеребьёвка ЧМ-2018, отстранение от Олимпиады | Класс народа",Денис Чужой,2017-12-05,19685,3392,26,241,RU,Comedy
_TeKcCGy4Xo,"МЕЛ ГИБСОН, УИЛЛ ФЕРРЕЛЛ, МАРК УОЛБЕРГ, ДЖОН ЛИТГОУ, ШИРЛИ БАЛЛАС [s22e08] | ШОУ ГРЭМА НОРТОНА",BlackSerj Production / BSP Studio,2017-12-05,21245,1274,13,116,RU,Comedy
UpBKMV1u800,"ПЛОХОЙ, ПЛОХОЙ НАВАЛЬНЫЙ",kamikadzedead,2017-12-04,265568,51454,38286,8071,RU,Comedy
nFIgsaogfA4,Самые богатые люди Киева - этот номер порвал зал! СТАРОЕ которое лучше НОВОГО! Ржу не могу!,Вечерний Квартал fan,2017-12-05,57802,326,62,15,RU,Comedy
CX42Gsl2veQ,Шашлык Карри,Borsch,2017-12-05,50226,4262,180,956,RU,Comedy
ZQnTokK2VL8,Время и Стекло - Тролль | ПРАНК,Must Go On Show,2017-12-05,41868,6820,72,285,RU,Comedy
rdW5mpd-mS4,КВН 2017 Спецпроект Кубок мэра Москвы (03.12.2017) ИГРА ЦЕЛИКОМ Full HD,Официальный канал КВН,2017-12-03,1072292,8582,2617,2523,RU,Comedy
oGvxMNHqtRk,Луценко предъявил дебильные доказательства сотрудничества Саакашвили с Путиным и Ко,Aleksandr Semchenko,2017-12-05,31734,1433,28,285,RU,Comedy
63RDDi_zDAs,Отель Элеон - финальный сезон - 10 и 11 серии,molodejjtv,2017-12-05,22567,245,23,48,RU,Comedy
0Lnja3AR1Q4,ВОЛШЕБНЫЕ ДУХИ,TheBrianMaps,2017-12-03,2442291,148947,7725,17163,RU,Comedy
iLriPr8gyZA,ПЕСНЯ ПРО КАБАНА,Кузьма,2017-12-06,274950,54894,1390,3314,RU,Comedy
mXF5PDjZvyM,"Короче говоря, первый снег",Room Factory,2017-12-06,544446,52168,597,2246,RU,Comedy
WWhajJfk2f0,О сериалах за 25 секунд,RED21,2017-12-05,325364,19507,1641,865,RU,Comedy
5LXFPoZAEh4,Баги YOUTUBE: ОПРОВЕРЖЕНИЕ!,Данила Поперечный,2017-12-05,554166,68206,3151,3411,RU,Comedy
cjyteUXBZPk,"Кремль, Алкосотник, Задняя",Анатолий Шарий,2017-12-06,305160,25695,443,2167,RU,Comedy
L0tcUpnzDGQ,КАК Я ПРОСРАЛА 95 000 РУБЛЕЙ?,Morana Battory,2017-12-05,206186,10685,7744,1718,RU,Comedy
FBvBd9QWqJ4,"Что, если горячие клавиши работали бы в жизни?",МЁD,2017-12-05,328721,20555,568,900,RU,Comedy
c2BRCBDHOrg,"Саакашвили, который живет на крыше. MOUNT SHOW #121",MOUNT SHOW,2017-12-05,215383,21848,599,1361,RU,Comedy
VRrZvP-CZs8,"СОБОЛЕВ ИЛЬЯ - В ГОСТЯХ У ДУДЯ, ТРЕНДЫ YOUTUBE",Соболев Илья,2017-12-06,49277,4748,246,310,RU,Comedy
DwERZvbXDzQ,BEST CUBE # 204,Best VIDEOS Лучшее видео,2017-12-06,91572,2384,749,164,RU,Comedy
DZoLqTaodEA,Алексей Навальный на ЭХО МОСКВЫ (05.12.17),TRUE,2017-12-05,60722,3554,3675,1099,RU,Comedy
F5sK_VXIpQU,BEST CUBE #185,BEST CUBE 2.0,2017-12-06,105596,1656,260,133,RU,Comedy
bYqEDsY2vHs,ЛУЧШИЕ НОВЫЕ ВАЙНЫ 2017 / НОВЫЕ РУССКИЕ ВАЙНЫ | BEST VINES,RuVine,2017-12-06,7111,153,125,32,RU,Comedy
10ZVYT2DdUY,"Зашкварные Истории #1: Ильич, Музыченко, Джарахов, Усачев и Старый",КЛИККЛАК,2017-12-07,982436,169263,3727,6956,RU,Comedy
SSMfBLf6054,ЛИГА ПЛОХИХ ШУТОК #1 | L'One x Гудков,Чикен Карри,2017-12-07,164856,6567,2365,517,RU,Comedy
LdoCgLbyAiE,Башкой своей ломаю эти знания,This is Хорошо,2017-12-08,76959,8329,236,579,RU,Comedy
RR1z0msBnJE,БУХЛИШКО ПАТРУЛЬ - ПОРАЗИТЕЛЬНЫЙ ФОКУСНИК  (гость Александр Муратаев),Кузьма,2017-12-07,105340,8264,248,546,RU,Comedy
UBWsMtoWA8E,Плохой хороший Саакашвили,Анатолий Шарий,2017-12-07,423170,24194,668,2100,RU,Comedy
lHZjOv4gHxw,Сериалы - Икра престолов - Уральские Пельмени (2017),Уральские Пельмени,2017-12-07,99259,1984,405,171,RU,Comedy
SNYIht-CFx0,КВН Борцы - 2017 Спецпроект «Кубок мэра Москвы»,Официальный канал КВН,2017-12-07,123184,3104,183,193,RU,Comedy
w4AImq08j9o,Why I'm not in YouTube Rewind 2017,PewDiePie,2017-12-07,3901200,352186,4155,42476,RU,Comedy
mXF5PDjZvyM,"Короче говоря, первый снег",Room Factory,2017-12-06,1035224,73275,1039,2741,RU,Comedy
_ao5h6rN6Mw,ТОП СМС ОТ КРУТЫХ ПРЕПОДОВ,Палата 6,2017-12-07,63468,4933,527,486,RU,Comedy
"#NAME?",Непосредственно Каха -- Полторы тысячи 4 сезон 8 серия трейлер,KTV,2017-12-06,202553,5299,115,189,RU,Comedy
hnGERcv6MpI,Быстрые сырники с грушей,Borsch,2017-12-07,37491,2859,75,508,RU,Comedy
8WTzAkKDkv8,ЗАПРЕЩЁННАЯ РЕКЛАМА СИНТОЛА,Студия Сбитый Лось,2017-12-07,55845,755,173,53,RU,Comedy
frI8cm0MgLs,Порараз Бирацца. Выпуск 21,Stand-Up Club #1,2017-12-07,10763,1264,37,239,RU,Comedy
_znVEbe5GE4,Отель Элеон - финальный сезон - 12 и 13 серии,molodejjtv,2017-12-07,33864,248,16,40,RU,Comedy
sdK3aTzIq08,Навальный про олимпиаду и отстранение наших спортсменов,TRUE,2017-12-07,24388,1667,1783,350,RU,Comedy
4RPZmkwsRvM,BEST CUBE #186,BEST CUBE 2.0,2017-12-08,16852,555,153,67,RU,Comedy
C1LmIcwdj8w,Трейлер популярного ютуб-канала «Денис Чужой»,Денис Чужой,2017-12-07,13663,1933,31,97,RU,Comedy
zNYaufN1ZGI,+100500 - Почему Нельзя Засыпать На Китайской Вписке?!,AdamThomasMoran,2017-12-08,1182459,113767,3626,15202,RU,Comedy
usam5OmPswc,Непосредственно Каха -- Полторы тысячи 4 сезон 8 серия,KTV,2017-12-08,694401,36090,1539,1913,RU,Comedy
LdoCgLbyAiE,Башкой своей ломаю эти знания,This is Хорошо,2017-12-08,398014,25482,1062,2034,RU,Comedy
cfgMmE9rzjk,"КОРОЧЕ ГОВОРЯ, НОВОГОДНИЕ ПОДАРКИ - ТимТим.",Tим Тим,2017-12-08,408585,29376,515,1658,RU,Comedy
4SVxrofaMYU,"КОРОЧЕ ГОВОРЯ, ГОТОВИМСЯ К НОВОМУ ГОДУ",OneTwo,2017-12-08,354118,20964,612,1613,RU,Comedy
nCCUZceMKVE,"Человек, похожий на Геращенко, и тарелка",Анатолий Шарий,2017-12-08,293131,26914,498,6354,RU,Comedy
10ZVYT2DdUY,"Зашкварные Истории #1: Ильич, Музыченко, Джарахов, Усачев и Старый",КЛИККЛАК,2017-12-07,1598134,227682,7782,8758,RU,Comedy
SSMfBLf6054,ЛИГА ПЛОХИХ ШУТОК #1 | L'One x Гудков,Чикен Карри,2017-12-07,304762,10785,4215,800,RU,Comedy
rTvIdV9JPdk,Артхаус Когда твоя девушка любит пазлы(#ЕвгенийКулик),Евгений Кулик • Оfficial Сhannel,2017-12-08,70242,4878,521,206,RU,Comedy
GTRQ2PY4G24,Россия будет Чемпионом мира по Футболу!,Начни С Себя,2017-12-08,82997,1703,1459,233,RU,Comedy
w8Yrmltzk18,НОВЫЙ ГОД: Серёжа и микрофон #19,sergeymeza,2017-12-08,57814,4332,281,790,RU,Comedy
P_KsvYdtsXc,ТИПЫ СОСЕДЕЙ,Максим Старосвитский,2017-12-08,103555,11814,120,560,RU,Comedy
RR1z0msBnJE,БУХЛИШКО ПАТРУЛЬ - ПОРАЗИТЕЛЬНЫЙ ФОКУСНИК  (гость Александр Муратаев),Кузьма,2017-12-07,173863,11083,371,652,RU,Comedy
lHZjOv4gHxw,Сериалы - Икра престолов - Уральские Пельмени (2017),Уральские Пельмени,2017-12-07,203004,2898,838,262,RU,Comedy
w4AImq08j9o,Why I'm not in YouTube Rewind 2017,PewDiePie,2017-12-07,6896028,513560,9506,64656,RU,Comedy
IEsaILpQKK8,"Зимний Кубок Лиги Смеха, часть 2 | Полный выпуск 08.12.2017",Лига Смеха,2017-12-08,134648,2019,156,656,RU,Comedy
SNYIht-CFx0,КВН Борцы - 2017 Спецпроект «Кубок мэра Москвы»,Официальный канал КВН,2017-12-07,238102,4627,306,337,RU,Comedy
vchTqs0z_6Y,"ТОП ШУТОК жюри КВН и Маслякова. Иногда они шутят смешнее команд. Лучшее, вошедшее в историю игры",Сейчас будет смешно!,2017-12-08,8326,319,13,62,RU,Comedy
bbvygsa2UoY,ЗАЛЕЗЛА НЕ ТУДА [Красавица и Чудовище](Выпуск 118),Красавица и Чудовище Официальный канал,2017-12-07,439735,23347,939,1172,RU,Comedy
o4720qO06aI,"Я, СНОВА Я И FACE!",Morana Battory,2017-12-08,60575,5244,422,589,RU,Comedy
9rHL2ZG0vVw,Армейский цирк | ПОТРАЧЕНО,ПОТРАЧЕНО,2017-12-08,72998,3353,183,143,RU,Comedy
evXSVHtFJm0,IKOTIKA - Впечатления от фильма Лига Справедливости,Ikotika,2017-12-08,15797,1998,71,229,RU,Comedy
6z-O9GwPIkw,НАВАЛЬНЫЙ ПРО ВЫДВИЖЕНИЕ ПУТИНА,TRUE,2017-12-07,84753,3484,13501,1364,RU,Comedy
fvoK5zwY8nY,ХАЙП КЭМП ГУСЬ (ЗА 1 МИНУТУ),DegraTube,2017-12-09,189688,22028,1054,1037,RU,Comedy
zNYaufN1ZGI,+100500 - Почему Нельзя Засыпать На Китайской Вписке?!,AdamThomasMoran,2017-12-08,1826331,144672,5559,19412,RU,Comedy
VbedXKcChAA,KAMIKADZE_D. ПАРОДИЯ #15,Satyr,2017-12-09,235559,43198,3348,6335,RU,Comedy
usam5OmPswc,Непосредственно Каха -- Полторы тысячи 4 сезон 8 серия,KTV,2017-12-08,1330782,48751,2935,2487,RU,Comedy
7Ax_sV73huE,В Таиланд без жены - 50 оттенков загорелого - Уральские Пельмени (2017),Уральские Пельмени,2017-12-09,146468,3178,227,116,RU,Comedy
ha3dI4LbJcE,3 ВИДА МОДНИЦ,MAX ПОЯСНИТ,2017-12-09,71966,5101,682,434,RU,Comedy
EsWoByJWmfg,Порошенко и книга добра,Анатолий Шарий,2017-12-09,208977,19983,319,3496,RU,Comedy
cfgMmE9rzjk,"КОРОЧЕ ГОВОРЯ, НОВОГОДНИЕ ПОДАРКИ - ТимТим.",Tим Тим,2017-12-08,629666,36082,917,1905,RU,Comedy
GTRQ2PY4G24,Россия будет Чемпионом мира по Футболу!,Начни С Себя,2017-12-08,91797,1760,1856,267,RU,Comedy
LdoCgLbyAiE,Башкой своей ломаю эти знания,This is Хорошо,2017-12-08,493137,29208,1298,2318,RU,Comedy
4SVxrofaMYU,"КОРОЧЕ ГОВОРЯ, ГОТОВИМСЯ К НОВОМУ ГОДУ",OneTwo,2017-12-08,476986,23905,866,1734,RU,Comedy
RwxWccKfieg,Новый Рассмеши Комика 2017 - 14 сезон - выпуск #13,Рассмеши Комика - Официальный Канал,2017-12-09,46642,530,49,50,RU,Comedy
HGyhpSQUXPs,"ЭЛТОН ДЖОН, РОББИ УИЛЬЯМС, PINK, КЭРИ МАЛЛИГАН, СТИВЕН ФРАЙ [s22e09] | ШОУ ГРЭМА НОРТОНА",BlackSerj Production / BSP Studio,2017-12-09,18380,1409,11,97,RU,Comedy
gv6Db7Di6Mg,BEST CUBE # 205,Best VIDEOS Лучшее видео,2017-12-09,94680,3426,359,301,RU,Comedy
brERt1thJ58,COUB лучшее за неделю декабрь 2017 | coub best,just enjoy,2017-12-09,82006,2067,204,149,RU,Comedy
6hOLEINZiXU,"Саакашвили, или Литва выдвинула требование к Украине",Aleksandr Semchenko,2017-12-09,92507,2119,160,750,RU,Comedy
rTvIdV9JPdk,Артхаус Когда твоя девушка любит пазлы(#ЕвгенийКулик),Евгений Кулик • Оfficial Сhannel,2017-12-08,116499,6275,762,270,RU,Comedy
PCUJIm5jrrU,Убитый ФИТ за 700 000,ГвоздиShow,2017-12-10,20040,2354,152,87,RU,Comedy
P_KsvYdtsXc,ТИПЫ СОСЕДЕЙ,Максим Старосвитский,2017-12-08,314375,17359,285,797,RU,Comedy
10ZVYT2DdUY,"Зашкварные Истории #1: Ильич, Музыченко, Джарахов, Усачев и Старый",КЛИККЛАК,2017-12-07,1749236,242817,10496,8759,RU,Comedy
SSMfBLf6054,ЛИГА ПЛОХИХ ШУТОК #1 | L'One x Гудков,Чикен Карри,2017-12-07,378541,12397,4629,882,RU,Comedy
ZWUtPsvIG5c,МЕНСТРУАЛЬНЫЕ ЧАШИ | обзор не nixelpixel,Morana Battory,2017-12-09,87111,5433,727,742,RU,Comedy
WG2f3zrx5s8,СМ0ТРЕТЬ ВСEМ! 10.12.2017- Н0В0СТЬ ДНЯ,Саша Костянка,2017-12-09,62966,229,84,31,RU,Comedy
IEsaILpQKK8,"Зимний Кубок Лиги Смеха, часть 2 | Полный выпуск 08.12.2017",Лига Смеха,2017-12-08,504023,4284,414,1027,RU,Comedy
z82L0EDmbms,[BadComedian] - Крым (#ФильмНаш),BadComedian,2017-12-10,2376157,285477,3847,28355,RU,Comedy
N1-G6rCvB0E,Прожекторперисхилтон. Выпуск от 09.12.2017,Первый канал,2017-12-10,567407,8721,1985,803,RU,Comedy
NXFaXLjfQSw,Нардеп Лещенко и его тайный друг,Анатолий Шарий,2017-12-10,343222,21442,437,1946,RU,Comedy
VbedXKcChAA,KAMIKADZE_D. ПАРОДИЯ #15,Satyr,2017-12-09,462385,60229,6307,8490,RU,Comedy
7Ax_sV73huE,В Таиланд без жены - 50 оттенков загорелого - Уральские Пельмени (2017),Уральские Пельмени,2017-12-09,312324,4706,438,171,RU,Comedy
fvoK5zwY8nY,ХАЙП КЭМП ГУСЬ (ЗА 1 МИНУТУ),DegraTube,2017-12-09,255597,25268,1245,1106,RU,Comedy
cMQTJtF-4_0,Путин обломал заседание оппозиции,Гараж Дубляж,2017-12-10,69256,3097,501,194,RU,Comedy
zNYaufN1ZGI,+100500 - Почему Нельзя Засыпать На Китайской Вписке?!,AdamThomasMoran,2017-12-08,2126730,156951,6254,20613,RU,Comedy
ha3dI4LbJcE,3 ВИДА МОДНИЦ,MAX ПОЯСНИТ,2017-12-09,114107,6473,1160,512,RU,Comedy
9w-gHvCNYuQ,ЧТО ТАКОЕ КРИПТО КОТЯТА?,Палата 6,2017-12-10,55274,5999,124,1601,RU,Comedy
"#NAME?",The Top 29 Dog Fails: FailArmy Hall of Fame (December 2017),FailArmy,2017-12-10,730403,20283,511,977,RU,Comedy
"#NAME?",Анекдот про кума.,Анекдоты от Алексеевича,2017-12-10,55795,1312,106,52,RU,Comedy
poeTw9Fjq1c,Приколы за неделю #38 | ПОТРАЧЕНО,ПОТРАЧЕНО,2017-12-10,76843,3460,392,201,RU,Comedy
XJguWUJyOsM,Магнитные деньги | ПРОВЕРКА ЛАЙФХАКОВ с канала SLIVKI SHOW и 5-Minute Crafts,JackBelozerov,2017-12-10,180878,20828,427,1521,RU,Comedy
L2Ig57awpWQ,Зайка ZOOBE Для любимой подружки- И так каждый Новый Год!,Зайка Julia ZOOBE,2017-12-10,14770,290,16,7,RU,Comedy
vZv66GzqrdU,Ирина Луценко начала сдавать подельников,Aleksandr Semchenko,2017-12-10,41749,1979,32,269,RU,Comedy
usam5OmPswc,Непосредственно Каха -- Полторы тысячи 4 сезон 8 серия,KTV,2017-12-08,1558044,51989,3185,2593,RU,Comedy
uDhieJOXC98,Обзор сливочного масла | БорщЖоу | Как делать масло сливочное,Borsch,2017-12-10,50219,3418,107,629,RU,Comedy
gv6Db7Di6Mg,BEST CUBE # 205,Best VIDEOS Лучшее видео,2017-12-09,211077,5489,625,433,RU,Comedy
brERt1thJ58,COUB лучшее за неделю декабрь 2017 | coub best,just enjoy,2017-12-09,308076,4798,571,286,RU,Comedy
jnKWAoqDPS4,Детский КВН 2017 - 1 сезон 3 выпуск (03.12.2017) ИГРА ЦЕЛИКОМ Full HD,Официальный канал КВН,2017-12-10,24451,337,181,95,RU,Comedy
kBCpks3gUWU,БАТИ НА РОДИТЕЛЬСКОМ СОБРАНИИ,TheBrianMaps,2017-12-11,1269270,120075,3174,11067,RU,Comedy
mjsdYOFeMY0,МЕГА - ЗВЕЗДА МАРЬЯНА РО ВЫПУСТИЛА КЛИП,Кузьма,2017-12-11,271420,31154,1293,1947,RU,Comedy
z82L0EDmbms,[BadComedian] - Крым (#ФильмНаш),BadComedian,2017-12-10,3295510,341240,5550,33998,RU,Comedy
e3mcNipwkWo,🎮 ПАРНИ С ГНИЛЬЦОЙ: Скрытая повестка,Данила Поперечный,2017-12-11,573106,51871,5056,1685,RU,Comedy
YMZwGKFoIRM,Яценюк в суде над Януковичем уничтожил Медведева,Анатолий Шарий,2017-12-11,420949,28353,504,2968,RU,Comedy
OdhncFK-dBY,Как меня выгнали из дома за аморальные видео и мат?,Morana Battory,2017-12-11,113637,8941,4794,1004,RU,Comedy
eQ1z_9srcyE,Яценюк в суде. Typчинoв приказал cбить CAMO ЛЕТ,Aleksandr Semchenko,2017-12-11,108609,5426,152,818,RU,Comedy
xxWJkzwfNAI,Россию отстранили от Олимпиады | Класс народа,Денис Чужой,2017-12-11,25113,4257,50,283,RU,Comedy
PCIZQqhZI74,ЛУЧШИЕ ПРИКОЛЫ 2017 ДЕКАБРЬ #57 | Лучшая Подборка Приколов | ТОПОВЫЕ ПРИКОЛЫ,АКАДЕМИЯ СМЕХА,2017-12-11,120553,5667,380,846,RU,Comedy
Tv2_Ym40rGI,ДЕВОЧКА — ВЛАСТЕЛИН КОЛЕЦ: Мистические истории,Пикули,2017-12-11,26117,4868,66,279,RU,Comedy
ebw9dPj83yQ,"ПРИКОЛЫ 2017 Декабрь #5 ЭТО РОССИЯ, ДЕТКА! РУССКИЕ ПРИКОЛЫ | Эту страну не победить!",Подборки Army Home,2017-12-11,41627,328,117,46,RU,Comedy
h6VVwP5vxns,Чувство Юмора полный Четвёртый выпуск,Ольга Картункова,2017-12-11,12830,206,29,15,RU,Comedy
8CyY9-S_iJU,Handalak - Haqiqiy kulgu nomli konsert dasturi 2017,YangiKulgu,2017-12-11,42722,796,73,113,RU,Comedy
VbedXKcChAA,KAMIKADZE_D. ПАРОДИЯ #15,Satyr,2017-12-09,537441,65085,7210,9122,RU,Comedy
d3E18v6vnG4,Как правильно подготовиться к Новому году?,МЁD,2017-12-12,263593,20320,1135,654,RU,Comedy
mjsdYOFeMY0,МЕГА - ЗВЕЗДА МАРЬЯНА РО ВЫПУСТИЛА КЛИП,Кузьма,2017-12-11,684722,58187,3481,3264,RU,Comedy
jsEL8RMVTms,"Бомжи-шпионы, Михо под чем-то и другое",Анатолий Шарий,2017-12-12,443515,25143,635,2008,RU,Comedy
kBCpks3gUWU,БАТИ НА РОДИТЕЛЬСКОМ СОБРАНИИ,TheBrianMaps,2017-12-11,1698173,137720,4332,12423,RU,Comedy
obFcvemDMuE,ПАТРИОТ-ИДИОТ. ЛУЧШИЙ ТЕСТ (18+),kamikadzedead,2017-12-12,130496,25806,27419,3517,RU,Comedy
eQ1z_9srcyE,Яценюк в суде. Typчинoв приказал cбить CAMO ЛЕТ,Aleksandr Semchenko,2017-12-11,323357,8522,686,1294,RU,Comedy
ebw9dPj83yQ,"ПРИКОЛЫ 2017 Декабрь #5 ЭТО РОССИЯ, ДЕТКА! РУССКИЕ ПРИКОЛЫ | Эту страну не победить!",Подборки Army Home,2017-12-11,105080,525,254,58,RU,Comedy
z82L0EDmbms,[BadComedian] - Крым (#ФильмНаш),BadComedian,2017-12-10,3664144,359746,6246,35963,RU,Comedy
C6aA5UcAaEc,Gigguk - НАСТОЯЩИЙ Топ-20 аниме которые должен посмотреть каждый поклонник аниме,Студия ДжоШизо,2017-12-12,31553,5043,224,700,RU,Comedy
e3mcNipwkWo,🎮 ПАРНИ С ГНИЛЬЦОЙ: Скрытая повестка,Данила Поперечный,2017-12-11,678746,57616,5756,1942,RU,Comedy
OdhncFK-dBY,Как меня выгнали из дома за аморальные видео и мат?,Morana Battory,2017-12-11,151160,10013,9962,1256,RU,Comedy
TifBRYmK3-A,Рецепт буженины | Как запечь вкусную Буженину | Новогоднее Праздничное Мясо,Borsch,2017-12-12,47590,4588,159,785,RU,Comedy
kQ3OA6b_v6k,Анекдот про таксиста.,Анекдоты от Алексеевича,2017-12-12,44336,1524,64,76,RU,Comedy
IZ49zXliZWk,НОВЫЙ КЛИП МАРЬЯНЫ РО МЕГА-ЗВЕЗДА \ РЕАКЦИЯ,Онтон Болотов,2017-12-12,23283,3436,126,358,RU,Comedy
welnHJcQrPM,НОВЫЙ ГОД 2018: НОВОГОДНИЕ ПРИКОЛЫ - ДИЗЕЛЬ ШОУ ЛУЧШЕЕ | ЮМОР ICTV,ДИЗЕЛЬ ШОУ - ЮМОР ICTV - Официальный канал,2017-12-12,41901,711,71,19,RU,Comedy
L5zddNz8Ddo,Чайки атакуют | ПОТРАЧЕНО,ПОТРАЧЕНО,2017-12-12,84750,3250,378,186,RU,Comedy
1H9Tg5tCILw,Смешные собаки Приколы про собак Funny Dogs 2017 #18 (Улыбайтесь - смех продливает жизнь),Смешные Кошки - МатроскинТВ,2017-12-12,9852,229,12,22,RU,Comedy
nYuRhQ-rRpg,[ОБЗОР] Званый ужин Пауль Альбертович (САМЫЙ БЕЗУМНЫЙ ВЫПУСК),TalzGame,2017-12-12,27988,2025,42,218,RU,Comedy
pQO_Eo2gwuw,Своими руками - СИНТОЛ ( руки базуки ),RED21,2017-12-13,660730,57686,3715,1727,RU,Comedy
0X8UYiZ79Ag,ЛИГА ПЛОХИХ ШУТОК #2 | Ёлка x Маша Миногарова,Чикен Карри,2017-12-13,148220,4646,1547,304,RU,Comedy
qwjn2r4Dd-Q,Властелин колец на работе (Переозвучка),TheNafig,2017-12-13,277725,32555,781,499,RU,Comedy
V-hnaJ0Oq4Y,"Короче говоря, день рождения мамы",Room Factory,2017-12-13,696640,74675,413,3744,RU,Comedy
7GnBAw5C8B8,Олимпиада. Странности. Техзадание,Анатолий Шарий,2017-12-13,402037,26129,905,2429,RU,Comedy
T0lgOy4smmU,Гаишник в юбке - Королевство кривых кулис. 2 часть - Уральские Пельмени (2017),Уральские Пельмени,2017-12-13,172252,3476,301,323,RU,Comedy
SxtZqBwzi2E,ПРОВОЖАЕМ ТРЕНДЫ 2017,Юрий Хованский,2017-12-13,159386,9735,1556,867,RU,Comedy
t2SWYe_aQ14,Мысли перед свиданием,Vano,2017-12-13,83135,4203,82,170,RU,Comedy
4mIkLqGpIbo,АРЕСТ В ЦЕРКВИ / БЫВАЛЫЙ 2017,kamikadzedead,2017-12-13,119022,27525,31678,4532,RU,Comedy
ECQu2dLZbqM,Бандера - НЕ ГЕРОЙ. Порошенко согласился с президентом Польши Анжеем Дудой,Aleksandr Semchenko,2017-12-13,76948,3184,76,623,RU,Comedy
d3E18v6vnG4,Как правильно подготовиться к Новому году?,МЁD,2017-12-12,361279,24838,1473,821,RU,Comedy
CSzhM05QgPU,"Дизель шоу 2017 о проблемах: Украина и Россия чья Одесса и Крым | Дизель cтудио Мнение, юмор декабрь",Дизель Студио,2017-12-13,21716,383,150,151,RU,Comedy
zt7RFrpu--M,ЮТУБ ДЛЯ ВЗРОСЛЫХ | Денис Чужой,Денис Чужой,2017-12-13,17357,4071,31,237,RU,Comedy
5ioOX-37Jko,100000% U WILL LAFF + RIP Slippy,PewDiePie,2017-12-13,1582168,152502,2014,21377,RU,Comedy
8kIq9DTYFp0,Отель Элеон - финальный сезон - 15 и 16 серии,molodejjtv,2017-12-13,32464,207,24,51,RU,Comedy
slIlXqp14Ho,КАРОМАТ ШАРИПОВ РОИ КАРДАН БА ТОЧИКИСТОН,GAP NADORM,2017-12-13,15884,325,137,197,RU,Comedy
lmtYHG3Llq4,100% РЖАКА - ЛУЧШИЕ ПРИКОЛЫ ПРО ПОЛИТИКУ 2017 - ДИЗЕЛЬ ШОУ ЛУЧШЕЕ | ЮМОР ICTV,ДИЗЕЛЬ ШОУ - ЮМОР ICTV - Официальный канал,2017-12-13,27566,382,33,6,RU,Comedy
FyO0U5ieoJg,ЛУЧШИЕ СМС ОТ РОДИТЕЛЕЙ С ЧУВСТВОМ ЮМОРА,Палата 6,2017-12-13,64738,4576,423,276,RU,Comedy
RxcSM9gRq3I,Ксения Собчак задает вопрос Путину о Навальном/Пресс-Конференция (14.12.17),TRUE,2017-12-14,217045,4642,1215,2540,RU,Comedy
SASHJaBOzj0,Навальный и нормальная страна,Анатолий Шарий,2017-12-14,255090,28036,1377,5567,RU,Comedy
W3JOP9_AnlE,Отель Элеон - финальный сезон - 16 и 17 серии,molodejjtv,2017-12-14,62250,293,39,40,RU,Comedy
RVF2eQTObTA,Экзотическое животное - Королевство кривых кулис. 3 часть - Уральские Пельмени (2017),Уральские Пельмени,2017-12-14,77823,2372,118,29,RU,Comedy
0X8UYiZ79Ag,ЛИГА ПЛОХИХ ШУТОК #2 | Ёлка x Маша Миногарова,Чикен Карри,2017-12-13,226076,6075,2226,366,RU,Comedy
WoLS2Vcc_8g,Сергей Писаренко VS Юрий Хованский: На защите душевного отдыха,Юрий Хованский,2017-12-14,172848,36102,1218,3180,RU,Comedy
xzaKlpT8f-s,СБУ и Генпрокуратура отказались признать Л HP/Д HP тepp opиcтами,Aleksandr Semchenko,2017-12-14,36723,2321,25,320,RU,Comedy
qwjn2r4Dd-Q,Властелин колец на работе (Переозвучка),TheNafig,2017-12-13,380001,38622,1043,265,RU,Comedy
wzKL-bQKcgA,Anitta & J Balvin - Downtown (Official Lyric Video) ft. Lele Pons & Juanpa Zurita,Lele Pons,2017-12-14,4190444,405385,8613,25727,RU,Comedy
YjfqH-JS1rI,Нарисуй Мирби: Винишко-тян | Реакция,Майни,2017-12-14,40659,2491,40,616,RU,Comedy
_wvm64qN9Aw,Пирожок ?? Пончик ?? Свинина ??? Ананас ????,Borsch,2017-12-14,37217,3172,91,451,RU,Comedy
jgbuXD-6UyE,Ида ищет парня на премии Высшая лига. Кто попал в старую лигу?,Galich Ida,2017-12-14,111914,2909,64,106,RU,Comedy
slIlXqp14Ho,КАРОМАТ ШАРИПОВ РОИ КАРДАН БА ТОЧИКИСТОН,GAP NADORM,2017-12-13,76649,536,287,222,RU,Comedy
A1zz1q9FgHY,Муж нетрадиционной ориентации возвращается к жене и реп реклама от Минипанков,ОруTV,2017-12-14,18269,124,24,0,RU,Comedy
qRC16nVgUVw,НОВОГОДНИЙ КОРПОРАТИВ 2018 – СМЕШНЫЕ НОВОГОДНИЕ ПРИКОЛЫ – ДИЗЕЛЬ ШОУ ЛУЧШЕЕ | ЮМОР ICTV,ДИЗЕЛЬ ШОУ - ЮМОР ICTV - Официальный канал,2017-12-14,75224,781,80,12,RU,Comedy
EZWC9zHsukI,Песня про руки-базуки,Это чудо!,2017-12-15,205735,3551,2377,250,RU,Comedy
ddn5pLKxvEg,БОЖЕСТВЕННЫЙ БУРГЕР,Кузьма,2017-12-15,194634,16677,519,994,RU,Comedy
J2Yo5DUENiE,НАВАЛЬНЫЙ О ВОПРОСЕ СОБЧАК И ОТВЕТЕ ПУТИНА,TRUE,2017-12-14,360421,11733,15453,2868,RU,Comedy
ZFB_GTDNQ8U,Юрий Луценко и левая нога Саакашвили,Анатолий Шарий,2017-12-15,345638,21961,440,1987,RU,Comedy
tk0KzZzamoM,"КОРОЧЕ ГОВОРЯ, ПОЛУЧИЛ ДВОЙКУ",DANIK,2017-12-15,68511,2526,326,1138,RU,Comedy
nq2B8nxZMWE,This is Хорошо - Странная какая-то пopнyxa #636,This is Хорошо,2017-12-15,375957,30766,8092,2429,RU,Comedy
VJe1xb6lQJ4,"КОРОЧЕ ГОВОРЯ, ОДИН ДОМА",OneTwo,2017-12-15,393122,26092,288,1903,RU,Comedy
ebKC26pldak,ДОЛГИ: Серёжа и микрофон #20,sergeymeza,2017-12-15,59218,6421,157,893,RU,Comedy
1zTii31VUVA,Дизель Шоу - 38 НОВЫЙ ВЫПУСК от 15.12.2017 - последний выпуск 4 сезон | ЮМОР ICTV,ДИЗЕЛЬ ШОУ - ЮМОР ICTV - Официальный канал,2017-12-15,43244,745,67,128,RU,Comedy
tEfdWbUbK_c,"ДУЭЙН ДЖОНСОН, ДЖЕК БЛЭК, КЕВИН ХАРТ, ДЖЕССИКА ЧЕСТЕЙН, РЕБЕЛ УИЛСОН, ДОН ФРЕНЧ [s22e10]",BlackSerj Production / BSP Studio,2017-12-15,22452,1603,12,118,RU,Comedy
7_4zF72NLNQ,Комики VS Шоу-бизнес - Спецпроект Лиги Смеха | Полный выпуск 15.12.2017,Лига Смеха,2017-12-15,155265,3856,267,463,RU,Comedy
5jfz7NV1OlE,"Լավ երեկո (Գեորգի Պողոսյան, Դաթո Խուջաձե) 15.12.2017",Հանրային հեռուստաընկերություն,2017-12-15,35225,678,30,0,RU,Comedy
24qpWYrgCwE,ТИПЫ ЛЮДЕЙ ПЕРЕД ЗЕРКАЛОМ,Максим Старосвитский,2017-12-15,124045,11637,200,1030,RU,Comedy
W3JOP9_AnlE,Отель Элеон - финальный сезон - 16 и 17 серии,molodejjtv,2017-12-14,130212,482,68,65,RU,Comedy
_DW4tJ_z84k,ОТКУДА БЕРЁТСЯ ХАЙПОВЫЙ ШМОТ,ЕГОР,2017-12-16,218829,27469,916,1472,RU,Comedy
AwD9VaHrcAM,ПРАВДА vs ЛОЖЬ: ЭКЗАМЕН,Black Horse,2017-12-16,356699,22192,486,429,RU,Comedy
SQ8gYbW_nT4,Ремонтный вопрос - Икра престолов - Уральские Пельмени (2017),Уральские Пельмени,2017-12-16,170266,3582,274,170,RU,Comedy
Ho2wD80YU5I,ТЕШИК ҚИЗНИНГ ТЎЙДАН КЕЙИНГИ ХАЁТИ ШОК ВИДЕО,UzbekistaN INC,2017-12-16,112935,370,887,288,RU,Comedy
GCqE1BW4KEY,"Деградация в тренде #1: НОВЫЙ СЕЗОН, МАРЬЯНА РО вернулась на ютуб, ТИМООООН и ЛИГА ПЛОХИХ ШУТОК",DegraTube,2017-12-16,141691,24210,2994,2874,RU,Comedy
udnnUVHR2xE,Почему же Путин не называет ИМЯ?,Анатолий Шарий,2017-12-16,394976,31153,3510,5794,RU,Comedy
VyaI4ZGbyo0,НЕВЕРОЯТНЫЕ ФОКУСЫ ГРИДИНЯНА,Кузьма,2017-12-16,184320,22553,799,931,RU,Comedy
EZWC9zHsukI,Песня про руки-базуки,Это чудо!,2017-12-15,298511,7068,4476,406,RU,Comedy
d4n4XGPtYxM,ЛИХИЕ 90-ЫЕ ВЕРНУЛИСЬ В РОССИЮ,kamikadzedead,2017-12-16,175263,38411,47114,10075,RU,Comedy
tapbgNNX3QQ,ПРИКОЛЫ 2017 Декабрь #333 ржака до слез угар прикол - ПРИКОЛЮХА,Подборки Army Home,2017-12-16,42893,415,98,52,RU,Comedy
jcimHqdFO_s,[ТНТ HD]15.12.17-COMEDY CLUB/КАМЕДИ КЛАБ(ВЫСОКОЕ КАЧЕСТВО)-Последний выпуск,Камеди Клаб New,2017-12-15,81441,609,90,70,RU,Comedy
1zTii31VUVA,Дизель Шоу - 38 НОВЫЙ ВЫПУСК от 15.12.2017 - последний выпуск 4 сезон | ЮМОР ICTV,ДИЗЕЛЬ ШОУ - ЮМОР ICTV - Официальный канал,2017-12-15,163903,1539,173,248,RU,Comedy
J2Yo5DUENiE,НАВАЛЬНЫЙ О ВОПРОСЕ СОБЧАК И ОТВЕТЕ ПУТИНА,TRUE,2017-12-14,381821,12125,17458,3044,RU,Comedy
enbbFKqzGMI,НЕОЖИДАНAОЕ ПОЯВЛЕНИЕ DIZASTER НА КОНЦЕРТЕ ОКСИМИРОНА В КИЕВЕ!!!! + СОВМЕСТНЫЙ ТРЕК!!!! 2017!!,Oleksandr Yushchenko,2017-12-17,283250,5291,1294,713,RU,Comedy
4r80hftCf6g,Марш за импичмент Пу в центре Ки,Анатолий Шарий,2017-12-17,456446,31167,1172,9354,RU,Comedy
_DW4tJ_z84k,ОТКУДА БЕРЁТСЯ ХАЙПОВЫЙ ШМОТ,ЕГОР,2017-12-16,402765,38463,1592,2020,RU,Comedy
Muek3QRy7gM,СОВРЕМЕННАЯ МЕДИЦИНА,Room Factory,2017-12-17,621421,51982,1253,2574,RU,Comedy
AwD9VaHrcAM,ПРАВДА vs ЛОЖЬ: ЭКЗАМЕН,Black Horse,2017-12-16,573717,29052,884,499,RU,Comedy
UVXKkTNsV-o,"КАК ТЫ ЕЖЕДНЕВНО НАРУШАЕШЬ ЗАКОН? / Повседневные вещи, за которые можно получить реальный срок",Morana Battory,2017-12-17,58998,4994,674,736,RU,Comedy
DeT7x-09yd4,ХАММА ЎЗБЕКЛАР КЎРСИН РЕКЛАМАДАГИ АВТОБУСЧИЛАР АКЛОНИЯ ВА ХОКОЗО ШОК ВИДЕО,UzbekistaN INC,2017-12-17,37320,244,112,0,RU,Comedy
SQ8gYbW_nT4,Ремонтный вопрос - Икра престолов - Уральские Пельмени (2017),Уральские Пельмени,2017-12-16,341028,5206,548,206,RU,Comedy
mlFu7xmpoeM,Так нагло Порошенко ещё никогда не врал,Aleksandr Semchenko,2017-12-17,87001,3334,78,677,RU,Comedy
Mcuyvrliw_I,WFCA 44 (полный турнир),Fight Club Akhmat,2017-12-17,70273,512,83,11,RU,Comedy
tapbgNNX3QQ,ПРИКОЛЫ 2017 Декабрь #333 ржака до слез угар прикол - ПРИКОЛЮХА,Подборки Army Home,2017-12-16,100183,629,160,76,RU,Comedy
QzVPBYg5FHs,«УСПЕШНАЯ ГРУППА — Цок-Цок» голосом ЗУСА (Гравити Фолз) [Закажи Козырного #5],КОЗЫРНЫЙ УГОЛОК,2017-12-17,112716,13409,228,849,RU,Comedy
GCqE1BW4KEY,"Деградация в тренде #1: НОВЫЙ СЕЗОН, МАРЬЯНА РО вернулась на ютуб, ТИМООООН и ЛИГА ПЛОХИХ ШУТОК",DegraTube,2017-12-16,212493,29814,4182,3419,RU,Comedy
TsvPb03iOTk,IKOTIKA - Впечатления от фильма Звёздные Войны: Последние джедаи,Ikotika,2017-12-17,22370,2534,353,399,RU,Comedy
pY9lTNNcTt4,"Сделал ОГРОМНУЮ СПИЧКУ | ПРОВЕРКА ЛАЙФХАКОВ с канала ТРУМ ТРУМ, SLIVKI SHOW",JackBelozerov,2017-12-17,194936,17054,422,1811,RU,Comedy
VyaI4ZGbyo0,НЕВЕРОЯТНЫЕ ФОКУСЫ ГРИДИНЯНА,Кузьма,2017-12-16,281210,28876,1131,1097,RU,Comedy
nFnBUykuRCY,Непосредственно Каха -- Тачки в 4 сезоне.,KTV,2017-12-17,93974,3412,162,177,RU,Comedy
Ni9yip7Ev_w,100000% U WILL LAFF (FAMILY FRIENDLY v7) + RIP Slippy,PewDiePie,2017-12-17,1405827,103778,2899,11424,RU,Comedy
ys8FdXh4_64,+50 000 - Охранник Порошенко и спиннер,Рассмеши Комика - Официальный Канал,2017-12-17,79932,950,133,30,RU,Comedy
d4n4XGPtYxM,ЛИХИЕ 90-ЫЕ ВЕРНУЛИСЬ В РОССИЮ,kamikadzedead,2017-12-16,229504,46399,53162,11461,RU,Comedy
NvUPzZuBmjs,Теперь не покупай украинское?,Анатолий Шарий,2017-12-18,332515,21909,568,2302,RU,Comedy
e5ViArCk5fc,ДЕТСКИЕ ЮТУБ-КАНАЛЫ ЗАБЛОКИРОВАЛИ (ЗА 1 МИНУТУ),DegraTube,2017-12-18,166942,16034,967,665,RU,Comedy
M5Gx0KBFJ7A,МЁРТВЫЕ ЗА ПУТИНА / ВЫБОРЫ У НАВАЛЬНОГО,kamikadzedead,2017-12-18,194488,42784,42936,10636,RU,Comedy
0YOc9-l9RDM,Обзор чебуреков | БорщЖоу | Рецепт сочных чебуреков,Borsch,2017-12-18,68269,5390,127,629,RU,Comedy
oKWJzAMvnbo,ДЕБИЛЫ 80 уровня! ТОП Эпичных Фейлов Ютуба 2017 #17,Корпорация Зла,2017-12-18,90560,4143,337,183,RU,Comedy
enbbFKqzGMI,НЕОЖИДАНAОЕ ПОЯВЛЕНИЕ DIZASTER НА КОНЦЕРТЕ ОКСИМИРОНА В КИЕВЕ!!!! + СОВМЕСТНЫЙ ТРЕК!!!! 2017!!,Oleksandr Yushchenko,2017-12-17,456016,7663,1888,1126,RU,Comedy
WKW7qTS0PrU,Девушки на акции: приди в купальнике - получи скидку - Дизель Шоу  | ЮМОР ICTV,ДИЗЕЛЬ ШОУ - ЮМОР ICTV - Официальный канал,2017-12-18,27224,260,23,12,RU,Comedy
jlp7wsY-D9Q,Чувство Юмора полный Третий выпуск,Ольга Картункова,2017-12-18,16959,171,38,18,RU,Comedy
OjTIFn5WVMk,ТАМАШОУ ФИНАЛ 9-СЕЗОН ОЮН ТОЛУГУ МЕНЕН | КАНАЛГА ЖАЗЫЛ,TAMASHOW PRODUCTION,2017-12-18,26562,867,46,269,RU,Comedy
_DW4tJ_z84k,ОТКУДА БЕРЁТСЯ ХАЙПОВЫЙ ШМОТ,ЕГОР,2017-12-16,447574,40783,1721,2151,RU,Comedy
Muek3QRy7gM,СОВРЕМЕННАЯ МЕДИЦИНА,Room Factory,2017-12-17,930449,67214,1689,2901,RU,Comedy
Rpoz9MPJuzM,РЕАКЦИЯ на топовые ПЕСНИ,Andrey Glazunov,2017-12-18,35346,3504,111,477,RU,Comedy
NFf6Wqr5PHk,"Если бы нам платили за то, что нам нравится делать",МЁD,2017-12-19,282138,23057,777,613,RU,Comedy
YC6wz8FxKDQ,Свежая струя на Эхо Москвы,Анатолий Шарий,2017-12-19,383056,30776,834,4233,RU,Comedy
5MLp-SOgLcE,Великий октябрьский майдан Саакашвили в декабре / Путин и Зуб. MOUNT SHOW #123,MOUNT SHOW,2017-12-19,139379,15385,317,1030,RU,Comedy
Sm0PJILV_5w,Такси Суперстар - 50 оттенков загорелого - Уральские Пельмени (2017),Уральские Пельмени,2017-12-19,113079,2840,184,118,RU,Comedy
tSiUw3Wuk_4,Сахара Много,RED21,2017-12-19,193888,13386,771,492,RU,Comedy
"#NAME?",ОШ ЭЛИ  КАЙРАТ КЫРГЫЗДЫ ТАНЫБАЙБЫ?ТАПКАН ТАПАЛАК,Super Tamashalar,2017-12-19,17202,149,32,77,RU,Comedy
hlCj3flhjvE,ЛУЧШИЕ ФЕЙЛЫ И ПРИКОЛЫ 2017 ДЕКАБРЬ | Чумовая Подборка #113,Приколы Чумовой канал,2017-12-19,83616,2142,207,194,RU,Comedy
MKoXyS2k66o,Отель Элеон - финальный сезон - 18 и 19 серии,molodejjtv,2017-12-19,32297,260,22,27,RU,Comedy
DkfSoR5TUMA,Анекдот про лыжницу.,Анекдоты от Алексеевича,2017-12-19,53260,1515,59,48,RU,Comedy
fivuk5a-ZdI,ЛУЧШИЕ ПРИКОЛЫ 2017 ДЕКАБРЬ #58 | Лучшая Подборка Приколов | ТОПОВЫЕ ПРИКОЛЫ,АКАДЕМИЯ СМЕХА,2017-12-19,60775,3462,221,569,RU,Comedy
7lkIv4j5ZCM,САМЫЕ РЖАЧНЫЕ ПРИКОЛЮХИ 2017 – СМЕШНАЯ ПОДБОРКА – НА ТРОИХ ЛУЧШЕЕ ЗА ГОД | ЮМОР ICTV,ДИЗЕЛЬ ШОУ - ЮМОР ICTV - Официальный канал,2017-12-19,32487,426,27,26,RU,Comedy
M5Gx0KBFJ7A,МЁРТВЫЕ ЗА ПУТИНА / ВЫБОРЫ У НАВАЛЬНОГО,kamikadzedead,2017-12-18,279518,54796,46645,13719,RU,Comedy
FxkAGH6IoTQ,ТРЭШ ЛОТО: ВОКРУГ СВЕТА — ИНДИЯ (Финал сезона),КЛИККЛАК,2017-12-20,1464681,152795,2457,4251,RU,Comedy
EGcJGaauvHU,"Короче говоря, годовщина",Room Factory,2017-12-20,565460,38865,1928,1773,RU,Comedy
ye1DY1PsH7o,Белый мрак Кличко,Анатолий Шарий,2017-12-20,384030,20384,646,4837,RU,Comedy
TlYd2rUwUeA,Великие изобретения Ким Чен Ына - Авито,Студия Сбитый Лось,2017-12-20,85990,3471,224,54,RU,Comedy
NFf6Wqr5PHk,"Если бы нам платили за то, что нам нравится делать",МЁD,2017-12-19,371147,27633,969,696,RU,Comedy
TC2AKpPTdy0,ПРАВИЛЬНАЯ РЕКЛАМА 29 RYTP / ПУП,InEx RYTP,2017-12-20,56883,6586,354,584,RU,Comedy
5MLp-SOgLcE,Великий октябрьский майдан Саакашвили в декабре / Путин и Зуб. MOUNT SHOW #123,MOUNT SHOW,2017-12-19,215332,19522,451,1222,RU,Comedy
tSiUw3Wuk_4,Сахара Много,RED21,2017-12-19,227698,14741,865,550,RU,Comedy
M2Dx62mabJg,Чувство Юмора Второй выпуск Полный,Ольга Картункова,2017-12-20,16716,183,32,23,RU,Comedy
GCEgdf-H9UI,Невероятные приключения Деда Мороза и Снегурочки – ЛУЧШИЕ НОВОГОДНИЕ ПРИКОЛЫ  – Дизель Шоу BEST,ДИЗЕЛЬ ШОУ - ЮМОР ICTV - Официальный канал,2017-12-20,27744,486,61,75,RU,Comedy
9muylip6jDM,САМЫЙ КРУТОЙ ПЕРЕЕЗД - Брайн Мапс (TheBrianMaps) | Реакция,Майни,2017-12-20,33214,2212,48,261,RU,Comedy
Sm0PJILV_5w,Такси Суперстар - 50 оттенков загорелого - Уральские Пельмени (2017),Уральские Пельмени,2017-12-19,174510,3612,248,148,RU,Comedy
GygqYq_8Jdg,Теща в клетке с медведем - что сделает зять? | Дизель cтудио Украина семейные приколы и юмор,Дизель Студио,2017-12-20,27082,489,36,52,RU,Comedy
5FysCWJBFvY,Million jamoasi - Besh aka-uka evropalik qizlarga uylangandan keyingi xolati,Million Jamoasi ™,2017-12-20,121806,1147,144,59,RU,Comedy
kAA0DlFgZKI,ЛИГА ПЛОХИХ ШУТОК #3 | Feduk x Денис Кукояка (Хлеб),Чикен Карри,2017-12-21,438723,21565,2123,607,RU,Comedy
2UVE5nZ3_hk,This is Хорошо - Почта России на Камчатке #637,This is Хорошо,2017-12-22,91989,9967,258,768,RU,Comedy
JxMf4Uiys2M,Ежовщина и деньги в Сбербанке,Анатолий Шарий,2017-12-21,356878,22992,436,2536,RU,Comedy
42D7X8gENTc,Женские комплексы - Королевство кривых кулис. 2 часть - Уральские Пельмени (2017),Уральские Пельмени,2017-12-21,83223,2312,105,85,RU,Comedy
a73uBdvLBE0,КАК ЛУЧШЕ ПОДДЕРЖАТЬ ПУТИНА?,kamikadzedead,2017-12-21,172137,47370,49920,12459,RU,Comedy
FxkAGH6IoTQ,ТРЭШ ЛОТО: ВОКРУГ СВЕТА — ИНДИЯ (Финал сезона),КЛИККЛАК,2017-12-20,1702395,168397,2832,4581,RU,Comedy
G6FRP5Jg3Lk,Что подарить мужику на Новый год 2018 - семейные моменты | Дизель шоу Украина выпуск декабрь 2017,Дизель Студио,2017-12-21,68429,800,93,106,RU,Comedy
qU0lMAYXugs,Ольга Картункова поёт олигархическую песню,Ольга Картункова,2017-12-21,9197,387,19,27,RU,Comedy
EGcJGaauvHU,"Короче говоря, годовщина",Room Factory,2017-12-20,823147,49463,2547,1989,RU,Comedy
KzQ-njZ3K_s,Когда пришёл в гости на Новый Год ОЖИДАНИЕ / РЕАЛЬНОСТЬ,RED21,2017-12-21,105556,10608,287,336,RU,Comedy
mly7XiQNUDA,КВН Русская дорога - Мама Алексея Кривени,Официальный канал КВН,2017-12-21,64042,2476,55,111,RU,Comedy
2RHfQ6_XjrM,Отель Элеон - финальный сезон - 20 и 21 серии,molodejjtv,2017-12-21,44418,524,39,143,RU,Comedy
MV2DgrSTn2Q,РЕЗИНОВЫЙ РОТ | ШОУ ПАДКИНАБАБКИ,IdiotikShow,2017-12-21,41115,2906,205,174,RU,Comedy
7Dpn6lcJwek,Картофельная запеканка? Или картофельная лазанья? Подготовка к Новому Году?,Borsch,2017-12-21,44916,3930,91,563,RU,Comedy
cKVXEOxGaf0,ПЛОХИЕ ШУТКИ #2: Денис Косяков,Данила Поперечный,2017-12-22,467044,65429,2681,2393,RU,Comedy
yeRCUKn-Ma4,Наперсточник-урод - [Бумага],Мартеллиада,2017-12-22,171241,21669,322,588,RU,Comedy
2UVE5nZ3_hk,This is Хорошо - Почта России на Камчатке #637,This is Хорошо,2017-12-22,468372,29291,1081,2030,RU,Comedy
p65v2RzFp7o,[ТНТ HD]22.12.17-COMEDY CLUB/КАМЕДИ КЛАБ(ВЫСОКОЕ КАЧЕСТВО)-Последний выпуск,Камеди Клаб New,2017-12-22,322496,3743,1110,355,RU,Comedy
KmnRTzuPsww,Назад в будущее. Спортивный альманах Вальди!,Это чудо!,2017-12-22,129167,5285,105,58,RU,Comedy
kAA0DlFgZKI,ЛИГА ПЛОХИХ ШУТОК #3 | Feduk x Денис Кукояка (Хлеб),Чикен Карри,2017-12-21,842429,35877,3397,910,RU,Comedy
yUtnbmIeWm0,Крыса Гройсмана,Анатолий Шарий,2017-12-22,337476,22957,382,2537,RU,Comedy
FfLefhgj-E8,"КОРОЧЕ ГОВОРЯ, НОВОГОДНЯЯ МЕЧТА",OneTwo,2017-12-22,350463,27336,690,2701,RU,Comedy
tzFN5YC2H7w,ХОРОШАЯ ЖИЗНЬ СТУДЕНТОВ и другое,kamikadzedead,2017-12-22,179292,42127,44053,10673,RU,Comedy
qjuTSZjLXg0,КАК ПОНРАВИТЬСЯ ТАКОЙ ДЕВУШКЕ КАК Я?,Morana Battory,2017-12-22,66577,4260,896,395,RU,Comedy
HQirUvLMbZw,Дизель шоу - новый выпуск 39 от 22.12.2017 | Дизель cтудио декабрь Украина Новий год,Дизель Студио,2017-12-22,31644,554,45,126,RU,Comedy
m8X2SxAk0Iw,КВН 2017 Первая лига Финал ИГРА ЦЕЛИКОМ Full HD,Официальный канал КВН,2017-12-22,78824,604,392,179,RU,Comedy
iBJhCXItW9s,"Լավ երեկո (Հրանտ Թոխատյան, Սեյրան Սարոյան) 22.12.2017",Հանրային հեռուստաընկերություն,2017-12-22,44895,963,55,0,RU,Comedy
I81PwYqZLXM,МАСТЕР НА ВСЕ РУКИ,Миша Шевчук,2017-12-22,123605,10081,303,335,RU,Comedy
GE4leT_D_Ug,Суррогатное материнство: как мужик сдал свою жену в аренду геям – Дизель Шоу 2017 | ЮМОР ICTV,ДИЗЕЛЬ ШОУ - ЮМОР ICTV - Официальный канал,2017-12-22,9782,168,12,7,RU,Comedy
m_vSLAL2dzE,Студентские Мутки: Пригласи Её !!! | Часть 2,Просто Озвучка,2017-12-22,21624,2062,19,164,RU,Comedy
fIjQXh7q2XQ,+100500 - Экскаватор в Пропасть и Солдат-Кран,AdamThomasMoran,2017-12-23,1011527,97509,2162,4225,RU,Comedy
cKVXEOxGaf0,ПЛОХИЕ ШУТКИ #2: Денис Косяков,Данила Поперечный,2017-12-22,919213,91139,4503,3000,RU,Comedy
1UK4P56jczw,О Порошенко - на канале Порошенко,Анатолий Шарий,2017-12-23,342855,22562,648,2714,RU,Comedy
ial_CpqXex4,ТИПЫ ЛЮДЕЙ НА ФУТБОЛЕ,Максим Старосвитский,2017-12-23,203419,12326,373,477,RU,Comedy
C-QvxBhGnoQ,Если бы я был футболистом,Vano,2017-12-23,69180,4201,86,148,RU,Comedy
ffBxpyN9pdQ,Kem dưỡng ẩm KOSXU WINTER CREAM,KOSXU VIETNAM,2017-12-24,53863,4,13,3,RU,Comedy
eVGx0efv5jU,По блату в детский сад - Королевство кривых кулис. 3 часть - Уральские Пельмени (2017),Уральские Пельмени,2017-12-23,83791,2340,121,127,RU,Comedy
ebl4BZsWOZ8,Рандомные моменты в Одноклассниках - ПАТРИОТЫ,Morana Battory,2017-12-23,32325,4132,356,374,RU,Comedy
RbWOL4D1-VY,ИП-шники: Серёжа и маленький глупый микрофон (СПЕШЛ),sergeymeza,2017-12-23,51331,3422,463,701,RU,Comedy
M-6qY-OUOj4,✨БОЛЬШОЙ🎄 НОВОГОДНИЙ🎄 ЮМОРИСТИЧЕСКИЙ КОНЦЕРТ🎅👍,РЖАЧ ПОЗИТИВ,2017-12-23,47685,278,68,9,RU,Comedy
XCyEKIhSiF4,Эл Эмне Дейт? \ 3 сезон \ 1 ВЫПУСК,1.1TV,2017-12-23,59669,2232,64,433,RU,Comedy
U8LHgq3Jlnw,NET NEUTRALITY MEMES,PewDiePie,2017-12-23,2382295,178025,4413,11040,RU,Comedy
ap4Wq-kS21A,"МАРК ХЭМИЛЛ, ДЖОН БОЙЕГА, ДЭЙЗИ РИДЛИ, ГВЕНДОЛИН КРИСТИ [s22e11] | ШОУ ГРЭМА НОРТОНА",BlackSerj Production / BSP Studio,2017-12-23,21552,1630,28,130,RU,Comedy
yeRCUKn-Ma4,Наперсточник-урод - [Бумага],Мартеллиада,2017-12-22,254485,26603,481,751,RU,Comedy
tZEB0VpLYTs,ПРИКОЛЫ 2017 Декабрь #337 ржака до слез угар прикол - ПРИКОЛЮХА,Подборки Army Home,2017-12-23,46747,413,132,45,RU,Comedy
dl2LNFgT6fk,ЧТО ВЫ НЕ ЗНАЛИ О ЛЮБИМЫХ РЕКЛАМАХ ДЕТСТВА,Палата 6,2017-12-23,78933,8671,224,1887,RU,Comedy
Z_5kdk0zFNE,Новый Рассмеши Комика 2017 - 14 сезон - выпуск #15,Рассмеши Комика - Официальный Канал,2017-12-23,51398,496,71,75,RU,Comedy
tzFN5YC2H7w,ХОРОШАЯ ЖИЗНЬ СТУДЕНТОВ и другое,kamikadzedead,2017-12-22,224151,47965,44883,11837,RU,Comedy
2UVE5nZ3_hk,This is Хорошо - Почта России на Камчатке #637,This is Хорошо,2017-12-22,545444,32022,1278,2146,RU,Comedy
TY2cwatLo8A,Время и Стекло - Тролль (ПАРОДИЯ). Барселона - Реал Мадрид 23.12.2017,Чоткий Паца,2017-12-23,100097,10830,564,583,RU,Comedy
QeqctvDj-iw,Пранк с Никки Хейли (Представитель США в ООН),Vovan222prank,2017-12-23,52517,1529,77,484,RU,Comedy
FfLefhgj-E8,"КОРОЧЕ ГОВОРЯ, НОВОГОДНЯЯ МЕЧТА",OneTwo,2017-12-22,488955,31805,878,3053,RU,Comedy
GGCVQ_o7WII,ЧТО МЕНЯ БЕСИТ В СТИРКЕ,Миша Шевчук,2017-12-23,115897,10662,150,347,RU,Comedy
ZA_Qi8LOIjA,Как УБРАТЬ ПЯТНО от УТЮГА? / ПРОВЕРКА СТРАННЫХ ЛАЙФХАКОВ,JackBelozerov,2017-12-23,201252,13407,395,1604,RU,Comedy
fIjQXh7q2XQ,+100500 - Экскаватор в Пропасть и Солдат-Кран,AdamThomasMoran,2017-12-23,1766073,130596,3649,5406,RU,Comedy
h5unwTFWmw4,ЭЛДЖЕЙ & FEDUK - РОЗОВОЕ ВИНО. ПАРОДИЯ #16,Satyr,2017-12-24,142652,36019,1197,2072,RU,Comedy
"#NAME?",Странный человек и полицейский Навального,Анатолий Шарий,2017-12-24,269414,26348,1430,4240,RU,Comedy
UQEl5ALj4Zw,ВСЯ ДЕГРАДАЦИЯ ютуба (ЗА 16 СЕКУНД),DegraTube,2017-12-24,121644,6720,1180,310,RU,Comedy
0Xc5tLb2M2I,ТВОЁ БУДУЩЕЕ С ПУТИНЫМ,kamikadzedead,2017-12-24,146409,34268,46192,9983,RU,Comedy
5SJNwKOji2Y,«АЗИНО 777» голосом ПУТИНА / [Пародия на АК-47 — Azino777],КОЗЫРНЫЙ УГОЛОК,2017-12-24,114227,12876,355,721,RU,Comedy
tZEB0VpLYTs,ПРИКОЛЫ 2017 Декабрь #337 ржака до слез угар прикол - ПРИКОЛЮХА,Подборки Army Home,2017-12-23,124957,662,258,85,RU,Comedy
ial_CpqXex4,ТИПЫ ЛЮДЕЙ НА ФУТБОЛЕ,Максим Старосвитский,2017-12-23,332084,15881,597,527,RU,Comedy
IzD7e8K-5J0,!00% Sketch Comedy Show Intro,100 Percent Sketch Comedy Show,2017-11-12,12993,0,0,0,RU,Comedy
ql27duXCUbg,Навальный в ЦИКе/Подача документов (24.12.2017),TRUE,2017-12-24,124494,4479,2862,921,RU,Comedy
JBp9w_W4neM,JAPANESE SHIA LABEOUF v1,PewDiePie,2017-12-24,1643876,139542,3344,14583,RU,Comedy
QeqctvDj-iw,Пранк с Никки Хейли (Представитель США в ООН),Vovan222prank,2017-12-23,98440,2172,111,705,RU,Comedy
C-QvxBhGnoQ,Если бы я был футболистом,Vano,2017-12-23,106991,5203,117,170,RU,Comedy
cKVXEOxGaf0,ПЛОХИЕ ШУТКИ #2: Денис Косяков,Данила Поперечный,2017-12-22,1078064,98358,5103,3154,RU,Comedy
ebl4BZsWOZ8,Рандомные моменты в Одноклассниках - ПУТИН И ПАТРИОТЫ,Morana Battory,2017-12-23,68845,6213,593,626,RU,Comedy
S-orFMFP2Hs,2016 ПРОТИВ 2017,RusSmosh,2017-12-24,37346,2248,54,107,RU,Comedy
2bItTIWh3kY,Порошенко признался в подлости своего режима /дословно/,Aleksandr Semchenko,2017-12-24,44429,2577,26,488,RU,Comedy
VRoRH1D5chA,РЕЧЬ НАВАЛЬНОГО В ЦИКе/СМОТРЕТЬ ВСЕМ (25.12.2017),TRUE,2017-12-25,183074,10828,14996,3808,RU,Comedy
rX9st7Yefjs,Раньше было лучше 3 (со Стасом Давыдовым) ВСЯ ПРАВДА О НАСТЕНЬКЕ,This is Хорошо,2017-12-25,411207,29362,825,2171,RU,Comedy
yxNMZOlP5vs,"Леша, держись, жизнь боль",Анатолий Шарий,2017-12-25,188817,21408,972,4349,RU,Comedy
QCUqNa6Uq2k,Топ 10 видео 2017 года - Уральские Пельмени,Уральские Пельмени,2017-12-25,109429,2013,140,170,RU,Comedy
CWWLRp0GRUM,Новые олимпийские игры,Канал Кшиштовского,2017-12-25,93327,18968,335,373,RU,Comedy
0sENRxhQuaU,НОВОГОДНИЕ БАЙКИ ХОВАНСКОГО,Юрий Хованский,2017-12-25,91714,9097,742,652,RU,Comedy
0Xc5tLb2M2I,ТВОЁ БУДУЩЕЕ С ПУТИНЫМ,kamikadzedead,2017-12-24,214529,45398,56698,12467,RU,Comedy
E5fYQpqUDZ4,Своими Руками - Бургерная Пицца,RED21,2017-12-25,319216,40384,1784,2706,RU,Comedy
zKQKt4HzwHM,"Короче говоря, конкурс",Room Factory,2017-12-25,294551,26791,1061,2186,RU,Comedy
kdrH63krqFY,Чувство Юмора полный Первый выпуск,Ольга Картункова,2017-12-25,17979,134,24,14,RU,Comedy
xgjak4xzJsE,Sho'rdanak - Kar quda | Шурданак - Кар куда (hajviy ko'rsatuv),YangiKulgu,2017-12-25,51609,779,76,50,RU,Comedy
Pp2lYFkvrpM,Пенсии ПОНИЗЯТ на 100 грн. - Прогноз Гройсмана на 2018 год,Aleksandr Semchenko,2017-12-25,61196,2350,55,397,RU,Comedy
fIjQXh7q2XQ,+100500 - Экскаватор в Пропасть и Солдат-Кран,AdamThomasMoran,2017-12-23,2007892,139659,4009,5687,RU,Comedy
RRUL9zPXs_8,ВСЯ ПРАВДА О СВИДАНИЯХ С КРАСАВИЦАМИ! Признаюсь в постановах!?,Афоня TV,2017-12-26,579326,50349,3907,3571,RU,Comedy
1IoMBytFT0M,БОЙКОТ ВЫБОРОВ 2018 И АВТОБУС В МОСКВЕ,kamikadzedead,2017-12-26,256790,60288,62938,16367,RU,Comedy
r-esK5xE3Is,"КОРОЧЕ ГОВОРЯ, РАССЛЕДОВАНИЕ - ТимТим.",Tим Тим,2017-12-26,405619,33340,421,2362,RU,Comedy
OytAYEpUIns,Кремлевская х*нта потоптала Алексея,Анатолий Шарий,2017-12-26,379295,31273,1932,9496,RU,Comedy
zSl2TFYOaok,Последний выпуск 2017 / Грудинин / Плагиат Собчак / Подлый Педро. MOUNT SHOW #124,MOUNT SHOW,2017-12-26,132128,18176,319,1470,RU,Comedy
0i2mjyFA6UU,АНИ - ЁЛКА КАК ИРИНА ШЕЙК,ANI,2017-12-26,18117,1452,298,97,RU,Comedy
O8L0YJZagB4,ТИПЫ ЛЮДЕЙ НА НОВЫЙ ГОД,Morana Battory,2017-12-26,68967,6071,760,489,RU,Comedy
VRoRH1D5chA,РЕЧЬ НАВАЛЬНОГО В ЦИКе/СМОТРЕТЬ ВСЕМ (25.12.2017),TRUE,2017-12-25,200376,11513,18089,4238,RU,Comedy
sUJAvUAM4K0,ПРАВИЛЬНАЯ РЕКЛАМА 30 RYTP / ПУП,InEx RYTP,2017-12-26,54520,7304,169,558,RU,Comedy
QqYnQ0zLJd4,Sexy Weihnachtslied für dich,Davis Schulz,2017-12-24,75793,8112,106,446,RU,Comedy
rX9st7Yefjs,Раньше было лучше 3 (со Стасом Давыдовым) ВСЯ ПРАВДА О НАСТЕНЬКЕ,This is Хорошо,2017-12-25,489410,33419,980,2480,RU,Comedy
QCUqNa6Uq2k,Топ 10 видео 2017 года - Уральские Пельмени,Уральские Пельмени,2017-12-25,231072,2976,271,206,RU,Comedy
lFLVD3bGio8,Просто Аху*нная Шаверма №12 | Новогодняя Шаверма |,Borsch,2017-12-26,44706,4115,329,781,RU,Comedy
onSUNsEtOG8,Украина vs Л/Д HP: kто тормозит обмен плeнными 27 декабря,Aleksandr Semchenko,2017-12-26,26100,1498,19,241,RU,Comedy
qiqaeuM5pc0,ТЕСТ НА ПСИХИКУ 2017! ПОПРОБУЙ НЕ ЗАСМЕЙСЯ! ЛУЧШИЕ ПРИКОЛЫ И ВАЙНЫ!,The Best,2017-12-26,10765,360,44,25,RU,Comedy
K7dMBV0VbpE,ИСПОВЕДЬ: Новогодний выпуск,Данила Поперечный,2017-12-27,433080,80807,2004,2203,RU,Comedy
l-rfZGh7F88,Дождь и украинские песни в комендантский час,Анатолий Шарий,2017-12-27,270517,15816,2161,3994,RU,Comedy
RRUL9zPXs_8,ВСЯ ПРАВДА О СВИДАНИЯХ С КРАСАВИЦАМИ! Признаюсь в постановах!?,Афоня TV,2017-12-26,765037,59634,5370,4064,RU,Comedy
JVHNSr8lQX4,Siri can't keep up,chukkie tykunez,2017-02-21,30686,10,155,27,RU,Comedy
S2vnepx3V1w,СПАСИБО ПУТИНУ ЗА БАНДИТОВ!,kamikadzedead,2017-12-27,201620,47705,50681,11298,RU,Comedy
PN16-ajSxi4,Новый год 2018 - год собаки: как правильно встречать семейные праздники | Дизель шоу декабрь украина,Дизель Студио,2017-12-27,102648,1104,288,240,RU,Comedy
1zAfFk4Ne8s,"Деградация в тренде #2: НАКРУТКИ В ТРЕНДЕ, Романтика от ШАПИКА и ФОНТАН из СОКА",DegraTube,2017-12-27,122959,19801,1132,1040,RU,Comedy
ptQZORrfBYc,Новогодние песни Уральских Пельменей. 1 часть,Уральские Пельмени,2017-12-27,57671,1560,140,118,RU,Comedy
Ih1Q0_fzMW4,"КОРОЧЕ ГОВОРЯ, новогоднее настроение",Andrey Glazunov,2017-12-27,87267,6205,85,385,RU,Comedy
r-esK5xE3Is,"КОРОЧЕ ГОВОРЯ, РАССЛЕДОВАНИЕ - ТимТим.",Tим Тим,2017-12-26,617351,42294,616,2859,RU,Comedy
tmSuIAdVpyI,■■ NEW EPIC PRANK ON BIRTHDAY 2017 ■■,Fun Facts,2017-12-25,14920,1,0,0,RU,Comedy
zSl2TFYOaok,Последний выпуск 2017 / Грудинин / Плагиат Собчак / Подлый Педро. MOUNT SHOW #124,MOUNT SHOW,2017-12-26,207886,23445,462,1929,RU,Comedy
s26JfwmlIKc,WARNING : ONLY INTELLEGENT PEOPLE CAN WATCH THIS.,PewDiePie,2017-12-27,1850888,235921,2541,19361,RU,Comedy
gUginI5D2_g,Лучший подарок на Новый Год 2018. Муж в шоке!,Юлианна Кобцева,2017-12-28,359509,6919,6810,1058,RU,Comedy
x8GR8HPNnvQ,This is Хорошо - СОЗДАЁМ НОВОГОДНЕЕ НАСТРОЕНИЕ #638,This is Хорошо,2017-12-29,99944,11707,787,842,RU,Comedy
3xpmojxX1To,Сколько стоило место на обмен,Анатолий Шарий,2017-12-28,347685,22563,538,2257,RU,Comedy
0BNmg4FtS7Y,ГАИШНИКИ ДЛЯ НАС - НИКТО,kamikadzedead,2017-12-28,170149,43000,52169,12178,RU,Comedy
64_izdRr5F8,ЧТО ПРИГОТОВИТЬ НА НОВЫЙ ГОД?,Кузьма,2017-12-28,128662,15452,1184,1135,RU,Comedy
gFXz4-wFwTk,НОВОГОДНИЕ ПОДАРКИ ОТ ROOM FACTORY,Room Factory,2017-12-28,328635,24988,762,1913,RU,Comedy
K7dMBV0VbpE,ИСПОВЕДЬ: Новогодний выпуск,Данила Поперечный,2017-12-27,607325,100088,2606,2539,RU,Comedy
ZPXljgOT0zs,Белочка догнала Порошенко в одесской больнице,Aleksandr Semchenko,2017-12-28,41886,2579,35,737,RU,Comedy
qQV-71kOxOI,Непосредственно Каха -- Никого не узнаете ?)),KTV,2017-12-28,134228,5711,492,394,RU,Comedy
PN16-ajSxi4,Новый год 2018 - год собаки: как правильно встречать семейные праздники | Дизель шоу декабрь украина,Дизель Студио,2017-12-27,295452,2142,611,409,RU,Comedy
rcZfezRTzPg,НАВАЛЬНЫЙ ПРО БЕЗУМИЕ В ЦИКе,TRUE,2017-12-28,104662,4693,698,1206,RU,Comedy
0y4_N8gEWkM,Гратен | Рецепт Новогоднего Гарнира,Borsch,2017-12-28,50038,4022,124,503,RU,Comedy
KuTJAD1U1fY,ЛУЧШИЕ ФЕЙЛЫ И ПРИКОЛЫ 2017 ДЕКАБРЬ | Чумовая Подборка приколов #114,Приколы Чумовой канал,2017-12-28,86045,2189,158,208,RU,Comedy
FrycJiEjR50,Галич танцует нижний брейк. Парни Ивлеевой. Варнава читает рэп. Масленников и корпоративы.,Galich Ida,2017-12-29,766201,18544,1671,712,RU,Comedy
c7KuQwbsxPw,"Игорь Николаев, Иван Ургант, Александр Гудков & Feduk – Розово-малиновое вино",Вечерний Ургант,2017-12-29,552388,92072,1230,3413,RU,Comedy
PJy-HrEGSV0,ЛИГА ПЛОХИХ ШУТОК #5 | Иван Ургант x Иван Дорн,Чикен Карри,2017-12-29,1093954,44302,3715,1157,RU,Comedy
SFtyXkTCtnE,ЧТО нас ждёт в Новом году?,Это чудо!,2017-12-29,419779,3224,720,228,RU,Comedy
kdlMFzRmBTY,"ЗАШКВАРНЫЕ ИСТОРИИ #2: Поперечный, Джарахов, Ильич, Музыченко, Прокофьев",КЛИККЛАК,2017-12-29,1341331,163322,2518,7512,RU,Comedy
nls_EpRJ4PI,Crazy 8 ball make,chukkie tykunez,2017-09-29,34566,280,16,7,RU,Comedy
x8GR8HPNnvQ,This is Хорошо - СОЗДАЁМ НОВОГОДНЕЕ НАСТРОЕНИЕ #638,This is Хорошо,2017-12-29,351331,26355,2349,1503,RU,Comedy
IqkXvDvf6p4,Шпильки Дoбкина иcкoлoли Геращенко,Анатолий Шарий,2017-12-29,324487,22825,334,1715,RU,Comedy
55s3gbPlO5g,Чарли качает в новогоднем клипе,Чарли Качает,2017-12-29,102537,2282,335,62,RU,Comedy
gUginI5D2_g,Лучший подарок на Новый Год 2018. Муж в шоке!,Юлианна Кобцева,2017-12-28,427082,17806,9549,1229,RU,Comedy
_-pPLzyplS0,КВН Высшая лига Финал - Анонс №1,Официальный канал КВН,2017-12-29,51829,635,251,116,RU,Comedy
EzIISAchyko,Por trás das câmeras - Antes do campeonato,George Ramos,2017-10-14,37255,895,5,0,RU,Comedy
ixE6S233g94,ДАРЮ ДЕНЬГИ на Новый Год / ПРАНК,Иван Эфиров,2017-12-29,140283,15570,290,972,RU,Comedy
d14bJ2xroaY,Быстрый неправильный Наполеон | Рецепт Наполеона | Торт Наполеон,Borsch,2017-12-29,39821,3410,77,394,RU,Comedy
2EIdDH_jJoQ,Адвокаты Януковича растерзали командующего BMC Украины,Aleksandr Semchenko,2017-12-29,50611,2567,38,437,RU,Comedy
ioJ0wkFKNlw,"Дизель шоу новый, предновогодний выпуск 40 от 29.12.2017 | Дизель cтудио декабрь 2017 Украина",Дизель Студио,2017-12-29,34105,516,56,109,RU,Comedy
RPUIQQOgcO0,ВОЛОСЫ: Серёжа и микрофон #21,sergeymeza,2017-12-29,37941,3061,113,532,RU,Comedy
EpEij605OuY,Новогодние песни Уральских Пельменей. 2 часть,Уральские Пельмени,2017-12-29,35170,837,86,80,RU,Comedy
1IWavuPpq1I,Ольга Картункова и Денис Дорохов поздравляют с Наступающим Новым Годом!!,Ольга Картункова,2017-12-29,13229,332,13,19,RU,Comedy
ax-BIrFovVM,"КОРОЧЕ ГОВОРЯ, НОВЫЙ ГОД",DANIK,2017-12-29,70260,3741,86,1925,RU,Comedy
0BNmg4FtS7Y,ГАИШНИКИ ДЛЯ НАС - НИКТО,kamikadzedead,2017-12-28,203918,49336,56713,13364,RU,Comedy
zucNvo4Gm2M,ПРИКОЛЫ 2017 Декабрь #340 ржака до слез угар прикол - ПРИКОЛЮХА,Подборки Army Home,2017-12-28,124391,783,179,73,RU,Comedy
c7KuQwbsxPw,"Игорь Николаев, Иван Ургант, Александр Гудков & Feduk – Розово-малиновое вино",Вечерний Ургант,2017-12-29,2779657,235685,5389,8185,RU,Comedy
jRt8AN9n15Y,НЕ БУДИ ОЛИВИЮ,TheBrianMaps,2017-12-30,1311648,139057,3172,16535,RU,Comedy
fu_leS4a220,СОБОЛЕВ ДО ПОСЛЕДНЕГО ХАЙПИТ,Кузьма,2017-12-30,256912,35118,1973,1662,RU,Comedy
eIbln4u9SEk,РОЗЫГРЫШ ОЧЕНЬ МОЩНОГО КОМПЬЮТЕРА АФОНЯ TV,Афоня TV,2017-12-30,217930,77442,1086,85146,RU,Comedy
PJy-HrEGSV0,ЛИГА ПЛОХИХ ШУТОК #5 | Иван Ургант x Иван Дорн,Чикен Карри,2017-12-29,1540759,53062,4623,1270,RU,Comedy
IfK2ScAoNwQ,ВЫБИРАЕМ КОСТЮМ НА НОВЫЙ ГОД,ЕГОР,2017-12-30,111872,19153,412,731,RU,Comedy
ZpP7pJjhfRY,Я люблю Иpину Луценкo,Анатолий Шарий,2017-12-30,214835,20956,200,3194,RU,Comedy
nFXt_5Ifpe8,УЛЫБКА СОБЧАК И НОВЫЙ ГОД 2018,kamikadzedead,2017-12-30,165090,39383,39063,8706,RU,Comedy
kdlMFzRmBTY,"ЗАШКВАРНЫЕ ИСТОРИИ #2: Поперечный, Джарахов, Ильич, Музыченко, Прокофьев",КЛИККЛАК,2017-12-29,1825556,193472,3213,8745,RU,Comedy
xqx0YkqzI0I,КОГДА НЕУДАЧНО ПОШУТИЛ,Black Horse,2017-12-30,323447,20181,546,620,RU,Comedy
RG_Hku04nXo,НАКРУЧЕННЫЕ ВИДЕО В ТРЕНДЕ И БАГИ ЮТУБА,DegraTube,2017-12-30,90885,11452,446,612,RU,Comedy
C5VoiaoZU7s,ЖИЗНЬ ГЛАЗАМИ ЁЛКИ,Room Factory,2017-12-30,677051,72282,750,6492,RU,Comedy
5atVDycaXWM,VINERS WELCOME!,PewDiePie,2017-12-30,2504955,252970,3059,22719,RU,Comedy
FrycJiEjR50,Галич танцует нижний брейк. Парни Ивлеевой. Варнава читает рэп. Масленников и корпоративы.,Galich Ida,2017-12-29,715217,23691,2161,863,RU,Comedy
NUNGyV44l2E,ЭЛ ЭМНЕ ДЕЙТ? / НОВОГОДНИЙ ВЫПУСК,1.1TV,2017-12-30,93643,3025,140,527,RU,Comedy
nMe3GiNU46Q,БЕЗДОМНЫЙ ДВА | RYTP,Пенёк ТВ,2017-12-30,204557,22720,587,1750,RU,Comedy
G48DxcuxDtI,TECHNO PARADE  Tu penses que l'on est quelle chaîne ? Ah ! Antenne 2,Philippe Postaire,2016-12-20,24137,164,1,0,RU,Comedy
cMQceXlDqsE,Как не умереть под Новый год? | Школа выживания,Денис Чужой,2017-12-30,16538,4180,44,172,RU,Comedy
SFtyXkTCtnE,ЧТО нас ждёт в Новом году?,Это чудо!,2017-12-29,266693,3399,854,228,RU,Comedy
7LeO_r8_L3k,КВН  Высшая лига  Финал - Анонс №2,Официальный канал КВН,2017-12-30,81573,1072,119,109,RU,Comedy
Cjx1DB-7woA,ПРИКОЛЫ 2017 Декабрь #341 ржака до слез угар прикол - ПРИКОЛЮХА,Подборки Army Home,2017-12-30,98813,578,245,82,RU,Comedy
I11rdQAgeHk,НЕ БУДИ ОЛИВИЮ - TheBrianMaps (Брайн Мапс) | Реакция,Майни,2017-12-30,29614,2108,45,552,RU,Comedy
LdfeKnKqb3E,Новогодний Рассмеши Комика 2017 - 14 сезон - выпуск #16,Рассмеши Комика - Официальный Канал,2017-12-30,54404,598,77,58,RU,Comedy
ioJ0wkFKNlw,"Дизель шоу новый, предновогодний выпуск 40 от 29.12.2017 | Дизель cтудио декабрь 2017 Украина",Дизель Студио,2017-12-29,125235,1047,136,177,RU,Comedy
AwpUu24OqZY,Анекдот про Василия))),Анекдоты от Алексеевича,2017-12-30,42362,1640,73,80,RU,Comedy
E2oLysWA1i0,[BadComedian] - Ёлки 5 (Новогодний обзор),BadComedian,2017-12-31,1780075,200000,2302,13713,RU,Comedy
bEStKwxmPIE,"Мандарины, вперед! - Уральские Пельмени (Новый год 2018)",Уральские Пельмени,2017-12-31,178234,4055,456,569,RU,Comedy
i7IehavUYFk,Новогодний спешл - [Бумага],Мартеллиада,2017-12-31,164145,32426,159,1976,RU,Comedy
-4w78wPaEqs,ТИПЫ ЛЮДЕЙ В НОВОГОДНЮЮ НОЧЬ,Максим Старосвитский,2017-12-31,282566,17745,351,1561,RU,Comedy
ipqAvQRZnIw,Очень новогодние дела (Переозвучка),TheNafig,2017-12-31,194743,27214,237,570,RU,Comedy
u68s6tg9O3g,12 МЕМСЯЦЕВ (Песня про лучшие мемы 2017 года),This is Хорошо,2017-12-31,308206,60556,3246,3434,RU,Comedy
XdabysLLbFs,Долбаный абсурд поздравления Порошенко,Анатолий Шарий,2018-01-01,156911,18708,314,3321,RU,Comedy
c7KuQwbsxPw,"Игорь Николаев, Иван Ургант, Александр Гудков & Feduk – Розово-малиновое вино",Вечерний Ургант,2017-12-29,3656118,265938,6595,9274,RU,Comedy
"#NAME?",2017 УХОДИТ. ЧЕГО ЖДАТЬ В 2018?,kamikadzedead,2017-12-31,130964,35409,26847,8943,RU,Comedy
__Sxrwi3QII,"Новогодняя ночь 2018 с Дизель шоу - новогодний выпуск, часть 3 декабрь 2017| Дизель cтудио Новый год",Дизель Студио,2017-12-31,34895,525,65,46,RU,Comedy
bQRINSTBSWA,Тизер: Дедкоины (сериал),КЛИККЛАК,2017-12-31,149436,10530,768,429,RU,Comedy
fu_leS4a220,СОБОЛЕВ ДО ПОСЛЕДНЕГО ХАЙПИТ,Кузьма,2017-12-30,415864,45380,2869,2134,RU,Comedy
yUj3bz4GYEc,ДИЗЕЛЬ ШОУ 2018 Новогодний концерт - полный выпуск - ЛУЧШИЕ ПРИКОЛЫ ГОДА - 4 часа ЮМОР ICTV,ДИЗЕЛЬ ШОУ - ЮМОР ICTV - Официальный канал,2017-12-31,54743,613,56,51,RU,Comedy
jRt8AN9n15Y,НЕ БУДИ ОЛИВИЮ,TheBrianMaps,2017-12-30,1690812,154079,3773,18144,RU,Comedy
ocYl_WhZTCU,"Ֆուլ հաուս 7, Սերիա 25 / Full House",PanArmenian TV,2017-12-31,117985,2495,90,440,RU,Comedy
eIbln4u9SEk,РОЗЫГРЫШ ОЧЕНЬ МОЩНОГО КОМПЬЮТЕРА АФОНЯ TV,Афоня TV,2017-12-30,304473,95922,1424,104564,RU,Comedy
IfK2ScAoNwQ,ВЫБИРАЕМ КОСТЮМ НА НОВЫЙ ГОД,ЕГОР,2017-12-30,141010,21986,478,833,RU,Comedy
xqx0YkqzI0I,КОГДА НЕУДАЧНО ПОШУТИЛ,Black Horse,2017-12-30,418383,23579,644,666,RU,Comedy
Cjx1DB-7woA,ПРИКОЛЫ 2017 Декабрь #341 ржака до слез угар прикол - ПРИКОЛЮХА,Подборки Army Home,2017-12-30,146422,718,314,98,RU,Comedy
mskRiHxQqYg,Непосредственно Каха. Каха поздравляет все нации с Новым Годом.,KTV,2017-12-31,102412,5540,223,228,RU,Comedy
Ef18hZr_Nz0,КАЖДЫЙ НОВЫЙ ГОД ТАКОЙ!!!,Nastia Rizik,2017-12-31,120854,8267,190,2097,RU,Comedy
NiZ1CTMGGUI,Полный выпуск Новогоднего Вечернего Квартала 2018,Студия Квартал 95 Online,2017-12-31,77286,1394,137,191,RU,Comedy
tDvN1xleZ5k,Пять странностей новогоднего обращения Петра Порошенко,Aleksandr Semchenko,2017-12-31,26349,2196,52,478,RU,Comedy
GZDglvV8Mbw,КВН 2017 Высшая лига Финал (01.01.2018) ИГРА ЦЕЛИКОМ Full HD,Официальный канал КВН,2018-01-01,401506,4691,4762,3880,RU,Comedy
E2oLysWA1i0,[BadComedian] - Ёлки 5 (Новогодний обзор),BadComedian,2017-12-31,2783416,263018,3580,17130,RU,Comedy
bEStKwxmPIE,"Мандарины, вперед! - Уральские Пельмени (Новый год 2018)",Уральские Пельмени,2017-12-31,804026,9900,1625,1309,RU,Comedy
ZvDc0135OxA,"РАЗБОРКА В САН-ФРАНЦИСКО (2018, боевик / комедия)",Юрий Хованский,2018-01-01,394833,58414,2664,6276,RU,Comedy
pwGVN1BBmBA,Неправильный американец на их ТВ,Анатолий Шарий,2018-01-01,237624,27042,482,3241,RU,Comedy
kXq-2l7cYA8,"КОРОЧЕ ГОВОРЯ, Я В БУДУЩЕМ",OneTwo,2018-01-01,441904,88172,1028,3299,RU,Comedy
Qk_b4bHKyNc,Лахзахои Гуворо - Карзи Падар 2018 | Соли Нави 2018,Sitora Tv,2018-01-01,60176,370,123,57,RU,Comedy
QsYISEg2sK8,100 мунот кулку😀ыр менен✔️ 2018 - Мыскыл жана Тамаша | Куудул Тамаша | 2018,Акыркы Кабарлар - Санжар Калматай,2018-01-01,46631,644,166,283,RU,Comedy
P-fUUniIc0U,Zo'r Yangi Yil (Musiqiy badiy film),OSHLIVE TV,2018-01-01,41265,346,53,37,RU,Comedy
i7IehavUYFk,Новогодний спешл - [Бумага],Мартеллиада,2017-12-31,249836,42894,286,2238,RU,Comedy
ZjPdK_7e9fc,ПУТИН ОПОЗОРИЛСЯ НА НОВЫЙ ГОД,КРИМИНАЛЬНАЯ РОССИЯ,2018-01-01,74003,1066,637,470,RU,Comedy
NiZ1CTMGGUI,Полный выпуск Новогоднего Вечернего Квартала 2018,Студия Квартал 95 Online,2017-12-31,631677,6491,813,828,RU,Comedy
tDvN1xleZ5k,Пять странностей новогоднего обращения Петра Порошенко,Aleksandr Semchenko,2017-12-31,98346,3844,117,689,RU,Comedy
-4w78wPaEqs,ТИПЫ ЛЮДЕЙ В НОВОГОДНЮЮ НОЧЬ,Максим Старосвитский,2017-12-31,364244,20543,463,1675,RU,Comedy
3faDpYcyOW8,ПРИКОЛЫ 2017 Декабрь #342 ржака до слез угар прикол - ПРИКОЛЮХА,Подборки Army Home,2017-12-31,126798,739,157,96,RU,Comedy
kNS6ZVCeXXE,НЕВЫШЕДШИЕ РОЛИКИ ЗА 2017 ГОД,Кузьма,2017-12-31,193453,18615,306,795,RU,Comedy
MSCWzojNbtI,"Новый год 2018 с Дизель шоу - новогодний выпуск, часть 1 - декабрь | Дизель cтудио - новогодняя ночь",Дизель Студио,2017-12-31,175377,1435,150,154,RU,Comedy
ipqAvQRZnIw,Очень новогодние дела (Переозвучка),TheNafig,2017-12-31,259900,32973,301,664,RU,Comedy
WrwjVAIqjE0,Влюбленные на отдыхе: конкурс на лучшую пару в отеле – Дизель Шоу | ЮМОР ICTV НОВЫЙ ГОД,ДИЗЕЛЬ ШОУ - ЮМОР ICTV - Официальный канал,2017-12-31,77302,658,59,45,RU,Comedy
ah5aXFfwJ9M,BEST CUBE # 211,Best VIDEOS Лучшее видео,2018-01-01,99088,3496,533,250,RU,Comedy
YzViV0fa1Rg,ROLLS-ROYCE PHANTOM ЗА 200.000 РУБЛЕЙ! (ВЕСЁЛЫЕ ОБЪЯВЛЕНИЯ),Bulkin,2018-01-01,146106,18231,398,1056,RU,Comedy
gWuvSU2bWXQ,Похмельный Супчик на 1-е Января,Borsch,2018-01-01,54604,4369,102,520,RU,Comedy
ocYl_WhZTCU,"Ֆուլ հաուս 7, Սերիա 25 / Full House",PanArmenian TV,2017-12-31,345396,4088,200,736,RU,Comedy
GZDglvV8Mbw,КВН 2017 Высшая лига Финал (01.01.2018) ИГРА ЦЕЛИКОМ Full HD,Официальный канал КВН,2018-01-01,1115520,8739,10031,7059,RU,Comedy
nWgtU79p3m4,Человек - фирма,МЁD,2018-01-02,261900,24369,475,619,RU,Comedy
9ERfTfEYIWE,Дело Нoздрoвской или следствие ведут активисты,Анатолий Шарий,2018-01-02,334253,21671,523,2534,RU,Comedy
PALcJ0HW1-I,WALK IN THE WOODS WITH A LOGAN PAUL MEME,PewDiePie,2018-01-02,2619160,235285,11430,20462,RU,Comedy
jSRFQC0LdmA,ДЕД-МОРОЗ-ЕДИНОРОСС,kamikadzedead,2018-01-02,176916,36378,41793,7629,RU,Comedy
m8yUGHZbtTE,"$40, или Почему нарушают режим тишины",Aleksandr Semchenko,2018-01-02,50427,2407,52,410,RU,Comedy
ZjPdK_7e9fc,ПУТИН ОПОЗОРИЛСЯ НА НОВЫЙ ГОД,КРИМИНАЛЬНАЯ РОССИЯ,2018-01-01,127543,1827,2326,768,RU,Comedy
E2oLysWA1i0,[BadComedian] - Ёлки 5 (Новогодний обзор),BadComedian,2017-12-31,3209881,287163,4159,18223,RU,Comedy
bEStKwxmPIE,"Мандарины, вперед! - Уральские Пельмени (Новый год 2018)",Уральские Пельмени,2017-12-31,1252459,12683,2333,1738,RU,Comedy
6A6Ps37BF2s,Импровизация 3 сезон 27 серия (31.12.17 год ) НОВОГОДНИЙ ВЫПУСК,Юмор Тв,2018-01-02,13641,220,12,7,RU,Comedy
ZvDc0135OxA,"РАЗБОРКА В САН-ФРАНЦИСКО (2018, боевик / комедия)",Юрий Хованский,2018-01-01,561335,74321,3542,7948,RU,Comedy
Qk_b4bHKyNc,Лахзахои Гуворо - Карзи Падар 2018 | Соли Нави 2018,Sitora Tv,2018-01-01,92139,515,174,78,RU,Comedy
99aMmjLSlb8,Самые угарные приколы – 2017 - 2018 – МЕГАРЖАКА – концерт Дизель Шоу | ЮМОР ICTV,ДИЗЕЛЬ ШОУ - ЮМОР ICTV - Официальный канал,2018-01-02,55382,564,59,47,RU,Comedy
P-fUUniIc0U,Zo'r Yangi Yil (Musiqiy badiy film),OSHLIVE TV,2018-01-01,91974,601,114,65,RU,Comedy
kXq-2l7cYA8,"КОРОЧЕ ГОВОРЯ, Я В БУДУЩЕМ",OneTwo,2018-01-01,555302,99309,1240,3757,RU,Comedy
hH3iPGnRwmg,#СИТКОМ ШИЗОФРЕНИЯ - СЕРИЯ ПРО МОТИВАЦИЮ (18+),TheBroadwayShow,2018-01-02,33024,6871,37,264,RU,Comedy
eiOYMIQK8MQ,КЛИПЫ ЛЕТСПЛЕЙЩИКОВ: STAVR - Я ФИФЕР (ft. Sovergon),D.K. Inc.,2018-01-03,556886,81113,3764,5915,RU,Comedy
XkhRy9ilWp4,"Список продуктов на Новый год - Мандарины, вперед! - Уральские Пельмени (Новый год 2018)",Уральские Пельмени,2018-01-03,134955,2498,612,317,RU,Comedy
qbfv7fehp0c,40-лeтние дeти или истоpия однoго бeзyмия,Анатолий Шарий,2018-01-03,419831,29782,957,4858,RU,Comedy
PALcJ0HW1-I,WALK IN THE WOODS WITH A LOGAN PAUL MEME,PewDiePie,2018-01-02,5792100,367459,22386,35704,RU,Comedy
nWgtU79p3m4,Человек - фирма,МЁD,2018-01-02,370279,30199,664,733,RU,Comedy
GZDglvV8Mbw,КВН 2017 Высшая лига Финал (01.01.2018) ИГРА ЦЕЛИКОМ Full HD,Официальный канал КВН,2018-01-01,1494831,10707,13313,8463,RU,Comedy
bxBiLqa1TAU,СТРИМ С ХОВАНСКИМ: РАЗОБЛАЧЕНИЕ ЛАКИ ЛИ,Anton Power,2018-01-03,20717,1145,213,37,RU,Comedy
bZp8sqPu_XE,ПРИКОЛЫ 2017 Январь #343 ржака до слез угар прикол - ПРИКОЛЮХА,Подборки Army Home,2018-01-03,73679,620,224,96,RU,Comedy
u5xMmc_piWY,"ТОП 5 САМЫХ ГНИЛЫХ русских клипов 2к17 (FACE, АТЕВА, ОЛЬГА БУЗОВА)",Онтон Болотов,2018-01-03,20944,3710,120,175,RU,Comedy
jSRFQC0LdmA,ДЕД-МОРОЗ-ЕДИНОРОСС,kamikadzedead,2018-01-02,229034,42193,52499,8929,RU,Comedy
bK4j7vt-XTw,Полный выпуск Новогоднего Вечернего Квартала 2018,Студия Квартал 95 Online,2018-01-03,40846,761,85,125,RU,Comedy
jOK0VnQCmi0,Знакомство с родителями девушки - ТОП-4 МЕГАРЖАЧНЫЕ ИСТОРИИ - Дизель Шоу лучшее | ЮМОР ICTV,ДИЗЕЛЬ ШОУ - ЮМОР ICTV - Официальный канал,2018-01-03,28283,506,23,53,RU,Comedy
2FOEfCcsqhw,"Gym and Workout Fails: New Year, New Me (January 2018) | FailArmy",FailArmy,2018-01-03,657172,16414,591,579,RU,Comedy
APdHqZrTZgg,ЖАРАЙТ СИТИ / НОВОГОДНИЙ ВЫПУСК,1.1TV,2018-01-03,41954,1622,80,282,RU,Comedy
EfRYxQW-Yy8,"Короче говоря, 31 декабря",Room Factory,2018-01-04,532055,44282,1335,2415,RU,Comedy
6HhXsTSoVFc,Машина ассенизаторов натолкнула на мысль по Ноздровской,Анатолий Шарий,2018-01-04,230874,18340,371,2650,RU,Comedy
rvqr2RL_A2U,ГНОЙНЫЙ (СЛАВА КПСС) ЗА 1 МИНУТУ,DegraTube,2018-01-04,191969,14961,2707,1029,RU,Comedy
y1pWOSUdTPo,ТОПОВЫЕ БЛОГЕРЫ В МИРЕ ГАРРИ ПОТТЕРА,Кузьма,2018-01-04,181361,27919,1591,2592,RU,Comedy
UyPhyh_SalU,"Тост за женщин - Мандарины, вперед! - Уральские Пельмени (Новый год 2018)",Уральские Пельмени,2018-01-04,112332,2460,191,140,RU,Comedy
eiOYMIQK8MQ,КЛИПЫ ЛЕТСПЛЕЙЩИКОВ: STAVR - Я ФИФЕР (ft. Sovergon),D.K. Inc.,2018-01-03,828142,98908,5569,7965,RU,Comedy
vwOidFlFyVU,ИСТОРИЯ БЕЗ НОВОГОДНЕГО ЧУДА,kamikadzedead,2018-01-04,149009,25939,31117,8852,RU,Comedy
bZp8sqPu_XE,ПРИКОЛЫ 2017 Январь #343 ржака до слез угар прикол - ПРИКОЛЮХА,Подборки Army Home,2018-01-03,163421,944,542,161,RU,Comedy
bK4j7vt-XTw,Полный выпуск Новогоднего Вечернего Квартала 2018,Студия Квартал 95 Online,2018-01-03,241096,2086,331,326,RU,Comedy
adTrfhjecJs,Порошенко поставил раком каждую третью корову в Украине,Aleksandr Semchenko,2018-01-04,57483,2929,38,647,RU,Comedy
Oy4PQvke7Rc,Avaz Oxun - 7-dan 70-gacha nomli konsert dasturi 2017,YangiKulgu,2018-01-04,127341,2483,210,411,RU,Comedy
_DeaErzK8vA,"КОРОЧЕ ГОВОРЯ, Я ХУДЕЮ",OneTwo,2018-01-05,484840,28164,1352,2197,RU,Comedy
BdkWd8fnu0A,Габриель поддержал нас!,Анатолий Шарий,2018-01-05,411447,21712,1143,2283,RU,Comedy
1kh9P7BZQjY,ГОТОВИМ ДЕТЕЙ К ВОЙНЕ!,kamikadzedead,2018-01-05,167383,36734,34505,13185,RU,Comedy
Eqj3UZVQbKM,"Meltdown Wish List | Comics, Beer & Sci-fi","Comics, Beer & Sci-fi",2017-12-25,21788,12,87,23,RU,Comedy
EfRYxQW-Yy8,"Короче говоря, 31 декабря",Room Factory,2018-01-04,858735,56953,2117,2861,RU,Comedy
yFdkExW3nfc,ПРИКОЛЫ 2017 Январь #344 ржака до слез угар прикол - ПРИКОЛЮХА,Подборки Army Home,2018-01-04,130081,738,188,89,RU,Comedy
rvqr2RL_A2U,ГНОЙНЫЙ (СЛАВА КПСС) ЗА 1 МИНУТУ,DegraTube,2018-01-04,281244,18239,3541,1341,RU,Comedy
Km9V6hfj8qU,"КОРОЧЕ ГОВОРЯ, Я ЗАБОЛЕЛ",DANIK,2018-01-05,76775,3056,225,1663,RU,Comedy
UyPhyh_SalU,"Тост за женщин - Мандарины, вперед! - Уральские Пельмени (Новый год 2018)",Уральские Пельмени,2018-01-04,247158,3444,400,196,RU,Comedy
y1pWOSUdTPo,ТОПОВЫЕ БЛОГЕРЫ В МИРЕ ГАРРИ ПОТТЕРА,Кузьма,2018-01-04,333735,40117,2546,3675,RU,Comedy
cr8Y4CnQ_pg,Суп Харчо | Рецепт настоящего Грузинского Харчо,Borsch,2018-01-05,44709,3822,106,714,RU,Comedy
BsDh-DAuSw4,LIKE A BOSS COMPILATION #13,ТЕРРИТОРИЯ СМЕХА,2018-01-05,252530,9261,296,1173,RU,Comedy
hUbXHbIDLPk,Как же тяжко стриптизерше на работе - На Троих ЛУЧШЕЕ | ЮМОР ICTV,ДИЗЕЛЬ ШОУ - ЮМОР ICTV - Официальный канал,2018-01-05,32629,545,68,54,RU,Comedy
F-I33JQZQX8,"Фейс хочет избить ИВАНГАЯ // Марьяна Ро, FACE, EeOneGuy ( Ивангай, Ваня Рудской )",ХОЛМИ,2018-01-05,12216,679,71,234,RU,Comedy
PfP4q-50zy8,Зам Пашинского заговорил по-русски,Aleksandr Semchenko,2018-01-05,59139,2555,35,296,RU,Comedy
wMSfpAMxM5M,ДЕТСКИЕ ТРЭШ ИГРЫ: Новогодний утренник боли,КЛИККЛАК,2018-01-06,1071631,106700,2291,4810,RU,Comedy
enVhAXYosY8,55x55 - ПЕСНЯ ПРО ЮТУБ. ПАРОДИЯ #17,Satyr,2018-01-06,344761,70978,1670,3984,RU,Comedy
66K_dee6hUc,Праздник зернышка и изюмчика,Анатолий Шарий,2018-01-06,284564,20299,1625,6689,RU,Comedy
jWvUNlyKkD4,ХОРОВОД ВОКРУГ СТОЛБА и прочие радости,kamikadzedead,2018-01-06,169549,35418,33081,12953,RU,Comedy
AYpx6UbWux4,"Новогодний корпоратив - Мандарины, вперед! - Уральские Пельмени (Новый год 2018)",Уральские Пельмени,2018-01-06,142526,2575,266,141,RU,Comedy
jrTWrWxBAVw,ЭКСКЛЮЗИВ 2018//ТЫНАР РАХМАНДАН ЧЫК ЭШИКЕ АТТУ СУПЕР САТИРАСЫ,Super Tamashalar,2018-01-06,54560,999,128,154,RU,Comedy
gTM9-bg9A8A,Зайка ZOOBE С Рождеством Христовым дорогие!,Зайка Julia ZOOBE,2018-01-06,66880,518,154,53,RU,Comedy
0l89AXDov1k,ВЫБИРАЕМ ЛУЧШУЮ КОЛБАСУ,Кузьма,2018-01-06,263970,36032,850,1997,RU,Comedy
mallo7HUa-w,ТИПЫ ЛЮДЕЙ ПЕРЕД СНОМ,Mr. Dim4ik,2018-01-06,127707,12686,732,2248,RU,Comedy
mm2JdmyWcSQ,Однажды в России 79 76 Полный выпуск - картункова-азамат мусагалиев-ольга картункова 2018,Кунг фу Панда 3 FUTURE Василий,2018-01-06,23866,85,40,5,RU,Comedy
5k3XC10Wvj8,КҮЛКҮ😀 аралаш ЫРДЕСТЕ✔️ - 2018 Мыскыл жана Тамаша - 2018 |  Куудул Тамаша | 2018,Акыркы Кабарлар - Санжар Калматай,2018-01-06,46115,340,127,156,RU,Comedy
TUq5Y106ZXw,ПРИКОЛЫ 2018 Январь #345 ржака до слез угар прикол - ПРИКОЛЮХА,Подборки Army Home,2018-01-05,123192,825,259,97,RU,Comedy
_DeaErzK8vA,"КОРОЧЕ ГОВОРЯ, Я ХУДЕЮ",OneTwo,2018-01-05,608800,31337,1732,2465,RU,Comedy
FoIi4jqY5JY,Новый Рассмеши Комика 2018 - 14 сезон - выпуск #17,Рассмеши Комика - Официальный Канал,2018-01-06,30314,430,45,82,RU,Comedy
gBCD6OjGIUI,Очередное дно! Каждый пятый украинец - предатель,Aleksandr Semchenko,2018-01-06,70921,3286,47,718,RU,Comedy
S43opZ6ksSo,"Борченов Шоу 1-чыгарылыш: Нурлан Насип, Кайрат Кыргыз",Фрунзе Life,2018-01-06,21485,1485,92,229,RU,Comedy
kMR3klOh7WU,Fails You Missed #24: Dangerous Animals (January 2018) | FailArmy,FailArmy,2018-01-06,600598,13638,1971,933,RU,Comedy
BwNFnkJ43zU,Смотритель маяка Навального,Анатолий Шарий,2018-01-07,357028,29717,3904,6926,RU,Comedy
2IJ6vKs7xN8,"Новый год без родителей - Мандарины, вперед! - Уральские Пельмени (Новый год 2018)",Уральские Пельмени,2018-01-07,210451,3999,334,250,RU,Comedy
enVhAXYosY8,55x55 - ПЕСНЯ ПРО ЮТУБ. ПАРОДИЯ #17,Satyr,2018-01-06,770321,105062,3872,5788,RU,Comedy
y1FoLfXSJ94,МАРЬЯНА РО - МЕГА-ЗВЕЗДА RYTP / ПУП,InEx RYTP,2018-01-07,78846,13057,457,1351,RU,Comedy
mLmJP8z4K_c,"Филарет рассказал, как пьёт Порошенко, и чьими молитвами растёт Киевский патриархат",Aleksandr Semchenko,2018-01-07,87465,3439,130,699,RU,Comedy
gdGwyPlfAJQ,КОММУНИСТЫ ПОЗДРАВЛЯЮТ С РОЖДЕСТВОМ и прочая дичь,kamikadzedead,2018-01-07,168269,34590,25828,10808,RU,Comedy
wMSfpAMxM5M,ДЕТСКИЕ ТРЭШ ИГРЫ: Новогодний утренник боли,КЛИККЛАК,2018-01-06,1582163,135883,3539,6019,RU,Comedy
Kua96zQsw7w,Super Mama 2 / Սուպեր Մամա 2 / Супер Мама 2 (2017/Фильм Full),MT PRODUCTION,2018-01-07,393435,8037,360,1013,RU,Comedy
Re1XMqxuKEw,Мама выбирает жениха для дочери | Дизель шоу,Дизель Студио,2018-01-07,47700,985,38,66,RU,Comedy
jrTWrWxBAVw,ЭКСКЛЮЗИВ 2018//ТЫНАР РАХМАНДАН ЧЫК ЭШИКЕ АТТУ СУПЕР САТИРАСЫ,Super Tamashalar,2018-01-06,93209,1356,217,244,RU,Comedy
xSqupUGj_M4,Ортик Султонов - Зокир Очилдиев - Савол жавоб курсатувига пародия (Хандалак),YangiKulgu,2018-01-07,72838,471,51,26,RU,Comedy
5t0rrCTmUwE,БИТВА ЗА ЛЮБОВЬ,Евгений Вольнов,2018-01-07,26767,2306,225,931,RU,Comedy
wHC2iXTGkSM,ЛУЧШИЕ ПРИКОЛЫ 2018 Январь ржака до слез угар видео прикол - ПРИКОЛЮХА # 100,ТЕМНАЯ СТОРОНА 2.0,2018-01-07,21229,617,84,129,RU,Comedy
QC2Z8_6a8_s,Кшиштан о фильме ДВИЖЕНИЕ ВВЕРХ,Канал Кшиштовского,2018-01-08,222330,24010,1390,2259,RU,Comedy
MnN2bNOalPU,Мы опять вступим в ЕС,Анатолий Шарий,2018-01-08,459765,24988,1117,2990,RU,Comedy
nzxJZfUIg5c,"КОНЕЦ СВЕТА, ДЕНЬГИ и ПАТРИАРХ КИРИЛЛ",kamikadzedead,2018-01-08,219307,37308,45711,10756,RU,Comedy
1wp63kXmEp4,"Новый год по-кавказски - Мандарины, вперед! - Уральские Пельмени (Новый год 2018)",Уральские Пельмени,2018-01-08,82512,1877,213,168,RU,Comedy
h8KkdGGY_1A,Светофор 10 сезон 3 серия  комедийный сериал HD,Светофор (сериал),2018-01-08,15313,231,6,14,RU,Comedy
T7UQyJweWHs,Антиправославная волна в СМИ. Кто и зачем?,Aleksandr Semchenko,2018-01-08,38105,2075,63,391,RU,Comedy
y1FoLfXSJ94,МАРЬЯНА РО - МЕГА-ЗВЕЗДА RYTP / ПУП,InEx RYTP,2018-01-07,153223,18502,900,1828,RU,Comedy
gm6WwGC3yiY,Ей Говорили- Давай НАГИБАЙСЯ!! Она Наклонялась НА РАБОТЕ и СОХРАНЯЛА МОЛОДОСТЬ! Секрет молодости.,1 782 987 подписчиков,2018-01-08,49046,1397,16,47,RU,Comedy
enVhAXYosY8,55x55 - ПЕСНЯ ПРО ЮТУБ. ПАРОДИЯ #17,Satyr,2018-01-06,969936,118017,4586,6390,RU,Comedy
ngSvR-ZSvfQ,#СИТКОМ ШИЗОФРЕНИЯ - СЕРИЯ ПРО ЛУЧШЕ ВСЕХ,TheBroadwayShow,2018-01-08,32738,5954,31,246,RU,Comedy
