video_id,title,channel_title,publish_time,views,likes,dislikes,comment_count,Region,category_title
CMRuwAxwFzk,Раскрутка и продвижение на YouTube,Раскрутка в YouTube,2017-11-13,23405,32,186,39,RU,Education
wIReYFIqFIc,Продолжаю осваивать Кэшбери. Инвестировал 30 000 рублей.,Кэшбери - развод или способ заработка?,2017-11-13,76854,57,1139,274,RU,Education
Mep50x4zzXY,ВКурлык / интервью с Пахомом,Школа Пахома,2017-11-13,34858,934,52,133,RU,Education
"#NAME?",HextraCoin – инвестиция 1100$ в мощный аналог BitConnect.,КриптоЛихорадка,2017-11-13,4606,178,3,20,RU,Education
m5WFp9JbO5o,ЗАЧЕМ всё ЭТО надо? Ткачёв Андрей,Ткачёв Проповеди Православие,2017-11-14,10577,202,8,11,RU,Education
67RxkpGKTGo,Притча про свое и чужое,Эра Водолея,2017-11-14,7659,519,11,22,RU,Education
nw0QUygx4tI,Первый шаг к достатку,ПЯТОЕ ИЗМЕРЕНИЕ,2017-11-14,8539,683,18,37,RU,Education
gvTbIdKFJMM,CRISPR Editing DNA in Real Time,Biohack Info,2017-11-14,2075,11,0,1,RU,Education
3O4u8xrmMUc,СТИХ ПРО МАМУ ДО СЛЁЗ...,Maks TV,2017-10-21,4578,246,1,44,RU,Education
FtNThF_oDmw,Стероиды Больше Не Принимаю,Aesthetic,2017-11-15,2385,53,2,18,RU,Education
"#NAME?",Как Ксения Собчак уходит от вопросов у Дудя на интервью. Вербальный анализ,MENTAL TV,2017-11-16,92661,6880,284,563,RU,Education
YexFtxrIMxs,Как творить на уровне мыслей,Эра Водолея,2017-11-16,8996,765,11,26,RU,Education
kuFqAGwXzFM,"NOGIRON KELIN, ORZU HAVASLI QAYNONA, E'TIBORSIZ ONA MASHMASHASI",Chef Odinahon,2017-11-17,2914,30,3,0,RU,Education
_prkaLz5PkI,"Ответы на вопросы от 11.11.2017 (прот. Владимир Головин, г. Болгар)",golovinBolgar,2017-11-16,8179,345,15,0,RU,Education
GPZ2JuStQY0,Позвольте этому происходить,ПЯТОЕ ИЗМЕРЕНИЕ,2017-11-16,6191,509,8,23,RU,Education
eob07qVz8JM,"наращивание ногтей, сама себе) Мрамор на ногтях. Дизайн ногтей 37",Verakso,2017-11-16,6892,646,6,54,RU,Education
Cch2K_Y_63E,✿ LET`S COOK ✿ Голландский соус / Голландез / Топлёное масло ♥,Маша Zолина,2017-11-15,16565,1694,10,0,RU,Education
ujUG9ZN0kZI,Вручение Ордена Дружбы. Осипов Алексей. Владимир Путин 15 11 2017,Ткачёв Проповеди Православие,2017-11-16,4545,597,6,74,RU,Education
"#NAME?",Как Ксения Собчак уходит от вопросов у Дудя на интервью. Вербальный анализ,MENTAL TV,2017-11-16,180142,10022,470,711,RU,Education
UBMxz71YxWo,СЛЕНДЕРМЕН VS БЕНДИ И ЧЕРНИЛЬНАЯ МАШИНА | СУПЕР РЭП БИТВА | Bendy and the ink song VS Slenderman,ДАМБО MUSIC,2017-11-17,31055,2175,231,3716,RU,Education
kuFqAGwXzFM,"NOGIRON KELIN, ORZU HAVASLI QAYNONA, E'TIBORSIZ ONA MASHMASHASI",Chef Odinahon,2017-11-17,19288,75,10,0,RU,Education
PAavc_42GDY,Выступление профессора Осипова А.И. в Екатерининском зале Кремля 15 ноября 2017 года,Алексей Ильич Осипов,2017-11-16,17413,1609,33,175,RU,Education
uVFWU4YwdHg,"Русское оружие будущего: на море, на суше, в воздухе (17.11.2017)",Военное телевидение,2017-11-17,8178,80,12,11,RU,Education
VJs_8vlPBB0,"Правильный стык, между ВАННОЙ и ПЛИТКОЙ",ДНЕВНИК ДИЗАЙНЕРА,2017-11-19,15744,1920,49,116,RU,Education
rOyE8yg-xvg,Ксенон - САМЫЙ ЯРКИЙ ГАЗ НА ЗЕМЛЕ!,Thoisoi,2017-11-18,142024,9034,150,346,RU,Education
cXNqK6muyfk,Злые будут Преуспевать. Наше Поражение. Не обольщайся о себе. Ткачёв Андрей 18 11 2017,Ткачёв Проповеди Православие,2017-11-18,9547,403,7,21,RU,Education
kdd1CuJXkTE,Мы сами отдаем свою энергию,Эра Водолея,2017-11-18,10800,747,3,40,RU,Education
5pPRE80q9iI,Постскриптум (18.02.2017),Постскриптум с Алексеем Пушковым,2017-11-18,132715,1376,170,644,RU,Education
VJs_8vlPBB0,"Правильный стык, между ВАННОЙ и ПЛИТКОЙ",ДНЕВНИК ДИЗАЙНЕРА,2017-11-19,77362,5223,318,368,RU,Education
yShTAMDvoWQ,✿ LET`S COOK ✿ Яйцо ПАШОТ и Яйца БЕНЕДИКТ / Учу Карину готовить ♥,Маша Zолина,2017-11-19,11402,1347,14,0,RU,Education
5pPRE80q9iI,Постскриптум (18.02.2017),Постскриптум с Алексеем Пушковым,2017-11-18,181821,1662,234,876,RU,Education
yt1Xtu3smRo,#3 Вывод денег. Покупка акций Кэшбери. РОЗЫГРЫШ 1000 РУБЛЕЙ!!,Влад Филатов Кэшбери - развод или способ заработка?,2017-11-20,79852,21,502,139,RU,Education
h2fNHi6cOBo,Страшный сон Евросоюза.М.Хазин,Navy Catran,2017-11-20,7554,70,15,21,RU,Education
VJs_8vlPBB0,"Правильный стык, между ВАННОЙ и ПЛИТКОЙ",ДНЕВНИК ДИЗАЙНЕРА,2017-11-19,99503,6162,409,402,RU,Education
wBH93Tbkj1k,Ангельский мир. Демоны. Ткачёв Андрей,Ткачёв Проповеди Православие,2017-11-21,4333,258,6,15,RU,Education
KgooT_TJxzM,Как поверить в исполнение мечты? Как повысить уровень веры?,WOMANUR Ада Кондэ,2017-11-21,6957,432,4,18,RU,Education
iH-mFj5wGfk,Встреча в будние дни 2017-11-20,Programas Teocraticos,2017-11-21,8213,112,11,0,RU,Education
skyPxBjmNmQ,Седьмая Вебмастерская. Запись трансляции,Создание и продвижение сайтов,2017-11-22,11170,102,57,10,RU,Education
8jYaU027ZLE,Духовное лечение. Есть ли смыл в телесном исцелении? (прот. Владимир Головин),golovinBolgar,2017-11-22,10648,573,6,0,RU,Education
bCEaj4PV9BA,"Канбан от Мегаплана. Доска визуальных карточек, которая сделает продажи прозрачными.",Мегаплан - Двигатель бизнеса,2017-11-23,52617,51,203,33,RU,Education
_3a8H16_avc,Пенсионерам могут выплатить ЕДВ в размере 10 000 рублей,Kommentarii,2017-11-23,10051,137,14,19,RU,Education
FQpDj4prDcU,КРУТЫЕ НОВИНКИ ❤❤❤ Вязание Knit Mom,Моё Вязание Knit Mom,2017-11-23,7557,564,19,63,RU,Education
pQWrqUHveAw,Ответы на Вопросы 23 11 2017  Ткачёв Андрей. Часть 7,Ткачёв Проповеди Православие,2017-11-23,7437,333,9,24,RU,Education
kPfx2LyCk_4,Родственные Связи. Тотальная Слабость. Ткачёв Андрей. Сборник (2017),Ткачёв Проповеди Православие,2017-11-24,5545,208,9,9,RU,Education
YRX9z-HowEs,Страшное дело с Игорем Прокопенко. Часть 2 (24.11.2017),Военное телевидение,2017-11-24,8347,78,8,14,RU,Education
ey-si6uzgE0,Матросы-балтийцы и штурм Зимнего дворца,Цифровая История,2017-11-24,4694,401,3,29,RU,Education
DG9xrqDXMYQ,Паника в Сбербанке по заявлениям о конвертации по коду 810,Правовед ТВ,2017-11-23,35370,1697,30,413,RU,Education
EzG_Sg5LWYA,Постскриптум (25.11.2017),Постскриптум с Алексеем Пушковым,2017-11-25,161240,1884,231,898,RU,Education
"#NAME?",Католический мир. Западное Общество. О Хворостовском 24 11 2017 Ткачёв Андрей,Ткачёв Проповеди Православие,2017-11-25,12790,286,22,45,RU,Education
EzG_Sg5LWYA,Постскриптум (25.11.2017),Постскриптум с Алексеем Пушковым,2017-11-25,237262,2341,347,1158,RU,Education
qmnHdhUgHRg,Иоанн ЗЛАТОУСТ. Ткачёв Андрей. Ответы на Вопросы,Ткачёв Проповеди Православие,2017-11-26,4768,197,9,14,RU,Education
PFHGRGFbAgo,Как НЕ разочароваться в мужчине?,2vmeste,2017-11-26,4627,258,9,23,RU,Education
cxAKDOe3lKI,Почему мы застреваем в негативности и как из этого выйти.,ТАТЬЯНА КОНКИНА - СЧАСТЬЕ И УСПЕХ ДЛЯ ВСЕХ.,2017-11-26,6936,717,8,105,RU,Education
sjXSh2yc4g4,SYNERGY GLOBAL FORUM 2017 Москва | Прямая трансляция открытия и выступление Ника Вуйчича,Университет СИНЕРГИЯ,2017-11-27,42269,1245,89,113,RU,Education
vP-H2chNXj4,Как долго я тебя ждала.,Лара Логинова-Таро,2017-11-27,7486,428,23,270,RU,Education
EIteQl_4Md0,Неделя быстрых денег с Максимом Темченко. Эфир 28.11 в 19 МСК,Максим Темченко,2017-11-28,6845,169,33,37,RU,Education
bpCbU_ILc0M,Рождественский ПОСТ. Головин Владимир,Ткачёв Проповеди Православие,2017-11-28,10401,335,13,12,RU,Education
ljk8TrHBlZY,✿ LET`S COOK ✿ Мой БОРЩ ♥,Маша Zолина,2017-11-28,21149,3743,31,0,RU,Education
Se3a4OJrwM4,Кэшбери Якутск,Кэшбери,2017-11-29,77736,88,409,92,RU,Education
3_VvyH1RV4s,Как научиться принимать себя и жизнь,Эра Водолея,2017-11-29,10357,842,7,27,RU,Education
0M_p5_0VKyk,Деньги могут приходить к вам легко,Пятое Измерение,2017-11-29,9148,695,17,47,RU,Education
iBfggPkXbjQ,10 способов заработка на живописи,jivopismaslom,2017-11-29,2931,65,3,2,RU,Education
GLZ4beUZ8Qs,Кому из пенсионеров увеличат пенсии после принятия бюджета на 2018 год,Kommentarii,2017-11-29,12751,84,8,4,RU,Education
wiM6c2fQnxQ,Бизнес Академия Кэшбери Урок № 8,Кэшбери,2017-11-30,70367,3056,224,45,RU,Education
RZKw14H6NDQ,"Ответы на вопросы от 25.11.2017 (прот. Владимир Головин, г. Болгар)",golovinBolgar,2017-11-30,8111,372,8,0,RU,Education
ohV3AFL_H68,✿ LET`S COOK ✿ Свинина Терияки и Пак-Чой ♥,Маша Zолина,2017-11-30,10711,1285,2,0,RU,Education
bGnprMzJ9n0,Что ждет Вас в личной жизни в 2018,Лара Логинова-Таро,2017-12-01,7414,406,30,185,RU,Education
Mkf_p6qdKqg,Правду нужно говорить с любовью (прот. Владимир Головин),golovinBolgar,2017-12-01,4640,261,4,0,RU,Education
dGmbqpihqD0,Постскриптум (02.12.2017),Постскриптум с Алексеем Пушковым,2017-12-02,162552,1657,237,943,RU,Education
5yc5diak1XA,Розыгрыш IPhoneX,Бизнес Молодость,2017-12-02,32439,1838,448,530,RU,Education
Dm5RwfLQMDM,В преддверии праздника Введения во храм Пресвятой Богородицы. Ткачёв Андрей,Ткачёв Проповеди Православие,2017-12-02,10229,444,7,26,RU,Education
TCMYvc9rsFQ,Таро гороскоп на неделю с 04 по 10 декабря | Все знаки зодиака | Ольга Герасимова,Академия таро и нумерологии Ольги Герасимовой,2017-12-02,6230,239,21,19,RU,Education
dGmbqpihqD0,Постскриптум (02.12.2017),Постскриптум с Алексеем Пушковым,2017-12-02,228059,1999,373,1193,RU,Education
gnc2N6NvDmY,Введение во храм Пресвятой Богородицы. Головин Владимир,Ткачёв Проповеди Православие,2017-12-03,5938,236,9,28,RU,Education
1TDDkYtBaNI,Слово на Введение во Храм Пресвятой Богородицы. Ткачёв Андрей,Ткачёв Проповеди Православие,2017-12-04,9558,182,8,4,RU,Education
Ff3NQxRyVoY,Воронеж: хотели бы здесь жить?,varlamov,2017-12-04,14687,950,65,459,RU,Education
TGIYEcamfkc,История против Эрнесто Че Гевары[Ted Ed],In Cor Cadit,2017-12-04,27130,2731,56,141,RU,Education
f51XXhEurk4,Анонс нового эксперимента от PollmixaN,PollmixaN,2017-12-04,6402,881,6,201,RU,Education
ota-KhbShdQ,Была ли порча причиной разрыва?,Лара Логинова-Таро,2017-12-04,4770,204,15,92,RU,Education
_5W26FvvNSI,Потребительский кооператив  БЛАГО,Кэшбери,2017-12-05,59937,3193,215,35,RU,Education
I8Udx3qk3aE,"Епифанцев   о поехавших, говне и смысле жизни",Школа Пахома,2017-12-05,112438,2140,922,132,RU,Education
d4gkK-DnTNk,Где найти Христа? Что делать с Богатством? 3 12 2017 Ткачёв Андрей,Ткачёв Проповеди Православие,2017-12-05,7026,186,6,8,RU,Education
3DHfHdruTPY,О корнях человека,Эра Водолея,2017-12-05,8413,583,11,27,RU,Education
Ff3NQxRyVoY,Воронеж: хотели бы здесь жить?,varlamov,2017-12-04,24100,1273,107,605,RU,Education
M3oqZ8kdztU,Важность заботы о себе,Пятое Измерение,2017-12-05,7736,672,9,31,RU,Education
I8Udx3qk3aE,"Епифанцев   о поехавших, говне и смысле жизни",Школа Пахома,2017-12-05,143027,2393,1184,164,RU,Education
PZS8FZyIFrA,Диспрозий - САМЫЙ МУЗЫКАЛЬНЫЙ МЕТАЛЛ НА ЗЕМЛЕ!,Thoisoi,2017-12-06,115972,8806,178,373,RU,Education
ToGQTmBDnHA,Скрытые лючки в ванной,ДНЕВНИК ДИЗАЙНЕРА,2017-12-06,38917,2839,66,169,RU,Education
FAyBnrDu9_Q,«Хочу Денег» - Лекция Дмитрия Троцкого,Dmitry Trotsky,2017-12-06,9125,490,14,0,RU,Education
qlSqc3sVdsI,✿ LET`S COOK ✿ Кремовое зерно (полба) на гарнир ♥,Маша Zолина,2017-12-06,15185,1327,9,0,RU,Education
qVQY-fIvmGw,"Археологи объяснили, как СТРОИЛИ пирамиды",Удивительные Факты,2017-12-05,134713,2522,568,403,RU,Education
yIW3XfBO0po,Александр НЕВСКИЙ. Ткачёв Андрей,Ткачёв Проповеди Православие,2017-12-06,7881,356,9,13,RU,Education
prtwGRPv_B4,Что бездомные хотят на Рождество. Подарки бездомным. Добрые дела. Русская озвучка,LIVE Emotions,2017-12-06,6496,851,5,175,RU,Education
keCIcuyU48I,Бизнес Академия Кэшбери Урок № 9,Кэшбери,2017-12-07,49590,38,129,24,RU,Education
j8zG9gcc_Z4,Важные законы вселенной,Эра Водолея,2017-12-07,9002,1068,13,71,RU,Education
h_1woxGaKNs,Часики на ногтях. Комбинированный маникюр. Дизайн ногтей 40,Verakso,2017-12-07,9361,869,12,42,RU,Education
7jUGBI_K4rE,Бесплатный вебинар от Андрея Дуйко из Милана!,Андрей Дуйко/ Andrii Duiko,2017-12-08,6440,245,1,25,RU,Education
aGBSUTl80TQ,Постскриптум (09.12.2017),Постскриптум с Алексеем Пушковым,2017-12-09,165932,1904,327,1488,RU,Education
cfiT7eXVUTo,"Жесты, которые выдают неуверенность",MENTAL TV,2017-12-09,83221,7229,228,466,RU,Education
MboPKL2mDGs,Как создавать события в своей жизни,Эра Водолея,2017-12-09,12653,1034,15,38,RU,Education
idvsnXu3-xo,ЧЕРНОБЫЛЬ. Нам 30 лет ВРАЛИ!!!,Теперь я Знаю,2017-12-10,404011,16407,6129,2123,RU,Education
aGBSUTl80TQ,Постскриптум (09.12.2017),Постскриптум с Алексеем Пушковым,2017-12-09,228961,2270,459,1819,RU,Education
cfiT7eXVUTo,"Жесты, которые выдают неуверенность",MENTAL TV,2017-12-09,121671,9123,292,517,RU,Education
Q3uWzhvoy8E,Непредсказуемая Глупость опасна! Бисмарк о Потребительстве 10 12 2017 Ткачёв Андрей,Ткачёв Проповеди Православие,2017-12-10,6911,416,7,20,RU,Education
idvsnXu3-xo,ЧЕРНОБЫЛЬ. Нам 30 лет ВРАЛИ!!!,Теперь я Знаю,2017-12-10,803380,24417,18245,3225,RU,Education
G58dsjZxlWU,"ОН КУПИЛ СЕБЕ АВТОМОБИЛЬ И ОБНАРУЖИЛ ДЕФЕКТ В ДВЕРИ. УВИДЕВ, ЧТО НАХОДИТСЯ ВНУТРИ, МУЖИК ОСТОЛБЕНЕЛ!",Я В ШОКЕ!,2017-12-11,154355,976,134,176,RU,Education
iUYvGzmIONc,Граждане СССР нашли где находится Госбанк СССР!!!,Правовед ТВ,2017-12-12,3198,347,2,55,RU,Education
hGDEbHsXfdM,Ответы на Вопросы 11 12 2017 Ткачёв Андрей. Часть 8,Ткачёв Проповеди Православие,2017-12-11,6620,248,5,6,RU,Education
tvXXhsvJ6vg,Чем женщина ПРИТЯГИВАЕТ мужчину сильнее всего?,2vmeste,2017-12-11,8027,548,24,71,RU,Education
fmxtPHF3dw8,С января будет проиндексирована фиксированная выплата к страховой пенсии,Kommentarii,2017-12-11,6394,43,9,1,RU,Education
z5_pjjowrYo,Если бы ЧАЭС в Припяти НЕ ВЗОРВАЛАСЬ,Теперь я Знаю,2017-12-11,699412,55872,2032,5362,RU,Education
1L-ButZg5-M,Как творить словами,Эра Водолея,2017-12-12,10700,1001,16,48,RU,Education
qyTikFeH6Xo,Необычные СПЛАВЫ СОПРОТИВЛЕНИЯ! КАКОЙ ЛУЧШЕ?,Thoisoi,2017-12-12,79410,6319,145,257,RU,Education
DMpGoaJiRg0,Обзор гель-лаков TNL | Комбинированный маникюр и покрытие на клиенте,Алёна Sokololof,2017-12-12,10051,630,20,149,RU,Education
DaEcXY1qQrY,ЧТО НАХОДИТСЯ ПОД СТАНЦИЕЙ ЧЕРНОБЫЛЯ?,Теперь я Знаю,2017-12-13,239886,29032,862,4375,RU,Education
0XF96Rb537k,CashTrading,Кэшбери,2017-12-13,69239,160,304,55,RU,Education
OeJfbLiwcXI,Пенсионерам разрешат не платить Кредиты и Долги в 2018 году,Kommentarii,2017-12-13,9468,113,9,9,RU,Education
DaEcXY1qQrY,ЧТО НАХОДИТСЯ ПОД СТАНЦИЕЙ ЧЕРНОБЫЛЯ?,Теперь я Знаю,2017-12-13,728180,46263,2338,5178,RU,Education
u9-uREgJpes,"С 1939 ГОДА ЭТУ КВАРТИРУ НИКТО НЕ ОТКРЫВАЛ.  ЗАЙДЯ ВНУТРЬ СПУСТЯ 70 ЛЕТ, ЛЮДИ ПОТЕРЯЛИ ДАР РЕЧИ!",Я В ШОКЕ!,2017-12-15,4569,254,5,19,RU,Education
habRdJxE2JQ,Как сохранить свою энергию в социуме,Эра Водолея,2017-12-14,7998,818,18,62,RU,Education
fNvEytFzgh8,Картин старше 250 лет нет! [ложь Третьяковки],Разгадки истории,2017-12-14,1806,132,17,22,RU,Education
pVH2qVUlwGU,Выплаты Неработающим Пенсионерам Проиндексируют,Блог Юридической Помощи,2017-12-15,17871,322,18,18,RU,Education
k_bcg84qEhE,"Ответы на вопросы от 09.12.2017 (прот. Владимир Головин, г. Болгар)",golovinBolgar,2017-12-15,8757,344,12,0,RU,Education
u9-uREgJpes,"С 1939 ГОДА КВАРТИРУ НИКТО НЕ ОТКРЫВАЛ!  ЗАЙДЯ ВНУТРЬ СПУСТЯ 70 ЛЕТ, ЛЮДИ ПОТЕРЯЛИ ДАР РЕЧИ!",Я В ШОКЕ!,2017-12-15,34868,648,34,32,RU,Education
d23FsXl_D6w,КАК Я РАБОТАЛ ОХРАННИКОМ В ТЮРЬМЕ США,Теперь я Знаю,2017-12-15,135989,10843,449,466,RU,Education
rWegfpVUHbo,ДМИТРИЙ ТРОЦКИЙ: вечер вопросов и ответов.,Dmitry Trotsky,2017-12-15,9513,442,16,0,RU,Education
Y0fFbmf2Mak,Постскриптум  (16.12.2017),Постскриптум с Алексеем Пушковым,2017-12-16,136344,1799,176,626,RU,Education
_Lf4eHPcCaw,Использование слов в нашей жизни,Эра Водолея,2017-12-16,7864,656,7,19,RU,Education
YbSlspct0_A,В России перенесли повышение пенсий?,Блог Юридической Помощи,2017-12-16,21902,796,38,22,RU,Education
ghxymmIgOeg,aws training in bangalore | learnbay,Learnbay,2017-12-07,13701,1,0,0,RU,Education
SAG-ubBCD9A,Бизнес Академия Кэшбери Урок № 10,Кэшбери,2017-12-17,84365,60,335,95,RU,Education
eaLnrqWVWSI,"Стрим: Панчин, Шарифов, Топа, Агния Огонек, Соколов и Лидин - Премия имени Гарри Гудини",Houdini Prize,2017-12-17,14750,1293,36,19,RU,Education
Y0fFbmf2Mak,Постскриптум  (16.12.2017),Постскриптум с Алексеем Пушковым,2017-12-16,198291,2242,219,793,RU,Education
DQBOAuwvlpI,"ВАРВАРА. Если Жизнь прожита Плохо, Важно умереть Правильно! 16 12 2017 Ткачёв Андрей",Ткачёв Проповеди Православие,2017-12-17,16000,507,9,14,RU,Education
BPsrTdYHmzk,Сорву ли я джекпот в 2018? И снова про любовь...,Лара Логинова-Таро,2017-12-17,6100,312,34,113,RU,Education
eI78Nabagws,Пенсионерам 10000 рублей доплата,Kommentarii,2017-12-17,3674,46,21,4,RU,Education
HI8sBjxjfAU,Собственники автосервисов Вилгуд привезли новые товары из Китая,Дима Ковпак,2017-12-18,60681,1199,299,68,RU,Education
3eTFO16vbpU,СКОРПИОНЫ (не ГОРОСКОП),Smash,2017-12-18,58542,15756,81,992,RU,Education
iQNb7B6CwBA,Как определить ложь по невербальным сигналам,MENTAL TV,2017-12-18,32204,3896,40,269,RU,Education
dsiXBZ83Lb0,Пенсионеры озолотятся к 2020 году,Kommentarii,2017-12-18,2200,43,11,8,RU,Education
NMjFNfbNx3Q,Что такое 100000 подписчиков? КАК ИХ ДОСТИЧЬ? | Сходка!,PollmixaN,2017-12-18,28327,2971,58,418,RU,Education
Xp_pnZ_mBd8,Николай Чудотворец. Ткачёв Андрей,Дух Проповеди Православие,2017-12-18,3366,376,12,24,RU,Education
PWw7OuJyZpw,🎄СВЯЗАНО за 2017 📽 | Вязание Knit Mom,Вязать ПРОСТО с Knit Mom,2017-12-18,6598,395,10,49,RU,Education
w0_yhhzA09w,Free Psn - Psn Codes l How to get codes psn unlimited l get games ps4,lanitayallah13,2017-12-18,12801,513,2,1,RU,Education
Qfz8w4gRRRU,Rocket Daily: 230 - Strive,Kc Kelly - Rocketprenuer,2017-12-17,13159,4,45,4,RU,Education
2TgybwNPYLo,"ГОВОРИМ, КАК АМЕРИКАНЦЫ! БАТТЛ по английскому. Регина Тодоренко vs Дима Пистоляко (Часть 2)",LinguaTrip TV,2017-12-20,2250,249,1,11,RU,Education
R2Jkv2Whris,Почему нас раздражают некоторые люди,Эра Водолея,2017-12-19,7401,512,24,26,RU,Education
5kEb5Wlh3C4,"ПРОИЗНОСИМ АНГЛИЙСКИЕ СЛОВА, КАК АМЕРИКАНЦЫ! 🇺🇸Регина Тодоренко vs Дима Пистоляко",Marina Mogilko,2017-12-20,4082,443,11,71,RU,Education
4QNvNyrCWDM,Николай Чудотворец требует Защиты! Ткачёв Андрей,Дух Проповеди Православие,2017-12-19,15313,357,22,22,RU,Education
cSrLFbJ4r5s,ХИРОСИМА и НАГАСАКИ: p.s. Мы ни о чём не жалеем США.,Теперь я Знаю,2017-12-19,163914,10854,454,2435,RU,Education
7xFw-jP8Ehw,Новогодний вечер «Исполняем ваши желания» с Дмитрием Троцким 19.12.2017,Dmitry Trotsky,2017-12-19,8536,438,18,0,RU,Education
GBkVpSXS3FA,Дмитрий ПОТАПЕНКО - Что ждёт нефтяную Россию? Рынок чёрного золота. Тренды и прогнозы,Дмитрий ПОТАПЕНКО,2017-12-19,41605,2080,72,199,RU,Education
02od8XBKnu4,Успех и здоровье в новых энергиях,Пятое Измерение,2017-12-19,5873,532,13,23,RU,Education
Qcka0q5yJ_E,В Госдуме выпали в осадок от шокирующей правды депутата Грудинина - 07.12.2017,Правовед ТВ,2017-12-19,6568,807,17,127,RU,Education
TWEzTlAImIU,Энциклопедия маразма,Om TV,2017-12-20,96371,12032,177,1876,RU,Education
2TgybwNPYLo,"ГОВОРИМ, КАК АМЕРИКАНЦЫ! БАТТЛ по английскому. Регина Тодоренко vs Дима Пистоляко (Часть 2)",LinguaTrip TV,2017-12-20,17619,914,33,41,RU,Education
4L3Z7etAwwM,Анонс нового эксперимента от PollmixaN,PollmixaN,2017-12-20,17029,2043,29,216,RU,Education
a5OGZX2_b5s,Как посадить Ель? С Митей Фоминым на его даче посадили Туи Смарагд и Ель.,Экоплант - Дачный ответ.,2017-12-22,7155,16,11,7,RU,Education
jxLtrsC5SFg,эстрадный гипноз: кто такой Путин? Кто Президент России? Фрагмент с обучения гипнозу.,гипнотерапия.москва,2017-12-21,86529,3016,259,66,RU,Education
fOepYfsBxQM,Ты не выучишь английский язык в школе! Как учить английский?,Инглиш Так Просто,2017-12-21,84686,2414,54,190,RU,Education
FAR8F0eRRDg,Как создавать новую жизнь,Эра Водолея,2017-12-21,7801,613,8,12,RU,Education
vDSn1HWY8J8,Русский язык за 18 минут,Arzamas,2017-12-21,44184,6897,67,390,RU,Education
a5OGZX2_b5s,Как посадить Ель? С Митей Фоминым на его даче посадили Туи Смарагд и Ель.,Экоплант - Дачный ответ.,2017-12-22,114067,87,325,79,RU,Education
gaEj1KR212g,Does The Shoe Fit?,School of Transformation,2017-11-28,11672,0,0,0,RU,Education
V9_EXwlEQoM,"Зачем, Почему и куда Идти? Ткачёв  Андрей",Дух Проповеди Православие,2017-12-22,10154,276,15,8,RU,Education
R5kZPlWFO44,Постскриптум (23.12.2017),Постскриптум с Алексеем Пушковым,2017-12-23,155864,1901,209,774,RU,Education
a5OGZX2_b5s,Как посадить Ель? С Митей Фоминым на его даче посадили Туи Смарагд и Ель.,Экоплант - Дачный ответ.,2017-12-22,92853,96,371,85,RU,Education
kUb028j8KOI,The Best Way to Teach First-Time Printers,TheTeachersAlphabet,2017-12-17,45073,4,62,12,RU,Education
R5kZPlWFO44,Постскриптум (23.12.2017),Постскриптум с Алексеем Пушковым,2017-12-23,223080,2358,264,884,RU,Education
0Q4IKTD4LdE,В каких числах Повысят Пенсию в следующем году,Блог Юридической Помощи,2017-12-24,15885,605,18,12,RU,Education
618XkJz8ZWQ,Water in His Face - Promo,The Gracie Series,2017-12-14,14275,243,0,0,RU,Education
SqsmGU5JKoE,Досрочная выплата пенсии за январь 2018 года,Kommentarii,2017-12-25,27892,191,28,10,RU,Education
Y7b-OAjLduM,PhysioFeel,PhysioFeel,2017-12-15,12457,11,0,2,RU,Education
YWCE-w-S4BI,СПИРИДОН ТРИМИФУНТСКИЙ 25 12 2017 Ткачёв Андрей. Житейские попечения Мешают жить Свято?,Дух Проповеди Православие,2017-12-25,10197,464,10,19,RU,Education
Umjc-mTtYoQ,Synergy Global Forum. Встреча клуба Трансформатор Дмитрия Портнягина. Фрирайд в Австрии.,Дима Ковпак,2017-12-26,348449,13071,815,166,RU,Education
0czmwliM2_4,с 1 Января Пенсии Будут Увеличены,Блог Юридической Помощи,2017-12-26,31705,381,52,31,RU,Education
8SebqyHPVjo,Pass2success 2nd Attempt Manual Driving Test Pass,pass2success Passes Video,2017-12-19,18634,4,1,0,RU,Education
Umjc-mTtYoQ,Synergy Global Forum. Встреча клуба Трансформатор Дмитрия Портнягина. Фрирайд в Австрии.,Дима Ковпак,2017-12-26,210254,16155,759,220,RU,Education
li2agRsYXwI,Every single episode of SHARK TANK EVER - in 50 seconds.,Egeria Media,2017-12-26,34016,763,3,0,RU,Education
0be7qhAxG-U,APRESENTAÇÃO DO MEU CANAL,WRM EDUCACIONAL,2016-11-27,10809,1,0,0,RU,Education
8hIDnmlWEJU,CashberyTrading,Кэшбери,2017-12-28,415063,57,240,33,RU,Education
sRe6Pv8krak,Новый вид пенсии в 2018 году,Блог Юридической Помощи,2017-12-28,11102,164,18,5,RU,Education
LENGZ_5SetQ,"Есть ли в моем окружении «мой мужчина», которого я не замечаю?",Лара Логинова-Таро,2017-12-28,7486,589,19,238,RU,Education
HUaNKfnpAdY,Притча об исполнении новогодних желаний,Эра Водолея,2017-12-29,12035,1019,15,43,RU,Education
nMN5eVU7a5I,Ron Paul Curriculum - Top 5 Reasons to Use Ron Paul's Homeschool Program,Homeschool Base,2017-10-11,23220,4,1,0,RU,Education
BSr9jFi2k5A,Вебинар по Эзотерике денежные практики на весь 2018 год. Выполняйте и становитесь богатыми быстро.,Андрей Дуйко/ Andrii Duiko,2017-12-29,8596,479,9,63,RU,Education
9clPbzz9VKo,Новый Год! Предновогодние Дни. Ткачёв Андрей,Дух Проповеди Православие,2017-12-30,8339,315,9,15,RU,Education
tKjuIhhvLSQ,ПОКОЛЕНИЕ ЯЯЯ — ТОПЛЕС | ЗАКЛЮЧИТЕЛЬНЫЙ ВЫПУСК 2017,ТОПЛЕС,2017-12-31,587361,117531,1389,11146,RU,Education
"#NAME?",VEDANTA BALCO NEWS 651 -  ANNUAL MINING SAFETY CELEBRATION - DECEMBER 2017,balco korba,2017-12-23,19223,0,0,0,RU,Education
tKjuIhhvLSQ,ПОКОЛЕНИЕ ЯЯЯ — ТОПЛЕС | ЗАКЛЮЧИТЕЛЬНЫЙ ВЫПУСК 2017,ТОПЛЕС,2017-12-31,791674,146313,1857,12766,RU,Education
QzzS3-mFACY,Изменения в Индексации Пенсий в 2018 году,Блог Юридической Помощи,2018-01-01,17794,198,24,25,RU,Education
46myCUqvB9E,Иоанн Кронштадский. Ткачёв Андрей,Дух Проповеди Православие,2018-01-02,9682,335,13,6,RU,Education
c11pAhURlvQ,Create. Share. Repeat. Channel Motivation and Plans for 2018,Josh Zaring,2018-01-02,51010,7,7,3,RU,Education
X16BBALYASU,"On The Shortness of Life - Seneca (1-Min Book Review, With Giulio D'Agostino)",Giulio Julyo D Agostino,2017-08-11,6775,252,0,0,RU,Education
HLWJ338_C2E,"Полезные привычки, которые приведут вас к здоровью!",Alunika Dobrovolski,2018-01-02,13543,1144,17,99,RU,Education
CtiWGU4MyBM,Новый год в Нью Йорке. Бизнес в Америке. Ковпак на коленях.,Дима Ковпак,2018-01-03,281242,4131,1538,566,RU,Education
JuufPvwtS4I,Universe,Horizons,2018-01-02,23922,7,124,40,RU,Education
niL1U2C0wLM,Неправильный перерасчет пенсии в России на 24 000 рублей,Kommentarii,2018-01-03,9449,136,9,8,RU,Education
Vc59JsKdUsQ,Ремонт ногтя с помощью ваты,Nadia Ustinova,2018-01-03,7544,512,21,41,RU,Education
asiZQ3hv6zQ,TED на русском - БИТКОЙН И БУДУЩЕЕ ДЕНЕГ - Неха Нарула,TED на русском языке,2018-01-03,4935,457,12,28,RU,Education
BhRzsJnRnas,"$420 PROFIT DAILY (BitConnect: $35,000) - 70 Litecoin Stuck on HitBTC - Bitcoin / Crypto Investing",AFINO,2018-01-04,39145,1250,46,51,RU,Education
CtiWGU4MyBM,Новый год в Нью Йорке. Бизнес в Америке. Ковпак на коленях.,Дима Ковпак,2018-01-03,296668,4677,2056,886,RU,Education
lcWGE5WwpwI,Календарь Повышения Пенсии на этот год,Блог Юридической Помощи,2018-01-04,5927,144,5,5,RU,Education
V8ym_eSCz-4,САМЫЕ ТУПЫЕ РЕШЕНИЯ В РЕМОНТЕ 2003-2018,1) Алексей Земсков (zems.pro),2018-01-05,55451,3707,470,392,RU,Education
_p-hBsRI_sg,РОЖДЕСТВО Христово! Ткачёв Андрей,Дух Проповеди Православие,2018-01-05,12976,363,20,26,RU,Education
n0N3VeNX6n4,"Ниобий - Металл, ЗАМЕНЯЮЩИЙ ЗОЛОТО!",Thoisoi,2018-01-05,117555,8597,320,400,RU,Education
6K5_b7nkG7M,Бесплатный вебинар с Андреем Дуйко по эзотерике! 05.01.2018,Андрей Дуйко/ Andrii Duiko,2018-01-05,6376,319,13,23,RU,Education
RWmjDEAWgCQ,Профессиональный психологический ТЕСТ! Выбери понравившегося человека!  Тест онлайн!,Психо Логика,2018-01-05,13165,565,19,145,RU,Education
"#NAME?",Любовь  начинается с любви к себе,Эра Водолея,2018-01-06,8860,619,13,37,RU,Education
QYE2qOYyiRA,В ночь перед Рождеством. Чего не избежать по судьбе в личной жизни.,Лара Логинова-Таро,2018-01-06,7283,553,19,269,RU,Education
qnrCgySyFlE,РОЖДЕСТВО - Новая эра. Исполняются Пророчества! Ткачёв Андрей,Дух Проповеди Православие,2018-01-06,17048,543,78,72,RU,Education
V8ym_eSCz-4,САМЫЕ ТУПЫЕ РЕШЕНИЯ В РЕМОНТЕ 2003-2018,1) Алексей Земсков (zems.pro),2018-01-05,130006,6282,838,570,RU,Education
57HmYJggNQE,На себе | комби и покрытие | лайфхак с блестками,Алёна Sokololof,2018-01-06,3220,366,6,64,RU,Education
OwI-OmKbm0g,"Как относиться к жизни, чтобы получать ЛУЧШЕЕ",Alunika Dobrovolski,2018-01-06,8434,566,7,52,RU,Education
ll_ys49mhaE,Проповедь в праздник Рождества Христова от 07.01.2018 (прот. Владимир Головин),golovinBolgar,2018-01-07,1351,189,4,0,RU,Education
0r4juA5D5cI,Региональная доплата к пенсии в 2018,Kommentarii,2018-01-06,3638,56,7,4,RU,Education
UrdCaGuJYRw,Tesoros Robados Promo,ADC-MediaProductions,2017-01-12,38144,0,3,0,RU,Education
oDFSI2mZxuQ,"14 Крутейших Фактов Из Психологии, Которые Нужно Знать!",Алексей Знаков,2018-01-07,54210,10037,134,831,RU,Education
ll_ys49mhaE,Проповедь в праздник Рождества Христова от 07.01.2018 (прот. Владимир Головин),golovinBolgar,2018-01-07,10741,538,11,0,RU,Education
It6Sd-pU_Hc,Норковая шубка или пуховик? Что гуманнее ?,ТАТЬЯНА КОНКИНА - СЧАСТЬЕ И УСПЕХ ДЛЯ ВСЕХ.,2018-01-07,7768,607,47,284,RU,Education
nvcm2mDlIBs,С 1 февраля увеличатся федеральные и региональные пособия,Kommentarii,2018-01-07,2480,53,4,7,RU,Education
q-zYXFyH8_A,Единовременная Выплата 5000 рублей Пенсионерам в Январе,Блог Юридической Помощи,2018-01-07,11317,127,29,24,RU,Education
9mMhjBaMw5w,НЕ УСЛОЖНЯЙ. Моё напутствие на 2018 год.,Простые Мысли,2018-01-07,34890,5962,47,512,RU,Education
ow_JyQKsFq4,Как не быть скучным [The School of Life],In Cor Cadit,2018-01-08,29537,2671,75,143,RU,Education
gNyPvb_ydhc,Paytm carding 2018 with refresh proof || official carder||,Official Carder,2018-01-08,23739,808,217,90,RU,Education
tRaAMxyI0V0,ЛОПАТА ФЕРМЕРА НАТКНУЛАСЬ НА ЧТО ТО ОГРОМНОЕ! ЧЕРЕЗ НЕДЕЛЮ ЕГО ПОЛЕ СТАЛО МЕСТОМ МАСШТАБНЫХ РАСКОПОК,Я В ШОКЕ!,2018-01-09,5437,258,7,27,RU,Education
H34qrTkhFz0,DO U KNO DA WEI?,PewDiePie,2018-01-11,2277099,229624,4376,25513,RU,Education
KgprJr7Gj5M,Дальнейшее Повышение Пенсий,Блог Юридической Помощи,2018-01-11,7432,151,14,17,RU,Education
aJx9J36YZcU,Преображение ноготков | КЛАССИЧЕСКИЙ маникюр | худ.роспись,Алёна Sokololof,2018-01-12,12001,869,10,106,RU,Education
VhaKo1C9X00,Как заработать на Биткоин с вложениями? Как зарабатывать с помощью Биткоин с нуля?,Антипов Алексей,2018-01-12,8990,1068,5,33,RU,Education
liOHw_upq4A,Bitcoin carding if anyone wants account then message me whatsapp,Official Carder,2018-01-12,9025,8,7,10,RU,Education
qXgqbCd-KlQ,Постскриптум (13.01.2018),Постскриптум с Алексеем Пушковым,2018-01-13,175650,1916,430,906,RU,Education
wKAFBEhErTo,Майами. Нью-Йорк с вертолета. Король стейков - Nusr Et a.k.a. Salt Bae. Бизнес в Америке,Дима Ковпак,2018-01-13,51451,21324,76,23,RU,Education
"#NAME?",Выпадение в матрицу,Эра Водолея,2018-01-13,6123,522,5,21,RU,Education
"#NAME?",Возобновятся ли отношения с загаданным мной мужчиной?,Лара Логинова-Таро,2018-01-13,5154,472,20,208,RU,Education
sDNdsD95vi4,Never Pay Consumer Credit Collections Again!,Get A New Credit File,2018-01-10,7401,6,0,0,RU,Education
qXgqbCd-KlQ,Постскриптум (13.01.2018),Постскриптум с Алексеем Пушковым,2018-01-13,297741,2479,866,1242,RU,Education
JmVlJx1CbOo,Указ Путина о защите пенсий,Kommentarii,2018-01-14,7774,63,11,9,RU,Education
NngmhO5_y_Y,КАК УВЕЛИЧИТЬ ЛОДЖИЮ? СПОСОБ ПЕРВЫЙ: УДАЛЕНИЕ ПАРАПЕТА,1) Алексей Земсков (zems.pro),2018-01-15,24430,2331,117,150,RU,Education
z2U_8qq2-IA,Качества ученика - 3.  Скромность.  Винито.,Уроки Медитации,2018-01-14,6332,616,5,83,RU,Education
18uSNbkfto0,САМАЯ ГЛАВНАЯ ИНВЕСТИЦИЯ - ЭТО ВАШИ ДЕТИ!,Всё по-взрослому!,2018-01-15,100691,0,0,95,RU,Education
BF4CAzaD_8I,Тайны Чапман. Новые терминаторы (15.01.2018),Военное телевидение,2018-01-15,16391,104,17,18,RU,Education
3XBnSC9obdA,ПРИШЕЛЬЦЫ В КИНО | UTOPIA SHOW И ИНОПЛАНЕТЯНЕ [СПЕЦВЫПУСК],ЧЕРНЫЙ КАБИНЕТ,2018-01-16,58411,5942,120,527,RU,Education
ffD-r-Etf7U,Что с вами будет через год,Эра Водолея,2018-01-16,12223,760,14,37,RU,Education
4vcLwdf6xlI,Онлайн-встреча  с Дмитрием Троцким,Dmitry Trotsky,2018-01-16,9180,546,11,0,RU,Education
VVAqxrEF7P4,"Биткоин, запомните этот прогноз!",Hamaha Биткоин трейдеры на бирже криптовалют,2018-01-16,90985,3880,152,568,RU,Education
6TybZGxvKVg,Олег Соколов о книге Е. Понасенкова Первая научная история войны 1812 года,Dmitry Puchkov,2018-01-16,68103,5158,282,1669,RU,Education
95SaN1cfHdM,Красивая улыбка и красивый маникюр . Что делать и как этого достичь.,ТАТЬЯНА КОНКИНА - СЧАСТЬЕ И УСПЕХ ДЛЯ ВСЕХ.,2018-01-16,12401,823,29,196,RU,Education
3XBnSC9obdA,ПРИШЕЛЬЦЫ В КИНО | UTOPIA SHOW И ИНОПЛАНЕТЯНЕ [СПЕЦВЫПУСК],ЧЕРНЫЙ КАБИНЕТ,2018-01-16,98077,8479,197,684,RU,Education
9yS3c9MPOrs,Тайны Чапман. Кто открыл врата ада (17.01.2018),Военное телевидение,2018-01-17,25392,143,17,33,RU,Education
QUOQip6-rp4,"Биткоин, что делать сегодня",Hamaha Биткоин трейдеры на бирже криптовалют,2018-01-17,87435,3383,191,722,RU,Education
44zmLQJVRxo,НЕ ТЕРЯЙТЕ ИНТЕРЕС МУЖЧИНЫ К СЕБЕ - РАСКРЕПОСТИТЕСЬ! Юлия Ланске,Julia Lanske,2018-01-17,6039,551,4,32,RU,Education
ahc6-bi_AQU,Диаграмма Ганта от CRM системы Мегаплан,Мегаплан - Двигатель бизнеса,2018-01-18,99019,21,178,35,RU,Education
v_FyOimjcOY,"Ответы на вопросы от 13.01.2018 (прот. Владимир Головин, г. Болгар)",golovinBolgar,2018-01-18,7505,318,5,0,RU,Education
vC8gE3bb3x8,Как всегда быть интересной мужчине | Эмоциональные встряски,Павел Раков,2018-01-18,15718,785,8,25,RU,Education
uE7YQEyt_AA,Как появляются наши ограничения,Эра Водолея,2018-01-18,8272,580,9,22,RU,Education
QYFClX0M4PA,Что такое Диминутивы и почему они нам так нравятся? [The School of Life],In Cor Cadit,2018-01-18,24558,2288,35,116,RU,Education
SqksE6a-LGs,Вопрос Путину по индексации  пенсий и индексации расходов на содержание Госдумы,Kommentarii,2018-01-19,13029,188,44,28,RU,Education
f8hB6pKEsW0,Постскриптум (20.01.2018),Постскриптум с Алексеем Пушковым,2018-01-20,243768,2013,1371,1917,RU,Education
jmn88DjlNBk,Разбор Разведданных. Испытание средой... 20.01.2018 гг.,Сергей Будков,2018-01-20,12820,753,13,228,RU,Education
Qp66o9pevII,ЭТО БЫЛО СКРЫТО ОТ ЛЮДЕЙ 1000 ЛЕТ В КОРНЯХ ДЕРЕВА! НАХОДКУ ОБНАРУЖИЛИ БЛАГОДАРЯ СИЛЬНОМУ УРАГАНУ…,Я В ШОКЕ!,2018-01-20,6036,271,14,17,RU,Education
xf6lhjW21gU,Гольмий - Самый МАГНИТНЫЙ Металл на ЗЕМЛЕ!,Thoisoi,2018-01-20,107450,8472,331,406,RU,Education
JTXlvC128e0,Три главных этапа на пути к счастью,Эра Водолея,2018-01-20,8582,725,14,56,RU,Education
AcnZW4Bm70Y,On-Line трансляция Конгресса-2018 холдинга Life is Good,Life is Good,2018-01-20,10503,193,11,0,RU,Education
f8hB6pKEsW0,Постскриптум (20.01.2018),Постскриптум с Алексеем Пушковым,2018-01-20,322581,2399,2223,2386,RU,Education
21EpkF3iRsk,ПРИСОЕДИНЯЕМ ЛОДЖИЮ К КВАРТИРЕ. ПЛЮСЫ И МИНУСЫ.,1) Алексей Земсков (zems.pro),2018-01-22,19388,2500,102,231,RU,Education
0g40ywQpJz4,Королева АНГЛИИ на юбилейной купюре банка России [22.01.2018],Правовед ТВ,2018-01-22,1696,136,10,27,RU,Education
Qp66o9pevII,1000 ЛЕТ ЭТО БЫЛО СКРЫТО ОТ ЛЮДЕЙ В КОРНЯХ ДЕРЕВА! НАХОДКУ ОБНАРУЖИЛИ БЛАГОДАРЯ СИЛЬНОМУ УРАГАНУ…,Я В ШОКЕ!,2018-01-20,30284,521,43,31,RU,Education
9-D6TAArREg,Как защититься от манипуляторов и агрессоров,Mila Levchuk,2018-01-21,36331,2255,104,345,RU,Education
qBDC7NuTSjA,On-Line трансляция Конгресса-2018 холдинга Life is Good,Life is Good,2018-01-21,8712,150,13,2,RU,Education
21EpkF3iRsk,ПРИСОЕДИНЯЕМ ЛОДЖИЮ К КВАРТИРЕ. ПЛЮСЫ И МИНУСЫ.,1) Алексей Земсков (zems.pro),2018-01-22,185518,7721,379,520,RU,Education
7knT2mV0tCg,Рецепт для Мужского Здоровья.,Георгий Кавказ,2018-01-22,178184,19141,173,1146,RU,Education
pBE6_jMnvm8,Почему С МУЖЧИНОЙ нужно поступать НАОБОРОТ?,2vmeste,2018-01-22,7689,597,8,66,RU,Education
opI6Cn9TOUw,Тайны Чапман. Все на дно (22.01.2018),Военное телевидение,2018-01-22,17705,101,14,13,RU,Education
UVbd7Wxnho4,"25 жуучу келип, бирөөсү да албай кеткен кыздын окуясы Устаз Абдишүкүр ажы Нарматов.",Nasaatkg БАЯНДАР-ХУТБАЛАР,2018-01-22,9007,514,4,11,RU,Education
XnrtmFh_Gug,Девочка и чудо,Эра Водолея,2018-01-23,8985,713,10,44,RU,Education
7_WvhdB6trA,Аэропуффинг | КОМБИ | гель-лаки F.O.X,Алёна Sokololof,2018-01-23,12507,947,9,130,RU,Education
Td-trb2E2yI,"Любить себя, это значит...",Пятое Измерение,2018-01-23,7202,730,5,33,RU,Education
fT5HCF1XXQg,Lesson 10. USED TO,Yes Centre,2018-01-24,98310,859,168,135,RU,Education
zFKAzogibak,Управление несколькими задачами в одном окне в Мегаплане!,Мегаплан - Двигатель бизнеса,2018-01-24,95505,30,301,52,RU,Education
sQR-Ed6xGrg,Правильно или неправильно?,Dmitry Trotsky,2018-01-24,8871,485,15,0,RU,Education
Fb6onIFGDM4,Комплименты мужчинам | Как правильно говорить комплименты,Павел Раков,2018-01-24,12239,1182,7,7,RU,Education
7F-5rNVLu94,Тайны Чапман. Жидкое золото (24.01.2018),Военное телевидение,2018-01-24,10749,87,7,4,RU,Education
"#NAME?",Яхтинг на Карибских Островах. Советы миллионеров. Регата Синергия. Советы от Алексея Воронина.,Дима Ковпак,2018-01-25,239001,61,151,28,RU,Education
Akw1bXC4reY,Почему котики только у одиноких женщин?,Mila Levchuk,2018-01-25,21590,890,165,228,RU,Education
GFgdNXFWbNg,"Кто вам сказал, что вы должны быть другими?",Эра Водолея,2018-01-25,10312,729,12,36,RU,Education
FZlPBUFwwSw,Куда перечислят Пенсии в Феврале,Блог Юридической Помощи,2018-01-25,9263,179,8,10,RU,Education
AhopUSXBAu8,Страшное дело с Игорем Прокопенко. Часть 1 (26.01.2018),Военное телевидение,2018-01-26,19395,192,24,70,RU,Education
DonzAUpX1Uw,Появится ли в ближайшем будущем мужчина для серьезных отношений?,Лара Логинова-Таро,2018-01-27,2621,267,12,93,RU,Education
"#NAME?",Яхтинг на Карибских Островах. Советы миллионеров. Регата Синергия. Советы от Алексея Воронина.,Дима Ковпак,2018-01-25,16970,100,185,38,RU,Education
PJMe7XhJ1Ow,"В Германии голодают пенсионеры, а виноват Варламов",varlamov,2018-01-26,34101,4265,71,981,RU,Education
OJVdjv9LHDg,Китай Отменит Запреты? Завершение Фьючерсов На CME. Ежедневный Обзор Новостей от iTuber,Сообщество Онлайн Инвесторов iTuber,2018-01-26,3579,291,10,24,RU,Education
TXE6BTrrCYI,Клим Жуков и Михаил Попов про единство и борьбу противоположностей в президентских выборах,Dmitry Puchkov,2018-01-26,73679,4419,366,2769,RU,Education
qx3YWCGokTI,Безобразная История: «Петрушечная» резня 1937 года [TED ED],In Cor Cadit,2018-01-26,17413,1705,29,121,RU,Education
G1K-A6iZcag,Перестаньте сомневаться и начните жить Вашу жизнь.,ТАТЬЯНА КОНКИНА - СЧАСТЬЕ И УСПЕХ ДЛЯ ВСЕХ.,2018-01-26,2556,485,9,76,RU,Education
GgYG1p50KiA,Постскриптум (27.01.2018),Постскриптум с Алексеем Пушковым,2018-01-27,203885,1918,900,2686,RU,Education
fqY5_RCZHmg,"Фразы, которым не место в вашей жизни",Эра Водолея,2018-01-27,16200,1038,22,60,RU,Education
5OK8vjelq-Y,Керамика за 120 Евро? Для чего она нужна?,Thoisoi,2018-01-27,119542,10291,122,481,RU,Education
rrFa76eLG3k,Вы меня очень огорчили,Кэшбери,2018-01-27,4496,244,16,55,RU,Education
ArdiZyPPp4M,Вернется ли он?,Лара Логинова-Таро,2018-01-27,5553,343,22,114,RU,Education
j1UzB9NRuyw,Вебинар: 7 способов спасти отношения,Mila Levchuk,2018-01-28,28724,1673,169,100,RU,Education
"#NAME?","СДВИНУВ КАМЕНЬ, ЛЮДИ ОБНАРУЖИЛИ ПОТАЙНОЙ ВХОД, КОТОРОМУ 5000 ЛЕТ!",Я В ШОКЕ!,2018-01-28,5046,299,9,38,RU,Education
lqJGl2B3OaE,ВНУТРИПОЛЬНЫЕ КОНВЕКТОРЫ — ЭТО ПОЛНАЯ ХЕРНЯ. РЕАЛЬНЫЙ ОПЫТ ИСПОЛЬЗОВАНИЯ.,1) Алексей Земсков (zems.pro),2018-01-29,34450,3267,178,279,RU,Education
rMQd2d8Q6N0,Успех в Школе и Реальной Жизни [The School of Life],In Cor Cadit,2018-01-28,25603,2729,67,165,RU,Education
6lqsS1-uQ1c,Любит или использует?,Лара Логинова-Таро,2018-01-28,4923,451,13,201,RU,Education
L9pF86C3zLk,Как завести партнерские отношения с правительством. Джек Ма и Илон Маск в Москве.,Дима Ковпак,2018-01-29,191114,121,188,26,RU,Education
tPoqK8e4MEA,"10 причин, почему я люблю Америку",varlamov,2018-01-29,39504,3517,159,965,RU,Education
bF_c4xzVyX4,"Вернется ли он? Если да, то по какой причине?",Лара Логинова-Таро,2018-01-29,7967,444,35,214,RU,Education
iamz07ArRZM,Самые шокирующие гипотезы. Петербург до нашей эры! (29.01.2018) © РЕН ТВ,Военное телевидение,2018-01-29,11469,155,13,45,RU,Education
L9pF86C3zLk,Как завести партнерские отношения с правительством. Джек Ма и Илон Маск в Москве.,Дима Ковпак,2018-01-29,218349,0,0,78,RU,Education
GNSI5kIyRDs,"10 ДРАКОНОВ, КОТОРЫХ УДАЛОСЬ СНЯТЬ НА КАМЕРУ",Bubble™,2018-01-30,165107,8918,1867,1683,RU,Education
oX7S4eg4Ukw,Алексей Лобин о русских рабынях,Dmitry Puchkov,2018-01-30,61593,2703,120,424,RU,Education
Y006Vcu0yeE,Облачная бухгалтерия от 1C и Мегаплана,Мегаплан - Двигатель бизнеса,2018-01-30,7432,61,267,72,RU,Education
br4YOIRNK3g,Загадки человечества с Олегом Шишкины (30.01.2018),Военное телевидение,2018-01-30,18974,63,8,3,RU,Education
z9IPGEP90cM,"Если вы хотите изменить свою жизнь, но не знаете как",Эра Водолея,2018-02-01,9930,919,6,51,RU,Education
b-Me9eOP-XI,Главные правила достижения цели,БМ LIFE,2018-02-01,10355,0,0,0,RU,Education
eQHTd-3HGFw,Один / Дмитрий Быков // 01.02.18,Эхо Культура,2018-02-01,4589,88,6,4,RU,Education
HWlZIzCsek0,"Владимир Яковлев о счастье в старости, развитии личности и жизненной стратегии",Идеономика,2018-02-02,311424,192,235,110,RU,Education
ejhczSMGU7w,"День Рождения холдинга Кэшбери, как это было.",Кэшбери,2018-02-02,400770,303,1185,264,RU,Education
g1fhl2KKS5E,Ностальгирующий Критик - Медведь Йоги,Студия ДжоШизо,2018-02-02,37627,3530,28,194,RU,Education
V48RYBr-umQ,Отмена пенсий для работающих пенсионеров в 2018 году,Kommentarii,2018-02-02,3236,68,12,5,RU,Education
oCtUStZIf8M,"Быков о конфликте Сванидзе и Шевченко [Один, 2 февраля 2018]",Дмитрий Быков [Радиоэфиры],2018-02-02,21703,309,66,172,RU,Education
lG6HFgIEnTY,Обновленный набор доктора Комаровского «Первый зуб»,Доктор Комаровский,2018-02-02,5675,346,8,25,RU,Education
nZLPmn_VbuU,Засекреченные списки. Эту страну не победить! (03.02.2018) © РЕН ТВ,Военное телевидение,2018-02-03,16721,124,22,55,RU,Education
Tmq5MGQZFaM,Притча - Разговор с Любовью,Эра Водолея,2018-02-03,9636,671,12,36,RU,Education
bDjFl43WanU,Постскриптум (03.02.2018) © ТВ Центр,Постскриптум с Алексеем Пушковым,2018-02-03,153238,1674,316,1390,RU,Education
pm09ebpzfsA,Сколько стоит переехать в США?,Marina Mogilko,2018-02-03,11096,674,29,58,RU,Education
HWlZIzCsek0,"Владимир Яковлев о счастье в старости, развитии личности и жизненной стратегии",Идеономика,2018-02-02,43383,289,350,162,RU,Education
1m2HEkYfz4I,Минералы за МИЛЛИОНЫ ЕВРО! Зачем они нужны?,Thoisoi,2018-02-03,110556,7992,278,372,RU,Education
sk1q5JK-LEM,Встреча в выходные дни 2018-02-03,Programas Teocraticos,2018-02-04,1724,88,4,0,RU,Education
7WvmUJZ2JhI,Укрепление ногтей гелем.Самый простой дизайн 47,Verakso,2018-02-03,10168,801,22,37,RU,Education
ejhczSMGU7w,"День Рождения холдинга Кэшбери, как это было.",Кэшбери,2018-02-02,112840,424,2307,448,RU,Education
rKcuaLP-DKY,Цена на биткоин НЕ ВЫРАСТЕТ? Как на этом заработать?,Мамкин майнер,2018-02-04,840,71,13,25,RU,Education
2yzVNzO1UZA,Что такое душа. Кто вы есть на самом деле,Пятое Измерение,2018-02-03,6615,445,12,45,RU,Education
8l0VmXULRJA,460 Суббота. Поход по музеям.,Life On The Road (судьба дорога),2018-02-04,1992,242,7,34,RU,Education
8uHfww_z1Xw,Как заслуженные артисты нарушают закон,varlamov,2018-02-04,41065,4866,42,706,RU,Education
fK7mTrKd_w0,"Новые запреты в Китае, Криптофонды Ожидают Стремительный Рост. Ежедневный Обзор Новостей от iTuber",Сообщество Онлайн Инвесторов iTuber,2018-02-05,5147,294,8,29,RU,Education
g9h-Rn0SqhQ,Загадки человечества с Олегом Шишкины (05.02.2018),Военное телевидение,2018-02-05,4777,56,5,10,RU,Education
E7usnHL4Pus,"🚩 Пузыри лопнули?  Сценарии BTC, SP500, DJI. ПАДАЕТ ВСЁ.",Умный- Инвестор,2018-02-05,2372,307,9,92,RU,Education
QFuQcnPvoJs,Перепелки на Гриле по-Домашнему.,Георгий Кавказ,2018-02-05,117180,10483,145,725,RU,Education
df34MN9rtl0,💀 САМЫЙ МРАЧНЫЙ ПРОГНОЗ ОБВАЛА КУРСА БИТКОИНА 2018,Ракета t8,2018-02-05,59839,5169,309,2949,RU,Education
ZpMkWF0iZX4,Не следуйте этому  совету,Эра Водолея,2018-02-06,11551,772,11,40,RU,Education
dQPvAfMq6TQ,Самые шокирующие гипотезы. У Вас ус отклеился! (06.02.2018) © РЕН ТВ,Военное телевидение,2018-02-06,16799,95,14,37,RU,Education
c6yyqViJlCs,Ошибки Алексея Земскова с конвекторами,san-therm,2018-02-07,1986,405,31,48,RU,Education
Y63bMV09LXA,"Отскок, Сокол Тяжелый, и Деньги",Sergei Sergienko,2018-02-06,2566,335,7,58,RU,Education
dJZsUDjB5b4,Радислав Гандапас. Выступление на фестивале ПиР-2017,Радислав Гандапас,2018-02-07,2997,187,9,12,RU,Education
0Zz9SesyPF4,Что обязательно должно быть в детской комнате? - Доктор Комаровский,Доктор Комаровский,2018-02-07,13326,621,20,46,RU,Education
NkhtVAaVyLQ,Тайны Чапман. На войне как на войне (07.02.2018),Военное телевидение,2018-02-07,20568,115,18,23,RU,Education
Be0fyrsWKtw,Как правильно закаливать горло? - Доктор Комаровский,Доктор Комаровский,2018-02-08,13085,798,37,76,RU,Education
D3i6ELLEVuU,🌐 КАК НАС ПОДНИМЕТ В КОСМОС КРИПТОВАЛЮТА QTUM,Ракета t8,2018-02-09,2504,302,11,148,RU,Education
h_sUdvJwwks,"09 февраля 2018 г. Дмитрий Краснов. Заметки трейдера. Магнит. Фьючерсы на индекс РТС , Доллар/рубль.",Дмитрий Краснов,2018-02-09,622,77,1,3,RU,Education
BlhIiuXveCw,Как сохранять спокойствие с раздражающими людьми [The School of Life],In Cor Cadit,2018-02-09,22315,2235,114,174,RU,Education
hArQBVjs5dM,Кэшбери холдинг,Кэшбери,2018-02-10,990,106,5,13,RU,Education
cEIwTF2D1UE,Новые доказательства Бога (09.02.2018),Военное телевидение,2018-02-09,21092,123,38,34,RU,Education
xrJWtGdTmOw,Решение суда РФ об анулированном коде валюты 810 RUR и мошенничестве банков [11.02.2018],Правовед ТВ,2018-02-10,3601,639,7,113,RU,Education
8mX9Q9G4rCg,Солнечное затмение 2018,Эра Водолея,2018-02-10,9401,767,20,38,RU,Education
SK9xU4laSiU,"КОГДА В ЛЕСУ ПРОПАЛ 2-ЛЕТНИЙ МАЛЬЧИК, ПОЛИЦЕЙСКИЕ НАТКНУЛИСЬ НА ОТПЕЧАТКИ ЛАП…",Я В ШОКЕ!,2018-02-10,4568,428,4,40,RU,Education
wC83O_SYVKc,"Железо - Металл, ЗАЩИЩАЮЩИЙ ЗЕМЛЮ!",Thoisoi,2018-02-10,96782,10227,140,369,RU,Education
N7ZFT-VDCdI,Вебинар: Кто такая девушка плюс и как ею стать,Mila Levchuk,2018-02-11,25732,1459,148,68,RU,Education
0m3LiMnQjnM,УВЕЛИЧИВАЕМ ВЫХОД НА ЛОДЖИЮ. ЧТО МОЖНО И ЧТО НЕЛЬЗЯ ДЕЛАТЬ.,1) Алексей Земсков (zems.pro),2018-02-12,24840,2537,224,284,RU,Education
vCtJTucRkzg,Что происходило в аэропорту Орска после авиакатастрофы в Подмосковье,UTV Oren,2018-02-11,4427,15,5,8,RU,Education
h4_-iAEig3M,Романовы без соплей: Битва экстрасенсов и спиритизм,Павел Перец,2018-02-11,4455,460,9,71,RU,Education
csj2B31kdGA,КАК ИЗБАВИТЬСЯ ОТ РУССКОГО АКЦЕНТА? Ещё упражнение на произношение [ПЭМ2 #17],Dmitry More,2018-02-11,2524,699,3,163,RU,Education
zyC_oY-ndeE,"Что в личной жизни у мужчины, которого не могу забыть?",Лара Логинова-Таро,2018-02-11,8349,493,25,259,RU,Education
vCtJTucRkzg,Что происходило в аэропорту Орска после авиакатастрофы в Подмосковье,UTV Oren,2018-02-11,107944,219,581,349,RU,Education
N7ZFT-VDCdI,Вебинар: Кто такая девушка плюс и как ею стать,Mila Levchuk,2018-02-11,33858,1743,176,137,RU,Education
S_2zJNI3nls,Атеистический дайджест #137. О чем не расскажут на уроках религиозной культуры,Алексей Козлов,2018-02-12,6762,976,5,281,RU,Education
gSrjeHM7p10,ШОК-ТЕСТ! Приготовьтесь! Игра Что бы ты выбрал? заставит разрываться между вариантами! Видеотест!,Психо Логика,2018-02-12,6375,617,26,176,RU,Education
ngbj7rqUtsE,СБОРНИК РЭП МУЛЬТФИЛЬМОВ (СОНИК VS ФЛЕШ) | Top 5 Cartoon Rap Song (The Flash VS Sonic x),ДАМБО MUSIC,2018-02-13,29471,1713,110,929,RU,Education
maxhl8mmaqQ,"5 ОШИБОК В АНГЛИЙСКОМ, которые делают даже носители",Marina Mogilko,2018-02-14,6212,801,11,77,RU,Education
e-JltD883e0,Сретение Господне. Ткачёв Андрей,Дух Проповеди Православие,2018-02-15,4783,341,9,10,RU,Education
_UNbsy384Ec,Обращение прот. Владимира Головина (в т.ч. к свящ. Александру Новопашину и А.Л.Дворкину),golovinBolgar,2018-02-14,10612,1084,56,0,RU,Education
uzoHfXjvAV8,Тайна числа 1.618034 - самое ВАЖНОЕ число в мире,Удивительные Факты,2018-02-15,21886,2784,106,229,RU,Education
xD4L1EpS9M8,Когда запор надо лечить? - Доктор Комаровский,Доктор Комаровский,2018-02-15,2873,190,5,21,RU,Education
u2vLJFknW0o,"XRP Запартнёрился Уже с 2 Центробанками, Грядущий Форк Litecoine.Ежедневный Обзор Новостей от iTuber",Сообщество Онлайн Инвесторов iTuber,2018-02-15,3234,179,7,18,RU,Education
mjVXV2SMaTk,"КОЛЬЦО ОБЕСПЕЧЕНО, ЕСЛИ СДЕЛАЕШЬ ЭТО! Юлия Ланске",Julia Lanske,2018-02-16,7482,712,10,89,RU,Education
AtzUBOJmLfA,"В паспорте ПРОПИСАНО, что ТЫ РАБ! Все по закону!",Проверь все сам!,2018-02-16,8256,391,48,115,RU,Education
OBX6wNf_Y-I,КАК ВЫУЧИТЬ АНГЛИЙСКИЙ  🙋СИНХРОННЫЕ ПОДКАСТЫ!,Anastacia Kay,2018-02-17,6010,582,20,49,RU,Education
9lkQ02DlP-I,#сложныеногтилайф | Ламинирование F.O.X. | Обзор гель-лаков Elsa,Алёна Sokololof,2018-02-16,12665,601,20,140,RU,Education
rG37Ahrglpw,Интервью и дискуссия по поводу АН-148,Макс Беляев,2018-02-17,6562,264,51,75,RU,Education
OBX6wNf_Y-I,КАК БЫСТРО ВЫУЧИТЬ АНГЛИЙСКИЙ ЯЗЫК САМОСТОЯТЕЛЬНО?,Anastacia Kay,2018-02-17,24004,1502,44,155,RU,Education
5W-rkW71zOI,"Эрбий - Металл, Создающий КВАНТОВЫЙ ИНТЕРНЕТ!",Thoisoi,2018-02-17,115309,8260,197,231,RU,Education
FU47FiNW42Q,Первая лекция Курса Как стать девушкой плюс,Mila Levchuk,2018-02-18,41700,0,0,0,RU,Education
y0a98xV5EwE,Секрет создания отношений,Эра Водолея,2018-02-18,10448,931,12,63,RU,Education
Fie2ENukf7k,Папа Франциск – враг христианства. — Осипов А.И.,Алексей Ильич Осипов,2018-02-18,7840,435,11,39,RU,Education
qWP77GuKZGQ,"99,9%попадаются на эти уловки! Манипуляция сознанием населения",Проверь все сам!,2018-02-18,6797,335,31,121,RU,Education
t2eYCenmGVo,Два вида энтузиазма. Качества ученика  - 6,Уроки Медитации,2018-02-18,5795,532,6,101,RU,Education
Yq-gRJ8UX3k,Загадки человечества с Олегом Шишкиным (19.02.2018),Военное телевидение,2018-02-19,16706,80,18,17,RU,Education
J3fWQXXw0WE,Скрытая тайна выборов Президента РФ [20.02.2018],Правовед ТВ,2018-02-19,1891,206,9,93,RU,Education
9_RDyOOHJWo,О произошедшем за последнюю неделю,Макс Беляев,2018-02-19,3189,316,23,83,RU,Education
u3HG9FO7S_c,Кыйынчылыктарыныз жонундо айтып бере аласызбы (СУРОО-ЖООП)-Шейх Чубак ажы.,Насаат Медиа,2018-02-20,1966,174,5,16,RU,Education
QGlGkFWURNw,✿ LET`S COOK ✿ Морские ножи - кто такие и как готовить? Razor clams / Couteaux ♥,Маша Zолина,2018-02-19,20773,1533,20,0,RU,Education
73atJgZxTno,Как научиться понимать людей? Встреча с участниками Академии смысла,Андрей Курпатов,2018-02-19,3664,315,7,36,RU,Education
pLa_PZV1zkc,Притча о привязанностях,Эра Водолея,2018-02-20,10796,714,15,38,RU,Education
lobdSZvVNyg,Комби + ранка :( | обзор ROXY | объемная инкрустация,Алёна Sokololof,2018-02-20,13227,1068,20,209,RU,Education
i2htF1rEG34,Разбираюсь работает или нет Акващит | Нужна ваша помощь и реальные отзывы о нем,На даче ЖИТЬ! Дом своими руками,2018-02-20,7151,776,43,418,RU,Education
6yfUlILrzto,"Семья, работник и инвестор (часть 2 из 2).",Justus Walker,2018-02-22,2131,245,1,41,RU,Education
K9Gq-TBeEKg,"Культурный код банкира (Познавательное ТВ, Михаил Величко)",Познавательное ТВ,2018-02-22,1808,189,14,26,RU,Education
e6HtsB6gvDU,Загадки человечества с Олегом Шишкиным (21.02.2018),Военное телевидение,2018-02-21,3435,47,10,4,RU,Education
3hvwaMTs1dE,Что на самом деле мы празднуем 23 февраля и 8 марта,РаВеда,2018-02-21,5451,398,27,128,RU,Education
RGyK1QCQClU,Мой неудачный дизайн ногтей(( Коррекция ногтей. 50,Verakso,2018-02-22,11386,884,19,191,RU,Education
hMDR9Ku7uSA,Самые шокирующие гипотезы. Чудище было огромно! (22.02.2018),Военное телевидение,2018-02-22,11399,71,15,8,RU,Education
isOvq28c_dI,"Что делать, когда вам мешают",Эра Водолея,2018-02-22,6590,593,10,32,RU,Education
XWsBRV9kC2w,Ждут ли новые отношения? Суждено ли мне быть в паре?,Лара Логинова-Таро,2018-02-23,3456,366,23,74,RU,Education
UKyB6MQeOXs,Товары и услуги при капитализме,Блог Торвальда,2018-02-24,2428,251,23,107,RU,Education
MRdM0ixpn7E,17.03.2018 фирма РФ закрывается! Возвращаемся в правовое поле СССР! - 22.02.2018,Правовед ТВ,2018-02-23,5500,648,21,0,RU,Education
ww1-wMG5gms,ГРУБЕЙШИЕ ЖЕНСКИЕ ОШИБКИ В ОТНОШЕНИЯХ! Юлия Ланске,Julia Lanske,2018-02-23,6778,472,18,42,RU,Education
C5Ip4UGGhCs,"Быков: травля Серебрякова после интервью Дудю [Один, 23 февраля 2018]",Дмитрий Быков [Радиоэфиры],2018-02-23,16524,313,29,104,RU,Education
8MaYSMfAk8w,"Криптовалюта Павла Дурова ОБМАН, МАЙНЕРЫ ЖГУТ ДОМА",Мамкин майнер,2018-02-25,756,72,12,8,RU,Education
7V5zT294Xpo,Встреча в выходные дни 2018-02-24,Programas Teocraticos,2018-02-24,1671,73,7,0,RU,Education
1uXJgZto2iU,Борис Юлин про рабство,Dmitry Puchkov,2018-02-24,89152,4967,136,516,RU,Education
DVYsF0DMeas,Сенсация! C 16.03.2017 cуды РФ ликвидированы! (Ленур Усманов) [24.02.2018],Правовед ТВ,2018-02-24,3033,463,3,81,RU,Education
vCyGCLri6jg,Душевный огонь,Уроки Медитации,2018-02-25,6142,871,4,131,RU,Education
C0jZWTOigr8,Гаагский суд принял заявление против В.В. Путина [26.02.2018],Правовед ТВ,2018-02-26,10239,1207,225,646,RU,Education
C0jZWTOigr8,Гаагский суд принял заявление против В.В. Путина [26.02.2018],Правовед ТВ,2018-02-26,73720,0,0,1384,RU,Education
S4MbX8bWO1I,МОЩНЕЙШИЕ ИНСТРУМЕНТЫ ДЛЯ ВОЗВРАТА МУЖЧИНЫ! Юлия Ланске,Julia Lanske,2018-02-27,11939,954,15,96,RU,Education
m-sZDyLvA7I,✿ LET`S COOK ✿ Самодельная свежая ПАСТА в домашних условиях  ♥,Маша Zолина,2018-02-27,17798,2188,7,0,RU,Education
qKD1hPLxEXg,Аналитический сериал Уполномочен огласить. 4 серия. Отсчёт пошел. 6 лет...,Сергей Будков,2018-02-27,10223,601,18,80,RU,Education
QRgeKzEwseU,Во время теледебатов Ксения Собчак вылила стакан воды на Владимира Жириновского,Коммерсантъ,2018-02-28,28527,77,9,0,RU,Education
1gnXLMvF3BE,Детское питание. Что нужно есть на ужин? - Доктор Комаровский,Доктор Комаровский,2018-03-01,2001,185,17,24,RU,Education
k55YSFnBwAI,Как правильно общаться с мужчиной | Психология мужчин,Павел Раков,2018-03-01,1332,136,2,4,RU,Education
qqTfKtlf0Lg,Почему я не доверяю прививкам,Блог Торвальда,2018-03-02,2417,242,57,97,RU,Education
UpaIEDWPBpU,Разведданные ТВ. Новости . 02.03.2018 гг.,Сергей Будков,2018-03-02,12601,943,12,104,RU,Education
QJc-VrczG7s,РОССИЯ 1991 - 2018 гг. / СТАТИСТИКА / ФАКТЫ,Tyler Durden,2018-03-03,3419,743,43,346,RU,Education
KUvaZk62CqY,Постскриптум (03.03.2018),Постскриптум с Алексеем Пушковым,2018-03-03,166946,2050,277,1447,RU,Education
nJ3b8jRYNPU,Разведданные ТВ. Новости 03.03.2018 гг.,Сергей Будков,2018-03-03,14583,1095,13,146,RU,Education
tNwKtjsvDv0,Как получить эффект от  аффирмаций,Эра Водолея,2018-03-03,6602,509,3,36,RU,Education
Z_8E_QPTaqo,«Пекинский человек» Сергей Савельев (Вынос мозга #34),издательство ВЕДИ,2018-03-03,4880,326,19,147,RU,Education
kFb-H1zcjG8,КУПИ МНЕ ТО… СДЕЛАЙ ЭТО… НЕ ГОВОРИ ТАК! Юлия Ланске,Julia Lanske,2018-03-03,7510,483,14,43,RU,Education
TngesFm8xiQ,Гелий - СВЕРХТЕКУЧИЙ И САМЫЙ ХОЛОДНЫЙ ГАЗ!,Thoisoi,2018-03-03,119726,8476,118,340,RU,Education
JFUaoD3maLA,Что с ними стало? - Победители шоу талантов,Теперь я Знаю,2018-03-05,59642,5857,167,465,RU,Education
zRsk9FPktbw,Сила Благодарности,Уроки Медитации,2018-03-04,6588,1009,8,122,RU,Education
3Yw3bnYpT0w,Grattol | Лайфхак для идеального выравнивания | Классический маникюр,Алёна Sokololof,2018-03-04,16803,1191,14,200,RU,Education
DQfZdgoNTJY,«Глупая Лошадь» - Доктор Комаровский рассказывает стишок Вадима Левина,Доктор Комаровский,2018-03-05,1899,236,2,29,RU,Education
JFUaoD3maLA,Что с ними стало? - Победители шоу талантов,Теперь я Знаю,2018-03-05,255703,11503,556,858,RU,Education
OM6K2QQ4t8Y,Разведданные ТВ. Новости 05.03.2018 гг.,Сергей Будков,2018-03-05,6624,848,7,88,RU,Education
6aWwAhmKlmM,"Оскар 2018. Шутки, скандалы и речь победителей на английском || Skyeng",Skyeng: онлайн-школа английского языка,2018-03-06,9130,892,21,45,RU,Education
ubom3SKKRpw,Весенний маникюр. Тонкие линии. Дизайн ногтей 51,Verakso,2018-03-05,7559,926,12,73,RU,Education
sUfQvxJrM68,18 ЯИЦ ЗА ДВА ГОДА.  Парень научился откладывать яйца.,GREAT STORY,2018-03-05,7585,63,46,30,RU,Education
ujweVqy9dwc,Нужно ли школьнику покупать дорогой мобильный телефон?,Теперь я Знаю,2018-03-07,24174,2163,524,1182,RU,Education
JcZoIOA_FiM,Аналитический сериал Уполномочен огласить. 5 серия. Передел Мира...,Сергей Будков,2018-03-06,4357,412,7,49,RU,Education
6aWwAhmKlmM,"Оскар 2018. Шутки, скандалы и речь победителей на английском || Skyeng",Skyeng: онлайн-школа английского языка,2018-03-06,44866,2800,49,125,RU,Education
UzJBnTJ1Nr4,"Криптовалюту используют НА ВЫБОРАХ, Последний шанс или многоходовочка?",Мамкин майнер,2018-03-07,760,68,8,19,RU,Education
JYbO9lkt8-4,Егор Яковлев об историческом контексте фильма Движение вверх,Dmitry Puchkov,2018-03-06,52399,2899,92,442,RU,Education
8wBUmJWVfP8,"ТЫ УВЕРЕНА, ЧТО У ТЕБЯ С НИМ ВСЁ ХОРОШО?! Юлия Ланске",Julia Lanske,2018-03-06,6988,470,16,43,RU,Education
f8WLIAVkw_E,Как улучшить интуитивные способности,Эра Водолея,2018-03-06,5969,433,6,20,RU,Education
46MH36fbMYU,Как Душа разговаривает с вами,Пятое Измерение,2018-03-06,6743,534,13,32,RU,Education
SvY-aZEmMqM,🛠 ОРИГИНАЛЬНЫЕ И НЕРЕАЛЬНО КРУТЫЕ САМОДЕЛКИ ИЗ АВТОЗАПЧАСТЕЙ! ТОП 5 КРУТЫХ ИДЕИ!,Школа Ремонтника,2018-03-08,8023,380,38,42,RU,Education
K0beA2aaRXs,Приняв участие в выборах - ты В ЛЮБОМ случае голосуешь за Путина! [08.03.2018],Правовед ТВ,2018-03-08,4013,345,153,259,RU,Education
RKQXAlOrjts,BENDY VS SONIC | СУПЕР РЭП БИТВА | Бенди И Чернильная Машина and the ink machine ПРОТИВ Соник ежик,ДАМБО MUSIC,2018-03-09,64813,2251,225,3012,RU,Education
GlTbFcu6cvM,Притча - Как лучше для меня,Эра Водолея,2018-03-09,9230,821,22,75,RU,Education
GLBIzwHKUx0,"Миссис России о шести детях, воспитании без нянь и где найти время на себя",Mila Levchuk,2018-03-09,17998,1655,58,275,RU,Education
V7gGrdUxdjs,"Переходим в пятое измерение? Вопросы к Нострадамусу, Кейси и Ванге. (10.03.18)",Игорь Ткаченко,2018-03-10,26592,425,128,58,RU,Education
PNq4FESSgQM,Разведданные ТВ. Новости 10.03.2018 гг.,Сергей Будков,2018-03-10,7676,612,8,92,RU,Education
2H38nTu9axk,Постскриптум (10.03.2018) © ТВ Центр,Постскриптум с Алексеем Пушковым,2018-03-10,160677,1661,237,956,RU,Education
9O1RKLPYr9s,Территория заблуждений (10.03.2018),Военное телевидение,2018-03-10,19821,98,76,63,RU,Education
ptJq7Vaf2PA,Кости гигантов на гравюрах Пиранези. Доказательства существования великанов до потопа в 18 веке,Крамола,2018-03-10,7990,1174,14,45,RU,Education
EP-nLwyEYk8,Клим Жуков про чайные и опиумные клиперы,Dmitry Puchkov,2018-03-11,122925,6787,185,1075,RU,Education
VchrgQJAOcw,ЭТОГО НЕ ХВАТАЕТ МНОГИМ ОТНОШЕНИЯМ… Юлия Ланске,Julia Lanske,2018-03-11,9942,877,25,107,RU,Education
CJ78niIk9hs,Практика благодарности на каждый день,Эра Водолея,2018-03-14,9946,831,11,51,RU,Education
TqWy78fGNxE,"👹 ИГРУШКИ, КОТОРЫЕ ЗАРАБАТЫВАЮТ КРИПТОВАЛЮТУ - ОБЗОР ICO MONSTERBIT",Ракета t8,2018-03-15,2178,257,36,76,RU,Education
r3uACJHRioY,"ОФИЦИАНТКА ПОКОРМИЛА БЕЗДОМНОГО, НО ОНА ДАЖЕ ПРЕДСТАВИТЬ СЕБЕ НЕ МОГЛА, ЧЕМ ЭТО ДЛЯ НЕЕ ЗАКОНЧИТСЯ…",Я В ШОКЕ!,2018-03-13,673737,13483,642,992,RU,Education
ETV1f1qyI3k,"СЛУШАЙТЕ «АЛЬ КАХФ» - СКАЗАНО АЛЛАХ ДАЕТ УСПОКОЕНИЕ, ДУШЕВНЫЙ ПОКОЙ ТОМУ ЧЕЛОВЕКУ.(ПОЛНЫЙ ПЕРЕВОД)","Слушай Коран, Заряжай Иманッ",2018-03-15,6226,310,8,28,RU,Education
emCIywOVvH8,КОКОН эволюция,БМ LIFE,2018-03-15,20608,0,0,0,RU,Education
QpNsE5fXGl0,ЛЕДИ БАГ И СУПЕР КОТ VS ФИКСИКИ | СУПЕР РЭП БИТВА | Miraculous Ladybug ПРОТИВ Fixiki Новые Серии,ДАМБО MUSIC,2018-03-16,35134,1721,95,3817,RU,Education
vK6pTxw1suE,Просто позвольте происходить этому. Изменение сознания,Пятое Измерение,2018-03-16,9592,729,11,66,RU,Education
lS7RZLBhoFE,Постскриптум (17.03.2018) © ТВ Центр,Постскриптум с Алексеем Пушковым,2018-03-17,171413,1823,246,1019,RU,Education
nMhxEjti0lg,"МУЖЧИНА КУПИЛ СТАРЫЙ КОМОД, А КОГДА СЛУЧАЙНО НАШЁЛ ПОТАЙНОЙ ЯЩИК, У НЕГО ЧЕЛЮСТЬ ОТВИСЛА!",Я В ШОКЕ!,2018-03-17,41625,956,56,167,RU,Education
QfIG5uUve58,Скрытые  антенны и слежка за людьми! Часть 2,Проверь все сам!,2018-03-17,12547,545,38,66,RU,Education
_Gx1BWiVZjs,Встреча в выходные дни 2018-03-17,Programas Teocraticos,2018-03-17,2262,78,6,0,RU,Education
Ha13RFROO44,Рутений - Самый ПОДОЗРИТЕЛЬНЫЙ МЕТАЛЛ НА ЗЕМЛЕ!,Thoisoi,2018-03-17,120550,7905,226,654,RU,Education
At-WB2MBiLg,"Не Доверяйся людям, Не говори о Своей Вере! Никон (Воробьев)",Дух Проповеди Православие,2018-03-17,17540,716,22,24,RU,Education
zzPhGTvHdoo,Щедрость,Уроки Медитации,2018-03-19,4683,521,2,67,RU,Education
SaewMFgYXUA,Лег спать в СССР - проснулся уже в РФ!!! [19.03.2018],Правовед ТВ,2018-03-18,2130,271,10,60,RU,Education
nMhxEjti0lg,"МУЖЧИНА КУПИЛ КОМОД, А ПОСЛЕ НАШЁЛ ПОТАЙНОЙ ЯЩИК. ОТ ТОГО, ЧТО ОН ТАМ УВИДЕЛ У НЕГО ЧЕЛЮСТЬ ОТВИСЛА!",Я В ШОКЕ!,2018-03-17,162712,1892,156,301,RU,Education
3qQkcXxdiOQ,Разведданные ТВ. Новости 19.03.2018 гг.,Сергей Будков,2018-03-19,10703,863,13,106,RU,Education
yGmBNyL8JSE,ЭТО БЫЛ ЕЁ ВЫБОР...  — [ЗАБИТЫЕ РУКИ #16],Забитые Тв,2018-03-19,63443,2495,69,494,RU,Education
NkAp4Oc_w80,Устаревшая Система Образования,MyGap,2018-03-20,65815,13115,329,1685,RU,Education
vQuo-FOhTQk,"Он будет облизывать монитор, если ты ЭТО напишешь! Юлия Ланске",Julia Lanske,2018-03-20,11549,1033,21,142,RU,Education
MHXKrscnMxQ,"Семья из Узбекистана, получив гражданство РФ, осталась без паспортов [21.03.2018]",Правовед ТВ,2018-03-21,1835,122,6,38,RU,Education
ZM27yz4nel8,Указ Путина о призыве на Военные Сборы в 2018 году,Блог Юридической Помощи,2018-03-21,827,51,4,2,RU,Education
QdWz0esqMhg,Пророчество = Бог даст смерть антихриста Путина от Царя Руси в 2018 году.,Правда ТВ,2018-03-16,5193,131,16,48,RU,Education
QdWz0esqMhg,Пророчество = Бог даст смерть антихриста Путина от Царя Руси в 2018 году.,Правда ТВ,2018-03-16,37826,823,181,395,RU,Education
NkAp4Oc_w80,Устаревшая Система Образования,MyGap,2018-03-20,134180,21512,686,2569,RU,Education
0lJy9v9d21k,Разведданные ТВ. Новости 21.03.2018 гг.,Сергей Будков,2018-03-21,9168,669,5,70,RU,Education
WKTI0E3MwZo,Как почистить Блонд,Andrey Strinadkin,2018-03-21,2913,436,6,38,RU,Education
A8H0BSVNFfo,Хочу замуж бесплатный вебинар Павла Ракова,Павел Раков,2018-03-22,12578,194,26,3,RU,Education
F4436uMs9qk,Что было бы без ожиданий,Эра Водолея,2018-03-22,7941,721,4,69,RU,Education
uw2Oadj4jfs,ПОСЛЕ ЭТОЙ ПЕРЕПИСКИ ОН ЗАХОЧЕТ ВСТРЕЧИ  С ТОБОЙ! Юлия Ланске,Julia Lanske,2018-03-22,7810,700,8,79,RU,Education
_c16gFa8eyU,Тайны Чапман. Оранжевое чудо (22.03.2018),Военное телевидение,2018-03-22,13808,84,12,30,RU,Education
EiGJGVj4jq8,Павел Глоба О НОВОМ СРОКЕ ПУТИНА!,Топ Бизнес,2018-03-20,19442,53,39,18,RU,Education
m9INumldOjM,Разведданные ТВ. Новости 23.03.2018 гг.,Сергей Будков,2018-03-23,9841,770,6,70,RU,Education
iB1BEe5T8ug,Снайперский счет (23.03.2018),Военное телевидение,2018-03-23,14725,201,24,23,RU,Education
6YwR1M9oQSg,"Кто ты, подарок судьбы или наказание?",Лара Логинова-Таро,2018-03-23,7615,453,21,194,RU,Education
vDacZaFA5KQ,Постскриптум с Алексеем Пушковым (24.03.2018) © ТВ Центр,Постскриптум с Алексеем Пушковым,2018-03-24,192702,2079,371,887,RU,Education
pzXgrZRLpMg,Что решил Запад?С.Демура,Cherrysun,2018-03-24,17608,169,49,54,RU,Education
h64WeR5T_QM,Слово   это энергия,Пятое Измерение,2018-03-24,10870,1000,17,62,RU,Education
PEqblTlgmUk,Признаки самообмана,Эра Водолея,2018-03-24,8522,613,12,56,RU,Education
OZfqulznUuI,Разведданные ТВ.Новости 24.03.2018 гг.,Сергей Будков,2018-03-24,11401,733,13,124,RU,Education
6peg1llTIbM,"ПРИЧИНЫ, УБИВАЮЩИЕ ВАШУ ЛЮБОВЬ! Юлия Ланске",Julia Lanske,2018-03-24,9207,829,10,78,RU,Education
FrjjGXIHaag,Сделает ли он шаг навстречу к примирению?,Лара Логинова-Таро,2018-03-25,5548,371,16,191,RU,Education
Ce3gNX7ZrxI,"Люди прыгают из окон, пытаясь спастись от пожара в Кемерово",Интересные видео,2018-03-25,5188,30,3,34,RU,Education
SJ8mz-rf9Jc,"МАТЬ НЕ МОГЛА ПОНЯТЬ, ПОЧЕМУ ТРАВА НА МОГИЛЕ ЕЕ СЫНА СТАЛА ЗЕЛЕНОЙ. ПОТОМ ОНА ПОНЯЛА, В ЧЕМ ПРИЧИНА…",Я В ШОКЕ!,2018-03-26,157532,3040,96,160,RU,Education
Gq1K2xtexrU,Кемерово пожар в ТЦ Зимняя вишня,allasc,2018-03-26,80515,412,76,156,RU,Education
37jWj8LUFcI,Сколько погибло в Кемерово? Пруфы. Зимняя вишня. [ Сергей Домогацкий ] Пожар в ТЦ. Торговый центр.,Сергей Домогацкий,2018-03-27,334537,2277,710,1065,RU,Education
xb1ENpUM7BA,Губернатор Кемеровской области извинился перед Путиным за пожар в ТЦ «Зимняя вишня»,Коммерсантъ,2018-03-27,47847,103,459,0,RU,Education
i46CM-BYg_I,Пожар в Кемерово | Зимняя вишня | О чем молчат сми ? сколько детей погибло ?,Nicolas Noir,2018-03-27,64503,699,1325,297,RU,Education
mY9COr723PM,Разведданные ТВ. Дирижёр и первая скрипка. МИ 6 и ЦРУ.,Сергей Будков,2018-03-27,9012,849,15,126,RU,Education
37jWj8LUFcI,Сколько погибло в Кемерово? Пруфы. Все проверяйте. Не позволяйте себя обмануть. Зимняя вишня.,Сергей Домогацкий,2018-03-27,585702,4247,1784,2199,RU,Education
P45E8LKiXEY,В ПАМЯТЬ О ПОГИБШИХ В ТЦ ЗИМНЯЯ ВИШНЯ г. КЕМЕРОВО. 25.03.18.,Я В ШОКЕ!,2018-03-28,32930,1923,40,322,RU,Education
t7MfMKVcBgg,Разведданные ТВ. Новости 28.03.2018 гг,Сергей Будков,2018-03-28,8800,804,10,112,RU,Education
G-5qdNG3D7c,Контролер кинотеатра в Зимней вишне дает первое интервью!,Прохор Прохоров,2018-03-28,6464,28,6,12,RU,Education
jQNazsWnQKU,"Tyler, The Creator - OKRA","Tyler, The Creator",2018-03-29,1476311,164064,1092,10901,RU,Education
Da_Rg7M8xo8,Кемерово: жертвоприношение детей в пасхальную неделю,harekrishnazpinfo,2018-03-28,31939,913,89,399,RU,Education
khIVz-Be9wQ,"ВОЕННАЯ ТАЙНА с Игорем Прокопенко. ВСЕОБЩЕЕ ОТУПЛЕНИЕ. © РЕН ТВ. Старый,но интересный выпуск.",ПОИСК ЗОЛОТА,2018-03-29,7179,41,4,26,RU,Education
e-k9_6O-27s,МОЙ ОПЫТ: КИБЕРБУЛЛИНГ ИЗ-ЗА РАБОТЫ В ВЕБКАМЕ,Дарья Зарыковская,2018-03-29,46980,7561,192,517,RU,Education
4DDO_o-04uY,Разведданные ТВ. Новости 29.03.2018 гг.,Сергей Будков,2018-03-29,8374,849,5,107,RU,Education
w9urAFX_UQM,МАРЬЯНА РО VS МИСТЕР МАКС | СУПЕР РЭП БИТВА | Mister Max челлендж ПРОТИВ Maryana Ro интервью ивангай,ДАМБО MUSIC,2018-03-30,49909,2663,807,3062,RU,Education
ymCEst8h0_0,Rahim Şəkinski və arvadı güllələndi...,Xeber Movqeyi,2018-03-30,59281,166,96,59,RU,Education
"#NAME?","Быков о Кемерово [Один, 30 марта 2018]",Дмитрий Быков [Радиоэфиры],2018-03-30,19765,274,43,61,RU,Education
q5OQsDKf0ic,Притча - Счастливый шанс,Эра Водолея,2018-03-30,6828,642,5,61,RU,Education
yYpc7zHm3qg,ЭТИКЕТ. КАК ПРОЙТИ ПРОВЕРКУ У СТАТУСНОГО МУЖЧИНЫ,Mila Levchuk,2018-03-30,12062,1741,30,224,RU,Education
QY6d6ESdNic,Кемерово.Как горит поролон. Эксперимент МК,Зоогуманизм,2018-03-29,19273,46,31,15,RU,Education
Q3qMyfILbWw,Рождение нового мирового сознания,Пятое Измерение,2018-03-30,9067,702,8,46,RU,Education
i-yUyKqNkXw,Жизнь подростка в Древнем Риме [Ted Ed],In Cor Cadit,2018-03-31,86919,5168,111,249,RU,Education
soeFv7R_gZA,Постскриптум с Алексеем Пушковым (31.03.2018) © ТВ Центр,Постскриптум с Алексеем Пушковым,2018-03-31,193384,2073,223,751,RU,Education
2nTqf4jpAPg,Разведданные ТВ. Новости 31.03.2018 гг,Сергей Будков,2018-03-31,8283,949,8,111,RU,Education
QS8oDZjHq9w,Не надо жить ради детей,Эра Водолея,2018-03-31,9518,801,22,65,RU,Education
RWSEIcIhlxU,САМОДЕЛЬНЫЕ СПИЧКИ ОКАЗАЛИСЬ НЕ ХУЖЕ ПОКУПНЫХ!,Thoisoi,2018-03-31,126979,14819,170,569,RU,Education
lAzOaA-4Fp8,Быть сильному землетрясенью в апреле... Пророчество (2),Валентина Склярова,2018-03-23,28354,176,94,159,RU,Education
i-yUyKqNkXw,Жизнь подростка в Древнем Риме [Ted Ed],In Cor Cadit,2018-03-31,258047,9841,287,431,RU,Education
_Pu00cRWrOY,Кемерово: неуклюжие попытки скрыть жертвоприношение детей,harekrishnazpinfo,2018-04-01,37636,0,0,439,RU,Education
2spqEyLjFPI,"Не пиши ЭТО в соцсетях, а то потеряешь мужчину. БЖ. Юлия Ланске",Julia Lanske,2018-04-01,7967,708,11,58,RU,Education
yz4En8Zr8Vo,Андрей Фурсов - Две фракции глобальной элиты 30.03.2018,Андрей Фурсов,2018-04-01,20726,682,14,85,RU,Education
AMxhXl2gQY4,ВСЯ ПРАВДА О ЗАРПЛАТАХ УЧИТЕЛЕЙ / УЧИТЕЛЯ - МИЛЛИОНЕРЫ,Павел Астапов,2018-04-02,15539,2431,13,360,RU,Education
FGA_kwRmTlE,Тайны Чапман. Тайна серебряной пули (02.04.2018),Военное телевидение,2018-04-02,22310,124,23,25,RU,Education
g9yMZEKdL_o,Самый успешный пират в истории [Ted Ed],In Cor Cadit,2018-04-02,49054,4208,37,224,RU,Education
6-js6ECDJj0,Разведданные ТВ. Новости 03.04.2018 гг,Сергей Будков,2018-04-03,6282,690,3,75,RU,Education
X0qYzfZ_e7E,Ölüm xəbəri yayılan Səbinə ilə bağlı xəstəxanadan son məlumat,Xeber Movqeyi,2018-04-03,73253,262,70,116,RU,Education
YsrsG5prsIY,Прямая трансляция АМОКОНФ 2018 СК Олимпийский,amoCRM [RU],2018-04-04,55368,652,128,42,RU,Education
29LYo14Pjls,"Səbinənin oğlunun bu sözləri ürək parçaladı Ana, kaş ki, sən",Xeber Movqeyi,2018-04-04,295246,2446,212,585,RU,Education
tlylSRrvGCs,Где ваша энергия,Эра Водолея,2018-04-04,9722,953,13,77,RU,Education
KvJZx7goOjU,Разведданные ТВ. Новости 04.04.2018 гг,Сергей Будков,2018-04-04,11617,885,18,102,RU,Education
Q6jnS6-q-XU,Как сохранить высокие вибрации,Пятое Измерение,2018-04-04,8477,857,13,53,RU,Education
aedhFVwZ9JY,Великий ЧЕТВЕРГ. Головин Владимир. Страстная седмица,Дух Проповеди Православие,2018-04-05,33056,885,46,44,RU,Education
Jq-e3XcfqBE,10 УГАРНЕЙШИХ СИТУАЦИЙ,Domino Show,2018-04-05,56187,2014,117,443,RU,Education
Bj9UmRohU3o,Разведданные ТВ. Новости 05.04.2018 гг,Сергей Будков,2018-04-05,11333,912,5,82,RU,Education
aWwMSupdCkU,Эти вопросы  изменят вашу жизнь,Эра Водолея,2018-04-06,10939,935,16,47,RU,Education
rQoG_NGNRDQ,Великая ПЯТНИЦА. Слово у Плащаницы. Тихон (Шевкунов) Страстная седмица,Дух Проповеди Православие,2018-04-06,26861,463,12,8,RU,Education
q2alJcqvsxw,Сознание и ДНК,Пятое Измерение,2018-04-06,9723,704,11,45,RU,Education
YaQH4ZXZQNs,Разведданные ТВ. Новости 06.04.2018 гг,Сергей Будков,2018-04-06,12243,840,13,80,RU,Education
-5C7a5_udO0,ОНО VS 5 НОЧЕЙ С ФРЕДДИ | СУПЕР РЭП БИТВА | Pennywise It movie ПРОТИВ 5 Nights At Freddy песня,ДАМБО MUSIC,2018-04-06,34896,2375,127,5524,RU,Education
kMIkp7a40ac,АЛЕКСЕЙ ЗЕМСКОВ И ОСОБЕННЫЕ БЛОгЕРЫ. РАЗНОС #1,1) Алексей Земсков (zems.pro),2018-04-13,255706,37541,4095,3756,RU,Education
VwX7Gpw4DBc,Разведданные ТВ. Новости 13.04.2018 гг.,Сергей Будков,2018-04-13,16145,1012,20,165,RU,Education
opM1krpB1x0,Как создать гармонию в себе,Эра Водолея,2018-04-13,12471,878,13,42,RU,Education
_YsfXziV2oY,Секрет привлечения родственной души,Эра Водолея,2018-04-14,13249,1108,21,44,RU,Education
vyfHxFgp_O0,СДЕЛАЛ И ПОПРОБОВАЛ САМУЮ ОСТРУЮ ЖИДКОСТЬ В МИРЕ!,Thoisoi,2018-04-14,164010,14233,277,1622,RU,Education
75pAvDmNLKs,Разведданные ТВ. Новости 14.04.2018 гг.,Сергей Будков,2018-04-14,10155,1029,10,144,RU,Education
RuORycN3zLY,"СЛУШАЙТЕ КАЖДОЕ УТРО - С УТРА ЗАРЯЖАЕТ НАСТРОЕНИЕ НА ВЕСЬ ДЕНЬ, УКРЕПЛЯЕТ ИМАН, ДАЕТ СИЛЫ","Слушай Коран, Заряжай Иманッ",2018-04-15,7630,418,5,33,RU,Education
6uMYV-Et7-s,Разведданные ТВ. Новости 16.04.2018 гг.,Сергей Будков,2018-04-16,9180,925,5,98,RU,Education
HgG8Y0A0TbE,Как не стоит начинать разговор,Эра Водолея,2018-04-16,10455,650,12,30,RU,Education
r3iEsypOas4,Как легко избежать сценария «неудач» и «поражений»,Alunika Dobrovolski,2018-04-16,7718,846,14,72,RU,Education
gXKYq-gazg0,КАК освободиться от давления родителей и ЖИТЬ КАК ХОЧЕШЬ,Mila Levchuk,2018-04-16,12914,1026,25,129,RU,Education
weAtxbB0Ypg,НАУЧУ ЧИТАТЬ ПО-КОРЕЙСКИ ЗА 5 МИНУТ (серьёзно),Lincore,2018-04-17,52484,5456,155,1030,RU,Education
eW-Fy2fZFU8,Разведданные ТВ. Новости 17.04.2018 гг,Сергей Будков,2018-04-17,7791,749,10,62,RU,Education
Qyk9ZPb51-k,Четыре практики Крайона,Пятое Измерение,2018-04-17,8210,759,14,47,RU,Education
BoFwI-xVYV4,5 признаков навязчивой девушки,Лев Вожеватов,2018-04-17,12140,1007,22,65,RU,Education
EYpbae316rM,Перестаньте ждать,Эра Водолея,2018-04-18,17415,1202,30,122,RU,Education
eYDGOswCvKU,Разведданные ТВ. Новости 18.04.2018 гг.,Сергей Будков,2018-04-18,14022,1018,1,91,RU,Education
FCpzTeyYXKY,Одиночество — приговор? Суждено ли мне встретить настоящую любовь?,Лара Логинова-Таро,2018-04-18,6869,451,24,162,RU,Education
7LlCrUH7yR0,►СРОЧНО! В Йеллоустоун доставили ядерные боеголовки ракет Минитмен!,Thelema 93,2018-04-10,22623,83,18,55,RU,Education
jqJRmBIQVjs,Разведданные ТВ.Новости 19.04.2018 гг.,Сергей Будков,2018-04-19,10257,827,7,55,RU,Education
a9yWO468uSo,Как найти себя. Презентация,БМ LIFE,2018-04-19,16750,0,0,0,RU,Education
E5HcKTNrQxw,Будет ли новое знакомство?,Лара Логинова-Таро,2018-04-19,8313,751,16,223,RU,Education
AxRLKyC_HLY,Как  помогать правильно,Эра Водолея,2018-04-20,8313,750,10,41,RU,Education
02fsl67JdUo,Разведданные ТВ. Новости 20.04.2018 гг.,Сергей Будков,2018-04-20,11094,933,11,131,RU,Education
kc1E4tTHjA4,Что происходит три дня после смерти,Пятое Измерение,2018-04-20,7401,554,11,94,RU,Education
WVVkqvYtg1k,30 МЕГА УЛЕТНЫХ ПРИКОЛОВ,Domino Show,2018-04-21,91168,2666,307,884,RU,Education
nsNaI5F-SrY,О твоей девственности и немного глубже [The School of Life],In Cor Cadit,2018-04-21,26809,2320,107,321,RU,Education
g01yqza_HKE,Лебединая песня еще прозвучит? Для возрастных девочек.,Лара Логинова-Таро,2018-04-21,4564,432,11,125,RU,Education
6ZIEbHSzJeo,Притча Ангел и Кот,Эра Водолея,2018-04-21,6683,519,6,47,RU,Education
"#NAME?",САМОДЕЛЬНАЯ КРУЖКА -  ХАМЕЛЕОН ИЗ ТЕРМОХРОМНЫХ КРАСОК!,Thoisoi,2018-04-21,94645,6538,118,280,RU,Education
Et8FUmCvw3M,Притча о Правде и Истине,Пятое Измерение,2018-04-21,6548,419,13,44,RU,Education
WgakGwc51pg,Что будет с долларом? / Прогноз на неделю 23 - 28 апреля 2018,InvestFuture,2018-04-21,3405,173,4,33,RU,Education
ugXcKfWL_jc,Разведданные ТВ. Новости 22.04.2018 гг.,Сергей Будков,2018-04-22,7622,720,7,88,RU,Education
y5OxuhFgckA,Зачем он постоянно возвращается в мою жизнь?,Лара Логинова-Таро,2018-04-22,2717,259,12,47,RU,Education
xlmu2ZNBfLg,Женская стратегия - выбирать мужчину,Эра Водолея,2018-04-23,12539,969,22,74,RU,Education
LKobLUHzS58,МНЕНИЕ ИНОСТРАНКИ О РУССКИХ МУЖЧИНАХ,Mila Levchuk,2018-04-23,13913,1236,84,188,RU,Education
9KhWmMjf1AA,ПОЧЕМУ Я НЕ ХУДЕЮ? Главная причина. Ада Кондэ,WOMANUR Ада Кондэ,2018-04-23,2837,288,12,13,RU,Education
C39ZZrxU6IU,ДВА ПУТИ РАЗВИТИЯ ЧЕЛОВЕКА! | Михаил Дашкиев. Бизнес Молодость,БМ ОГОНЬ,2018-04-23,4614,336,4,25,RU,Education
ZYn1Iz_WTUQ,Тайны Чапман. Апокалипсис был вчера (24.04.2018),Военное телевидение,2018-04-24,23418,138,30,31,RU,Education
JSqLC33_en0,Перерасчет Пенсий с 1 Мая без заявления,Блог Юридической Помощи,2018-04-24,18214,229,33,28,RU,Education
ISkAbbE53TE,UNO | комби | дизайн с ФОЛЬГОЙ и геометрия,Алёна Sokololof,2018-04-24,10720,1184,5,153,RU,Education
3W3cok4FkjM,Встреча в будние дни 2018-04-23,Programas Teocraticos,2018-04-25,1239,76,6,0,RU,Education
KrIIgZYhtZk,Алгоритм знакомств и перехода к отношениям,Лев Вожеватов,2018-04-24,8251,679,10,40,RU,Education
4awPU9qp5C8,УЧИТЕСЬ МЕНЬШЕ ГОВОРИТЬ! Как слова и мысли влияют на нашу жизнь.,*Mr.Gens Best,2018-04-24,11410,699,24,26,RU,Education
iYEVP7zoEcs,Любовь без привязанности - свобода в отношениях,Эра Водолея,2018-04-25,11184,809,11,49,RU,Education
Ahivnl0UxRc,Вечер вопросов и ответов,Dmitry Trotsky,2018-04-25,9967,596,11,0,RU,Education
lg3vbqJfVXA,Пробуждение жизни - Весна,Уроки Медитации,2018-04-25,8763,1093,10,117,RU,Education
ZK4tdAG5sRI,🛠 Впечатляющие и Нереально Крутые Самоделки! Топ 5!,Школа Ремонтника,2018-04-26,7240,369,25,36,RU,Education
q-IaVGz2EiU,ЧЕРНОБЫЛЬ СЕГОДНЯ. Нам 30 лет ВРАЛИ!!!,PANDORA,2018-04-26,14893,745,64,98,RU,Education
QtjWPdSCrtc,Отчетность,Кэшбери,2018-04-26,3342,237,11,20,RU,Education
6vzqs390sGU,КОВШ ЭКСКАВАТОРА ЗАЦЕПИЛСЯ ЗА ЧТО-ТО БОЛЬШОЕ И ТВЕРДОЕ... НЕОЖИДАННАЯ НАХОДКА ПОРАЗИЛА ВЕСЬ МИР!,Я В ШОКЕ!,2018-04-26,47325,1099,64,75,RU,Education
uaHH1AHC_ng,10 СЛУЧАЕВ КОГДА ЧТО ТО ПОШЛО НЕ ТАК,Domino Show,2018-04-27,47472,3535,71,829,RU,Education
T9l7hnHzSNs,Женщине важно быть наполненной,Эра Водолея,2018-04-27,10655,824,10,89,RU,Education
GtGg6UuwJ4k,"Как понять, что ты не нравишься мужчине? 12 простых признаков",Julia Lanske,2018-04-27,10675,672,9,75,RU,Education
GfgWa7wmY5c,Перестаньте соСТРАДАТЬ,Пятое Измерение,2018-04-27,7840,608,13,38,RU,Education
q4yThLYF_YI,Как чиновники уничтожают деревья,varlamov,2018-04-28,42929,6508,81,929,RU,Education
XJCfjCHmkTQ,Сила веры и сила воли,Эра Водолея,2018-04-28,9075,822,11,44,RU,Education
c4PkwpQFRwQ,"Никель - Металл, ОБРАЗУЮЩИЙ СУПЕРСПЛАВЫ!",Thoisoi,2018-04-28,107689,7093,146,284,RU,Education
gcU5qPA534A,Самые шокирующие прогнозы. Главное - не бояться! (28.04.2018) © РЕН ТВ,Военное телевидение,2018-04-28,16171,110,20,22,RU,Education
yFKfDIBgXLo,"«Նիկոլը պրոֆեսիոնալ հեղափոխական է և անթերի ղեկավարում է պրոցեսը». Սամվել Սևադա, Երկրի հարցը",Yerkir Media TV,2018-04-28,13560,208,4,15,RU,Education
Xo-8T-OfN7w,не рекламные ИСПЫТАНИЯ ОГНЁМ,Строительство дома. Просто о сложном,2018-04-30,2312,219,10,105,RU,Education
5XXU951eh30,IELTS vs TOEFL: в чем разница экзаменов по английскому || Skyeng,Skyeng: онлайн-школа английского языка,2018-05-01,5845,644,12,37,RU,Education
uwQerYkBAeQ,Как трансформировать свою судьбу? Интервью Дмитрия Троцкого на канале Мистика Вятки,Dmitry Trotsky,2018-05-01,8460,710,13,0,RU,Education
ihyW0dJyJFc,Х1АР ДУКХ НОХЧИ ЧУР НИД МАРШО ЛАДОГ1АЙШ,ВРЕМЯ-ПЕРЕМЕН,2018-04-27,12293,32,31,23,RU,Education
jGUMr4ncWB0,🛠 Крутые Самоделки Своими Руками в Домашних Условиях!,Школа Ремонтника,2018-05-01,11947,543,27,39,RU,Education
HP_0FGU-2uM,ЖЕСТКИЙ ТЕСТ HYPER И ЭКСКУРСИЯ ПО ЗАВОДУ,1) Алексей Земсков (zems.pro),2018-05-01,114627,8623,11769,1282,RU,Education
TUWBbNi-BV4,10 НЕУДАЧНИКОВ,Domino Show,2018-05-03,38771,1764,78,248,RU,Education
zkzojWZBnVk,Почему французы НЕНАВИДЯТ ЛЮКА БЕССОНА? (ft. Chuck review),ЧЕРНЫЙ КАБИНЕТ,2018-05-03,13290,1817,48,111,RU,Education
OscuXHkOHpQ,Популярный дизайн. Геометрия. Дизайн ногтей 60,Verakso,2018-05-03,8467,794,8,25,RU,Education
oAa3hvJtLPE,Тайны Чапман. На чем мы ездим (03.05.2018),Военное телевидение,2018-05-03,20805,104,21,30,RU,Education
QuH67h_cgTg,"Зачем нужно плохое зрение? (Познавательное ТВ, Артём Войтенков)",Познавательное ТВ,2018-05-04,2790,299,15,91,RU,Education
mmnfFQvACfY,ДЕВУШКА КУПИЛА 4 СТАРЫХ КОНТЕЙНЕРА И ПРЕВРАТИЛА ИХ ... В НЕЧТО НЕРЕАЛЬНОЕ!,Я В ШОКЕ!,2018-05-04,84990,2441,143,240,RU,Education
gJNkBOcPjLQ,ЗВЕЗДЕЦ КАКИЕ СМЕШНЫЕ И ИНТЕРЕСНЫЕ МОМЕНТЫ,Domino Show,2018-05-04,42501,1656,116,170,RU,Education
_J_583zfqQc,ГУБКА БОБ VS ЧЕРЕПАШКИ НИНДЗЯ | СУПЕР РЭП БИТВА | Spongebob Squarepants ПРОТИВ Ninja Turtles episode,ДАМБО MUSIC,2018-05-04,44612,2776,237,4852,RU,Education
6aO__-TjmDo,"Что это — любовь, зависимость или желание реванша?",Лара Логинова-Таро,2018-05-04,2988,224,21,66,RU,Education
_WT9c1FznXY,"Осторожно! Слова, вызывающие мутагенный эффект",Пятое Измерение,2018-05-05,9495,850,14,52,RU,Education
1Wm05jdp7_A,Клим Жуков о теории пассионарности Гумилева,Dmitry Puchkov,2018-05-05,88604,4494,276,1449,RU,Education
9nYWOKGuWQ8,Территория заблуждений с Игорем Прокопенко (05.05.2018) © РЕН ТВ,Военное телевидение,2018-05-05,16600,137,25,24,RU,Education
nKM97xA9q5k,Сработает ли принцип бумеранга с моим обидчиком?,Лара Логинова-Таро,2018-05-05,3899,286,8,161,RU,Education
qYBRfXbOynQ,Притча про крылья,Эра Водолея,2018-05-05,6990,675,7,79,RU,Education
kOqjhdYZqcU,Строптивые рабы сцаря получают по заслугам,Volnov Live,2018-05-06,2248,200,13,48,RU,Education
8Wt98Qy31rI,Счастливый образ мышления. Интервью Дмитрия Троцкого каналу FamTV часть 4,Dmitry Trotsky,2018-05-06,5383,371,10,0,RU,Education
DS-BDwybljc,Пожар стадион Ярыгина Красноярск остров отдыха 08.05.2018 без комментариев,Fun-N-Cam studio©,2018-05-08,3706,20,0,11,RU,Education
GHHHQQOjXIo,Михаил Толчельников о современном общественном устройстве Англии,TacticMedia,2018-05-07,11081,445,16,219,RU,Education
NUiE9O7W324,Морфогенетическое поле или откуда приходят наши знания,Пятое Измерение,2018-05-07,7562,472,8,33,RU,Education
c7ff0PHz_jQ,Тонкое выравнивание | стильный дизайн | комбиманикюр,Алёна Sokololof,2018-05-08,11191,1194,11,99,RU,Education
rH6YhbE-GN4,Рисунки для новичков. Дизайн ногтей 61.,Verakso,2018-05-08,7279,775,10,21,RU,Education
8jkMObgpY4M,БЛОгЕРЫ ЗАЯВИЛИСЬ К РОДИТЕЛЯМ НА ДОМ. ЭТО НЕ ШУТКА...,1) Алексей Земсков (zems.pro),2018-05-09,58431,3309,1726,1635,RU,Education
MQEbls7B80Y,Разведданные ТВ. Новости 09.05.2018 гг.,Сергей Будков,2018-05-09,7103,764,11,95,RU,Education
MIg-TrqWzV4,Почему человек много ест,Исцеляйся САМ,2018-05-09,8818,648,9,40,RU,Education
tVMpsbtAZMI,Разведданные ТВ. Новости 10.05.2018 гг.,Сергей Будков,2018-05-10,6163,707,4,90,RU,Education
mafLxPv4xIw,Легкий способ развить мозг и стать креативным,Alunika Dobrovolski,2018-05-10,10579,1050,12,61,RU,Education
WfsTRyi7hAU,3 ПРИЧИНЫ НЕСЧАСТНОЙ ЖИЗНИ. Как быть счастливой? Как жить легко? Ада Кондэ,WOMANUR Ада Кондэ,2018-05-10,9739,641,10,22,RU,Education
cmAfVyWd_IQ,Как не оказаться замужем за нищебродом или брошенной миллионером,Mila Levchuk,2018-05-10,17748,1574,41,194,RU,Education
yWPOgdvrtdo,Разведданные ТВ. Новости 11.05.2018 гг.,Сергей Будков,2018-05-11,5626,614,11,69,RU,Education
i3450ta40K0,Страшное дело с Игорем Прокопенко (11.05.2018) Часть 3,Военное телевидение,2018-05-11,8814,62,8,7,RU,Education
YhKBHcX_FHg,Пикабу: инструкция по созданию манямирка,Smash,2018-05-13,89176,19453,617,1862,RU,Education
xUTC9LLLkCA,Как защититься от манипуляторов и агрессоров,Mila Levchuk,2018-05-13,9359,893,45,11,RU,Education
_UCNE4_P4fU,Аэрогель - САМЫЙ ЛЕГКИЙ МАТЕРИАЛ НА ЗЕМЛЕ!,Thoisoi,2018-05-12,334484,14158,347,641,RU,Education
lZLEZHY1eAc,"Причины бедности. Почему мы бедные?  Привычки, которые ведут к бедности. Сатья дас",Сатья дас,2018-05-13,3070,207,2,1,RU,Education
80QpRDKtDAU,Встреча в выходные дни 2018-05-12,Programas Teocraticos,2018-05-13,3699,100,2,0,RU,Education
EBgrLJqjjuM,Что такое синхронистичность,Пятое Измерение,2018-05-12,13432,834,10,52,RU,Education
jznHAlHwnlo,"СЕСТЕР БЛИЗНЯШЕК СБИЛ АВТОМОБИЛЬ, А ЧЕРЕЗ ГОД ОНИ ВЕРНУЛИСЬ К СВОИМ РОДИТЕЛЯМ",Я В ШОКЕ!,2018-05-13,162807,2481,340,291,RU,Education
xUTC9LLLkCA,Как защититься от манипуляторов и агрессоров,Mila Levchuk,2018-05-13,26351,1389,98,146,RU,Education
7VwUti5EJgE,"Узнай, что мужчины любят больше секса!",Julia Lanske,2018-05-13,9382,541,20,50,RU,Education
jznHAlHwnlo,"СЕСТЕР БЛИЗНЯШЕК СБИЛ АВТОМОБИЛЬ, А ЧЕРЕЗ ГОД ОНИ ВЕРНУЛИСЬ К СВОИМ РОДИТЕЛЯМ",Я В ШОКЕ!,2018-05-13,653323,6264,1203,682,RU,Education
BA9JDS0Buhs,Вы под защитой Духа,Пятое Измерение,2018-05-14,11642,1185,30,113,RU,Education
U_ptCNkyTpQ,Разведданные ТВ. Новости 14.05. 2018 гг.,Сергей Будков,2018-05-14,7143,727,7,96,RU,Education
I9VlqNEaq3g,Загадки человечества с Олегом Шишкиным (14.05.2018),Военное телевидение,2018-05-14,4913,47,3,4,RU,Education
MT5A-BZ5fx8,Минимальная Пенсия с 1 Июня 2018 года,Блог Юридической Помощи,2018-05-15,16940,243,41,32,RU,Education
rWgH0teotSU,ЧТО СНАЧАЛА - СТЯЖКА ИЛИ СТЕНЫ? ОКОНЧАТЕЛЬНЫЙ ОТВЕТ ОТ АЛЕКСЕЯ ЗЕМСКОВА,1) Алексей Земсков (zems.pro),2018-05-17,132140,15334,3247,1367,RU,Education
rvdKcUMlOh4,Вебинар Кто такая девушка-плюс?,Mila Levchuk,2018-05-20,28137,1435,92,191,RU,Education
OuZ-7qZw4hA,25 ЛЕТ ОТШЕЛЬНИК ЖИВЕТ В ПЕЩЕРЕ ТОЛЬКО СО СВОЕЙ СОБАКОЙ. УВИДЕВ ЕЕ ИЗНУТРИ – ПРОПАДАЕТ ДАР РЕЧИ!,Я В ШОКЕ!,2018-05-21,38492,1514,48,131,RU,Education
iaWfg2KOz7Q,ГЛАВНОЕ В РЕМОНТЕ: НУЛЕВАЯ ОТМЕТКА И ПРОЁМЫ ДВЕРЕЙ. МАСТЕР-КЛАСС ОТ АЛЕКСЕЯ ЗЕМСКОВА,1) Алексей Земсков (zems.pro),2018-05-21,93435,6243,575,715,RU,Education
UTJ84npy9BI,Почему отключили пополнение и тарифы?,Кэшбери,2018-05-21,23230,567,104,97,RU,Education
SQsPvrev_bQ,435,"Tyler, The Creator",2018-05-22,401968,48860,192,3136,RU,Education
QJCeZzUmw1w,"КАК ЖИВУТ АМЕРИКАНЦЫ - ОБЗОР ДОМА В ГОЛЛИВУДЕ. 5 причин, почему они странные",Marina Mogilko,2018-05-23,45869,4705,115,575,RU,Education
eh71aGzrIZQ,Армен Гаспарян о книге Ложь Посполита,Dmitry Puchkov,2018-05-24,42607,2943,109,610,RU,Education
2erxLEFgS3U,ИСТОРИКАМ ЗАПРЕЩЕНО ГОВОРИТЬ ОБ ЭТОМ. ТАРТАРИЯ ТОЛЬКО ФАКТЫ Часть 1. Обновлённая версия трилогии,Крамола,2018-05-26,31820,2122,99,488,RU,Education
fHKJJJGKtuk,"Большой Стрим #57-2. ЕГЭ по информатике 2018, 11 класс",Информатик БУ,2018-05-27,59281,2095,93,71,RU,Education
fsWlyrPm5dw,Перерасчет Пенсии Пенсионерам на 47 %,Блог Юридической Помощи,2018-05-27,22531,1647,50,82,RU,Education
RwXdTU7qtko,"Клим Жуков о Ливонской войне, часть 2",Dmitry Puchkov,2018-05-27,43708,2893,43,196,RU,Education
zbqG2umhyLU,"Стрим после ЕГЭ #58. ЕГЭ по информатике 2018, 11 класс",Информатик БУ,2018-05-28,21559,571,18,176,RU,Education
mee4DSqNfYk,Энергия слов формирует материю быстрее энергии мыслей,*Mr.Gens Best,2018-05-28,34136,1771,72,59,RU,Education
Da9znj7-1PE,КАК ИЗБАВИТЬСЯ ОТ ДУХОТЫ И ЗАПОТЕВАНИЯ ПЛАСТИКОВЫХ ОКОН? ПРИТОЧНЫЙ КЛАПАН!,1) Алексей Земсков (zems.pro),2018-05-29,105112,11625,600,1232,RU,Education
JHVBNuVuUDA,ЭТОТ ДЕРЕВЕНСКИЙ ПАРЕНЬ УКРАЛ У БАНКА $242 МЛН! И НИЧЕГО ЕМУ ЗА ЭТО НЕ БЫЛО!,Я В ШОКЕ!,2018-05-29,23040,947,57,114,RU,Education
RXtK6PWxN2Q,Разбор КИМа ЕГЭ 2018 по Математике из конверта Часть 1 из 2,Математикс,2018-05-31,25704,759,18,132,RU,Education
7WYkKeKMzoA,1 ДЕНЬ ДО ЕГЭ ПО МАТЕМАТИКЕ! РЕШАЕМ ЗАДАЧИ ВТОРОЙ ЧАСТИ,Wild Mathing,2018-05-31,23028,947,38,26,RU,Education
T7WtfwFlVSg,ЕГЭ 2018 МАТЕМАТИКА✏️,lomonosovclub.com,2018-05-31,21574,1639,28,11,RU,Education
1pP4oh9cUPo,Досрочный ЕГЭ 2018 по математике от 11 апреля (полный разбор всех заданий варианта),Школа Пифагора ЕГЭ и ОГЭ по математике,2018-05-31,14886,1894,15,4,RU,Education
uznRhrmv3fA,“Maşın” şouda dava düşdü,Xeber Movqeyi,2018-05-30,159849,832,148,170,RU,Education
RXtK6PWxN2Q,Разбор КИМа ЕГЭ 2018 по Математике из конверта Часть 1 из 2,Математикс,2018-05-31,36683,848,28,150,RU,Education
tGNavryicl4,С 1970 года он собирал монеты и спустя 45 лет НЕ ПОВЕРИЛ услышанному,iKnow Channel,2018-05-31,196762,4220,309,846,RU,Education
7WYkKeKMzoA,1 ДЕНЬ ДО ЕГЭ ПО МАТЕМАТИКЕ! РЕШАЕМ ЗАДАЧИ ВТОРОЙ ЧАСТИ,Wild Mathing,2018-05-31,25249,964,39,28,RU,Education
nTQlPwEUUds,НЕОБДУМАННЫЕ ПОСТУПКИ,Domino Show,2018-06-01,41452,1446,93,95,RU,Education
tGNavryicl4,С 1970 года он собирал монеты и спустя 45 лет НЕ ПОВЕРИЛ услышанному,iKnow Channel,2018-05-31,594732,11216,866,2021,RU,Education
F0g06xHAQ6o,Уран - САМЫЙ ОПАСНЫЙ МЕТАЛЛ НА ЗЕМЛЕ!,Thoisoi,2018-06-02,223343,18511,462,1677,RU,Education
nTQlPwEUUds,НЕОБДУМАННЫЕ ПОСТУПКИ,Domino Show,2018-06-01,81420,1838,173,113,RU,Education
nIBsmiydK00,Военная тайна с Игорем Прокопенко (02.06.2018),Военное телевидение,2018-06-02,30089,256,42,56,RU,Education
F0g06xHAQ6o,Уран - САМЫЙ ОПАСНЫЙ МЕТАЛЛ НА ЗЕМЛЕ!,Thoisoi,2018-06-02,487965,28583,925,2381,RU,Education
83_M6C_IMkU,"FIRST EVER UNIVERSAL WALLET FOR ETH, NEO, AND EOS | INFINITO WALLET REVIEW | $200 LTC GIVEAWAY!",Crypto Chemist,2018-06-04,44934,199,1,78,RU,Education
FMNjJc_DstM,УЧЁНЫЕ НАС ДУРЯТ С РОЖДЕНИЯ. 7 КРАМОЛЬНЫХ ФАКТОВ О ГРАВИТАЦИИ. РАЗОБЛАЧЕНИЕ ЛЖИ НЬЮТОНА И ФИЗИКОВ,Крамола,2018-06-04,85497,2790,547,884,RU,Education
due4-PwVIvg,"АЛЕКСЕЙ ЗЕМСКОВ И ОСОБЕННЫЕ БЛОгЕРЫ МАСЛОВ, ЧУБАРОВ, ЗОТОВА. РАЗНОС 2 из 41",1) Алексей Земсков (zems.pro),2018-06-04,145013,22327,1543,1565,RU,Education
auiY5rLdkXA,ОГЭ математика Алгебра #16.18,lomonosovclub.com,2018-06-04,23012,850,15,191,RU,Education
DFKT2mqEssM,"Если увидите ФЛЕШКУ в стене, НЕ ТРОГАЙТЕ ЕЁ!",iKnow Channel,2018-06-05,892061,15004,3700,1908,RU,Education
L9duFHWxD88,OLYMP TRADE как быстро заработать на ОЛИМП ТРЕЙД,Добрый Трейдер,2018-06-05,87748,1169,175,338,RU,Education
ZYg2bUfO8Vw,КАК БЛОгЕРЫ НАЕБАЛИ ПОГОРЕЛЬЦЕВ И ПОДПИСЧИКОВ НА ДЕНЬГИ. ЖЕСТЬ КАК ОНА ЕСТЬ.,1) Алексей Земсков (zems.pro),2018-06-06,99350,13065,427,1987,RU,Education
rpVPY9Y_63M,"ВСЕ СЧИТАЛИ, ЧТО ОНА СОШЛА С УМА, ПОКА ВРАЧ НЕ ПОПРОСИЛ ЕЕ НАРИСОВАТЬ ЭТО! я в шоке!",Я В ШОКЕ!,2018-06-06,85800,2155,351,201,RU,Education
DFKT2mqEssM,"Если увидите ФЛЕШКУ в стене, НЕ ТРОГАЙТЕ ЕЁ!",iKnow Channel,2018-06-05,1678797,22154,6217,2747,RU,Education
cypF_T4C6hA,Ободо Орозо. Суроо-жооп. Шейх Чубак ажы New TV 05 06 2018,Насаат Медиа,2018-06-06,12964,409,21,66,RU,Education
ZYg2bUfO8Vw,КАК БЛОгЕРЫ НАЕБАЛИ ПОГОРЕЛЬЦЕВ И ПОДПИСЧИКОВ НА ДЕНЬГИ. ЖЕСТЬ КАК ОНА ЕСТЬ.,1) Алексей Земсков (zems.pro),2018-06-06,179391,16097,633,2551,RU,Education
O31TqiO-NmE,Мастер-класс Выйти на новый уровень,БМ LIFE,2018-06-07,19146,0,0,0,RU,Education
rpVPY9Y_63M,"ВСЕ СЧИТАЛИ, ЧТО ОНА СОШЛА С УМА, ПОКА ВРАЧ НЕ ПОПРОСИЛ ЕЕ НАРИСОВАТЬ ЭТО! я в шоке!",Я В ШОКЕ!,2018-06-06,216975,3686,717,305,RU,Education
sJkFaY9x-NM,Hacı Sahin 3cü Qədir  Gecəsi !,By Sefer H,2018-06-08,40254,1703,29,39,RU,Education
hSA2AOf7amU,5 Крутых ЗАГАДОК Для САМЫХ УМНЫХ!!!,ОТ ВИНТА!,2018-06-09,89534,1006,244,201,RU,Education
LkyyuXKUS7Y,Xoşqədəmin verilişində üzə çıxan qətlin yeni TƏFƏRRÜATI,Xeber Movqeyi,2018-06-10,52132,384,49,164,RU,Education
4XHZt99zLg4,ИСТОРИКИ УВОЛЬНЯЮТСЯ ПОСМОТРЕВ ЭТОТ ФИЛЬМ. КИТАЙСКАЯ ИСТОРИЯ - ФЕЙК. ФАЛЬШИВАЯ ДРЕВНОСТЬ КИТАЯ.,Крамола,2018-06-11,51643,4236,291,839,RU,Education
lX6oK-dwGIE,СЕМЬ СМЕРТНЫХ ГРЕХОВ,СКАЗКИ НАЙТ,2018-06-11,32742,1929,49,253,RU,Education
JgoLzXIa4vw,Мужчина ЗАПЕРТ в этом АППАРАТЕ уже более 60 лет,iKnow Channel,2018-06-12,130249,3327,177,360,RU,Education
1n5X--D_ip8,Военная тайна с Игорем Прокопенко (11.06.2018) Часть 2,Военное телевидение,2018-06-11,51033,227,50,34,RU,Education
9jx3gKjbUck,ЗВЕЗДЕЦ КАКИЕ СМЕШНЫЕ И ИНТЕРЕСНЫЕ МОМЕНТЫ,Domino Show,2018-06-12,33142,1464,58,135,RU,Education
OUdPpzLViWQ,Разбор КИМа ЕГЭ 2018 по Обществознанию,Математикс,2018-06-13,14879,424,9,57,RU,Education
