video_id,title,channel_title,publish_time,views,likes,dislikes,comment_count,Region,category_title
ETV1f1qyI3k,"СЛУШАЙТЕ «АЛЬ КАХФ» - СКАЗАНО АЛЛАХ ДАЕТ УСПОКОЕНИЕ, ДУШЕВНЫЙ ПОКОЙ ТОМУ ЧЕЛОВЕКУ.(ПОЛНЫЙ ПЕРЕВОД)","Слушай Коран, Заряжай Иманッ",2018-03-15,6226,310,8,28,RU,Education
emCIywOVvH8,КОКОН эволюция,БМ LIFE,2018-03-15,20608,0,0,0,RU,Education
QpNsE5fXGl0,ЛЕДИ БАГ И СУПЕР КОТ VS ФИКСИКИ | СУПЕР РЭП БИТВА | Miraculous Ladybug ПРОТИВ Fixiki Новые Серии,ДАМБО MUSIC,2018-03-16,35134,1721,95,3817,RU,Education
vK6pTxw1suE,Просто позвольте происходить этому. Изменение сознания,Пятое Измерение,2018-03-16,9592,729,11,66,RU,Education
lS7RZLBhoFE,Постскриптум (17.03.2018) © ТВ Центр,Постскриптум с Алексеем Пушковым,2018-03-17,171413,1823,246,1019,RU,Education
nMhxEjti0lg,"МУЖЧИНА КУПИЛ СТАРЫЙ КОМОД, А КОГДА СЛУЧАЙНО НАШЁЛ ПОТАЙНОЙ ЯЩИК, У НЕГО ЧЕЛЮСТЬ ОТВИСЛА!",Я В ШОКЕ!,2018-03-17,41625,956,56,167,RU,Education
QfIG5uUve58,Скрытые  антенны и слежка за людьми! Часть 2,Проверь все сам!,2018-03-17,12547,545,38,66,RU,Education
_Gx1BWiVZjs,Встреча в выходные дни 2018-03-17,Programas Teocraticos,2018-03-17,2262,78,6,0,RU,Education
Ha13RFROO44,Рутений - Самый ПОДОЗРИТЕЛЬНЫЙ МЕТАЛЛ НА ЗЕМЛЕ!,Thoisoi,2018-03-17,120550,7905,226,654,RU,Education
At-WB2MBiLg,"Не Доверяйся людям, Не говори о Своей Вере! Никон (Воробьев)",Дух Проповеди Православие,2018-03-17,17540,716,22,24,RU,Education
zzPhGTvHdoo,Щедрость,Уроки Медитации,2018-03-19,4683,521,2,67,RU,Education
SaewMFgYXUA,Лег спать в СССР - проснулся уже в РФ!!! [19.03.2018],Правовед ТВ,2018-03-18,2130,271,10,60,RU,Education
nMhxEjti0lg,"МУЖЧИНА КУПИЛ КОМОД, А ПОСЛЕ НАШЁЛ ПОТАЙНОЙ ЯЩИК. ОТ ТОГО, ЧТО ОН ТАМ УВИДЕЛ У НЕГО ЧЕЛЮСТЬ ОТВИСЛА!",Я В ШОКЕ!,2018-03-17,162712,1892,156,301,RU,Education
3qQkcXxdiOQ,Разведданные ТВ. Новости 19.03.2018 гг.,Сергей Будков,2018-03-19,10703,863,13,106,RU,Education
yGmBNyL8JSE,ЭТО БЫЛ ЕЁ ВЫБОР...  — [ЗАБИТЫЕ РУКИ #16],Забитые Тв,2018-03-19,63443,2495,69,494,RU,Education
NkAp4Oc_w80,Устаревшая Система Образования,MyGap,2018-03-20,65815,13115,329,1685,RU,Education
vQuo-FOhTQk,"Он будет облизывать монитор, если ты ЭТО напишешь! Юлия Ланске",Julia Lanske,2018-03-20,11549,1033,21,142,RU,Education
MHXKrscnMxQ,"Семья из Узбекистана, получив гражданство РФ, осталась без паспортов [21.03.2018]",Правовед ТВ,2018-03-21,1835,122,6,38,RU,Education
ZM27yz4nel8,Указ Путина о призыве на Военные Сборы в 2018 году,Блог Юридической Помощи,2018-03-21,827,51,4,2,RU,Education
QdWz0esqMhg,Пророчество = Бог даст смерть антихриста Путина от Царя Руси в 2018 году.,Правда ТВ,2018-03-16,5193,131,16,48,RU,Education
QdWz0esqMhg,Пророчество = Бог даст смерть антихриста Путина от Царя Руси в 2018 году.,Правда ТВ,2018-03-16,37826,823,181,395,RU,Education
NkAp4Oc_w80,Устаревшая Система Образования,MyGap,2018-03-20,134180,21512,686,2569,RU,Education
0lJy9v9d21k,Разведданные ТВ. Новости 21.03.2018 гг.,Сергей Будков,2018-03-21,9168,669,5,70,RU,Education
WKTI0E3MwZo,Как почистить Блонд,Andrey Strinadkin,2018-03-21,2913,436,6,38,RU,Education
A8H0BSVNFfo,Хочу замуж бесплатный вебинар Павла Ракова,Павел Раков,2018-03-22,12578,194,26,3,RU,Education
F4436uMs9qk,Что было бы без ожиданий,Эра Водолея,2018-03-22,7941,721,4,69,RU,Education
uw2Oadj4jfs,ПОСЛЕ ЭТОЙ ПЕРЕПИСКИ ОН ЗАХОЧЕТ ВСТРЕЧИ  С ТОБОЙ! Юлия Ланске,Julia Lanske,2018-03-22,7810,700,8,79,RU,Education
_c16gFa8eyU,Тайны Чапман. Оранжевое чудо (22.03.2018),Военное телевидение,2018-03-22,13808,84,12,30,RU,Education
EiGJGVj4jq8,Павел Глоба О НОВОМ СРОКЕ ПУТИНА!,Топ Бизнес,2018-03-20,19442,53,39,18,RU,Education
m9INumldOjM,Разведданные ТВ. Новости 23.03.2018 гг.,Сергей Будков,2018-03-23,9841,770,6,70,RU,Education
iB1BEe5T8ug,Снайперский счет (23.03.2018),Военное телевидение,2018-03-23,14725,201,24,23,RU,Education
6YwR1M9oQSg,"Кто ты, подарок судьбы или наказание?",Лара Логинова-Таро,2018-03-23,7615,453,21,194,RU,Education
vDacZaFA5KQ,Постскриптум с Алексеем Пушковым (24.03.2018) © ТВ Центр,Постскриптум с Алексеем Пушковым,2018-03-24,192702,2079,371,887,RU,Education
pzXgrZRLpMg,Что решил Запад?С.Демура,Cherrysun,2018-03-24,17608,169,49,54,RU,Education
h64WeR5T_QM,Слово   это энергия,Пятое Измерение,2018-03-24,10870,1000,17,62,RU,Education
PEqblTlgmUk,Признаки самообмана,Эра Водолея,2018-03-24,8522,613,12,56,RU,Education
OZfqulznUuI,Разведданные ТВ.Новости 24.03.2018 гг.,Сергей Будков,2018-03-24,11401,733,13,124,RU,Education
6peg1llTIbM,"ПРИЧИНЫ, УБИВАЮЩИЕ ВАШУ ЛЮБОВЬ! Юлия Ланске",Julia Lanske,2018-03-24,9207,829,10,78,RU,Education
FrjjGXIHaag,Сделает ли он шаг навстречу к примирению?,Лара Логинова-Таро,2018-03-25,5548,371,16,191,RU,Education
Ce3gNX7ZrxI,"Люди прыгают из окон, пытаясь спастись от пожара в Кемерово",Интересные видео,2018-03-25,5188,30,3,34,RU,Education
SJ8mz-rf9Jc,"МАТЬ НЕ МОГЛА ПОНЯТЬ, ПОЧЕМУ ТРАВА НА МОГИЛЕ ЕЕ СЫНА СТАЛА ЗЕЛЕНОЙ. ПОТОМ ОНА ПОНЯЛА, В ЧЕМ ПРИЧИНА…",Я В ШОКЕ!,2018-03-26,157532,3040,96,160,RU,Education
Gq1K2xtexrU,Кемерово пожар в ТЦ Зимняя вишня,allasc,2018-03-26,80515,412,76,156,RU,Education
37jWj8LUFcI,Сколько погибло в Кемерово? Пруфы. Зимняя вишня. [ Сергей Домогацкий ] Пожар в ТЦ. Торговый центр.,Сергей Домогацкий,2018-03-27,334537,2277,710,1065,RU,Education
xb1ENpUM7BA,Губернатор Кемеровской области извинился перед Путиным за пожар в ТЦ «Зимняя вишня»,Коммерсантъ,2018-03-27,47847,103,459,0,RU,Education
i46CM-BYg_I,Пожар в Кемерово | Зимняя вишня | О чем молчат сми ? сколько детей погибло ?,Nicolas Noir,2018-03-27,64503,699,1325,297,RU,Education
mY9COr723PM,Разведданные ТВ. Дирижёр и первая скрипка. МИ 6 и ЦРУ.,Сергей Будков,2018-03-27,9012,849,15,126,RU,Education
37jWj8LUFcI,Сколько погибло в Кемерово? Пруфы. Все проверяйте. Не позволяйте себя обмануть. Зимняя вишня.,Сергей Домогацкий,2018-03-27,585702,4247,1784,2199,RU,Education
P45E8LKiXEY,В ПАМЯТЬ О ПОГИБШИХ В ТЦ ЗИМНЯЯ ВИШНЯ г. КЕМЕРОВО. 25.03.18.,Я В ШОКЕ!,2018-03-28,32930,1923,40,322,RU,Education
t7MfMKVcBgg,Разведданные ТВ. Новости 28.03.2018 гг,Сергей Будков,2018-03-28,8800,804,10,112,RU,Education
G-5qdNG3D7c,Контролер кинотеатра в Зимней вишне дает первое интервью!,Прохор Прохоров,2018-03-28,6464,28,6,12,RU,Education
jQNazsWnQKU,"Tyler, The Creator - OKRA","Tyler, The Creator",2018-03-29,1476311,164064,1092,10901,RU,Education
Da_Rg7M8xo8,Кемерово: жертвоприношение детей в пасхальную неделю,harekrishnazpinfo,2018-03-28,31939,913,89,399,RU,Education
khIVz-Be9wQ,"ВОЕННАЯ ТАЙНА с Игорем Прокопенко. ВСЕОБЩЕЕ ОТУПЛЕНИЕ. © РЕН ТВ. Старый,но интересный выпуск.",ПОИСК ЗОЛОТА,2018-03-29,7179,41,4,26,RU,Education
e-k9_6O-27s,МОЙ ОПЫТ: КИБЕРБУЛЛИНГ ИЗ-ЗА РАБОТЫ В ВЕБКАМЕ,Дарья Зарыковская,2018-03-29,46980,7561,192,517,RU,Education
4DDO_o-04uY,Разведданные ТВ. Новости 29.03.2018 гг.,Сергей Будков,2018-03-29,8374,849,5,107,RU,Education
w9urAFX_UQM,МАРЬЯНА РО VS МИСТЕР МАКС | СУПЕР РЭП БИТВА | Mister Max челлендж ПРОТИВ Maryana Ro интервью ивангай,ДАМБО MUSIC,2018-03-30,49909,2663,807,3062,RU,Education
ymCEst8h0_0,Rahim Şəkinski və arvadı güllələndi...,Xeber Movqeyi,2018-03-30,59281,166,96,59,RU,Education
"#NAME?","Быков о Кемерово [Один, 30 марта 2018]",Дмитрий Быков [Радиоэфиры],2018-03-30,19765,274,43,61,RU,Education
q5OQsDKf0ic,Притча - Счастливый шанс,Эра Водолея,2018-03-30,6828,642,5,61,RU,Education
yYpc7zHm3qg,ЭТИКЕТ. КАК ПРОЙТИ ПРОВЕРКУ У СТАТУСНОГО МУЖЧИНЫ,Mila Levchuk,2018-03-30,12062,1741,30,224,RU,Education
QY6d6ESdNic,Кемерово.Как горит поролон. Эксперимент МК,Зоогуманизм,2018-03-29,19273,46,31,15,RU,Education
Q3qMyfILbWw,Рождение нового мирового сознания,Пятое Измерение,2018-03-30,9067,702,8,46,RU,Education
i-yUyKqNkXw,Жизнь подростка в Древнем Риме [Ted Ed],In Cor Cadit,2018-03-31,86919,5168,111,249,RU,Education
soeFv7R_gZA,Постскриптум с Алексеем Пушковым (31.03.2018) © ТВ Центр,Постскриптум с Алексеем Пушковым,2018-03-31,193384,2073,223,751,RU,Education
2nTqf4jpAPg,Разведданные ТВ. Новости 31.03.2018 гг,Сергей Будков,2018-03-31,8283,949,8,111,RU,Education
QS8oDZjHq9w,Не надо жить ради детей,Эра Водолея,2018-03-31,9518,801,22,65,RU,Education
RWSEIcIhlxU,САМОДЕЛЬНЫЕ СПИЧКИ ОКАЗАЛИСЬ НЕ ХУЖЕ ПОКУПНЫХ!,Thoisoi,2018-03-31,126979,14819,170,569,RU,Education
lAzOaA-4Fp8,Быть сильному землетрясенью в апреле... Пророчество (2),Валентина Склярова,2018-03-23,28354,176,94,159,RU,Education
i-yUyKqNkXw,Жизнь подростка в Древнем Риме [Ted Ed],In Cor Cadit,2018-03-31,258047,9841,287,431,RU,Education
_Pu00cRWrOY,Кемерово: неуклюжие попытки скрыть жертвоприношение детей,harekrishnazpinfo,2018-04-01,37636,0,0,439,RU,Education
2spqEyLjFPI,"Не пиши ЭТО в соцсетях, а то потеряешь мужчину. БЖ. Юлия Ланске",Julia Lanske,2018-04-01,7967,708,11,58,RU,Education
yz4En8Zr8Vo,Андрей Фурсов - Две фракции глобальной элиты 30.03.2018,Андрей Фурсов,2018-04-01,20726,682,14,85,RU,Education
AMxhXl2gQY4,ВСЯ ПРАВДА О ЗАРПЛАТАХ УЧИТЕЛЕЙ / УЧИТЕЛЯ - МИЛЛИОНЕРЫ,Павел Астапов,2018-04-02,15539,2431,13,360,RU,Education
FGA_kwRmTlE,Тайны Чапман. Тайна серебряной пули (02.04.2018),Военное телевидение,2018-04-02,22310,124,23,25,RU,Education
g9yMZEKdL_o,Самый успешный пират в истории [Ted Ed],In Cor Cadit,2018-04-02,49054,4208,37,224,RU,Education
6-js6ECDJj0,Разведданные ТВ. Новости 03.04.2018 гг,Сергей Будков,2018-04-03,6282,690,3,75,RU,Education
X0qYzfZ_e7E,Ölüm xəbəri yayılan Səbinə ilə bağlı xəstəxanadan son məlumat,Xeber Movqeyi,2018-04-03,73253,262,70,116,RU,Education
YsrsG5prsIY,Прямая трансляция АМОКОНФ 2018 СК Олимпийский,amoCRM [RU],2018-04-04,55368,652,128,42,RU,Education
29LYo14Pjls,"Səbinənin oğlunun bu sözləri ürək parçaladı Ana, kaş ki, sən",Xeber Movqeyi,2018-04-04,295246,2446,212,585,RU,Education
tlylSRrvGCs,Где ваша энергия,Эра Водолея,2018-04-04,9722,953,13,77,RU,Education
KvJZx7goOjU,Разведданные ТВ. Новости 04.04.2018 гг,Сергей Будков,2018-04-04,11617,885,18,102,RU,Education
Q6jnS6-q-XU,Как сохранить высокие вибрации,Пятое Измерение,2018-04-04,8477,857,13,53,RU,Education
aedhFVwZ9JY,Великий ЧЕТВЕРГ. Головин Владимир. Страстная седмица,Дух Проповеди Православие,2018-04-05,33056,885,46,44,RU,Education
Jq-e3XcfqBE,10 УГАРНЕЙШИХ СИТУАЦИЙ,Domino Show,2018-04-05,56187,2014,117,443,RU,Education
Bj9UmRohU3o,Разведданные ТВ. Новости 05.04.2018 гг,Сергей Будков,2018-04-05,11333,912,5,82,RU,Education
aWwMSupdCkU,Эти вопросы  изменят вашу жизнь,Эра Водолея,2018-04-06,10939,935,16,47,RU,Education
rQoG_NGNRDQ,Великая ПЯТНИЦА. Слово у Плащаницы. Тихон (Шевкунов) Страстная седмица,Дух Проповеди Православие,2018-04-06,26861,463,12,8,RU,Education
q2alJcqvsxw,Сознание и ДНК,Пятое Измерение,2018-04-06,9723,704,11,45,RU,Education
YaQH4ZXZQNs,Разведданные ТВ. Новости 06.04.2018 гг,Сергей Будков,2018-04-06,12243,840,13,80,RU,Education
-5C7a5_udO0,ОНО VS 5 НОЧЕЙ С ФРЕДДИ | СУПЕР РЭП БИТВА | Pennywise It movie ПРОТИВ 5 Nights At Freddy песня,ДАМБО MUSIC,2018-04-06,34896,2375,127,5524,RU,Education
kMIkp7a40ac,АЛЕКСЕЙ ЗЕМСКОВ И ОСОБЕННЫЕ БЛОгЕРЫ. РАЗНОС #1,1) Алексей Земсков (zems.pro),2018-04-13,255706,37541,4095,3756,RU,Education
VwX7Gpw4DBc,Разведданные ТВ. Новости 13.04.2018 гг.,Сергей Будков,2018-04-13,16145,1012,20,165,RU,Education
opM1krpB1x0,Как создать гармонию в себе,Эра Водолея,2018-04-13,12471,878,13,42,RU,Education
_YsfXziV2oY,Секрет привлечения родственной души,Эра Водолея,2018-04-14,13249,1108,21,44,RU,Education
vyfHxFgp_O0,СДЕЛАЛ И ПОПРОБОВАЛ САМУЮ ОСТРУЮ ЖИДКОСТЬ В МИРЕ!,Thoisoi,2018-04-14,164010,14233,277,1622,RU,Education
75pAvDmNLKs,Разведданные ТВ. Новости 14.04.2018 гг.,Сергей Будков,2018-04-14,10155,1029,10,144,RU,Education
RuORycN3zLY,"СЛУШАЙТЕ КАЖДОЕ УТРО - С УТРА ЗАРЯЖАЕТ НАСТРОЕНИЕ НА ВЕСЬ ДЕНЬ, УКРЕПЛЯЕТ ИМАН, ДАЕТ СИЛЫ","Слушай Коран, Заряжай Иманッ",2018-04-15,7630,418,5,33,RU,Education
6uMYV-Et7-s,Разведданные ТВ. Новости 16.04.2018 гг.,Сергей Будков,2018-04-16,9180,925,5,98,RU,Education
HgG8Y0A0TbE,Как не стоит начинать разговор,Эра Водолея,2018-04-16,10455,650,12,30,RU,Education
r3iEsypOas4,Как легко избежать сценария «неудач» и «поражений»,Alunika Dobrovolski,2018-04-16,7718,846,14,72,RU,Education
gXKYq-gazg0,КАК освободиться от давления родителей и ЖИТЬ КАК ХОЧЕШЬ,Mila Levchuk,2018-04-16,12914,1026,25,129,RU,Education
weAtxbB0Ypg,НАУЧУ ЧИТАТЬ ПО-КОРЕЙСКИ ЗА 5 МИНУТ (серьёзно),Lincore,2018-04-17,52484,5456,155,1030,RU,Education
eW-Fy2fZFU8,Разведданные ТВ. Новости 17.04.2018 гг,Сергей Будков,2018-04-17,7791,749,10,62,RU,Education
Qyk9ZPb51-k,Четыре практики Крайона,Пятое Измерение,2018-04-17,8210,759,14,47,RU,Education
BoFwI-xVYV4,5 признаков навязчивой девушки,Лев Вожеватов,2018-04-17,12140,1007,22,65,RU,Education
EYpbae316rM,Перестаньте ждать,Эра Водолея,2018-04-18,17415,1202,30,122,RU,Education
eYDGOswCvKU,Разведданные ТВ. Новости 18.04.2018 гг.,Сергей Будков,2018-04-18,14022,1018,1,91,RU,Education
FCpzTeyYXKY,Одиночество — приговор? Суждено ли мне встретить настоящую любовь?,Лара Логинова-Таро,2018-04-18,6869,451,24,162,RU,Education
7LlCrUH7yR0,►СРОЧНО! В Йеллоустоун доставили ядерные боеголовки ракет Минитмен!,Thelema 93,2018-04-10,22623,83,18,55,RU,Education
jqJRmBIQVjs,Разведданные ТВ.Новости 19.04.2018 гг.,Сергей Будков,2018-04-19,10257,827,7,55,RU,Education
a9yWO468uSo,Как найти себя. Презентация,БМ LIFE,2018-04-19,16750,0,0,0,RU,Education
E5HcKTNrQxw,Будет ли новое знакомство?,Лара Логинова-Таро,2018-04-19,8313,751,16,223,RU,Education
AxRLKyC_HLY,Как  помогать правильно,Эра Водолея,2018-04-20,8313,750,10,41,RU,Education
02fsl67JdUo,Разведданные ТВ. Новости 20.04.2018 гг.,Сергей Будков,2018-04-20,11094,933,11,131,RU,Education
kc1E4tTHjA4,Что происходит три дня после смерти,Пятое Измерение,2018-04-20,7401,554,11,94,RU,Education
WVVkqvYtg1k,30 МЕГА УЛЕТНЫХ ПРИКОЛОВ,Domino Show,2018-04-21,91168,2666,307,884,RU,Education
nsNaI5F-SrY,О твоей девственности и немного глубже [The School of Life],In Cor Cadit,2018-04-21,26809,2320,107,321,RU,Education
g01yqza_HKE,Лебединая песня еще прозвучит? Для возрастных девочек.,Лара Логинова-Таро,2018-04-21,4564,432,11,125,RU,Education
6ZIEbHSzJeo,Притча Ангел и Кот,Эра Водолея,2018-04-21,6683,519,6,47,RU,Education
"#NAME?",САМОДЕЛЬНАЯ КРУЖКА -  ХАМЕЛЕОН ИЗ ТЕРМОХРОМНЫХ КРАСОК!,Thoisoi,2018-04-21,94645,6538,118,280,RU,Education
Et8FUmCvw3M,Притча о Правде и Истине,Пятое Измерение,2018-04-21,6548,419,13,44,RU,Education
WgakGwc51pg,Что будет с долларом? / Прогноз на неделю 23 - 28 апреля 2018,InvestFuture,2018-04-21,3405,173,4,33,RU,Education
ugXcKfWL_jc,Разведданные ТВ. Новости 22.04.2018 гг.,Сергей Будков,2018-04-22,7622,720,7,88,RU,Education
y5OxuhFgckA,Зачем он постоянно возвращается в мою жизнь?,Лара Логинова-Таро,2018-04-22,2717,259,12,47,RU,Education
xlmu2ZNBfLg,Женская стратегия - выбирать мужчину,Эра Водолея,2018-04-23,12539,969,22,74,RU,Education
LKobLUHzS58,МНЕНИЕ ИНОСТРАНКИ О РУССКИХ МУЖЧИНАХ,Mila Levchuk,2018-04-23,13913,1236,84,188,RU,Education
9KhWmMjf1AA,ПОЧЕМУ Я НЕ ХУДЕЮ? Главная причина. Ада Кондэ,WOMANUR Ада Кондэ,2018-04-23,2837,288,12,13,RU,Education
C39ZZrxU6IU,ДВА ПУТИ РАЗВИТИЯ ЧЕЛОВЕКА! | Михаил Дашкиев. Бизнес Молодость,БМ ОГОНЬ,2018-04-23,4614,336,4,25,RU,Education
ZYn1Iz_WTUQ,Тайны Чапман. Апокалипсис был вчера (24.04.2018),Военное телевидение,2018-04-24,23418,138,30,31,RU,Education
JSqLC33_en0,Перерасчет Пенсий с 1 Мая без заявления,Блог Юридической Помощи,2018-04-24,18214,229,33,28,RU,Education
ISkAbbE53TE,UNO | комби | дизайн с ФОЛЬГОЙ и геометрия,Алёна Sokololof,2018-04-24,10720,1184,5,153,RU,Education
3W3cok4FkjM,Встреча в будние дни 2018-04-23,Programas Teocraticos,2018-04-25,1239,76,6,0,RU,Education
KrIIgZYhtZk,Алгоритм знакомств и перехода к отношениям,Лев Вожеватов,2018-04-24,8251,679,10,40,RU,Education
4awPU9qp5C8,УЧИТЕСЬ МЕНЬШЕ ГОВОРИТЬ! Как слова и мысли влияют на нашу жизнь.,*Mr.Gens Best,2018-04-24,11410,699,24,26,RU,Education
iYEVP7zoEcs,Любовь без привязанности - свобода в отношениях,Эра Водолея,2018-04-25,11184,809,11,49,RU,Education
Ahivnl0UxRc,Вечер вопросов и ответов,Dmitry Trotsky,2018-04-25,9967,596,11,0,RU,Education
lg3vbqJfVXA,Пробуждение жизни - Весна,Уроки Медитации,2018-04-25,8763,1093,10,117,RU,Education
ZK4tdAG5sRI,🛠 Впечатляющие и Нереально Крутые Самоделки! Топ 5!,Школа Ремонтника,2018-04-26,7240,369,25,36,RU,Education
q-IaVGz2EiU,ЧЕРНОБЫЛЬ СЕГОДНЯ. Нам 30 лет ВРАЛИ!!!,PANDORA,2018-04-26,14893,745,64,98,RU,Education
QtjWPdSCrtc,Отчетность,Кэшбери,2018-04-26,3342,237,11,20,RU,Education
6vzqs390sGU,КОВШ ЭКСКАВАТОРА ЗАЦЕПИЛСЯ ЗА ЧТО-ТО БОЛЬШОЕ И ТВЕРДОЕ... НЕОЖИДАННАЯ НАХОДКА ПОРАЗИЛА ВЕСЬ МИР!,Я В ШОКЕ!,2018-04-26,47325,1099,64,75,RU,Education
uaHH1AHC_ng,10 СЛУЧАЕВ КОГДА ЧТО ТО ПОШЛО НЕ ТАК,Domino Show,2018-04-27,47472,3535,71,829,RU,Education
T9l7hnHzSNs,Женщине важно быть наполненной,Эра Водолея,2018-04-27,10655,824,10,89,RU,Education
GtGg6UuwJ4k,"Как понять, что ты не нравишься мужчине? 12 простых признаков",Julia Lanske,2018-04-27,10675,672,9,75,RU,Education
GfgWa7wmY5c,Перестаньте соСТРАДАТЬ,Пятое Измерение,2018-04-27,7840,608,13,38,RU,Education
q4yThLYF_YI,Как чиновники уничтожают деревья,varlamov,2018-04-28,42929,6508,81,929,RU,Education
XJCfjCHmkTQ,Сила веры и сила воли,Эра Водолея,2018-04-28,9075,822,11,44,RU,Education
c4PkwpQFRwQ,"Никель - Металл, ОБРАЗУЮЩИЙ СУПЕРСПЛАВЫ!",Thoisoi,2018-04-28,107689,7093,146,284,RU,Education
gcU5qPA534A,Самые шокирующие прогнозы. Главное - не бояться! (28.04.2018) © РЕН ТВ,Военное телевидение,2018-04-28,16171,110,20,22,RU,Education
yFKfDIBgXLo,"«Նիկոլը պրոֆեսիոնալ հեղափոխական է և անթերի ղեկավարում է պրոցեսը». Սամվել Սևադա, Երկրի հարցը",Yerkir Media TV,2018-04-28,13560,208,4,15,RU,Education
Xo-8T-OfN7w,не рекламные ИСПЫТАНИЯ ОГНЁМ,Строительство дома. Просто о сложном,2018-04-30,2312,219,10,105,RU,Education
5XXU951eh30,IELTS vs TOEFL: в чем разница экзаменов по английскому || Skyeng,Skyeng: онлайн-школа английского языка,2018-05-01,5845,644,12,37,RU,Education
uwQerYkBAeQ,Как трансформировать свою судьбу? Интервью Дмитрия Троцкого на канале Мистика Вятки,Dmitry Trotsky,2018-05-01,8460,710,13,0,RU,Education
ihyW0dJyJFc,Х1АР ДУКХ НОХЧИ ЧУР НИД МАРШО ЛАДОГ1АЙШ,ВРЕМЯ-ПЕРЕМЕН,2018-04-27,12293,32,31,23,RU,Education
jGUMr4ncWB0,🛠 Крутые Самоделки Своими Руками в Домашних Условиях!,Школа Ремонтника,2018-05-01,11947,543,27,39,RU,Education
HP_0FGU-2uM,ЖЕСТКИЙ ТЕСТ HYPER И ЭКСКУРСИЯ ПО ЗАВОДУ,1) Алексей Земсков (zems.pro),2018-05-01,114627,8623,11769,1282,RU,Education
TUWBbNi-BV4,10 НЕУДАЧНИКОВ,Domino Show,2018-05-03,38771,1764,78,248,RU,Education
zkzojWZBnVk,Почему французы НЕНАВИДЯТ ЛЮКА БЕССОНА? (ft. Chuck review),ЧЕРНЫЙ КАБИНЕТ,2018-05-03,13290,1817,48,111,RU,Education
OscuXHkOHpQ,Популярный дизайн. Геометрия. Дизайн ногтей 60,Verakso,2018-05-03,8467,794,8,25,RU,Education
oAa3hvJtLPE,Тайны Чапман. На чем мы ездим (03.05.2018),Военное телевидение,2018-05-03,20805,104,21,30,RU,Education
QuH67h_cgTg,"Зачем нужно плохое зрение? (Познавательное ТВ, Артём Войтенков)",Познавательное ТВ,2018-05-04,2790,299,15,91,RU,Education
mmnfFQvACfY,ДЕВУШКА КУПИЛА 4 СТАРЫХ КОНТЕЙНЕРА И ПРЕВРАТИЛА ИХ ... В НЕЧТО НЕРЕАЛЬНОЕ!,Я В ШОКЕ!,2018-05-04,84990,2441,143,240,RU,Education
