video_id,title,channel_title,publish_time,views,likes,dislikes,comment_count,Region,category_title
VAWNQDgwwOM,ХАЙП КЭМП - СВОЙ СРЕДИ ЧУЖИХ,Юлик,2017-11-13,424596,49854,714,2944,RU,Entertainment
3sYvZcwzZr8,КЛИПЫ РОДИТЕЛЕЙ НА ШКОЛЬНЫЙ ВЫПУСКНОЙ,Совергон,2017-11-13,243469,36216,631,1692,RU,Entertainment
SLF34Gt_UxQ,АНОНС / Versus Fresh Blood 4: Война Стилей,versusbattleru,2017-11-12,733936,47964,2545,3901,RU,Entertainment
YxEJVGfP74Y,Итальянцы VS русская народная медицина,Итальянцы by Kuzno Productions,2017-11-13,105116,9780,93,1184,RU,Entertainment
ZYNJKWCFrH8,ЗАБЫТЫЕ ЗВЁЗДЫ 2000-ЫХ,DaiFiveTop,2017-11-13,191348,10679,762,790,RU,Entertainment
Va4KRV9c95o,"Американцы Слушают Русскую Музыку #36 MIYAGI, JAH KHALIB, КОРЖ, FACE, L'ONE, KIZARU, Т. Раут, VERSUS",GlebaTV,2017-11-13,101081,4937,453,1140,RU,Entertainment
DS7OiDdSkR0,Ивановы Ивановы - 17 серия - комедийный сериал HD,serial,2017-11-13,317094,6433,158,532,RU,Entertainment
d9ndEyk2lBw,Regime forces use UR-77 mine clearence charges in an attempt to break through in Jobar,News & Politics #17,2017-11-11,151624,106,35,53,RU,Entertainment
jielZn5fzWo,60 минут по горячим следам (дневной выпуск в 13:00) от 13.11.17,Россия 24,2017-11-13,157093,778,469,577,RU,Entertainment
UYhP4UHEBhI,РВАТЬ НА БИТАХ - 495 SQUAD Х CODEKIEV (МЛЕЧНЫЙ / ВАРАБ Х GIGA1 / MARUL),#SLOVOSPB PRODUCTION,2017-11-12,540442,31477,1668,3522,RU,Entertainment
5kVDklB0xXg,KIZARU VS FACE И PHARAOH | ПОПЕРЕЧНЫЙ VS ПАНИН | ATL | ХЛЕБ #RapNews 238,RapNews,2017-11-13,132061,4934,335,714,RU,Entertainment
3YQVjNUsNjc,10 СЛУЧАЕВ МОМЕНТАЛЬНОЙ КАРМЫ,Top Five,2017-11-13,116081,8739,235,327,RU,Entertainment
ulcBhCJotPU,НОЧЬ ПУГАЮЩАЯ ЗАГАДКА! ТБИ,Anny May,2017-11-13,493894,39688,1358,69331,RU,Entertainment
9w0v_qBcjxA,Мы расстаемся! Пранк над парнем принял неожиданный поворот...,Mikael's Studio,2017-11-13,101114,3028,295,420,RU,Entertainment
xQrFmQOKe6k,FIDELIO PUNCH CLUB | S1E03 | РАЙТРАУН VS ISLA DE MUERTA,Fidelio PunchClub,2017-11-13,117434,2035,309,320,RU,Entertainment
5o5kT0tesWs,ТОП 5 САМЫХ ЖУТКИХ МЕСТ НА ЗЕМЛЕ,КУРКУМА,2017-11-13,66129,1182,64,30,RU,Entertainment
DesEiWDxcB0,"10 ЛЮДЕЙ, КОТОРЫЕ СИЛЬНО ОТЛИЧАЮТСЯ ОТ ОСТАЛЬНЫХ",Bubble™,2017-11-13,260279,16124,461,827,RU,Entertainment
K62o61YwTv0,ТОР: РАГНАРЁК [Ржака от Marvel],Юрий Хованский,2017-11-13,136087,7843,1232,808,RU,Entertainment
mKUhK2AEAs4,Давай поженимся! Неудачно женатый. Выпуск от 13.11.2017,Красный квадрат,2017-11-13,17800,51,15,23,RU,Entertainment
JcO83xX3x2A,"Всё о гигантах из фильма Конг: Остров Черепа (виды, биология, способности)",Звездный Капитан,2017-11-13,119602,7469,96,434,RU,Entertainment
LayzJtW_3bM,РОССИЯ МАГНИТ ГИПЕРМАРКЕТ УВОЛЕНЫ ВСЕ КАССИРЫ,Сибирский Барс,2017-11-05,42279,29,23,21,RU,Entertainment
peSbhTLCLSs,БОЛЕ ЧУДЕС / ЛЮТЫЙ КОКТЕЙЛЬ / 3 СЕРИЯ,vJOBivay,2017-11-12,202600,10121,697,761,RU,Entertainment
ZOTIQ-nBDQo,Многообещающий пистолет с интегрированным глушителем | Разрушительное ранчо | Перевод Zёбры,Zёбра,2017-11-13,129867,10906,70,526,RU,Entertainment
0x7hArUxG1w,Дом 2 новости 14 ноября 2017 (14.11.2017) Раньше эфира,Новости Проекта,2017-11-13,5534,36,8,5,RU,Entertainment
zSAao3HusPM,FIFA — До Того Как Стала Известна!,telblog.net,2017-11-13,103824,6336,191,576,RU,Entertainment
_yfTrT0UkY8,Друже пытается делать САМСУ В ТАНДЫРЕ! До успеха далеко....,oblomoff,2017-11-14,616177,27172,2127,3213,RU,Entertainment
Plvd9-5VKvY,Ивановы Ивановы - 18 серия - комедийный сериал HD,serial,2017-11-14,500342,8594,290,954,RU,Entertainment
UUqxsjHjI6w,Топ10 УМНЫХ Ютуберов!,telblog.net,2017-11-14,362964,21298,1284,4097,RU,Entertainment
G_M_Jk_McTY,60 минут. Почему Рада передумала разрывать дипотношения с Россией? От 14.11.17,Россия 24,2017-11-14,162497,960,333,660,RU,Entertainment
dDcB3OVmZrk,ОГРАБИЛИ БАНК!! Познакомились с МАЛЬЧИКОМ Дети совершили ОГРАБЛЕНИЕ Для детей KIDS Children,Super Girl,2017-11-14,415860,4164,1092,895,RU,Entertainment
ZI44CTfsUq4,"МАКС +100500 ОТКРЫЛ РЕСТОРАН / ЧЕСТНЫЙ ОБЗОР / СОРЯН, МАКСОН",Макс Брандт,2017-11-14,205319,10183,521,741,RU,Entertainment
VAWNQDgwwOM,ХАЙП КЭМП - СВОЙ СРЕДИ ЧУЖИХ,Юлик,2017-11-13,854112,81243,1529,4234,RU,Entertainment
bx3G_kbmEX0,"7 ЖЕСТОВ, КОТОРЫЕ ЛУЧШЕ НЕ ПОКАЗЫВАТЬ В ДРУГИХ СТРАНАХ",Мастерская Настроения,2017-11-14,373430,18889,623,1098,RU,Entertainment
UfcGsMcCoLo,Давай поженимся! Неунывающая оптимистка. Выпуск от 14.11.2017,Красный квадрат,2017-11-14,20120,67,5,20,RU,Entertainment
YxEJVGfP74Y,Итальянцы VS русская народная медицина,Итальянцы by Kuzno Productions,2017-11-13,275496,16762,225,1659,RU,Entertainment
429k3QbKBKw,МастерШеф. Сезон 7. Выпуск 23. Часть 2 из 5 от 14.11.2017,МастерШеф,2017-11-14,14425,86,8,24,RU,Entertainment
BjcQu1GoRAs,Татьяна Кравченко. Судьба человека с Борисом Корчевниковым,Россия 1,2017-11-14,56498,374,44,72,RU,Entertainment
27O1pzfITJ8,OXXXYMIRON VS СМОКИ МО | РВАТЬ НА БИТАХ | NTL | ВИТЯ CLASSIC | FIDELIO PUNCH CLUB #RapNews 239,RapNews,2017-11-14,185541,5246,317,477,RU,Entertainment
_1iMtURl6sU,Китайцы были в шоке от Доброты сирийцев,Guseynov Tv,2017-11-14,12721,453,13,92,RU,Entertainment
tIwGaLOhPSM,Senin lider seçilmeni sağlayabilirim! - Eşkıya Dünyaya Hükümdar Olmaz 80. Bölüm,atv,2017-11-14,110212,241,30,13,RU,Entertainment
SLF34Gt_UxQ,АНОНС / Versus Fresh Blood 4: Война Стилей,versusbattleru,2017-11-12,851283,51775,2942,4277,RU,Entertainment
fbYtkuxg6_k,Seni axtariram 13.11.2017 Tam verilis / Seni axtariram 13 noyabr 2017,Səni Axtarıram / Bizə Danış,2017-11-14,33743,245,55,78,RU,Entertainment
L9KPE_Kq_vo,Загадки человечества. 85 выпуск (14.11.2017) HD,Secret TV,2017-11-14,7036,46,5,1,RU,Entertainment
JR0znkb5sOY,Цымбалюк-Романовская не захватывала театр. Андрей Малахов. Прямой эфир от 14.11.17,Прямой эфир,2017-11-14,9904,19,9,10,RU,Entertainment
OoKJ2kNL3uY,МАНА УЗБЕК ЙИГИТИ  МИЛЛИ КИЙИМДА РУССЛАРНИ ЛОЛ КОЛДИРДИ!,UzBoom Tv,2017-11-13,54466,3385,263,816,RU,Entertainment
Va4KRV9c95o,"Американцы Слушают Русскую Музыку #36 MIYAGI, JAH KHALIB, КОРЖ, FACE, L'ONE, KIZARU, Т. Раут, VERSUS",GlebaTV,2017-11-13,167344,6447,703,1590,RU,Entertainment
CeUaopDSfFY,Славный Обзор. Ресторан Водопад. Сельская свадебка...,oblomoff,2017-11-15,549824,23279,1532,2014,RU,Entertainment
nOLOWDZbxvc,Ивановы Ивановы - 19 серия - комедийный сериал HD,serial,2017-11-15,541004,8633,291,1088,RU,Entertainment
9UqPRv975Vg,"ЧТО ЕСЛИ ПРИГОТОВИТЬ НУТЕЛЛУ и МЫЛО в ВАФЕЛЬНИЦЕ - ЭТО ОЧЕНЬ СТРАННО, НО в....?!",TimOn ChaveS,2017-11-15,409738,26502,1619,2135,RU,Entertainment
AleHmBh29kc,Русский Фейерверк Екатреинбург,"Русский Фейерверк, магазины салютов в России",2017-04-03,24868,6,107,0,RU,Entertainment
DeZlHaaTJ6U,Diriliş Ertuğrul 96.Bölüm Tanıtımı,TRT 1,2017-11-15,133748,0,0,0,RU,Entertainment
e1-s7keE0qQ,Вечер с Владимиром Соловьевым от 14.11.2017,Россия 24,2017-11-15,242403,1583,732,839,RU,Entertainment
DcdoBrCvS9o,Eşkıya Dünyaya Hükümdar Olmaz 80. Bölüm,atv,2017-11-15,432837,2647,353,353,RU,Entertainment
WWuJotGYz4M,МастерШеф. Сезон 7. Выпуск 24. Часть 2 из 5 от 15.11.2017,МастерШеф,2017-11-15,24990,120,17,64,RU,Entertainment
aNCW0GMo3AM,The New SpotMini -  Собака-Робот НЕВЕРОЯТНО!,ITechFuture,2017-11-15,3593,76,2,2,RU,Entertainment
ul4_XUH6ejg,Давай поженимся. Большая любовь для владельца паба. Выпуск от 15.11.2017,Красный квадрат,2017-11-15,14810,33,18,24,RU,Entertainment
LrOQFMfJ3yE,10 НЕОБЫЧНЫХ ДОМАШНИХ ЖИВОТНЫХ,MARGO TOPs,2017-11-15,18201,842,18,80,RU,Entertainment
Ayx-3cLGGXw,Полиция пришла с обыском к жене Джигарханяна. Андрей Малахов. Прямой эфир от 15.11.17,Прямой эфир,2017-11-15,134962,494,363,1471,RU,Entertainment
CVPTaGQHRgs,Сколько стоит твоя жизнь?,Кирилл Прядухин,2017-11-15,42289,2057,207,138,RU,Entertainment
zaOsGbyuru8,Александр Половцев. Судьба человека с Борисом Корчевниковым,Россия 1,2017-11-15,15333,51,21,37,RU,Entertainment
WZ5B9Ojoc9c,Seni axtariram 14.11.2017 Tam verilis / Seni axtariram 14 noyabr 2017,Səni Axtarıram / Bizə Danış,2017-11-15,34469,256,53,125,RU,Entertainment
UUqxsjHjI6w,Топ10 УМНЫХ Ютуберов!,telblog.net,2017-11-14,614772,30048,1983,5393,RU,Entertainment
AngM8zOQdUw,Кирилл Терёшин. Хватит пыхтеть в тренажерке,Bazooka,2017-11-15,3174,20,39,43,RU,Entertainment
dfkVXUOk3Ag,#ВТЕМЕ: Настасья Самбурская тайно вышла замуж?,Телеканал Ю,2017-11-15,26689,164,17,12,RU,Entertainment
g10jIeejvYU,Загадки человечества. 87 выпуск (16.11.2017) HD,Secret TV,2017-11-15,7343,53,7,4,RU,Entertainment
Yr5Dq2k-73c,Все киногрехи  Телохранитель киллера,KINOKOS,2017-11-15,98299,5056,361,536,RU,Entertainment
"#NAME?",ВЗРОСЛЫЕ И МОЛОДЫЕ УГАДЫВАЮТ ЦЕНЫ ВЕЩЕЙ,DaiFiveTop,2017-11-16,378421,17698,1202,1701,RU,Entertainment
jC3KhlMBtX0,"ЛАРИН ПРОХОДИТ ДЕТЕКТОР ЛЖИ / Versus, Джарахов, чайлдфри и любовь",Sokolovsky!,2017-11-16,157651,16596,1611,1248,RU,Entertainment
SJPQOTgtavc,Итальянцы пробуют варенья из России,Итальянцы by Kuzno Productions,2017-11-16,187915,16794,209,2128,RU,Entertainment
G3ZgjModpso,Офигенный голос. Девушка очень красиво поет Новый день (SONIKA - Новы дзень).,Александр Буш,2017-11-16,260645,20684,2342,1011,RU,Entertainment
wKgN9B-8evc,Ивановы Ивановы - 20 серия - комедийный сериал HD,serial,2017-11-16,620657,14282,361,1720,RU,Entertainment
rFT8fBjjzEU,РОЗЫГРАЛ НАСТЮ!! Настя БЕЗ ДРУЗЕЙ Соня и Светозар ОБИДЕЛИСЬ НА Настю Для детей KIDS Children,Super Girl,2017-11-16,442430,5455,1057,927,RU,Entertainment
raz1NU0aRw8,"ИНОСТРАНЦЫ СЛУШАЮТ РУССКУЮ МУЗЫКУ (FACE, KIZARU, OXXXYMIRON, MIYAGI, T-FEST, БАСТА)",EvRosTV,2017-11-16,246253,10751,720,1148,RU,Entertainment
b29iV4xZdUY,45-летний Малахов впервые стал отцом !,SHOW NEWS,2017-11-16,23738,645,37,100,RU,Entertainment
3iedYPUtHxE,60 минут по горячим следам (дневной выпуск в 13:00) от 16.11.17,Россия 24,2017-11-16,121087,567,413,558,RU,Entertainment
CeUaopDSfFY,Славный Обзор. Ресторан Водопад. Сельская свадебка...,oblomoff,2017-11-15,707987,26950,1925,2262,RU,Entertainment
wfitWgw5NtQ,"7 ПОВСЕДНЕВНЫХ ПРОДУКТОВ, КОТОРЫЕ ВЫ БОЛЬШЕ НЕ ЗАХОТИТЕ ПОКУПАТЬ",Мастерская Настроения,2017-11-16,264266,12203,976,1250,RU,Entertainment
H2pvLy1KYsY,Топ5 ГОЛИМЫХ Понтов!,telblog.net,2017-11-16,242811,12934,2144,2023,RU,Entertainment
vMlxzNAH5Pc,Рёбра барбекю в домашних условиях | Нереальная вкуснямба,Borsch,2017-11-16,37979,3443,89,598,RU,Entertainment
TjZuQHhcPK8,Seni axtariram 15.11.2017 Tam verilis / Seni axtariram 15 noyabr 2017,Səni Axtarıram / Bizə Danış,2017-11-16,30656,251,39,108,RU,Entertainment
9UqPRv975Vg,"ЧТО ЕСЛИ ПРИГОТОВИТЬ НУТЕЛЛУ и МЫЛО в ВАФЕЛЬНИЦЕ - ЭТО ОЧЕНЬ СТРАННО, НО в....?!",TimOn ChaveS,2017-11-15,571693,32063,2306,2749,RU,Entertainment
gTH9dJjsxZA,Загадки человечества. 88 выпуск (16.11.2017) HD,Secret TV,2017-11-16,9110,51,8,2,RU,Entertainment
DeZlHaaTJ6U,Diriliş Ertuğrul 96.Bölüm Tanıtımı,TRT 1,2017-11-15,357940,0,0,0,RU,Entertainment
b_kfww6ldrE,ФАБРИКА ТРОЛЛЕЙ НА САВУШКИНА 55 [netstalkers],netstalkers,2017-11-16,62338,10047,5111,692,RU,Entertainment
coOKvrsmQiI,RAMPAGE - OFFICIAL TRAILER 1 [HD],Warner Bros. Pictures,2017-11-16,2585851,40780,3499,8834,RU,Entertainment
NWX6JLy7dto,ДИЗАЙНЕР ИДИОТ?!,ТРЕНДЫ и ХАЙПЫ,2017-11-15,30296,439,84,70,RU,Entertainment
p8XP7A7kvzM,Spill Your Guts or Fill Your Guts w/ Kim Kardashian,The Late Late Show with James Corden,2017-11-16,4722974,119115,3782,6651,RU,Entertainment
Q6DVtmQSiTE,Александр Малинин отказывается от умирающего отца. Андрей Малахов. Прямой эфир от 16.11.17,Россия 1,2017-11-16,23659,141,68,250,RU,Entertainment
NqFYQwRhOcI,ФЕЙС УНИЖАЕТ МАРЬЯНУ РО?! УМЕР РЭПЕР ЛИЛ ПИП / Lil Peep | КОМКОВ ПРОСИТ ПРОЩЕНИЯ,VOVA KESS,2017-11-16,109738,6365,168,789,RU,Entertainment
MEPrP-YtFcY,"Kizaru о Смерти Lil Peep, конфликте с Face, Rose 044, Dead Dynasty, Смоки Мо(16.11.2017)",Rap Periscope,2017-11-16,34194,765,59,137,RU,Entertainment
8VJvqMy4ziE,Эрдоган превратил Путина из дедушки в бабушку,Самый сок.,2017-11-15,69649,3460,63,430,RU,Entertainment
kJJMrwKuhk4,Новый зашквар BLACK STAR // Cмерть LIL PEEP // Битва за Розовое Вино,Руслан Усачев,2017-11-17,512821,56159,3806,2137,RU,Entertainment
mqlscc-Ir38,Светящийся ЛЁД - Проверка Странных лайфхаков!,Дима Масленников,2017-11-17,590807,52433,2074,14596,RU,Entertainment
i-kpVHy4z_Y,"ЧТО, ЕСЛИ весь МИР В ОГНЕ",Что если,2017-11-17,564315,29569,978,1838,RU,Entertainment
"#NAME?",ВЗРОСЛЫЕ И МОЛОДЫЕ УГАДЫВАЮТ ЦЕНЫ ВЕЩЕЙ,DaiFiveTop,2017-11-16,729775,25335,2328,2457,RU,Entertainment
jC3KhlMBtX0,"ЛАРИН ПРОХОДИТ ДЕТЕКТОР ЛЖИ / Versus, Джарахов, чайлдфри и любовь",Sokolovsky!,2017-11-16,313062,24546,2880,1677,RU,Entertainment
Y7LLaF_hB4w,=Обзор ИРП= АМЕРИКАНСКИЙ сухпай. Что едят в USA армии. MRE №1,Видео от SoLiDa,2017-11-17,271648,15441,718,1719,RU,Entertainment
uvGF8Z1IgfY,60 минут по горячим следам от 17.11.2017,Россия 24,2017-11-17,131239,761,632,581,RU,Entertainment
G3ZgjModpso,Офигенный голос. Девушка очень красиво поет Новый день (SONIKA - Новы дзень).,Александр Буш,2017-11-16,408653,25364,2760,1260,RU,Entertainment
SJPQOTgtavc,Итальянцы пробуют варенья из России,Итальянцы by Kuzno Productions,2017-11-16,326631,21996,340,2693,RU,Entertainment
YxDjgta_eU0,Черепашки-ниндзя | 1 сезон 11 серия | Nickelodeon Россия,Nickelodeon Россия,2017-11-17,84883,1254,73,190,RU,Entertainment
wc2ena0ktGM,Seni axtariram 16.11.2017 Tam verilis / Seni axtariram 16 noyabr 2017,Səni Axtarıram / Bizə Danış,2017-11-17,27720,205,55,127,RU,Entertainment
EQvhjefl0c8,IPHONE — До Того Как Стал Известен!,telblog.net,2017-11-17,202536,10880,605,1368,RU,Entertainment
e_RGKUJtDXw,WTFFF... КАК ТАК...?! КО МНЕ ПРИЕХАЛ НАСТОЯЩИЙ ТИМОН из АФРИКИ !!!  ЭТО ВООБЩЕ РЕАЛЬНО..?!,TimOn ChaveS,2017-11-17,289236,41864,429,8320,RU,Entertainment
Hg8K1gbYoZQ,У телеведущего Андрея Малахова родился сын! 45-летний Малахов впервые стал отцом !,Большой Брат,2017-11-17,22238,182,13,20,RU,Entertainment
XZpIbvwEiBo,О Чём Мечтают Девушки? | Народный Гугл #2,Сквозь.,2017-11-17,28386,2237,66,75,RU,Entertainment
I5btcj20Qsg,"Выходные дни. Таро прогноз 17-19 ноября, 2017",Irina Dybro Tarot Reading,2017-11-17,12743,499,44,40,RU,Entertainment
ajt_wY2d3eo,Дмитрий Дюжев. Судьба человека с Борисом Корчевниковым,Россия 1,2017-11-17,40791,240,241,344,RU,Entertainment
VE5ss5Ipi2U,Острый репортаж с Аллой Михеевой. Концерт рэпера Тимати.(17.11.2017),Вечерний Ургант,2017-11-17,36456,1264,82,113,RU,Entertainment
nY_1GoG40M4,ЗАКАЗАЛИ ВСЕ МЕНЮ / ДОСТАВКА ЗА 13000 РУБЛЕЙ / ЛЕВ ШАГИНЯН,Макс Брандт,2017-11-17,142682,5705,320,566,RU,Entertainment
"#NAME?",Давай поженимся! Помощница нотариуса. Выпуск от 17.11.2017,Красный квадрат,2017-11-17,24635,56,13,33,RU,Entertainment
ek3jU8xiLEk,Diriliş Ertuğrul 96 Bölüm 2. Tanıtım,TRT 1,2017-11-17,289337,0,0,0,RU,Entertainment
9kDxcie_45M,Светлана Иванова и Мария Зиброва. «Бедный Лазарь» - Нокауты - Голос - Сезон 6,Голос / The Voice Russia,2017-11-17,13664,713,19,140,RU,Entertainment
QquFA5ZszSY,Вязаный страх и ужас. Что я вязала раньше :) Jekaterina Sap,Jekaterina Sap,2017-11-17,7220,325,14,73,RU,Entertainment
wKgN9B-8evc,Ивановы Ивановы - 20 серия - комедийный сериал HD,serial,2017-11-16,1241458,20061,597,2410,RU,Entertainment
fNMUDWm5XAE,Всё о Самаэле из фильма Хеллбой: Герой из Пекла,Звездный Капитан,2017-11-17,105705,6728,57,323,RU,Entertainment
Vy4ckZFKnI0,ХУДШИЙ ФОКУСНИК В МИРЕ 2 | CЛОМАЛ ПАЛЕЦ | ПРАНК,Magic Five,2017-11-17,94763,3391,230,239,RU,Entertainment
rFT8fBjjzEU,РОЗЫГРАЛ НАСТЮ!! Настя БЕЗ ДРУЗЕЙ Соня и Светозар ОБИДЕЛИСЬ НА Настю Для детей KIDS Children,Super Girl,2017-11-16,773205,7532,1692,1300,RU,Entertainment
TsqaTtZmOog,Bozbash Pictures Qayıdış Yeni (16.11.2017),BozbashPictures,2017-11-16,188973,3921,276,477,RU,Entertainment
ap4Q8qzXJ04,Зважені та щасливі. Сезон 7. Выпуск 12. Часть 3 из 4 от 16.11.17,Зважені та щасливі,2017-11-16,34736,78,10,52,RU,Entertainment
0fEejRrpK40,Жена Малахова родила мальчика: вес 4 кг рост 54 сантиметра,vangogh TV,2017-11-17,9624,0,0,0,RU,Entertainment
4cq47LwqQTU,Вечерний Ургант. В гостях у Ивана Николай Соболев(17.11.2017),Вечерний Ургант,2017-11-18,765535,29013,6752,2171,RU,Entertainment
kJJMrwKuhk4,Новый зашквар BLACK STAR // Cмерть LIL PEEP // Битва за Розовое Вино,Руслан Усачев,2017-11-17,855305,75677,5482,2768,RU,Entertainment
56kbdxn0Q-M,3 Simple & Fun Life Hacks,SkyBek,2017-11-18,194530,2359,626,257,RU,Entertainment
ww9izCMMHqU,Запустили тараканов в космос,experimentanium,2017-11-18,104880,3974,499,192,RU,Entertainment
PhsdkOzBcfs,Топ10 Ютуберов ХЕЙТЕРОВ!,telblog.net,2017-11-18,227859,11677,2181,2009,RU,Entertainment
hexRcrLSBL4,ДЕТСКИЙ РЭП,Юлик,2017-11-18,389719,33265,3185,3181,RU,Entertainment
bqPKuaksl8w,Наркоманская ДЕТСКАЯ азбука!!! ЛЮТАЯ КНИГА!!!,Max Maximov,2017-11-18,59651,2431,120,206,RU,Entertainment
gITp-Pmu4Pg,Священник рассказал о тяжелом грехе Примадонны. У Пугачевой подозревают cмеpтeльнyю болезнь,SHOW NEWS,2017-11-18,44084,89,165,93,RU,Entertainment
4BFnxte2PM8,Victory Ceremony Ladies 2017 Grand Prix France,FSone,2017-11-18,11351,155,11,65,RU,Entertainment
mqlscc-Ir38,Светящийся ЛЁД - Проверка Странных лайфхаков!,Дима Масленников,2017-11-17,841795,64838,2867,17929,RU,Entertainment
4i9m8a8P6pk,Дом 2 Город любви 4940 день Вечерний эфир (18.11.2017) HD без рекламы,Live,2017-11-18,9769,75,67,22,RU,Entertainment
GtGpHnHgQ5s,"Все киногрехи Валериан и город тысячи планет, Часть 1",KINOKOS,2017-11-18,82678,3821,200,319,RU,Entertainment
OuKhjOPeTG4,ЧТО ТАКОЕ ICO — заработать миллион долларов и не сесть в тюрьму,BitJournal,2017-11-17,93612,1170,43,114,RU,Entertainment
wkSbO-0Iip0,Столото представляет | Русское лото тираж №1206 от 19.11.17,Столото,2017-11-19,6013,36,26,16,RU,Entertainment
OdSQiKm03II,"5də5 - Üzeyir Mehdizadə, Əlibəy Məmmədli (ELÇİLİK)  17.11.2017",Xəzər Media,2017-11-18,36504,707,62,226,RU,Entertainment
mnZp2-xdWX4,«Стена». 5 выпуск,WeiT Media,2017-11-18,31672,302,35,95,RU,Entertainment
i-kpVHy4z_Y,"ЧТО, ЕСЛИ весь МИР В ОГНЕ",Что если,2017-11-17,731408,33921,1227,2081,RU,Entertainment
DEuvV0RCMP8,Кирилл Терёшин. Ауууеее качаем базуки!,Bazooka,2017-11-18,22246,81,351,236,RU,Entertainment
e30FW4zGeuc,ЛИЗУН ПОД МИКРОСКОПОМ | РАСПАКОВКА ОГРОМНОЙ ПОСЫЛКИ из Китая | ОЖИДАНИЕ И РЕАЛЬНОСТЬ,ANNA CHI,2017-11-18,147431,4949,132,4081,RU,Entertainment
a4TkkFx_OWM,Простой Наполеон к новому году — рецепт Бабушки Эммы,Рецепты Бабушки Эммы,2017-11-18,21268,2086,33,146,RU,Entertainment
TAATv-r1nj0,НОВАЯ КОРОБКА MARVEL из США!,Qewbite,2017-11-18,85387,9226,87,872,RU,Entertainment
Uob0r-s-mBI,Своя игра 18.11.2017,Наше! Телевидение,2017-11-18,11076,75,14,14,RU,Entertainment
77sC2kivSM4,Гороскоп Таро для всех знаков Зодиака на неделю c 20 по 26 ноября 2017 года,Irina Dybro Tarot Reading,2017-11-18,9840,532,51,56,RU,Entertainment
zHYhhpI0nDU,Наташу Королеву назвали старухой и выгнали на пенсию!,Лучшее из Сети,2017-11-18,9614,37,10,8,RU,Entertainment
sx-L_ZUKJkA,ПСИХОЛОГИЧЕСКИЙ ТЕСТ / Узнай свои СТРАХИ и ФОБИИ !,Обо всем Интересном :3,2017-11-18,15017,1041,78,190,RU,Entertainment
AgZwfPBmlaU,ТОП 10 СТРАННЫХ и НЕОБЫЧНЫХ самоделок из ЛЕГО!,The Waymax,2017-11-18,9717,504,14,810,RU,Entertainment
YxDjgta_eU0,Черепашки-ниндзя | 1 сезон 11 серия | Nickelodeon Россия,Nickelodeon Россия,2017-11-17,233898,1810,162,242,RU,Entertainment
NA7pk_QGqIQ,Территория заблуждений с Игорем Прокопенко (18.11.2017) HD,Secret TV,2017-11-18,8124,56,15,13,RU,Entertainment
9kDxcie_45M,Светлана Иванова и Мария Зиброва. «Бедный Лазарь» - Нокауты - Голос - Сезон 6,Голос / The Voice Russia,2017-11-17,38037,1307,35,202,RU,Entertainment
gd5zd2BF2fk,НАСТОЯЩИЕ ПРЕДЕЛЫ ЖИЗНИ ЧЕЛОВЕКА,Ridddle,2017-11-17,352819,26699,1055,2126,RU,Entertainment
Bq9Bpj1zzDg,ВЕНЧАНИЕ АЛЛЫ ПУГАЧЕВОЙ И МАКСИМА ГАЛКИНА!,СПЛЕТНИКИ,2017-11-18,19705,66,35,86,RU,Entertainment
IxIzaibGJ7o,ДЕТИ ПУГАЧЕВОЙ И ГАЛКИНА: Лиза и Гарри на венчании родителей Аллы Пугачевой и Максима Галкина!,Маша Деточкина,2017-11-18,33313,392,36,77,RU,Entertainment
Y7LLaF_hB4w,=Обзор ИРП= АМЕРИКАНСКИЙ сухпай. Что едят в USA армии. MRE №1,Видео от SoLiDa,2017-11-17,373733,18338,941,2161,RU,Entertainment
RswdKYsJquw,VERSUS X #SLOVOSPB: Obe 1 Kanobe VS ΨBOY,versusbattleru,2017-11-19,553719,33320,7745,8007,RU,Entertainment
rHLQog-0R_A,РВАТЬ НА БИТАХ - NKVD Х EX-TEMPLE (BOOKER / DOMASHNIY Х MICKEYMOUSE / T-ONE),#SLOVOSPB PRODUCTION,2017-11-19,384289,22930,1352,2421,RU,Entertainment
eSM9p0OP2Y0,LIL PUMP - ТРЕК и КЛИП за 5 МИНУТ! [#ИзиРеп] / SONG and MUSIC VIDEO for 5 MINUTES! (Eng Subs),MORGENSHTERN,2017-11-19,279740,35404,1146,3741,RU,Entertainment
wkSbO-0Iip0,Столото представляет | Русское лото тираж №1206 от 19.11.17,Столото,2017-11-19,60402,97,328,115,RU,Entertainment
2ZOMhpV-hYU,Онлайн-трансляция из Нескучного сада 19 ноября 2017 года,Что? Где? Когда?,2017-11-19,46132,391,117,139,RU,Entertainment
4-3uWLUoljk,Чипсы | БорщЖоу | Обзор и рецепт чипсов,Borsch,2017-11-19,106099,6159,404,830,RU,Entertainment
ieaqIQ5Bezg,САМАЯ ЖЕСТОКАЯ ПЫТКА,DaiFiveTop,2017-11-19,355114,14361,2121,1966,RU,Entertainment
rhRPr7oQI-Q,Воскресный вечер с Владимиром Соловьевым от 19.11.2017,Россия 24,2017-11-19,179167,1402,938,482,RU,Entertainment
56kbdxn0Q-M,3 Simple & Fun Life Hacks,SkyBek,2017-11-18,293173,3230,1026,312,RU,Entertainment
RpOnAk_t6IM,ЧТО ЕСЛИ УДАРИТЬ по ЗАЩИТНОЙ РАКУШКЕ - КУВАЛДОЙ ?! БУДЕТ ЯИЧНИЦА или НЕТ..?!,TimOn ChaveS,2017-11-19,343992,15323,823,1785,RU,Entertainment
fSgpDwA2XTA,Eşkıya Dünyaya Hükümdar Olmaz 81. Bölüm Fragmanı - atv,atv,2017-11-19,591683,2771,132,273,RU,Entertainment
4cq47LwqQTU,Вечерний Ургант. В гостях у Ивана Николай Соболев(17.11.2017),Вечерний Ургант,2017-11-18,1047509,37173,8604,2232,RU,Entertainment
Q8NNJlAz_1g,15 НЕУДАЧ НА ВЕЛОСИПЕДЕ,LAПIN,2017-11-19,122474,10657,654,1191,RU,Entertainment
nZgy3XNSwqU,"Синий Фил 224: Лига справедливости, Субурбикон, Дмитрий Дюжев и российские зрители",Dmitry Puchkov,2017-11-19,113189,5939,350,420,RU,Entertainment
DK6tGrXumc4,Доставка ресторана Бакинский бульвар | Где мои соусы и лаваш???,Покашеварим,2017-11-19,86749,2723,405,350,RU,Entertainment
wAcyWEPCbiI,Believe This Fishing? Unique Eel Bamboo Trapping - New Technique To Catch A Lot Of Eels Using Bamboo,Daily Show,2017-11-18,174614,726,150,27,RU,Entertainment
NyzU6AFjdt0,Big Russian Boss Show #36 | Пошлая Молли,Big Russian Boss Show,2017-11-18,554346,33124,8771,3881,RU,Entertainment
Fd_IMtrE29Q,Юмористический сериал На троих: 2 серия 4 сезон 2017 | Дизель Студио -  семейные приколы Украина,Фильмы и сериалы Дизель Студио,2017-11-19,22526,309,14,31,RU,Entertainment
IZ1jvxIQAaE,Ирина Гладкая. Армрестлер. Я могу! Фрагмент выпуска от 19.11.2017,Шоу на Первом,2017-11-19,77966,981,294,257,RU,Entertainment
8VDse_dxzkI,Своя игра 19.11.2017,Наше! Телевидение,2017-11-19,12248,78,6,20,RU,Entertainment
OqrtqF4lF3k,"Битва экстрасенсов, 18 сезон, 9 серия 18 11 2017",WoW Page,2017-11-18,147634,427,153,136,RU,Entertainment
Eqt7yH8mDZg,7 ОТЛИЧИЙ ШКОЛ В РАЗНЫХ СТРАНАХ МИРА,tophype,2017-11-19,285638,15601,320,2551,RU,Entertainment
ivSszut6ZbQ,"Угробили ЗАПОРОЖЕЦ , Машина моей мечты ВЛОГ",Сергей Трейсер Everyday,2017-11-19,82765,5353,256,797,RU,Entertainment
wsgE9RKEOaM,Сегодня вечером. Памяти Эльдара Рязанова. Выпуск от 18.11.2017,Сегодня вечером,2017-11-19,35580,157,25,122,RU,Entertainment
v853hteH0xw,"Ляйсян Золотарева. Народный башкирский эпос «Урал-батыр», башкирская народная песня «Поющий журавл…",Всероссийский конкурс юных талантов Синяя птица,2017-11-19,4265,153,2,23,RU,Entertainment
PhsdkOzBcfs,Топ10 Ютуберов ХЕЙТЕРОВ!,telblog.net,2017-11-18,309761,13627,2844,2514,RU,Entertainment
X64Q9C0ddLo,Крым!! Таврида!! Поехали!!!,Graham Phillips,2017-11-19,6132,465,3,68,RU,Entertainment
kJJMrwKuhk4,Новый зашквар BLACK STAR // Cмерть LIL PEEP // Битва за Розовое Вино,Руслан Усачев,2017-11-17,935628,80293,5930,2884,RU,Entertainment
OdSQiKm03II,"5də5 - Üzeyir Mehdizadə, Əlibəy Məmmədli (ELÇİLİK)  17.11.2017",Xəzər Media,2017-11-18,68938,1025,88,321,RU,Entertainment
jvQ1kRtp6aU,⭐ [SNAILKICK] СМОТРИТ ТРЕНДЫ 18.11.17,SNAIL MOMENTS,2017-11-18,13773,345,23,47,RU,Entertainment
54wOCOJcnjc,15 КРУТЫХ ВЕЩЕЙ ДО 100 рублей с ALIEXPRESS И GEARBEST/ ОФИГЕННО КРУТЫЕ ТОВАРЫ С КИТАЯ (АЛИ),SUPER Мишка,2017-11-19,35466,1578,91,246,RU,Entertainment
hexRcrLSBL4,ДЕТСКИЙ РЭП,Юлик,2017-11-18,500347,38365,3766,3598,RU,Entertainment
q83UqSmYTtk,Всероссийский конкурс юных талантов Синяя птица 2017. 3 сезон. Прямая трансляция 19.11.17,Россия 1,2017-11-19,7480,103,12,0,RU,Entertainment
Znw6O9gLW8g,НОВЕЙШИЕ РУССКИЕ ТРЕЙЛЕРЫ 2017 | Неделя #46,FilmSelect Россия,2017-11-19,70276,744,54,45,RU,Entertainment
_34P2pASqHw,"Птаха очень Злой на Гуфа, последнее видео перед Versus (18.11.2017)",Rap Periscope,2017-11-18,64858,213,176,98,RU,Entertainment
kJIF040MaKY,"Все киногрехи  Валериан и город тысячи планет, Часть 2",KINOKOS,2017-11-18,86483,4533,140,447,RU,Entertainment
yEwoxxcvI9Y,🔴 МОИ МАЛЬЧИКИ 🔴 ПОЛНЫЙ ДОМ КРАСОТЫ  АЛИ СЭМ АНДРЕЙ НИКИ 17.11.2017,FloridaYalta,2017-11-19,9570,244,69,54,RU,Entertainment
QMNUOF-L1aI,Даша Ступак – Queen – Who wants to live forever (WWRY) – Х-фактор 8. Второй прямой эфир,Х-Фактор,2017-11-18,85585,1167,139,216,RU,Entertainment
yI68Qs2igcY,Битва экстрасенсов. Сезон 17. Выпуск 8 от 19.11.2017,Битва екстрасенсів,2017-11-19,18710,188,48,96,RU,Entertainment
4h4prRuY-t4,Отель Элеон - Серия 2 сезон 3 - комедия HD,Кухня (сериал),2017-11-20,281679,6586,286,763,RU,Entertainment
GNwG8ff-bMs,ЗАЛИВНОЕ ИЗ КРАБА. Центральный ресторан. Славный Обзор.,oblomoff,2017-11-20,545015,23609,1402,2587,RU,Entertainment
xd9vK8Mjk_g,Итальянцы оценили танцы народов России,Итальянцы by Kuzno Productions,2017-11-20,133158,9722,252,1495,RU,Entertainment
ndTU9mzwsfA,"О ЧЁМ ЧИТАЛ LIL PEEP? Он не умер, пока мы помним его.",Tema Flex,2017-11-20,110378,8909,404,878,RU,Entertainment
X2YoheUwNNo,"Американцы Слушают Русскую Музыку ЭЛДЖЕЙ & FEDUK - Розовое вино, КРАВЦ - Дисконнект, Рваные джинсы",GlebaTV,2017-11-20,131964,5283,1189,756,RU,Entertainment
vyN2wuPLZ1A,Топ10 СМАРТФОНОВ 2017!,telblog.net,2017-11-20,279751,12210,1315,3420,RU,Entertainment
RswdKYsJquw,VERSUS X #SLOVOSPB: Obe 1 Kanobe VS ΨBOY,versusbattleru,2017-11-19,1110255,51978,14524,11789,RU,Entertainment
LJfIV7m5JAg,60 минут. НЕВЫУЧЕННЫЕ УРОКИ ИСТОРИИ: откуда школьники узнают о Сталинградском котле? От 20.11.17,Россия 24,2017-11-20,116128,1050,386,1436,RU,Entertainment
9wFoqZDJRmE,Давай поженимся! Спортивный финансист. Выпуск от 20.11.2017,Красный квадрат,2017-11-20,23969,75,23,52,RU,Entertainment
2ZOMhpV-hYU,Онлайн-трансляция из Нескучного сада 19 ноября 2017 года,Что? Где? Когда?,2017-11-19,62630,465,159,247,RU,Entertainment
4-3uWLUoljk,Чипсы | БорщЖоу | Обзор и рецепт чипсов,Borsch,2017-11-19,129350,6907,496,874,RU,Entertainment
0ebLj8XQiQw,ТЕСТ на ВОЗРАСТ / 9 ВОПРОСОВ которые Расскажут о Тебе  ВСЕ,Обо всем Интересном :3,2017-11-20,42524,2147,161,356,RU,Entertainment
nZCz8qIFr_k,Аскеров о подсказке из зала и о Друзе,Ваще всё...ну почти всё!,2017-11-20,4115,29,2,25,RU,Entertainment
rHLQog-0R_A,РВАТЬ НА БИТАХ - NKVD Х EX-TEMPLE (BOOKER / DOMASHNIY Х MICKEYMOUSE / T-ONE),#SLOVOSPB PRODUCTION,2017-11-19,488442,25590,1547,2828,RU,Entertainment
udNJ4NK0uUw,Ирина Скобцева. Судьба человека с Борисом Корчевниковым,Россия 1,2017-11-20,23264,132,26,35,RU,Entertainment
TKXCcT46T_Q,Братухи - Все серии,Yuframe,2017-11-20,51489,2015,24,194,RU,Entertainment
VtZefBRGaHs,Загадки человечества. 88 выпуск (20.11.2017) HD,Secret TV,2017-11-20,6938,43,8,2,RU,Entertainment
eSM9p0OP2Y0,LIL PUMP - ТРЕК и КЛИП за 5 МИНУТ! [#ИзиРеп] / SONG and MUSIC VIDEO for 5 MINUTES! (Eng Subs),MORGENSHTERN,2017-11-19,450124,46783,1822,4798,RU,Entertainment
ieaqIQ5Bezg,САМАЯ ЖЕСТОКАЯ ПЫТКА,DaiFiveTop,2017-11-19,515930,17931,2979,2475,RU,Entertainment
dk8SfrM4P8Q,"Hər Şey Daxil - Talıb Tale, Elgün Hüseynov (20.11.2017)",Xəzər Media,2017-11-20,8935,129,12,20,RU,Entertainment
wkSbO-0Iip0,Столото представляет | Русское лото тираж №1206 от 19.11.17,Столото,2017-11-19,69525,100,415,134,RU,Entertainment
SjWYwaUF8t4,Отель Элеон - 3 серия 3 сезон (45 серия) - комедия HD,Отель Элеон,2017-11-21,691522,13239,495,1694,RU,Entertainment
WGibw8E26w8,ЭТО ТРЕТЬЯ СТОЛИЦА РОССИИ? [ Пора Валить в Казань! ],Руслан Усачев,2017-11-21,378934,64491,1848,3751,RU,Entertainment
47ByaiEPKmQ,ШАВЕРМА из BURGER KING,Юрий Хованский,2017-11-21,413053,16671,2644,1799,RU,Entertainment
4h4prRuY-t4,Отель Элеон - Серия 2 сезон 3 - 44 серия - комедия HD,Кухня (сериал),2017-11-20,610556,9853,589,1140,RU,Entertainment
bvszR3n8f-k,60 минут по горячим следам (дневной выпуск в 13:00) от 21.11.17,Россия 24,2017-11-21,136959,725,743,742,RU,Entertainment
qI6jpxxVtpw,МастерШеф. Сезон 7. Выпуск 25. Часть 2 из 6 от 21.11.2017,МастерШеф,2017-11-21,32831,203,22,119,RU,Entertainment
AgHe1dH9id0,НОВИНКА ФИЛЬМ ПЕРВАЯ ЛЮБОВЬ (2017) РУССКАЯ МЕЛОДРАМА,Даня Карпов,2017-11-21,104452,284,126,25,RU,Entertainment
C_6s2RKUI-4,"Ешьте Чеснок Каждый День и Смотрите, Что с Вами Случится",AdMe.ru - Сайт о творчестве,2017-11-21,155616,6811,152,289,RU,Entertainment
ndTU9mzwsfA,"О ЧЁМ ЧИТАЛ LIL PEEP? Он не умер, пока мы помним его.",Tema Flex,2017-11-20,211117,13283,745,1205,RU,Entertainment
ctbML7DY7LQ,Denize düşen yılana sarılır!  - Eşkıya Dünyaya Hükümdar Olmaz 81. Bölüm,atv,2017-11-21,121205,366,32,19,RU,Entertainment
xd9vK8Mjk_g,Итальянцы оценили танцы народов России,Итальянцы by Kuzno Productions,2017-11-20,245033,13148,387,1965,RU,Entertainment
SXGr-LoFCBg,Плевать хотела: Мара Багдасарян снова села за руль. Андрей Малахов. Прямой эфир от 21.11.17,Прямой эфир,2017-11-21,144546,599,333,1255,RU,Entertainment
JelV2pmRdFI,Рецепт лукового супа | Классический Французский Луковый Суп,Borsch,2017-11-21,45231,3950,126,777,RU,Entertainment
GNwG8ff-bMs,ЗАЛИВНОЕ ИЗ КРАБА. Центральный ресторан. Славный Обзор.,oblomoff,2017-11-20,714698,27763,1730,3088,RU,Entertainment
olg79SW5168,Эрига Хиёнат Килган Келин - Денгиздан Томчи,???? ????,2017-11-21,38987,198,23,31,RU,Entertainment
pN_vBsHkBrE,Загадки человечества. 89 выпуск (21.11.2017) HD,Secret TV,2017-11-21,9254,41,5,6,RU,Entertainment
vWrOGYUvGP4,"5də5 - Səbinə Ərəbli, Tacir Şahmalıoğlu, Babək Niftəliyev (20.11.2017)",Xəzər Media,2017-11-21,20537,100,27,25,RU,Entertainment
dOByV5KYkJU,Все киногрехи Звёздные войны. Эпизод III: Месть ситхов,KINOKOS,2017-11-21,76861,4227,162,438,RU,Entertainment
nPWgzlwYNSE,Бургеры от Корнер Бургер (Corner Burger) | Звезды Мишлен летят с погон?,Покашеварим,2017-11-21,67451,2135,210,270,RU,Entertainment
VDQUPUycC1c,"МЫ ЖИВЕМ В 1720, А НЕ В 2017?!",Мастерская Настроения,2017-11-21,487283,23651,2159,5318,RU,Entertainment
bE5gxCt4Uhs,"Модный приговор. Дело о том, почему Таня не громко, но часто плачет. Выпуск от 21.11.2011",Красный квадрат,2017-11-21,18557,61,22,34,RU,Entertainment
7z40hSBYE5A,Валерий Гаркалин. Судьба человека с Борисом Корчевниковым,Россия 1,2017-11-21,22207,146,10,40,RU,Entertainment
5tictQjiEbo,Фильм Последний провод Хороший Боевик,StarmeD,2017-11-21,16940,23,5,0,RU,Entertainment
RswdKYsJquw,VERSUS X #SLOVOSPB: Obe 1 Kanobe VS ΨBOY,versusbattleru,2017-11-19,1276341,55764,15725,12600,RU,Entertainment
X2YoheUwNNo,"Американцы Слушают Русскую Музыку ЭЛДЖЕЙ & FEDUK - Розовое вино, КРАВЦ - Дисконнект, Рваные джинсы",GlebaTV,2017-11-20,177217,6131,1423,898,RU,Entertainment
4h2eexil8Ys,Siyah Beyaz Aşk 7. Bölüm Fragmanı,netd,2017-11-21,225936,1979,58,254,RU,Entertainment
AHV9ypWmbys,Отель Элеон -  4 серия 3 сезон - 46 серия - комедия HD,Отель Элеон,2017-11-22,840058,16396,737,1506,RU,Entertainment
NVDMSuSAkXU,"АНДРЕЙ, КОТОРЫЙ ВСЕ ЗНАЕТ",лиззка,2017-11-22,238404,26451,3467,1288,RU,Entertainment
6BxJHVexsDU,NOKIA 3310 VS  iPhone X  - ЗАМОРОЗИТЬ в ЖИДКОМ АЗОТЕ  -196 °С ... ЧТО БУДЕТ ..?!,TimOn ChaveS,2017-11-22,427005,22941,2529,3595,RU,Entertainment
EXA735g-Rwo,Маленькая машина VS БОЛЬШАЯ на чем быстрей с Александр Муратаев,Костя Павлов,2017-11-22,365525,11709,1003,1210,RU,Entertainment
dczQntLA1L4,Вечер с Владимиром Соловьевым от 22.11.2017,Россия 24,2017-11-22,128841,1091,580,399,RU,Entertainment
WGibw8E26w8,ЭТО ТРЕТЬЯ СТОЛИЦА РОССИИ? [ Пора Валить в Казань! ],Руслан Усачев,2017-11-21,609836,86233,3003,5253,RU,Entertainment
w8yB2O1N6LY,"EVROS TV - ИНОСТРАНЦЫ СМОТРЯТ МУЛЬТИКИ И СЛУШАЮТ РУССКУЮ МУЗЫКУ (ЭЛДЖЕЙ, ГУФ, MIYAGI, СКРИПТОНИТ)",EvRosTV,2017-11-22,128045,6807,335,919,RU,Entertainment
u59xsiF63V4,#1 |  Покердом с нормальными явлениями,Big Russian Boss Show,2017-11-22,206751,14764,3150,885,RU,Entertainment
KlJbIxWJsRA,ТОП5 ЛУЧШИХ СЕРИАЛОВ 3,DaiFiveTop,2017-11-22,271944,18582,1308,2257,RU,Entertainment
47ByaiEPKmQ,ШАВЕРМА из BURGER KING,Юрий Хованский,2017-11-21,552235,20064,3851,2302,RU,Entertainment
O2b0CjTOkgM,"МОТ и МАША МЕЛЬНИКОВА: 9 фактов, которые вы не знали о них",Glamour Russia,2017-11-22,18516,344,10,9,RU,Entertainment
1SaLjxAJt5U,МастерШеф. Сезон 7. Выпуск 26. Часть 2 из 5 от 22.11.2017,МастерШеф,2017-11-22,32128,191,17,139,RU,Entertainment
xX513GgnatE,Diriliş 'Ertuğrul' 97. Bölüm 1. Fragmanı,TRT 1,2017-11-22,205727,0,0,0,RU,Entertainment
YlQbqb5WYWs,Алкоголь и измены жены вызвали рак у Хворостовского,SHOW NEWS,2017-11-22,29457,75,35,27,RU,Entertainment
SP3zC40jS0c,Давай поженимся! Настоящая блондинка. Выпуск от 22.11.2017,Красный квадрат,2017-11-22,30043,70,38,78,RU,Entertainment
Xe--t47BgBo,Eşkıya Dünyaya Hükümdar Olmaz 81. Bölüm,atv,2017-11-21,549985,3305,473,469,RU,Entertainment
ygLYDYCzR08,Парни пробуют ЭКОНОМИТЬ НА ОДЕЖДЕ ☑️,Smetana TV,2017-11-22,140054,14570,76,635,RU,Entertainment
zQvptSwRJRM,Seni axtariram  21.11.2017 / Tam verilis,Xəzər Media,2017-11-22,39442,231,72,109,RU,Entertainment
eeZ0hsxwpbY,Загадки человечества. 90 выпуск (22.11.2017) HD,Secret TV,2017-11-22,10183,43,8,3,RU,Entertainment
LgMLY-38kAI,Хворостовский оставил необычное завещание: мир потрясен!,Лучшее из Сети,2017-11-22,22157,173,9,30,RU,Entertainment
RTc4sfJpRQg,Загляни на кухню «Отеля «Элеон» вместе с START.ru,Кухня (сериал),2017-11-22,42597,1217,47,57,RU,Entertainment
xhjeM6y4JCM,САМЫЕ ПОПУЛЯРНЫЕ ЗВЕЗДНЫЕ ДЕТИ НА ЮТУБЕ: Топ 5 самых популярных детей звезд шоу бизнеса!,Маша Деточкина,2017-11-22,8190,124,6,21,RU,Entertainment
X8kmHeWgpVc,Наталья Андрейченко. Судьба человека с Борисом Корчевниковым,Россия 1,2017-11-22,36138,186,36,78,RU,Entertainment
yzc_FuaooYE,ТЕСТ: СМОЖЕТЕ ЛИ ВЫ ОТЛИЧИТЬ ОРИГИНАЛ ОТ ПОДДЕЛКИ?,tophype,2017-11-22,87690,5951,604,1403,RU,Entertainment
x7YZLYPvwCo,RUSSIA 🇷🇺 - EXCLUSIVE REHEARSAL FOOTAGE - POLINA BOGUSEVICH - WINGS - JUNIOR EUROVISION 2017,Junior Eurovision Song Contest,2017-11-22,17592,850,131,382,RU,Entertainment
vDcQ8gaFDSw,НЕ САДИСЬ ЗА РУЛЬ ПЬЯНЫМ! - социальный ролик от Дизель Студио -  Украина,Фильмы и сериалы Дизель Студио,2017-11-22,7691,191,9,16,RU,Entertainment
9gGxw4Eb2fo,ЧТО ТАКОЕ СКРРАА ПА ПА КА КА КА СКИБИКИ ПА ПА? The Ting Go SKRRRA PAP PAP KA KA / BIG SHAQ,Tema Flex,2017-11-22,93256,5960,206,328,RU,Entertainment
Ao5jRFaHDO8,Отель Элеон -  5 серия 3 сезон (47 серия) - комедия HD,Отель Элеон,2017-11-23,972692,22287,904,2570,RU,Entertainment
uJG41HNz_aE,ЛАРИН ОТВЕЧАЕТ НА ШКОЛЬНЫЕ ВОПРОСЫ,DaiFiveTop,2017-11-23,475976,41507,1088,2438,RU,Entertainment
9d0z1j9BzIg,ЮЛИК 20!8,Юлик,2017-11-23,390271,77292,1286,4053,RU,Entertainment
8O7Es-z7diw,"5 МЕСТ НА ЗЕМЛЕ, ГДЕ ГРАВИТАЦИЯ НЕ РАБОТАЕТ",Мастерская Настроения,2017-11-23,968805,35396,2194,2674,RU,Entertainment
Ja8sm19k0e0,Вечер с Владимиром Соловьевым от 23.11.2017,Россия 24,2017-11-23,140800,1516,705,1088,RU,Entertainment
TITDOWMl9zM,Тизер - GhostBuster - Дом с полтергейстом,Дима Масленников,2017-11-23,229405,19081,668,1184,RU,Entertainment
QCPhqGlZg9U,Вызов (2 сезон) - 100 000 рублей,LizzzTV,2017-11-23,151357,11429,738,653,RU,Entertainment
0mG5ZeYys-s,Соня с Ромой ПОТЕРЯЛИ Дашину Любимую КОШКУ! Друзья ПРИНЕСЛИ ДРУГОГО ЗВЕРЯ kids children,Dasha Koshkina,2017-11-23,487916,4810,1473,1233,RU,Entertainment
Nvfbfb_rTBs,Ютуберы Поднявшиеся за ЧУЖОЙ СЧЁТ!,telblog.net,2017-11-23,135876,10278,536,1427,RU,Entertainment
Hej88x1A6rk,Seni axtariram 22.11.2017  / Tam verilis,Xəzər Media,2017-11-23,35076,240,65,199,RU,Entertainment
mqaj9FNoAaQ,"Отель Элеон - 6 серия, 3 сезон (48 серия) - Анонс",ParodyLV,2017-11-23,10419,52,39,8,RU,Entertainment
wtIUUnDuo9k,ТЕСТЫ ОХРАННИКОВ МИЛЛИАРДЕРОВ,GAZ,2017-11-23,27375,721,69,37,RU,Entertainment
JDvb0EYbVy0,Моя мама всегда говорила...,Итальянцы by Kuzno Productions,2017-11-23,63264,6866,121,715,RU,Entertainment
0JDJ-_OzB48,"Рататуй | Нет, не крыса | Рецепт рататуя",Borsch,2017-11-23,48449,4292,109,428,RU,Entertainment
k-ZD8TTY1k4,Опубликованы редчайшие фотографии Хворостовского,vangogh TV,2017-11-23,23525,0,0,0,RU,Entertainment
WTLqMoo-Fbw,Bozbash Pictures Lökbatan Yeni (23.11.2017),BozbashPictures,2017-11-23,76711,2041,159,364,RU,Entertainment
bBMjoa6tkh8,Давай поженимся! Непростой жених. Выпуск от 23.11.2017,Красный квадрат,2017-11-23,22025,56,32,29,RU,Entertainment
yxruNNfh3KA,ЖАНЫ КЫРГЫЗ КИНО 2017 / БАЖАРИКИ / КИНОКОМЕДИЯ / full HD,SOLO,2017-11-23,64549,1002,90,297,RU,Entertainment
PRf6ppVKASc,"Друзья Джигарханяна проверят лекарства, которыми его пичкала молодая жена. Прямой эфир от 23.11.17",Прямой эфир,2017-11-23,118201,448,374,1425,RU,Entertainment
bdMQScRpzgI,ПРОГНОЗ НА НЕДЕЛЮ 27.11-3.12 ДЛЯ ЗНАКОВ ЗОДИАКА,Мастерская Инги Таро,2017-11-23,6259,267,28,36,RU,Entertainment
NVDMSuSAkXU,"АНДРЕЙ, КОТОРЫЙ ВСЕ ЗНАЕТ",лиззка,2017-11-22,322459,31239,4773,1489,RU,Entertainment
cHB_s970Uyw,The Poop In My Pants | Rick and Morty | Adult Swim,Adult Swim,2017-11-22,3765990,117001,4148,14779,RU,Entertainment
A-NiiAlFgFQ,Тайны Чапман. Концы в воду (23.11.2017) HD,Secret TV,2017-11-23,6087,43,4,5,RU,Entertainment
yxUjnEGbt2o,🔴 Что одеть и как принять 🔴 к РОБЕРТУ в семью на День Благодарения 23.11.217,FloridaYalta,2017-11-23,9895,264,126,102,RU,Entertainment
CqqizPmhBZE,Елена Воробей. Судьба человека с Борисом Корчевниковым,Россия 1,2017-11-23,34647,152,36,44,RU,Entertainment
"#NAME?","ПРЕМЬЕРА 2017 ОТ КОТОРОЙ РЫДАЛИ ДЕВКИ [ НЕЖНАЯ ЖЕНЩИНА ] Русские мелодрамы 2017 новинки, фильмы 2017",ФильмЛяндия,2017-11-23,28863,110,26,3,RU,Entertainment
6BxJHVexsDU,NOKIA 3310 VS  iPhone X  - ЗАМОРОЗИТЬ в ЖИДКОМ АЗОТЕ  -196 °С ... ЧТО БУДЕТ ..?!,TimOn ChaveS,2017-11-22,554471,26808,3233,4154,RU,Entertainment
vP4XKbuhjKU,"ЧЕ, ПАЦАНЫ АНИМЕ? - HardObzor 28",RussFegg,2017-11-23,57555,10118,141,1337,RU,Entertainment
iks2tYUbXqY,ТОП ПРЕДСТОЯЩИЙ МУЛЬТФИЛЬМОВ 2018 (Русский Трейлер),FilmSelect Россия,2017-11-22,54741,567,59,16,RU,Entertainment
YQvel9QFEOQ,Stand Up - Нурлан Сабуров о провинциальном роддоме,Телеканал ТНТ,2017-11-22,65092,1103,62,28,RU,Entertainment
ms1WYFKcciA,Всего 2 чашки в День в Течение 1 Недели Обеспечат Вам Плоский Живот,AdMe.ru - Сайт о творчестве,2017-11-24,13861,2006,35,55,RU,Entertainment
SrWKPhu03lU,"ЧТО, ЕСЛИ люди остались ОБЕЗЬЯНАМИ",Что если,2017-11-24,503868,26567,3009,3084,RU,Entertainment
Ao5jRFaHDO8,Отель Элеон -  5 серия 3 сезон (47 серия) - комедия HD,Отель Элеон,2017-11-23,1760516,29361,1406,3265,RU,Entertainment
WB99BYO9_Ko,=Обзор ИРП= РЕДКИЙ СУХПАЙ ЧЕХИИ. Что едят  солдаты НАТО,Видео от SoLiDa,2017-11-24,278133,15124,705,1961,RU,Entertainment
_SJVCs0rNF0,ЧТО ЕСЛИ ПОЕЗД - ПЕРЕЕДЕТ iPhone X ?!,TimOn ChaveS,2017-11-24,342902,29992,2152,7243,RU,Entertainment
RmkeEpRTwQY,Ян Гэ «Castle in the Snow» - Нокауты - Голос - Сезон 6,Голос / The Voice Russia,2017-11-24,34266,1666,71,264,RU,Entertainment
UtkQjbnxq6I,ЯИЦА ИЗ ФИКС ПРАЙС ПОД КОНТРОЛЕМ - морские монстры,Обзоры Игрушек Товарищ Сафронов,2017-11-24,47756,1440,68,252,RU,Entertainment
x4XS_U3hk2A,60 минут. ВОЕННЫЕ РЕЛЬСЫ ПУТИНА: как отреагировал Запад? От 24.11.17,Россия 24,2017-11-24,165165,1160,403,994,RU,Entertainment
3kqur-TIRLY,Топ10 ТВОИХ ЛЮБИМЫХ Фильмов!,telblog.net,2017-11-24,130078,9793,891,2771,RU,Entertainment
LcCWmMcBSnk,Черепашки-ниндзя | 1 сезон 12 серия | Nickelodeon Россия,Nickelodeon Россия,2017-11-24,97199,1326,64,222,RU,Entertainment
4IZGu9Lcuvw,Парни пробуют ТЕСТ НА ИДИОТА  ☑️,Smetana TV,2017-11-24,122420,12940,122,358,RU,Entertainment
uJG41HNz_aE,ЛАРИН ОТВЕЧАЕТ НА ШКОЛЬНЫЕ ВОПРОСЫ,DaiFiveTop,2017-11-23,756963,56246,1598,3151,RU,Entertainment
b6sxuKIqPeQ,"5də5 - Musa Musayev, Təranə Qumral, Orxan Babazadə (23.11.2017)",Xəzər Media,2017-11-24,57287,449,125,243,RU,Entertainment
9d0z1j9BzIg,ЮЛИК 20!8,Юлик,2017-11-23,511511,91703,1690,4685,RU,Entertainment
JNUAEqukSoA,Все киногрехи Железный человек 2,KINOKOS,2017-11-24,83263,5122,112,453,RU,Entertainment
x5Dx-kEvIBM,"Дана Борисова, Евгений Осин, Крис Кельми: Жизнь после клиники. Андрей Малахов. Прямой эфир 24.11.17",Прямой эфир,2017-11-24,166026,627,300,767,RU,Entertainment
WRoY6e5PxuA,"Страшное дело. Смотрите, как я колдую! (24.11.2017) HD",Secret TV,2017-11-24,9728,45,9,19,RU,Entertainment
cN-iaOU0y7k,Государство и семья. Время покажет. Выпуск от 24.11.2017,Новости на Первом Канале,2017-11-24,9930,51,20,0,RU,Entertainment
WTLqMoo-Fbw,Bozbash Pictures Lökbatan Yeni (23.11.2017),BozbashPictures,2017-11-23,297249,4394,414,558,RU,Entertainment
"#NAME?",Давай поженимся! Энергичный миллионер. Выпуск от 24.11.2017,Красный квадрат,2017-11-24,30587,107,38,89,RU,Entertainment
ZD_4n5W78uw,"Выходные дни. Таро прогноз 25-26 ноября, 2017",Irina Dybro Tarot Reading,2017-11-24,7701,375,39,18,RU,Entertainment
8O7Es-z7diw,"5 МЕСТ НА ЗЕМЛЕ, ГДЕ ГРАВИТАЦИЯ НЕ РАБОТАЕТ",Мастерская Настроения,2017-11-23,1484636,48081,2832,3573,RU,Entertainment
9Ue3XZFD6WY,"10 Новых Телефонных Мошенничеств, о Которых Нужно Знать",AdMe.ru - Сайт о творчестве,2017-11-25,9520,1170,20,61,RU,Entertainment
TmNIJc34Ay4,История На Ночь - НЕУЛОВИМЫЙ РАЙОН.,†СТРАШНЫЕ ИСТОРИИ ОТ ВОРОНА†,2017-11-24,3474,336,6,50,RU,Entertainment
Z-s_QUenHXE,Сергей Астахов. Судьба человека с Борисом Корчевниковым,Россия 1,2017-11-24,28096,148,20,45,RU,Entertainment
QCPhqGlZg9U,Вызов (2 сезон) - 100 000 рублей,LizzzTV,2017-11-23,246595,15424,947,818,RU,Entertainment
hrDcZkZp_pU,6 ЛАЙФХАКОВ от SLIVKI SHOW,SlivkiShow,2017-11-25,2591759,131799,14752,9740,RU,Entertainment
UCP-GBzyyro,На Землю СКОРО Упадет Луна?,Ridddle,2017-11-25,396509,22305,1950,2676,RU,Entertainment
9WQZ17iHCNg,Секрет на миллион - Виктор Салтыков 25.11.2017,Skvell,2017-11-25,39761,79,115,220,RU,Entertainment
UzxmPr7rK8U,Ночь в Доме Из Пленки НА ДЕРЕВЕ АЛИСА СЛЕДИТ ЗА МНОЙ 24 часа | Elli Di,Elli Di,2017-11-25,938470,38071,3108,8559,RU,Entertainment
H_RjYMDAUGM,Лютые троли фотошопа 380 УРОВНЯ!,Max Maximov,2017-11-25,88158,2927,457,160,RU,Entertainment
YvticymHQvI,ЭЛДЖЕЙ — До Того Как Стал Известен!,telblog.net,2017-11-25,271434,12134,1147,1420,RU,Entertainment
wMsKLq7XdaY,"ЛУЧШИЕ ДУЭТЫ В РЭПЕ В 2017 / FEDUK & Элджей. T-Fest & Скриптонит, Obladaet & Markul , sidxram, ЛСП",Tema Flex,2017-11-25,69022,3427,133,699,RU,Entertainment
CjJIazEevWg,Евгений Кузин и Саша Артемова:  СВАДЬБА! ГОСТИ! ТОРТ! ПОЗДРАВЛЕНИЯ!,ЗВЕЗДНАЯ ЖИЗНЬ,2017-11-25,46104,157,106,57,RU,Entertainment
kcgOKtHNNVk,"EVROS TV - ИНОСТРАНЦЫ СМОТРЯТ МУЛЬТИКИ И СЛУШАЮТ РУССКУЮ МУЗЫКУ (FACE, OXXXYMIRON, БАСТА, ATL)",EvRosTV,2017-11-25,117522,4826,585,688,RU,Entertainment
SrWKPhu03lU,"ЧТО, ЕСЛИ люди остались ОБЕЗЬЯНАМИ",Что если,2017-11-24,724324,31472,4214,3719,RU,Entertainment
lfR37RPQD0M,«Стена». 6 выпуск,WeiT Media,2017-11-25,34227,433,42,111,RU,Entertainment
AaVoS5pGPk8,САМЫЙ ВАТНЫЙ КЛИП ШКОЛЬНИКОВ... (Песня о Путине Дядя Вова Мы С Тобой реакция),ДА НИЛ,2017-11-25,42643,5545,314,564,RU,Entertainment
nDnGQvgub9g,Столото представляет| Русское лото тираж №1207 от 26.11.17,Столото,2017-11-26,5442,62,24,27,RU,Entertainment
imAIz99twZY,Нина Шацкая «Колдунья» - Нокауты - Голос - Сезон 6,Голос / The Voice Russia,2017-11-24,54432,974,271,386,RU,Entertainment
ljq8fx48-V4,"5də5 - Mətanət İsgəndərli, Elnur Məmmədov  (24.11.2017)",Xəzər Media,2017-11-25,25696,173,31,41,RU,Entertainment
pJ07IJfz8TA,Дмитрия Хворостовского привезли в Москву на прощание!,Лучшее из Сети,2017-11-25,8844,37,3,7,RU,Entertainment
BpOLF8yvdVE,Фильм Враждебное намерение Хороший боевик,StarmeD,2017-11-25,20904,22,8,0,RU,Entertainment
zITDn8FJseA,Serafima Sakhanovich SP 2017 Skate America,FSone,2017-11-26,9102,173,8,42,RU,Entertainment
l8goh2lHz4I,Своя игра 25.11.2017,Наше! Телевидение,2017-11-25,14097,91,12,12,RU,Entertainment
em62He4-0Ss,Идеальный ремонт. В гостях у Евгения Кулакова. Чудеса ремонта. Выпуск от 25.11.2017,Красный квадрат,2017-11-25,6492,62,2,14,RU,Entertainment
RAPrxWz_agc,КУЧА СЛАДОСТЕЙ 🍰 Cheese-сake.ru VS Азбука вкуса 🍰 Сравнение,Покашеварим,2017-11-25,29203,1546,176,210,RU,Entertainment
T2AUIjN2PVc,"МУЧАЮ АНТИСТРЕССЫ УТЮГОМ, ЕНОТОМ, БЛЕНДЕРОМ и др  с сайта Gearbest",Live Today,2017-11-25,60530,3807,100,1028,RU,Entertainment
kuxSldxCmXk,ЭКСКЛЮЗИВ! УРМАТ НЕЛЯ ЭФИРДЕН УРУШУП КЕТЕ ЖАЗДАП...СОЗСУЗ КОР! КЕЧКИ БИШКЕК,Каниет Жыргалбеков,2017-11-25,40943,495,66,221,RU,Entertainment
FGtGH7wZTko,Новогодний салат из крабовых палочек -  рецепт Бабушки Эммы,Рецепты Бабушки Эммы,2017-11-25,14868,1239,47,161,RU,Entertainment
WB99BYO9_Ko,=Обзор ИРП= РЕДКИЙ СУХПАЙ ЧЕХИИ. Что едят  солдаты НАТО,Видео от SoLiDa,2017-11-24,350714,17142,860,2219,RU,Entertainment
zTIffAiSgbs,Тело Дмитрия Хворостовского доставят в Москву,Жизнь Замечательных Людей,2017-11-25,13304,81,2,25,RU,Entertainment
LcCWmMcBSnk,Черепашки-ниндзя | 1 сезон 12 серия | Nickelodeon Россия,Nickelodeon Россия,2017-11-24,272339,1958,137,268,RU,Entertainment
ZsaLMaKN30k,Свадьба Евгения Кузина и Саши Артёмовой. Букет невесты,АнтиХламур / Дом-2 в Periscope,2017-11-24,22267,50,17,9,RU,Entertainment
rGxVVQhf57w,ТЯЖЕЛО  ВЗДОХНУЛА  и пошла на  ВЫСОКУЮ НОТУ,Вячеслав Маринушкин,2017-11-25,49546,275,22,10,RU,Entertainment
vanibZ9VYqA,РВАТЬ НА БИТАХ - ЕЖЕМЕСЯЧНЫЕ Х БЕССЛАВНЫЕ УБЛЮДКИ (СЛАВА КПСС/FALLEN Х ЭРНЕСТО ЗАТКНИТЕСЬ/МАЙТИ ДИ),#SLOVOSPB PRODUCTION,2017-11-26,720708,30349,14470,8607,RU,Entertainment
bMj52qjlLIU,WINNER - POLINA BOGUSEVICH - WINGS - LIVE - RUSSIA - JUNIOR EUROVISION 2017,Junior Eurovision Song Contest,2017-11-26,111488,2495,605,705,RU,Entertainment
O_LlJ1JKpus,Славный обзор. Чизкейк за 5000 рублей!!! Дороговато...,oblomoff,2017-11-26,672185,36200,3818,3047,RU,Entertainment
nDnGQvgub9g,Столото представляет| Русское лото тираж №1207 от 26.11.17,Столото,2017-11-26,68360,141,312,102,RU,Entertainment
IoTtMTfeuS4,Русский ниндзя - Выпуск 1 от 26.11.17.,Tiger Trailers,2017-11-26,30786,300,117,128,RU,Entertainment
G0EdovtC0i4,Топ10 ПЛАГИАТОВ Русских Сериалов!,telblog.net,2017-11-26,301852,13798,1207,1554,RU,Entertainment
J16EK_LXRNU,КАКАЯ ДОЗА ВОДЫ ТЕБЯ УБЬЁТ?,DaiFiveTop,2017-11-26,619919,35289,1937,3045,RU,Entertainment
hrDcZkZp_pU,6 ЛАЙФХАКОВ от SLIVKI SHOW,SlivkiShow,2017-11-25,3614043,155488,19684,11281,RU,Entertainment
UCP-GBzyyro,На Землю СКОРО Упадет Луна?,Ridddle,2017-11-25,609884,27955,2717,3214,RU,Entertainment
x91l0xZ5PAg,Онлайн-трансляция из Нескучного сада 26 ноября 2017 года,Что? Где? Когда?,2017-11-26,43488,453,63,38,RU,Entertainment
g61cvpz7LyU,Eşkıya Dünyaya Hükümdar Olmaz 82. Bölüm Fragmanı - atv,atv,2017-11-26,432369,2433,86,193,RU,Entertainment
KfXAd3tgc1M,Сегодня вечером. Татьяна Тарасова. Выпуск от 25.11.2017,Сегодня вечером,2017-11-26,45603,241,45,79,RU,Entertainment
oDUtaMKFef0,Топ-модель по-украински. Выпуск 13. 24.11.2017,Новий Канал,2017-11-26,355259,6392,673,2432,RU,Entertainment
7qnscli7pHg,ЭТОТ ТЕСТ ПРОВЕРИТ ТВОЮ ПАМЯТЬ! Без ошибок пройдут только 5%,Big ideas,2017-11-26,20847,582,59,431,RU,Entertainment
txJ_nKd4TwU,Итоги недели с Ирадой Зейналовой. 26.11.2017г.,The Only One Channel 2,2017-11-26,20243,112,21,29,RU,Entertainment
jPpBFJfIeXw,"ЧТО БУДЕТ, ЕСЛИ ТРИЛЛИОН ДОЛЛАРОВ ВЛОЖИТЬ В НАУКУ",Top Five,2017-11-26,215505,13328,412,1550,RU,Entertainment
jOMJsyIRK0Q,Victoria Sinitsina | Nikita Katsalapov SD 2017 Skate America,FSone,2017-11-26,14327,82,9,28,RU,Entertainment
wMsKLq7XdaY,"ЛУЧШИЕ ДУЭТЫ В РЭПЕ В 2017 / FEDUK & Элджей. T-Fest & Скриптонит, Obladaet & Markul , sidxram, ЛСП",Tema Flex,2017-11-25,127278,4787,215,920,RU,Entertainment
9WQZ17iHCNg,Секрет на миллион - Виктор Салтыков 25.11.2017,Skvell,2017-11-25,76916,97,192,274,RU,Entertainment
ZMEyi5an25s,Özlem'den Cengiz'e tehdit! - Cennet'in Gözyaşları 10. Bölüm,Cennet'in Gözyaşları,2017-11-26,13914,95,2,5,RU,Entertainment
iCs355gUgZE,НОВЕЙШИЕ РУССКИЕ ТРЕЙЛЕРЫ 2017 | Неделя #47,FilmSelect Россия,2017-11-26,106919,968,113,48,RU,Entertainment
H_RjYMDAUGM,Лютые троли фотошопа 380 УРОВНЯ!,Max Maximov,2017-11-25,143732,3972,748,186,RU,Entertainment
vGHHbo6SBEk,"5 ОБМАНОВ МАГАЗИНОВ, О КОТОРЫХ ВЫ НЕ ЗНАЛИ",tophype,2017-11-26,108553,7284,343,1725,RU,Entertainment
yef_HfQoBd8,Black Mirror - Arkangel | Official Trailer [HD] | Netflix,Netflix,2017-11-25,1776191,21784,1286,2426,RU,Entertainment
AaVoS5pGPk8,САМЫЙ ВАТНЫЙ КЛИП ШКОЛЬНИКОВ... (Песня о Путине Дядя Вова Мы С Тобой реакция),ДА НИЛ,2017-11-25,59581,6716,375,624,RU,Entertainment
ayBqqabbmmE,История На ночь - Доходяга,†СТРАШНЫЕ ИСТОРИИ ОТ ВОРОНА†,2017-11-26,3925,472,5,60,RU,Entertainment
79QqSt9dZKo,Damla - Xosbext ol / 2018 (Official Klip Clip),Damla Official,2017-11-26,56042,4583,106,819,RU,Entertainment
QsTj1Efob_0,Нино Басилая When we were young – выбор вслепую – Голос. Дети 4 сезон,Голос країни,2017-11-26,67391,1471,32,119,RU,Entertainment
7UU0antTtCE,Гороскоп Таро для всех знаков Зодиака на неделю c 27 ноября по 3 декабря 2017 года,Irina Dybro Tarot Reading,2017-11-26,6522,426,33,52,RU,Entertainment
QqxSxGt5t5o,Битва экстрасенсов. Сезон 17. Выпуск 9 от 26.11.2017,Битва екстрасенсів,2017-11-26,18211,192,37,55,RU,Entertainment
jvJIJil9JLQ,Школьница забеременела от 25-летнего насильника-армянина — Один за всех — 26.11.2017,Телеканал СТБ,2017-11-26,21130,255,69,270,RU,Entertainment
fa1lryy5guY,Юмористический сериал На троих: 3 серия 4 сезон 2017 | Дизель Студио -  приколы  Украина,Фильмы и сериалы Дизель Студио,2017-11-26,29107,318,18,18,RU,Entertainment
Za95f5ZQC8E,Отель Элеон -  6 серия 3 сезон - 48 серия - комедия HD,Отель Элеон,2017-11-27,1009649,20391,777,3065,RU,Entertainment
0GSO-XPtPI0,ДИСС НА КОМКОВА,Юлик,2017-11-27,527473,64428,1127,3270,RU,Entertainment
iIYwVHW0gIM,Итальянцы пробуют исконно русские напитки,Итальянцы by Kuzno Productions,2017-11-27,178488,13120,159,2024,RU,Entertainment
wuShxdlQx30,Comedy Club - Идеальная женщина,Телеканал ТНТ,2017-11-27,388168,5046,294,112,RU,Entertainment
D4I64-GCN-c,Чокнутое Ведро и Реакция Моего Суриката Тимона  !!!,TimOn ChaveS,2017-11-27,437200,45037,764,3491,RU,Entertainment
CE-7xWf5k5Y,15 НЕУДАЧНИКОВ,LAПIN,2017-11-27,239017,9267,1791,1471,RU,Entertainment
AZp_54850a0,Ночь в ДОМЕ с Полтергейстом | GhostBuster в Испании,Дима Масленников,2017-11-27,247824,36769,842,10307,RU,Entertainment
TctjxiaqBhw,OXXXYMIRON | PHARAOH | ХАСКИ | SID X RAM | РВАТЬ НА БИТАХ #RapNews 243,RapNews,2017-11-27,126819,5847,390,469,RU,Entertainment
bMj52qjlLIU,WINNER - POLINA BOGUSEVICH - WINGS - LIVE - RUSSIA - JUNIOR EUROVISION 2017,Junior Eurovision Song Contest,2017-11-26,276063,4421,1107,1145,RU,Entertainment
vanibZ9VYqA,РВАТЬ НА БИТАХ - ЕЖЕМЕСЯЧНЫЕ Х БЕССЛАВНЫЕ УБЛЮДКИ (СЛАВА КПСС/FALLEN Х ЭРНЕСТО ЗАТКНИТЕСЬ/МАЙТИ ДИ),#SLOVOSPB PRODUCTION,2017-11-26,1078832,37703,18782,10662,RU,Entertainment
qZDLfyafJQY,Памяти Дмитрия Хворостовского. Судьба человека с Борисом Корчевниковым,Россия 1,2017-11-27,61953,646,42,194,RU,Entertainment
nN12Ao2hlMQ,"ПЕЧЕНЬ, СЕРДЦЕ, ПОЧКИ. КОЛБАСА по-Кавказски",Георгий Кавказ,2017-11-27,160441,14554,198,1151,RU,Entertainment
SfWXpqC2QdE,РУСЛАН CMH УЖЕ НЕ ТОТ...,ДА НИЛ,2017-11-27,50082,3863,167,281,RU,Entertainment
eBoQzCjiq5A,10 САМЫХ УРОДЛИВЫХ МАШИН,DaiFiveTop,2017-11-27,164296,8212,1201,1188,RU,Entertainment
IoTtMTfeuS4,Русский ниндзя - Выпуск 1 от 26.11.17.,Tiger Trailers,2017-11-26,96337,691,403,339,RU,Entertainment
KnZYQBYYefk,Вечер с Владимиром Соловьевым от 27.11.2017,Россия 24,2017-11-27,124703,795,328,574,RU,Entertainment
pYQyI-gCZUM,Прощание с Дмитрием Хворостовским Несколько сотен людей пришли проститься с Хворостовским,Большой Брат,2017-11-27,24564,124,7,6,RU,Entertainment
G0EdovtC0i4,Топ10 ПЛАГИАТОВ Русских Сериалов!,telblog.net,2017-11-26,489512,17503,1973,2064,RU,Entertainment
O_LlJ1JKpus,Славный обзор. Чизкейк за 5000 рублей!!! Дороговато...,oblomoff,2017-11-26,892888,42339,4740,3752,RU,Entertainment
2BZFXFRsQPI,Родные Дмитрия Хворостовского заявили о странном решении!!!,SHOW NEWS,2017-11-27,51865,245,25,28,RU,Entertainment
FQp-A7amSbA,Развод Джигарханяна с молодой женой в прямом эфире. Андрей Малахов. Прямой эфир от 27.11.17,Прямой эфир,2017-11-27,133756,474,500,1476,RU,Entertainment
CFfrL7Pe3rc,Вечерний Ургант. В гостях Владимир Познер.(27.11.2017),Вечерний Ургант,2017-11-27,40006,1444,72,112,RU,Entertainment
t9JQqw-bhzA,СЛИВ ВОЙНЫ БЕСКОНЕЧНОСТИ,Qewbite,2017-11-27,103037,8981,126,851,RU,Entertainment
sSqkVYYDC24,Отель Элеон 3 сезон - Анонс 6-9 серий,Кухня (сериал),2017-11-27,64256,1254,36,153,RU,Entertainment
tuw886Rse00,Давай поженимся! Бортпроводница с ребенком. Выпуск от 27.11.2017,Красный квадрат,2017-11-27,30726,67,21,38,RU,Entertainment
BlYucbxkIyc,Все киногрехи Пипец 2,KINOKOS,2017-11-27,79208,4240,103,329,RU,Entertainment
qf06rcKGFWM,Вдова сразила наповал поклонников на прощании с Хворостовским!,Лучшее из Сети,2017-11-27,16623,63,16,3,RU,Entertainment
nDnGQvgub9g,Столото представляет | Русское лото тираж №1207 от 26.11.17,Столото,2017-11-26,78659,152,392,130,RU,Entertainment
dQsnQ6iMsHk,"Угарные фамилии. Игорь Престолов,  Килька Сазанович и ...",Max Maximov,2017-11-27,83174,4178,89,632,RU,Entertainment
aeekRJsoHt8,Синяя птица 2017. Новый 3 сезон. Эфир от 26.11.2017,Всероссийский конкурс юных талантов Синяя птица,2017-11-27,8071,102,5,16,RU,Entertainment
x91l0xZ5PAg,Онлайн-трансляция из Нескучного сада 26 ноября 2017 года,Что? Где? Когда?,2017-11-26,59201,520,87,110,RU,Entertainment
WzaO43Rn-9Y,\Ազիզյաններ\ 3 եթերաշրջան\ սերիա 13\,Aren games Time,2017-11-27,30429,254,21,23,RU,Entertainment
kYi377Gv9XQ,10 ОТЛИЧИЙ ОБЩЕЖИТИЙ В РАЗНЫХ СТРАНАХ МИРА,tophype,2017-11-27,91728,5534,225,875,RU,Entertainment
iCs355gUgZE,НОВЕЙШИЕ РУССКИЕ ТРЕЙЛЕРЫ 2017 | Неделя #47,FilmSelect Россия,2017-11-26,163038,1286,156,62,RU,Entertainment
tnlPF4iYBkw,Отель Элеон -  7 серия 3 сезон 49 серия - комедия HD,Отель Элеон,2017-11-28,1049736,21841,764,2849,RU,Entertainment
3VbHg5fqBYw,Avengers: Infinity War Trailer Tease,Marvel Entertainment,2017-11-28,3111226,127081,12405,18233,RU,Entertainment
PmXJk7em8JY,В Москве похоронили Дмитрия Хворостовского,Жизнь Замечательных Людей,2017-11-28,68530,163,51,28,RU,Entertainment
AZp_54850a0,Ночь в ДОМЕ с Полтергейстом | GhostBuster в Испании,Дима Масленников,2017-11-27,1098361,97854,2705,25091,RU,Entertainment
o0eCLTzKm7M,=Обзор ИРП= Американская еда. Во всем виновато США! Сухпай MRE Menu № 22,Видео от SoLiDa,2017-11-28,248966,14710,675,1834,RU,Entertainment
wuShxdlQx30,Comedy Club - Идеальная женщина,Телеканал ТНТ,2017-11-27,774061,9599,1157,150,RU,Entertainment
N9An30Eiq7M,10 ЖИВОТНЫХ С НАСТОЯЩИМИ СУПЕРСПОСОБНОСТЯМИ,Мастерская Настроения,2017-11-28,858209,23012,1084,1774,RU,Entertainment
0GSO-XPtPI0,ДИСС НА КОМКОВА,Юлик,2017-11-27,961780,94780,2156,4239,RU,Entertainment
qT_gRQw5h84,60 минут по горячим следам (дневной выпуск в 13:00) от 28.11.17,Россия 24,2017-11-28,153435,809,701,888,RU,Entertainment
9EyugLwlnwk,Похороны Дмитрия Хворостовского на Новодевичьем Прощание с великим маэстро Вся страна скорбит,Большой Брат,2017-11-28,22641,82,27,9,RU,Entertainment
uOT0YujK49w,#190 Влог! Готовим Шарлотку с Яблоками и Корицей!,ANTONplusANNA,2017-11-28,65403,5410,55,307,RU,Entertainment
iIYwVHW0gIM,Итальянцы пробуют исконно русские напитки,Итальянцы by Kuzno Productions,2017-11-27,348665,17910,328,2477,RU,Entertainment
6EIk6MJPJRo,18-летний сын Филиппа Киркорова обнародовал совместные фото со звездным отцом!,Лучшее из Сети,2017-11-28,74721,483,68,45,RU,Entertainment
VUb5yWYww90,Eşkıya Dünyaya Hükümdar Olmaz 82. Bölüm,atv,2017-11-28,177602,1670,198,225,RU,Entertainment
wMbNNF0ihWA,РОМА МИЛЛИОНЕР! Ищет НОВЫХ ДРУЗЕЙ Даша Всех ПОМИРИЛА kids children,Dasha Koshkina,2017-11-28,352204,4625,1124,1274,RU,Entertainment
p35LhYUq-W8,Давай поженимся! Разборчивый бизнесмен. Выпуск от 28.11.2017,Красный квадрат,2017-11-28,32189,139,43,136,RU,Entertainment
0OdEVomGRF8,Бизнес ланч | ШИКАРИ | Выпуск #10,Покашеварим,2017-11-28,62367,2378,174,231,RU,Entertainment
Gc54JAC5Xd8,ВАТНЫЙ КЛИП ПРО АРМИЮ ИЗ НУЛЕВЫХ...,ДА НИЛ,2017-11-28,42882,5111,156,555,RU,Entertainment
33OpwBzq71I,Крутой раскрыл пугающие подробности болезни Хворостовского,vangogh TV,2017-11-28,53658,0,0,0,RU,Entertainment
CjRQjNXZZmM,МастерШеф. Сезон 7. Выпуск 27. Часть 1 из 3 от 28.11.2017,МастерШеф,2017-11-28,22094,152,26,132,RU,Entertainment
WwUEvm4AVlY,Вкуснейшая паста,Borsch,2017-11-28,50571,4948,217,1276,RU,Entertainment
mXjdLKkfiZ0,"Американцы Слушают Русскую Музыку #37 OXXXYMIRON, БАСТА, СКРИПТОНИТ, ГУФ, SLIM, ОУ74, LEXS(ГАМОРА)",GlebaTV,2017-11-28,130004,4397,682,1008,RU,Entertainment
e9Gv1ePvxsQ,"Новые Инста Вайны [Выпуск 35] Лев Шагинян, яжемать, Юфрейм, Абрамова Лилия, Андрей Глазунов",PastaTV - инстаграм вайны,2017-11-28,4577,106,7,8,RU,Entertainment
qzhzp2UOA10,DENGIZDAN TOMCHI 11,my.uzbekistan uz,2017-11-28,4325,38,4,0,RU,Entertainment
cwssgQ_EpOk,Сын выгоняет вдову актёра Евстигнеева на улицу. Андрей Малахов. Прямой эфир от 28.11.17,Россия 1,2017-11-28,48575,137,64,122,RU,Entertainment
iTbBEf4wn6E,DRAW CHALLENGE #ЛенаНарисуй,Elena Sheidlin,2017-11-28,624712,55787,766,3282,RU,Entertainment
bMj52qjlLIU,WINNER - POLINA BOGUSEVICH - WINGS - LIVE - RUSSIA - JUNIOR EUROVISION 2017,Junior Eurovision Song Contest,2017-11-26,318500,4986,1232,1341,RU,Entertainment
D4I64-GCN-c,Чокнутое Ведро и Реакция Моего Суриката Тимона  !!!,TimOn ChaveS,2017-11-27,594680,53627,1044,4114,RU,Entertainment
CE-7xWf5k5Y,15 НЕУДАЧНИКОВ,LAПIN,2017-11-27,297729,10249,2352,1601,RU,Entertainment
oZuUIu-iWAI,Мстители: Война бесконечности – тизер-трейлер,MARVEL Россия,2017-11-29,2538435,109010,2028,12998,RU,Entertainment
"#NAME?",Отель Элеон - 8 серия 3 сезон 50 серия - комедия HD,Отель Элеон,2017-11-29,1233105,21979,814,2151,RU,Entertainment
xY7sHfV5ReQ,ВСЯ ПРАВДА о iPhone X / Возвращаю телефон!,Дима Масленников,2017-11-29,382160,51565,2366,11803,RU,Entertainment
3VbHg5fqBYw,Avengers: Infinity War Trailer Tease,Marvel Entertainment,2017-11-28,6941731,177893,19441,21252,RU,Entertainment
prNI5b9xOro,Топ10 Кандидатов в ПРЕЗИДЕНТЫ!,telblog.net,2017-11-29,199718,11539,3043,3752,RU,Entertainment
"#NAME?",YUNG TRAPPA | OXXXYMIRON | ST | МЭЙТИ | ГРОТ #RapNews 244,RapNews,2017-11-29,160733,5302,409,355,RU,Entertainment
_PW191szkro,"EVROS TV - ИНОСТРАНЦЫ СЛУШАЮТ РУССКУЮ МУЗЫКУ (0XXXYMIRON, LSP, MIYAGI, FEDUK, SCHOKK, ЧЕСТНЫЙ)",EvRosTV,2017-11-29,186916,10055,612,1219,RU,Entertainment
pF8nafsroK0,СМОЖЕТ ЭКШЕН КАМЕРА ЗАПИСАТЬ мое ЛИЦО - ВНУТРИ ЖИДКОГО АЗОТА - 196 °С ?!,TimOn ChaveS,2017-11-29,356181,34941,1059,2091,RU,Entertainment
z1FL60aLCpI,Diriliş Ertuğrul 98.Bölüm Fragmanı,TRT 1,2017-11-29,223068,1280,58,0,RU,Entertainment
KFkB66szOGs,Развлечение для компании?  PlayLink - проверка рекламы,Костя Павлов,2017-11-29,207807,10444,1322,712,RU,Entertainment
SHgyoN8IeLo,Вечер с Владимиром Соловьевым от 29.11.2017,Россия 24,2017-11-30,151057,1222,625,394,RU,Entertainment
2gm4_lGHc6M,Ирина Салтыкова. Судьба человека с Борисом Корчевниковым,Россия 1,2017-11-29,30896,144,103,186,RU,Entertainment
VUb5yWYww90,Eşkıya Dünyaya Hükümdar Olmaz 82. Bölüm,atv,2017-11-28,554434,3242,578,443,RU,Entertainment
zVosj6ncD0E,МастерШеф. Сезон 7. Выпуск 28. Часть 1 из 4 от 29.11.2017,МастерШеф,2017-11-29,35182,255,34,208,RU,Entertainment
O1e3vMZzBMw,Загадки человечества. 94 выпуск (29.11.2017) HD,Secret TV,2017-11-29,11523,60,10,1,RU,Entertainment
AyZsDohzMR4,Киморбоз Эр | Ён Кушни Жон Кушни | Оталар Сузи Аклнинг Кузи,???? ????,2017-11-29,11679,73,7,11,RU,Entertainment
L1OiP-eh7u8,"Модный приговор. Дело о том, как раз и навсегда отбить желание у всех подруг... Выпуск от 29.11.2017",Красный квадрат,2017-11-29,14632,78,19,22,RU,Entertainment
b88rrSGakBg,Почему на похороны легендарного Петрухи не пришли его родные дети? Прямой эфир от 29.11.17,Прямой эфир,2017-11-29,40126,162,66,121,RU,Entertainment
_3U-SeSmimA,Konul Kerimovanin qizinin toyunda bash verenler (Gune son),ARB Sheki,2017-11-29,18700,81,8,4,RU,Entertainment
Rxj5WhXWHAw,ITPEDIA О НЕНОРМАЛЬНЫХ ШКОЛЬНИКАХ И О РУССКОМ БЫДЛО.,TheCoolGame Channel,2017-11-29,2071,43,1,1,RU,Entertainment
w_EfH_wLNsI,Бывшая жена Джигарханяна заявила о беременности!,Лучшее из Сети,2017-11-29,7800,36,19,7,RU,Entertainment
2sszEu-XOME,"7 ВЕЩЕЙ, КОТОРЫЕ ЛУЧШЕ НЕ ВЫБРАСЫВАТЬ. Например, втулки от туалетной бумаги",Лайфхакер,2017-11-29,7496,236,76,22,RU,Entertainment
j1FtIiKUK8Q,Вечерний Ургант. Павел Трубинер и Мария Шумакова.  901 выпуск от 29.11.2017,Вечерний Ургант,2017-11-29,24803,306,43,37,RU,Entertainment
e7PhNKg90ZY,Big Russian Boss Show #37 | Виталий Милонов,Big Russian Boss Show,2017-11-30,1198630,71673,10911,6785,RU,Entertainment
oZuUIu-iWAI,Мстители: Война бесконечности – тизер-трейлер,MARVEL Россия,2017-11-29,3897399,137843,3182,16422,RU,Entertainment
_HO6b5aqYCM,БЛОГЕРЫ ПРОТИВ РОССИИ-24: Репортаж о ВИНИШКО-ТЯН!,Уголок Акра,2017-11-30,261710,25279,854,1848,RU,Entertainment
qFsGYP8eZDQ,Отель Элеон - Серия 9 сезон 3 (51 серия) - комедийный сериал HD,serial,2017-11-30,677952,9362,405,964,RU,Entertainment
eng7k3WZxX0,ВОТ ЭТО ХАЧАПУРИ!! Вот уж реально МНОГО и ВКУСНО!,oblomoff,2017-11-30,670162,56974,1927,4216,RU,Entertainment
kohazg0V96k,"Что, Если Черная Дыра Столкнется с БЕЛОЙ?",Ridddle,2017-11-30,330765,22636,2104,3180,RU,Entertainment
suoWXycjKVw,Детские рисунки глазами МАСТЕРА ФОТОШОПА 580 уровня,Max Maximov,2017-11-30,143319,8076,321,582,RU,Entertainment
PksTScxpODM,Саню забегают !!! Полиция беспределит,Романус,2017-11-30,101087,4944,356,464,RU,Entertainment
xY7sHfV5ReQ,ВСЯ ПРАВДА о iPhone X / Возвращаю телефон!,Дима Масленников,2017-11-29,834192,77597,4480,17637,RU,Entertainment
i1VybNpaCYY,Просто неАху*нная Шаверма №11,Borsch,2017-11-30,64184,5582,297,885,RU,Entertainment
yI-orTcssQo,Новый Грандиозный Спойлер 8 Сезона Игры Престолов! Что Станет с ДЕЙНЕРИС?,MovieMaker,2017-11-30,49486,1451,222,404,RU,Entertainment
"#NAME?",Отель Элеон - 8 серия 3 сезон 50 серия - комедия HD,Отель Элеон,2017-11-29,2175948,27992,1247,2698,RU,Entertainment
n6Mpk9Wjg00,60 минут по горячим следам от 30.11.2017,Россия 24,2017-11-30,133968,716,308,646,RU,Entertainment
547R5L6mSRk,Виталина травила мужа таблетками! Джигарханян расцвел после расставания с супругой!,Лучшее из Сети,2017-11-30,37369,165,44,65,RU,Entertainment
YJd5c-jw1bI,СЮРПРИЗ ДЛЯ ДАШИ! Рома Устроил ПРАЗДНИК Соня Схитрила kids children,Dasha Koshkina,2017-11-30,258260,3915,322,1339,RU,Entertainment
FuEukIAg3Q4,Загадки человечества. 95 выпуск (30.11.2017) HD,Secret TV,2017-11-30,12873,57,17,8,RU,Entertainment
pF8nafsroK0,СМОЖЕТ ЭКШЕН КАМЕРА ЗАПИСАТЬ мое ЛИЦО - ВНУТРИ ЖИДКОГО АЗОТА - 196 °С ?!,TimOn ChaveS,2017-11-29,537254,43653,1485,2745,RU,Entertainment
DMfKdOiXzxc,Давай поженимся! Врач-ловелас. Выпуск от 30.11.2017,Красный квадрат,2017-11-30,17416,53,13,29,RU,Entertainment
3VbHg5fqBYw,Avengers: Infinity War Trailer Tease,Marvel Entertainment,2017-11-28,7281189,180808,19955,21244,RU,Entertainment
FVrEzKcpsFY,ЛИЗУН СВОИМИ РУКАМИ ПРОТИВ СЛАЙМ ИЗ МАГАЗИНА |НОВЫЙ РЕЦЕПТ ЛИЗУНА |КАНАЛ С ЛИЗУНАМИ |Alisa DIY slime,Alisa DIY,2017-11-30,78360,6459,318,3108,RU,Entertainment
Jaya73HCrsI,Все киногрехи Бегущий в лабиринте,KINOKOS,2017-11-30,67006,4432,92,295,RU,Entertainment
K-3eVI6tvFw,Siyah Beyaz Aşk 8. Bölüm Fragmanı,KanalD,2017-11-30,882933,13649,189,3424,RU,Entertainment
cSmeKOSMjOs,Перепутанные в роддоме девочки отказались от материнского молока. Прямой эфир от 30.11.17,Прямой эфир,2017-11-30,85536,597,86,333,RU,Entertainment
3sDhKteGt6w,"Е. Понасенков: мельдоний, причина неудачи Украины, Райкин в Одессе, Египет, брак Пугачевой",Канал здравого смысла: блог Евгения Понасенкова,2017-11-29,79863,4130,229,470,RU,Entertainment
R9urV1nSCNw,ЛУЧШИЕ СЕКРЕТЫ В СЕРИАЛАХ,MysteryForce,2017-11-30,52326,4209,50,444,RU,Entertainment
KwQ-WeYWt9g,Смотри 10-ю серию финального сезона «Отеля Элеон» до эфира на ТВ уже сейчас только на START.ru,Кухня (сериал),2017-11-30,62213,839,38,101,RU,Entertainment
Ym7vJnDeaSs,Bozbash Pictures Şabran Yeni (30.11.2017),BozbashPictures,2017-11-30,73757,1769,155,354,RU,Entertainment
tQITuqGo3TI,"Бургерная J.D.Burgers | Смотрите, как я чётприуныл",Покашеварим,2017-11-30,64067,2603,270,249,RU,Entertainment
_PW191szkro,"EVROS TV - ИНОСТРАНЦЫ СЛУШАЮТ РУССКУЮ МУЗЫКУ (0XXXYMIRON, LSP, MIYAGI, FEDUK, SCHOKK, ЧЕСТНЫЙ)",EvRosTV,2017-11-29,229273,11115,678,1329,RU,Entertainment
KFkB66szOGs,Развлечение для компании?  PlayLink - проверка рекламы,Костя Павлов,2017-11-29,281475,12495,1604,856,RU,Entertainment
Vuzzo3d2Mn4,ИДУ НА ШОУ УСПЕХ ИДА ГАЛИЧ И НЮША ИГРАЮТ С ДЖИНОЙ на СТС | Elli Di,Elli Di,2017-11-30,337555,26582,380,3952,RU,Entertainment
Je3wpgpNAQY,КОРПОРАТИВНОЕ БУДУЩЕЕ ИНТЕРНЕТА [netstalkers],netstalkers,2017-11-30,58226,11605,41,426,RU,Entertainment
j1FtIiKUK8Q,Вечерний Ургант. Павел Трубинер и Мария Шумакова.  901 выпуск от 29.11.2017,Вечерний Ургант,2017-11-29,87671,612,82,55,RU,Entertainment
rkq8YbiWiG4,Руки-базуки и самая большая грудь Европы. Андрей Малахов. Прямой эфир от 1.12.17,Прямой эфир,2017-12-01,157491,741,1896,251,RU,Entertainment
e7PhNKg90ZY,Big Russian Boss Show #37 | Виталий Милонов,Big Russian Boss Show,2017-11-30,1669644,86983,14891,8414,RU,Entertainment
uhb_pZM9UnM,"ЧТО, ЕСЛИ ты СУПЕРСОЛДАТ",Что если,2017-12-01,408711,25545,1094,1488,RU,Entertainment
oZuUIu-iWAI,Мстители: Война бесконечности – тизер-трейлер,MARVEL Россия,2017-11-29,4392223,148150,3699,17490,RU,Entertainment
BdsX-r3jzvc,РУКИ-БАЗУКИ или СИНТОЛ головного мозга. Кирилл Терешин,Агния Огонек,2017-12-01,214867,14152,759,1711,RU,Entertainment
AiEQ3L4o5jU,Итальянцы угадывают русские звуки животных,Итальянцы by Kuzno Productions,2017-12-01,160333,14016,244,1255,RU,Entertainment
HMUSbM_TVSU,5 МИНУТ НАЗАД -  by A4 - ШКОЛА,A4,2017-12-01,637431,92862,8980,8919,RU,Entertainment
KFdW-k4iSeY,ЧТО ЕСЛИ СМЕШАТЬ в БЛЕНДЕРЕ СМУЗИ из СКИТЛС и M&M's ?! МОЯ РЕАКЦИЯ на КОКТЕЙЛЬ...,TimOn ChaveS,2017-12-01,392897,31340,842,2822,RU,Entertainment
_HO6b5aqYCM,БЛОГЕРЫ ПРОТИВ РОССИИ-24: Репортаж о ВИНИШКО-ТЯН!,Уголок Акра,2017-11-30,423344,32991,1580,2535,RU,Entertainment
wBlCjxtJ-mw,Х/ф Второе Дыхание  .,RED21,2017-12-01,105273,6855,616,331,RU,Entertainment
kohazg0V96k,"Что, Если Черная Дыра Столкнется с БЕЛОЙ?",Ridddle,2017-11-30,504418,28903,2999,3970,RU,Entertainment
PFKOsVlm2dk,10 ИНТЕРЕСНЫХ ФАКТОВ О ДУДЕ,DaiFiveTop,2017-12-01,167588,10753,523,430,RU,Entertainment
TjBMtr5kx88,Брендон Стоун «Historia de un amour» - Нокауты - Голос - Сезон 6,Голос / The Voice Russia,2017-12-01,24153,984,56,134,RU,Entertainment
qFsGYP8eZDQ,Отель Элеон - Серия 9 сезон 3 (51 серия) - комедийный сериал HD,serial,2017-11-30,1221693,12761,639,1396,RU,Entertainment
IXZ8q6cv5NE,Давай поженимся! Защитник для дочери. Выпуск от 01.12.2017,Красный квадрат,2017-12-01,15852,66,54,139,RU,Entertainment
3cvvsPTwen4,KinoKiller - Тизер,KinoKiller Reviews,2017-12-01,8710,1085,28,151,RU,Entertainment
QkEikQ_vjsI,"5də5 - Talıb Tale, Mənzurə Musayeva - ELÇİLİK XAÇMAZ (1-ci hissə)",Xəzər Media,2017-12-01,117628,960,134,637,RU,Entertainment
1JzgX-lZ5CE,Анастасия Макеева. Судьба человека с Борисом Корчевниковым,Россия 1,2017-12-01,43580,171,40,93,RU,Entertainment
FX6TuZSoQQk,PHARAOH | СКРИПТОНИТ | ХАСКИ | ТОНИ РАУТ | КАРАНДАШ #RapNews  245,RapNews,2017-12-01,64877,3138,158,201,RU,Entertainment
2HboMs0vbsE,[2017 MAMA in Hong Kong] BTS_INTRO Perf. + Not Today,Mnet K-POP,2017-12-01,2289723,199785,4451,10481,RU,Entertainment
PksTScxpODM,Саню забегают !!! Полиция беспределит,Романус,2017-11-30,144836,6094,537,613,RU,Entertainment
eng7k3WZxX0,ВОТ ЭТО ХАЧАПУРИ!! Вот уж реально МНОГО и ВКУСНО!,oblomoff,2017-11-30,912440,68124,2444,4882,RU,Entertainment
frPp4-LmqQk,Взрываем Петарды подо льдом и на льду | Взрыв петард в воде и на воде | Взорвали петарду Корсар,ULTRAS PYRO,2017-12-01,4750,427,17,158,RU,Entertainment
M2ilrwTDqws,громкое заявление Ольги Бузовой на премии Высшая Лига 2017 !!!   ПОДРОБНОСТИ !!!,жёлтая газетка,2017-12-01,7843,654,14,195,RU,Entertainment
Ym7vJnDeaSs,Bozbash Pictures Şabran Yeni (30.11.2017),BozbashPictures,2017-11-30,248126,3626,321,759,RU,Entertainment
suoWXycjKVw,Детские рисунки глазами МАСТЕРА ФОТОШОПА 580 уровня,Max Maximov,2017-11-30,230363,11505,519,729,RU,Entertainment
RCMdTOSduDw,"15 ЗАБЛУЖДЕНИЙ, В КОТОРЫЕ ВЫ ВЕРИТЕ",Мастерская Настроения,2017-12-02,1487088,47659,2899,3526,RU,Entertainment
csl5-CD1agw,Руки-базуки: Ради славы в интернете. Андрей Малахов. Прямой эфир. Трансляция от 01.12.17,Прямой эфир,2017-12-01,570096,4830,5076,2408,RU,Entertainment
XyQWDxFD3HM,100 ГРАММ СТЕЙКА за 7000 рублей и ЛОДКА СУШИ!,oblomoff,2017-12-02,680910,46854,2140,3866,RU,Entertainment
MJigiDZ77Bs,ЛОМИТСЯ ПОЛИЦИЯ | РОМАНУСА И МИЛЛЕРА ЗАДЕРЖАЛИ | Анисимова и Миллер,Романус,2017-12-02,176506,16214,589,1781,RU,Entertainment
gvxAFApFDio,Материнский капитал - Королевство кривых кулис. 2 часть - Уральские Пельмени (2017),Уральские Пельмени,2017-12-02,88593,2596,172,208,RU,Entertainment
9ZV5QeRzoq8,"РЭПЕРЫ-ШКОЛЬНИКИ, КОТОРЫЕ СТАЛИ ИЗВЕСТНЫ /  LIL PUMP, THRILL PILL, LIZER, ЛИЛ МОРТИ",Tema Flex,2017-12-02,99813,5093,180,405,RU,Entertainment
B3gK8jjZw3Q,=Обзор ИРП= БЕЛОРУССКИЙ сухпай!  Еда для ВДВ! Привет из СССР!,Видео от SoLiDa,2017-12-02,258044,15999,543,2371,RU,Entertainment
BdsX-r3jzvc,РУКИ-БАЗУКИ или СИНТОЛ головного мозга. Кирилл Терешин,Агния Огонек,2017-12-01,338788,17833,1200,2290,RU,Entertainment
x4M7BW6iiZQ,10 ИСЧЕЗНУВШИХ Профессий!,telblog.net,2017-12-02,162538,7949,228,834,RU,Entertainment
AiEQ3L4o5jU,Итальянцы угадывают русские звуки животных,Итальянцы by Kuzno Productions,2017-12-01,288405,18573,427,1591,RU,Entertainment
60IB-TFYl3s,Вечерний Ургант. Острый репортаж с Аллой Михеевой.(01.12.2017),Вечерний Ургант,2017-12-02,141685,2736,172,152,RU,Entertainment
TjBMtr5kx88,Брендон Стоун «Historia de un amor» - Нокауты - Голос - Сезон 6,Голос / The Voice Russia,2017-12-01,88482,1990,122,233,RU,Entertainment
uhb_pZM9UnM,"ЧТО, ЕСЛИ ты СУПЕРСОЛДАТ",Что если,2017-12-01,601597,31419,1556,1755,RU,Entertainment
FdcDXWRRH8s,Столото представляет | Русское лото тираж №1208 от 03.12.17,Столото,2017-12-03,5714,36,12,16,RU,Entertainment
v-yv6-Jrczw,«Стена». 7 выпуск,WeiT Media,2017-12-02,17320,166,25,24,RU,Entertainment
rp6oy3kEc0Y,Своя игра 02.12.2017,Наше! Телевидение,2017-12-02,8634,71,4,11,RU,Entertainment
UqOj6ymwPNo,Идеальный ремонт. В гостях у Кристины Орбакайте. Легендарный ремонт. Часть 1. Выпуск от 02.12.2017,Красный квадрат,2017-12-02,34889,144,47,55,RU,Entertainment
_PXrUc_d--s,ЭКСКЛЮЗИВ! Султанды жакшы коруп Малика ыйлаганбы?  Созсуз кор. КЕЧКИ БИШКЕК,Каниет Жыргалбеков,2017-12-02,22770,564,45,438,RU,Entertainment
Tl0KuXZUHY0,ЧЕХЛЫ ДЛЯ ТЕЛЕФОНА НА НОВЫЙ ГОД DIY 3D РУЧКА | 5-МИНУТНЫЕ ИДЕИ ЛАЙФХАКИ ДЛЯ ХЕНДМЕЙДА,ANNA CHI,2017-12-02,127070,6109,162,2457,RU,Entertainment
e7PhNKg90ZY,Big Russian Boss Show #37 | Виталий Милонов,Big Russian Boss Show,2017-11-30,1848592,91730,16306,8949,RU,Entertainment
SI-kyvuSZKE,РУКИ-БАЗУКИ СКОРО АМПУТИРУЮТ? СИНТОЛОВЫЙ КАЧОК КИРИЛЛ ТЕРЕШИН ДОИГРАЛСЯ...,Kash,2017-12-02,50406,4162,210,876,RU,Entertainment
jxC-C30YGnk,Документальный проект. Застывшая тайна планеты (HD 1080p),Secret TV,2017-12-02,7870,54,14,15,RU,Entertainment
lv0aC6yQL84,Anjelika: Anar Nağılbazın məndə hələ çox videosu var,BAKU.WS,2017-12-02,167618,1005,192,221,RU,Entertainment
3Yc52LCzip8,Кирилл Терёшин. Базука дала осечку у Малахова в Прямом эфире,Bazooka,2017-12-01,30821,326,62,94,RU,Entertainment
oZuUIu-iWAI,Мстители: Война бесконечности – тизер-трейлер,MARVEL Россия,2017-11-29,4701591,153524,3944,3167,RU,Entertainment
o3kqTfjLZJY,"Zaur Kamal, Talıb Tale, Mənzurə Musayeva - Xaçmazda Elçilikdə  (2ci hissə)",Xəzər Media,2017-12-02,82432,685,186,1042,RU,Entertainment
GXbxQeEQLVg,ЛЮТЫЕ названия фирм и магазинов. ООО Три О,Max Maximov,2017-12-02,59838,2595,64,299,RU,Entertainment
9x334Ms9Igo,Мульт - День из жизни Кирилла Терешина (СинтолМэна),ZLOYMAN,2017-12-02,48998,3167,202,201,RU,Entertainment
lxaej1nmuLw,Дети в Сирии поют известную всем Смуглянку-молдаванку,Бельцы Сити,2017-12-02,3288,87,0,6,RU,Entertainment
mNibGi1ZTdE,VERSUS #6 (сезон IV): D.Masta VS Drago,versusbattleru,2017-12-03,494832,20421,41701,13862,RU,Entertainment
FdcDXWRRH8s,Столото представляет | Русское лото тираж №1208 от 03.12.17,Столото,2017-12-03,52720,89,272,111,RU,Entertainment
5PaJEiT1RMo,Ты не поверишь! Выпуск от 03.12.17,Tiger Trailers,2017-12-03,140731,279,189,176,RU,Entertainment
ZIIXD4nKw1A,Реванш - смогу я отыграть свой IPhone X или нет?,Костя Павлов,2017-12-03,218335,9242,808,414,RU,Entertainment
IXT7r0PryiE,Обзор фильма Олдбой (Ремейк о котором никто не просил) - KinoKiller,KinoKiller Reviews,2017-12-03,56302,6549,214,708,RU,Entertainment
RCMdTOSduDw,"15 ЗАБЛУЖДЕНИЙ, В КОТОРЫЕ ВЫ ВЕРИТЕ",Мастерская Настроения,2017-12-02,1915490,55202,3621,3346,RU,Entertainment
Z7jLoq1_Rlc,ВЫИГРАЛ iPhone X в ПЕНАЛЬТИ CHALLENGE!?😱,Антон ЛАВ,2017-12-03,91606,4584,206,501,RU,Entertainment
XyQWDxFD3HM,100 ГРАММ СТЕЙКА за 7000 рублей и ЛОДКА СУШИ!,oblomoff,2017-12-02,977560,57328,2786,4546,RU,Entertainment
3QFSH1Hc4TY,ЧТО Я НИКОГДА НЕ НАДЕНУ? МОИ СТИЛЬНЫЕ НЕТ! **пародия**,YanGo,2017-12-03,467037,54793,3188,4886,RU,Entertainment
PQCyPs-0-tg,Новые русские сенсации: Киркоров. Признание,НТВ,2017-12-03,68503,472,179,211,RU,Entertainment
B04eOYanEsA,Топ10 ХАЙПОВОГО Шмота!,telblog.net,2017-12-03,120885,8840,865,2350,RU,Entertainment
gvxAFApFDio,Материнский капитал - Королевство кривых кулис. 2 часть - Уральские Пельмени (2017),Уральские Пельмени,2017-12-02,164325,3572,262,286,RU,Entertainment
ZUjtQr-slGc,Топ-модель по-украински. Выпуск 14. 01.12.2017,Новий Канал,2017-12-03,245225,5142,265,2099,RU,Entertainment
Q__t2PmQ4vk,МОЗГУ КОНЕЦ!,Поззи,2017-12-03,55937,3728,103,698,RU,Entertainment
wPnD7yYxI9o,Eşkıya Dünyaya Hükümdar Olmaz 83. Bölüm Fragmanı - atv,atv,2017-12-03,336624,1942,83,365,RU,Entertainment
MJigiDZ77Bs,ЛОМИТСЯ ПОЛИЦИЯ | РОМАНУСА И МИЛЛЕРА ЗАДЕРЖАЛИ | Анисимова и Миллер,Романус,2017-12-02,259146,20429,859,2147,RU,Entertainment
fz-qAL_w7Rw,Своя игра 03.12.2017,Наше! Телевидение,2017-12-03,12536,97,7,14,RU,Entertainment
9ZV5QeRzoq8,"РЭПЕРЫ-ШКОЛЬНИКИ, КОТОРЫЕ СТАЛИ ИЗВЕСТНЫ /  LIL PUMP, THRILL PILL, LIZER, ЛИЛ МОРТИ",Tema Flex,2017-12-02,197110,7592,318,640,RU,Entertainment
Y9pVT0ZGRHs,КАТЯ АДУШКИНА И НИКИТА МОРОЗОВ ВСТРЕЧАЮТСЯ?! МАРЬЯНА РО ВЫЗДОРАВЛИВАЙ,VOVA KESS,2017-12-03,58188,7476,129,925,RU,Entertainment
i3nMlm4EBkg,Дом 2 новости 3 декабря 2017 (3.12.2017) Раньше эфира,Новости Проекта,2017-12-03,13815,50,9,8,RU,Entertainment
CW6PpJrLO1M,8 ЖУТКИХ ВЕЩЕЙ РАЗРЕШЕННЫХ В ПРОШЛОМ [Белый кот],КОТЫ ЮТУБЕРЫ,2017-12-03,33738,2325,50,246,RU,Entertainment
GX-d4P_oGIM,ГОСТИ АЛЛЫ-ВИКТОРИИ - НОВЫЕ видео и фото со дня рождения!,Маша Деточкина,2017-12-03,35946,389,42,53,RU,Entertainment
BZvT-AP3ybw,Evdəkilərə Salam - Könül Kərimovanın qızının xınayaxtı və toy mərasimi (03.12.2017),Xəzər Media,2017-12-03,23953,369,33,71,RU,Entertainment
W0-HKYlGoG4,"ПАРА НАШЛА СКРЫТЫЙ СЕЙФ В СВОЁМ ДОМЕ, ТО ЧТО ОНИ ТАМ ОБНАРУЖИЛИ ПОРАЖАЕТ",JUSTFUN,2017-12-03,10988,188,21,10,RU,Entertainment
RLCVCp2sJe0,"София, Игорь, Мария-Даниэла – Believer – бои – Голос. Діти 4 сезон",Голос країни,2017-12-03,92771,2853,77,330,RU,Entertainment
S3IuZmGUEys,Cennet'i öldürecek miydin? - Cennet'in Gözyaşları 11. Bölüm,Cennet'in Gözyaşları,2017-12-03,19466,179,4,5,RU,Entertainment
SGH9ytT3KTw,Короли фанеры. Выпуск от 02.12.2017,Шоу на Первом,2017-12-03,32715,301,42,40,RU,Entertainment
B3gK8jjZw3Q,=Обзор ИРП= БЕЛОРУССКИЙ сухпай!  Еда для ВДВ! Привет из СССР!,Видео от SoLiDa,2017-12-02,344736,18825,639,2786,RU,Entertainment
AarqDQ2J52c,БАТЯ ВСЕХ УДЕЛАЛ ПРАНК feat МАКС МУНСТАР,vJOBivay,2017-12-03,133652,10316,449,249,RU,Entertainment
dh58PtWTmqQ,Угарные рекорды Гинесса. Самые нелепые рекорды!,Max Maximov,2017-12-03,34084,1914,31,174,RU,Entertainment
0yKEE-qZFDY,Сегодня вечером. Эстрада 1970-х. Выпуск от 02.12.2017,Сегодня вечером,2017-12-03,35845,283,32,100,RU,Entertainment
SI-kyvuSZKE,РУКИ-БАЗУКИ СКОРО АМПУТИРУЮТ? СИНТОЛОВЫЙ КАЧОК КИРИЛЛ ТЕРЕШИН ДОИГРАЛСЯ...,Kash,2017-12-02,83895,5507,370,1073,RU,Entertainment
KIOAJtb7RdQ,Отель Элеон  - 12 серия 3 сезон (54 серия) - ОБЗОР,Слай,2017-12-03,157328,2145,162,173,RU,Entertainment
uHgceyuOjmg,Отель Элеон - Серия 10 сезон 3 (52 серия) - комедийный сериал HD,serial,2017-12-04,573212,8943,413,1246,RU,Entertainment
_cdKur1zY28,"ЧТО ЕСЛИ ПРИГОТОВИТЬ SKITTLES и ВОСКОВЫЕ КАРАНДАШИ в ВАФЕЛЬНИЦЕ - ЭТО ОЧЕНЬ СТРАННО, НО в....?!  -",TimOn ChaveS,2017-12-04,396080,31408,1022,3716,RU,Entertainment
mNibGi1ZTdE,VERSUS #6 (сезон IV): D.Masta VS Drago,versusbattleru,2017-12-03,977055,27343,76017,21143,RU,Entertainment
7sHqVmbIX14,60 минут. Русофобская вечеринка в Вильнюсе: почему Собчак в списке Путина? От 04.12.17,Россия 24,2017-12-04,201423,1359,2213,3849,RU,Entertainment
ovcEdyNEWe4,Что думают итальянки о русских мужчинах,Итальянцы by Kuzno Productions,2017-12-04,138254,7100,835,1940,RU,Entertainment
jFWUmQJjcJM,Топ10 Ютуберов с ЗОЛОТЫМИ Руками!,telblog.net,2017-12-04,158727,13386,623,2623,RU,Entertainment
_XKjB5dQ3hA,Лютые троли фотошопа 680 LVL. Сделай так чтоб я был выше папы...,Max Maximov,2017-12-04,157074,6791,646,241,RU,Entertainment
8e-5Cbi4DMg,58 товаров по 1$  с AliExpres! ДА ЧТО ЗА ТРЭШ?,Bukreev Buy,2017-12-04,45655,3207,233,1041,RU,Entertainment
_sGRCkAdJUM,Все киногрехи Kingsman: Золотое кольцо,KINOKOS,2017-12-04,125960,6001,277,710,RU,Entertainment
20lpwCd9IQw,Джигарханян и Виталина всё ещё муж и жена? Андрей Малахов. Прямой эфир от 04.12.17,Россия 1,2017-12-04,47192,140,226,592,RU,Entertainment
bCi6TzRoAHc,Get Ready for YouTube Rewind 2017 | #RewindisComing,YouTube Spotlight,2017-12-04,144795,10948,1063,2880,RU,Entertainment
e6LUntX08dM,Diriliş Ertuğrul 98.Bölüm 2.Tanıtımı,TRT 1,2017-12-04,275435,2263,61,0,RU,Entertainment
6KUeKRouQh0,15 СЛУЧАЕВ УГАРА В БАСКЕТБОЛЕ,LAПIN,2017-12-04,150219,14335,1373,4890,RU,Entertainment
Q__t2PmQ4vk,МОЗГУ КОНЕЦ!,Поззи,2017-12-03,151543,5652,263,929,RU,Entertainment
xEojDkTT9cg,Давай поженимся! В поисках своей половины. Выпуск от 04.12.2017,Красный квадрат,2017-12-04,18571,62,15,35,RU,Entertainment
s3uG_nKkmm0,Тайны Чапман. Наперегонки со смертью (04.12.2017) HD,Secret TV,2017-12-04,11156,52,10,6,RU,Entertainment
AtENqy0UoR8,Seni axtariram  04.12.2017 / Tam verilis,Xəzər Media,2017-12-04,14190,187,37,187,RU,Entertainment
sJaLXqzB-7Q,Драго батлит банду Димасты (Батл-Рэмбо),Epic World,2017-12-04,84331,1655,54,231,RU,Entertainment
FGpMzRlA2_w,Фонбет бк,inBet,2017-12-04,10388,37,9,52,RU,Entertainment
oRCpZe6eNsU,Синяя птица 2017. Новый 3 сезон. Эфир от 03.12.2017,Всероссийский конкурс юных талантов Синяя птица,2017-12-04,8201,77,8,7,RU,Entertainment
AWigCGLtBjE,"7 ЖИВОТНЫХ, замороженных ВО ВРЕМЕНИ",GAZ,2017-12-03,51037,3406,76,258,RU,Entertainment
bpcZ6rxSaEI,Стоматолог из МОСКВЫ отказался лечить ЛЫСОГО - как после такого заявления выиграть бабло,Рассмеши Комика fan,2017-12-04,7567,60,8,2,RU,Entertainment
0azjTm95UYE,Отель Элеон -  анонс 52-55 серий,Кухня (сериал),2017-12-04,30684,485,12,52,RU,Entertainment
1o-RB2vjhE0,Битва экстрасенсов. Сезон 17. Выпуск 10 от 03.12.2017,Битва екстрасенсів,2017-12-03,68712,383,132,254,RU,Entertainment
L52AgQW_s_Y,Про ВСЁ. Выпуск 5. Jekaterina Sap. Декабрь 2017,Jekaterina Sap,2017-12-04,6171,343,19,133,RU,Entertainment
Eyzjg0tcRHg,5 ЛАЙФХАКОВ от SLIVKISHOW + 1 от Степы,SlivkiShow,2017-12-05,1662659,102325,6293,12618,RU,Entertainment
Ety-6-OiiL8,ХАЙП КЭМП ЗАКРЫЛСЯ,Юлик,2017-12-05,607218,63354,1281,3582,RU,Entertainment
AS0XcVWgqDY,Отель Элеон - Серия 11 сезон 3 (53 серия) - комедийный сериал HD,serial,2017-12-05,572654,9502,381,1215,RU,Entertainment
FA2LD8114Uw,ЕГИПЕТСКАЯ ШАВЕРМА,Юрий Хованский,2017-12-05,257817,12314,1237,1518,RU,Entertainment
3oueFpfVDyU,Интернет-провайдер - Королевство кривых кулис. 3 часть - Уральские Пельмени (2017),Уральские Пельмени,2017-12-05,105550,3575,139,135,RU,Entertainment
sLmEma9B4JE,D.MASTA VS DRAGO VS SCHOKK | 140 BPM | МИША КРУПИН VS МАЙТИ ДИ #RapNews 246,RapNews,2017-12-05,161244,6117,274,645,RU,Entertainment
xwnZ1V0s-cc,#ДРУЖКПОТ | Гость из будущего,Столото,2017-12-05,62375,664,395,59,RU,Entertainment
lYcuNy_q7PE,МастерШеф. Сезон 7. Выпуск 29. Часть 2 из 5 от 05.12.2017,МастерШеф,2017-12-05,32299,188,23,78,RU,Entertainment
0mOUr56CSps,МОРГЕНШТЕРН 20!8 - ПРЕДВЫБОРНЫЙ КЛИП,MORGENSHTERN,2017-12-05,166895,33712,547,2441,RU,Entertainment
gADby2MXwbA,Вечерний Ургант. Иван Ургант - «Зимняя песня».(04.12.2017),Вечерний Ургант,2017-12-04,160413,3750,198,135,RU,Entertainment
ck7dbuIEt4o,60 минут по горячим следам от 05.12.2017,Россия 24,2017-12-05,223338,1071,587,960,RU,Entertainment
0iCszUqIW_U,ПОДАРОК АЛЛЫ ПУГАЧЕВОЙ привел в неописуемый восторг АЛЛУ-ВИКТОРИЮ!,Маша Деточкина,2017-12-05,8228,109,13,8,RU,Entertainment
yxBv8iCeyfQ,Екатерина Градова. Судьба человека с Борисом Корчевниковым,Россия 1,2017-12-05,56109,436,29,138,RU,Entertainment
RqfWbjCe1g4,10 НЕОБЪЯСНИМЫХ ЯВЛЕНИЙ,ТРЕНДЫ и ХАЙПЫ,2017-12-05,12660,266,16,40,RU,Entertainment
jFWUmQJjcJM,Топ10 Ютуберов с ЗОЛОТЫМИ Руками!,telblog.net,2017-12-04,424857,20596,1198,4292,RU,Entertainment
YRxWgMrvf8E,"Hızır, Mürsel'i avlıyor - Eşkıya Dünyaya Hükümdar Olmaz 83. Bölüm",atv,2017-12-05,186936,949,85,110,RU,Entertainment
8e-5Cbi4DMg,58 товаров по 1$  с AliExpres! ДА ЧТО ЗА ТРЭШ?,Bukreev Buy,2017-12-04,118891,5187,492,1880,RU,Entertainment
F5DtVxptqnI,"ЧТО ЕСЛИ СМЕШАТЬ в БЛЕНДЕРЕ СМУЗИ из СЕЛЕДКИ, МОЛОКА и ОГУРЧИКОВ ?! МОЯ РЕАКЦИЯ на КОКТЕЙЛЬ...",TimOn ChaveS,2017-12-05,190757,21992,587,3935,RU,Entertainment
B9DPoguV_Rg,Загадки человечества. 97 выпуск (05.12.2017) HD,Secret TV,2017-12-05,15159,65,24,13,RU,Entertainment
pqTxrrClQPI,Первый лёд на Куртюге 2017 г Плотва и окунь на безнасадку,RybolovNN,2017-12-05,2926,141,2,26,RU,Entertainment
gwNAiAME0pE,Лютые КНИГИ. Китайские три поросенка и неожиданный финал,Max Maximov,2017-12-05,54521,2122,43,273,RU,Entertainment
MZwXWKTllAg,Qaynonasini Zaharlamoqchi Bo'lgan Kelin | Oqilona Ish Tutgan Folbin,???? ????,2017-12-05,7964,50,7,5,RU,Entertainment
Fj6C3Uu5WQc,"Кузьма не прав, Ютюб падает,  БРЕНДЫ НЕ ПРОВЕРЯТЬ? Мои новости",Костя Павлов,2017-12-05,91880,6713,1906,732,RU,Entertainment
5Ux40HBnGzA,Давай поженимся! Влюбленный в образ. Выпуск от 05.12.2017,Красный квадрат,2017-12-05,18768,54,11,18,RU,Entertainment
Y7MiSN0twDs,Артем Тарасов ответ Drago (5.12.2017),Rap Periscope,2017-12-05,11230,86,680,86,RU,Entertainment
bmAMK8QgpVo,98% СПРАВЛЯЮТСЯ ! Тест на твою ЛИЧНОСТЬ / ГЕНИЙ или НЕТ,Обо всем Интересном :3,2017-12-05,12397,1392,32,307,RU,Entertainment
lh8GZQegjCI,🔴 ЧТО НАША ЖИЗНЬ 🔴 МИСТИКА 🔴 ПРИЧИНА БОЛЕЗНЕЙ СССР ЛЮБИМЫЕ РЯДОМ 05.12.2017,FloridaYalta,2017-12-05,6532,289,88,21,RU,Entertainment
8cKWr45Ky1A,"Что если СТРОИТЕЛЬНЫМ ФЕНОМ НАГРЕТЬ КОЛУ, КОКОС, СПИННЕР, ЧУПА-ЧУПC и др.",Live Today,2017-12-05,60441,5640,94,1231,RU,Entertainment
-1O8gyA0sSM,РЕАКЦИЯ ХОМЯКА НА КИТАЙСКОГО ХОМЯКА| РАСПАКОВКА ПОСЫЛКИ ИЗ КИТАЯ Newchic | ОЖИДАНИЕ И РЕАЛЬНОСТЬ,ANNA CHI,2017-12-05,64211,3273,74,1064,RU,Entertainment
VxKBq4V_AlA,Снял реального Полтергейста!!! - GhostBuster За Гранью,Дима Масленников,2017-12-06,730603,67557,2761,16659,RU,Entertainment
HQtcUv9gkKo,Отель Элеон - 12 серия 3 сезон 54 серия - комедия HD,Отель Элеон,2017-12-06,1270287,22409,715,2507,RU,Entertainment
FlsCjmMhFmw,YouTube Rewind: The Shape of 2017 | #YouTubeRewind,YouTube Spotlight,2017-12-06,24784870,1149238,483957,461983,RU,Entertainment
MBm5fGnpMGs,"ЧТО ПРОИЗОЙДЕТ, ЕСЛИ ИСЧЕЗНУТ СТРАНЫ?",Ridddle,2017-12-06,452490,29385,3778,4543,RU,Entertainment
1WQDxgLscUU,Глазированная ЦЕСАРКА НА ВЕРТЕЛЕ. Belissimo! =),oblomoff,2017-12-06,347287,22367,1043,1458,RU,Entertainment
Eyzjg0tcRHg,5 ЛАЙФХАКОВ от SLIVKISHOW + 1 от Степы,SlivkiShow,2017-12-05,2323953,122512,8177,14451,RU,Entertainment
Ety-6-OiiL8,ХАЙП КЭМП ЗАКРЫЛСЯ,Юлик,2017-12-05,952186,82945,2023,4350,RU,Entertainment
bURhIgvlZmo,60 минут по горячим следам (дневной выпуск в 13:00) от 06.12.17,Россия 24,2017-12-06,214100,1026,852,1884,RU,Entertainment
DNsPYD1yKyI,Отель Элеон - 11 Серия сезон 3 - 53 серия - комедия HD,Кухня (сериал),2017-12-05,579258,8925,345,876,RU,Entertainment
3oueFpfVDyU,Интернет-провайдер - Королевство кривых кулис. 3 часть - Уральские Пельмени (2017),Уральские Пельмени,2017-12-05,327276,6462,345,220,RU,Entertainment
yvRs16ys5Sg,"ЛУЧШЕЕ ИЗ ИНОСТРАНЦЫ СЛУШАЮТ РУССКУЮ МУЗЫКУ (OXXXYMIRON,ЛСП,MIYAGI,BRB,T-FEST,СКРИПТОНИТ,РЕМ ДИГГА)",EvRosTV,2017-12-06,109928,5764,962,403,RU,Entertainment
LdDBQgEtF-E,Татьяна Буланова. Судьба человека с Борисом Корчевниковым,Россия 1,2017-12-06,60384,282,65,163,RU,Entertainment
p9j_tCb4kWQ,"Всё о Паразитах из аниме Паразит (способности, слабости, поведение)",Звездный Капитан,2017-12-06,167028,10362,316,1353,RU,Entertainment
1m5hUp_hxTM,Eşkıya Dünyaya Hükümdar Olmaz 83. Bölüm,atv,2017-12-05,491995,2858,351,336,RU,Entertainment
yW5vTZZRk_4,GUF | L’ONE X NEL | ХОВАНСКИЙ VS ВИТЯ АК | СКРУДЖИ | DA GUDDA JAZZ #RapNews 247,RapNews,2017-12-06,70051,3837,331,206,RU,Entertainment
Zn0K5AlhnsI,КОГДА ПАРЕНЬ ТЕБЯ НЕ ЛЮБИТ / СКЕТЧ,Mary Senn,2017-12-06,314200,49631,749,2193,RU,Entertainment
sZyjJphguGE,Все киногрехи Терминатор: Да придёт спаситель,KINOKOS,2017-12-06,93297,6095,117,507,RU,Entertainment
wSJwF4jX_Ww,МастерШеф. Сезон 7. Выпуск 30. Часть 2 из 5 от 06.12.2017,МастерШеф,2017-12-06,40127,201,21,93,RU,Entertainment
yEaFMenlqAU,Дагестанец мощно ответил Чечнцу оскорбивший Имам Шамиля и Аварцев,YouTube Russiа,2017-12-05,8399,86,31,158,RU,Entertainment
L6bkCGAcP1w,Давай поженимся! Мамина принцесса. Выпуск от 06.12.2017,Красный квадрат,2017-12-06,21038,66,14,27,RU,Entertainment
FA2LD8114Uw,ЕГИПЕТСКАЯ ШАВЕРМА,Юрий Хованский,2017-12-05,335287,14238,1743,1936,RU,Entertainment
IdKMjk-T2hQ,"Отель Элеон 14, 15, 16 серии АНОНС!!!!!",Tina Mayer,2017-12-06,7765,126,12,20,RU,Entertainment
SYm_1mnI0L8,Seni axtariram  05.12.2017 / Tam verilis,Xəzər Media,2017-12-06,33754,278,55,393,RU,Entertainment
Ty7u4RcD85c,"СПАИЛИ ФАНФУРИКА стрим с Людмила ЛЮДМУРИК, Андрей ГОБЗАВР и Жека ФАНФУРИК в ГОБЗ ШОУ GOBZAVR",GOBZAVR,2017-12-06,6189,110,312,7,RU,Entertainment
OVTA9K7kdA4,КОШАЧИЙ ПЕРЕДОЗ СЫЕНДУК РЕАКЦИЯ на sndk,Юмилия,2017-12-06,19814,1851,73,387,RU,Entertainment
5ELQ6u_5YYM,Black Mirror - Season 4 | Official Trailer [HD] | Netflix,Netflix,2017-12-06,439207,13837,121,1052,RU,Entertainment
kQvRWXuMd5M,The Flash 4x10 Promo (HD) Season 4 Episode 10 Promo,TV Promos,2017-12-06,294262,2863,40,807,RU,Entertainment
GyWTPYNc4Uk,ВЫ БУДЕТЕ В ШОКЕ! Никита Пресняков разводится с молодой женой!,Celebrity News,2017-12-06,20934,37,21,13,RU,Entertainment
0mOUr56CSps,МОРГЕНШТЕРН 20!8 - ПРЕДВЫБОРНЫЙ КЛИП,MORGENSHTERN,2017-12-05,296986,47632,806,3240,RU,Entertainment
MVE9xOhJm8o,Я НА СТС//МЫ ПРОШЛИ В ШОУ УСПЕХ???//НОВАЯ ПЕСНЯ!||VLOG,NIKITA ZLATOUST,2017-12-06,59127,5600,98,658,RU,Entertainment
8RcjrT9sx0w,Отель Элеон - 13 серия 3 сезон 55 серия - комедия HD,Отель Элеон,2017-12-07,1159922,21953,598,2616,RU,Entertainment
jK2Z_1dboR0,Итальянцы смотрят мультфильм жил-был пес,Итальянцы by Kuzno Productions,2017-12-07,93833,9811,112,1392,RU,Entertainment
LWlQooXputs,Проверяю БРОНЕ Перчатки с моим Сурикатом и моя Новая коллекция Ножей из Китая !!!,TimOn ChaveS,2017-12-07,420407,28167,666,2537,RU,Entertainment
FlsCjmMhFmw,YouTube Rewind: The Shape of 2017 | #YouTubeRewind,YouTube Spotlight,2017-12-06,52611730,1891836,884967,702790,RU,Entertainment
bfy0bTKk8KA,60 минут. ВТОРОЕ ДЫХАНИЕ СААКАШВИЛИ: новая попытка сместить Порошенко. От 07.12.17,Россия 24,2017-12-07,168534,979,377,860,RU,Entertainment
MBm5fGnpMGs,"ЧТО СЛУЧИТСЯ, ЕСЛИ ИСЧЕЗНУТ ВСЕ СТРАНЫ?",Ridddle,2017-12-06,602683,34632,4497,5281,RU,Entertainment
VxKBq4V_AlA,Снял реального Полтергейста!!! - GhostBuster За Гранью,Дима Масленников,2017-12-06,1250122,92164,4293,22124,RU,Entertainment
5ivK4Aj0yJE,Дилноза Кубаева ва Озодбек Назарбеков ўртасидаги мухаббат ростми?,shok.uz,2017-12-07,33945,437,43,197,RU,Entertainment
GVVMcTkgVvU,"Настя Решетова о Путине, дочери Тимати Алисе и своем салоне красоты",Glamour Russia,2017-12-07,21746,143,40,12,RU,Entertainment
Np3sCLpm0NA,КУЗЬМА И ПЕСНЯ ПРО КАБАНА,ДА НИЛ,2017-12-07,42406,5086,112,327,RU,Entertainment
dXmGzrVZRVM,Mikhail Kolyada SP 2017 Nagoya GP Final,FSone,2017-12-07,17693,149,7,27,RU,Entertainment
bFnF484ZjmM,Лютые стоматологи и коты-драконы!,Max Maximov,2017-12-07,80289,3786,84,285,RU,Entertainment
vJUuNWYZ5vs,15 НЕУДАЧНЫХ ПАРКУРЩИКОВ,LAПIN,2017-12-07,169725,13396,727,2402,RU,Entertainment
AeKoXPBL32U,Отель Элеон - 12 Серия сезон 3 - 54 серия - комедия HD,Кухня (сериал),2017-12-06,493920,7998,244,614,RU,Entertainment
fTyXnFHhCd0,Seni axtariram 06.12.2017 / Tam verilis,Xəzər Media,2017-12-07,37117,223,48,128,RU,Entertainment
rlFgApnVo2Y,Давай поженимся! Молодой вдовец. Выпуск от 07.12.2017,Красный квадрат,2017-12-07,35050,121,33,92,RU,Entertainment
zJduOTRV1Bw,Лучшие приколы Декабрь 2017 | Best Jokes Compilation #76,GoTRASHshow,2017-12-07,88721,2212,130,106,RU,Entertainment
Cw_qgvO-Hp0,"БОБ и смертельно громкие звуки (эпизод 9, сезон 3) РЕАКЦИЯ НА ЗНАКОМЬТЕСЬ БОБ",Юмилия,2017-12-07,25911,1794,55,472,RU,Entertainment
YGtVvURCe3g,Беременную невестку Марии Шукшиной выгнали на улицу. Андрей Малахов. Прямой эфир от 07.12.17,Прямой эфир,2017-12-07,168852,582,329,1079,RU,Entertainment
oyNQf7emy4s,Xalq artisti adı erməni ilə hallanan qızının müdafiəsinə qalxdı: “Şərləməyin”- QALMAQAL,Yeni Kanal,2017-12-07,34914,132,37,53,RU,Entertainment
8cq2npsPnq4,Зважені та щасливі. Сезон 7. Выпуск 15. Часть 1 из 4 от 07.12.17,Зважені та щасливі,2017-12-07,20740,128,15,70,RU,Entertainment
CafDUxKGVZ8,НЕ ЛЕЗЕТ В ЛУНКУ ! ВОТ ЭТО УЛОВ ! Волшебный чёртик и клёвая зимняя рыбалка на безмотылку,Sibiria Рыбалка и Охота,2017-12-07,38737,1082,30,291,RU,Entertainment
qFEHH8hQTvA,Bozbash Pictures Corat Yeni (07.12.2017),BozbashPictures,2017-12-07,55540,1574,132,207,RU,Entertainment
4NHaQgjpEmo,"Е. Понасенков: Путин – стесняющийся диктатор, запретные темы, как спланировать семью и др.",Канал здравого смысла: блог Евгения Понасенкова,2017-12-07,51409,3359,144,365,RU,Entertainment
ERrrzH2hm4Q,Siyah Beyaz Aşk 9. Bölüm Fragmanı,KanalD,2017-12-07,521619,11770,109,3390,RU,Entertainment
6_dwbcpc7Cs,ЧАЛА СПОРТИК Азамат ЧУБАК Ажы жонундо эмне дейт?,Булбул Кыргызстан,2017-12-07,48486,2892,79,553,RU,Entertainment
"#NAME?",БЛОГЕРЫ УГАДЫВАЮТ НОВОГОДНИЕ  ПЕСНИ ГОЛОСОМ SIRI,Генри,2017-12-07,3909,195,3,60,RU,Entertainment
8WnzYRlHaSc,Тайны Чапман. Вся планета придумана (07.12.2017) HD,Secret TV,2017-12-07,10782,70,15,12,RU,Entertainment
CDYGrTjZoxw,"ЧТО, ЕСЛИ ты в компьютерной игре",Что если,2017-12-08,496989,29589,1410,4238,RU,Entertainment
2qiqk8t13o4,Стекляшка ВМЕСТО СОУСА... Славный Обзор. Начали за здравие..,oblomoff,2017-12-08,766451,44267,5968,6030,RU,Entertainment
_PY9A3IvoxM,"Музыкальная студия Александра Гудкова & Витя АК-47 - «Советы, как правильно кормить птиц зимой».",Вечерний Ургант,2017-12-08,113030,11835,838,1040,RU,Entertainment
Z2PdzJssC4w,=Обзор ИРП= Российский сухпай простого работяги!  ИРП своими руками !,Видео от SoLiDa,2017-12-08,237457,15478,798,2560,RU,Entertainment
P3TqmBXPpPw,БЕСПРЕДЕЛ СУДЕЙ НА VERSUS BATTLE! / ПОДСТАВНОЙ СУДЬЯ D. MASTA VS DRAGO / ЗАШКВАР РЕСТОРАТОРА,Tema Flex,2017-12-08,157139,9658,285,838,RU,Entertainment
KR_lgxH_G2c,"ПРЕМЬЕРА 2017 КОТОРУЮ НЕЛЬЗЯ НАЙТИ [ НОВОЕ ЛИЦО ] Мелодрамы 2017 новинки, Татьяна Арнтгольц 2017 HD",ФильмЛяндия,2017-12-08,142205,510,149,51,RU,Entertainment
jK2Z_1dboR0,Итальянцы смотрят мультфильм жил-был пес,Итальянцы by Kuzno Productions,2017-12-07,268367,16667,260,2130,RU,Entertainment
o1mYIdcF1Kw,Рассмеши цыпу: ШАКУЛИН VS ПАВЛОВ,Smetana TV,2017-12-08,94142,9793,157,257,RU,Entertainment
J2h8O97DotQ,Лора Горбунова «Панамки» - Четвертьфинал - Голос - Сезон 6,Голос / The Voice Russia,2017-12-08,22199,872,91,310,RU,Entertainment
IcNR3Wfk0To,Seni axtariram 07.12.2017 / Tam verilis,Xəzər Media,2017-12-08,40481,315,77,289,RU,Entertainment
30AHhxCwsS4,Отель Элеон - 13 Серия сезон 3 - 55 серия - комедия HD,Кухня (сериал),2017-12-07,498572,9858,257,969,RU,Entertainment
d45NLLz5Mdw,Alina Zagitova SP 2017 Nagoya GP Final,FSone,2017-12-08,13185,126,9,59,RU,Entertainment
M3-ttftrO8c,ГИГАНТСКИЙ ДОМ ИЗ КИТКАТ! Anny May,Anny May,2017-12-08,542308,62962,1068,7904,RU,Entertainment
qFEHH8hQTvA,Bozbash Pictures Corat Yeni (07.12.2017),BozbashPictures,2017-12-07,246453,3515,317,235,RU,Entertainment
4NHaQgjpEmo,"Е. Понасенков: Путин – стесняющийся диктатор, запретные темы, как спланировать семью и др.",Канал здравого смысла: блог Евгения Понасенкова,2017-12-07,109391,4926,260,703,RU,Entertainment
0No_N2pl6ow,Все киногрехи Люди икс,KINOKOS,2017-12-08,86700,4903,123,374,RU,Entertainment
dBRI76mY6N4,Давай поженимся! За справедливостью и любовью. Выпуск от 08.12.2017,Красный квадрат,2017-12-08,24845,75,91,202,RU,Entertainment
LWlQooXputs,Проверяю БРОНЕ Перчатки с моим Сурикатом и моя Новая коллекция Ножей из Китая !!!,TimOn ChaveS,2017-12-07,700945,37392,1044,3344,RU,Entertainment
WP-QoYXFo_M,Егор Кончаловский. Судьба человека с Борисом Корчевниковым,Россия 1,2017-12-08,32199,156,28,42,RU,Entertainment
n4T9v28vM30,ОТРЕЗАЛ КОЗЛИНУЮ БОРОДКУ / МАКС БРАНДТ БЕЗ БОРОДЫ,Макс Брандт,2017-12-08,124904,7447,355,1196,RU,Entertainment
WwDHD9JFu-E,5 ТЕСТОВ НА ТВОЮ УНИКАЛЬНОСТЬ,tophype,2017-12-08,140452,11532,380,2398,RU,Entertainment
aA2qlHTxC5w,ПРОГНОЗ НА НЕДЕЛЮ 11-17 ДЕКАБРЯ ДЛЯ ЗНАКОВ ЗОДИАКА,Мастерская Инги Таро,2017-12-08,8947,368,27,24,RU,Entertainment
_PY9A3IvoxM,"Музыкальная студия Александра Гудкова & Витя АК-47 - «Советы, как правильно кормить птиц зимой».",Вечерний Ургант,2017-12-08,909931,48361,6262,2337,RU,Entertainment
c3BnZYschgs,РОССИЙСКИЙ СУХПАЁК vs ИНОСТРАННЫЕ СУХПАЙКИ,Юрий Хованский,2017-12-09,352103,36323,3791,5229,RU,Entertainment
FXpF5q6m80U,Меня опять хотят ОБМАНУТЬ продавцы с АЛИ!,Костя Павлов,2017-12-09,410549,27724,3161,1094,RU,Entertainment
1J-uqOJSNTs,"Американцы Слушают Русскую Музыку #38 OXXXYMIRON, СКРИПТОНИТ, ЛЕНИНГРАД, VERSUS, KIZARU, PHARAOH",GlebaTV,2017-12-09,140021,5650,697,1527,RU,Entertainment
TF5yPmzo4D0,ТАКОГО ЕЩЕ НЕ БЫЛО! ОГРОМНАЯ ПОСЫЛКА + КУЧА ТОВАРОВ С ALIEXPRESS!,Bukreev Buy,2017-12-09,97894,5205,304,1471,RU,Entertainment
JunmToLI8E4,Что Если Смешать ВСЕ Вкусы Tic-Tac в Блендере ?! Сурикат пробует новое Смузи !!!,TimOn ChaveS,2017-12-09,389049,27029,925,4254,RU,Entertainment
FS1bM_GP_zQ,Элджей & ФИЗРУК - Розовое вино (ПАРОДИЯ 2017),Пацаны вообще ребята,2017-12-09,90045,2171,338,67,RU,Entertainment
QK_iX5cPDhE,Marvel's Jessica Jones | Date Announcement: She's Back [HD] | Netflix,Netflix,2017-12-09,269145,12204,236,1674,RU,Entertainment
CDYGrTjZoxw,"ЧТО, ЕСЛИ ты в компьютерной игре",Что если,2017-12-08,772305,36001,2199,4978,RU,Entertainment
NGFH1QgX26A,Топ10 ХАРИЗМАТИЧНЫХ Ютуберов!,telblog.net,2017-12-09,108431,8651,442,1544,RU,Entertainment
2qiqk8t13o4,Стекляшка ВМЕСТО СОУСА... Славный Обзор. Начали за здравие..,oblomoff,2017-12-08,1015576,51709,7567,7200,RU,Entertainment
mXCsnJPYkr8,Лютые коты. Коты-люди и коты с крутыми рисунками на теле!,Max Maximov,2017-12-09,56638,5745,58,380,RU,Entertainment
2v7skU3tzAY,"5 СЕКРЕТОВ ЗНАМЕНИТОСТЕЙ, О КОТОРЫХ ВЫ НЕ ЗНАЛИ",Мастерская Настроения,2017-12-09,493118,16706,2034,857,RU,Entertainment
NQqvLgigBWw,Столото представляет | Русское лото тираж №1209 от 10.12.17,Столото,2017-12-10,6830,40,43,22,RU,Entertainment
nn1TNTCXE14,Раскрыта афера Банка России! Полное разоблачение махинаций со счетами 810 и 643,Евгений Пупырин,2017-12-09,81180,2600,206,491,RU,Entertainment
ZrNLlfvOQd8,РАЗБИЛИ ТЕХНИКИ НА 100.000 РУБЛЕЙ!!!,CompactTV,2017-12-09,60319,32,151,38,RU,Entertainment
CzVqZptyEDk,Alina Zagitova FS 2017 Nagoya GP Final,FSone,2017-12-09,20372,204,23,59,RU,Entertainment
_nw-mbzRDB0,"ТРЕКИ, С КОТОРЫХ ХАЙПАНУЛИ РЭПЕРЫ: ЭЛДЖЕЙ, KIZARU, FACE, OXXXYMIRON, PHARAOH, СКРИПТОНИТ, MiyaGi",ЛАМПОВЫЙ RAP,2017-12-09,28271,1430,87,290,RU,Entertainment
kPv0rjRS3tQ,ЛИЗУН БЕЗ КЛЕЯ | ОПЫТЫ С ЛИЗУНАМИ | ЛУЧШЕЕ ВИДЕО С ЛИЗУНАМИ И СЛАЙМ | Alisa DIY,Alisa DIY,2017-12-09,118773,7670,260,2231,RU,Entertainment
7GuEs_EQfLw,"БОРОНЧУ БАБАНОВ МЕНЕН СУЙЛОШКОНДОН КОРКСО,АСЫЛБЕК ОЗУБЕКОВ ОБУШКОНДОН ТАРТЫНЫП...КЕЧКИ БИШКЕК",Каниет Жыргалбеков,2017-12-09,32633,470,41,158,RU,Entertainment
P3TqmBXPpPw,БЕСПРЕДЕЛ СУДЕЙ НА VERSUS BATTLE! / ПОДСТАВНОЙ СУДЬЯ D. MASTA VS DRAGO / ЗАШКВАР РЕСТОРАТОРА,Tema Flex,2017-12-08,274686,13298,450,1029,RU,Entertainment
4TTw0jtl87w,"5də5 - Damla, Kənan Yusif, Elşən Hacıbabayev (08.12.2017)",Xəzər Media,2017-12-09,60793,510,69,172,RU,Entertainment
J2h8O97DotQ,Лора Горбунова «Панамки» - Четвертьфинал - Голос - Сезон 6,Голос / The Voice Russia,2017-12-08,63287,1684,149,490,RU,Entertainment
90wKjba-Efk,20 УПОРОТЫХ ЗАПИСЕЙ В ШКОЛЬНЫХ ДНЕВНИКАХ с ЕНОТОМ ХАЙПОМ,Live Today,2017-12-09,54025,2680,68,306,RU,Entertainment
nEXkwIuBgL0,РОЗОВОЕ ВИНО МЕМ Crash Bandicoot,Den Schmalz,2017-12-09,19061,3390,84,179,RU,Entertainment
QRQovJ3pftY,"РАСПАКОВКА 15 ПОСЫЛОК С ALIEXPRESS и UGEARS | Конкурс | пылесос, одежда, техника, кэшбэк | NikiMoran",NikiMoran,2017-12-09,11989,639,21,194,RU,Entertainment
zC3iTnzZz0c,ЖИВОТНЫЙ СТРИМ №2 с Людмила ЛЮДМУРИК и Андрей ГОБЗАВР  в ГОБЗ ШОУ GOBZAVR,GOBZAVR,2017-12-09,9021,0,0,5,RU,Entertainment
5EhofHzJeiQ,"5 ВЕЩЕЙ, С ТЕЛЕФОНОМ КОТОРЫЕ ВЫ ДЕЛАЕТЕ НЕПРАВИЛЬНО",tophype,2017-12-09,95704,8449,424,3455,RU,Entertainment
X-kNQZQLslo,Удивительный мир Гамбола | Картофельная солидарность | Cartoon Network,Cartoon Network Россия,2017-12-09,43562,1432,35,131,RU,Entertainment
ZIzLjNaAQk4,Хлебоутки | 1 сезон 9 серия | Nickelodeon Россия,Nickelodeon Россия,2017-12-09,20391,373,16,56,RU,Entertainment
Z2PdzJssC4w,=Обзор ИРП= Российский сухпай простого работяги!  ИРП своими руками !,Видео от SoLiDa,2017-12-08,340264,19092,1088,3052,RU,Entertainment
oXPupUfskQc,МОЙ НОВЫЙ ДОМ! ROOM TOUR + ответ ТБИ,Anny May,2017-12-09,525937,42681,1133,8787,RU,Entertainment
pRiTsQArinc,КАК СДЕЛАТЬ ЗНАЧКИ ИЗ ПЛАСТИКА? - DIY,TheVovkaCom,2017-12-09,21816,1676,108,161,RU,Entertainment
cSp1dM2Vj48,READY PLAYER ONE - Official Trailer 1 [HD],Warner Bros. Pictures,2017-12-10,3437722,91341,3451,16434,RU,Entertainment
CbFiJ39sSs0,Воскресный вечер с Владимиром Соловьевым от 10.12.17,Россия 24,2017-12-10,166297,1578,667,718,RU,Entertainment
_PY9A3IvoxM,"Музыкальная студия Александра Гудкова & Витя АК-47 - «Советы, как правильно кормить птиц зимой».",Вечерний Ургант,2017-12-08,1372228,62635,8407,2752,RU,Entertainment
NQqvLgigBWw,Столото представляет | Русское лото тираж №1209 от 10.12.17,Столото,2017-12-10,60599,128,245,101,RU,Entertainment
jhbRvKkE7KY,Онлайн-трансляция из Нескучного сада 10 декабря 2017 года,Что? Где? Когда?,2017-12-10,46025,390,91,42,RU,Entertainment
c3BnZYschgs,РОССИЙСКИЙ СУХПАЁК vs ИНОСТРАННЫЕ СУХПАЙКИ,Юрий Хованский,2017-12-09,609636,51412,5907,7011,RU,Entertainment
aD15NBIk0ok,ОГОНЬ ПОД ВОДОЙ? 25 примеров ОТСУТСТВИЯ ЛОГИКИ в мультфильмах  часть два,Обо всем Интересном :3,2017-12-10,91584,4838,236,662,RU,Entertainment
tTIrfUayfrI,Все киногрехи  Люди Икс: Первый класс,KINOKOS,2017-12-10,100793,5631,148,512,RU,Entertainment
FS1bM_GP_zQ,Элджей & ФИЗРУК - Розовое вино (ПАРОДИЯ 2017),Пацаны вообще ребята,2017-12-09,140518,3241,906,141,RU,Entertainment
Z1PkH40zCXQ,Юмористический сериал На троих: 5 серия 4 сезон 2017 | Дизель Студио Украина - новый выпуск,Фильмы и сериалы Дизель Студио,2017-12-10,59077,679,63,79,RU,Entertainment
pg6VCfzH7Qs,КАК ТЕСТИРУЮТ КОРМ ДЛЯ ЖИВОТНЫХ?,DaiFiveTop,2017-12-10,129386,7149,371,1085,RU,Entertainment
ttSRJnysfoM,Eşkıya Dünyaya Hükümdar Olmaz 84. Bölüm Fragmanı - atv,atv,2017-12-10,382710,2061,88,201,RU,Entertainment
oqnyTSYmdAs,Дом 2 новости 10 декабря 2017 (10.12.2017) Раньше эфира,Новости Проекта,2017-12-10,27504,91,32,15,RU,Entertainment
1J-uqOJSNTs,"Американцы Слушают Русскую Музыку #38 OXXXYMIRON, СКРИПТОНИТ, ЛЕНИНГРАД, VERSUS, KIZARU, PHARAOH",GlebaTV,2017-12-09,197343,6663,880,1767,RU,Entertainment
ZmDLqK-MeVM,УЛЕТЕЛ С ГИГАНТСКОГО МЯЧА😱 / КОМУ ДОСТАНЕТСЯ iPhone X 📱/ РЕВАНШ с Костей Павловым⚽,Антон ЛАВ,2017-12-10,81056,5033,411,1265,RU,Entertainment
Hly0rD5MO_M,Данэлия Тулешова Rise up – нокауты – Голос. Дети 4 сезон,Голос країни,2017-12-10,163261,7886,82,712,RU,Entertainment
O1Yomrqi98o,Топ-модель по-украински. Выпуск 15. 08.12.2017,Новий Канал,2017-12-10,363031,6993,552,2503,RU,Entertainment
YzSIUjcUs8s,Русский ниндзя 3 выпуск 10.12.2017,Mr X,2017-12-10,6745,38,3,9,RU,Entertainment
FXpF5q6m80U,Меня опять хотят ОБМАНУТЬ продавцы с АЛИ!,Костя Павлов,2017-12-09,505036,31647,3840,1155,RU,Entertainment
RA06bWV8Pm4,Этот Легендарный Тест Расскажет Всю Правду о Вашей Личности,AdMe.ru - Сайт о творчестве,2017-12-11,9296,1012,89,180,RU,Entertainment
NxmTSiib994,Битва экстрасенсов. Сезон 17. Выпуск 11 от 10.12.2017,Битва екстрасенсів,2017-12-10,29554,243,82,134,RU,Entertainment
KFRYxSsTzpI,Всё о Зомби Нацистах из фильмов Операция Мертвый Снег,Звездный Капитан,2017-12-10,132909,8342,202,573,RU,Entertainment
MLLSEeaC1pM,"ЧТО СТАЛО c РЭПЕРАМИ БИТВА ЗА РЕСПЕКТ? / D.MASTA, ST, L'ONE, АНТ 25/17, КРИПЛ versus battle",Tema Flex,2017-12-10,69332,2984,98,194,RU,Entertainment
