video_id,title,channel_title,publish_time,views,likes,dislikes,comment_count,Region,category_title
Y006Vcu0yeE,Облачная бухгалтерия от 1C и Мегаплана,Мегаплан - Двигатель бизнеса,2018-01-30,7432,61,267,72,RU,Education
br4YOIRNK3g,Загадки человечества с Олегом Шишкины (30.01.2018),Военное телевидение,2018-01-30,18974,63,8,3,RU,Education
z9IPGEP90cM,"Если вы хотите изменить свою жизнь, но не знаете как",Эра Водолея,2018-02-01,9930,919,6,51,RU,Education
b-Me9eOP-XI,Главные правила достижения цели,БМ LIFE,2018-02-01,10355,0,0,0,RU,Education
eQHTd-3HGFw,Один / Дмитрий Быков // 01.02.18,Эхо Культура,2018-02-01,4589,88,6,4,RU,Education
HWlZIzCsek0,"Владимир Яковлев о счастье в старости, развитии личности и жизненной стратегии",Идеономика,2018-02-02,311424,192,235,110,RU,Education
ejhczSMGU7w,"День Рождения холдинга Кэшбери, как это было.",Кэшбери,2018-02-02,400770,303,1185,264,RU,Education
g1fhl2KKS5E,Ностальгирующий Критик - Медведь Йоги,Студия ДжоШизо,2018-02-02,37627,3530,28,194,RU,Education
V48RYBr-umQ,Отмена пенсий для работающих пенсионеров в 2018 году,Kommentarii,2018-02-02,3236,68,12,5,RU,Education
oCtUStZIf8M,"Быков о конфликте Сванидзе и Шевченко [Один, 2 февраля 2018]",Дмитрий Быков [Радиоэфиры],2018-02-02,21703,309,66,172,RU,Education
lG6HFgIEnTY,Обновленный набор доктора Комаровского «Первый зуб»,Доктор Комаровский,2018-02-02,5675,346,8,25,RU,Education
nZLPmn_VbuU,Засекреченные списки. Эту страну не победить! (03.02.2018) © РЕН ТВ,Военное телевидение,2018-02-03,16721,124,22,55,RU,Education
Tmq5MGQZFaM,Притча - Разговор с Любовью,Эра Водолея,2018-02-03,9636,671,12,36,RU,Education
bDjFl43WanU,Постскриптум (03.02.2018) © ТВ Центр,Постскриптум с Алексеем Пушковым,2018-02-03,153238,1674,316,1390,RU,Education
pm09ebpzfsA,Сколько стоит переехать в США?,Marina Mogilko,2018-02-03,11096,674,29,58,RU,Education
HWlZIzCsek0,"Владимир Яковлев о счастье в старости, развитии личности и жизненной стратегии",Идеономика,2018-02-02,43383,289,350,162,RU,Education
1m2HEkYfz4I,Минералы за МИЛЛИОНЫ ЕВРО! Зачем они нужны?,Thoisoi,2018-02-03,110556,7992,278,372,RU,Education
sk1q5JK-LEM,Встреча в выходные дни 2018-02-03,Programas Teocraticos,2018-02-04,1724,88,4,0,RU,Education
7WvmUJZ2JhI,Укрепление ногтей гелем.Самый простой дизайн 47,Verakso,2018-02-03,10168,801,22,37,RU,Education
ejhczSMGU7w,"День Рождения холдинга Кэшбери, как это было.",Кэшбери,2018-02-02,112840,424,2307,448,RU,Education
rKcuaLP-DKY,Цена на биткоин НЕ ВЫРАСТЕТ? Как на этом заработать?,Мамкин майнер,2018-02-04,840,71,13,25,RU,Education
2yzVNzO1UZA,Что такое душа. Кто вы есть на самом деле,Пятое Измерение,2018-02-03,6615,445,12,45,RU,Education
8l0VmXULRJA,460 Суббота. Поход по музеям.,Life On The Road (судьба дорога),2018-02-04,1992,242,7,34,RU,Education
8uHfww_z1Xw,Как заслуженные артисты нарушают закон,varlamov,2018-02-04,41065,4866,42,706,RU,Education
fK7mTrKd_w0,"Новые запреты в Китае, Криптофонды Ожидают Стремительный Рост. Ежедневный Обзор Новостей от iTuber",Сообщество Онлайн Инвесторов iTuber,2018-02-05,5147,294,8,29,RU,Education
g9h-Rn0SqhQ,Загадки человечества с Олегом Шишкины (05.02.2018),Военное телевидение,2018-02-05,4777,56,5,10,RU,Education
E7usnHL4Pus,"🚩 Пузыри лопнули?  Сценарии BTC, SP500, DJI. ПАДАЕТ ВСЁ.",Умный- Инвестор,2018-02-05,2372,307,9,92,RU,Education
QFuQcnPvoJs,Перепелки на Гриле по-Домашнему.,Георгий Кавказ,2018-02-05,117180,10483,145,725,RU,Education
df34MN9rtl0,💀 САМЫЙ МРАЧНЫЙ ПРОГНОЗ ОБВАЛА КУРСА БИТКОИНА 2018,Ракета t8,2018-02-05,59839,5169,309,2949,RU,Education
ZpMkWF0iZX4,Не следуйте этому  совету,Эра Водолея,2018-02-06,11551,772,11,40,RU,Education
dQPvAfMq6TQ,Самые шокирующие гипотезы. У Вас ус отклеился! (06.02.2018) © РЕН ТВ,Военное телевидение,2018-02-06,16799,95,14,37,RU,Education
c6yyqViJlCs,Ошибки Алексея Земскова с конвекторами,san-therm,2018-02-07,1986,405,31,48,RU,Education
Y63bMV09LXA,"Отскок, Сокол Тяжелый, и Деньги",Sergei Sergienko,2018-02-06,2566,335,7,58,RU,Education
dJZsUDjB5b4,Радислав Гандапас. Выступление на фестивале ПиР-2017,Радислав Гандапас,2018-02-07,2997,187,9,12,RU,Education
0Zz9SesyPF4,Что обязательно должно быть в детской комнате? - Доктор Комаровский,Доктор Комаровский,2018-02-07,13326,621,20,46,RU,Education
NkhtVAaVyLQ,Тайны Чапман. На войне как на войне (07.02.2018),Военное телевидение,2018-02-07,20568,115,18,23,RU,Education
Be0fyrsWKtw,Как правильно закаливать горло? - Доктор Комаровский,Доктор Комаровский,2018-02-08,13085,798,37,76,RU,Education
D3i6ELLEVuU,🌐 КАК НАС ПОДНИМЕТ В КОСМОС КРИПТОВАЛЮТА QTUM,Ракета t8,2018-02-09,2504,302,11,148,RU,Education
h_sUdvJwwks,"09 февраля 2018 г. Дмитрий Краснов. Заметки трейдера. Магнит. Фьючерсы на индекс РТС , Доллар/рубль.",Дмитрий Краснов,2018-02-09,622,77,1,3,RU,Education
BlhIiuXveCw,Как сохранять спокойствие с раздражающими людьми [The School of Life],In Cor Cadit,2018-02-09,22315,2235,114,174,RU,Education
hArQBVjs5dM,Кэшбери холдинг,Кэшбери,2018-02-10,990,106,5,13,RU,Education
cEIwTF2D1UE,Новые доказательства Бога (09.02.2018),Военное телевидение,2018-02-09,21092,123,38,34,RU,Education
xrJWtGdTmOw,Решение суда РФ об анулированном коде валюты 810 RUR и мошенничестве банков [11.02.2018],Правовед ТВ,2018-02-10,3601,639,7,113,RU,Education
8mX9Q9G4rCg,Солнечное затмение 2018,Эра Водолея,2018-02-10,9401,767,20,38,RU,Education
SK9xU4laSiU,"КОГДА В ЛЕСУ ПРОПАЛ 2-ЛЕТНИЙ МАЛЬЧИК, ПОЛИЦЕЙСКИЕ НАТКНУЛИСЬ НА ОТПЕЧАТКИ ЛАП…",Я В ШОКЕ!,2018-02-10,4568,428,4,40,RU,Education
wC83O_SYVKc,"Железо - Металл, ЗАЩИЩАЮЩИЙ ЗЕМЛЮ!",Thoisoi,2018-02-10,96782,10227,140,369,RU,Education
N7ZFT-VDCdI,Вебинар: Кто такая девушка плюс и как ею стать,Mila Levchuk,2018-02-11,25732,1459,148,68,RU,Education
0m3LiMnQjnM,УВЕЛИЧИВАЕМ ВЫХОД НА ЛОДЖИЮ. ЧТО МОЖНО И ЧТО НЕЛЬЗЯ ДЕЛАТЬ.,1) Алексей Земсков (zems.pro),2018-02-12,24840,2537,224,284,RU,Education
vCtJTucRkzg,Что происходило в аэропорту Орска после авиакатастрофы в Подмосковье,UTV Oren,2018-02-11,4427,15,5,8,RU,Education
h4_-iAEig3M,Романовы без соплей: Битва экстрасенсов и спиритизм,Павел Перец,2018-02-11,4455,460,9,71,RU,Education
csj2B31kdGA,КАК ИЗБАВИТЬСЯ ОТ РУССКОГО АКЦЕНТА? Ещё упражнение на произношение [ПЭМ2 #17],Dmitry More,2018-02-11,2524,699,3,163,RU,Education
zyC_oY-ndeE,"Что в личной жизни у мужчины, которого не могу забыть?",Лара Логинова-Таро,2018-02-11,8349,493,25,259,RU,Education
vCtJTucRkzg,Что происходило в аэропорту Орска после авиакатастрофы в Подмосковье,UTV Oren,2018-02-11,107944,219,581,349,RU,Education
N7ZFT-VDCdI,Вебинар: Кто такая девушка плюс и как ею стать,Mila Levchuk,2018-02-11,33858,1743,176,137,RU,Education
S_2zJNI3nls,Атеистический дайджест #137. О чем не расскажут на уроках религиозной культуры,Алексей Козлов,2018-02-12,6762,976,5,281,RU,Education
gSrjeHM7p10,ШОК-ТЕСТ! Приготовьтесь! Игра Что бы ты выбрал? заставит разрываться между вариантами! Видеотест!,Психо Логика,2018-02-12,6375,617,26,176,RU,Education
ngbj7rqUtsE,СБОРНИК РЭП МУЛЬТФИЛЬМОВ (СОНИК VS ФЛЕШ) | Top 5 Cartoon Rap Song (The Flash VS Sonic x),ДАМБО MUSIC,2018-02-13,29471,1713,110,929,RU,Education
maxhl8mmaqQ,"5 ОШИБОК В АНГЛИЙСКОМ, которые делают даже носители",Marina Mogilko,2018-02-14,6212,801,11,77,RU,Education
e-JltD883e0,Сретение Господне. Ткачёв Андрей,Дух Проповеди Православие,2018-02-15,4783,341,9,10,RU,Education
_UNbsy384Ec,Обращение прот. Владимира Головина (в т.ч. к свящ. Александру Новопашину и А.Л.Дворкину),golovinBolgar,2018-02-14,10612,1084,56,0,RU,Education
uzoHfXjvAV8,Тайна числа 1.618034 - самое ВАЖНОЕ число в мире,Удивительные Факты,2018-02-15,21886,2784,106,229,RU,Education
xD4L1EpS9M8,Когда запор надо лечить? - Доктор Комаровский,Доктор Комаровский,2018-02-15,2873,190,5,21,RU,Education
u2vLJFknW0o,"XRP Запартнёрился Уже с 2 Центробанками, Грядущий Форк Litecoine.Ежедневный Обзор Новостей от iTuber",Сообщество Онлайн Инвесторов iTuber,2018-02-15,3234,179,7,18,RU,Education
mjVXV2SMaTk,"КОЛЬЦО ОБЕСПЕЧЕНО, ЕСЛИ СДЕЛАЕШЬ ЭТО! Юлия Ланске",Julia Lanske,2018-02-16,7482,712,10,89,RU,Education
AtzUBOJmLfA,"В паспорте ПРОПИСАНО, что ТЫ РАБ! Все по закону!",Проверь все сам!,2018-02-16,8256,391,48,115,RU,Education
OBX6wNf_Y-I,КАК ВЫУЧИТЬ АНГЛИЙСКИЙ  🙋СИНХРОННЫЕ ПОДКАСТЫ!,Anastacia Kay,2018-02-17,6010,582,20,49,RU,Education
9lkQ02DlP-I,#сложныеногтилайф | Ламинирование F.O.X. | Обзор гель-лаков Elsa,Алёна Sokololof,2018-02-16,12665,601,20,140,RU,Education
rG37Ahrglpw,Интервью и дискуссия по поводу АН-148,Макс Беляев,2018-02-17,6562,264,51,75,RU,Education
OBX6wNf_Y-I,КАК БЫСТРО ВЫУЧИТЬ АНГЛИЙСКИЙ ЯЗЫК САМОСТОЯТЕЛЬНО?,Anastacia Kay,2018-02-17,24004,1502,44,155,RU,Education
5W-rkW71zOI,"Эрбий - Металл, Создающий КВАНТОВЫЙ ИНТЕРНЕТ!",Thoisoi,2018-02-17,115309,8260,197,231,RU,Education
FU47FiNW42Q,Первая лекция Курса Как стать девушкой плюс,Mila Levchuk,2018-02-18,41700,0,0,0,RU,Education
y0a98xV5EwE,Секрет создания отношений,Эра Водолея,2018-02-18,10448,931,12,63,RU,Education
Fie2ENukf7k,Папа Франциск – враг христианства. — Осипов А.И.,Алексей Ильич Осипов,2018-02-18,7840,435,11,39,RU,Education
qWP77GuKZGQ,"99,9%попадаются на эти уловки! Манипуляция сознанием населения",Проверь все сам!,2018-02-18,6797,335,31,121,RU,Education
t2eYCenmGVo,Два вида энтузиазма. Качества ученика  - 6,Уроки Медитации,2018-02-18,5795,532,6,101,RU,Education
Yq-gRJ8UX3k,Загадки человечества с Олегом Шишкиным (19.02.2018),Военное телевидение,2018-02-19,16706,80,18,17,RU,Education
J3fWQXXw0WE,Скрытая тайна выборов Президента РФ [20.02.2018],Правовед ТВ,2018-02-19,1891,206,9,93,RU,Education
9_RDyOOHJWo,О произошедшем за последнюю неделю,Макс Беляев,2018-02-19,3189,316,23,83,RU,Education
u3HG9FO7S_c,Кыйынчылыктарыныз жонундо айтып бере аласызбы (СУРОО-ЖООП)-Шейх Чубак ажы.,Насаат Медиа,2018-02-20,1966,174,5,16,RU,Education
QGlGkFWURNw,✿ LET`S COOK ✿ Морские ножи - кто такие и как готовить? Razor clams / Couteaux ♥,Маша Zолина,2018-02-19,20773,1533,20,0,RU,Education
73atJgZxTno,Как научиться понимать людей? Встреча с участниками Академии смысла,Андрей Курпатов,2018-02-19,3664,315,7,36,RU,Education
pLa_PZV1zkc,Притча о привязанностях,Эра Водолея,2018-02-20,10796,714,15,38,RU,Education
lobdSZvVNyg,Комби + ранка :( | обзор ROXY | объемная инкрустация,Алёна Sokololof,2018-02-20,13227,1068,20,209,RU,Education
i2htF1rEG34,Разбираюсь работает или нет Акващит | Нужна ваша помощь и реальные отзывы о нем,На даче ЖИТЬ! Дом своими руками,2018-02-20,7151,776,43,418,RU,Education
6yfUlILrzto,"Семья, работник и инвестор (часть 2 из 2).",Justus Walker,2018-02-22,2131,245,1,41,RU,Education
K9Gq-TBeEKg,"Культурный код банкира (Познавательное ТВ, Михаил Величко)",Познавательное ТВ,2018-02-22,1808,189,14,26,RU,Education
e6HtsB6gvDU,Загадки человечества с Олегом Шишкиным (21.02.2018),Военное телевидение,2018-02-21,3435,47,10,4,RU,Education
3hvwaMTs1dE,Что на самом деле мы празднуем 23 февраля и 8 марта,РаВеда,2018-02-21,5451,398,27,128,RU,Education
RGyK1QCQClU,Мой неудачный дизайн ногтей(( Коррекция ногтей. 50,Verakso,2018-02-22,11386,884,19,191,RU,Education
hMDR9Ku7uSA,Самые шокирующие гипотезы. Чудище было огромно! (22.02.2018),Военное телевидение,2018-02-22,11399,71,15,8,RU,Education
isOvq28c_dI,"Что делать, когда вам мешают",Эра Водолея,2018-02-22,6590,593,10,32,RU,Education
XWsBRV9kC2w,Ждут ли новые отношения? Суждено ли мне быть в паре?,Лара Логинова-Таро,2018-02-23,3456,366,23,74,RU,Education
UKyB6MQeOXs,Товары и услуги при капитализме,Блог Торвальда,2018-02-24,2428,251,23,107,RU,Education
MRdM0ixpn7E,17.03.2018 фирма РФ закрывается! Возвращаемся в правовое поле СССР! - 22.02.2018,Правовед ТВ,2018-02-23,5500,648,21,0,RU,Education
ww1-wMG5gms,ГРУБЕЙШИЕ ЖЕНСКИЕ ОШИБКИ В ОТНОШЕНИЯХ! Юлия Ланске,Julia Lanske,2018-02-23,6778,472,18,42,RU,Education
C5Ip4UGGhCs,"Быков: травля Серебрякова после интервью Дудю [Один, 23 февраля 2018]",Дмитрий Быков [Радиоэфиры],2018-02-23,16524,313,29,104,RU,Education
8MaYSMfAk8w,"Криптовалюта Павла Дурова ОБМАН, МАЙНЕРЫ ЖГУТ ДОМА",Мамкин майнер,2018-02-25,756,72,12,8,RU,Education
7V5zT294Xpo,Встреча в выходные дни 2018-02-24,Programas Teocraticos,2018-02-24,1671,73,7,0,RU,Education
1uXJgZto2iU,Борис Юлин про рабство,Dmitry Puchkov,2018-02-24,89152,4967,136,516,RU,Education
DVYsF0DMeas,Сенсация! C 16.03.2017 cуды РФ ликвидированы! (Ленур Усманов) [24.02.2018],Правовед ТВ,2018-02-24,3033,463,3,81,RU,Education
vCyGCLri6jg,Душевный огонь,Уроки Медитации,2018-02-25,6142,871,4,131,RU,Education
C0jZWTOigr8,Гаагский суд принял заявление против В.В. Путина [26.02.2018],Правовед ТВ,2018-02-26,10239,1207,225,646,RU,Education
C0jZWTOigr8,Гаагский суд принял заявление против В.В. Путина [26.02.2018],Правовед ТВ,2018-02-26,73720,0,0,1384,RU,Education
S4MbX8bWO1I,МОЩНЕЙШИЕ ИНСТРУМЕНТЫ ДЛЯ ВОЗВРАТА МУЖЧИНЫ! Юлия Ланске,Julia Lanske,2018-02-27,11939,954,15,96,RU,Education
m-sZDyLvA7I,✿ LET`S COOK ✿ Самодельная свежая ПАСТА в домашних условиях  ♥,Маша Zолина,2018-02-27,17798,2188,7,0,RU,Education
qKD1hPLxEXg,Аналитический сериал Уполномочен огласить. 4 серия. Отсчёт пошел. 6 лет...,Сергей Будков,2018-02-27,10223,601,18,80,RU,Education
QRgeKzEwseU,Во время теледебатов Ксения Собчак вылила стакан воды на Владимира Жириновского,Коммерсантъ,2018-02-28,28527,77,9,0,RU,Education
1gnXLMvF3BE,Детское питание. Что нужно есть на ужин? - Доктор Комаровский,Доктор Комаровский,2018-03-01,2001,185,17,24,RU,Education
k55YSFnBwAI,Как правильно общаться с мужчиной | Психология мужчин,Павел Раков,2018-03-01,1332,136,2,4,RU,Education
qqTfKtlf0Lg,Почему я не доверяю прививкам,Блог Торвальда,2018-03-02,2417,242,57,97,RU,Education
UpaIEDWPBpU,Разведданные ТВ. Новости . 02.03.2018 гг.,Сергей Будков,2018-03-02,12601,943,12,104,RU,Education
QJc-VrczG7s,РОССИЯ 1991 - 2018 гг. / СТАТИСТИКА / ФАКТЫ,Tyler Durden,2018-03-03,3419,743,43,346,RU,Education
KUvaZk62CqY,Постскриптум (03.03.2018),Постскриптум с Алексеем Пушковым,2018-03-03,166946,2050,277,1447,RU,Education
nJ3b8jRYNPU,Разведданные ТВ. Новости 03.03.2018 гг.,Сергей Будков,2018-03-03,14583,1095,13,146,RU,Education
tNwKtjsvDv0,Как получить эффект от  аффирмаций,Эра Водолея,2018-03-03,6602,509,3,36,RU,Education
Z_8E_QPTaqo,«Пекинский человек» Сергей Савельев (Вынос мозга #34),издательство ВЕДИ,2018-03-03,4880,326,19,147,RU,Education
kFb-H1zcjG8,КУПИ МНЕ ТО… СДЕЛАЙ ЭТО… НЕ ГОВОРИ ТАК! Юлия Ланске,Julia Lanske,2018-03-03,7510,483,14,43,RU,Education
TngesFm8xiQ,Гелий - СВЕРХТЕКУЧИЙ И САМЫЙ ХОЛОДНЫЙ ГАЗ!,Thoisoi,2018-03-03,119726,8476,118,340,RU,Education
JFUaoD3maLA,Что с ними стало? - Победители шоу талантов,Теперь я Знаю,2018-03-05,59642,5857,167,465,RU,Education
zRsk9FPktbw,Сила Благодарности,Уроки Медитации,2018-03-04,6588,1009,8,122,RU,Education
3Yw3bnYpT0w,Grattol | Лайфхак для идеального выравнивания | Классический маникюр,Алёна Sokololof,2018-03-04,16803,1191,14,200,RU,Education
DQfZdgoNTJY,«Глупая Лошадь» - Доктор Комаровский рассказывает стишок Вадима Левина,Доктор Комаровский,2018-03-05,1899,236,2,29,RU,Education
JFUaoD3maLA,Что с ними стало? - Победители шоу талантов,Теперь я Знаю,2018-03-05,255703,11503,556,858,RU,Education
OM6K2QQ4t8Y,Разведданные ТВ. Новости 05.03.2018 гг.,Сергей Будков,2018-03-05,6624,848,7,88,RU,Education
6aWwAhmKlmM,"Оскар 2018. Шутки, скандалы и речь победителей на английском || Skyeng",Skyeng: онлайн-школа английского языка,2018-03-06,9130,892,21,45,RU,Education
ubom3SKKRpw,Весенний маникюр. Тонкие линии. Дизайн ногтей 51,Verakso,2018-03-05,7559,926,12,73,RU,Education
sUfQvxJrM68,18 ЯИЦ ЗА ДВА ГОДА.  Парень научился откладывать яйца.,GREAT STORY,2018-03-05,7585,63,46,30,RU,Education
ujweVqy9dwc,Нужно ли школьнику покупать дорогой мобильный телефон?,Теперь я Знаю,2018-03-07,24174,2163,524,1182,RU,Education
JcZoIOA_FiM,Аналитический сериал Уполномочен огласить. 5 серия. Передел Мира...,Сергей Будков,2018-03-06,4357,412,7,49,RU,Education
6aWwAhmKlmM,"Оскар 2018. Шутки, скандалы и речь победителей на английском || Skyeng",Skyeng: онлайн-школа английского языка,2018-03-06,44866,2800,49,125,RU,Education
UzJBnTJ1Nr4,"Криптовалюту используют НА ВЫБОРАХ, Последний шанс или многоходовочка?",Мамкин майнер,2018-03-07,760,68,8,19,RU,Education
JYbO9lkt8-4,Егор Яковлев об историческом контексте фильма Движение вверх,Dmitry Puchkov,2018-03-06,52399,2899,92,442,RU,Education
8wBUmJWVfP8,"ТЫ УВЕРЕНА, ЧТО У ТЕБЯ С НИМ ВСЁ ХОРОШО?! Юлия Ланске",Julia Lanske,2018-03-06,6988,470,16,43,RU,Education
f8WLIAVkw_E,Как улучшить интуитивные способности,Эра Водолея,2018-03-06,5969,433,6,20,RU,Education
46MH36fbMYU,Как Душа разговаривает с вами,Пятое Измерение,2018-03-06,6743,534,13,32,RU,Education
SvY-aZEmMqM,🛠 ОРИГИНАЛЬНЫЕ И НЕРЕАЛЬНО КРУТЫЕ САМОДЕЛКИ ИЗ АВТОЗАПЧАСТЕЙ! ТОП 5 КРУТЫХ ИДЕИ!,Школа Ремонтника,2018-03-08,8023,380,38,42,RU,Education
K0beA2aaRXs,Приняв участие в выборах - ты В ЛЮБОМ случае голосуешь за Путина! [08.03.2018],Правовед ТВ,2018-03-08,4013,345,153,259,RU,Education
RKQXAlOrjts,BENDY VS SONIC | СУПЕР РЭП БИТВА | Бенди И Чернильная Машина and the ink machine ПРОТИВ Соник ежик,ДАМБО MUSIC,2018-03-09,64813,2251,225,3012,RU,Education
GlTbFcu6cvM,Притча - Как лучше для меня,Эра Водолея,2018-03-09,9230,821,22,75,RU,Education
GLBIzwHKUx0,"Миссис России о шести детях, воспитании без нянь и где найти время на себя",Mila Levchuk,2018-03-09,17998,1655,58,275,RU,Education
V7gGrdUxdjs,"Переходим в пятое измерение? Вопросы к Нострадамусу, Кейси и Ванге. (10.03.18)",Игорь Ткаченко,2018-03-10,26592,425,128,58,RU,Education
PNq4FESSgQM,Разведданные ТВ. Новости 10.03.2018 гг.,Сергей Будков,2018-03-10,7676,612,8,92,RU,Education
2H38nTu9axk,Постскриптум (10.03.2018) © ТВ Центр,Постскриптум с Алексеем Пушковым,2018-03-10,160677,1661,237,956,RU,Education
9O1RKLPYr9s,Территория заблуждений (10.03.2018),Военное телевидение,2018-03-10,19821,98,76,63,RU,Education
ptJq7Vaf2PA,Кости гигантов на гравюрах Пиранези. Доказательства существования великанов до потопа в 18 веке,Крамола,2018-03-10,7990,1174,14,45,RU,Education
EP-nLwyEYk8,Клим Жуков про чайные и опиумные клиперы,Dmitry Puchkov,2018-03-11,122925,6787,185,1075,RU,Education
VchrgQJAOcw,ЭТОГО НЕ ХВАТАЕТ МНОГИМ ОТНОШЕНИЯМ… Юлия Ланске,Julia Lanske,2018-03-11,9942,877,25,107,RU,Education
CJ78niIk9hs,Практика благодарности на каждый день,Эра Водолея,2018-03-14,9946,831,11,51,RU,Education
TqWy78fGNxE,"👹 ИГРУШКИ, КОТОРЫЕ ЗАРАБАТЫВАЮТ КРИПТОВАЛЮТУ - ОБЗОР ICO MONSTERBIT",Ракета t8,2018-03-15,2178,257,36,76,RU,Education
r3uACJHRioY,"ОФИЦИАНТКА ПОКОРМИЛА БЕЗДОМНОГО, НО ОНА ДАЖЕ ПРЕДСТАВИТЬ СЕБЕ НЕ МОГЛА, ЧЕМ ЭТО ДЛЯ НЕЕ ЗАКОНЧИТСЯ…",Я В ШОКЕ!,2018-03-13,673737,13483,642,992,RU,Education
