video_id,title,channel_title,publish_time,views,likes,dislikes,comment_count,Region,category_title
efpUCPITNmw,Russia Vs Argentina 0-1 - All Goals & Highlights - Resumen y Goles 11/11/2017 HD,NugoBasilaiaa,2017-11-11,1641745,7643,702,1082,IN,Sports
ysik6z44B1E,"Stephanie McMahon questions Kurt Angle's leadership: Raw, Nov. 13, 2017",WWE,2017-11-14,1574756,32539,843,3096,IN,Sports
PnYrL1rK-z8,"Hardik Patel's video goes viral, Hardik terms it dirty politics- Tv9Gujarati",Tv9 Gujarati,2017-11-13,42816,169,55,85,IN,Sports
ysik6z44B1E,"Stephanie McMahon questions Kurt Angle's leadership: Raw, Nov. 13, 2017",WWE,2017-11-14,1717414,34163,884,3175,IN,Sports
ExBnZv7mYys,England vs Brazil 0-0 - Extended Match Highlights - Friendly 14/11/2017 HD,GOLAZO TV,2017-11-14,749448,2680,244,513,IN,Sports
xLTyB3tMOm0,🔴[Live] Sarabha (Ludhiana) Kabaddi Tournament 16 Nov 2017,Kabaddi365.com,2017-11-16,127803,1913,145,8,IN,Sports
YXSbUKHg2to,"Jinder Mahal vows to come after WWE Champion AJ Styles: SmackDown LIVE, Nov. 14, 2017",WWE,2017-11-15,389636,6858,376,933,IN,Sports
6cR_0HlApkg,🔴[Live] Khanna (Ludhiana) Kabaddi Tournament  17 Nov 2017,Kabaddi365.com,2017-11-17,142791,2104,129,4,IN,Sports
fNVfgXSHXRQ,17/3 | IND vs SL 1st Test | INDIA | SRILANKA | KOLKATA | 2017 1st Test IND vs SL,PetroMax Light,2017-11-16,138676,137,300,27,IN,Sports
6cR_0HlApkg,🔴[Live] Khanna (Ludhiana) Kabaddi Tournament  17 Nov 2017,Kabaddi365.com,2017-11-17,168367,2198,145,8,IN,Sports
NTPAau4KNPQ,Leganes vs Barcelona 0-3 - All Goals & Extended Highlights - La Liga 18/11/2017 HD,GOLAZO TV,2017-11-18,1875142,11393,685,1115,IN,Sports
fNVfgXSHXRQ,17/3 | IND vs SL 1st Test | INDIA | SRILANKA | KOLKATA | 2017 1st Test IND vs SL,PetroMax Light,2017-11-16,161598,150,337,29,IN,Sports
pC9dViGfJ2Q,Atletico Madrid vs Real Madrid 0-0 - Extended Match Highlights - La Liga 18/11/2017 HD,GOLAZO TV,2017-11-18,2029829,9322,764,2385,IN,Sports
5ly4eC-U4P4,Resumen de Atlético de Madrid vs Real Madrid (0-0),LaLiga Santander,2017-11-18,400462,2602,288,251,IN,Sports
BbF4mQtyCLU,🔴[Live] Dhura (Sangrur) Kabaddi Tournament 18 Nov 2017,Kabaddi365.com,2017-11-18,231198,2735,257,26,IN,Sports
lplrTS5ONlg,5th day IND vs SL 1st test: Shami gets angry on Dikwela at Kolkata | Headlines Sports,Headlines Sports,2017-11-20,208794,1040,177,56,IN,Sports
pC9dViGfJ2Q,Atletico Madrid vs Real Madrid 0-0 - Extended Match Highlights - La Liga 18/11/2017 HD,GOLAZO TV,2017-11-18,2304099,10084,856,2539,IN,Sports
bpHw9kWH4bM,"Raw Women's Champion Alexa Bliss is despondent after her loss: Exclusive, Nov. 19, 2017",WWE,2017-11-20,285245,4544,143,801,IN,Sports
5ly4eC-U4P4,Resumen de Atlético de Madrid vs Real Madrid (0-0),LaLiga Santander,2017-11-18,471089,2911,367,302,IN,Sports
BbF4mQtyCLU,🔴[Live] Dhura (Sangrur) Kabaddi Tournament 18 Nov 2017,Kabaddi365.com,2017-11-18,244925,2798,276,23,IN,Sports
lplrTS5ONlg,5th day IND vs SL 1st test: Shami gets angry on Dikwela at Kolkata | Headlines Sports,Headlines Sports,2017-11-20,311208,1305,448,103,IN,Sports
gXiJM445mYM,"Braun Strowman warns everyone about the repercussions of double-crossing him: Nov. 19, 2017",WWE,2017-11-20,360407,6041,125,621,IN,Sports
pC9dViGfJ2Q,Atletico Madrid vs Real Madrid 0-0 - Extended Match Highlights - La Liga 18/11/2017 HD,GOLAZO TV,2017-11-18,2433172,10370,883,2587,IN,Sports
lplrTS5ONlg,5th day IND vs SL 1st test: Shami gets angry on Dikwela at Kolkata | Headlines Sports,Headlines Sports,2017-11-20,311208,1305,448,103,IN,Sports
VJwoSfTOhyM,Water Bottle Flip 2 | Dude Perfect,Dude Perfect,2017-11-20,10552150,438805,7340,30559,IN,Sports
lplrTS5ONlg,5th day IND vs SL 1st test: Shami gets angry on Dikwela at Kolkata | Headlines Sports,Headlines Sports,2017-11-20,412775,1521,724,150,IN,Sports
jQW0apSNm14,"Bryan answers Owens' pleas with a match against Orton next week: SmackDown LIVE, Nov 21, 2017",WWE,2017-11-22,484715,8292,235,683,IN,Sports
iIzRYZyrg8U,🔴[Live]Kandhala Jattan (Hoshiarpur) Kabaddi Tournament 22 Nov 2017,Kabaddi365.com,2017-11-22,200467,3047,210,9,IN,Sports
VJwoSfTOhyM,Water Bottle Flip 2 | Dude Perfect,Dude Perfect,2017-11-20,11474521,457987,7923,28571,IN,Sports
lplrTS5ONlg,5th day IND vs SL 1st test: Shami gets angry on Dikwela at Kolkata | Headlines Sports,Headlines Sports,2017-11-20,464032,1626,877,144,IN,Sports
FPF034i9SW4,"The Shield drives The Miz through the announce table after Raw: Raw Fallout, Nov. 20, 2017",WWE,2017-11-21,2117469,41465,1445,4338,IN,Sports
_8vguSZ_lJw,Indian Sports Honours Awards: Virat and Anushka play ‘Never Have I Ever’,Star Sports,2017-11-24,188960,2763,89,55,IN,Sports
VJwoSfTOhyM,Water Bottle Flip 2 | Dude Perfect,Dude Perfect,2017-11-20,12355872,474027,8390,29644,IN,Sports
FPF034i9SW4,"The Shield drives The Miz through the announce table after Raw: Raw Fallout, Nov. 20, 2017",WWE,2017-11-21,2197018,42242,1474,4440,IN,Sports
lplrTS5ONlg,5th day IND vs SL 1st test: Shami gets angry on Dikwela at Kolkata | Headlines Sports,Headlines Sports,2017-11-20,482520,1666,941,142,IN,Sports
M-_zgaPRcCA,🔴[Live] Bhandal Dona (Kapurthala) Kabaddi Cup 24 Nov 2017,Kabaddi365.com,2017-11-24,192589,2835,200,18,IN,Sports
_8vguSZ_lJw,Indian Sports Honours Awards: Virat and Anushka play ‘Never Have I Ever’,Star Sports,2017-11-24,388280,4361,149,86,IN,Sports
ts7YmLdSwmM,Manchester United vs Brighton 1-0 - All Goals & Highlights 25/11/2017 HD,Fazzer,2017-11-25,271212,843,112,71,IN,Sports
sPQ-7mdeuHY,Real Madrid vs Malaga 3-2 - All Goals & Extended Highlights - La Liga 25/11/2017 HD,GOLAZO TV,2017-11-25,1407953,7653,959,1381,IN,Sports
VJwoSfTOhyM,Water Bottle Flip 2 | Dude Perfect,Dude Perfect,2017-11-20,13234006,488655,8870,30713,IN,Sports
M-_zgaPRcCA,🔴[Live] Bhandal Dona (Kapurthala) Kabaddi Cup 24 Nov 2017,Kabaddi365.com,2017-11-24,215329,2952,212,20,IN,Sports
_8vguSZ_lJw,Indian Sports Honours Awards: Virat and Anushka play ‘Never Have I Ever’,Star Sports,2017-11-24,521485,5421,200,113,IN,Sports
ts7YmLdSwmM,Manchester United vs Brighton 1-0 - All Goals & Highlights 25/11/2017 HD,Fazzer,2017-11-25,484049,1306,168,121,IN,Sports
sPQ-7mdeuHY,Real Madrid vs Malaga 3-2 - All Goals & Extended Highlights - La Liga 25/11/2017 HD,GOLAZO TV,2017-11-25,1892074,9147,1203,1516,IN,Sports
4hyWFjCY60o,Resumen de Real Madrid vs Málaga CF (3-2),LaLiga Santander,2017-11-25,294972,1983,253,280,IN,Sports
5cAkrx9Pm90,🔴[Live] Jagatpur Jattan (Phagwara) North India Federation Kabaddi Cup  26 Nov 2017,Kabaddi365.com,2017-11-26,68464,765,43,2,IN,Sports
AC0Z5lmxJmU,Resumen de Valencia CF vs FC Barcelona (1-1),LaLiga Santander,2017-11-26,545402,3245,418,681,IN,Sports
iiOzcMQiDZs,Valencia vs Barcelona 1-1 - All Goals & Extended Highlights - La Liga 26/11/2017 HD,GOLAZO TV,2017-11-26,1472251,7194,654,2032,IN,Sports
_8vguSZ_lJw,Indian Sports Honours Awards: Virat and Anushka play ‘Never Have I Ever’,Star Sports,2017-11-24,608747,6077,222,128,IN,Sports
vTTs2p_SVnw,"Stunning in-ring proposals: WWE Top 10, Nov. 27, 2017",WWE,2017-11-27,703922,20136,769,2426,IN,Sports
Tv3VsWnwqrQ,🔴[Live] Toosa (Ludhiana) Kabaddi Tournament 27 Nov 2017,Kabaddi365.com,2017-11-27,58937,669,18,1,IN,Sports
OvjS1Tkz4HU,🔴[Live] Gehal (Barnala) Kabaddi Tournament  28 Nov 2017,Kabaddi365.com,2017-11-28,191631,2850,250,13,IN,Sports
AC0Z5lmxJmU,Resumen de Valencia CF vs FC Barcelona (1-1),LaLiga Santander,2017-11-26,638604,3644,530,719,IN,Sports
iiOzcMQiDZs,Valencia vs Barcelona 1-1 - All Goals & Extended Highlights - La Liga 26/11/2017 HD,GOLAZO TV,2017-11-26,1543330,7389,687,2042,IN,Sports
OvjS1Tkz4HU,🔴[Live] Gehal (Barnala) Kabaddi Tournament  28 Nov 2017,Kabaddi365.com,2017-11-28,220119,2957,263,21,IN,Sports
1vmhLprZYBg,Arsenal vs Huddersfield 5-0 All Goals & Highlights 29/11/2017 HD,Wrsh98,2017-11-29,831373,2157,505,225,IN,Sports
OvjS1Tkz4HU,🔴[Live] Gehal (Barnala) Kabaddi Tournament  28 Nov 2017,Kabaddi365.com,2017-11-28,229974,2989,270,24,IN,Sports
Ykqx3BYXKmQ,Barcelona vs Murcia 5-0 - All Goals & Extended Highlights - La Copa 29/11/2017 HD,GOLAZO TV,2017-11-29,1392611,8980,473,840,IN,Sports
g6Y_mepNH10,🔴[Live] Dhuri (Sangrur) Kabaddi Cup  01 Dec 2017,Kabaddi365.com,2017-12-01,168443,2255,154,42,IN,Sports
g6Y_mepNH10,🔴[Live] Dhuri (Sangrur) Kabaddi Cup  01 Dec 2017,Kabaddi365.com,2017-12-01,197745,2395,181,50,IN,Sports
EIdzdUZuL-E,Barcelona vs Celta Vigo 2-2 - All Goals & Extended Highlights - La Liga 02/12/2017 HD,GOLAZO TV,2017-12-02,1430785,8551,640,201,IN,Sports
Q6CUaLa1Rtg,Ganguly Reacts on SL Smog Drama IND vs SL 3rd Test Day 2.,Sportsvilla,2017-12-03,721184,3767,616,1115,IN,Sports
nnWM9LsDOiw,IND Vs SL Day 2: IND strike early after 536/7 declared with Virat 243 | Headlines Sports,Headlines Sports,2017-12-03,360351,2002,368,60,IN,Sports
EIdzdUZuL-E,Barcelona vs Celta Vigo 2-2 - All Goals & Extended Highlights - La Liga 02/12/2017 HD,GOLAZO TV,2017-12-02,1733060,9498,727,663,IN,Sports
3AhGp3ELXUM,Resumen de Athletic Club vs Real Madrid (0-0),LaLiga Santander,2017-12-02,255976,1439,244,595,IN,Sports
lduo4gvJsaQ,Barcelona vs Celta Vigo 2-2 - All Goals & Highlights 02/12/2017 HD,Fazzer,2017-12-02,360904,1218,147,134,IN,Sports
g6Y_mepNH10,🔴[Live] Dhuri (Sangrur) Kabaddi Cup  01 Dec 2017,Kabaddi365.com,2017-12-01,209461,2438,194,9,IN,Sports
Q6CUaLa1Rtg,Ganguly Reacts on SL Smog Drama IND vs SL 3rd Test Day 2.,Sportsvilla,2017-12-03,1016810,4811,889,1463,IN,Sports
nnWM9LsDOiw,IND Vs SL Day 2: IND strike early after 536/7 declared with Virat 243 | Headlines Sports,Headlines Sports,2017-12-03,509322,2505,582,101,IN,Sports
7i3LymfKdGY,Athletic Bilbao vs Real Madrid 0-0 - Extended Match Highlights - La Liga 02/12/2017 HD,GOLAZO TV,2017-12-02,1424879,5609,730,4034,IN,Sports
3AhGp3ELXUM,Resumen de Athletic Club vs Real Madrid (0-0),LaLiga Santander,2017-12-02,300837,1621,292,458,IN,Sports
Q6CUaLa1Rtg,Ganguly Reacts on SL Smog Drama IND vs SL 3rd Test Day 2.,Sportsvilla,2017-12-03,1143180,5254,1005,1256,IN,Sports
nnWM9LsDOiw,IND Vs SL Day 2: IND strike early after 536/7 declared with Virat 243 | Headlines Sports,Headlines Sports,2017-12-03,619091,2809,740,141,IN,Sports
"#NAME?",All Sports Golf Battle 2 | Dude Perfect,Dude Perfect,2017-12-04,8643326,299732,5168,23303,IN,Sports
yn_-uRhyijQ,Cyclone Ockhi: Surat coastal areas put on high alert - Tv9 Gujarati,Tv9 Gujarati,2017-12-04,48287,184,15,2,IN,Sports
"#NAME?",India vs Sri Lanka: Sri Lankan cricket team wore mask in order to safe guard from pollution,News Nation,2017-12-03,183132,524,146,167,IN,Sports
AkO-HWVFJtU,"Samoa Joe ambushes Jason Jordan in Kurt Angle's office: Raw, Dec. 4, 2017",WWE,2017-12-05,488122,7605,287,688,IN,Sports
Q6CUaLa1Rtg,Ganguly Reacts on SL Smog Drama IND vs SL 3rd Test Day 2.,Sportsvilla,2017-12-03,1216411,5497,1088,1609,IN,Sports
kbAuQ-vxUdw,🔴[Live] Dher (Haryana) Kabaddi Tournament  06 Dec 2017,Kabaddi365.com,2017-12-06,114156,1347,86,14,IN,Sports
nnWM9LsDOiw,IND Vs SL Day 2: IND strike early after 536/7 declared with Virat 243 | Headlines Sports,Headlines Sports,2017-12-03,646922,2885,797,122,IN,Sports
AkO-HWVFJtU,"Samoa Joe ambushes Jason Jordan in Kurt Angle's office: Raw, Dec. 4, 2017",WWE,2017-12-05,548476,8154,326,603,IN,Sports
"#NAME?",All Sports Golf Battle 2 | Dude Perfect,Dude Perfect,2017-12-04,9828746,316976,5797,23221,IN,Sports
NGl4-NmAtuQ,Top News Stories From Gujarat : 05-12-2017 - Tv9 Gujarati,Tv9 Gujarati,2017-12-05,39603,103,14,3,IN,Sports
PZFDEDCyph4,MR. PUNJAB 2017 Grand Finale,PTC PUNJABI GOLD,2017-12-07,50688,1173,79,60,IN,Sports
kbAuQ-vxUdw,🔴[Live] Dher (Haryana) Kabaddi Tournament  06 Dec 2017,Kabaddi365.com,2017-12-06,134443,1414,94,13,IN,Sports
"#NAME?",All Sports Golf Battle 2 | Dude Perfect,Dude Perfect,2017-12-04,10558591,325481,6104,24107,IN,Sports
vWaEIuGRWQI,"Shane McMahon puts Owens & Zayn's careers on the line: SmackDown LIVE, Dec. 5, 2017",WWE,2017-12-06,356265,6461,241,897,IN,Sports
PZFDEDCyph4,MR. PUNJAB 2017 Grand Finale,PTC PUNJABI GOLD,2017-12-07,99893,1631,170,141,IN,Sports
dvpm3XFWNqg,Cristiano Ronaldo Wins The Ballon D'or 2017,MadridistaTV,2017-12-07,820961,10625,847,1425,IN,Sports
xlhuPmDsm8U,🔴[Live] Kaddon (Ludhiana) Kabaddi Tournament  08 Dec 2017,Kabaddi365.com,2017-12-08,83200,1017,58,1,IN,Sports
rJ6SyvwnPd0,Real Madrid vs Sevilla 5-0 - All Goals & Extended Highlights - La Liga 09/12/2017 HD,GOLAZO TV,2017-12-09,1576014,10129,1015,178,IN,Sports
PZFDEDCyph4,MR. PUNJAB 2017 Grand Finale,PTC PUNJABI GOLD,2017-12-07,120656,1801,202,81,IN,Sports
dvpm3XFWNqg,Cristiano Ronaldo Wins The Ballon D'or 2017,MadridistaTV,2017-12-07,1022354,12122,1045,1607,IN,Sports
Nx0CsfFIhPs,Real Madrid vs Sevilla 5-0 - HIGHLIGHTS & GOALS RESUMEN & GOLES - La Liga 09/12/2017 HD,MATCH OF THE DAY,2017-12-09,414330,5366,269,748,IN,Sports
wAH2abwcJKI,🔴[Live] Jhuner (Sangrur) Kabaddi Tournament  09 Dec 2017,Kabaddi365.com,2017-12-09,86278,1074,52,6,IN,Sports
rJ6SyvwnPd0,Real Madrid vs Sevilla 5-0 - All Goals & Extended Highlights - La Liga 09/12/2017 HD,GOLAZO TV,2017-12-09,1921510,11468,1220,118,IN,Sports
x6LKJjIhUEs,Resumen de Real Madrid vs Sevilla FC (5-0),LaLiga Santander,2017-12-09,359856,2915,303,137,IN,Sports
Nx0CsfFIhPs,Real Madrid vs Sevilla 5-0 - HIGHLIGHTS & GOALS RESUMEN & GOLES - La Liga 09/12/2017 HD,MATCH OF THE DAY,2017-12-09,575372,6220,323,831,IN,Sports
GRaR6JpFoM0,"Live match: India vs Sri Lanka 1st ODI,Live Cricket Scoreonline,#indvssl:SL Won",HSB News,2017-12-10,39802,72,36,3,IN,Sports
PZFDEDCyph4,MR. PUNJAB 2017 Grand Finale,PTC PUNJABI GOLD,2017-12-07,131781,1877,227,194,IN,Sports
kSAx-Kvor1Q,🔴[Live] Gowara (Malerkotla) North India Federation Kabaddi Cup  10 Dec 2017,Kabaddi365.com,2017-12-10,114321,1626,104,8,IN,Sports
M8stuApKzjI,Resumen de Villarreal CF vs FC Barcelona (0-2),LaLiga Santander,2017-12-10,382698,3010,330,159,IN,Sports
R9_hKhf0TDo,Villarreal vs Barcelona 0-2 - All Goals & Extended Highlights - La Liga 10/12/2017 HD,GOLAZO TV,2017-12-10,2005172,13775,836,496,IN,Sports
kSAx-Kvor1Q,🔴[Live] Gowara (Malerkotla) North India Federation Kabaddi Cup  10 Dec 2017,Kabaddi365.com,2017-12-10,139354,1761,121,10,IN,Sports
ycVc1jsaAA0,Christmas Stereotypes,Dude Perfect,2017-12-11,8267018,367667,5273,33808,IN,Sports
M8stuApKzjI,Resumen de Villarreal CF vs FC Barcelona (0-2),LaLiga Santander,2017-12-10,444410,3409,397,188,IN,Sports
YmQc3lpqMuA,"Virat Kohli, Anuskha Sharma Get Married In Italy",NDTV,2017-12-11,43098,207,19,24,IN,Sports
dKj1h3WJHE0,Rohit Sharma scores his third double century during second ODI against Sri Lanka,The Times of India,2017-12-13,676404,3322,240,353,IN,Sports
Ztbw3tz47JI,Rohit Sharma ने दी Virat Kohli को ऐसी बधाई कि खुद ही फंस गए,News Mirror,2017-12-13,606386,3313,589,200,IN,Sports
FAG0G7y7Wo0,"Rohit Sharma creates history, becomes first batsman to score three ODI double tons",News Nation,2017-12-13,182744,1195,81,164,IN,Sports
uBO4wV7sgws,"India vs Sri Lanka 2nd ODI Match ,#indvssl:Ind won by 141  Runs",HSB News,2017-12-13,161038,247,115,14,IN,Sports
sykLxkX_-2I,‘2017 Is My Best Year’: Rohit Sharma on His 3rd ODI Double Century | The Quint,The Quint,2017-12-13,200574,1314,75,319,IN,Sports
c8bkGdeqwWw,"Top 10 Raw moments: WWE Top 10, December 11, 2017",WWE,2017-12-12,1355333,27086,941,1305,IN,Sports
n4siMzEeTKk,Virat-Anushka को पाक क्रिकेटरों ने दी शादी की बधाई,NMF News,2017-12-12,536252,3463,379,130,IN,Sports
ycVc1jsaAA0,Christmas Stereotypes,Dude Perfect,2017-12-11,9387347,389347,5901,35377,IN,Sports
H6Jv_lpOFZc,India Vs Sri Lanka 2nd ODI: Rohit Sharma Powerfull SIX on Pardeep | Headlines Sports,Headlines Sports,2017-12-13,28444,150,34,6,IN,Sports
Ztbw3tz47JI,Rohit Sharma ने दी Virat Kohli को ऐसी बधाई कि खुद ही फंस गए,News Mirror,2017-12-13,1074331,4338,1014,99,IN,Sports
dKj1h3WJHE0,Rohit Sharma scores his third double century during second ODI against Sri Lanka,The Times of India,2017-12-13,804924,3623,313,0,IN,Sports
ufjhzCUq7ZU,"ind vs sl odi 2017 ; 2nd ODI में ms dhoni ने तोड़ा ICC का Rule, 3rd odi से हो सकते है बाहर",NEGA NEWS,2017-12-14,156361,1177,372,99,IN,Sports
uBO4wV7sgws,"India vs Sri Lanka 2nd ODI Match ,#indvssl:Ind won by 141  Runs",HSB News,2017-12-13,185927,275,152,13,IN,Sports
FAG0G7y7Wo0,"Rohit Sharma creates history, becomes first batsman to score three ODI double tons",News Nation,2017-12-13,215077,1423,105,0,IN,Sports
sykLxkX_-2I,‘2017 Is My Best Year’: Rohit Sharma on His 3rd ODI Double Century | The Quint,The Quint,2017-12-13,237060,1519,82,0,IN,Sports
CaI--yOpUY0,"Daniel Bryan reveals SmackDown LIVE’s Superstars for the Mixed Match Challenge, beginning Jan. 16",WWE,2017-12-13,355523,9859,295,2269,IN,Sports
Ztbw3tz47JI,Rohit Sharma ने दी Virat Kohli को ऐसी बधाई कि खुद ही फंस गए,News Mirror,2017-12-13,1297537,4863,1229,96,IN,Sports
dKj1h3WJHE0,Rohit Sharma scores his third double century during second ODI against Sri Lanka,The Times of India,2017-12-13,868136,3709,347,1,IN,Sports
ufjhzCUq7ZU,"ind vs sl odi 2017 ; 2nd ODI में ms dhoni ने तोड़ा ICC का Rule, 3rd odi से हो सकते है बाहर",NEGA NEWS,2017-12-14,231965,1466,681,132,IN,Sports
FAG0G7y7Wo0,"Rohit Sharma creates history, becomes first batsman to score three ODI double century",News Nation,2017-12-13,233878,1538,116,2,IN,Sports
uBO4wV7sgws,"India vs Sri Lanka 2nd ODI Match ,#indvssl:Ind won by 141  Runs",HSB News,2017-12-13,197102,286,160,2,IN,Sports
sykLxkX_-2I,‘2017 Is My Best Year’: Rohit Sharma on His 3rd ODI Double Century | The Quint,The Quint,2017-12-13,244733,1558,85,4,IN,Sports
Ztbw3tz47JI,Rohit Sharma ने दी Virat Kohli को ऐसी बधाई कि खुद ही फंस गए,News Mirror,2017-12-13,1355126,5009,1308,208,IN,Sports
dKj1h3WJHE0,Rohit Sharma scores his third double century during second ODI against Sri Lanka,The Times of India,2017-12-13,884862,3738,359,0,IN,Sports
FnPN2eOUVGM,"ind vs sl odi 2017 : :Team India's announcement playing XI for 3rd ODI  , this player will debut",NEGA NEWS,2017-12-16,164789,1416,173,36,IN,Sports
Ztbw3tz47JI,Rohit Sharma ने दी Virat Kohli को ऐसी बधाई कि खुद ही फंस गए,News Mirror,2017-12-13,1374356,5056,1329,221,IN,Sports
yQkA-fofEro,India Vs Sri Lanka 3rd ODI: MS Dhoni advise to Kuldeep before the wicket ball | Headlines Sports,Headlines Sports,2017-12-17,95330,1075,60,21,IN,Sports
E0rSeGP0nIg,Real Madrid CF v Gremio FBPA - FIFA CLUB WORLD CUP UAE 2017,FIFATV,2017-12-16,971439,8456,520,1289,IN,Sports
ufjhzCUq7ZU,"ind vs sl odi 2017 ; 2nd ODI में ms dhoni ने तोड़ा ICC का Rule, 3rd odi से हो सकते है बाहर",NEGA NEWS,2017-12-14,276079,1622,919,143,IN,Sports
d_tG4j-3b9E,"Live match:India vs Sri Lanka 3rd ODI,Visakhapatnam,#Live #indvssl,ind won by 8 wkts",HSB News,2017-12-17,45161,89,22,7,IN,Sports
aqj7Uvi9jK8,"Brock Lesnar's Royal Rumble challengers revealed: Raw, Dec. 18, 2017",WWE,2017-12-19,899815,25885,953,2670,IN,Sports
yQkA-fofEro,India Vs Sri Lanka 3rd ODI: MS Dhoni advise to Kuldeep before the wicket ball | Headlines Sports,Headlines Sports,2017-12-17,166571,1361,109,32,IN,Sports
8gOdVsbfjW4,Barcelona vs Deportivo La Coruna 4-0 - All Goals & Extended Highlights - La Liga - 17/12/2017 HD,GOLAZO TV,2017-12-17,2161335,15958,935,2609,IN,Sports
Ztbw3tz47JI,Rohit Sharma ने दी Virat Kohli को ऐसी बधाई कि खुद ही फंस गए,News Mirror,2017-12-13,1380681,5062,1333,217,IN,Sports
E0rSeGP0nIg,Real Madrid CF v Gremio FBPA - FIFA CLUB WORLD CUP UAE 2017,FIFATV,2017-12-16,1387458,10697,671,1450,IN,Sports
q-jZm-FUbqs,"Stephanie McMahon announces the first-ever Women's Royal Rumble Match: Raw, Dec. 18, 2017",WWE,2017-12-19,1354133,25722,1772,5663,IN,Sports
lhBdEnSeAAg,"Live Match:IND vs SL 1st T20i Live,INDIA VS SRI LANKA T20i#indvssl,SL 87-all out (16.0 Ovs)  Ind Won",HSB News,2017-12-20,100638,256,51,17,IN,Sports
3tfTJw5QFeA,WWE Smackdown 19 December 2017 Highlights HD - WWE Smackdown 19/12/2017 Highlights HD,WLive,2017-12-20,81648,1677,68,71,IN,Sports
lUDqmvNXizU,"Full Video: Virat Kohli and Anushka Sharma Delhi reception, Modi, Amir, Salman, Yuvraj, Sehwag",News Mirror,2017-12-21,39569,292,44,29,IN,Sports
lhBdEnSeAAg,"Live Match:IND vs SL 1st T20i Live,INDIA VS SRI LANKA T20i#indvssl,SL 87-all out (16.0 Ovs)  Ind Won",HSB News,2017-12-20,119984,288,63,19,IN,Sports
q-jZm-FUbqs,"Stephanie McMahon announces the first-ever Women's Royal Rumble Match: Raw, Dec. 18, 2017",WWE,2017-12-19,1453741,26453,1860,5097,IN,Sports
sJNeTue32UQ,Inside Virat Kohli And Anushka Sharma's Delhi Reception,NDTV,2017-12-21,21694,103,19,6,IN,Sports
B21MOxooxDk,🔴[Live] Sardulgarh (Mansa) Kabaddi Tournament  22 Dec 2017,Kabaddi365.com,2017-12-22,136148,2016,134,11,IN,Sports
lUDqmvNXizU,"Full Video: Virat Kohli and Anushka Sharma Delhi reception, Modi, Amir, Salman, Yuvraj, Sehwag",News Mirror,2017-12-21,82458,458,68,34,IN,Sports
QAwugvwTPEs,Real Madrid Vs Barcelona 0-3 - All Goals & Highlights - Resumen y Goles 23/12/2017 HD,NugoBasilaiaa,2017-12-23,1643957,11099,942,1389,IN,Sports
5JjPfpSrtvY,Real Madrid vs Barcelona 0-3 - All Goals & Extended Highlights - La Liga 23/12/2017 HD,GOLAZO TV,2017-12-23,2670218,27721,2100,5215,IN,Sports
BASh7eNGciw,Real Madrid vs Barcelona 0-3 All Goals & Highlights 23/12/2017 HD,Wrsh98,2017-12-23,2863226,15225,2444,1321,IN,Sports
XWvhubdMsNY,"Most shocking moments of 2017: WWE Top 10, Dec. 23, 2017",WWE,2017-12-23,1494366,40970,1033,2232,IN,Sports
B21MOxooxDk,🔴[Live] Sardulgarh (Mansa) Kabaddi Tournament  22 Dec 2017,Kabaddi365.com,2017-12-22,158586,2113,151,28,IN,Sports
QAwugvwTPEs,Real Madrid Vs Barcelona 0-3 - All Goals & Highlights - Resumen y Goles 23/12/2017 HD,NugoBasilaiaa,2017-12-23,2335267,13716,1308,1692,IN,Sports
5JjPfpSrtvY,Real Madrid vs Barcelona 0-3 - All Goals & Extended Highlights - La Liga 23/12/2017 HD,GOLAZO TV,2017-12-23,3394865,31019,2458,5704,IN,Sports
BASh7eNGciw,Real Madrid vs Barcelona 0-3 All Goals & Highlights 23/12/2017 HD,Wrsh98,2017-12-23,4106045,19015,3228,1624,IN,Sports
XWvhubdMsNY,"Most shocking moments of 2017: WWE Top 10, Dec. 23, 2017",WWE,2017-12-23,2210506,50348,1382,2754,IN,Sports
ECFRIzp3EB8,🔴[Live] Burj Sidhwan (Malout) Kabaddi Tournament  24 Dec 2017,Kabaddi365.com,2017-12-24,81893,966,37,1,IN,Sports
5OVHGWx3FHw,UNCUT : पुणे : महाराष्ट्र केसरी : अभिजित कटके आणि किरण भगत यांची संपूर्ण लढत,ABP Majha,2017-12-24,164859,785,106,40,IN,Sports
XWvhubdMsNY,"Most shocking moments of 2017: WWE Top 10, Dec. 23, 2017",WWE,2017-12-23,2547724,54188,1568,2885,IN,Sports
QAwugvwTPEs,Real Madrid Vs Barcelona 0-3 - All Goals & Highlights - Resumen y Goles 23/12/2017 HD,NugoBasilaiaa,2017-12-23,2586722,14801,1471,1774,IN,Sports
5JjPfpSrtvY,Real Madrid vs Barcelona 0-3 - All Goals & Extended Highlights - La Liga 23/12/2017 HD,GOLAZO TV,2017-12-23,3668650,32163,2600,5812,IN,Sports
jLggee_GYTA,🔴[Live] Daffar (Hoshiarpur) Punjab Kabaddi Academy Association Cup  25 Dec 2017,Kabaddi365.com,2017-12-25,122340,1632,88,17,IN,Sports
BASh7eNGciw,Real Madrid vs Barcelona 0-3 All Goals & Highlights 23/12/2017 HD,Wrsh98,2017-12-23,4361354,19709,3364,1926,IN,Sports
xb0vST0FhVc,Lionel Messi Reaction after hitting Cristiano Ronaldo on Head (Real Madrid vs Barcelona 0-3),MrMatador,2017-12-24,1491081,11945,471,809,IN,Sports
fNddOeXJj3Y,Gali Janardhan Reddy About CBI Raids And Jail Experience | Open Heart With RK | ABN Telugu,ABN Telugu,2017-12-25,523173,2516,527,0,IN,Sports
Y4VIMU8ggtE,"Kurt Angle engages in emotional post-match celebration with Jason Jordan: Raw Fallout, Dec. 25, 2017",WWE,2017-12-26,915389,15877,1209,2605,IN,Sports
5OVHGWx3FHw,UNCUT : पुणे : महाराष्ट्र केसरी : अभिजित कटके आणि किरण भगत यांची संपूर्ण लढत,ABP Majha,2017-12-24,188919,861,113,44,IN,Sports
QAwugvwTPEs,Real Madrid Vs Barcelona 0-3 - All Goals & Highlights - Resumen y Goles 23/12/2017 HD,NugoBasilaiaa,2017-12-23,2758507,15509,1599,1789,IN,Sports
PUKVqTztMGA,🔴[Live] Kotha Guru (Bathinda) North India Federation Kabaddi Cup  26 Dec 2017,Kabaddi365.com,2017-12-26,119478,1648,104,9,IN,Sports
Y4VIMU8ggtE,"Kurt Angle engages in emotional post-match celebration with Jason Jordan: Raw Fallout, Dec. 25, 2017",WWE,2017-12-26,1282129,19883,1425,2947,IN,Sports
5OVHGWx3FHw,UNCUT : पुणे : महाराष्ट्र केसरी : अभिजित कटके आणि किरण भगत यांची संपूर्ण लढत,ABP Majha,2017-12-24,204475,901,120,44,IN,Sports
g8FTfyXDc9E,Inside Anushka Sharma And Virat Kohli's Mumbai Reception,NDTV,2017-12-26,34436,84,16,8,IN,Sports
PUKVqTztMGA,🔴[Live] Kotha Guru (Bathinda) North India Federation Kabaddi Cup  26 Dec 2017,Kabaddi365.com,2017-12-26,147466,1795,118,12,IN,Sports
9oyKePWRi8Y,Best of 2017 | Dude Perfect,Dude Perfect,2017-12-26,6291266,307708,2851,15199,IN,Sports
0XJJxUuWXFc,🔴[Live] Raikot (Ludhiana) Kabaddi Tournament  28 Dec 2017,Kabaddi365.com,2017-12-28,243915,3575,263,20,IN,Sports
Y4VIMU8ggtE,"Kurt Angle engages in emotional post-match celebration with Jason Jordan: Raw Fallout, Dec. 25, 2017",WWE,2017-12-26,1514687,21804,1527,2500,IN,Sports
9oyKePWRi8Y,Best of 2017 | Dude Perfect,Dude Perfect,2017-12-26,6969112,324853,3151,16270,IN,Sports
fSmjCZdQkw4,🔴[Live] Raikot (Ludhiana) Punjab Kabaddi Academy Association Cup  29 Dec 2017,Kabaddi365.com,2017-12-29,142061,1867,123,14,IN,Sports
fSmjCZdQkw4,🔴[Live] Raikot (Ludhiana) Punjab Kabaddi Academy Association Cup  29 Dec 2017,Kabaddi365.com,2017-12-29,162904,1954,139,20,IN,Sports
S6mySI6d2eY,Watch: Virat Kohli's first net session in Cape Town | India Tour of South Africa,Xtra Time,2017-12-30,85923,575,37,20,IN,Sports
"#NAME?",Why Virat is not happy with the practice wickets in Cape Town? | India Tour of South Africa,Xtra Time,2017-12-30,254221,2140,126,326,IN,Sports
mF5zEqffGAI,Watch: Dhawan gets down to business in Cape Town | India Tour of South Africa,Xtra Time,2017-12-31,173677,929,65,55,IN,Sports
cWTp5xejawE,"Superstars looking invincible: WWE Top 10, Jan. 1, 2018",WWE,2018-01-01,946381,26088,553,1679,IN,Sports
zDz9s2AOTVE,"Brock Lesnar steps into the fire with Kane: Raw, Jan. 1, 2018",WWE,2018-01-02,3208825,51775,2723,5706,IN,Sports
D_lG-nIrSBs,🔴[Live] Malerkotla (Sangrur) Punjab Kabaddi Academy Association Cup 02 Jan 2018,Kabaddi365.com,2018-01-02,131337,2009,166,49,IN,Sports
_mbtqnwhASg,Watch: Virat  Kohli tries a Messi during India practice | India Tour of South Africa,Xtra Time,2018-01-02,99940,612,64,50,IN,Sports
duCd0Gy-k14,ARS vs CHE 2-2 All Goals & Highlights 03/01/2018 HD,Wrsh98,2018-01-03,1246408,7302,571,1025,IN,Sports
zDz9s2AOTVE,"Brock Lesnar steps into the fire with Kane: Raw, Jan. 1, 2018",WWE,2018-01-02,4377502,59742,3472,6778,IN,Sports
D_lG-nIrSBs,🔴[Live] Malerkotla (Sangrur) Punjab Kabaddi Academy Association Cup 02 Jan 2018,Kabaddi365.com,2018-01-02,165374,2187,196,68,IN,Sports
zDz9s2AOTVE,"Brock Lesnar steps into the fire with Kane: Raw, Jan. 1, 2018",WWE,2018-01-02,4837982,62706,3745,6127,IN,Sports
QcprczvwErA,🔴[Live] Gaga (Sangrur) Kabaddi Tournament  04 Jan 2018,Kabaddi365.com,2018-01-04,101775,1182,117,12,IN,Sports
r9t_LVsnXrE,🔴[Live] Tibba (Kapurthala) North India Federation Kabaddi Cup  05 Jan 2018,Kabaddi365.com,2018-01-05,178146,1960,94,10,IN,Sports
1JHY490K_A8,Kurt Angle pairs Finn Bálor with Sasha Banks for WWE Mixed Match Challenge,WWE,2018-01-04,1104184,25961,795,2760,IN,Sports
lqf1ExOzzdw,"Live Match:IND vs SA 1st Test Day 2 match live,#INDVSSA1stTest Live Cricket Score RSA-65/2 Stumps",HSB News,2018-01-06,83216,194,52,8,IN,Sports
3MNEi6hkVIQ,IPL-11: KKR के धोखे के बाद गंभीर को मिला धोनी का साथ.. बड़ा ऐलान हुआ,FLAME MEDIA,2018-01-05,241386,1865,163,96,IN,Sports
1JHY490K_A8,Kurt Angle pairs Finn Bálor with Sasha Banks for WWE Mixed Match Challenge,WWE,2018-01-04,1246692,27422,859,2724,IN,Sports
egL3W14rJ-k,🔴[Live] Dhuri (Sangrur) North India Kabaddi Federation Cup 06 Jan 2018,Kabaddi365.com,2018-01-06,92216,1165,59,16,IN,Sports
LH73_yXe61w,🔴[Live] Kapurthala (Guru Nanak Stadium) Punjab Kabaddi Academy Association Cup  07 Jan 2018,Kabaddi365.com,2018-01-07,117647,1284,73,19,IN,Sports
lqf1ExOzzdw,"Live Match:IND vs SA 1st Test Day 2 match live,#INDVSSA1stTest Live Cricket Score RSA-65/2 Stumps",HSB News,2018-01-06,94363,212,58,8,IN,Sports
6jetElIwt-w,Barcelona vs Levante 3-0 - All Goals & Extended Highlights - La Liga 07/01/2018 HD,GOLAZO TV,2018-01-07,1826716,14722,646,1276,IN,Sports
8c6-SPYAaRs,"Football Fights & Angry Moments 2017/2018 ● Neymar, Messi, C.Ronaldo, Ramos",JackieMT 2nd,2018-01-06,2416034,22005,1363,1460,IN,Sports
2OVzWs816uk,🔴[Live] Pharwahi (Barnala) Kabaddi Tournament  08 Jan 2018,Kabaddi365.com,2018-01-08,145883,1668,124,18,IN,Sports
WfrZAjLjDqo,"Live Match:IND vs SA 1st Test Day 4 match Live,#INDVSSA1st Test South Africa won by 72 runs",HSB News,2018-01-08,103466,261,74,13,IN,Sports
6jetElIwt-w,Barcelona vs Levante 3-0 - All Goals & Extended Highlights - La Liga 07/01/2018 HD,GOLAZO TV,2018-01-07,2410559,16816,826,1410,IN,Sports
YtROJvfLauA,🔴 [Live] Kotra Kalan (Mansa) Kabaddi Tournament  11 Jan 2018,Kabaddi365.com,2018-01-11,351650,4149,430,22,IN,Sports
A47EHIKO05o,"AJ Styles, Randy Orton & Shinsuke Nakamura vs. Kevin Owens & Sami Zayn: SmackDown LIVE, Jan. 9, 2018",WWE,2018-01-10,1543550,25039,1218,2000,IN,Sports
lgLWZ1BcX64,13 Brilliant Fielding by Indians in Cricket Ever 🤩 Mind blowing Efforts 🤗,RangeRIX,2018-01-08,284657,1510,125,166,IN,Sports
marAZRRxLgs,Barcelona vs Celta Vigo 5-0 - All Goals & Highlights ● 11/01/2018 HD (First Half),MrMatador,2018-01-11,1748168,9571,856,809,IN,Sports
blrrsDqDrrk,🔴 [Live] Patto Hira Singh (Moga) Kabaddi Tournament 12 Jan 2018,Kabaddi365.com,2018-01-12,285934,2898,282,4,IN,Sports
z_rHZI7AIUo,Barcelona vs Celta Vigo 5-0 - All Goals & Extended Highlights - La Copa 11/01/2017 HD,GOLAZO TV,2018-01-11,3077931,24391,1161,2339,IN,Sports
marAZRRxLgs,Barcelona vs Celta Vigo 5-0 - All Goals & Highlights ● 11/01/2018 HD (First Half),MrMatador,2018-01-11,1942268,10218,941,828,IN,Sports
blrrsDqDrrk,🔴 [Live] Patto Hira Singh (Moga) Kabaddi Tournament 12 Jan 2018,Kabaddi365.com,2018-01-12,306840,2980,298,6,IN,Sports
z_rHZI7AIUo,Barcelona vs Celta Vigo 5-0 - All Goals & Extended Highlights - La Copa 11/01/2018 HD,GOLAZO TV,2018-01-11,3336417,25285,1226,2354,IN,Sports
NBPy6urvevw,🔴 [Live] Mohem (Nakodar) Punjab Kabaddi Academy Association Cup 14 Jan 2018,Kabaddi365.com,2018-01-14,131489,1305,76,9,IN,Sports
DvDty9y-8Gc,Real Madrid vs Villarreal 0-1 - All Goals & Extended Highlights - La Liga 13/01/2018 HD,GOLAZO TV,2018-01-13,2452830,16315,1534,6302,IN,Sports
KqXf5QS8Ggo,LIV vs MCI 4-3 All Goals & Highlights 14/01/2018 HD,Wrsh98,2018-01-14,654770,4189,336,236,IN,Sports
3R_a-waj0sA,Resumen de Real Sociedad vs FC Barcelona (2-4),LaLiga Santander,2018-01-14,717862,6522,297,317,IN,Sports
TJwch9OCWag,"Live Match Day-3:IND vs SA 2nd Test Match Day 3 live, CricketScore, RSA-90/2",HSB News,2018-01-15,108853,279,102,7,IN,Sports
"#NAME?",Real Sociedad vs Barcelona 2-4 - All Goals & Extended Highlights - La Liga 14/01/2018 HD,GOLAZO TV,2018-01-14,3709068,34607,1462,3412,IN,Sports
NBPy6urvevw,🔴 [Live] Mohem (Nakodar) Punjab Kabaddi Academy Association Cup 14 Jan 2018,Kabaddi365.com,2018-01-14,152263,1404,85,12,IN,Sports
clQGvMBNmqs,"Braun Strowman demolishes a TV production truck: Raw, Jan. 15, 2018",WWE,2018-01-16,3396247,46483,4249,8162,IN,Sports
TJwch9OCWag,"Live Match Day-3:IND vs SA 2nd Test Match Day 3 live, CricketScore, RSA-90/2",HSB News,2018-01-15,118365,294,115,10,IN,Sports
3R_a-waj0sA,Resumen de Real Sociedad vs FC Barcelona (2-4),LaLiga Santander,2018-01-14,791564,6952,356,341,IN,Sports
"#NAME?",Real Sociedad vs Barcelona 2-4 - All Goals & Extended Highlights - La Liga 14/01/2018 HD,GOLAZO TV,2018-01-14,4076091,35781,1585,3508,IN,Sports
GB4Hlszzsb0,🔴 [Live] Jhorran (Ludhiana) Kabaddi Tournament 16 Jan 2018,Kabaddi365.com,2018-01-16,85150,975,58,2,IN,Sports
clQGvMBNmqs,"Braun Strowman demolishes a TV production truck: Raw, Jan. 15, 2018",WWE,2018-01-16,4802685,57261,7261,10039,IN,Sports
S1JK-nYCB9E,🔴 [Live] Takhtupura (Moga) North India Federation Kabaddi Cup  17 Jan 2018,Kabaddi365.com,2018-01-17,180886,1956,129,22,IN,Sports
TJwch9OCWag,"Match Day-3:IND vs SA 2nd Test Match Day 3 live, CricketScore, RSA-90/2",HSB News,2018-01-15,120208,302,117,11,IN,Sports
S1JK-nYCB9E,🔴 [Live] Takhtupura (Moga) North India Federation Kabaddi Cup  17 Jan 2018,Kabaddi365.com,2018-01-17,204610,2035,144,30,IN,Sports
jBwfiA01ok8,"Braun Strowman wreaks havoc backstage: Raw, Jan. 15, 2018",WWE,2018-01-16,1378629,21049,823,2355,IN,Sports
ukMF1xsoWjA,Espanyol vs Barcelona 1-0 - All Goals & Highlights - La Copa 17/01/2018 HD,GOLAZO TV,2018-01-17,1970267,10354,1495,2422,IN,Sports
VJHaIJPf-ss,India U19s - the need for speed!,ICC,2018-01-18,1321973,12450,382,532,IN,Sports
DWHlzb4mG8w,🔴 [Live] Ghudani Khurd (Ludhiana) North India Federation Kabaddi Cup 19 Jan 2018,Kabaddi365.com,2018-01-19,171964,1818,124,5,IN,Sports
0zMvIfB_DKI,Leganes vs Real Madrid 0-1 - All Goals & Extended Highlights - La Copa 18/01/2018 HD,GOLAZO TV,2018-01-18,764256,4433,435,1194,IN,Sports
VJHaIJPf-ss,India U19s - the need for speed!,ICC,2018-01-18,2321345,19110,637,761,IN,Sports
j2UAW47ElIw,🔴 [Live] Raqba (Ludhiana) Kabaddi Tournament 20 Jan 2018,Kabaddi365.com,2018-01-20,135245,1316,100,20,IN,Sports
d_vMkYoblMU,Real Madrid vs Deportivo La Coruña 7-1 - All Goals & Highlights ● 21/01/2018 HD (First Half),MrMatador,2018-01-21,1666100,8915,2786,1181,IN,Sports
VJHaIJPf-ss,India U19s - the need for speed!,ICC,2018-01-18,2996732,23630,811,846,IN,Sports
UyDZofuB0zk,Real Madrid vs Deportivo La Coruna 7-1 - All Goals & Extended Highlights - La Liga 21/01/2018 HD,GOLAZO TV,2018-01-21,1995964,15472,1269,3649,IN,Sports
j2UAW47ElIw,🔴 [Live] Raqba (Ludhiana) Kabaddi Tournament 20 Jan 2018,Kabaddi365.com,2018-01-20,150552,1363,108,30,IN,Sports
sRfp-Zlj6QY,Resumen de Real Betis vs FC Barcelona (0-5),LaLiga Santander,2018-01-21,380749,3638,194,312,IN,Sports
DNRhS8F5Jds,Real Betis Vs Barcelona 0-5 - All Goals & Highlights - Resumen y Goles 21/01/2018 HD,NugoBasilaiaa,2018-01-21,953966,4777,450,1245,IN,Sports
Zr6ZbXXCL3U,🔴 [Live] Sheron (Sangrur) Kabaddi Tournament 22 Jan 2018,Kabaddi365.com,2018-01-22,197528,2057,169,14,IN,Sports
UyDZofuB0zk,Real Madrid vs Deportivo La Coruna 7-1 - All Goals & Extended Highlights - La Liga 21/01/2018 HD,GOLAZO TV,2018-01-21,2503420,17252,1482,4010,IN,Sports
sRfp-Zlj6QY,Resumen de Real Betis vs FC Barcelona (0-5),LaLiga Santander,2018-01-21,844058,6073,454,463,IN,Sports
DNRhS8F5Jds,Real Betis Vs Barcelona 0-5 - All Goals & Highlights - Resumen y Goles 21/01/2018 HD,NugoBasilaiaa,2018-01-21,1926982,7596,839,1367,IN,Sports
d_vMkYoblMU,Real Madrid vs Deportivo La Coruña 7-1 - All Goals & Highlights ● 21/01/2018 HD (First Half),MrMatador,2018-01-21,1911194,9512,3050,1249,IN,Sports
vVOHWYEbVMM,"Raw's loudest crowd reactions: WWE Top 10, Jan. 22, 2018",WWE,2018-01-22,640615,21783,460,1934,IN,Sports
VJHaIJPf-ss,India U19s - the need for speed!,ICC,2018-01-18,3559870,26808,956,928,IN,Sports
VRJmcxCrAOA,Real Life Trick Shots 2 | Dude Perfect,Dude Perfect,2018-01-22,4234615,287417,1677,20037,IN,Sports
VvjjGtSDDo4,"Stone Cold Steve Austin Stuns Shane and Mr. McMahon: Raw 25, Jan. 22, 2018",WWE,2018-01-23,3142984,66578,1604,5560,IN,Sports
VRJmcxCrAOA,Real Life Trick Shots 2 | Dude Perfect,Dude Perfect,2018-01-22,12525525,633710,6036,34903,IN,Sports
7_84vaExkmI,🔴 [Live] Landran (Mohali) Kabaddi Tournament  23 Jan 2018,Kabaddi365.com,2018-01-23,182531,1970,164,20,IN,Sports
tr-cbaH6JXA,Cristiano Ronaldo Face Injury - Real Madrid vs Deportivo La Coruna 7-1 - La Liga 21/01/2018 HD,GOLAZO TV,2018-01-21,1064025,5479,413,1139,IN,Sports
sRfp-Zlj6QY,Resumen de Real Betis vs FC Barcelona (0-5),LaLiga Santander,2018-01-21,955656,6612,558,503,IN,Sports
VRJmcxCrAOA,Real Life Trick Shots 2 | Dude Perfect,Dude Perfect,2018-01-22,17228602,784286,9287,41999,IN,Sports
VvjjGtSDDo4,"Stone Cold Steve Austin Stuns Shane and Mr. McMahon: Raw 25, Jan. 22, 2018",WWE,2018-01-23,3701118,72869,1870,6058,IN,Sports
65avgxQjT_0,🔴 [Live] Chohla Sahib (Tarn Taran) North India Federation Kabaddi Cup 24 Jan 2018,Kabaddi365.com,2018-01-24,170511,1716,123,7,IN,Sports
tr-cbaH6JXA,Cristiano Ronaldo Face Injury - Real Madrid vs Deportivo La Coruna 7-1 - La Liga 21/01/2018 HD,GOLAZO TV,2018-01-21,1258989,6280,494,963,IN,Sports
OjS-MiMe0tM,🔴 [Live] Threeke (Ludhiana) Kabaddi Tournament 25 Jan 2018,Kabaddi365.com,2018-01-25,274121,3258,335,31,IN,Sports
VRJmcxCrAOA,Real Life Trick Shots 2 | Dude Perfect,Dude Perfect,2018-01-22,20761480,871933,11595,43026,IN,Sports
wu4-4ioLC2s,"Boogeyman feeds Xavier Woods a handful of worms: Raw 25 Fallout, Jan. 23, 2018",WWE,2018-01-24,1438957,23910,892,1154,IN,Sports
aaVPh1Qr_t4,Real Madrid vs Leganes 1-2 - All Goals & Extended Highlights - La Copa 24/01/2018 HD,GOLAZO TV,2018-01-24,2586322,14325,1557,3609,IN,Sports
A_OHxcig2xU,Highlights from Afghanistan's crushing U19s victory over New Zealand,ICC,2018-01-25,593100,5311,275,810,IN,Sports
OjS-MiMe0tM,🔴 [Live] Threeke (Ludhiana) Kabaddi Tournament 25 Jan 2018,Kabaddi365.com,2018-01-25,318438,3400,350,34,IN,Sports
pefGcGvkStI,Barcelona vs Espanyol 2-0 - All Goals & Extended Highlights - La Copa 25/01/2018 HD,GOLAZO TV,2018-01-25,3306094,22784,1148,2163,IN,Sports
WmzSRrDAICY,Alexis Sanchez DEBUT For Manchester United l Alexis Sanchez vs Yeovil Town (26/01/2018) Away HD,Fazzer,2018-01-26,328726,2461,196,582,IN,Sports
wkVABDc9qJQ,Bid For Bold with Mr. Nags and RCB! | 2018 VIVO IPL Auction,Royal Challengers Bangalore,2018-01-26,37054,3456,30,375,IN,Sports
aTauLr_RVms,Valencia vs Real Madrid 1-4 - All Goals & Highlights ● 27/01/2018 HD (First Half),MrMatador,2018-01-27,2088123,10710,2855,2811,IN,Sports
Vxp7RHYaK-g,🔴 [Live] Talwan (Jalandhar) North India Federation Kabaddi Cup 27 Jan 2018,Kabaddi365.com,2018-01-27,148801,1589,115,23,IN,Sports
qt13pXFT4tg,Valencia vs Real Madrid 1-4 - All Goals & Extended Highlights - La Liga 27/01/2018 HD,GOLAZO TV,2018-01-27,2426665,18264,1946,5692,IN,Sports
IBVo8dfqTBc,Rey Mysterio makes a shocking return in the Royal Rumble Match: Royal Rumble 2018 (WWE Network),WWE,2018-01-29,1080121,46605,431,7695,IN,Sports
Tg9OdmUD9cE,Barcelona vs Alaves 2-1 - All Goals & Extended Highlights - La Liga 28/01/2018 HD,GOLAZO TV,2018-01-28,1391260,13765,589,3128,IN,Sports
dcii8lk5xQU,Resumen de FC Barcelona vs Deportivo Alavés (2-1),LaLiga Santander,2018-01-28,320683,3174,261,306,IN,Sports
aTauLr_RVms,Valencia vs Real Madrid 1-4 - All Goals & Highlights ● 27/01/2018 HD (First Half),MrMatador,2018-01-27,2459371,11707,3113,2946,IN,Sports
Vxp7RHYaK-g,🔴 [Live] Talwan (Jalandhar) North India Federation Kabaddi Cup 27 Jan 2018,Kabaddi365.com,2018-01-27,169879,1677,129,28,IN,Sports
IBVo8dfqTBc,Rey Mysterio makes a shocking return in the Royal Rumble Match: Royal Rumble 2018 (WWE Network),WWE,2018-01-29,5799849,125916,1692,16056,IN,Sports
bQYdbB6pG_8,🔴 [Live] Akalpur (Jalandhar) North India Federation Kabaddi Cup 29 Jan 2018,Kabaddi365.com,2018-01-29,129836,1279,94,33,IN,Sports
Tg9OdmUD9cE,Barcelona vs Alaves 2-1 - All Goals & Extended Highlights - La Liga 28/01/2018 HD,GOLAZO TV,2018-01-28,2192455,17383,844,3738,IN,Sports
dcii8lk5xQU,Resumen de FC Barcelona vs Deportivo Alavés (2-1),LaLiga Santander,2018-01-28,650768,4937,486,468,IN,Sports
IBVo8dfqTBc,Rey Mysterio makes a shocking return in the Royal Rumble Match: Royal Rumble 2018 (WWE Network),WWE,2018-01-29,7735840,150472,2277,18130,IN,Sports
bQYdbB6pG_8,🔴 [Live] Akalpur (Jalandhar) North India Federation Kabaddi Cup 29 Jan 2018,Kabaddi365.com,2018-01-29,137007,1350,109,43,IN,Sports
Tg9OdmUD9cE,Barcelona vs Alaves 2-1 - All Goals & Extended Highlights - La Liga 28/01/2018 HD,GOLAZO TV,2018-01-28,2343623,17883,883,3769,IN,Sports
IBVo8dfqTBc,Rey Mysterio makes a shocking return in the Royal Rumble Match: Royal Rumble 2018 (WWE Network),WWE,2018-01-29,7735840,150473,2277,18130,IN,Sports
IBVo8dfqTBc,Rey Mysterio makes a shocking return in the Royal Rumble Match: Royal Rumble 2018 (WWE Network),WWE,2018-01-29,9159408,165056,2567,17398,IN,Sports
dcii8lk5xQU,Resumen de FC Barcelona vs Deportivo Alavés (2-1),LaLiga Santander,2018-01-28,760490,5556,622,516,IN,Sports
bQYdbB6pG_8,🔴 [Live] Akalpur (Jalandhar) North India Federation Kabaddi Cup 29 Jan 2018,Kabaddi365.com,2018-01-29,144486,1362,113,44,IN,Sports
IBVo8dfqTBc,Rey Mysterio makes a shocking return in the Royal Rumble Match: Royal Rumble 2018 (WWE Network),WWE,2018-01-29,9159408,165056,2567,17398,IN,Sports
xeLNzNYH5GY,India Vs South Africa 1st ODI: Team India Playing XI | Headlines Sports,Headlines Sports,2018-01-30,311429,5365,983,161,IN,Sports
V0YYbRyH5Ko,🔴 [Live] Kamalpura (Ludhiana) Kabaddi Tournament 30 Jan 2018,Kabaddi365.com,2018-01-30,172932,1863,142,14,IN,Sports
IBVo8dfqTBc,Rey Mysterio makes a shocking return in the Royal Rumble Match: Royal Rumble 2018 (WWE Network),WWE,2018-01-29,10130930,176613,2839,18134,IN,Sports
iNqSrPMt1QM,Mr. Nags' bids adieu to the Terrific Trio | 2018 VIVO IPL,Royal Challengers Bangalore,2018-02-02,62297,3671,58,200,IN,Sports
oVJNzoSKy3o,🔴[Live] Nadala (Kapurthala) North India federation Kabaddi Cup 02 Feb 2018,Kabaddi365.com,2018-02-02,201434,1810,150,11,IN,Sports
41dRU2x6K2c,HIGHLIGHTS: India beat Australia to win the 2018 U19 Cricket World Cup,ICC,2018-02-03,2707789,29341,1362,2200,IN,Sports
K7Dt927Rk0k,"ICC U-19 World Cup Final: India beats Australia by 8 wickets, wins title for record 4 times",News Nation,2018-02-03,297755,1573,139,147,IN,Sports
ce7YDAlIMCA,🔴 🔴 [Live] Bolina (Jalandhar) Punjab Kabaddi Academy Association Cup 03 Feb  2018,Kabaddi365.com,2018-02-03,219031,1734,109,11,IN,Sports
U6b_QeukGuk,Levante vs Real Madrid 2-2 - All Goals & Extended Highlights - La Liga 03/02/2018 HD,GOLAZO TV,2018-02-03,1364333,9082,812,2714,IN,Sports
WmFvh7YNqoA,ARS vs EVE 5-1 All Goals & Highlights 03/02/2018 HD,Wrsh98,2018-02-03,854117,5081,268,537,IN,Sports
ijJwq05GMcQ,ICC Under 19 World Cup FInal: Team India Win world Cup 4th Time | Headlines Sports,Headlines Sports,2018-02-03,72344,562,29,30,IN,Sports
MjnQHnlIZ8U,Resumen de Levante UD vs Real Madrid (2-2),LaLiga Santander,2018-02-03,163353,1298,184,109,IN,Sports
iNqSrPMt1QM,Mr. Nags' bids adieu to the Terrific Trio | 2018 VIVO IPL,Royal Challengers Bangalore,2018-02-02,87744,4446,73,224,IN,Sports
41dRU2x6K2c,HIGHLIGHTS: India beat Australia to win the 2018 U19 Cricket World Cup,ICC,2018-02-03,3970332,36638,1849,2620,IN,Sports
K7Dt927Rk0k,"ICC U-19 World Cup Final: India beats Australia by 8 wickets, wins title for record 4 times",News Nation,2018-02-03,324962,1679,160,162,IN,Sports
ijJwq05GMcQ,ICC Under 19 World Cup FInal: Team India Win world Cup 4th Time | Headlines Sports,Headlines Sports,2018-02-03,80750,597,37,35,IN,Sports
NHPPVfr24-Q,🔴 [Live] Kotla Mehar Singh Wala (Moga) Punjab Kabaddi Academy Association Cup 04 Feb 2018,Kabaddi365.com,2018-02-04,112253,1080,65,7,IN,Sports
U6b_QeukGuk,Levante vs Real Madrid 2-2 - All Goals & Extended Highlights - La Liga 03/02/2018 HD,GOLAZO TV,2018-02-03,2125153,11174,1073,3244,IN,Sports
MjnQHnlIZ8U,Resumen de Levante UD vs Real Madrid (2-2),LaLiga Santander,2018-02-03,483781,2697,527,236,IN,Sports
41dRU2x6K2c,HIGHLIGHTS: India beat Australia to win the 2018 U19 Cricket World Cup,ICC,2018-02-03,4313041,38486,2018,2781,IN,Sports
K7Dt927Rk0k,"ICC U-19 World Cup Final: India beats Australia by 8 wickets, wins title for record 4 times",News Nation,2018-02-03,338672,1722,171,168,IN,Sports
fNDAtrWpzzk,🔴 [Live] Lambra (Nakodar) North India Federation Kabaddi Cup 05 Feb 2018,Kabaddi365.com,2018-02-05,113206,1047,42,5,IN,Sports
U6b_QeukGuk,Levante vs Real Madrid 2-2 - All Goals & Extended Highlights - La Liga 03/02/2018 HD,GOLAZO TV,2018-02-03,2399022,11607,1151,3384,IN,Sports
41dRU2x6K2c,HIGHLIGHTS: India beat Australia to win the 2018 U19 Cricket World Cup,ICC,2018-02-03,4492909,39290,2095,2979,IN,Sports
WpqUOW19aJQ,Model Rocket Battle | Dude Perfect,Dude Perfect,2018-02-05,9651434,432675,4078,33345,IN,Sports
Xwseq5D77GM,"Roman Reigns punches his ticket to the Elimination Chamber Match: Raw, Feb. 5, 2018",WWE,2018-02-06,1212478,27079,2939,3162,IN,Sports
fDaBaRMGqqc,🔴 [Live] Arraicha (Ludhiana) North India Federation Kabaddi Cup 06 Feb 2018,Kabaddi365.com,2018-02-06,177071,1607,127,18,IN,Sports
41dRU2x6K2c,HIGHLIGHTS: India beat Australia to win the 2018 U19 Cricket World Cup,ICC,2018-02-03,4492909,39290,2095,2979,IN,Sports
WpqUOW19aJQ,Model Rocket Battle | Dude Perfect,Dude Perfect,2018-02-05,9651434,432675,4078,33345,IN,Sports
Xwseq5D77GM,"Roman Reigns punches his ticket to the Elimination Chamber Match: Raw, Feb. 5, 2018",WWE,2018-02-06,1212478,27079,2939,3162,IN,Sports
fDaBaRMGqqc,🔴 [Live] Arraicha (Ludhiana) North India Federation Kabaddi Cup 06 Feb 2018,Kabaddi365.com,2018-02-06,177071,1607,127,18,IN,Sports
41dRU2x6K2c,HIGHLIGHTS: India beat Australia to win the 2018 U19 Cricket World Cup,ICC,2018-02-03,4600608,39552,2141,2997,IN,Sports
WpqUOW19aJQ,Model Rocket Battle | Dude Perfect,Dude Perfect,2018-02-05,11150609,464954,4541,35229,IN,Sports
94RfP_GdjtI,"Charlotte Flair vs. Liv Morgan: SmackDown LIVE, Feb. 6, 2018",WWE,2018-02-07,565545,8540,266,840,IN,Sports
fDaBaRMGqqc,🔴 [Live] Arraicha (Ludhiana) North India Federation Kabaddi Cup 06 Feb 2018,Kabaddi365.com,2018-02-06,163330,1671,142,22,IN,Sports
41dRU2x6K2c,HIGHLIGHTS: India beat Australia to win the 2018 U19 Cricket World Cup,ICC,2018-02-03,4600608,39552,2141,2997,IN,Sports
xmupkoVfUnQ,Valencia vs Barcelona 0-2 - All Goals & Extended Highlights - La Copa 08/02/2018 HD,GOLAZO TV,2018-02-08,3077741,25699,1375,2221,IN,Sports
3O8nkBoYQz0,🔴 [Live] Sarhali (Jalandhar) North India Federation Kabaddi Cup 08 Feb 2018,Kabaddi365.com,2018-02-07,208999,1776,127,8,IN,Sports
8OTTQfSZfF0,India vs South Africa 3rd ODI: Virat Kohli scores 34th ODI century | Headlines Sports,Headlines Sports,2018-02-07,349979,1507,265,83,IN,Sports
WpqUOW19aJQ,Model Rocket Battle | Dude Perfect,Dude Perfect,2018-02-05,11896309,478750,4778,36507,IN,Sports
41dRU2x6K2c,HIGHLIGHTS: India beat Australia to win the 2018 U19 Cricket World Cup,ICC,2018-02-03,4660155,39676,2158,3010,IN,Sports
94RfP_GdjtI,"Charlotte Flair vs. Liv Morgan: SmackDown LIVE, Feb. 6, 2018",WWE,2018-02-07,622601,8919,289,870,IN,Sports
xmupkoVfUnQ,Valencia vs Barcelona 0-2 - All Goals & Extended Highlights - La Copa 08/02/2018 HD,GOLAZO TV,2018-02-08,4429364,31434,1823,2750,IN,Sports
3O8nkBoYQz0,🔴 [Live] Sarhali (Jalandhar) North India Federation Kabaddi Cup 08 Feb 2018,Kabaddi365.com,2018-02-07,189071,1803,139,9,IN,Sports
I8wqqsoc7b0,Resumen de Real Madrid vs Real Sociedad (5-2),LaLiga Santander,2018-02-10,296617,3444,281,275,IN,Sports
NEGQ_j5q8mI,Real Madrid vs Real Sociedad 5-2 - All Goals & Highlights ● 10/02/2018 HD (1st half),MrMatador,2018-02-10,933181,5904,1019,674,IN,Sports
BKkRLlHR_Dc,🔴 [Live] Daffar (Hoshiarpur) North India Federation Kabaddi Cup 10 Feb 2018,Kabaddi365.com,2018-02-10,167881,1370,102,7,IN,Sports
46TiqS5SSQw,Manchester United vs Newcastle 4-1 Goals and EXT Highlights with English Commentary 2017-18 HD 720p,TehFuriousD TV,2018-02-10,1100175,6142,643,298,IN,Sports
xmupkoVfUnQ,Valencia vs Barcelona 0-2 - All Goals & Extended Highlights - La Copa 08/02/2018 HD,GOLAZO TV,2018-02-08,4748704,32398,1909,2810,IN,Sports
hIS0nbNy-Ek,🔴 [Live] Sarhala Ranuan (Nawanshahr) North India Federation Kabaddi Cup 11 Feb 2018,Kabaddi365.com,2018-02-11,210706,1997,117,15,IN,Sports
I8wqqsoc7b0,Resumen de Real Madrid vs Real Sociedad (5-2),LaLiga Santander,2018-02-10,764094,6472,710,496,IN,Sports
StVc9S6NYV8,Real Madrid vs Real Sociedad 5-2 - All Goals & Extended Highlights - La Liga 10/02/2018 HD,GOLAZO TV,2018-02-10,1566550,11764,989,2831,IN,Sports
hIS0nbNy-Ek,🔴 [Live] Sarhala Ranuan (Nawanshahr) North India Federation Kabaddi Cup 11 Feb 2018,Kabaddi365.com,2018-02-11,194436,2055,126,20,IN,Sports
I8wqqsoc7b0,Resumen de Real Madrid vs Real Sociedad (5-2),LaLiga Santander,2018-02-10,863419,7298,903,580,IN,Sports
f-xe1qxhcUI,"Braun Strowman bashes Elias with a bass: Raw, Feb. 12, 2018",WWE,2018-02-13,2112381,53247,1292,4735,IN,Sports
e4VmGrGGPuU,Juventus vs Tottenham 2-2 - All Goals & Extended Highlights - Champions League 13/02/2018 HD,GOLAZO TV,2018-02-13,1414634,10432,575,1046,IN,Sports
4Vgigt3S4d4,Basel vs Manchester City 0-4 All Goals & Highlights 13/02/2018 HD,Wrsh98,2018-02-13,762808,3838,374,247,IN,Sports
T0jSxk0BuTE,🔴 [Live] Babeli (Phagwara) Punjab Kabaddi Academy Association Cup 15 Feb 2018,Kabaddi365.com,2018-02-15,174883,1260,75,9,IN,Sports
1WjoLZi6SCI,🔴 [Live] Mothada Kalan (Jalandhar) North India Federation Kabaddi Cup 16 Feb 2018,Kabaddi365.com,2018-02-16,229360,2046,176,22,IN,Sports
1WjoLZi6SCI,🔴 [Live] Mothada Kalan (Jalandhar) North India Federation Kabaddi Cup 16 Feb 2018,Kabaddi365.com,2018-02-16,224545,2162,199,25,IN,Sports
u1kWw6uIBdY,🔴 [Live] Nangal Ambian (Shahkot) North India Federation Kabaddi Cup 18 Feb 2018,Kabaddi365.com,2018-02-18,384689,3854,298,39,IN,Sports
G-ghxQ-09lA,Real Betis vs Real Madrid 3-5 - All Goals & Highlights ● 18/02/2018 HD (1st half),MrMatador,2018-02-18,971403,3881,1697,274,IN,Sports
qZHycHI3F1Q,Football vs Soccer Trick Shots | Dude Perfect,Dude Perfect,2018-02-19,4151801,279527,2495,28691,IN,Sports
u1kWw6uIBdY,🔴 [Live] Nangal Ambian (Shahkot) North India Federation Kabaddi Cup 18 Feb 2018,Kabaddi365.com,2018-02-18,368808,4047,321,53,IN,Sports
Hy8ISlyuz-A,South Africa vs India 1st T20 highlights  : Bhuvneshwar kumar said during taking a man of THE MATCH,NEGA NEWS,2018-02-18,404048,0,0,0,IN,Sports
qCRhteWhEtQ,Chelsea vs Barcelona 1-1 All Goals & Highlights 20/02/2018 HD,Wrsh98,2018-02-20,1240199,6552,521,1044,IN,Sports
qZHycHI3F1Q,Football vs Soccer Trick Shots | Dude Perfect,Dude Perfect,2018-02-19,10929365,508109,6326,47234,IN,Sports
q9vE1kEP7tI,🔴 [Live] Saidowal (Kapurthala) North India Federation Kabaddi Cup 20 Feb 2018,Kabaddi365.com,2018-02-21,217015,1546,120,17,IN,Sports
Cv28C0hqDbY,"A special look at Ronda Rousey: Raw, Feb. 19, 2018",WWE,2018-02-20,920121,16225,843,1883,IN,Sports
qZHycHI3F1Q,Football vs Soccer Trick Shots | Dude Perfect,Dude Perfect,2018-02-19,12948825,552368,7378,51412,IN,Sports
q9vE1kEP7tI,🔴 [Live] Saidowal (Kapurthala) North India Federation Kabaddi Cup 20 Feb 2018,Kabaddi365.com,2018-02-21,178214,1576,127,28,IN,Sports
VjSSwBIH4jc,"Top 10 SmackDown LIVE moments: WWE Top 10, February 20, 2018",WWE,2018-02-21,378089,10897,310,769,IN,Sports
UrenNhrvyVg,🔴 [Live] Rurka Kalan (Jalandhar) North India Federation Kabaddi Cup  22 Feb 2018,Kabaddi365.com,2018-02-22,356263,2686,254,7,IN,Sports
qZHycHI3F1Q,Football vs Soccer Trick Shots | Dude Perfect,Dude Perfect,2018-02-19,13907124,571378,7746,52923,IN,Sports
iZ3v0F75f_I,Multan Sultan Vs Peshawar Zalmi I Short Highlights | PSL 2018 | PSL,Pakistan Super League,2018-02-22,341030,5539,364,498,IN,Sports
xiVFyVNYaXg,Tyson Kidd & Cesaro rewatch the first-ever Tag Team Title Elimination Chamber Match: WWE Playback,WWE,2018-02-22,426204,14909,312,1396,IN,Sports
UrenNhrvyVg,🔴 [Live] Rurka Kalan (Jalandhar) North India Federation Kabaddi Cup  22 Feb 2018,Kabaddi365.com,2018-02-22,307900,2751,265,15,IN,Sports
qZHycHI3F1Q,Football vs Soccer Trick Shots | Dude Perfect,Dude Perfect,2018-02-19,14654718,585763,7996,54262,IN,Sports
iZ3v0F75f_I,Multan Sultan Vs Peshawar Zalmi I Short Highlights | PSL 2018 | PSL,Pakistan Super League,2018-02-22,803697,8019,598,696,IN,Sports
kGyO2J94gno,Real Madrid vs Deportivo Alaves 4-0 - All Goals & Extended Highlights ●  La Liga 24/02/2018 HD,MrMatador,2018-02-24,917467,3940,994,632,IN,Sports
EHlZQr-dbIQ,Resumen de FC Barcelona vs Girona FC (6-1),LaLiga Santander,2018-02-24,401037,5337,312,206,IN,Sports
iOtJvtVHBPs,🔴 [Live] Jandiala Manjki (Jalandhar) Punjab Kabaddi Academy Association Cup  24 Feb 2018,Kabaddi365.com,2018-02-24,275118,2507,215,39,IN,Sports
dN5eLAh2obA,Short Highlights | Peshawar Zalmi Vs Islamabad United | Match 4 | HBL PSL 2018 | 24 Feb | PSL,Pakistan Super League,2018-02-24,209346,2189,159,162,IN,Sports
kGyO2J94gno,Real Madrid vs Deportivo Alaves 4-0 - All Goals & Extended Highlights ●  La Liga 24/02/2018 HD,MrMatador,2018-02-24,1149601,4415,1159,673,IN,Sports
vq66Z83lldM,🔴 [Live] Gharuan (Mohali) North India Federation Kabaddi Cup 25 Feb 2018,Kabaddi365.com,2018-02-25,218823,1742,137,13,IN,Sports
EHlZQr-dbIQ,Resumen de FC Barcelona vs Girona FC (6-1),LaLiga Santander,2018-02-24,1239338,11155,890,447,IN,Sports
UsciN7COX1g,Ronda Rousey puts Triple H through a table at her contract signing: WWE Elimination Chamber 2018,WWE,2018-02-26,2788033,39291,2447,5223,IN,Sports
7BaquTQzQgo,🔴 [Live] Khadur Sahib (Amritsar) North India Federation Kabaddi Cup 26 Feb 2018,Kabaddi365.com,2018-02-26,233418,1666,101,12,IN,Sports
UsciN7COX1g,Ronda Rousey puts Triple H through a table at her contract signing: WWE Elimination Chamber 2018,WWE,2018-02-26,2788033,39291,2447,5223,IN,Sports
gU1RxhTB71E,"Roman Reigns lays into absent, “entitled” Brock Lesnar: Raw, Feb. 26, 2018",WWE,2018-02-27,1508277,41380,3393,8043,IN,Sports
gU1RxhTB71E,"Roman Reigns lays into absent, “entitled” Brock Lesnar: Raw, Feb. 26, 2018",WWE,2018-02-27,1508277,41380,3393,8043,IN,Sports
gU1RxhTB71E,"Roman Reigns lays into absent, “entitled” Brock Lesnar: Raw, Feb. 26, 2018",WWE,2018-02-27,1735935,44307,3575,8701,IN,Sports
YBW3mm63EYI,🔴 [Live] Anandpur Sahib North India Federation Kabaddi Cup 01 Mar 2018,Kabaddi365.com,2018-03-01,499991,3834,340,21,IN,Sports
ZDz89bDGT0k,Resumen de UD Las Palmas vs FC Barcelona (1-1),LaLiga Santander,2018-03-01,296663,2587,288,267,IN,Sports
fMU6ZvKT3X4,Las Palmas vs Barcelona 1-1 - All Goals & Extended Highlights - La Liga 01/03/2018 HD,GOLAZO TV,2018-03-01,937221,5976,621,1446,IN,Sports
YBW3mm63EYI,🔴 [Live] Anandpur Sahib North India Federation Kabaddi Cup 01 Mar 2018,Kabaddi365.com,2018-03-01,499991,3834,340,21,IN,Sports
YBW3mm63EYI,🔴 [Live] Anandpur Sahib North India Federation Kabaddi Cup 01 Mar 2018,Kabaddi365.com,2018-03-01,438829,3934,360,26,IN,Sports
fMU6ZvKT3X4,Las Palmas vs Barcelona 1-1 - All Goals & Extended Highlights - La Liga 01/03/2018 HD,GOLAZO TV,2018-03-01,1290080,7282,752,1721,IN,Sports
ZDz89bDGT0k,Resumen de UD Las Palmas vs FC Barcelona (1-1),LaLiga Santander,2018-03-01,770825,5124,847,581,IN,Sports
NiBIt4CuShY,Real Madrid vs Getafe 3-1 - All Goals & Extended Highlights ● 03/03/2018 HD (1st Half),MrMatador,2018-03-03,905331,5153,1463,401,IN,Sports
Jxc7SBL5TbE,Barcelona vs Atletico Madrid 1-0 - All Goals & Highlights ● LA LIGA 04/03/2018 HD (First Half),MrMatador,2018-03-04,1401037,9520,1323,809,IN,Sports
T37rjrt98q8,Resumen de FC Barcelona vs Atlético de Madrid (1-0),LaLiga Santander,2018-03-04,503864,5264,475,222,IN,Sports
fEFAQ2j7KyE,🔴 [Live] Dalewal (Jalandhar) North India Federation Kabaddi Cup 04 Mar 2018,Kabaddi365.com,2018-03-04,210419,1700,133,8,IN,Sports
MuPL-PSMX0Q,World's Longest LEGO Walk | Dude Perfect,Dude Perfect,2018-03-05,4852889,242769,7677,24081,IN,Sports
QhGprUmrA8U,🔴 [Live] Jangiana (Barnala) North India Federation Kabaddi Cup 05 Mar 2018,Kabaddi365.com,2018-03-05,237419,1761,135,4,IN,Sports
yAZkC7nM0d4,"5 things you need to know before tonight's Raw: March 5, 2018",WWE,2018-03-05,307215,7845,294,916,IN,Sports
Jxc7SBL5TbE,Barcelona vs Atletico Madrid 1-0 - All Goals & Highlights ● LA LIGA 04/03/2018 HD (First Half),MrMatador,2018-03-04,1692435,10695,1453,864,IN,Sports
DfeScRY4jd4,Resumen de Real Madrid vs Getafe CF (3-1),LaLiga Santander,2018-03-03,1005012,7568,1112,284,IN,Sports
MuPL-PSMX0Q,World's Longest LEGO Walk | Dude Perfect,Dude Perfect,2018-03-05,11887211,391496,15821,35224,IN,Sports
1H2cIiV49H8,🔴 [Live] Jodhan (Ludhiana) Punjab Kabaddi Academy Association Cup 06 Mar 2018,Kabaddi365.com,2018-03-06,170426,1433,105,3,IN,Sports
Txogjk7J-7k,Bhavnagar:26 of marriage party died as Truck plunges into gorge:CM orders to provide help to victims,Tv9 Gujarati,2018-03-06,142788,416,79,33,IN,Sports
MuPL-PSMX0Q,World's Longest LEGO Walk | Dude Perfect,Dude Perfect,2018-03-05,13740772,421047,17977,37341,IN,Sports
NonKN3YAMHE,Barcelona vs Espanyol 0-0 (4-2) - Highlights & Penalty Shootout - Catalan Cup 07/03/2018 HD,GOLAZO TV,2018-03-07,1920130,13269,957,1084,IN,Sports
Txogjk7J-7k,Bhavnagar:26 of marriage party died as Truck plunges into gorge:CM orders to provide help to victims,Tv9 Gujarati,2018-03-06,333430,751,153,57,IN,Sports
e1-OxAy9uxM,"AJ Styles responds to John Cena's WrestleMania suggestions: SmackDown LIVE, March 6, 2018",WWE,2018-03-07,963847,16557,780,1962,IN,Sports
MhD3RqmvLwo,🔴 [Live] Ratna (Ludhiana) Kabaddi Tournament 07 Mar 2018,Kabaddi365.com,2018-03-07,137883,1053,47,1,IN,Sports
MuPL-PSMX0Q,World's Longest LEGO Walk | Dude Perfect,Dude Perfect,2018-03-05,15088864,437116,19257,38885,IN,Sports
kot_17IgBpU,🔴 [Live] Baidwala (Sirsa) Kabaddi Championship 08 Mar 2018,Kabaddi365.com,2018-03-08,201997,1607,145,0,IN,Sports
NonKN3YAMHE,Barcelona vs Espanyol 0-0 (4-2) - Highlights & Penalty Shootout - Catalan Cup 07/03/2018 HD,GOLAZO TV,2018-03-07,2432130,15263,1140,1252,IN,Sports
tT70QEa5qdQ,🔴 [Live] Mansoorwal Bet (Kapurthala) North India Federation Kabaddi Cup  09 Mar 2018,Kabaddi365.com,2018-03-09,195377,1446,112,0,IN,Sports
vDUasQsg178,5 bones broken by Brock Lesnar: WWE List This!,WWE,2018-03-09,968969,16658,1206,2233,IN,Sports
MuPL-PSMX0Q,World's Longest LEGO Walk | Dude Perfect,Dude Perfect,2018-03-05,16363949,450655,20389,39970,IN,Sports
HS-JpLtk1Ek,Mini Highlights | Quetta Gladiators vs  Karachi Kings | Match 19 | 8 March | HBL PSL 2018,Pakistan Super League,2018-03-09,495802,2740,348,316,IN,Sports
Hb-1swI5E_0,Malaga vs Barcelona 0-2 - All Goals & Extended Highlights - La Liga 10/03/2018 HD,GOLAZO TV,2018-03-10,1557828,11482,740,1371,IN,Sports
SN_sa-BBugU,Resumen de Málaga CF vs FC Barcelona (0-2),LaLiga Santander,2018-03-10,273563,2463,239,58,IN,Sports
vDUasQsg178,5 bones broken by Brock Lesnar: WWE List This!,WWE,2018-03-09,1467677,19966,1532,2483,IN,Sports
ovieh5hTzz0,🔴 [Live] Brahmpuri (Nawanshahr) Kabaddi Tournament 10 Mar 2018,Kabaddi365.com,2018-03-11,124247,1047,46,8,IN,Sports
b25zVPsXcRo,Malaga vs Barcelona 0-2 - All Goals & Highlights ● LA LIGA 10/03/2018 HD (FIRST HALF),MrMatador,2018-03-10,894868,6560,476,292,IN,Sports
LlRZu9UeMMc,Braun Strowman vents his frustration with a patriotic response on WWE MMC,WWE,2018-03-11,637514,13628,540,904,IN,Sports
xqMyxS8Y13o,🔴 [Live] Amargarh (Sangrur) Kabaddi Tournament  11 Mar 2018,Kabaddi365.com,2018-03-11,177022,1759,95,3,IN,Sports
Hb-1swI5E_0,Malaga vs Barcelona 0-2 - All Goals & Extended Highlights - La Liga 10/03/2018 HD,GOLAZO TV,2018-03-10,2235534,14017,963,1549,IN,Sports
SN_sa-BBugU,Resumen de Málaga CF vs FC Barcelona (0-2),LaLiga Santander,2018-03-10,770274,5387,720,149,IN,Sports
LlRZu9UeMMc,Braun Strowman vents his frustration with a patriotic response on WWE MMC,WWE,2018-03-11,818318,14775,663,963,IN,Sports
vO7odIj77No,Want to see my family happy again: Mohammed Shami to India TV,IndiaTV,2018-03-11,205814,1795,230,507,IN,Sports
xqMyxS8Y13o,🔴 [Live] Amargarh (Sangrur) Kabaddi Tournament  11 Mar 2018,Kabaddi365.com,2018-03-11,145139,1774,98,2,IN,Sports
Hb-1swI5E_0,Malaga vs Barcelona 0-2 - All Goals & Extended Highlights - La Liga 10/03/2018 HD,GOLAZO TV,2018-03-10,2370178,14406,1006,1585,IN,Sports
LlRZu9UeMMc,Braun Strowman vents his frustration with a patriotic response on WWE MMC,WWE,2018-03-11,886254,14977,696,972,IN,Sports
vO7odIj77No,Want to see my family happy again: Mohammed Shami to India TV,IndiaTV,2018-03-11,207746,1804,234,509,IN,Sports
xqMyxS8Y13o,🔴 [Live] Amargarh (Sangrur) Kabaddi Tournament  11 Mar 2018,Kabaddi365.com,2018-03-11,148237,1776,99,2,IN,Sports
Hb-1swI5E_0,Malaga vs Barcelona 0-2 - All Goals & Extended Highlights - La Liga 10/03/2018 HD,GOLAZO TV,2018-03-10,2429275,14517,1024,1588,IN,Sports
9dHLFD_Jveo,"Mr. McMahon suspends Roman Reigns: Raw, March 12, 2018",WWE,2018-03-13,1919951,27873,3538,4995,IN,Sports
9dHLFD_Jveo,"Mr. McMahon suspends Roman Reigns: Raw, March 12, 2018",WWE,2018-03-13,1919951,27873,3538,4995,IN,Sports
8JUu6zCg3Ig,"गोरखपुर में हार के बाद योगी ने डीएम को दिए खतरनाक आदेश, यूपी उपचुनाव / Gorakhpur Yogi",Gnews,2018-03-14,846092,2892,986,780,IN,Sports
w9Xyz56v7Us,🔴 [Live] Bhogiwal (Malerkotla) Kabaddi Tournament 15 Mar 2018,Kabaddi365.com,2018-03-15,243285,2081,156,3,IN,Sports
9dHLFD_Jveo,"Mr. McMahon suspends Roman Reigns: Raw, March 12, 2018",WWE,2018-03-13,2026827,28553,3710,4246,IN,Sports
8JUu6zCg3Ig,"गोरखपुर में हार के बाद योगी ने डीएम को दिए खतरनाक आदेश, यूपी उपचुनाव / Gorakhpur Yogi",Gnews,2018-03-14,1094034,3850,1554,1143,IN,Sports
6KbUS33vOqQ,WrestleMania 35's high-profile press conference descends on MetLife Stadium,WWE,2018-03-16,685077,0,0,1183,IN,Sports
snYhOXzgn9g,🔴 [Live] Jhaloor (Barnala) Kabaddi Tournament  15 Mar 2018,Kabaddi365.com,2018-03-15,180610,1651,87,3,IN,Sports
8JUu6zCg3Ig,"गोरखपुर में हार के बाद योगी ने डीएम को दिए खतरनाक आदेश, यूपी उपचुनाव / Gorakhpur Yogi",Gnews,2018-03-14,1094034,3850,1554,1143,IN,Sports
8JUu6zCg3Ig,"गोरखपुर में हार के बाद योगी ने डीएम को दिए खतरनाक आदेश, यूपी उपचुनाव / Gorakhpur Yogi",Gnews,2018-03-14,1178894,4063,1672,1185,IN,Sports
W5jce_ZxvoA,🔴 [Live] Bhano Langa (Kapurthala) Kabaddi Tournament 17 Mar 2018,Kabaddi365.com,2018-03-17,222719,1568,105,0,IN,Sports
FVe1otlBNf8,"Funniest WrestleMania moments: WWE Top 10, March 17, 2018",WWE,2018-03-17,975738,20429,824,1179,IN,Sports
XJBEZ-lnvlM,Winner of DEADLIFT CHALLENGE - Guru Mann Deadlift Challenge,Health And Fitness,2018-03-17,222305,12104,214,917,IN,Sports
tMJM6B4HHt8,Resumen de Real Madrid vs Girona FC (6-3),LaLiga Santander,2018-03-18,349734,2800,333,216,IN,Sports
dswzUry69cE,"अब योगी मस्जिद जाएंगे, गोरखपुर हार के बाद 6 बड़े फैसले, जानकर दिमाग हिल जायेगा / Gorakhpur CM yogi",Gnews,2018-03-18,249167,639,314,137,IN,Sports
pjyVGBFu_z4,🔴 [Live] Lambra (Jalandhar) Punjab Kabaddi Academy Association Cup  18 Mar 2018,Kabaddi365.com,2018-03-18,168426,1299,80,3,IN,Sports
S7b6AzisWUU,Real Madrid vs Girona 6-3 All Goals & Highlights (FH) 18/03/2018 HD,Fazzer,2018-03-18,636373,0,0,261,IN,Sports
gWpIelc_xrI,Barcelona vs Athletic Bilbao 2-0 - All Goals & Extended Highlights - La Liga 18/03/2018 HD,GOLAZO TV,2018-03-18,1629178,12301,558,1095,IN,Sports
kQzefga4v6c,Rohit Sharma on India's Win Over Bangladesh | The Quint,The Quint,2018-03-18,165969,893,68,141,IN,Sports
tMJM6B4HHt8,Resumen de Real Madrid vs Girona FC (6-3),LaLiga Santander,2018-03-18,349734,2800,333,216,IN,Sports
476M0nR46bs,"कोई नहीं जानता जो अंतिम बॉल पर हुआ, होश उड़ा देगा, सबसे छुपाया गया - IND VS BAN - T20 FINAL",Gnews,2018-03-19,595609,0,0,0,IN,Sports
tMJM6B4HHt8,Resumen de Real Madrid vs Girona FC (6-3),LaLiga Santander,2018-03-18,845344,5900,839,439,IN,Sports
9Lewz31ne3Q,🔴 [Live] Saner (Zira) Kabaddi Tournament 19 Mar 2018,Kabaddi365.com,2018-03-20,244522,1750,164,1,IN,Sports
S7b6AzisWUU,Real Madrid vs Girona 6-3 All Goals & Highlights (FH) 18/03/2018 HD,Fazzer,2018-03-18,926690,0,0,342,IN,Sports
gWpIelc_xrI,Barcelona vs Athletic Bilbao 2-0 - All Goals & Extended Highlights - La Liga 18/03/2018 HD,GOLAZO TV,2018-03-18,1896590,13515,632,1187,IN,Sports
kQzefga4v6c,Rohit Sharma on India's Win Over Bangladesh | The Quint,The Quint,2018-03-18,311202,1289,115,202,IN,Sports
476M0nR46bs,"कोई नहीं जानता जो अंतिम बॉल पर हुआ, होश उड़ा देगा, सबसे छुपाया गया - IND VS BAN - T20 FINAL",Gnews,2018-03-19,595609,0,0,0,IN,Sports
FFsp5b4AUTE,"Roman Reigns is brutally ambushed by Brock Lesnar: Raw, March 19, 2018",WWE,2018-03-20,5635250,73400,13195,17122,IN,Sports
476M0nR46bs,"कोई नहीं जानता जो अंतिम बॉल पर हुआ, होश उड़ा देगा, सबसे छुपाया गया - IND VS BAN - T20 FINAL",Gnews,2018-03-19,1052119,0,0,0,IN,Sports
N9aWlYpMS98,🔴 [Live] Barnala Kabaddi Tournament 20 Mar 2018,Kabaddi365.com,2018-03-20,268538,1912,161,5,IN,Sports
FFsp5b4AUTE,"Roman Reigns is brutally ambushed by Brock Lesnar: Raw, March 19, 2018",WWE,2018-03-20,7286159,84386,16406,19528,IN,Sports
476M0nR46bs,"कोई नहीं जानता जो अंतिम बॉल पर हुआ, होश उड़ा देगा, सबसे छुपाया गया - IND VS BAN - T20 FINAL",Gnews,2018-03-19,1426556,0,0,0,IN,Sports
N9aWlYpMS98,🔴 [Live] Barnala Kabaddi Tournament 20 Mar 2018,Kabaddi365.com,2018-03-20,225795,1944,171,6,IN,Sports
FFsp5b4AUTE,"Roman Reigns is brutally ambushed by Brock Lesnar: Raw, March 19, 2018",WWE,2018-03-20,7286159,84386,16406,19528,IN,Sports
476M0nR46bs,"कोई नहीं जानता जो अंतिम बॉल पर हुआ, होश उड़ा देगा, सबसे छुपाया गया - IND VS BAN - T20 FINAL",Gnews,2018-03-19,1426556,0,0,0,IN,Sports
FFsp5b4AUTE,"Roman Reigns is brutally ambushed by Brock Lesnar: Raw, March 19, 2018",WWE,2018-03-20,8198243,88916,17628,20555,IN,Sports
476M0nR46bs,"कोई नहीं जानता जो अंतिम बॉल पर हुआ, होश उड़ा देगा, सबसे छुपाया गया - IND VS BAN - T20 FINAL",Gnews,2018-03-19,1615977,0,0,0,IN,Sports
_8C9X2XsWbc,🔴 [Live] Machhi bugra (Firozpur) Kabaddi Tournament 21 Mar 2018,Kabaddi365.com,2018-03-21,239305,2181,177,7,IN,Sports
FAZRYM9z-ZM,"आखिर पता चल गया की राजा भैया ने किसे वोट दिया, खुद ही देखिए किसने किसे वोट दिया / Yogi / Rajya Sabha",Gnews,2018-03-23,144193,340,88,28,IN,Sports
FFsp5b4AUTE,"Roman Reigns is brutally ambushed by Brock Lesnar: Raw, March 19, 2018",WWE,2018-03-20,8718657,91398,18207,21050,IN,Sports
FgF5O1nt4QA,🔴 [Live] Bassian (Ludhiana) Kabaddi Tournament 23 Mar 2018,Kabaddi365.com,2018-03-23,316024,2466,210,0,IN,Sports
FAZRYM9z-ZM,"आखिर पता चल गया की राजा भैया ने किसे वोट दिया, खुद ही देखिए किसने किसे वोट दिया / Yogi / Rajya Sabha",Gnews,2018-03-23,335209,637,250,94,IN,Sports
ws2cJVuTtJc,FULL MATCH - Triple H vs. Brock Lesnar - No Holds Barred Match: WrestleMania 29 (WWE Network),WWE,2018-03-24,878312,23324,1116,2942,IN,Sports
go2PlAmR3no,🔴 [Live] Khera Bet (Kapurthala) Kabaddi Tournament 24 Mar 2018,Kabaddi365.com,2018-03-24,174187,1313,83,4,IN,Sports
ex6aFxPb8Q4,Winner of BICEP CURL CHALLENGE - Guru Mann BICEP CURL CHALLENGE,Health And Fitness,2018-03-24,176140,8717,209,727,IN,Sports
Q3Iq9FwbdTk,"ट्रक ने ठोकर मारकर मोहम्मद शमी को घायल किया, IPL से हुए बाहर? अभी अभी क्रिकेट जगत में शोक",Gnews,2018-03-25,591029,2009,570,307,IN,Sports
1LOYHEM_P58,FULL SEGMENT - The Rock and Ronda Rousey confront The Authority: WrestleMania 31 (WWE Network),WWE,2018-03-25,1393660,31774,1401,3319,IN,Sports
go2PlAmR3no,🔴 [Live] Khera Bet (Kapurthala) Kabaddi Tournament 24 Mar 2018,Kabaddi365.com,2018-03-24,170200,1323,87,4,IN,Sports
SZZ0GwjnHMM,🔴 [Live] Otalan (Ludhiana) Kabaddi Tournament 26 Mar 2018,Kabaddi365.com,2018-03-26,171029,1230,70,4,IN,Sports
1LOYHEM_P58,FULL SEGMENT - The Rock and Ronda Rousey confront The Authority: WrestleMania 31 (WWE Network),WWE,2018-03-25,2697951,45780,2329,4080,IN,Sports
Q3Iq9FwbdTk,"ट्रक ने ठोकर मारकर मोहम्मद शमी को घायल किया, IPL से हुए बाहर? अभी अभी क्रिकेट जगत में शोक",Gnews,2018-03-25,738714,2326,720,332,IN,Sports
qlEe2iykVy4,Week 3 - SHOULDER PRESS CHALLENGE l Guru Mann Challenge Series,Health And Fitness,2018-03-26,116716,6333,112,654,IN,Sports
S9KxqRUcnCU,Boomerang Trick Shots | Dude Perfect,Dude Perfect,2018-03-26,12213413,620701,8807,27642,IN,Sports
1LOYHEM_P58,FULL SEGMENT - The Rock and Ronda Rousey confront The Authority: WrestleMania 31 (WWE Network),WWE,2018-03-25,3069534,48461,2547,4266,IN,Sports
SZZ0GwjnHMM,🔴 [Live] Otalan (Ludhiana) Kabaddi Tournament 26 Mar 2018,Kabaddi365.com,2018-03-26,142430,1264,73,7,IN,Sports
S9KxqRUcnCU,Boomerang Trick Shots | Dude Perfect,Dude Perfect,2018-03-26,12213413,620702,8807,27642,IN,Sports
HXFfY-MBPGc,अभी श्रीदेवी की गम से बाहर भी नहीं आया बॉलीवुड तबतक इस खबर ने सबको झकझोर दिया। ...,Gnews,2018-03-28,180558,409,329,90,IN,Sports
S9KxqRUcnCU,Boomerang Trick Shots | Dude Perfect,Dude Perfect,2018-03-26,15295839,701921,11126,30710,IN,Sports
xM5y92gT_cI,Russia Vs France 1-3 - All Goals & Highlights - Resumen y Goles 27/03/2018 HD,NugoBasilaiaa,2018-03-27,2361105,7956,695,1747,IN,Sports
XnRs9InyaA0,"Daniel Bryan issues WrestleMania challenge to Kevin Owens & Sami Zayn:SmackDown LIVE, March 27, 2018",WWE,2018-03-28,1766208,39193,991,4189,IN,Sports
o5_Vpc7c8Lo,🔴 [Live] Lande (Moga) Kabaddi Tournament 27 Mar 2018,Kabaddi365.com,2018-03-27,208724,1505,150,3,IN,Sports
HXFfY-MBPGc,अभी श्रीदेवी की गम से बाहर भी नहीं आया बॉलीवुड तबतक इस खबर ने सबको झकझोर दिया। ...,Gnews,2018-03-28,180558,409,329,90,IN,Sports
S9KxqRUcnCU,Boomerang Trick Shots | Dude Perfect,Dude Perfect,2018-03-26,15295839,701921,11126,30710,IN,Sports
G3x4lx0kbqg,"Steve Smith Breaks Down, Says He’s ‘Absolutely Devastated’ | The Quint",The Quint,2018-03-29,240743,3191,197,1211,IN,Sports
S9KxqRUcnCU,Boomerang Trick Shots | Dude Perfect,Dude Perfect,2018-03-26,17433516,747641,12441,32529,IN,Sports
LIjO3XNci7U,Indian Cricketers Open Up On Ball-Tampering Scandal And IPL 2018,NDTV,2018-03-28,314265,2132,177,262,IN,Sports
I_HS5XouqXM,"FULL MATCH - Randy Orton, Sheamus & Big Show vs. The Shield: WrestleMania 29 (WWE Network)",WWE,2018-03-29,744923,19085,788,1706,IN,Sports
xM5y92gT_cI,Russia Vs France 1-3 - All Goals & Highlights - Resumen y Goles 27/03/2018 HD,NugoBasilaiaa,2018-03-27,2639852,8458,755,1828,IN,Sports
dGB0iwnbZhY,🔴 [Live] Mana Singh Wala (Firozpur) Kabaddi Tournament 29 Mar 2018,Kabaddi365.com,2018-03-30,113755,825,48,0,IN,Sports
G3x4lx0kbqg,"Steve Smith Breaks Down, Says He’s ‘Absolutely Devastated’ | The Quint",The Quint,2018-03-29,240743,3191,197,1211,IN,Sports
vzqiIwPdXAc,🔴 [Live] Bhairupa (Bathinda) Kabaddi Tournament 30 Mar 2018,Kabaddi365.com,2018-03-30,292024,2687,269,9,IN,Sports
G3x4lx0kbqg,"Steve Smith Breaks Down, Says He’s ‘Absolutely Devastated’ | The Quint",The Quint,2018-03-29,272360,3343,211,1224,IN,Sports
vzqiIwPdXAc,🔴 [Live] Bhairupa (Bathinda) Kabaddi Tournament 30 Mar 2018,Kabaddi365.com,2018-03-30,292024,2687,269,9,IN,Sports
xzzs_1EdfJo,Sevilla Vs Barcelona 2-2 - All Goals & Highlights - Resumen y Goles 31/03/2018 HD,NugoBasilaiaa,2018-03-31,3192364,19659,2212,2212,IN,Sports
5000ZcHiMws,Resumen de Sevilla FC vs FC Barcelona (2-2),LaLiga Santander,2018-03-31,374036,3014,339,245,IN,Sports
vzqiIwPdXAc,🔴 [Live] Bhairupa (Bathinda) Kabaddi Tournament 30 Mar 2018,Kabaddi365.com,2018-03-30,315649,2757,283,11,IN,Sports
-27pqCGF5zw,"Greatest WrestleMania endings: WWE Top 10, March 31, 2018",WWE,2018-03-31,904082,21269,725,2138,IN,Sports
xzzs_1EdfJo,Sevilla Vs Barcelona 2-2 - All Goals & Highlights - Resumen y Goles 31/03/2018 HD,NugoBasilaiaa,2018-03-31,3192364,19659,2212,2212,IN,Sports
xzzs_1EdfJo,Sevilla Vs Barcelona 2-2 - All Goals & Highlights - Resumen y Goles 31/03/2018 HD,NugoBasilaiaa,2018-03-31,4955919,26085,3529,2801,IN,Sports
5000ZcHiMws,Resumen de Sevilla FC vs FC Barcelona (2-2),LaLiga Santander,2018-03-31,1255386,7766,980,518,IN,Sports
0-xwTI8MKO8,#VIVOIPL 2018: Mumbai Indians vs Chennai Super Kings,Star Sports,2018-04-01,3174035,12969,338,1572,IN,Sports
vzqiIwPdXAc,🔴 [Live] Bhairupa (Bathinda) Kabaddi Tournament 30 Mar 2018,Kabaddi365.com,2018-03-30,319705,2769,287,11,IN,Sports
GBTV5ekQwWw,"Stephanie McMahon sends Ronda Rousey crashing through a table: Raw, April 2, 2018",WWE,2018-04-03,1054453,20084,2202,3658,IN,Sports
xzzs_1EdfJo,Sevilla Vs Barcelona 2-2 - All Goals & Highlights - Resumen y Goles 31/03/2018 HD,NugoBasilaiaa,2018-03-31,5250265,27042,3796,2890,IN,Sports
GBTV5ekQwWw,"Stephanie McMahon sends Ronda Rousey crashing through a table: Raw, April 2, 2018",WWE,2018-04-03,1054453,20085,2202,3658,IN,Sports
bIOpP1qC5Jw,#VIVOIPL ni Telugu lo chudadaaniki siddamaina Jr. NTR,Star Sports,2018-04-03,298701,13039,545,691,IN,Sports
GlngwhWaLBs,"Roman Reigns unleashes on Brock Lesnar before WrestleMania: Raw, April 2, 2018",WWE,2018-04-03,6270936,96933,6706,11212,IN,Sports
76hxU2wIuGE,🔴 [Live] Bhaini Bahia (Bathinda) Kabaddi Tournament 03 Apr 2018,Kabaddi365.com,2018-04-03,179044,1442,86,3,IN,Sports
dVg4z5TQ0D4,WWE Smackdown 3/4/2018 Hghlights HD - WWE Smackdown 3 April 2018 Highlights HD,Wrestling Reality,2018-04-04,161715,4402,170,201,IN,Sports
bIOpP1qC5Jw,#VIVOIPL ni Telugu lo chudadaaniki siddamaina Jr. NTR,Star Sports,2018-04-03,298701,13039,545,691,IN,Sports
GlngwhWaLBs,"Roman Reigns unleashes on Brock Lesnar before WrestleMania: Raw, April 2, 2018",WWE,2018-04-03,6270936,96934,6706,11212,IN,Sports
bIOpP1qC5Jw,#VIVOIPL ni Telugu lo chudadaaniki siddamaina Jr. NTR,Star Sports,2018-04-03,760359,20293,1106,1033,IN,Sports
GlngwhWaLBs,"Roman Reigns unleashes on Brock Lesnar before WrestleMania: Raw, April 2, 2018",WWE,2018-04-03,7773268,109532,7837,12138,IN,Sports
bIOpP1qC5Jw,#VIVOIPL ni Telugu lo chudadaaniki siddamaina Jr. NTR,Star Sports,2018-04-03,760359,20293,1106,1033,IN,Sports
GlngwhWaLBs,"Roman Reigns unleashes on Brock Lesnar before WrestleMania: Raw, April 2, 2018",WWE,2018-04-03,7773268,109532,7837,12138,IN,Sports
bIOpP1qC5Jw,#VIVOIPL ni Telugu lo chudadaaniki siddamaina Jr. NTR,Star Sports,2018-04-03,936743,23156,1497,1198,IN,Sports
ED5w-Cm4BDs,Nagumentry to end all dacumentaries! | #RCBInsider 4.0,Royal Challengers Bangalore,2018-04-05,166143,10135,166,681,IN,Sports
GlngwhWaLBs,"Roman Reigns unleashes on Brock Lesnar before WrestleMania: Raw, April 2, 2018",WWE,2018-04-03,8755813,115640,8517,12562,IN,Sports
bIOpP1qC5Jw,#VIVOIPL ni Telugu lo chudadaaniki siddamaina Jr. NTR,Star Sports,2018-04-03,936743,23156,1497,1198,IN,Sports
ED5w-Cm4BDs,Nagumentry to end all dacumentaries! | #RCBInsider 4.0,Royal Challengers Bangalore,2018-04-05,166143,10135,166,681,IN,Sports
GlngwhWaLBs,"Roman Reigns unleashes on Brock Lesnar before WrestleMania: Raw, April 2, 2018",WWE,2018-04-03,8755813,115640,8517,12562,IN,Sports
bIOpP1qC5Jw,#VIVOIPL ni Telugu lo chudadaaniki siddamaina Jr. NTR,Star Sports,2018-04-03,1011117,24142,1584,1223,IN,Sports
ED5w-Cm4BDs,Nagumentry to end all dacumentaries! | #RCBInsider 4.0,Royal Challengers Bangalore,2018-04-05,219690,11659,199,676,IN,Sports
e7E7Jj1yLuA,"WWE Hall of Fame 2018 Red Carpet LIVE: April 6, 2018",WWE,2018-04-07,563675,15071,532,838,IN,Sports
h9cs3ah1huM,🔴 [Live] Dugal (Patiala) Kabaddi Tournament 06 Apr 2018,Kabaddi365.com,2018-04-06,346628,3000,261,15,IN,Sports
bIOpP1qC5Jw,#VIVOIPL ni Telugu lo chudadaaniki siddamaina Jr. NTR,Star Sports,2018-04-03,1011117,24142,1584,1223,IN,Sports
ED5w-Cm4BDs,Nagumentry to end all dacumentaries! | #RCBInsider 4.0,Royal Challengers Bangalore,2018-04-05,219690,11659,199,676,IN,Sports
vWio5TorrHw,வந்துட்டான்யா.. வந்துட்டான்யா.. CSK-விற்கு களமிறங்கியிருக்கும் புதிய சிங்கம்! அதிரடி ஆரம்பம்,Tamil Thimiru,2018-04-13,97288,2346,53,91,IN,Sports
vWio5TorrHw,வந்துட்டான்யா.. வந்துட்டான்யா.. CSK-விற்கு களமிறங்கியிருக்கும் புதிய சிங்கம்! அதிரடி ஆரம்பம்,Tamil Thimiru,2018-04-13,162397,3256,99,123,IN,Sports
vWio5TorrHw,வந்துட்டான்யா.. வந்துட்டான்யா.. CSK-விற்கு களமிறங்கியிருக்கும் புதிய சிங்கம்! அதிரடி ஆரம்பம்,Tamil Thimiru,2018-04-13,200793,3583,129,132,IN,Sports
nvOrYzltjb0,Resumen de Málaga CF vs Real Madrid (1-2),LaLiga Santander,2018-04-15,303565,2787,290,96,IN,Sports
nvOrYzltjb0,Resumen de Málaga CF vs Real Madrid (1-2),LaLiga Santander,2018-04-15,796369,5644,855,191,IN,Sports
gR0pSSISaVk,"Ronda Rousey helps Natalya fend off Absolution: Raw, April 16, 2018",WWE,2018-04-17,4222286,45310,2376,4345,IN,Sports
Op81YCCo69A,Resumen de RC Celta vs FC Barcelona (2-2),LaLiga Santander,2018-04-17,279065,2303,352,195,IN,Sports
gR0pSSISaVk,"Ronda Rousey helps Natalya fend off Absolution: Raw, April 16, 2018",WWE,2018-04-17,4222286,45310,2376,4345,IN,Sports
gR0pSSISaVk,"Ronda Rousey helps Natalya fend off Absolution: Raw, April 16, 2018",WWE,2018-04-17,4992619,49407,3032,5110,IN,Sports
"#NAME?",CSK VS KXIP Super Sixes Challenge - VIVO IPL,Sports Blast,2018-04-15,3667636,13168,3255,75,IN,Sports
gR0pSSISaVk,"Ronda Rousey helps Natalya fend off Absolution: Raw, April 16, 2018",WWE,2018-04-17,5451646,51723,3351,5498,IN,Sports
2vxDqHrXLzs,Resumen de Real Madrid vs Athletic Club (1-1),LaLiga Santander,2018-04-18,624570,4061,683,414,IN,Sports
jzvlDbGUG54,Nags gets yet another AB masterclass | RCB Insider 4.0 | VIVO IPL 2018,Royal Challengers Bangalore,2018-04-20,98924,5039,52,401,IN,Sports
awhXQwli4zc,"Chennai Super Kings | Funny Videos Ms Dhoni, Suresh Raina | Vivo Ipl 2018",I Love Cricket,2018-04-21,120823,2351,94,105,IN,Sports
awhXQwli4zc,"Chennai Super Kings | Funny Videos Ms Dhoni, Suresh Raina | Vivo Ipl 2018",I Love Cricket,2018-04-21,157556,2727,118,113,IN,Sports
Hk5dxn5dj2M,Deep Sea Fishing Battle | Dude Perfect,Dude Perfect,2018-04-23,8593086,305102,11053,25290,IN,Sports
MhZ7Zepw3Gg,"Roman Reigns and Brock Lesnar meet before the Greatest Royal Rumble event: Raw, April 23, 2018",WWE,2018-04-24,2221301,41479,2511,5146,IN,Sports
mq06LzlPuLE,Liverpool vs Roma ( 5-2 ) Mo Salah Show -  All Goals & Highlights / Resumen y Goles,FEEL MY STYLE,2018-04-24,288953,3144,223,264,IN,Sports
Hk5dxn5dj2M,Deep Sea Fishing Battle | Dude Perfect,Dude Perfect,2018-04-23,8593086,305103,11053,25290,IN,Sports
MhZ7Zepw3Gg,"Roman Reigns and Brock Lesnar meet before the Greatest Royal Rumble event: Raw, April 23, 2018",WWE,2018-04-24,2221301,41479,2511,5146,IN,Sports
dDRfdMWtRHI,"देखिये जब डीकॉक का कैच पकड़ने के लिए चीते की रफ़्तार से भागे धोनी, और करा अपनी फुर्ती से सबको हैरान",Sports Edge,2018-04-25,477481,13908,1849,512,IN,Sports
Hk5dxn5dj2M,Deep Sea Fishing Battle | Dude Perfect,Dude Perfect,2018-04-23,10273003,337276,12853,27528,IN,Sports
5R2ZZ-t8XS0,"Charlotte Flair & Carmella sign contract for their match at Backlash: SmackDown LIVE, April 24, 2018",WWE,2018-04-25,999410,18274,604,2264,IN,Sports
dDRfdMWtRHI,"देखिये जब डीकॉक का कैच पकड़ने के लिए चीते की रफ़्तार से भागे धोनी, और करा अपनी फुर्ती से सबको हैरान",Sports Edge,2018-04-25,477481,13908,1849,512,IN,Sports
Hk5dxn5dj2M,Deep Sea Fishing Battle | Dude Perfect,Dude Perfect,2018-04-23,10273003,337276,12853,27528,IN,Sports
dDRfdMWtRHI,"देखिये जब डीकॉक का कैच पकड़ने के लिए चीते की रफ़्तार से भागे धोनी, और करा अपनी फुर्ती से सबको हैरान",Sports Edge,2018-04-25,1513983,34163,8738,1742,IN,Sports
Hk5dxn5dj2M,Deep Sea Fishing Battle | Dude Perfect,Dude Perfect,2018-04-23,11201666,352228,13696,28643,IN,Sports
5R2ZZ-t8XS0,"Charlotte Flair & Carmella sign contract for their match at Backlash: SmackDown LIVE, April 24, 2018",WWE,2018-04-25,1141062,19744,693,2433,IN,Sports
dDRfdMWtRHI,"देखिये जब डीकॉक का कैच पकड़ने के लिए चीते की रफ़्तार से भागे धोनी, और करा अपनी फुर्ती से सबको हैरान",Sports Edge,2018-04-25,1513983,34163,8739,1742,IN,Sports
dDRfdMWtRHI,"देखिये जब डीकॉक का कैच पकड़ने के लिए चीते की रफ़्तार से भागे धोनी, और करा अपनी फुर्ती से सबको हैरान",Sports Edge,2018-04-25,2405777,48434,13106,2594,IN,Sports
QtNvvWsSsoE,"Greatest Royal Rumble Kickoff: April 27, 2018",WWE,2018-04-27,1929211,39955,2485,1364,IN,Sports
dDRfdMWtRHI,"देखिये जब डीकॉक का कैच पकड़ने के लिए चीते की रफ़्तार से भागे धोनी, और करा अपनी फुर्ती से सबको हैरान",Sports Edge,2018-04-25,2405777,48434,13106,2594,IN,Sports
QtNvvWsSsoE,"Greatest Royal Rumble Kickoff: April 27, 2018",WWE,2018-04-27,1929211,39955,2485,1364,IN,Sports
dDRfdMWtRHI,"देखिये जब डीकॉक का कैच पकड़ने के लिए चीते की रफ़्तार से भागे धोनी, और करा अपनी फुर्ती से सबको हैरान",Sports Edge,2018-04-25,3315594,62765,16563,3164,IN,Sports
QtNvvWsSsoE,"Greatest Royal Rumble Kickoff: April 27, 2018",WWE,2018-04-27,2249448,41914,2881,1574,IN,Sports
dDRfdMWtRHI,"देखिये जब डीकॉक का कैच पकड़ने के लिए चीते की रफ़्तार से भागे धोनी, और करा अपनी फुर्ती से सबको हैरान",Sports Edge,2018-04-25,3315594,62766,16563,3164,IN,Sports
dDRfdMWtRHI,"देखिये जब डीकॉक का कैच पकड़ने के लिए चीते की रफ़्तार से भागे धोनी, और करा अपनी फुर्ती से सबको हैरान",Sports Edge,2018-04-25,4337113,76178,19274,3514,IN,Sports
C2YqFvjTG84,Resumen de RC Deportivo vs FC Barcelona (2-4),LaLiga Santander,2018-04-29,606942,6181,510,319,IN,Sports
dDRfdMWtRHI,"देखिये जब डीकॉक का कैच पकड़ने के लिए चीते की रफ़्तार से भागे धोनी, और करा अपनी फुर्ती से सबको हैरान",Sports Edge,2018-04-25,4337113,76178,19274,3514,IN,Sports
C2YqFvjTG84,Resumen de RC Deportivo vs FC Barcelona (2-4),LaLiga Santander,2018-04-29,606942,6181,510,319,IN,Sports
1LTpixReuyg,"सांस रोक देने वाले मैच में, धोनी की चतुराई से चेन्नई ने दिल्ली को 11 रनो से ऐसे हरया | SPORTS EDGE",Sports Edge,2018-04-30,131119,3264,294,162,IN,Sports
C2YqFvjTG84,Resumen de RC Deportivo vs FC Barcelona (2-4),LaLiga Santander,2018-04-29,1187663,10163,1054,522,IN,Sports
1LTpixReuyg,"सांस रोक देने वाले मैच में, धोनी की चतुराई से चेन्नई ने दिल्ली को 11 रनो से ऐसे हरया | SPORTS EDGE",Sports Edge,2018-04-30,131119,3264,294,162,IN,Sports
_RTMvAhKtAc,"Reigns, Strowman & Lashley vs. Mahal, Owens & Zayn: Raw, April 30, 2018",WWE,2018-05-01,1783875,26494,948,2029,IN,Sports
1LTpixReuyg,"सांस रोक देने वाले मैच में, धोनी की चतुराई से चेन्नई ने दिल्ली को 11 रनो से ऐसे हरया | SPORTS EDGE",Sports Edge,2018-04-30,342810,5669,1035,392,IN,Sports
_RTMvAhKtAc,"Reigns, Strowman & Lashley vs. Mahal, Owens & Zayn: Raw, April 30, 2018",WWE,2018-05-01,1783875,26494,948,2029,IN,Sports
1LTpixReuyg,"सांस रोक देने वाले मैच में, धोनी की चतुराई से चेन्नई ने दिल्ली को 11 रनो से ऐसे हरया | SPORTS EDGE",Sports Edge,2018-04-30,342810,5669,1035,392,IN,Sports
_RTMvAhKtAc,"Reigns, Strowman & Lashley vs. Mahal, Owens & Zayn: Raw, April 30, 2018",WWE,2018-05-01,2143186,28805,1073,2184,IN,Sports
1LTpixReuyg,"सांस रोक देने वाले मैच में, धोनी की चतुराई से चेन्नई ने दिल्ली को 11 रनो से ऐसे हरया | SPORTS EDGE",Sports Edge,2018-04-30,418081,6504,1264,422,IN,Sports
JkYJQdjTX4o,🔴 [Live] Nakodar Kabaddi Cup 02 May 2018,Kabaddi365.com,2018-05-02,156585,1982,132,8,IN,Sports
_w2b9CMKGbw,Supremo Trophy 2018  |  ( day 3  ),TennisCricket.in,2018-05-03,75903,480,61,1,IN,Sports
os168iCFxA4,"मैच तो हार गयी चेन्नई लेकिन देखिये जब धोनी के के सामने अंपायर ने फिर झुका दिया अपना सर, देखे वीडियो",Sports Edge,2018-05-03,135358,5565,515,440,IN,Sports
JkYJQdjTX4o,🔴 [Live] Nakodar Kabaddi Cup 02 May 2018,Kabaddi365.com,2018-05-02,183298,2118,160,17,IN,Sports
v0xBdIyNijk,"Charlotte Flair, Asuka & Becky Lynch vs. Carmella & The IIconics: SmackDown LIVE, May 1, 2018",WWE,2018-05-02,761468,11991,388,1425,IN,Sports
_w2b9CMKGbw,Supremo Trophy 2018  |  ( day 3  ),TennisCricket.in,2018-05-03,75903,480,61,1,IN,Sports
os168iCFxA4,"मैच तो हार गयी चेन्नई लेकिन देखिये जब धोनी के के सामने अंपायर ने फिर झुका दिया अपना सर, देखे वीडियो",Sports Edge,2018-05-03,311377,8767,1614,746,IN,Sports
g63BEa7LEtY,Supremo Trophy 2018  LIVE |  ( day 4  ),TennisCricket.in,2018-05-04,62714,380,23,0,IN,Sports
HCKxQXaNiaE,Supremo Trophy 2018  LIVE |  ( final day   ),TennisCricket.in,2018-05-05,102284,690,57,0,IN,Sports
UuTjSuSVHkQ,"18र्वें ओवेर में चहल ने डालदी नो बोल, फिर धोनी ने जड़ दिए 3 लगातार छक्के और जीत गयी चेन्नई की टीम",Sports Edge,2018-05-05,177502,3889,409,213,IN,Sports
1ys2_kcWlVk,SUPREMO TROPHY 2018 | FINAL MATCH,7070 sports,2018-05-05,79451,563,49,0,IN,Sports
HCKxQXaNiaE,Supremo Trophy 2018  LIVE |  ( final day   ),TennisCricket.in,2018-05-05,102284,690,57,0,IN,Sports
uDAqwYzZ0wk,"आरसीबी को हराने के बाद कोहली की कप्तानी को पर यह क्या बोल गए धोनी, कही ऐसे बात किसी को नहीं हुआ यकीन",Sports Edge,2018-05-06,251563,5285,858,308,IN,Sports
HCKxQXaNiaE,Supremo Trophy 2018  LIVE |  ( final day   ),TennisCricket.in,2018-05-05,109526,711,64,0,IN,Sports
SPQbewtlChg,ElClásico - Resumen de FC Barcelona vs Real Madrid (2-2),LaLiga Santander,2018-05-06,2806987,18736,2030,1805,IN,Sports
Bb8nNqkdfbU,IPL 2018 Kingfisher Funny Commercial ads Video - I love Cricket,I Love Cricket,2018-05-07,684403,9275,723,1233,IN,Sports
FepIkIILumA,Fortnite with Ninja | Dude Perfect,Dude Perfect,2018-05-07,5589612,253725,9084,21111,IN,Sports
DYZoD-0vJGQ,"Dust storm, thunderstorm in Rajasthan; rain alert for Delhi-NCR",Zee News,2018-05-07,60057,352,46,64,IN,Sports
uDAqwYzZ0wk,"आरसीबी को हराने के बाद कोहली की कप्तानी को पर यह क्या बोल गए धोनी, कही ऐसे बात किसी को नहीं हुआ यकीन",Sports Edge,2018-05-06,316141,5819,1178,351,IN,Sports
rO8Kl1Yz1Hk,Barcelona vs Real Madrid (2-2) 🔥 All Goals Highlights/ Resumen y Goles,FEEL MY STYLE,2018-05-07,260633,2333,179,305,IN,Sports
SPQbewtlChg,ElClásico - Resumen de FC Barcelona vs Real Madrid (2-2),LaLiga Santander,2018-05-06,2806987,18736,2030,1805,IN,Sports
Bb8nNqkdfbU,IPL 2018 Kingfisher Funny Commercial ads Video - I love Cricket,I Love Cricket,2018-05-07,684403,9275,723,1233,IN,Sports
FepIkIILumA,Fortnite with Ninja | Dude Perfect,Dude Perfect,2018-05-07,5589612,253729,9084,21111,IN,Sports
DYZoD-0vJGQ,"Dust storm, thunderstorm in Rajasthan; rain alert for Delhi-NCR",Zee News,2018-05-07,60057,352,46,64,IN,Sports
FepIkIILumA,Fortnite with Ninja | Dude Perfect,Dude Perfect,2018-05-07,11386222,398818,17930,28445,IN,Sports
Bb8nNqkdfbU,IPL 2018 Kingfisher Funny Commercial ads Video - I love Cricket,I Love Cricket,2018-05-07,1168024,13018,1139,1623,IN,Sports
SPQbewtlChg,ElClásico - Resumen de FC Barcelona vs Real Madrid (2-2),LaLiga Santander,2018-05-06,3375614,22053,2763,1994,IN,Sports
DYZoD-0vJGQ,"Dust storm, thunderstorm in Rajasthan; rain alert for Delhi-NCR",Zee News,2018-05-07,150365,621,94,127,IN,Sports
JPr_6aIyXuU,"Sasha Banks vs. Ember Moon vs. Ruby Riott - Money in the Bank Qualifying Match: Raw, May 7, 2018",WWE,2018-05-08,811524,14137,560,1597,IN,Sports
FepIkIILumA,Fortnite with Ninja | Dude Perfect,Dude Perfect,2018-05-07,11386222,398819,17930,28445,IN,Sports
FepIkIILumA,Fortnite with Ninja | Dude Perfect,Dude Perfect,2018-05-07,13275050,431020,19914,30932,IN,Sports
Bb8nNqkdfbU,IPL 2018 Kingfisher Funny Commercial ads Video - I love Cricket,I Love Cricket,2018-05-07,1407988,14622,1321,1840,IN,Sports
SPQbewtlChg,ElClásico - Resumen de FC Barcelona vs Real Madrid (2-2),LaLiga Santander,2018-05-06,3611707,23113,2862,2071,IN,Sports
DYZoD-0vJGQ,"Dust storm, thunderstorm in Rajasthan; rain alert for Delhi-NCR",Zee News,2018-05-07,180470,687,107,138,IN,Sports
sT1an-dH94w,Resumen de Sevilla FC vs Real Madrid (3-2),LaLiga Santander,2018-05-09,1230345,8063,1352,710,IN,Sports
dhWCKmigvnM,Chennai Super Kings 2018 I Inside Dressing Room | Vivo Ipl Funny videos,I Love Cricket,2018-05-10,147030,2641,129,157,IN,Sports
TxsFCeIEtZ4,"शतक लगाने के बाद भी हारी दिल्ली तो रो पड़े ऋषभ पंत, लेकिन कह गए ऐसी बात जीत लिया करोड़ों लोगो का दिल",Sports Edge,2018-05-11,258265,4492,643,370,IN,Sports
sT1an-dH94w,Resumen de Sevilla FC vs Real Madrid (3-2),LaLiga Santander,2018-05-09,1372080,8963,1711,771,IN,Sports
qD-ofY9niOs,Resumen de Real Madrid vs RC Celta (6-0),LaLiga Santander,2018-05-12,572981,5705,685,319,IN,Sports
qD-ofY9niOs,Resumen de Real Madrid vs RC Celta (6-0),LaLiga Santander,2018-05-12,572981,5705,685,319,IN,Sports
MdmTiJYaFAU,"देखिए जब चीते की रफ्तार से दौड़ने धोनी,फिर गेंद उठाकर जडेजा को ही मारने लगे, धोनी ने ऐसा क्यों किया?",Sports Edge,2018-05-13,242496,7621,961,246,IN,Sports
qD-ofY9niOs,Resumen de Real Madrid vs RC Celta (6-0),LaLiga Santander,2018-05-12,1360741,11085,1416,601,IN,Sports
4bt1o27n_0Q,🔴 [Live] Malliana (Moga) Kabaddi Tournament 13 May 2018,Kabaddi365.com,2018-05-13,128229,1400,92,7,IN,Sports
MdmTiJYaFAU,"देखिए जब चीते की रफ्तार से दौड़ने धोनी,फिर गेंद उठाकर जडेजा को ही मारने लगे, धोनी ने ऐसा क्यों किया?",Sports Edge,2018-05-13,242496,7621,961,246,IN,Sports
qD-ofY9niOs,Resumen de Real Madrid vs RC Celta (6-0),LaLiga Santander,2018-05-12,1360741,11085,1416,601,IN,Sports
4bt1o27n_0Q,🔴 [Live] Malliana (Moga) Kabaddi Tournament 13 May 2018,Kabaddi365.com,2018-05-13,128229,1400,92,7,IN,Sports
MdmTiJYaFAU,"देखिए जब चीते की रफ्तार से दौड़ने धोनी,फिर गेंद उठाकर जडेजा को ही मारने लगे, धोनी ने ऐसा क्यों किया?",Sports Edge,2018-05-13,242496,7621,961,246,IN,Sports
qD-ofY9niOs,Resumen de Real Madrid vs RC Celta (6-0),LaLiga Santander,2018-05-12,1360741,11085,1416,601,IN,Sports
4bt1o27n_0Q,🔴 [Live] Malliana (Moga) Kabaddi Tournament 13 May 2018,Kabaddi365.com,2018-05-13,128229,1400,92,7,IN,Sports
MdmTiJYaFAU,"देखिए जब चीते की रफ्तार से दौड़ने धोनी,फिर गेंद उठाकर जडेजा को ही मारने लगे, धोनी ने ऐसा क्यों किया?",Sports Edge,2018-05-13,242496,7621,961,246,IN,Sports
qD-ofY9niOs,Resumen de Real Madrid vs RC Celta (6-0),LaLiga Santander,2018-05-12,1360741,11085,1416,601,IN,Sports
4bt1o27n_0Q,🔴 [Live] Malliana (Moga) Kabaddi Tournament 13 May 2018,Kabaddi365.com,2018-05-13,128229,1400,92,7,IN,Sports
MdmTiJYaFAU,"देखिए जब चीते की रफ्तार से दौड़ने धोनी,फिर गेंद उठाकर जडेजा को ही मारने लगे, धोनी ने ऐसा क्यों किया?",Sports Edge,2018-05-13,607470,11294,2410,470,IN,Sports
E9pIhue2lSU,Ronda Rousey to challenge Raw Women's Champion Nia Jax at WWE Money in the Bank,WWE,2018-05-14,649142,14931,790,2548,IN,Sports
qD-ofY9niOs,Resumen de Real Madrid vs RC Celta (6-0),LaLiga Santander,2018-05-12,1775669,13177,1824,660,IN,Sports
MdmTiJYaFAU,"देखिए जब चीते की रफ्तार से दौड़ने धोनी,फिर गेंद उठाकर जडेजा को ही मारने लगे, धोनी ने ऐसा क्यों किया?",Sports Edge,2018-05-13,607470,11294,2410,470,IN,Sports
E9pIhue2lSU,Ronda Rousey to challenge Raw Women's Champion Nia Jax at WWE Money in the Bank,WWE,2018-05-14,649142,14931,790,2548,IN,Sports
qD-ofY9niOs,Resumen de Real Madrid vs RC Celta (6-0),LaLiga Santander,2018-05-12,1775669,13177,1824,660,IN,Sports
MdmTiJYaFAU,"देखिए जब चीते की रफ्तार से दौड़ने धोनी,फिर गेंद उठाकर जडेजा को ही मारने लगे, धोनी ने ऐसा क्यों किया?",Sports Edge,2018-05-13,776938,13250,3227,646,IN,Sports
3o3-3UJpFYs,"Kurt Angle denies Roman Reigns another Money in the Bank Qualifying Match: Raw, May 14, 2018",WWE,2018-05-15,1049288,15597,859,2514,IN,Sports
7odyDcqdouc,"देखिए जब KL Rahul से पूछा गया कि Hardik से Jersey क्यों बदली, तो राहुल ने दिया चौकाने वाला बयान ...",NH 24,2018-05-17,194263,5167,551,405,IN,Sports
lFh9daE3FQQ,"देखिये कैसे, बुमराह की तूफानी गेंदबाजी से मुंबई ने पंजाब को 3 रनों से हराकर किया सीधा आईपीएल से बाहर",Sports Edge,2018-05-16,105164,2184,256,88,IN,Sports
p20vjER9UnE,"Top 10 SmackDown LIVE moments: WWE Top 10, May 15, 2018",WWE,2018-05-16,945489,19145,667,1256,IN,Sports
7odyDcqdouc,"देखिए जब KL Rahul से पूछा गया कि Hardik से Jersey क्यों बदली, तो राहुल ने दिया चौकाने वाला बयान ...",NH 24,2018-05-17,194263,5167,551,405,IN,Sports
7odyDcqdouc,"देखिए जब KL Rahul से पूछा गया कि Hardik से Jersey क्यों बदली, तो राहुल ने दिया चौकाने वाला बयान ...",NH 24,2018-05-17,629019,10017,2150,799,IN,Sports
XXUIyOrO3PY,"देखिये डिविलियर्स द्वारा हवा में उड़ कर पकड़ा गया वह जानलेवा कैच, जिसे देख कोहली की भी आंखे फटी रह गयी",Sports Edge,2018-05-17,355776,12246,1228,656,IN,Sports
7odyDcqdouc,"देखिए जब KL Rahul से पूछा गया कि Hardik से Jersey क्यों बदली, तो राहुल ने दिया चौकाने वाला बयान ...",NH 24,2018-05-17,629019,10017,2150,799,IN,Sports
7odyDcqdouc,"देखिए जब KL Rahul से पूछा गया कि Hardik से Jersey क्यों बदली, तो राहुल ने दिया चौकाने वाला बयान ...",NH 24,2018-05-17,831139,12000,2953,1007,IN,Sports
XXUIyOrO3PY,"देखिये डिविलियर्स द्वारा हवा में उड़ कर पकड़ा गया वह जानलेवा कैच, जिसे देख कोहली की भी आंखे फटी रह गयी",Sports Edge,2018-05-17,992285,20471,3648,1099,IN,Sports
7odyDcqdouc,"देखिए जब KL Rahul से पूछा गया कि Hardik से Jersey क्यों बदली, तो राहुल ने दिया चौकाने वाला बयान ...",NH 24,2018-05-17,831139,12000,2953,1007,IN,Sports
XXUIyOrO3PY,"देखिये डिविलियर्स द्वारा हवा में उड़ कर पकड़ा गया वह जानलेवा कैच, जिसे देख कोहली की भी आंखे फटी रह गयी",Sports Edge,2018-05-17,992285,20471,3648,1099,IN,Sports
XXUIyOrO3PY,"देखिये डिविलियर्स द्वारा हवा में उड़ कर पकड़ा गया वह एलियन कैच, जिसे देख कोहली की भी आंखे फटी रह गयी",Sports Edge,2018-05-17,1291834,23113,5361,1256,IN,Sports
7odyDcqdouc,"देखिए जब KL Rahul से पूछा गया कि Hardik से Jersey क्यों बदली, तो राहुल ने दिया चौकाने वाला बयान ...",NH 24,2018-05-17,924212,12751,3254,915,IN,Sports
XXUIyOrO3PY,"देखिये डिविलियर्स द्वारा हवा में उड़ कर पकड़ा गया वह एलियन कैच, जिसे देख कोहली की भी आंखे फटी रह गयी",Sports Edge,2018-05-17,1291834,23113,5361,1256,IN,Sports
7odyDcqdouc,"देखिए जब KL Rahul से पूछा गया कि Hardik से Jersey क्यों बदली, तो राहुल ने दिया चौकाने वाला बयान ...",NH 24,2018-05-17,924212,12751,3254,915,IN,Sports
XXUIyOrO3PY,"देखिये डिविलियर्स द्वारा हवा में उड़ कर पकड़ा गया वह एलियन कैच, जिसे देख कोहली की भी आंखे फटी रह गयी",Sports Edge,2018-05-17,1441856,24160,6003,1327,IN,Sports
FFL3h6ZTCFw,Resumen de Villarreal CF vs Real Madrid (2-2),LaLiga Santander,2018-05-19,1055482,7680,1074,384,IN,Sports
7odyDcqdouc,"देखिए जब KL Rahul से पूछा गया कि Hardik से Jersey क्यों बदली, तो राहुल ने दिया चौकाने वाला बयान ...",NH 24,2018-05-17,962568,13045,3330,911,IN,Sports
9m9oO84Q2fk,Giant Darts Battle | Dude Perfect,Dude Perfect,2018-05-21,3553407,169991,2106,16003,IN,Sports
OUi0u_hlF2Y,"Biggest wall-busters: WWE Top 10, May 21, 2018",WWE,2018-05-21,772336,17196,580,1285,IN,Sports
9m9oO84Q2fk,Giant Darts Battle | Dude Perfect,Dude Perfect,2018-05-21,3553407,169991,2106,16003,IN,Sports
9m9oO84Q2fk,Giant Darts Battle | Dude Perfect,Dude Perfect,2018-05-21,8523528,296275,5962,23855,IN,Sports
d0NNTQLLVQY,"Ronda Rousey vows to take Nia Jax's arm and her title: Raw, May 21, 2018",WWE,2018-05-22,1884643,27869,1463,3660,IN,Sports
7tx02bD_kPU,"देखिये जब, हैदराबाद के खिलाफ जीत के बाद, धोनी ने डुप्लेसीस को लेकर कहा कुछ ऐसा सब ह गए हैरान",Sports Edge,2018-05-23,166089,4505,369,295,IN,Sports
9m9oO84Q2fk,Giant Darts Battle | Dude Perfect,Dude Perfect,2018-05-21,8523528,296275,5962,23855,IN,Sports
d0NNTQLLVQY,"Ronda Rousey vows to take Nia Jax's arm and her title: Raw, May 21, 2018",WWE,2018-05-22,1884643,27869,1463,3660,IN,Sports
7tx02bD_kPU,"देखिये जब, हैदराबाद के खिलाफ जीत के बाद, धोनी ने डुप्लेसीस को लेकर कहा कुछ ऐसा सब ह गए हैरान",Sports Edge,2018-05-23,166089,4505,369,295,IN,Sports
7tx02bD_kPU,"देखिये जब, हैदराबाद के खिलाफ जीत के बाद, धोनी ने डुप्लेसीस को लेकर कहा कुछ ऐसा सब ह गए हैरान",Sports Edge,2018-05-23,367281,6324,913,444,IN,Sports
9m9oO84Q2fk,Giant Darts Battle | Dude Perfect,Dude Perfect,2018-05-21,10944812,338803,7424,26285,IN,Sports
d0NNTQLLVQY,"Ronda Rousey vows to take Nia Jax's arm and her title: Raw, May 21, 2018",WWE,2018-05-22,2197850,30238,1627,3985,IN,Sports
NeV1oExo8PU,AB de Villiers : Retires from international Cricket | Tribute to AB de Villiers | 23rd May 2018,Sports Blast,2018-05-23,218428,9801,291,1948,IN,Sports
vyV1r9ZDSbc,Csk - Wives of Chennai Super Kings Players | Ipl 2018,I Love Cricket,2018-05-23,173747,2163,141,111,IN,Sports
7tx02bD_kPU,"देखिये जब, हैदराबाद के खिलाफ जीत के बाद, धोनी ने डुप्लेसीस को लेकर कहा कुछ ऐसा सब ह गए हैरान",Sports Edge,2018-05-23,367281,6324,913,444,IN,Sports
9m9oO84Q2fk,Giant Darts Battle | Dude Perfect,Dude Perfect,2018-05-21,10944812,338803,7424,26285,IN,Sports
NeV1oExo8PU,AB de Villiers : Retires from international Cricket | Tribute to AB de Villiers | 23rd May 2018,Sports Blast,2018-05-23,683097,18551,645,3522,IN,Sports
7tx02bD_kPU,"देखिये जब, हैदराबाद के खिलाफ जीत के बाद, धोनी ने डुप्लेसीस को लेकर कहा कुछ ऐसा सब ह गए हैरान",Sports Edge,2018-05-23,433297,6854,1123,500,IN,Sports
9m9oO84Q2fk,Giant Darts Battle | Dude Perfect,Dude Perfect,2018-05-21,12211480,357498,8183,25199,IN,Sports
d0NNTQLLVQY,"Ronda Rousey vows to take Nia Jax's arm and her title: Raw, May 21, 2018",WWE,2018-05-22,2350928,31283,1703,4131,IN,Sports
vyV1r9ZDSbc,Csk - Wives of Chennai Super Kings Players | Ipl 2018,I Love Cricket,2018-05-23,253895,2684,194,118,IN,Sports
58jE0jh03aA,Srh vs Kkr | Rashid Khan Celebration inside Dressing room | Vivo Ipl 2018 Funny videos,I Love Cricket,2018-05-26,267216,4603,336,307,IN,Sports
f-hsrO_HAIQ,"हैदराबाद को फाइनल में पहुंचाने के बाद राशिद खान ने धोनी पर दिया चौकाने वाला बयान, कर दिया सबक हैरान.",NH 24,2018-05-25,213362,6779,950,1338,IN,Sports
bMZvsBXf5y4,"हैदराबाद के खिलाफ शर्मनाक हार की जिम्मेदारी लेते हुए रो पडे कार्तिक, लेकिन कह गये ऐसी बात, सब भावुक",Sports Edge,2018-05-26,144416,2803,412,285,IN,Sports
58jE0jh03aA,Srh vs Kkr | Rashid Khan Celebration inside Dressing room | Vivo Ipl 2018 Funny videos,I Love Cricket,2018-05-26,267216,4603,336,307,IN,Sports
f-hsrO_HAIQ,"हैदराबाद को फाइनल में पहुंचाने के बाद राशिद खान ने धोनी पर दिया चौकाने वाला बयान, कर दिया सबक हैरान.",NH 24,2018-05-25,213362,6779,950,1338,IN,Sports
58jE0jh03aA,Srh vs Kkr | Rashid Khan Celebration inside Dressing room | Vivo Ipl 2018 Funny videos,I Love Cricket,2018-05-26,1018965,10585,926,682,IN,Sports
f-hsrO_HAIQ,"हैदराबाद को फाइनल में पहुंचाने के बाद राशिद खान ने धोनी पर दिया चौकाने वाला बयान, कर दिया सबक हैरान.",NH 24,2018-05-25,501358,11017,2351,2423,IN,Sports
wsjvc9hrbcc,"फैन्स ने करी वापसी की मांग, तो एबी डिविलियर्स ने दिया ऐसा अंतिम जवाब, के सुन कर रो पड़ेंगे आप",Sports Edge,2018-05-25,286477,9327,875,1149,IN,Sports
58jE0jh03aA,Srh vs Kkr | Rashid Khan Celebration inside Dressing room | Vivo Ipl 2018 Funny videos,I Love Cricket,2018-05-26,1018965,10585,926,682,IN,Sports
f-hsrO_HAIQ,"हैदराबाद को फाइनल में पहुंचाने के बाद राशिद खान ने धोनी पर दिया चौकाने वाला बयान, कर दिया सबक हैरान.",NH 24,2018-05-25,501358,11017,2351,2423,IN,Sports
muzsTfb-wlE,Csk vs Srh | Shane Watson Celebration inside Dressing room | Vivo Ipl 2018 Final Funny videos,I Love Cricket,2018-05-28,322009,7788,485,434,IN,Sports
f-hsrO_HAIQ,"हैदराबाद को फाइनल में पहुंचाने के बाद राशिद खान ने धोनी पर दिया चौकाने वाला बयान, कर दिया सबक हैरान.",NH 24,2018-05-25,658055,12389,2961,2748,IN,Sports
TKju1tD7rHI,"फाइनल जीतने के बाद धोनी की महानता देख रो पड़ेंगे आप भी, ट्राफी छोड़कर बेटी संग मनाया ऐसे जश्न, देखे",Sports Edge,2018-05-28,278546,12103,887,538,IN,Sports
muzsTfb-wlE,Csk vs Srh | Shane Watson Celebration inside Dressing room | Vivo Ipl 2018 Final Funny videos,I Love Cricket,2018-05-28,322009,7788,485,434,IN,Sports
f-hsrO_HAIQ,"हैदराबाद को फाइनल में पहुंचाने के बाद राशिद खान ने धोनी पर दिया चौकाने वाला बयान, कर दिया सबक हैरान.",NH 24,2018-05-25,658055,12389,2961,2748,IN,Sports
TKju1tD7rHI,"फाइनल जीतने के बाद धोनी की महानता देख रो पड़ेंगे आप भी, ट्राफी छोड़कर बेटी संग मनाया ऐसे जश्न, देखे",Sports Edge,2018-05-28,278546,12103,887,538,IN,Sports
muzsTfb-wlE,Csk vs Srh | Shane Watson Celebration inside Dressing room | Vivo Ipl 2018 Final Funny videos,I Love Cricket,2018-05-28,1957419,27611,2909,1831,IN,Sports
TKju1tD7rHI,"फाइनल जीतने के बाद धोनी की महानता देख रो पड़ेंगे आप भी, ट्राफी छोड़कर बेटी संग मनाया ऐसे जश्न, देखे",Sports Edge,2018-05-28,940928,22320,1978,1064,IN,Sports
f-hsrO_HAIQ,"हैदराबाद को फाइनल में पहुंचाने के बाद राशिद खान ने धोनी पर दिया चौकाने वाला बयान, कर दिया सबक हैरान.",NH 24,2018-05-25,811823,13839,3407,3037,IN,Sports
muzsTfb-wlE,Csk vs Srh | Shane Watson Celebration inside Dressing room | Vivo Ipl 2018 Final Funny videos,I Love Cricket,2018-05-28,1957419,27611,2909,1831,IN,Sports
TKju1tD7rHI,"फाइनल जीतने के बाद धोनी की महानता देख रो पड़ेंगे आप भी, ट्राफी छोड़कर बेटी संग मनाया ऐसे जश्न, देखे",Sports Edge,2018-05-28,940928,22320,1978,1064,IN,Sports
muzsTfb-wlE,Csk vs Srh | Shane Watson Celebration inside Dressing room | Vivo Ipl 2018 Final Funny videos,I Love Cricket,2018-05-28,2694340,34171,4158,2523,IN,Sports
TKju1tD7rHI,"फाइनल जीतने के बाद धोनी की महानता देख रो पड़ेंगे आप भी, ट्राफी छोड़कर बेटी संग मनाया ऐसे जश्न, देखे",Sports Edge,2018-05-28,1261703,26886,2528,1315,IN,Sports
muzsTfb-wlE,Csk vs Srh | Shane Watson Celebration inside Dressing room | Vivo Ipl 2018 Final Funny videos,I Love Cricket,2018-05-28,2694340,34171,4158,2523,IN,Sports
TKju1tD7rHI,"फाइनल जीतने के बाद धोनी की महानता देख रो पड़ेंगे आप भी, ट्राफी छोड़कर बेटी संग मनाया ऐसे जश्न, देखे",Sports Edge,2018-05-28,1261703,26886,2528,1315,IN,Sports
muzsTfb-wlE,Csk vs Srh | Shane Watson Celebration inside Dressing room | Vivo Ipl 2018 Final Funny videos,I Love Cricket,2018-05-28,3103282,36637,4512,2695,IN,Sports
TKju1tD7rHI,"फाइनल जीतने के बाद धोनी की महानता देख रो पड़ेंगे आप भी, ट्राफी छोड़कर बेटी संग मनाया ऐसे जश्न, देखे",Sports Edge,2018-05-28,1477126,29387,2811,1437,IN,Sports
muzsTfb-wlE,Csk vs Srh | Shane Watson Celebration inside Dressing room | Vivo Ipl 2018 Final Funny videos,I Love Cricket,2018-05-28,3103282,36637,4512,2695,IN,Sports
muzsTfb-wlE,Csk vs Srh | Shane Watson Celebration inside Dressing room | Vivo Ipl 2018 Final Funny videos,I Love Cricket,2018-05-28,3133236,36785,4538,2720,IN,Sports
TKju1tD7rHI,"फाइनल जीतने के बाद धोनी की महानता देख रो पड़ेंगे आप भी, ट्राफी छोड़कर बेटी संग मनाया ऐसे जश्न, देखे",Sports Edge,2018-05-28,1489771,29549,2823,1450,IN,Sports
muzsTfb-wlE,Csk vs Srh | Shane Watson Celebration inside Dressing room | Vivo Ipl 2018 Final Funny videos,I Love Cricket,2018-05-28,3133236,36785,4538,2720,IN,Sports
muzsTfb-wlE,Csk vs Srh | Shane Watson Celebration inside Dressing room | Vivo Ipl 2018 Final Funny videos,I Love Cricket,2018-05-28,3166997,36929,4552,2736,IN,Sports
lZdHrpqDJXI,"Craziest food fights: WWE Top 10, June 2, 2018",WWE,2018-06-02,573308,12631,922,1162,IN,Sports
v-dfygYIfLs,Old School Trick Shots | Dude Perfect,Dude Perfect,2018-06-04,3828183,205229,3336,20893,IN,Sports
v-dfygYIfLs,Old School Trick Shots | Dude Perfect,Dude Perfect,2018-06-04,3828183,205229,3336,20893,IN,Sports
v-dfygYIfLs,Old School Trick Shots | Dude Perfect,Dude Perfect,2018-06-04,9397277,369425,7612,32349,IN,Sports
dn9Ov0_j9GM,"Styles & Nakamura trade barbs during explosive contract signing: SmackDown LIVE, June 5, 2018",WWE,2018-06-06,655610,16483,471,2291,IN,Sports
v-dfygYIfLs,Old School Trick Shots | Dude Perfect,Dude Perfect,2018-06-04,9397277,369425,7612,32349,IN,Sports
