video_id,title,channel_title,publish_time,views,likes,dislikes,comment_count,Region,category_title
JwboxqDylgg,"Canada Soccer's Women's National Team v USA International Friendly LIVE from Avaya Stadium, San Jose",Canada Soccer,2017-11-13,36311,277,28,13,CA,Sports
ThLVteoxnSE,"LFR11 - Game 19 - B Sweeper - Tor 4, Bos 1",SteveDangle,2017-11-12,28992,1409,9,188,CA,Sports
f-G8fK1LJVU,BREAKING: LiAngelo Ball Just Got THROWN INTO PRISON!! Will China MURDER LiAngelo Ball?,Ali's Highlights,2017-11-12,788935,15535,2557,2848,CA,Sports
WuzMMgFsJFE,McElhinney shines in Leafs' 4-1 win over the Bruins,NHL,2017-11-12,33167,304,11,71,CA,Sports
SElT590QmTY,Vikings vs. Redskins | NFL Week 10 Game Highlights,NFL,2017-11-12,439507,2557,133,1294,CA,Sports
QUUOLFAbJ6A,Ireland Fans In Copenhagen Outside Victoria's Secret - Denmark vs Ireland,Everything Football,2017-11-11,166818,465,42,60,CA,Sports
1KHCqtTC0EQ,"Toronto Raptors vs Boston Celtics: November 12, 2017",Motion Station,2017-11-12,102766,294,39,39,CA,Sports
F6HTw5DU670,Dude Perfect Face Off | Spikeball,Whistle Sports,2017-11-09,2682879,48408,2267,2341,CA,Sports
8tbQHHso0oY,Bellator 187: Conor McGregor storms the Bellator MMA Cage,BellatorMMA,2017-11-10,1107916,1807,269,1545,CA,Sports
o4qUbIZn538,Stephen Curry New Hair Debut! Nick Young Left Wide Open! 2017-18 Season,Chris Smoove,2017-11-12,650469,17003,185,1102,CA,Sports
o-y6Q0bANm4,Côte d'Ivoire vs Maroc 0 - 2,Ayoub Hamraoui,2017-11-11,265303,1475,110,273,CA,Sports
psDauoxUj9A,شاهد انبهار الاعلام المصري  بتأهل المغرب لكأس العالم  و يعتبر المغرب أقوى فريق عربي و افريقي,Info Press,2017-11-11,624328,7100,398,971,CA,Sports
YYOCmR5Lvbw,2017 Brazil Grand Prix: Race Highlights,FORMULA 1,2017-11-12,758492,11936,160,1472,CA,Sports
oP-6Z1RlaIc,"Triple H returns to join Team Raw at Survivor Series: Raw, Nov. 13, 2017",WWE,2017-11-14,2455165,47921,2236,8112,CA,Sports
DupviAaffdk,Stephen Colbert monologue 11/13/17 : Too Much Moore !,Federica Balsamo,2017-11-14,187026,786,121,218,CA,Sports
u-WXjOBFdgw,Stephen A. Smith sides with LeBron James in scuffle with Knicks | First Take | ESPN,ESPN,2017-11-14,545806,4193,448,1842,CA,Sports
2CZXls3Yclo,Cleveland Cavaliers vs New York Knicks Full Game Highlights / Week 5 / 2017 NBA Season,MLG Highlights,2017-11-14,2010343,9400,540,2483,CA,Sports
JwboxqDylgg,"Canada Soccer's Women's National Team v USA International Friendly LIVE from Avaya Stadium, San Jose",Canada Soccer,2017-11-13,41029,296,32,33,CA,Sports
8sdQ7dP9Drs,"Today's News: It's On - Get The Goods, November 14th, 2017",Whistler Blackcomb,2017-11-14,4851,31,0,0,CA,Sports
GZkgGhlscc0,GERMANY vs FRANCE 2-2 ● All Goals & Highlights HD ● 14 Nov 2017 - FRIENDLY,Football Highlights & Goals,2017-11-14,584612,2102,186,546,CA,Sports
TRZPLiLl9HY,Patriots vs. Broncos | NFL Week 10 Game Highlights,NFL,2017-11-13,1012191,7769,362,1528,CA,Sports
Iw8apHDAXhk,LeBron vs Kanter! Cavs Stun Knicks With Epic 23 Point Comeback! 2017-18 Season,Chris Smoove,2017-11-14,454790,14853,133,1383,CA,Sports
SC6Pweta170,"This is why UFC won't allow Conor McGregor to fight on Dec 30 at UFC 219,Bisping on Silva,Woodley",MMA WORLD,2017-11-14,309388,2908,201,2214,CA,Sports
-zro2JcQucc,Skip and Shannon talk Enes vs LeBron James after the Cavs beat the Knicks | UNDISPUTED,Skip and Shannon: UNDISPUTED,2017-11-14,241896,3049,142,1683,CA,Sports
7LgNSdeBIpE,LeBron James vs Frank Ntilikina and Enes Kanter - LeBron mocks Ntilikina!,NBAHighlights2,2017-11-14,617754,1923,168,1388,CA,Sports
Ehke7aPI9l0,"Kurt Angle & The Shield lead a Raw raid of SmackDown: SmackDown LIVE, Nov. 14, 2017",WWE,2017-11-15,3715529,86803,2264,11409,CA,Sports
NjWiiT74hB0,Stephen A. Smith calls for LiAngelo Ball and UCLA players to be suspended | First Take | ESPN,ESPN,2017-11-15,535562,5306,526,3960,CA,Sports
k_3rgt-h328,"McDavid, Oilers rout Golden Knights in 8-2 win",NHL,2017-11-15,67136,648,22,191,CA,Sports
Q6vkQG5KsDU,Toronto Raptors vs Houston Rockets - Full Game Highlights | Nov 14 | 2017-18 NBA Season,NBA Kit,2017-11-15,228385,674,56,195,CA,Sports
EnBfzD0HhtM,Argentina vs Nigeria 2-4 - All Goals & Extended Highlights - Friendly 14/11/2017 HD,GOLAZO TV,2017-11-14,2333278,11373,1206,3697,CA,Sports
tO5eH6oRMfw,Cleveland Cavaliers vs Charlotte Hornets Full Game Highlights / Week 5 / 2017 NBA Season,MLG Highlights,2017-11-16,551409,3243,169,807,CA,Sports
ZptISqiTxsQ,Gotta See It: Chaotic bench brawl erupts between Flames and Red Wings,SPORTSNET,2017-11-16,59846,517,9,327,CA,Sports
TWKzDGCLI9w,OG Anunoby 16 Points Full Highlights (11/14/2017),DownToBuck,2017-11-15,7494,136,0,44,CA,Sports
KPV4Pac3muA,WWE Smackdown 14 November Highlights HD - WWE Smackdown 14/11/2017 Highlights HD,Wrestling Reality II,2017-11-15,1502902,11298,920,1155,CA,Sports
xo6EcR8xvFM,ARGENTINA vs NIGERIA 2-4 ● All Goals & Highlights HD ● 14 Nov 2017 - FRIENDLY,Football Highlights & Goals,2017-11-14,1327882,4321,573,1487,CA,Sports
UwdLlnPaRAU,Tony Hawk Answers Skateboarding Questions From Twitter | Tech Support | WIRED,WIRED,2017-11-15,229515,9435,90,759,CA,Sports
YfIpOLtflWM,Raptors 45 Points 2nd QTR Franchise Record! James Harden 38 Pts! 2017-18 Season,Chris Smoove,2017-11-15,206367,7225,33,585,CA,Sports
u5E1Z3Upmt8,"Tyron Woodley to defend his belt against Nate Diaz on Dec 30 at UFC 219?,DC on Volkan,Conor McGregor",MMA WORLD,2017-11-15,347414,4448,250,3483,CA,Sports
ZptISqiTxsQ,Gotta See It: Chaotic bench brawl erupts between Flames and Red Wings,SPORTSNET,2017-11-16,392458,1467,54,743,CA,Sports
jKkOYEW7RvQ,Golden State Warriors vs Boston Celtics Full Game Highlights / Week 5 / 2017 NBA Season,MLG Highlights,2017-11-17,685641,8969,398,4995,CA,Sports
Ehke7aPI9l0,"Kurt Angle & The Shield lead a Raw raid of SmackDown: SmackDown LIVE, Nov. 14, 2017",WWE,2017-11-15,4373507,94443,2502,12173,CA,Sports
WBfOtfotvi8,"Toronto Raptors vs. New Orleans Pelicans - November 15, 2017",Motion Station,2017-11-16,10164,29,3,3,CA,Sports
k_3rgt-h328,"McDavid, Oilers rout Golden Knights in 8-2 win",NHL,2017-11-15,82447,728,30,216,CA,Sports
NjWiiT74hB0,Stephen A. Smith calls for LiAngelo Ball and UCLA players to be suspended | First Take | ESPN,ESPN,2017-11-15,677463,6070,626,4555,CA,Sports
2McDKO-E3Pg,"Skip and Shannon react to Joel Embiid's 46-point, 15-rebound night vs the Lakers | UNDISPUTED",Skip and Shannon: UNDISPUTED,2017-11-16,243083,2666,93,796,CA,Sports
LDzBX_zj9hg,CELEBRACIÓN CON LLANTOS DE LA SELECCIÓN PERÚ TRAS CLASIFICAR AL MUNDIAL LUEGO DE 36 AÑOS,Pasión90' Perú,2017-11-16,655537,4842,241,1366,CA,Sports
qBe3pYZ47ds,"Found Possible Human Bone, 2 Knives and Diamonds Underwater in River! (Scuba Diving)",DALLMYD,2017-11-17,95216,11265,108,1225,CA,Sports
7uLWqykxqjY,Golden Knights Goalie Injuries,Jens 95,2017-11-15,60282,768,12,168,CA,Sports
Rd8UD7WUIr8,Tibo InShape - Papy InShape (clip officiel),Tibo InShape,2017-11-16,670446,95714,3103,6802,CA,Sports
KPV4Pac3muA,WWE Smackdown 14 November Highlights HD - WWE Smackdown 14/11/2017 Highlights HD,Wrestling Reality II,2017-11-15,1762418,12532,1087,1234,CA,Sports
xo6EcR8xvFM,ARGENTINA vs NIGERIA 2-4 ● All Goals & Highlights HD ● 14 Nov 2017 - FRIENDLY,Football Highlights & Goals,2017-11-14,1494393,4701,643,1559,CA,Sports
ZptISqiTxsQ,Gotta See It: Chaotic bench brawl erupts between Flames and Red Wings,SPORTSNET,2017-11-16,517275,1912,85,910,CA,Sports
jKkOYEW7RvQ,Golden State Warriors vs Boston Celtics Full Game Highlights / Week 5 / 2017 NBA Season,MLG Highlights,2017-11-17,3158597,19584,995,7573,CA,Sports
Ae7rZuR9oBw,Equipe d'Algérie : Rabah Madjer - Maamar Djebbour c'est  le clash,ALGERIE Football,2017-11-14,90474,101,22,85,CA,Sports
_9BgJQMUdwY,Golden Knights score three in the 3rd to beat Canucks,NHL,2017-11-17,16708,160,10,31,CA,Sports
Zk7SYvVEqk4,Inside the NBA: The Crew Reacts to Warriors Upset by Celtics | Game Highlights and Analysis,Ximo NBA,2017-11-17,641173,3960,165,1713,CA,Sports
qBe3pYZ47ds,"Found Possible Human Bone, 2 Knives and Diamonds Underwater in River! (Scuba Diving)",DALLMYD,2017-11-17,484423,28135,294,2335,CA,Sports
FVxzk7t13HM,Titans vs. Steelers | NFL Week 11 Game Highlights,NFL,2017-11-17,960271,8827,340,1974,CA,Sports
LgZBhEMk9Gc,Golden State Warriors vs Boston Celtics - Full Game Highlights | Nov 16 | 2017-18 NBA Season,NBA Kit,2017-11-17,288228,1384,62,523,CA,Sports
Ehke7aPI9l0,"Kurt Angle & The Shield lead a Raw raid of SmackDown: SmackDown LIVE, Nov. 14, 2017",WWE,2017-11-15,4799436,98414,2650,12089,CA,Sports
ptnyAECPXLQ,Warriors Blew 17 Pt Lead! Celtics 14 Game Win Streak! Warriors vs Celtics 2017-18 Season,Chris Smoove,2017-11-17,490399,18910,188,2408,CA,Sports
KzDNW4SCIJo,"Liangelo Ball, Cody Riley & Jalen Hill Comments on Shoplifting in China",GOAT Hoops,2017-11-15,358247,3052,162,1118,CA,Sports
rgfk4qFQC2c,"Golden State Warriors vs Boston Celtics: November 16, 2017",Motion Station,2017-11-17,270451,976,126,258,CA,Sports
LDzBX_zj9hg,CELEBRACIÓN CON LLANTOS DE LA SELECCIÓN PERÚ TRAS CLASIFICAR AL MUNDIAL LUEGO DE 36 AÑOS,Pasión90' Perú,2017-11-16,709727,5271,274,1539,CA,Sports
JQb3ICATNTM,Manchester United vs Newcastle 4-1 - Highlights & Goals - 18 November 2017,FOOTBALL MINDS,2017-11-18,2331121,10674,866,1011,CA,Sports
ZptISqiTxsQ,Gotta See It: Chaotic bench brawl erupts between Flames and Red Wings,SPORTSNET,2017-11-16,581541,2234,105,951,CA,Sports
oB7ElnIr1AQ,"Maxime Villemaire, Marc-Olivier D'Amour et Francis Meilleur se battent contre la foule!",David Lagassé,2017-11-18,6587,3,0,1,CA,Sports
xegLxMmC7Rs,Real Time with Bill Maher 11-17-2017 | November 17th 2017 HBO Tonight,souljaskata,2017-11-18,115206,1217,110,383,CA,Sports
X5sJ81nGZuc,LA Clippers vs Cleveland Cavaliers Full Game Highlights / Week 5 / 2017 NBA Season,MLG Highlights,2017-11-18,1962534,9023,509,1878,CA,Sports
KLMcxlT8zEQ,"Andersen, Nylander lead Maple Leafs to 1-0 OT victory",NHL,2017-11-17,33653,323,14,67,CA,Sports
qniD1SHd42M,"New York Knicks vs. Toronto Raptors - November 17, 2017",Motion Station,2017-11-18,8915,27,6,13,CA,Sports
Zk7SYvVEqk4,Inside the NBA: The Crew Reacts to Warriors Upset by Celtics | Game Highlights and Analysis,Ximo NBA,2017-11-17,807588,4574,216,1882,CA,Sports
NTPAau4KNPQ,Leganes vs Barcelona 0-3 - All Goals & Extended Highlights - La Liga 18/11/2017 HD,GOLAZO TV,2017-11-18,1875142,11394,685,1115,CA,Sports
Ae7rZuR9oBw,Equipe d'Algérie : Rabah Madjer - Maamar Djebbour c'est  le clash,ALGERIE Football,2017-11-14,100589,134,26,105,CA,Sports
vwcbTeUQh1s,"LFR11 - Game 20 - Fredzina - NJ 0, Tor 1 (OT)",SteveDangle,2017-11-17,30515,1407,12,198,CA,Sports
LDVXOo_HXKU,"Best Survivor Series sole survivors - WWE Top 10, Nov. 18, 2017",WWE,2017-11-18,1188326,25951,1115,2263,CA,Sports
FVxzk7t13HM,Titans vs. Steelers | NFL Week 11 Game Highlights,NFL,2017-11-17,1114865,9570,393,2172,CA,Sports
W9LrfNfUrSI,NOTRE PREMIÈRE DISPUTE DE COUPLE !!,Tibo InShape,2017-11-19,992247,69528,2939,3534,CA,Sports
rynT6gpywWU,"Maple Leafs Post-Game: Auston Matthews - November 18, 2017",Toronto Maple Leafs,2017-11-19,12205,247,6,37,CA,Sports
Mof0nSLHxkk,"Andersen, Matthews lead Leafs past Habs, 6-0",NHL,2017-11-19,54885,545,37,295,CA,Sports
xegLxMmC7Rs,Real Time with Bill Maher 11-17-2017 | November 17th 2017 HBO Tonight,souljaskata,2017-11-18,198777,1784,163,523,CA,Sports
ZptISqiTxsQ,Gotta See It: Chaotic bench brawl erupts between Flames and Red Wings,SPORTSNET,2017-11-16,609245,2323,114,974,CA,Sports
tClGIRj4rTo,Why Lonzo Ball Is HATED By His Own Teammates!! Lonzo Must Be Thrown On The Bench.,Ali's Highlights,2017-11-19,375889,8901,1277,1439,CA,Sports
pC9dViGfJ2Q,Atletico Madrid vs Real Madrid 0-0 - Extended Match Highlights - La Liga 18/11/2017 HD,GOLAZO TV,2017-11-18,2029829,9322,764,2385,CA,Sports
cG0-oiy4scs,Rams vs. Vikings | NFL Week 11 Game Highlights,NFL,2017-11-19,291062,2083,67,1705,CA,Sports
nVAjY6pQZFo,Boston Celtics vs Atlanta Hawks - Full Game Highlights | Nov 18 | 2017-18 NBA Season,NBA Kit,2017-11-19,747529,2920,144,793,CA,Sports
rWOllhAi_lY,Golden State Warriors vs Philadelphia 76ers Full Game Highlights / Week 5 / 2017 NBA Season,MLG Highlights,2017-11-19,1461658,6136,370,1512,CA,Sports
6uN1eJwoL04,NEW K.O. RECORD! Zolani Tete Vs Siboniso Gonya 2017 11 18,HEY Sports,2017-11-18,37225,9,9,2,CA,Sports
RjA3-uJMiTw,"TRIPLE WOODWORK CHALLENGE W/ W2S, CHRISMD, MINIMINTER, TBJZL & MANNY!",Calfreezy,2017-11-19,340103,15808,178,570,CA,Sports
iGjGwJdGHVo,NBL Canada: Halifax Hurricanes vs St. John's Edge - 19 Nov 2017,Halifax Hurricanes,2017-11-19,2952,26,0,0,CA,Sports
NN7yRZT83pk,"NHL Power Rankings, November 18th Edition",The Hockey Guy,2017-11-19,8267,363,9,253,CA,Sports
5f0oKcvdGLs,"LFR11 - Game 21 - 6ix - Tor 6, Mtl 0",SteveDangle,2017-11-19,33945,2096,16,388,CA,Sports
FIxMhx2CLiw,Celtics Comeback Down 16 To Win 15th Straight Game! 2017-18 Season,Chris Smoove,2017-11-19,278943,10248,44,1052,CA,Sports
OCKBxmGHSlM,"Jon Jones has been exposed he doesn't even deserve to be in this sport,DC on Conor McGregor",MMA WORLD,2017-11-19,216416,3578,151,1907,CA,Sports
oB7ElnIr1AQ,"Maxime Villemaire, Marc-Olivier D'Amour et Francis Meilleur se battent contre la foule!",David Lagassé,2017-11-18,7914,4,1,1,CA,Sports
VJwoSfTOhyM,Water Bottle Flip 2 | Dude Perfect,Dude Perfect,2017-11-20,3914524,218328,3066,19437,CA,Sports
fEjag-a7TyU,Georgia Dome Implosion  - TWC Camera Man Losing It LIVE,Duston Ward,2017-11-20,578128,5705,225,777,CA,Sports
Mof0nSLHxkk,"Andersen, Matthews lead Leafs past Habs, 6-0",NHL,2017-11-19,64800,630,44,336,CA,Sports
kj_INeVXuXU,Washington Wizards vs Toronto Raptors Full Game Highlights / Week 5 / 2017 NBA Season,MLG Highlights,2017-11-19,211515,805,35,383,CA,Sports
W9LrfNfUrSI,NOTRE PREMIÈRE DISPUTE DE COUPLE !!,Tibo InShape,2017-11-19,1367664,84460,4564,4186,CA,Sports
ft5aY1I22j4,Gravity is Overrated | Weightless,Outside TV,2017-11-10,487894,12963,302,403,CA,Sports
wx-M8sxcOp8,Eagles vs. Cowboys | NFL Week 11 Game Highlights,NFL,2017-11-20,1056220,8709,509,4358,CA,Sports
5f0oKcvdGLs,"LFR11 - Game 21 - 6ix - Tor 6, Mtl 0",SteveDangle,2017-11-19,39002,2236,20,408,CA,Sports
RjA3-uJMiTw,"TRIPLE WOODWORK CHALLENGE W/ W2S, CHRISMD, MINIMINTER, TBJZL & MANNY!",Calfreezy,2017-11-19,570276,21538,310,690,CA,Sports
tClGIRj4rTo,Why Lonzo Ball Is HATED By His Own Teammates!! Lonzo Must Be Thrown On The Bench.,Ali's Highlights,2017-11-19,606692,11564,2321,2193,CA,Sports
v-cXArR7of8,"Kurt Angle threatens to retaliate against Triple H: Raw, Nov. 20, 2017",WWE,2017-11-21,614817,16542,395,1699,CA,Sports
X4wQLfMtKGM,"Maple Leafs Pre-Game: Mitch Marner - November 20, 2017",Toronto Maple Leafs,2017-11-20,1730,25,0,1,CA,Sports
DcCA7O6P1u0,Grading all 31 NHL Teams at the Quarter Mark 2017,The Hockey Guy,2017-11-20,7440,327,6,197,CA,Sports
bdmCAfFUC20,'Maci & Chelsea Discuss Drug Abuse' Official Sneak Peek | Teen Mom 2: Reunion | MTV,MTV,2017-11-20,57022,316,12,30,CA,Sports
XycGoUNcgEs,Raptors Avenge Only Home Loss! John Wall Sore Knee Wizards vs Raptors 2017-18 Season,Chris Smoove,2017-11-20,158766,5793,23,390,CA,Sports
fdaFGfjfFeM,Paige Return Raw Attack Sasha Bank Bayley WWE Raw 20 November 2017 Monday Night Raw 11/20/17,WWE Full Show On Request,2017-11-21,154964,1394,98,374,CA,Sports
ig6xEJ-g5ko,Seatmates on Air Canucks,Canucks,2017-11-20,5181,194,2,23,CA,Sports
MjYGgah15Kk,"A warning sent to Tyron Woodley and Conor McGregor,GSP vs Whittaker UFC 221?",MMA WORLD,2017-11-20,233310,2796,138,1503,CA,Sports
bu2LaqQaDjw,Marc Bergevin's reaction to Leafs goals,Hockey is life,2017-11-19,24478,146,18,132,CA,Sports
pC9dViGfJ2Q,Atletico Madrid vs Real Madrid 0-0 - Extended Match Highlights - La Liga 18/11/2017 HD,GOLAZO TV,2017-11-18,2304099,10084,856,2539,CA,Sports
VJwoSfTOhyM,Water Bottle Flip 2 | Dude Perfect,Dude Perfect,2017-11-20,8839267,395070,6146,28049,CA,Sports
fEjag-a7TyU,Georgia Dome Implosion  - TWC Camera Man Losing It LIVE,Duston Ward,2017-11-20,1053325,9973,499,1514,CA,Sports
tEA_n4mmBok,"Paige returns to WWE alongside Raw newcomers Mandy Rose and Sonya Deville: Raw, Nov. 20, 2017",WWE,2017-11-21,2051979,44906,1642,9802,CA,Sports
TkOufDh_OYU,Oklahoma City Thunder vs New Orleans Pelicans - Full Game Highlights | Nov 20 | 2017-18 NBA Season,NBA Kit,2017-11-21,689014,1552,167,839,CA,Sports
jvaHa5m-V3Q,Cleveland Cavaliers vs Detroit Pistons Full Game Highlights / Week 6 / 2017 NBA Season,MLG Highlights,2017-11-21,1670899,6511,375,1506,CA,Sports
ZyMByVSIEKE,Sevilla vs Liverpool 3-3 ● All Goals & Highlights HD ● 21 Nov 2017 - Champions League,Football Highlights & Goals,2017-11-21,749817,3897,378,653,CA,Sports
g_Z6cil3BBk,Stephen A. Smith reacts to LaVar Ball's CNN interview on President Trump | First Take | ESPN,ESPN,2017-11-21,391033,3320,357,2899,CA,Sports
4KiM_ng46dg,Found Old Cash Register in River While Scuba Diving! (Money Inside??),DALLMYD,2017-11-22,196680,13680,154,1089,CA,Sports
Ah7WUGALNhQ,"How to choose your Flex, Stick Height, Curve, and handedness - Kids Hockey Sticks",Coach Jeremy,2017-11-21,15398,363,3,67,CA,Sports
Jts0uiY03iY,Falcons vs. Seahawks | NFL Week 11 Game Highlights,NFL,2017-11-21,998737,8633,440,3270,CA,Sports
8SkCDP0muso,PSG vs Celtic 5-0 All Goals & Highlights - RESUMEN & GOLES (Last 2 Matches) HD,WePerfect Ed,2017-11-21,1188783,4411,596,367,CA,Sports
Mof0nSLHxkk,"Andersen, Matthews lead Leafs past Habs, 6-0",NHL,2017-11-19,66546,643,45,331,CA,Sports
Zk3lpy5bjac,Skip and Shannon react to Lonzo Ball walking away from a scuffle against the Suns | UNDISPUTED,Skip and Shannon: UNDISPUTED,2017-11-21,257863,2522,190,1149,CA,Sports
W9LrfNfUrSI,NOTRE PREMIÈRE DISPUTE DE COUPLE !!,Tibo InShape,2017-11-19,1525396,89326,5116,4380,CA,Sports
8xs7MHze0hA,Masked Kyrie Irving 47 Points! Celtics 16 Game Win Streak! 2017-18 Season,Chris Smoove,2017-11-21,389099,13593,106,1101,CA,Sports
B-AiYUk9tIM,"LFR11 - Game 22 - Raant - Ari 4, Tor 1",SteveDangle,2017-11-21,23972,1213,43,538,CA,Sports
VJwoSfTOhyM,Water Bottle Flip 2 | Dude Perfect,Dude Perfect,2017-11-20,10552150,438807,7340,30559,CA,Sports
fEjag-a7TyU,Georgia Dome Implosion  - TWC Camera Man Losing It LIVE,Duston Ward,2017-11-20,1154618,10487,528,1647,CA,Sports
tEA_n4mmBok,"Paige returns to WWE alongside Raw newcomers Mandy Rose and Sonya Deville: Raw, Nov. 20, 2017",WWE,2017-11-21,2399289,48182,1870,10586,CA,Sports
uUOru0pwXO0,Roy Moore Met Wife At Recital? | The View,The View,2017-11-22,53347,552,32,263,CA,Sports
g_Z6cil3BBk,Stephen A. Smith reacts to LaVar Ball's CNN interview on President Trump | First Take | ESPN,ESPN,2017-11-21,556623,4301,515,3645,CA,Sports
B-AiYUk9tIM,"LFR11 - Game 22 - Raant - Ari 4, Tor 1",SteveDangle,2017-11-21,28904,1356,47,608,CA,Sports
ovQ1VTJ_IUI,Gotta See It: Canadiens' Benn finishes check on brother Jamie with parents in attendance,SPORTSNET,2017-11-22,174227,1242,14,184,CA,Sports
imv_Cz8V_LQ,"Golden State Warriors vs OKC Thunder - Full Game Highlights | November 22, 2017 | NBA Season 2017-18",Rapid Highlights,2017-11-23,116843,575,34,284,CA,Sports
QEgSzHPFlF4,ATLETICO MADRID vs AS ROMA 2-0 ● All Goals & Highlights HD ● 22 Nov 2017 - CHAMPIONS LEAGUE,Football Highlights & Goals,2017-11-22,359421,1706,149,160,CA,Sports
vm1MHePQXUI,Should the Lakers already regret drafting Lonzo Ball? | UNDISPUTED,Skip and Shannon: UNDISPUTED,2017-11-22,236863,2515,212,1394,CA,Sports
4KiM_ng46dg,Found Old Cash Register in River While Scuba Diving! (Money Inside??),DALLMYD,2017-11-22,456364,24211,323,1497,CA,Sports
Jts0uiY03iY,Falcons vs. Seahawks | NFL Week 11 Game Highlights,NFL,2017-11-21,1131052,9276,495,3432,CA,Sports
C-5qa_kdxVU,"【NBA】Golden State Warriors vs OKC Thunder - Full Game Highlights  Nov 22, 2017  2017-18 NBA Season",Ximo Pierto,2017-11-23,288515,4419,205,1005,CA,Sports
eowaHzGVTgk,Best Dish You Can Cook?,NHL,2017-11-21,24276,557,7,105,CA,Sports
ENZYxdKFPn0,"Golden State Warriors vs OKC Thunder - Full Game Highlights | Nov 22, 2017 | 2017-18 NBA Season",Ximo Pierto,2017-11-23,1333050,8602,356,2651,CA,Sports
VJwoSfTOhyM,Water Bottle Flip 2 | Dude Perfect,Dude Perfect,2017-11-20,11474521,457989,7923,28571,CA,Sports
oi0lucy8fxI,Dude Perfect Sumo Soccer | FACE OFF,Whistle Sports,2017-11-23,1061604,22399,1026,1392,CA,Sports
lLK9BBXCAEw,"Kevin Durant Talking Shit To Russell Westbrook,KD Called Russ A Pussy ！",DunkFest,2017-11-23,995983,4455,195,2887,CA,Sports
fEjag-a7TyU,Georgia Dome Implosion  - TWC Camera Man Losing It LIVE,Duston Ward,2017-11-20,1190081,10587,537,749,CA,Sports
zUqoCaYPcGk,Mason guides Jets to 2-1 victory against Kings,NHL,2017-11-23,11408,103,2,46,CA,Sports
Z2T4cyRUoTc,"Nazem Kadri slams stick in penalty box, hits NHL official",SPORTSNET,2017-11-23,80504,258,13,225,CA,Sports
tEA_n4mmBok,"Paige returns to WWE alongside Raw newcomers Mandy Rose and Sonya Deville: Raw, Nov. 20, 2017",WWE,2017-11-21,2535833,49279,1945,6891,CA,Sports
fDGWi4eUjRY,Chargers vs. Cowboys | NFL Week 12 Game Highlights,NFL,2017-11-24,215895,2521,174,2055,CA,Sports
HCtObPe4Sf8,Sweeping Through Pennsylvania - All Access,Canucks,2017-11-23,5371,164,2,27,CA,Sports
33LIRKhj1cg,"Brooklyn Nets vs Cleveland Cavaliers - Full Game Highlights | November 22, 2017 | NBA Season 2017-18",Rapid Highlights,2017-11-23,322607,1035,70,410,CA,Sports
fxYRWt_GQlw,"【NBA】Boston Celtics vs Miami Heat - Full Game Highlights  November 22, 2017  2017-18 NBA Season",Ximo Pierto,2017-11-23,510055,1638,118,288,CA,Sports
7ZTSUAv9kLQ,Miami Heat Snap Celtics 16 Game Winning Streak! 2017-18 Season,Chris Smoove,2017-11-23,304800,10170,98,1174,CA,Sports
Ww20vcuOWio,Thunder def. Warriors 108-91 - What did you learn about Kevin Durant & Russell Westbrook?,First Take 10Am,2017-11-23,208486,1059,134,505,CA,Sports
uUOru0pwXO0,Roy Moore Met Wife At Recital? | The View,The View,2017-11-22,69082,667,45,347,CA,Sports
_aNk5WkMQNU,Stephen A. reacts to President Trump calling LaVar Ball an 'ungrateful fool' | First Take | ESPN,ESPN,2017-11-22,426147,3486,533,2625,CA,Sports
ENZYxdKFPn0,"Golden State Warriors vs OKC Thunder - Full Game Highlights | Nov 22, 2017 | 2017-18 NBA Season",Ximo Pierto,2017-11-23,1784585,10139,477,2747,CA,Sports
Z2T4cyRUoTc,"Nazem Kadri slams stick in penalty box, hits NHL official",SPORTSNET,2017-11-23,107666,325,19,351,CA,Sports
VJwoSfTOhyM,Water Bottle Flip 2 | Dude Perfect,Dude Perfect,2017-11-20,12355872,474027,8390,29644,CA,Sports
oi0lucy8fxI,Dude Perfect Sumo Soccer | FACE OFF,Whistle Sports,2017-11-23,1547590,27711,1306,1670,CA,Sports
lLK9BBXCAEw,"Kevin Durant Talking Shit To Russell Westbrook,KD Called Russ A Pussy ！",DunkFest,2017-11-23,1117397,4628,209,2982,CA,Sports
FWPZzOlfkGI,Cleveland Cavaliers vs Charlotte Hornets Full Game Highlights / Week 6 / 2017 NBA Season,MLG Highlights,2017-11-25,498664,4532,205,1165,CA,Sports
Ww20vcuOWio,Thunder def. Warriors 108-91 - What did you learn about Kevin Durant & Russell Westbrook?,First Take 10Am,2017-11-23,346567,1527,210,647,CA,Sports
3Puo92lyFck,"LFR11 - Game 23 - Sunny - Tor 1, Fla 2 (SO)",SteveDangle,2017-11-23,23124,987,17,262,CA,Sports
fEjag-a7TyU,Georgia Dome Implosion  - TWC Camera Man Losing It LIVE,Duston Ward,2017-11-20,1210184,10652,548,754,CA,Sports
mugFX9RL2MI,SAUCE GOLF VS MY DAD!,Tyler Day,2017-11-24,8659,267,10,62,CA,Sports
fDGWi4eUjRY,Chargers vs. Cowboys | NFL Week 12 Game Highlights,NFL,2017-11-24,550039,4018,304,2821,CA,Sports
nMO_xfBbBCs,"Ehlers, Little lift Jets past Ducks, 4-1",NHL,2017-11-25,1954,38,3,81,CA,Sports
tEA_n4mmBok,"Paige returns to WWE alongside Raw newcomers Mandy Rose and Sonya Deville: Raw, Nov. 20, 2017",WWE,2017-11-21,2641858,50048,2011,7087,CA,Sports
FcOocaULa0w,Incredibile liscio di Leonardo Bonucci in Milan - Austria Vienna 5-1,Mondo Sport Live,2017-11-23,90475,64,6,9,CA,Sports
2CgA8R_fakU,Michael Bisping vs Kelvin Gastelum K.O Full Fight 25th November 2017 : UFC 122 Bisping vs Gastelum,UFC TV,2017-11-25,554147,2278,229,1893,CA,Sports
F3T38_a0bN8,Liverpool vs Chelsea 1-1 - Highlights & Goals - 25 November 2017,FOOTBALL MINDS,2017-11-25,1320828,6177,506,924,CA,Sports
VJwoSfTOhyM,Water Bottle Flip 2 | Dude Perfect,Dude Perfect,2017-11-20,13234006,488656,8870,30713,CA,Sports
ENZYxdKFPn0,"Golden State Warriors vs OKC Thunder - Full Game Highlights | Nov 22, 2017 | 2017-18 NBA Season",Ximo Pierto,2017-11-23,1950255,10624,530,2891,CA,Sports
xlWyucShmRU,Seguin notches hat trick in Stars' 6-4 win,NHL,2017-11-25,12811,141,4,29,CA,Sports
sPQ-7mdeuHY,Real Madrid vs Malaga 3-2 - All Goals & Extended Highlights - La Liga 25/11/2017 HD,GOLAZO TV,2017-11-25,1407953,7654,959,1381,CA,Sports
Z2T4cyRUoTc,"Nazem Kadri slams stick in penalty box, hits NHL official",SPORTSNET,2017-11-23,116007,337,22,369,CA,Sports
FWPZzOlfkGI,Cleveland Cavaliers vs Charlotte Hornets Full Game Highlights / Week 6 / 2017 NBA Season,MLG Highlights,2017-11-25,1565904,8288,420,1711,CA,Sports
oi0lucy8fxI,Dude Perfect Sumo Soccer | FACE OFF,Whistle Sports,2017-11-23,1690173,28996,1375,1724,CA,Sports
Hb2vcvpJozA,Stephen Curry 26 Points 2nd QTR! Warriors Win By 49 vs Bulls! 2017-18 Season,Chris Smoove,2017-11-25,310050,9998,95,890,CA,Sports
K1K0piNm3IE,NEW Funny NBA Interviews 2017-2018,GOAT Hoops,2017-11-24,168500,1502,40,161,CA,Sports
FC0RR_TsqQs,"LFR11 - Game 24 - Anderstorm - Tor 5, Car 4",SteveDangle,2017-11-25,17020,977,10,147,CA,Sports
2CgA8R_fakU,Michael Bisping vs Kelvin Gastelum K.O Full Fight 25th November 2017 : UFC 122 Bisping vs Gastelum,UFC TV,2017-11-25,794262,3089,337,2282,CA,Sports
Kd1xVG6f2No,Michael Crabtree vs. Aqib Talib Fight | Broncos vs. Raiders | NFL,Highlight Heaven,2017-11-26,728572,4110,194,1988,CA,Sports
4wqvrjHAwNM,Monaco vs PSG 1-2 - Highlights & Goals - 26 November 2017,FOOTBALL MINDS,2017-11-26,1546774,11002,773,730,CA,Sports
C5bxMYpTazk,"Backlund, Rittich lead Flames to 3-2 win against Avs",NHL,2017-11-26,9660,102,3,16,CA,Sports
kRupYgqwtf8,Bills vs. Chiefs | NFL Week 12 Game Highlights,NFL,2017-11-26,191815,1308,85,924,CA,Sports
FC0RR_TsqQs,"LFR11 - Game 24 - Anderstorm - Tor 5, Car 4",SteveDangle,2017-11-25,21704,1134,10,161,CA,Sports
iiOzcMQiDZs,Valencia vs Barcelona 1-1 - All Goals & Extended Highlights - La Liga 26/11/2017 HD,GOLAZO TV,2017-11-26,999860,5586,481,1693,CA,Sports
OSFdiFnkhQE,Gotta See It: Bieksa drops Andreoff with patented one-punch KO,SPORTSNET,2017-11-26,112608,452,10,141,CA,Sports
czsQN71it48,"OKC Thunder vs Dallas Mavericks - Full Game Highlights | November 25, 2017 | 2017-18 NBA Season",Ximo Pierto,2017-11-26,305060,1103,92,930,CA,Sports
FWPZzOlfkGI,Cleveland Cavaliers vs Charlotte Hornets Full Game Highlights / Week 6 / 2017 NBA Season,MLG Highlights,2017-11-25,1700321,8631,445,1762,CA,Sports
VJwoSfTOhyM,Water Bottle Flip 2 | Dude Perfect,Dude Perfect,2017-11-20,13963525,499346,9279,31544,CA,Sports
BXREg5yPf9A,2017 Abu Dhabi Grand Prix | Race Highlights,FORMULA 1,2017-11-26,379554,7925,213,1136,CA,Sports
QNgrDIFs1Ug,Masked Kyrie Irving Got Darren Collison Leaning! Celtics vs Pacers 2017-18 Season,Chris Smoove,2017-11-26,400304,12153,71,790,CA,Sports
Kd1xVG6f2No,Michael Crabtree vs. Aqib Talib Fight | Broncos vs. Raiders | NFL,Highlight Heaven,2017-11-26,1394388,5813,419,2948,CA,Sports
QzfnWcHhdyQ,Packers vs. Steelers | NFL Week 12 Game Highlights,NFL,2017-11-27,1172709,11033,958,3510,CA,Sports
VKW64fQwzRc,CFL 105th Grey Cup - Calgary Stampeders vs Toronto Argonauts Full Highlights,CFL Insider,2017-11-27,29733,290,18,168,CA,Sports
4wqvrjHAwNM,Monaco vs PSG 1-2 - Highlights & Goals - 26 November 2017,FOOTBALL MINDS,2017-11-26,2656569,14639,1138,1105,CA,Sports
unhZDGTTCVo,CFL Grey Cup 2017: Stampeders vs Argonauts (24-27),Torontomapleleafs951,2017-11-27,26480,114,6,40,CA,Sports
iiOzcMQiDZs,Valencia vs Barcelona 1-1 - All Goals & Extended Highlights - La Liga 26/11/2017 HD,GOLAZO TV,2017-11-26,1472251,7194,654,2032,CA,Sports
hfFas8XfTKk,Stephen A. Smith: Cavaliers shouldn't want Derrick Rose back on team | First Take | ESPN,ESPN,2017-11-27,568161,4779,395,1565,CA,Sports
Vb_Mif1ZEe4,'Got Your Back' Official Sneak Peek | Teen Mom OG (Season 7) | MTV,MTV,2017-11-27,59897,502,13,81,CA,Sports
thyvXWn-6Mg,Toronto Argos hand Calgary Stampers stunning Grey Cup defeat,Toronto Star,2017-11-27,4373,3,2,3,CA,Sports
OSFdiFnkhQE,Gotta See It: Bieksa drops Andreoff with patented one-punch KO,SPORTSNET,2017-11-26,143706,502,10,153,CA,Sports
UvAqIR7BQFU,"Price shuts out Sabres, 3-0, in return from injury",NHL,2017-11-26,25136,259,18,90,CA,Sports
YL9sNrOlK-I,2 wingsuit flyers BASE jump into a plane in mid-air. | A Door In The Sky,Red Bull,2017-11-28,528664,9387,140,727,CA,Sports
oTAIAE1qiNQ,VOUS AVEZ UN INCROYABLE TALENT !!,Tibo InShape,2017-11-28,749538,57763,924,5125,CA,Sports
Kd1xVG6f2No,Michael Crabtree vs. Aqib Talib Fight | Broncos vs. Raiders | NFL,Highlight Heaven,2017-11-26,1589286,6240,473,3185,CA,Sports
UMKGdivcKpQ,"Canada Soccer's Women's National Team v Norway International Friendly LIVE from Marbella, ESP",Canada Soccer,2017-11-28,10803,81,4,3,CA,Sports
VKW64fQwzRc,CFL 105th Grey Cup - Calgary Stampeders vs Toronto Argonauts Full Highlights,CFL Insider,2017-11-27,44661,379,28,284,CA,Sports
9gIOOxlV0Ys,Stephen A. Smith is 'petrified' Lonzo Ball is a bust | First Take | ESPN,ESPN,2017-11-28,740561,6964,414,3114,CA,Sports
HZpI5BsW1ZA,Lonzo Ball scores 3 points vs Clippers - Should the Lakers be worried he's a bust? | UNDISPUTED,Skip and Shannon: UNDISPUTED,2017-11-28,340633,3117,148,1687,CA,Sports
HdrIShEM60Q,Cleveland Cavaliers vs Miami Heat Full Game Highlights / Week 7 / 2017 NBA Season,MLG Highlights,2017-11-29,520378,2934,128,728,CA,Sports
QzfnWcHhdyQ,Packers vs. Steelers | NFL Week 12 Game Highlights,NFL,2017-11-27,1332547,11898,1033,3678,CA,Sports
xCyzsBH2K-U,"Gallagher, Price lead Canadiens past Jackets, 3-1",NHL,2017-11-28,29499,303,10,163,CA,Sports
oGXSn4fiLok,"Cleveland Cavaliers vs Philadelphia Sixers - Full Highlights | Nov 27, 2017 | 2017-18 NBA Season",Ximo Pierto,2017-11-28,485144,2240,85,664,CA,Sports
0KAgwnlbwEw,Best Gift ideas for any Hockey Players 2017,Hockey Tutorial,2017-11-28,6811,276,3,65,CA,Sports
IAqetXwohqI,What's the last thing the Habs Googled?,Canadiens de Montréal,2017-11-28,4227,199,0,13,CA,Sports
YL9sNrOlK-I,2 wingsuit flyers BASE jump into a plane in mid-air. | A Door In The Sky,Red Bull,2017-11-28,1699436,20220,348,1314,CA,Sports
8-L392k6IoU,"Toronto Maple Leafs vs Calgary Flames - November 28, 2017 | Game Highlights | NHL 2017/18. Обзор",PRO Hockey,2017-11-29,12951,54,4,8,CA,Sports
oTAIAE1qiNQ,VOUS AVEZ UN INCROYABLE TALENT !!,Tibo InShape,2017-11-28,1138890,74433,1499,6606,CA,Sports
2dOZP79aHgE,Four different Leafs score in 4-1 win against Flames,NHL,2017-11-29,41770,278,24,98,CA,Sports
wt8yp4sE1qQ,Pacioretty shocked after Drouin unknowingly jumped on ice without skate blades,SPORTSNET,2017-11-28,130028,701,16,72,CA,Sports
9gIOOxlV0Ys,Stephen A. Smith is 'petrified' Lonzo Ball is a bust | First Take | ESPN,ESPN,2017-11-28,1045370,8709,576,3938,CA,Sports
atnjrUzgG_s,PSG vs Troyes 2-0 - Highlights & Goals - 29 November 2017,FOOTBALL MINDS,2017-11-29,1176365,9506,676,890,CA,Sports
Wp4Z2CAFIE8,FT Arsenal 5 - 0 Huddersfield,Stadium Astro,2017-11-29,579931,2928,128,360,CA,Sports
HdrIShEM60Q,Cleveland Cavaliers vs Miami Heat Full Game Highlights / Week 7 / 2017 NBA Season,MLG Highlights,2017-11-29,1425273,5602,293,967,CA,Sports
KH7HSHQI6IY,Joe Rogan Reacts to Conor McGregor Beat up guy in Bar,Octagon News,2017-11-29,335882,1238,243,730,CA,Sports
Kd1xVG6f2No,Michael Crabtree vs. Aqib Talib Fight | Broncos vs. Raiders | NFL,Highlight Heaven,2017-11-26,1660394,6393,487,3338,CA,Sports
HZpI5BsW1ZA,Lonzo Ball scores 3 points vs Clippers - Should the Lakers be worried he's a bust? | UNDISPUTED,Skip and Shannon: UNDISPUTED,2017-11-28,508632,3892,213,1978,CA,Sports
YL9sNrOlK-I,2 wingsuit flyers BASE jump into a plane in mid-air. | A Door In The Sky,Red Bull,2017-11-28,2432670,25499,471,1749,CA,Sports
2dOZP79aHgE,Four different Leafs score in 4-1 win against Flames,NHL,2017-11-29,49034,336,28,111,CA,Sports
aHFC_GIq9NA,Hitman Holla & DC Young Fly Shoot Their Shot 'Official Sneak Peek' | Wild 'N Out | MTV,MTV,2017-11-30,463512,10497,100,611,CA,Sports
wt8yp4sE1qQ,Pacioretty shocked after Drouin unknowingly jumped on ice without skate blades,SPORTSNET,2017-11-28,153211,788,21,74,CA,Sports
9gIOOxlV0Ys,Stephen A. Smith is 'petrified' Lonzo Ball is a bust | First Take | ESPN,ESPN,2017-11-28,1120572,9089,625,4056,CA,Sports
atnjrUzgG_s,PSG vs Troyes 2-0 - Highlights & Goals - 29 November 2017,FOOTBALL MINDS,2017-11-29,1820027,11704,932,1139,CA,Sports
MdRkQ28Ktw4,GS Warriors vs LA Lakers Full Game Highlights / Week 7 / 2017 NBA Season,MLG Highlights,2017-11-30,1426035,6407,318,1686,CA,Sports
HUAaTsSYQaU,"LFR11 - Game 26 - Mans Not Hot - Tor 4, Cgy 1",SteveDangle,2017-11-29,26569,1448,12,282,CA,Sports
kb1XvgKgfpw,FT Everton 4 - 0 West Ham,Stadium Astro,2017-11-29,659842,3481,133,422,CA,Sports
OKJSWaGDMXA,Stephen Curry vs Lonzo Ball! Curry 13 Points in Overtime! Warriors vs Lakers 2017-18 Season,Chris Smoove,2017-11-30,450817,14867,116,1116,CA,Sports
oTAIAE1qiNQ,VOUS AVEZ UN INCROYABLE TALENT !!,Tibo InShape,2017-11-28,1279340,79145,1695,7032,CA,Sports
HZpI5BsW1ZA,Lonzo Ball scores 3 points vs Clippers - Should the Lakers be worried he's a bust? | UNDISPUTED,Skip and Shannon: UNDISPUTED,2017-11-28,530790,3971,220,2008,CA,Sports
KH7HSHQI6IY,Joe Rogan Reacts to Conor McGregor Beat up guy in Bar,Octagon News,2017-11-29,516577,1741,340,967,CA,Sports
tJFg3td4dPY,"Match Highlights: Columbus Crew SC at Toronto FC (2nd-Leg) - November 29, 2017",Toronto FC,2017-11-30,16618,245,9,82,CA,Sports
XLDjjQDHc8M,Desiigner VS. Nick Cannon & Some 'Girl on Girl on Girl' Action | Wild 'N Out | #Wildstyle,MTV,2017-12-01,564789,12479,138,385,CA,Sports
qDcQww9IXzE,"Thank you, Rider Nation!",Saskatchewan Roughriders,2017-12-01,6448,127,5,6,CA,Sports
YL9sNrOlK-I,2 wingsuit flyers BASE jump into a plane in mid-air. | A Door In The Sky,Red Bull,2017-11-28,2801054,28934,554,1959,CA,Sports
J97oLRHJKSw,"Maple Leafs outlast Oilers, 6-4",NHL,2017-12-01,58862,431,25,236,CA,Sports
KK6eEPQMOEs,"Raptors Post-Game: Drake Interviews Kyle Lowry - November 29, 2017",Toronto Raptors,2017-11-30,18462,275,1,21,CA,Sports
Em9EI37Yy9g,Redskins vs. Cowboys | NFL Week 13 Game Highlights,NFL,2017-12-01,928939,8872,505,2803,CA,Sports
X4quXDeFyhk,Cleveland Cavaliers vs Atlanta Hawks Full Game Highlights / Week 7 / 2017 NBA Season,MLG Highlights,2017-12-01,1446819,6746,361,1509,CA,Sports
oCoVIbUESJ8,"Toronto Maple Leafs vs Edmonton Oilers - November 30, 2017 | Game Highlights | NHL 2017/18. Обзор",PRO Hockey,2017-12-01,13579,75,7,15,CA,Sports
QSauCNx3zHo,"Kris Russell scores slapper on his own net, Oilers lose",SPORTSNET,2017-12-01,63535,361,16,239,CA,Sports
yzQAqKy4XVU,LE MEILLEUR BURGER AU MONDE !!,Tibo InShape,2017-12-01,622211,49605,1058,2832,CA,Sports
1xQyWyJ3a94,The UNTOLD Truth About DeMarcus Cousins,Mike Korzemba,2017-12-01,219182,10523,173,1378,CA,Sports
5nj1UNhmUHM,LA POLICE ARRÊTE NOTRE PRANK!,Wass Freestyle,2017-12-01,315626,24798,415,1226,CA,Sports
44atHL-bTEI,Stephen A. Smith says LeBron James should consider going to 76ers | First Take | ESPN,ESPN,2017-11-30,414256,2833,175,1133,CA,Sports
beTvLwWQiYk,2018 FIFA World Cup Russia Final Draw - LIVE info graphic presentation,FIFATV,2017-12-01,511772,4585,531,775,CA,Sports
OKJSWaGDMXA,Stephen Curry vs Lonzo Ball! Curry 13 Points in Overtime! Warriors vs Lakers 2017-18 Season,Chris Smoove,2017-11-30,485805,15392,123,1156,CA,Sports
XLDjjQDHc8M,Desiigner VS. Nick Cannon & Some 'Girl on Girl on Girl' Action | Wild 'N Out | #Wildstyle,MTV,2017-12-01,945462,18433,247,789,CA,Sports
J97oLRHJKSw,"Maple Leafs outlast Oilers, 6-4",NHL,2017-12-01,68202,495,29,266,CA,Sports
tJELPsUhiQ8,Stephen Colbert monologue 12/1/17 : Coffee Joe Calls Trump Cuckoo !,Federica Balsamo,2017-12-02,194896,948,141,218,CA,Sports
YL9sNrOlK-I,2 wingsuit flyers BASE jump into a plane in mid-air. | A Door In The Sky,Red Bull,2017-11-28,3027415,31069,614,2060,CA,Sports
hFpRf9QnOW8,Chelsea vs Newcastle 3-1 Highlights & Goals 02 December 2017 HD,WePerfect Ed,2017-12-02,311237,1134,97,50,CA,Sports
eEDLBCoByAI,Daniel Sedin | Letter from Markus Naslund,Canucks,2017-12-03,1626,98,0,8,CA,Sports
tTjMJpkYYRg,"Open Gym, presented by Bell S6E7 - Swing",Toronto Raptors,2017-12-01,17570,358,3,51,CA,Sports
QSauCNx3zHo,"Kris Russell scores slapper on his own net, Oilers lose",SPORTSNET,2017-12-01,76805,396,17,250,CA,Sports
X6VRraRK6UI,Barcelona vs Celta Vigo 2-2 - Highlights & Goals - 02 December 2017,FOOTBALL MINDS,2017-12-02,1085480,5158,546,190,CA,Sports
vFS2aH90_fc,Arsenal 1 Man Utd 3 | De Gea Could Save The Titanic!!! (DT Frustrated),ArsenalFanTV,2017-12-02,285499,6529,511,2616,CA,Sports
qDcQww9IXzE,"Thank you, Rider Nation!",Saskatchewan Roughriders,2017-12-01,8044,140,6,9,CA,Sports
XLDjjQDHc8M,Desiigner VS. Nick Cannon & Some 'Girl on Girl on Girl' Action | Wild 'N Out | #Wildstyle,MTV,2017-12-01,1176511,21082,314,854,CA,Sports
KSkyxpieUI0,Alistair Overeem vs Francis Ngannou - FULL FIGHT Highlights - UFC 218 - KNOCKOUT,BLACK TIGER,2017-12-03,534912,1250,139,1084,CA,Sports
8y5OlHzhwFc,⚡UFC 218 Alistar Overeem vs Francis Ngannou - 🔥Brutal Knockout.Don't  Blink,King of Metal,2017-12-03,826676,3710,191,2507,CA,Sports
Lf2mkD0G1iQ,"Byron, Galchenyuk lead Habs to 10-1 rout of Red Wings",NHL,2017-12-03,64307,853,48,490,CA,Sports
fliOp6c95oA,Jose Aldo vs Max Holloway LUTA COMPLETA - UFC 03/12/2017,iCompsBR,2017-12-03,1242641,0,0,2647,CA,Sports
tJELPsUhiQ8,Stephen Colbert monologue 12/1/17 : Coffee Joe Calls Trump Cuckoo !,Federica Balsamo,2017-12-02,248438,1134,181,264,CA,Sports
91tA9KU7v_4,Dana White Reacts to Francis Ngannou def. Alistair Overeem via KO,Octagon News,2017-12-03,278017,1037,105,818,CA,Sports
EIdzdUZuL-E,Barcelona vs Celta Vigo 2-2 - All Goals & Extended Highlights - La Liga 02/12/2017 HD,GOLAZO TV,2017-12-02,1733060,9498,727,663,CA,Sports
vkM2-91Hq8I,"MMA Community Reacts to Francis Ngannou's Brutal Knockout of Overeem,Max Holloway on Conor McGregor",MMA WORLD,2017-12-03,286580,3764,198,1607,CA,Sports
301yDF2fIf4,Patriots vs. Bills | NFL Week 13 Game Highlights,NFL,2017-12-03,324779,2909,143,1428,CA,Sports
Ldin8eQDGFM,Cleveland Cavaliers vs Memphis Grizzlies Full Game Highlights / Week 7 / Dec 2,MLG Highlights,2017-12-03,1437340,7173,338,1626,CA,Sports
N2UPaPrYVLI,Joel Embiid vs Andre Drummond! Ben Simmons Flagrant Foul! 2017-18 Season,Chris Smoove,2017-12-03,221698,7580,42,632,CA,Sports
PGrvA97SzKY,JE METS DES TALONS À CAUSE D'ELLE!,Wass Freestyle,2017-12-03,397143,38519,466,2425,CA,Sports
-RmUADCWI4A,All Sports Golf Battle 2 | Dude Perfect,Dude Perfect,2017-12-04,3687609,175553,2508,17350,CA,Sports
CgjAN_wgmiI,Rob Gronkowski DIRTY Hit On Tre'Davious White | Pats vs. Bills | NFL,Highlight Heaven,2017-12-03,851150,2532,361,4289,CA,Sports
xl3HhY2BTuU,Eagles vs. Seahawks | NFL Week 13 Game Highlights,NFL,2017-12-04,1270477,12058,620,6865,CA,Sports
Lf2mkD0G1iQ,"Byron, Galchenyuk lead Habs to 10-1 rout of Red Wings",NHL,2017-12-03,79084,1019,56,543,CA,Sports
XLDjjQDHc8M,Desiigner VS. Nick Cannon & Some 'Girl on Girl on Girl' Action | Wild 'N Out | #Wildstyle,MTV,2017-12-01,1307338,22331,342,931,CA,Sports
fliOp6c95oA,Jose Aldo vs Max Holloway LUTA COMPLETA - UFC 03/12/2017,iCompsBR,2017-12-03,1770432,0,0,2562,CA,Sports
Zv_Pf0eWhgs,NBA Crossovers and Ankle Breakers of 2017-18 Season,World of Basketball,2017-12-03,727611,4152,245,382,CA,Sports
sm9u0_9ejO0,Golden State Warriors vs Miami Heat Full Game Highlights / Week 7 / Dec 3,MLG Highlights,2017-12-04,1118920,4496,244,887,CA,Sports
yFIZd03O_XQ,JE COMBATS LA CHAMPIONNE DU MONDE DE BOXE !!,Tibo InShape,2017-12-04,616404,48244,551,2680,CA,Sports
jFKV4SzD1i4,"Russell Westbrook Triple Double vs Spurs! Kyle Anderson Injury, 2017-18 Season",Chris Smoove,2017-12-04,223104,7377,47,648,CA,Sports
vkM2-91Hq8I,"MMA Community Reacts to Francis Ngannou's Brutal Knockout of Overeem,Max Holloway on Conor McGregor",MMA WORLD,2017-12-03,367370,4182,256,1760,CA,Sports
tJELPsUhiQ8,Stephen Colbert monologue 12/1/17 : Coffee Joe Calls Trump Cuckoo !,Federica Balsamo,2017-12-02,277200,1214,202,303,CA,Sports
DTaFgkbz9GM,"ADMU vs. DLSU | Finals Game 3 Highlights | UAAP 80 Men's Basketball | December 03, 2017",ABS-CBN Sports And Action,2017-12-03,329880,927,89,113,CA,Sports
us5V82WsJ4A,LaVar Ball pulls LiAngelo out of UCLA; Lakers enforce 'LaVar Ball rule'  The Jump  ESPN,ESPN,2017-12-04,210273,1436,125,686,CA,Sports
91tA9KU7v_4,Dana White Reacts to Francis Ngannou def. Alistair Overeem via KO,Octagon News,2017-12-03,319103,1119,116,746,CA,Sports
JIKBpQ7q_E4,Ryan Shazier Injury | Steelers vs. Bengals NFL Highlights,Sam Echols,2017-12-05,832981,1186,1338,1811,CA,Sports
-RmUADCWI4A,All Sports Golf Battle 2 | Dude Perfect,Dude Perfect,2017-12-04,8643326,299732,5168,23303,CA,Sports
z1FfOwjlqxU,Steelers vs. Bengals | NFL Week 13 Game Highlights,NFL,2017-12-05,993435,7388,919,3187,CA,Sports
CgjAN_wgmiI,Rob Gronkowski DIRTY Hit On Tre'Davious White | Pats vs. Bills | NFL,Highlight Heaven,2017-12-03,1118314,2963,442,4879,CA,Sports
vlMFNhPUfPI,Stephen Colbert monologue 12/4/17 : Flynn Flips !,Federica Balsamo,2017-12-05,199705,1060,138,363,CA,Sports
kPRWgbLhOsc,Cleveland Cavaliers vs Chicago Bulls Full Game Highlights / Week 8 / Dec 4,MLG Highlights,2017-12-05,1800293,7335,501,1850,CA,Sports
FXNpeuDRiFc,CSKA vs MNU 1-2 All goals & Highlights English Commentary (05/12/2017) HD/1080P,NIXBLACK,2017-12-05,907759,2412,233,172,CA,Sports
zDprDKIrjvE,NHL Sportsmanship Moments,Delta Highlights,2017-12-04,114539,918,12,136,CA,Sports
KVJLID7awYM,"Braun Strowman dismantles Elias: Raw, Dec. 4, 2017",WWE,2017-12-05,1209323,16993,621,1523,CA,Sports
Lf2mkD0G1iQ,"Byron, Galchenyuk lead Habs to 10-1 rout of Red Wings",NHL,2017-12-03,85336,1067,61,404,CA,Sports
xR9vVQR2Wzg,Bayern Munich vs PSG 3-1 - All Goals & Highlights HD - 5 Dec 2017 - Champions League,Football Highlights & Goals,2017-12-05,541140,3944,256,561,CA,Sports
e3-3cyMc4CY,That Thingy on The Tip Front...,DemolitionRanch,2017-12-05,473873,25806,269,4649,CA,Sports
jSuJMhAgpFA,"Phoenix Suns vs Toronto Raptors - Full Game Highlights | Dec 5, 2017 | NBA Season 2017-18",Rapid Highlights,2017-12-06,29619,171,4,42,CA,Sports
OT_i_jPynPQ,"Kevin Durant, DeMarcus Cousins Ejected! Curry Injury Warriors vs Pelicans 2017-18 Season",Chris Smoove,2017-12-05,477253,11470,110,1833,CA,Sports
jnDd6gqtxOU,Skip and Shannon talk Lavar pulling LiAngelo Ball out of UCLA | UNDISPUTED,Skip and Shannon: UNDISPUTED,2017-12-05,195052,2000,137,949,CA,Sports
VzZcIKIsAxE,Stephen A. Smith believes in James Harden because of Chris Paul | First Take | ESPN,ESPN,2017-12-05,163352,1493,62,534,CA,Sports
JIKBpQ7q_E4,Ryan Shazier Injury | Steelers vs. Bengals NFL Highlights,Sam Echols,2017-12-05,945424,1323,1557,1934,CA,Sports
-RmUADCWI4A,All Sports Golf Battle 2 | Dude Perfect,Dude Perfect,2017-12-04,9828746,316976,5797,23221,CA,Sports
z1FfOwjlqxU,Steelers vs. Bengals | NFL Week 13 Game Highlights,NFL,2017-12-05,1188917,8303,1079,3363,CA,Sports
DvD3kHJYa-M,Stephen Colbert monologue 12/5/17 : A Whole Lotta Moore,Federica Balsamo,2017-12-06,177236,801,49,221,CA,Sports
CgjAN_wgmiI,Rob Gronkowski DIRTY Hit On Tre'Davious White | Pats vs. Bills | NFL,Highlight Heaven,2017-12-03,1259902,3199,498,5163,CA,Sports
blgS56pESPk,"Matt Hardy vows to “delete” Bray Wyatt: Raw, Dec. 4, 2017",WWE,2017-12-05,1525550,58343,719,10845,CA,Sports
jSuJMhAgpFA,"Phoenix Suns vs Toronto Raptors - Full Game Highlights | Dec 5, 2017 | NBA Season 2017-18",Rapid Highlights,2017-12-06,102804,313,12,102,CA,Sports
kYJFCHTS9cA,J'OFFRE L'IPHONE X À CELUI QUI RÉUSSIT!,Wass Freestyle,2017-12-06,718028,63272,1280,3585,CA,Sports
kPRWgbLhOsc,Cleveland Cavaliers vs Chicago Bulls Full Game Highlights / Week 8 / Dec 4,MLG Highlights,2017-12-05,2006685,7710,544,1883,CA,Sports
zDprDKIrjvE,NHL Sportsmanship Moments,Delta Highlights,2017-12-04,149752,1092,24,160,CA,Sports
rBWhi5da-io,"YouTube Rewind: The Shape of 2017 REACTION ft. Logan & Jake Paul, KSI",Calfreezy,2017-12-06,512889,17226,702,1209,CA,Sports
OT_i_jPynPQ,"Kevin Durant, DeMarcus Cousins Ejected! Curry Injury Warriors vs Pelicans 2017-18 Season",Chris Smoove,2017-12-05,510228,11897,121,1859,CA,Sports
jnDd6gqtxOU,Skip and Shannon talk Lavar pulling LiAngelo Ball out of UCLA | UNDISPUTED,Skip and Shannon: UNDISPUTED,2017-12-05,310700,2616,194,1223,CA,Sports
e3-3cyMc4CY,That Thingy on The Tip Front...,DemolitionRanch,2017-12-05,653687,32465,335,5648,CA,Sports
JIKBpQ7q_E4,Ryan Shazier Injury | Steelers vs. Bengals NFL Highlights,Sam Echols,2017-12-05,1042230,1418,1698,2064,CA,Sports
-RmUADCWI4A,All Sports Golf Battle 2 | Dude Perfect,Dude Perfect,2017-12-04,10558591,325481,6104,24107,CA,Sports
Euy76qPpK7s,Cleveland Cavaliers vs Sacramento Kings Full Game Highlights / Week 8 / Dec 6,MLG Highlights,2017-12-07,1654526,9266,367,2518,CA,Sports
9JCdCs-Ip6M,Even Santa Won't Take DC Young Fly's Mom's Cookie | Wild 'N Out | #Wildstyle,MTV,2017-12-08,51334,3295,37,117,CA,Sports
kYJFCHTS9cA,J'OFFRE L'IPHONE X À CELUI QUI RÉUSSIT!,Wass Freestyle,2017-12-06,942015,75363,1668,4265,CA,Sports
rBWhi5da-io,"YouTube Rewind: The Shape of 2017 REACTION ft. Logan & Jake Paul, KSI",Calfreezy,2017-12-06,767222,22762,1054,1576,CA,Sports
rnOFqIoKtB4,Trump Slurs Speech While Recognizing Jerusalem As Israel's Capital | The View,The View,2017-12-07,80635,560,261,666,CA,Sports
UGmPQRyy-GI,2017 Tim Hortons Roar of the Rings - Rachel Homan Double to Win,Curling Canada,2017-12-07,7118,53,1,5,CA,Sports
ZECYsAkRNJg,"Andersen, Nylander lead Maple Leafs to shootout win",NHL,2017-12-07,31589,235,13,108,CA,Sports
SlbOahDInOU,Chris Broussard on LeBron's Cavaliers winning their 13th straight game | UNDISPUTED,Skip and Shannon: UNDISPUTED,2017-12-07,209605,2692,111,1358,CA,Sports
jSuJMhAgpFA,"Phoenix Suns vs Toronto Raptors - Full Game Highlights | Dec 5, 2017 | NBA Season 2017-18",Rapid Highlights,2017-12-06,112595,347,12,107,CA,Sports
z1FfOwjlqxU,Steelers vs. Bengals | NFL Week 13 Game Highlights,NFL,2017-12-05,1263292,8547,1132,3017,CA,Sports
UKka73nn1dk,GraceFitUk Vs Nile Wilson **Celebrity Gymnastics**,Nile Wilson,2017-12-07,154513,7499,82,432,CA,Sports
tPDiF5bAlV0,Cavaliers or Celtics? First Take debates which is the best team in the East | First Take | ESPN,ESPN,2017-12-07,249263,2280,122,1171,CA,Sports
ADCFHaklJ4A,"Kyrie Irving, Dennis Smith Jr Double Technical Fouls! Mavs vs Celtics 2017-18 Season",Chris Smoove,2017-12-07,361145,11017,66,775,CA,Sports
hONq-41k0Og,Serayah Cuts the Beat & Goes In On Nick Cannon | Wild 'N Out | #Wildstyle,MTV,2017-12-08,795899,17046,221,572,CA,Sports
JIKBpQ7q_E4,Ryan Shazier Injury | Steelers vs. Bengals NFL Highlights,Sam Echols,2017-12-05,1091129,1470,1751,2090,CA,Sports
n2uuKIxcdv8,ELLE A HUMILIÉ IBRA TV!,Wass Freestyle,2017-12-08,472828,46584,468,2354,CA,Sports
-RmUADCWI4A,All Sports Golf Battle 2 | Dude Perfect,Dude Perfect,2017-12-04,11319116,334495,6430,25199,CA,Sports
NX_BDh-5oDk,ON ENLÈVE LA ROULETTE ! (Swan the Voice & Néo),Aurelien Fontenoy,2017-12-08,408859,11714,1761,2142,CA,Sports
s5c5teLL1mE,Doughty's overtime winner propels Kings past Senators,NHL,2017-12-08,15316,141,17,68,CA,Sports
-gt1BZUCqsA,Saints vs. Falcons | NFL Week 14 Game Highlights,NFL,2017-12-08,960816,8639,512,4428,CA,Sports
0wEOCpLCabo,Shaqtin' A Fool: LeBron's Not On the Mixtape | Inside the NBA | NBA on TNT,NBA on TNT,2017-12-08,601776,6444,122,730,CA,Sports
Euy76qPpK7s,Cleveland Cavaliers vs Sacramento Kings Full Game Highlights / Week 8 / Dec 6,MLG Highlights,2017-12-07,1801390,9583,395,2592,CA,Sports
QVqm5YdtWyQ,"GS Warriors vs Detroit Pistons - Full Game Highlights | Dec 8, 2017 | NBA Season 2017-18",Rapid Highlights,2017-12-09,213376,1103,67,546,CA,Sports
UKka73nn1dk,GraceFitUk Vs Nile Wilson **Celebrity Gymnastics**,Nile Wilson,2017-12-07,254170,9568,166,526,CA,Sports
hONq-41k0Og,Serayah Cuts the Beat & Goes In On Nick Cannon | Wild 'N Out | #Wildstyle,MTV,2017-12-08,1164027,23561,347,685,CA,Sports
yYNA158zPsw,"Toronto Raptors vs. Memphis Grizzlies - December 8, 2017",Motion Station,2017-12-09,9600,32,14,9,CA,Sports
WWWEErdA2EQ,"Match Highlights: Seattle Sounders FC at Toronto FC - December 9, 2017",Toronto FC,2017-12-10,26159,667,11,316,CA,Sports
-RmUADCWI4A,All Sports Golf Battle 2 | Dude Perfect,Dude Perfect,2017-12-04,12306042,342825,6898,25905,CA,Sports
Qa3sH2ipDKs,Cleveland Cavaliers vs Indiana Pacers Full Game Highlights / Week 8 / Dec 8,MLG Highlights,2017-12-09,1048786,4287,376,2630,CA,Sports
n2uuKIxcdv8,ELLE A HUMILIÉ IBRA TV!,Wass Freestyle,2017-12-08,762526,61120,805,2868,CA,Sports
rJ6SyvwnPd0,Real Madrid vs Sevilla 5-0 - All Goals & Extended Highlights - La Liga 09/12/2017 HD,GOLAZO TV,2017-12-09,1576014,10129,1015,178,CA,Sports
NX_BDh-5oDk,ON ENLÈVE LA ROULETTE ! (Swan the Voice & Néo),Aurelien Fontenoy,2017-12-08,577516,14119,2214,2608,CA,Sports
0DuSqqLJqEU,"Toronto Raptors vs Memphis Grizzlies - Full Game Highlights | Dec 8, 2017 | 2017-18 NBA Season",Raptors HQ,2017-12-09,19777,204,5,34,CA,Sports
m7Pen0DOAWg,"LA Lakers vs Charlotte Hornets - Full Game Highlights | Dec 9, 2017 | NBA Season 2017-18",Rapid Highlights,2017-12-10,254140,1303,82,728,CA,Sports
KovwMq1sJSs,LiAngelo Ball and LaMelo Ball GIVE UP BASKETBALL FOREVER!! Lavar Ball Just Killed Their Careers.,Ali's Highlights,2017-12-09,262525,6542,1142,1202,CA,Sports
sVHh2GxMnJc,Manu Ginobili Game Winner 40 Years Old vs Celtics! 2017-18 Season,Chris Smoove,2017-12-09,367462,11609,106,1287,CA,Sports
hONq-41k0Og,Serayah Cuts the Beat & Goes In On Nick Cannon | Wild 'N Out | #Wildstyle,MTV,2017-12-08,1369971,26162,399,568,CA,Sports
WWWEErdA2EQ,"Match Highlights: Seattle Sounders FC at Toronto FC - December 9, 2017",Toronto FC,2017-12-10,73826,1299,27,482,CA,Sports
Iu5YdqvK7fY,Ball In The Family Episode 3 | Season 2 | Ball Family Reality Show HD,Plug Trending,2017-12-11,141897,2502,44,341,CA,Sports
w4-Ino9ytmk,Colts vs. Bills | NFL Week 14 Game Highlights,NFL,2017-12-10,299529,3003,99,877,CA,Sports
SPRtQB7Z3s8,Ball In The Family Season 2 - Episode 2 The First 48 Hrs,Official 905,2017-12-09,374837,5538,92,317,CA,Sports
du_rb1hzfYk,FT Manchester Utd 1 - 2 Manchester City,Stadium Astro,2017-12-10,2467562,10330,969,446,CA,Sports
05hFEtwH05g,"Toronto Raptors vs Sacramento Kings - Full Game Highlights | Dec 10, 2017 | NBA Season 2017-18",Rapid Highlights,2017-12-10,52409,223,16,54,CA,Sports
6ybKFp09OwA,Cleveland Cavaliers vs Philadelphia Sixers Full Game Highlights / Week 8 / Dec 9,MLG Highlights,2017-12-10,1562989,7744,400,2484,CA,Sports
DjL9s9yT3w0,NHL Broken Bones,Delta Highlights,2017-12-09,161392,960,38,133,CA,Sports
R9_hKhf0TDo,Villarreal vs Barcelona 0-2 - All Goals & Extended Highlights - La Liga 10/12/2017 HD,GOLAZO TV,2017-12-10,1572813,11609,676,266,CA,Sports
u_e2XrZx50s,"Maple Leafs stave off Penguins, 4-3",NHL,2017-12-10,39682,297,13,115,CA,Sports
NX_BDh-5oDk,ON ENLÈVE LA ROULETTE ! (Swan the Voice & Néo),Aurelien Fontenoy,2017-12-08,667789,15209,2318,2374,CA,Sports
eRngrNXk44w,Russell Westbrook Game Winner vs Grizzlies! 87th Triple Double 2017-18 Season,Chris Smoove,2017-12-10,257196,8407,88,995,CA,Sports
f5BKsnNybgM,"Toronto Raptors vs Sacramento Kings - Full Game Highlights | December 10, 2017 | 2017-18 NBA Season",Ximo Pierto,2017-12-10,7822,69,1,8,CA,Sports
yYNA158zPsw,"Toronto Raptors vs. Memphis Grizzlies - December 8, 2017",Motion Station,2017-12-09,10831,35,15,13,CA,Sports
KovwMq1sJSs,LiAngelo Ball and LaMelo Ball GIVE UP BASKETBALL FOREVER!! Lavar Ball Just Killed Their Careers.,Ali's Highlights,2017-12-09,460186,8912,1825,1591,CA,Sports
mxpd6esNayQ,Barcelona vs Villarreal 2-0 All goals & Highlights English Commentary (10/12/2017) HD/1080P,NIXBLACK,2017-12-10,454025,1801,173,201,CA,Sports
5CZA8YQzSik,"Toronto Raptors vs Sacramento Kings - Full Game Highlights | Dec 10, 2017 | 2017-18 NBA Season",Raptors HQ,2017-12-10,3121,44,1,15,CA,Sports
ycVc1jsaAA0,Christmas Stereotypes,Dude Perfect,2017-12-11,4242835,238505,2718,25884,CA,Sports
kcSmQef9-xE,Ravens vs. Steelers | NFL Week 14 Game Highlights,NFL,2017-12-11,1146663,10128,463,3230,CA,Sports
WWWEErdA2EQ,"Match Highlights: Seattle Sounders FC at Toronto FC - December 9, 2017",Toronto FC,2017-12-10,88826,1478,30,639,CA,Sports
Gq-qTSGuW7E,If You Hate LONZO BALL Watch This! (Can It Change Your Mind?),Mike Korzemba,2017-12-11,293360,15533,573,3052,CA,Sports
05hFEtwH05g,"Toronto Raptors vs Sacramento Kings - Full Game Highlights | Dec 10, 2017 | NBA Season 2017-18",Rapid Highlights,2017-12-10,104842,335,26,92,CA,Sports
hONq-41k0Og,Serayah Cuts the Beat & Goes In On Nick Cannon | Wild 'N Out | #Wildstyle,MTV,2017-12-08,1478266,27415,425,738,CA,Sports
R9_hKhf0TDo,Villarreal vs Barcelona 0-2 - All Goals & Extended Highlights - La Liga 10/12/2017 HD,GOLAZO TV,2017-12-10,2005172,13775,836,496,CA,Sports
lvmV8rGvdFY,"LFR11 - Game 30 - Rafiki & Simba - Tor 4, Pit 3",SteveDangle,2017-12-10,24349,1144,16,166,CA,Sports
du_rb1hzfYk,FT Manchester Utd 1 - 2 Manchester City,Stadium Astro,2017-12-10,2580013,10638,1024,525,CA,Sports
VqfbYBzToFM,"Nia Jax wants to chat with Enzo Amore in private: Raw, Dec. 11, 2017",WWE,2017-12-12,175826,4432,144,926,CA,Sports
6ybKFp09OwA,Cleveland Cavaliers vs Philadelphia Sixers Full Game Highlights / Week 8 / Dec 9,MLG Highlights,2017-12-10,1760304,8228,431,2244,CA,Sports
ycVc1jsaAA0,Christmas Stereotypes,Dude Perfect,2017-12-11,8267018,367668,5273,33808,CA,Sports
sbXy2vkJxSk,Marathoner heroically finishes Dallas Marathon with help of fellow runner | ESPN,ESPN,2017-12-11,116577,278,19,64,CA,Sports
j7RZy2B73hw,Patriots vs. Dolphins | NFL Week 14 Game Highlights,NFL,2017-12-12,1291753,12586,654,5733,CA,Sports
32SnkiinVmI,MON NOUVEAU MÉTIER !!,Tibo InShape,2017-12-12,522009,41973,831,2326,CA,Sports
c8bkGdeqwWw,"Top 10 Raw moments: WWE Top 10, December 11, 2017",WWE,2017-12-12,884215,21183,662,1371,CA,Sports
ztAD4WpM3tQ,Cleveland Cavaliers vs Atlanta Hawks Full Game Highlights / Week 9 / Dec 12,MLG Highlights,2017-12-13,507588,3856,178,1186,CA,Sports
Gq-qTSGuW7E,If You Hate LONZO BALL Watch This! (Can It Change Your Mind?),Mike Korzemba,2017-12-11,470392,21233,822,3779,CA,Sports
xrhOwpl-LQo,"LA Lakers vs New York Knicks - Full Game Highlights | Dec 12, 2017 | NBA Season 2017-18",Rapid Highlights,2017-12-13,162682,1015,48,687,CA,Sports
WWWEErdA2EQ,"Match Highlights: Seattle Sounders FC at Toronto FC - December 9, 2017",Toronto FC,2017-12-10,94214,1512,33,562,CA,Sports
ycVc1jsaAA0,Christmas Stereotypes,Dude Perfect,2017-12-11,9387347,389347,5901,35377,CA,Sports
32SnkiinVmI,MON NOUVEAU MÉTIER !!,Tibo InShape,2017-12-12,915956,59579,1496,2809,CA,Sports
ztAD4WpM3tQ,Cleveland Cavaliers vs Atlanta Hawks Full Game Highlights / Week 9 / Dec 12,MLG Highlights,2017-12-13,1405612,6826,342,1422,CA,Sports
c8bkGdeqwWw,"Top 10 Raw moments: WWE Top 10, December 11, 2017",WWE,2017-12-12,1355333,27086,941,1305,CA,Sports
Ha3WCbl7S7s,Virat Kohli And Anushka Sharma Marriage Ceremony Full Videos - HD,Sports Blast,2017-12-11,15860214,131887,9601,6563,CA,Sports
EDBikEAtrwI,Real Madrid vs Al Jazira 2-1 - All Goals & Extended Highlights - 13/12/2017 HD,GOLAZO TV,2017-12-13,788997,4762,442,1410,CA,Sports
j7RZy2B73hw,Patriots vs. Dolphins | NFL Week 14 Game Highlights,NFL,2017-12-12,1462747,13474,743,6081,CA,Sports
DExbJi4p1co,"Zack Kassian vs Brandon Dubinsky Dec 12, 2017",NHL Video,2017-12-13,6684,23,1,37,CA,Sports
TLDIoZtML74,Chris Broussard on Lonzo and LaVar Ball after the Lakers loss in New York | UNDISPUTED,Skip and Shannon: UNDISPUTED,2017-12-13,253893,2420,120,1041,CA,Sports
sbXy2vkJxSk,Marathoner heroically finishes Dallas Marathon with help of fellow runner | ESPN,ESPN,2017-12-11,211559,353,27,76,CA,Sports
ycVc1jsaAA0,Christmas Stereotypes,Dude Perfect,2017-12-11,10109758,399989,6184,32628,CA,Sports
sbXy2vkJxSk,Marathoner heroically finishes Dallas Marathon with help of fellow runner | ESPN,ESPN,2017-12-11,253876,388,31,80,CA,Sports
GtStI9e4360,"Toronto Raptors vs. Phoenix Suns - December 13, 2017",Motion Station,2017-12-14,10119,54,3,6,CA,Sports
aZ2InouMlWg,Cleveland Cavaliers vs Los Angeles Lakers Full Game Highlights / Week 9 / Dec 14,MLG Highlights,2017-12-15,327013,3637,130,900,CA,Sports
trMLhPi3cL8,Chris Broussard: The Rockets are the biggest threat in the NBA to the Warriors | UNDISPUTED,Skip and Shannon: UNDISPUTED,2017-12-14,214097,2649,91,901,CA,Sports
YE6ILrxmXJw,"LA Lakers vs Cleveland Cavaliers - Full Game Highlights | Dec 14, 2017 | NBA Season 2017-18",Rapid Highlights,2017-12-15,224987,999,54,379,CA,Sports
ycVc1jsaAA0,Christmas Stereotypes,Dude Perfect,2017-12-11,10954361,410531,6461,33530,CA,Sports
YnSNZC2KROo,9000€ EN 6 MINUTES ON DÉVALISE GO SPORT !!,Tibo InShape,2017-12-15,847905,64309,999,2180,CA,Sports
gjvAjrI3mFQ,SNL's Pete Davidson Takes No Prisoners | Wild 'N Out | #Wildstyle,MTV,2017-12-15,700248,17880,179,653,CA,Sports
aZ2InouMlWg,Cleveland Cavaliers vs Los Angeles Lakers Full Game Highlights / Week 9 / Dec 14,MLG Highlights,2017-12-15,1737133,8520,406,1400,CA,Sports
JH1wI6I57KA,Baybaw | The Steve Dangle Podcast,Steve Dangle Podcast,2017-12-15,6007,178,8,41,CA,Sports
eunPONMdJOo,Doing Stunts From Captain America: Civil War (Marvel's Avengers),Nick Pro,2017-12-15,67464,1831,36,347,CA,Sports
wMhnpH2-vIY,JE VOUS MONTRE MON VRAI MÉTIER!,Wass Freestyle,2017-12-15,243004,17506,262,1239,CA,Sports
p2P5jrcNwY4,Stephen A. speculates what LeBron James told Lonzo Ball after Lakers-Cavaliers | First Take | ESPN,ESPN,2017-12-15,423760,4141,257,959,CA,Sports
dnxi5CZc_NA,The 12 Most HUMILIATING Moments in NBA History!,Mike Korzemba,2017-12-15,233879,10506,271,717,CA,Sports
I8S7ZH4-wIs,Macaulay Culkin Interferes In Wrestling Match Using ‘Home Alone’ Tactics,Pro Wrestling Sheet,2017-12-15,250672,949,60,168,CA,Sports
28Jgz9Sc-S4,Real Madrid vs Gremio 1-0 - Extended Match Highlights - 16/12/2017 HD,GOLAZO TV,2017-12-16,954654,5574,554,763,CA,Sports
YnSNZC2KROo,9000€ EN 6 MINUTES ON DÉVALISE GO SPORT !!,Tibo InShape,2017-12-15,1340330,86607,1612,3049,CA,Sports
gjvAjrI3mFQ,SNL's Pete Davidson Takes No Prisoners | Wild 'N Out | #Wildstyle,MTV,2017-12-15,880663,20324,204,709,CA,Sports
JirSbOF1vBE,"Toronto Raptors vs Brooklyn Nets - Full Game Highlights | Dec 15, 2017 | 2017-18 NBA Season",Raptors HQ,2017-12-16,28976,269,4,114,CA,Sports
0g2gaMYLw88,"Open Gym, presented by Bell S6E9 - Dear Ava",Toronto Raptors,2017-12-15,13526,551,6,90,CA,Sports
4D2mz2saxus,Oklahoma City Thunder vs Philadelphia Sixers Full Game Highlights / Week 9 / Dec 15,MLG Highlights,2017-12-16,1083694,6096,269,1742,CA,Sports
eunPONMdJOo,Doing Stunts From Captain America: Civil War (Marvel's Avengers),Nick Pro,2017-12-15,172107,3273,88,433,CA,Sports
FnAx2bLICOo,5-a-side Scissor Kick,Freddie Lister,2017-12-17,662308,8100,923,885,CA,Sports
v9wbMzkVseE,Patriots vs. Steelers | NFL Week 15 Game Highlights,NFL,2017-12-18,740457,9213,2027,9710,CA,Sports
I8S7ZH4-wIs,Macaulay Culkin Interferes In Wrestling Match Using ‘Home Alone’ Tactics,Pro Wrestling Sheet,2017-12-15,322093,1434,112,250,CA,Sports
xTfA-5TxYOI,New Hallmark - Christmas Next Door 2017 - Christmas Hallmark Realease Movies 2017,0b1knob,2017-12-17,64636,336,26,10,CA,Sports
beF82S2S8Jg,Oklahoma City Thunder vs New York Knicks Full Game Highlights / Week 9 / Dec 16,MLG Highlights,2017-12-17,611389,2116,168,1018,CA,Sports
8gOdVsbfjW4,Barcelona vs Deportivo La Coruna 4-0 - All Goals & Extended Highlights - La Liga - 17/12/2017 HD,GOLAZO TV,2017-12-17,1553964,12888,682,2199,CA,Sports
Cbi6EYxUVJs,Robbie Lawler vs Rafael Dos Anjos | HIGHLIGHTS | UFC on FOX,UFC ON FOX,2017-12-17,432748,2020,224,655,CA,Sports
FnAx2bLICOo,5-a-side Scissor Kick,Freddie Lister,2017-12-17,973015,11426,1368,1343,CA,Sports
v9wbMzkVseE,Patriots vs. Steelers | NFL Week 15 Game Highlights,NFL,2017-12-18,2078841,18220,4222,14800,CA,Sports
I8S7ZH4-wIs,Macaulay Culkin Interferes In Wrestling Match Using ‘Home Alone’ Tactics,Pro Wrestling Sheet,2017-12-15,362829,1687,145,298,CA,Sports
aqj7Uvi9jK8,"Brock Lesnar's Royal Rumble challengers revealed: Raw, Dec. 18, 2017",WWE,2017-12-19,899815,25887,953,2670,CA,Sports
CqigwEzUYmc,Found Waterproof Camera Lost 2 Months Ago! (Reviewing the Footage) - Returned to Owner!,DALLMYD,2017-12-19,119330,6833,85,664,CA,Sports
a8Tjigv61fk,NFL Angriest Moments,Savage Brick Sports,2017-12-18,183325,1880,64,370,CA,Sports
FnAx2bLICOo,5-a-side Scissor Kick,Freddie Lister,2017-12-17,1064509,12205,1480,1410,CA,Sports
hPlkLFgiRBw,Maple Leafs celebrate 100th anniversary with 8-1 rout,NHL,2017-12-19,36107,480,17,187,CA,Sports
q-jZm-FUbqs,"Stephanie McMahon announces the first-ever Women's Royal Rumble Match: Raw, Dec. 18, 2017",WWE,2017-12-19,1146692,23788,1527,5134,CA,Sports
v9wbMzkVseE,Patriots vs. Steelers | NFL Week 15 Game Highlights,NFL,2017-12-18,2336544,19462,4484,15699,CA,Sports
4iA0SfNGaI0,Golden State Warriors vs Los Angeles Lakers Full Game Highlights / Week 10 / Dec 18,MLG Highlights,2017-12-19,1571275,8214,499,2366,CA,Sports
lRX2HbNgzwE,Meet The NBA’s BEST Prospect Since LEBRON JAMES!,Mike Korzemba,2017-12-19,306316,13875,479,3117,CA,Sports
d1hs-JI_yBE,Kobe Bryant No.8 & No.24 Jersey Retirement In Los Angeles,NBA,2017-12-19,479046,11095,168,1619,CA,Sports
4o-NvvY0eTk,Kobe Bryant or LeBron James: First Take debates closest to being Michael Jordan | First Take | ESPN,ESPN,2017-12-19,225405,2263,116,2692,CA,Sports
ZWexhd_kK68,Dolph Ziggler Leaves WWE ? - WWE SmackDown 19th December 2017,Wrestling Universe,2017-12-20,336906,3048,268,804,CA,Sports
2fJnalpveZU,"Chris Broussard on Steve Kerr comparing Kobe Bryant, LeBron James and MIchael Jordan | UNDISPUTED",Skip and Shannon: UNDISPUTED,2017-12-19,255563,3006,225,3108,CA,Sports
k_PvPruyfXY,Patrick Maroon tugs on the beard of Brent Burns,SPORTSNET,2017-12-19,18687,221,4,31,CA,Sports
stvBXbtvfuY,"Carolina Hurricanes vs Toronto Maple Leafs – Dec. 19, 2017 | Game Highlights | NHL 2017/18. Обзор",PRO Hockey,2017-12-20,3805,40,0,6,CA,Sports
4IXfmrWqKHs,Joe Rogan & Eddie Bravo on Conor McGregor v GSP at 170 lbs Rumors,Octagon News,2017-12-20,57729,418,35,264,CA,Sports
IU-Fo-QEpOI,Dude Perfect Face Off | What's In The Box,Whistle Sports,2017-12-20,808617,17472,295,1243,CA,Sports
hPlkLFgiRBw,Maple Leafs celebrate 100th anniversary with 8-1 rout,NHL,2017-12-19,75838,891,33,268,CA,Sports
q-jZm-FUbqs,"Stephanie McMahon announces the first-ever Women's Royal Rumble Match: Raw, Dec. 18, 2017",WWE,2017-12-19,1354133,25722,1772,5663,CA,Sports
nca7qbxuIBk,"LFR11 - Game 35 - Next - Car 1, Tor 8",SteveDangle,2017-12-20,27842,1705,18,271,CA,Sports
FnAx2bLICOo,5-a-side Scissor Kick,Freddie Lister,2017-12-17,1088374,12332,1492,1410,CA,Sports
4iA0SfNGaI0,Golden State Warriors vs Los Angeles Lakers Full Game Highlights / Week 10 / Dec 18,MLG Highlights,2017-12-19,1791550,8762,548,2491,CA,Sports
ZmSXVPApUfg,Train for Life | Whitney Simmons,Gymshark,2017-12-20,74616,4159,10,557,CA,Sports
PZzLBj4_Jis,"Montreal Canadiens vs Vancouver Canucks – Dec. 19, 2017 | Game Highlights | NHL 2017/18. Обзор матча",PRO Hockey,2017-12-20,7987,74,1,12,CA,Sports
Ef7J2aFVZ5g,"DeMar DeRozan Full Highlights 2017.12.20 at Hornets - 28 Pts, 8 Assists in 3 Quarters!",FreeDawkins,2017-12-21,3189,131,7,91,CA,Sports
d1hs-JI_yBE,Kobe Bryant No.8 & No.24 Jersey Retirement In Los Angeles,NBA,2017-12-19,585954,12604,190,1774,CA,Sports
IU-Fo-QEpOI,Dude Perfect Face Off | What's In The Box,Whistle Sports,2017-12-20,1820947,31223,702,1925,CA,Sports
hPlkLFgiRBw,Maple Leafs celebrate 100th anniversary with 8-1 rout,NHL,2017-12-19,82200,950,35,279,CA,Sports
R0I9RTd8sVg,Machine Gun Kelly Pop ‘N Locks His Way To Victory 'Official Sneak Peek' | Wild 'N Out | MTV,MTV,2017-12-21,400943,10924,112,371,CA,Sports
v6lRrXq6VBk,Cleveland Cavaliers vs Chicago Bulls Full Game Highlights / Week 10 / Dec 21,MLG Highlights,2017-12-22,512662,4178,215,1058,CA,Sports
RSiwG-d6a3Y,HUMILIÉ PAR CE CHAMPION DE JIU JITSU !!,Tibo InShape,2017-12-21,665965,48809,546,2570,CA,Sports
1qaTF0RcjoY,"Toronto Raptors vs Philadelphia Sixers - Full Game Highlights | Dec 21, 2017 | NBA Season 2017-18",Rapid Highlights,2017-12-22,58995,324,22,136,CA,Sports
v5A_dLZkCk4,Braun Strowman is The Elf Among Men: A WWE Christmas movie parody,WWE,2017-12-21,529332,29132,1254,4530,CA,Sports
Ua-sEFWDQiA,How Michael Jordan ENDED a Man's Career with 3 Words,Mike Korzemba,2017-12-21,217876,11089,214,1337,CA,Sports
J5zVwTyJg1k,Machine Gun Kelly Is Not Eminem | Wild 'N Out | #Wildstyle,MTV,2017-12-22,786744,21013,302,1075,CA,Sports
1qaTF0RcjoY,"Toronto Raptors vs Philadelphia Sixers - Full Game Highlights | Dec 21, 2017 | NBA Season 2017-18",Rapid Highlights,2017-12-22,221370,634,42,228,CA,Sports
IU-Fo-QEpOI,Dude Perfect Face Off | What's In The Box,Whistle Sports,2017-12-20,2172958,33920,816,2094,CA,Sports
1ARqr3JWUOA,"Jenner cross checks Guentzel's throat, Crosby tries to fight Jones",SPORTSNET,2017-12-22,135917,296,18,199,CA,Sports
v6lRrXq6VBk,Cleveland Cavaliers vs Chicago Bulls Full Game Highlights / Week 10 / Dec 21,MLG Highlights,2017-12-22,1453153,7216,414,1510,CA,Sports
yaDLn-gSsag,"Maple Leafs Practice: Auston Matthews - December 22, 2017",Toronto Maple Leafs,2017-12-22,3680,90,0,23,CA,Sports
ZlIWp-wM450,CET HANDICAPÉ À UN INCROYABLE TALENT!,Wass Freestyle,2017-12-22,301350,53681,397,4222,CA,Sports
hPlkLFgiRBw,Maple Leafs celebrate 100th anniversary with 8-1 rout,NHL,2017-12-19,85132,972,36,290,CA,Sports
YlVTjLF9g3Y,DeMar DeRozan 45 Points Career High vs 76ers! 2017-18 Season,Chris Smoove,2017-12-22,141383,5369,31,339,CA,Sports
zts9tWuJGTs,Arsenal vs Liverpool 3-3 - All Goals & Highlights - 22/12/2017 HD,BlansaroniTV,2017-12-23,93777,522,34,105,CA,Sports
VsSYngXbCc0,The Quietest Sniper Rifle Ever... and Why The Government Doesn’t Regulate It...,DemolitionRanch,2017-12-22,718139,38713,380,2771,CA,Sports
uFDPLyAWpVg,GoPro: Gorilla Tickling at the GRACE Center,GoPro,2017-12-21,268057,6157,64,397,CA,Sports
OKnL_D3bvLU,Real Madrid vs Barcelona 0-3 - All Goals & Highlights - 23/12/2017 HD,Premium Sintesi,2017-12-23,3826984,42076,2595,3657,CA,Sports
J5zVwTyJg1k,Machine Gun Kelly Is Not Eminem | Wild 'N Out | #Wildstyle,MTV,2017-12-22,1046464,24096,364,1105,CA,Sports
5JjPfpSrtvY,Real Madrid vs Barcelona 0-3 - All Goals & Extended Highlights - La Liga 23/12/2017 HD,GOLAZO TV,2017-12-23,2670218,27721,2100,5215,CA,Sports
QAwugvwTPEs,Real Madrid Vs Barcelona 0-3 - All Goals & Highlights - Resumen y Goles 23/12/2017 HD,NugoBasilaiaa,2017-12-23,1643957,11100,942,1389,CA,Sports
ReAM7JhiVT4,Real Madrid vs Barcelona (El Clasico) 0-3 - Highlights Resumen 23/12/2017,Iuonak,2017-12-23,1196926,4590,3336,766,CA,Sports
BASh7eNGciw,Real Madrid vs Barcelona 0-3 All Goals & Highlights 23/12/2017 HD,Wrsh98,2017-12-23,2863226,15226,2444,1321,CA,Sports
_al3Qt2CxQo,ملخص مباراه ريال مدريد وبرشلونة 0-3 - ميسي يؤكد عقدة البرنابيو - جنون الشوالي - الدوري الاسباني,extra goal,2017-12-23,4510250,42742,7488,5561,CA,Sports
XWvhubdMsNY,"Most shocking moments of 2017: WWE Top 10, Dec. 23, 2017",WWE,2017-12-23,1494366,40970,1033,2232,CA,Sports
1ARqr3JWUOA,"Jenner cross checks Guentzel's throat, Crosby tries to fight Jones",SPORTSNET,2017-12-22,163201,330,22,167,CA,Sports
1qaTF0RcjoY,"Toronto Raptors vs Philadelphia Sixers - Full Game Highlights | Dec 21, 2017 | NBA Season 2017-18",Rapid Highlights,2017-12-22,241539,692,48,214,CA,Sports
JhnoSfwGJBI,Los Angeles Lakers vs Golden State Warriors Full Game Highlights / Week 10 / Dec 22,MLG Highlights,2017-12-23,1427777,7696,449,1896,CA,Sports
1zqgvyzZOIQ,Real Madrid vs Barcelona 0-3 Resumen Highlights Goles Goals La Liga 23/12/2017,Resumenes FUT,2017-12-23,4489524,38358,4273,6382,CA,Sports
Quq9B3OxjrY,"Canadiens hang on to edge Flames on the road, 3-2",NHL,2017-12-23,22043,169,15,39,CA,Sports
IU-Fo-QEpOI,Dude Perfect Face Off | What's In The Box,Whistle Sports,2017-12-20,2353300,35429,868,2162,CA,Sports
v3Mg8zltz7U,"DeMar DeRozan Full Highlights 2017.12.23 vs Sixers - 29 Pts, Too EASY!",FreeDawkins,2017-12-24,4507,186,8,135,CA,Sports
OKnL_D3bvLU,Real Madrid vs Barcelona 0-3 - All Goals & Highlights - 23/12/2017 HD,Premium Sintesi,2017-12-23,5540707,53895,3744,4644,CA,Sports
5JjPfpSrtvY,Real Madrid vs Barcelona 0-3 - All Goals & Extended Highlights - La Liga 23/12/2017 HD,GOLAZO TV,2017-12-23,3394865,31019,2458,5704,CA,Sports
cnqb2tXu9k8,JE PASSE SUR TF1 ÇA TOURNE MAL !!,Tibo InShape,2017-12-24,940170,91409,1792,3613,CA,Sports
J5zVwTyJg1k,Machine Gun Kelly Is Not Eminem | Wild 'N Out | #Wildstyle,MTV,2017-12-22,1185096,25898,405,1130,CA,Sports
QAwugvwTPEs,Real Madrid Vs Barcelona 0-3 - All Goals & Highlights - Resumen y Goles 23/12/2017 HD,NugoBasilaiaa,2017-12-23,2335267,13716,1308,1692,CA,Sports
BASh7eNGciw,Real Madrid vs Barcelona 0-3 All Goals & Highlights 23/12/2017 HD,Wrsh98,2017-12-23,4106045,19015,3228,1624,CA,Sports
Mu0lbTM7px8,Bills vs. Patriots | NFL Week 16 Game Highlights,NFL,2017-12-24,394203,3714,350,1978,CA,Sports
OlEV7ZJMpWI,"Philadelphia Sixers vs Toronto Raptors - Full Game Highlights | Dec 23, 2017 | NBA Season 2017-18",Rapid Highlights,2017-12-24,160294,477,35,177,CA,Sports
64S0qEGJdh0,NHL Best Penalty Box Moments,Delta Highlights,2017-12-23,254470,1489,72,101,CA,Sports
XYSl_Ngt_gc,How NOT to Load an M1 Garand!,hickok45,2017-12-24,252926,9809,97,937,CA,Sports
CMUv4J_PGxc,Matthews returns to lead Maple Leafs to 3-2 win,NHL,2017-12-24,27903,225,12,132,CA,Sports
MbxmqYveQZw,Real Madrid vs Barcelona FULL Match 23.12.2017 HD La Liga,EPIC BRO,2017-12-23,648053,4696,345,502,CA,Sports
ReAM7JhiVT4,Real Madrid vs Barcelona (El Clasico) 0-3 - Highlights Resumen 23/12/2017,Iuonak,2017-12-23,1287047,4771,3502,796,CA,Sports
XWvhubdMsNY,"Most shocking moments of 2017: WWE Top 10, Dec. 23, 2017",WWE,2017-12-23,2210506,50348,1382,2754,CA,Sports
x2SXc-mUJGY,UN PÈRE NOËL TRÈS SPÉCIAL!,Wass Freestyle,2017-12-24,351127,20128,404,1895,CA,Sports
9n1PN6bd5Jk,UFC 219 Countdown: Full Episode,UFC - Ultimate Fighting Championship,2017-12-24,220886,2125,93,1103,CA,Sports
JhnoSfwGJBI,Los Angeles Lakers vs Golden State Warriors Full Game Highlights / Week 10 / Dec 22,MLG Highlights,2017-12-23,1543273,7973,474,1903,CA,Sports
a0INQapwKV0,Why LaMelo Ball will be KILLED IN LITHUANIA!! The Fans WILL HATE LIANGELO AND LAMELO!!,Ali's Highlights,2017-12-24,182713,4904,2077,951,CA,Sports
2JzNWBo15xM,Are people sleeping on the Raptors? | NBA Countdown | ESPN,ESPN,2017-12-23,98758,1343,54,908,CA,Sports
WSISlTa4w40,Real Madrid 0 x 3 Barcelona - Melhores Momentos (HD) El Clásico 23/12/2017,Ligados No Futebol,2017-12-23,2168740,50017,2235,6951,CA,Sports
Sq7hMzKbHog,Sebastian's Wish,bhtv,2017-12-21,56181,1073,21,133,CA,Sports
OKnL_D3bvLU,Real Madrid vs Barcelona 0-3 - All Goals & Highlights - 23/12/2017 HD,Premium Sintesi,2017-12-23,6315133,59637,4498,5192,CA,Sports
z5wiZRlV9I4,Cleveland Cavaliers vs Golden State Warriors Full Game Highlights / Week 11 / Dec 25,MLG Highlights,2017-12-25,1356267,7856,762,5291,CA,Sports
yKbJKJ_whHY,Seahawks vs. Cowboys | NFL Week 16 Game Highlights,NFL,2017-12-25,792062,5988,453,3513,CA,Sports
Y5PvmIruT0c,"Cleveland Cavaliers vs Golden State Warriors: December 25, 2017",Motion Station,2017-12-25,165934,915,104,171,CA,Sports
Wzb-xT6bzVY,"Cleveland Cavaliers vs GS Warriors - Full Game Highlights | Dec 25, 2017 | NBA Season 2017-18",Rapid Highlights,2017-12-25,313226,1495,125,927,CA,Sports
cnqb2tXu9k8,JE PASSE SUR TF1 ÇA TOURNE MAL !!,Tibo InShape,2017-12-24,1666788,137511,3517,4898,CA,Sports
5JjPfpSrtvY,Real Madrid vs Barcelona 0-3 - All Goals & Extended Highlights - La Liga 23/12/2017 HD,GOLAZO TV,2017-12-23,3668650,32163,2600,5812,CA,Sports
a0INQapwKV0,Why LaMelo Ball will be KILLED IN LITHUANIA!! The Fans WILL HATE LIANGELO AND LAMELO!!,Ali's Highlights,2017-12-24,329721,6706,3286,1321,CA,Sports
SG5al5UTolU,"Christmas chaos: WWE Top 10, Dec. 25, 2017",WWE,2017-12-25,1367546,30024,866,1445,CA,Sports
J5zVwTyJg1k,Machine Gun Kelly Is Not Eminem | Wild 'N Out | #Wildstyle,MTV,2017-12-22,1290375,27130,432,1183,CA,Sports
DyK1xtKprGI,"Gotta See It: Rinaldo sucker punches Girard, brawl ensues",SPORTSNET,2017-12-24,275945,996,53,467,CA,Sports
QAwugvwTPEs,Real Madrid Vs Barcelona 0-3 - All Goals & Highlights - Resumen y Goles 23/12/2017 HD,NugoBasilaiaa,2017-12-23,2586722,14801,1471,1774,CA,Sports
XYSl_Ngt_gc,How NOT to Load an M1 Garand!,hickok45,2017-12-24,332370,11672,116,1134,CA,Sports
CMUv4J_PGxc,Matthews returns to lead Maple Leafs to 3-2 win,NHL,2017-12-24,32263,245,13,122,CA,Sports
BASh7eNGciw,Real Madrid vs Barcelona 0-3 All Goals & Highlights 23/12/2017 HD,Wrsh98,2017-12-23,4361354,19709,3364,1926,CA,Sports
z5wiZRlV9I4,Cleveland Cavaliers vs Golden State Warriors Full Game Highlights / Week 11 / Dec 25,MLG Highlights,2017-12-25,2415334,11603,1147,6813,CA,Sports
OKnL_D3bvLU,Real Madrid vs Barcelona 0-3 - All Goals & Highlights - 23/12/2017 HD,Premium Sintesi,2017-12-23,6932065,63972,5084,5762,CA,Sports
9oyKePWRi8Y,Best of 2017 | Dude Perfect,Dude Perfect,2017-12-26,3185900,195420,1502,11246,CA,Sports
CBQjhjeHv_w,"Washington Wizards vs Boston Celtics - Full Game Highlights | Dec 25, 2017 | NBA Season 2017-18",Rapid Highlights,2017-12-26,525055,1231,120,227,CA,Sports
Z90T9riY8Xs,"Roman Reigns vs. Samoa Joe - Intercontinental Championship Match: Raw, Dec. 25, 2017",WWE,2017-12-26,1993340,35379,1729,2984,CA,Sports
O3ttybJghsc,Raiders vs. Eagles | NFL Week 16 Game Highlights,NFL,2017-12-26,872301,7505,441,2845,CA,Sports
Y5PvmIruT0c,"Cleveland Cavaliers vs Golden State Warriors: December 25, 2017",Motion Station,2017-12-25,277748,1372,185,246,CA,Sports
RwH7vvXlf6M,Man United vs Burnley 2-2 All Goals & Highlights 26/12/2017 HD,Wrsh98,2017-12-26,517605,1784,179,393,CA,Sports
3xH4u0NLuk4,UFC 219 Embedded: Vlog Series - Episode 1,UFC - Ultimate Fighting Championship,2017-12-26,387681,6175,173,2275,CA,Sports
cAjkvg6Xc5A,Virat & Anushka dancing with SRK at Mumbai Reception | Cric7,Cric7 Videos,2017-12-26,411655,2659,144,54,CA,Sports
QAwugvwTPEs,Real Madrid Vs Barcelona 0-3 - All Goals & Highlights - Resumen y Goles 23/12/2017 HD,NugoBasilaiaa,2017-12-23,2758507,15509,1599,1789,CA,Sports
CeK6seVYaQk,LIV vs SWA 5-0 Highlights & Goals - 26 December 2017 HD,Team Bwowos,2017-12-26,1600054,6489,535,331,CA,Sports
cnqb2tXu9k8,JE PASSE SUR TF1 ÇA TOURNE MAL !!,Tibo InShape,2017-12-24,1937780,153801,4097,5363,CA,Sports
8TE1h4OJ_OM,Chelsea vs Brighton 2-0 Goals & Extended Highlights 26 December 2017,Iuonak,2017-12-26,370556,1171,131,104,CA,Sports
2C9tIrhUnXg,Kevin Durant vs LeBron James NBA Christmas Cavs vs Warriors 2017-18 Season,Chris Smoove,2017-12-26,406117,13608,230,4398,CA,Sports
5JjPfpSrtvY,Real Madrid vs Barcelona 0-3 - All Goals & Extended Highlights - La Liga 23/12/2017 HD,GOLAZO TV,2017-12-23,3817620,32697,2679,5850,CA,Sports
9oyKePWRi8Y,Best of 2017 | Dude Perfect,Dude Perfect,2017-12-26,6291266,307708,2851,15199,CA,Sports
z5wiZRlV9I4,Cleveland Cavaliers vs Golden State Warriors Full Game Highlights / Week 11 / Dec 25,MLG Highlights,2017-12-25,2702889,12341,1272,7022,CA,Sports
OKnL_D3bvLU,Real Madrid vs Barcelona 0-3 - All Goals & Highlights - 23/12/2017 HD,Premium Sintesi,2017-12-23,7386080,66568,5508,6139,CA,Sports
bYZajWpce-w,"Brendan Shanahan speaks on the Passing of Leaf Great Johnny Bower - December 27, 2017",Toronto Maple Leafs,2017-12-27,4138,144,0,15,CA,Sports
byqfaZJsKAU,Biggest NBA Transformations Compilation (Then & Now),Heat Check,2017-12-26,971871,8781,393,739,CA,Sports
JhvzsKnV-LE,UFC 219 Embedded: Vlog Series - Episode 2,UFC - Ultimate Fighting Championship,2017-12-27,289665,4654,108,1648,CA,Sports
Y5PvmIruT0c,"Cleveland Cavaliers vs Golden State Warriors: December 25, 2017",Motion Station,2017-12-25,310054,1490,208,248,CA,Sports
gQqi_Vm1oqU,"Asuka sets her sights on Alexa Bliss by entering the Royal Rumble Match: Raw, Dec. 25, 2017",WWE,2017-12-26,882311,15890,720,2883,CA,Sports
Ldvb9J2ex04,CE N'EST PAS LA TAILLE QUI COMPTE!,Wass Freestyle,2017-12-27,398472,50310,589,3833,CA,Sports
OmLxYUOgTNs,Jalen shuts down Will saying Kevin Durant will surpass LeBron James this season | First Take | ESPN,ESPN,2017-12-27,369942,4196,271,2586,CA,Sports
JgFakipK4z0,ENTRAINEMENT DE FOU ENTRE AMIS,Tibo InShape,2017-12-27,565819,41859,632,2718,CA,Sports
CBQjhjeHv_w,"Washington Wizards vs Boston Celtics - Full Game Highlights | Dec 25, 2017 | NBA Season 2017-18",Rapid Highlights,2017-12-26,613729,1365,138,244,CA,Sports
9oyKePWRi8Y,Best of 2017 | Dude Perfect,Dude Perfect,2017-12-26,6969112,324853,3151,16270,CA,Sports
JhvzsKnV-LE,UFC 219 Embedded: Vlog Series - Episode 2,UFC - Ultimate Fighting Championship,2017-12-27,549782,6570,159,2029,CA,Sports
zHs4hIuAEGQ,Play w/ Timothy DeLaGhetto’s Woody 'Official Sneak Peek' | Wild 'N Out | MTV,MTV,2017-12-28,325177,7975,59,153,CA,Sports
byukjr-MFP0,Boston Celtics vs Houston Rockets Full Game Highlights / Week 11 / Dec 28,MLG Highlights,2017-12-29,474111,4476,208,1983,CA,Sports
ydYK365oNgo,"Boston Celtics vs Charlotte Hornets - Full Game Highlights | Dec 27, 2017 | NBA Season 2017-18",Rapid Highlights,2017-12-28,458898,1113,94,152,CA,Sports
7RQXhN3QCvs,"Aho, Ward power Hurricanes to 3-1 victory on home ice",NHL,2017-12-28,7440,67,9,37,CA,Sports
RBllnpr5qDA,Vince Carter 24 Points vs LeBron James Triple Double! 2017-18 Season,Chris Smoove,2017-12-28,222605,7931,56,582,CA,Sports
nGkELaGU2k0,Crystal Palace vs Arsenal 2-3 All Goals & Highlights 28/12/2017 HD,Wrsh98,2017-12-28,684676,2036,216,221,CA,Sports
q2uvnl3US1w,NBA Players Going GOD MODE,Heat Check,2017-12-27,338960,2613,112,189,CA,Sports
AoJLWk41Tks,UFC 219: Official Weigh-in,UFC - Ultimate Fighting Championship,2017-12-30,240792,3094,92,1327,CA,Sports
ZlHfYj3b1c0,Doing Stunts From The Amazing Spider-Man In Real Life,Nick Pro,2017-12-29,100163,2297,76,366,CA,Sports
IVKykpy2dIk,"Marleau, Marner propel Leafs to 7-4 win vs. Coyotes",NHL,2017-12-29,35827,306,12,170,CA,Sports
xnfd7iaPmnA,Ayo & Teyo Dance Their Way To Victory | Wild 'N Out | #Wildstyle,MTV,2017-12-29,791791,24586,419,1008,CA,Sports
byukjr-MFP0,Boston Celtics vs Houston Rockets Full Game Highlights / Week 11 / Dec 28,MLG Highlights,2017-12-29,1711088,9990,533,2986,CA,Sports
9oyKePWRi8Y,Best of 2017 | Dude Perfect,Dude Perfect,2017-12-26,7448921,335822,3359,16869,CA,Sports
JGUQWdjyMME,Highlights of the USA vs. Slovakia game,Hockey is life,2017-12-29,5461,29,1,23,CA,Sports
bYMlIHJZ4FE,USA vs. Canada (FULL GAME) | IIHF WJC 12/29/2017,Puck Daily,2017-12-30,17073,369,10,6,CA,Sports
A1Rt9sA1i2o,"Minnesota Timberwolves vs Milwaukee Bucks - Full Game Highlights | Dec 28, 2017 | NBA Season 2017-18",Rapid Highlights,2017-12-29,350911,1049,61,242,CA,Sports
sBsaLHgBmYk,FULL MATCH - Royal Rumble Match: Royal Rumble 2013,WWE,2017-12-29,462977,16816,616,2442,CA,Sports
AoJLWk41Tks,UFC 219: Official Weigh-in,UFC - Ultimate Fighting Championship,2017-12-30,492624,4124,149,1878,CA,Sports
4yNHILuiGgY,J'ENTRAINE MES FRÈRES !!,Tibo InShape,2017-12-30,905540,77818,842,4453,CA,Sports
YIiFjONHEp8,"Atlanta Hawks vs Toronto Raptors - Full Game Highlights | Dec 29, 2017 | NBA Season 2017-18",Rapid Highlights,2017-12-30,81401,265,11,119,CA,Sports
MhPdwzDKOb0,Golden State Warriors vs Memphis Grizzlies Full Game Highlights / Dec 30 / 2017-18 NBA Season,MLG Highlights,2017-12-31,331592,3928,151,1118,CA,Sports
ZlHfYj3b1c0,Doing Stunts From The Amazing Spider-Man In Real Life,Nick Pro,2017-12-29,307735,3654,184,514,CA,Sports
xnfd7iaPmnA,Ayo & Teyo Dance Their Way To Victory | Wild 'N Out | #Wildstyle,MTV,2017-12-29,1266537,32823,595,1351,CA,Sports
tSvAPO-sy6s,Chelsea vs Stoke City 5-0 All Goals & Highlights 30/12/2017 HD,Wrsh98,2017-12-30,343267,1415,116,110,CA,Sports
FYf4V6XFIFA,"Compher, Avalanche top Maple Leafs in overtime, 4-3",NHL,2017-12-30,20545,98,15,81,CA,Sports
mtIgppWwnA8,"Head Coach Dwane Casey FURIOUS with Hawks Coach - Raptors vs Hawks | Dec 29, 2017 | 17-18 NBA Season",Raptors HQ,2017-12-30,15984,79,0,27,CA,Sports
pf5YPloinZ0,Bayley reveals how Matt Hardy ruined her relationship and more teen stories: WWE Superstar Superfan,WWE,2017-12-30,382142,11460,275,1317,CA,Sports
iLZwZX39FXU,Holly Holm vs Cris Cyborg Breakdown | HIGHLIGHTS | UFC 219,UFC ON FOX,2017-12-31,1606151,5010,1013,2057,CA,Sports
elKXFHeJFbc,UFC 219: Cris Cyborg - Octagon Interview,UFC - Ultimate Fighting Championship,2017-12-31,779843,4797,478,2216,CA,Sports
KtwVjaO8CwM,London New Year's Eve 2018 - Fireworks From London [FULL],BrioTV,2018-01-01,84662,653,41,83,CA,Sports
MhPdwzDKOb0,Golden State Warriors vs Memphis Grizzlies Full Game Highlights / Dec 30 / 2017-18 NBA Season,MLG Highlights,2017-12-31,1388463,8998,392,1837,CA,Sports
7ClO-1OGP4k,"Gaborik, Toffoli help Kings top Canucks, 4-3",NHL,2017-12-31,11551,106,10,84,CA,Sports
4yNHILuiGgY,J'ENTRAINE MES FRÈRES !!,Tibo InShape,2017-12-30,1196196,94161,1163,5375,CA,Sports
b_RtkI6EUvY,Browns vs. Steelers | NFL Week 17 Game Highlights,NFL,2017-12-31,285127,2802,127,1739,CA,Sports
Of9oaK1eeWw,Is a Pure Silver Bar Bullet Proof???  Super Expensive!!!,DemolitionRanch,2017-12-31,648853,45081,534,5536,CA,Sports
HBzzB9Ra9b8,"LFR11 - Game 39 - MacKilledIt - Tor 3, Col 4 (OT)",SteveDangle,2017-12-30,18347,751,7,187,CA,Sports
26GvjUcuYHE,"Cleveland Cavaliers vs Utah Jazz - Full Game Highlights | Dec 30, 2017 | NBA Season 2017-18",Rapid Highlights,2017-12-31,226637,476,44,203,CA,Sports
bwOMObQxIdQ,UFC 219: Khabib Nurmagomedov Post-Fight Press Conference - MMA Fighting,MMAFightingonSBN,2017-12-31,134138,1808,65,917,CA,Sports
VAx1GDM2jD4,Donovan Mitchell Spoils LeBron's Birthday Alley Oop and Dunk! 2017-18 Season,Chris Smoove,2017-12-31,321605,10231,89,903,CA,Sports
iLZwZX39FXU,Holly Holm vs Cris Cyborg Breakdown | HIGHLIGHTS | UFC 219,UFC ON FOX,2017-12-31,2371010,6811,1500,2775,CA,Sports
KtwVjaO8CwM,London New Year's Eve 2018 - Fireworks From London [FULL],BrioTV,2018-01-01,226267,1342,86,206,CA,Sports
elKXFHeJFbc,UFC 219: Cris Cyborg - Octagon Interview,UFC - Ultimate Fighting Championship,2017-12-31,859756,5055,519,2319,CA,Sports
-Pl-TSs97J4,"Kurt Angle reveals the rules for the first-ever Women's Royal Rumble Match: Raw, Jan. 1, 2018",WWE,2018-01-02,418316,10336,270,1562,CA,Sports
MhPdwzDKOb0,Golden State Warriors vs Memphis Grizzlies Full Game Highlights / Dec 30 / 2017-18 NBA Season,MLG Highlights,2017-12-31,1621168,9655,432,1984,CA,Sports
dI_GLAGsD2M,NHL: Injury During Warmups,Jens95,2017-12-31,108925,795,20,124,CA,Sports
TVUF1lVjyA8,Burnley vs Liverpool 1-2 All Goals & Highlights 01/01/2018 HD,Wrsh98,2018-01-01,530838,2341,227,146,CA,Sports
b_RtkI6EUvY,Browns vs. Steelers | NFL Week 17 Game Highlights,NFL,2017-12-31,550275,4448,201,2252,CA,Sports
00ea8T7iwTw,Season 2 Episode 6 - Ball in the Family - “A Mother’s Love”,Real Sportz,2018-01-01,486401,7013,161,678,CA,Sports
Of9oaK1eeWw,Is a Pure Silver Bar Bullet Proof???  Super Expensive!!!,DemolitionRanch,2017-12-31,1081376,65128,792,6853,CA,Sports
iTrcyQtEEs8,EVE vs MU 0-2 Highlights & Goals 2nd January 2018,GrandHighlights HD,2018-01-01,1852312,7845,679,488,CA,Sports
j-Nmn0ebfu4,"Conor McGregor Reacts to Khabib's performance-Sloppy Bum asking to be slept,Urijah on Sage,Lee",MMA WORLD,2018-01-01,424434,5583,393,3990,CA,Sports
iLZwZX39FXU,Holly Holm vs Cris Cyborg | HIGHLIGHTS | UFC 219,UFC ON FOX,2017-12-31,2894282,7709,1763,3027,CA,Sports
RpOWPsJIkjI,"Portland Trail Blazers vs Cleveland Cavaliers - Full Game Highlights Jan 2, 2018 NBA Season 2017-18",Rapid Highlights,2018-01-03,190738,1070,67,232,CA,Sports
zDz9s2AOTVE,"Brock Lesnar steps into the fire with Kane: Raw, Jan. 1, 2018",WWE,2018-01-02,3208825,51775,2723,5706,CA,Sports
J8xfz8lCE7Y,Milwaukee Bucks vs Toronto Raptors Full Game Highlights / Jan 1 / 2017-18 NBA Season,MLG Highlights,2018-01-02,254093,1172,52,302,CA,Sports
JecJSDbE118,Will Isaiah Thomas returning hurt the Cleveland Cavaliers chemistry? | UNDISPUTED,Skip and Shannon: UNDISPUTED,2018-01-02,304269,2891,117,911,CA,Sports
r-1yjIoWxBA,RECETTE GALETTE DES ROIS DIÈTE (ft. Tibo Inshape),Juju Fitcats,2018-01-02,295812,24014,538,2318,CA,Sports
KtwVjaO8CwM,London New Year's Eve 2018 - Fireworks From London [FULL],BrioTV,2018-01-01,243174,1403,97,208,CA,Sports
jvNefGT0qQY,Tibo InShape - Bonne Résolution feat. Ma Famille (Clip Officiel),Tibo InShape,2018-01-02,888353,104251,5533,5425,CA,Sports
dI_GLAGsD2M,NHL: Injury During Warmups,Jens95,2017-12-31,148733,966,24,137,CA,Sports
elKXFHeJFbc,UFC 219: Cris Cyborg - Octagon Interview,UFC - Ultimate Fighting Championship,2017-12-31,888459,5164,537,2341,CA,Sports
j80JbKPEMNQ,NHL Fan Interactions,Delta Highlights,2018-01-02,223974,1491,65,164,CA,Sports
34SnjkpKcTI,DeMar DeRozan's 52-point game a sign of things to come? | The Jump | ESPN,ESPN,2018-01-02,31814,561,18,234,CA,Sports
XTWyTn_qkg8,"Isaiah Thomas Official Cavaliers Debut, Full Highlights vs Blazers (2018.01.02) - 17 Pts",Real GD's Latest Highlights,2018-01-03,133450,2528,46,610,CA,Sports
FgZVZic9AsY,"DeMar DeRozan UNREAL Career-HiGH 52 Pts 2018.01.01 vs Bucks - 52 Pts, Raptors Franchise RECORD!",FreeDawkins,2018-01-02,122186,2484,35,848,CA,Sports
duCd0Gy-k14,ARS vs CHE 2-2 All Goals & Highlights 03/01/2018 HD,Wrsh98,2018-01-03,1246408,7301,571,1025,CA,Sports
RpOWPsJIkjI,"Portland Trail Blazers vs Cleveland Cavaliers - Full Game Highlights Jan 2, 2018 NBA Season 2017-18",Rapid Highlights,2018-01-03,605094,2029,148,405,CA,Sports
X1rfgbHfPDc,Golden State Warriors vs Dallas Mavericks Full Game Highlights / Jan 3 / 2017-18 NBA Season,MLG Highlights,2018-01-04,247470,2719,79,1005,CA,Sports
h-n1PZmNvrQ,Daniel Bryan pairs Charlotte Flair and Bobby Roode for WWE Mixed Match Challenge,WWE,2018-01-03,329333,9551,122,817,CA,Sports
Qe7dInvivYg,Stephen A. Smith says Isaiah Thomas return proves Warriors should be concerned | First Take | ESPN,ESPN,2018-01-03,503698,4880,250,1963,CA,Sports
sPY014ld3vw,Skip and Shannon on Isaiah Thomas after his Cleveland Cavaliers debut | UNDISPUTED,Skip and Shannon: UNDISPUTED,2018-01-03,228968,2395,183,1147,CA,Sports
9t6EDSRc96g,Isaiah Thomas Cavs Debut! Damian Lillard Returns! 2017-18 Season,Chris Smoove,2018-01-03,408162,14207,72,923,CA,Sports
XTWyTn_qkg8,"Isaiah Thomas Official Cavaliers Debut, Full Highlights vs Blazers (2018.01.02) - 17 Pts",Real GD's Latest Highlights,2018-01-03,360955,3978,80,885,CA,Sports
j80JbKPEMNQ,NHL Fan Interactions,Delta Highlights,2018-01-02,271596,1712,77,200,CA,Sports
8gXSBZuCov4,Oilers’ Maroon gets match penalty for fight and hit to Doughty’s head,SPORTSNET,2018-01-03,27592,115,13,117,CA,Sports
iLZwZX39FXU,Holly Holm vs Cris Cyborg | HIGHLIGHTS | UFC 219,UFC ON FOX,2017-12-31,3252167,8335,1935,3304,CA,Sports
Lh19QWLOtBk,J’OFFRE 100 EUROS À CELUI QUI RÉUSSIT!,Wass Freestyle,2018-01-03,198975,18537,267,2154,CA,Sports
mBhAPpHqD4Y,"Video emerges of Cody Garbrandt getting kicked in the face by Jean-Claude Van DammeBisping,Khabib",MMA WORLD,2018-01-03,282923,4461,165,2340,CA,Sports
qqhh5WmU_9s,"Frederik Andersen has been fined $2,000",Hockey is life,2018-01-04,6711,22,19,46,CA,Sports
1dCnGh603hc,Cleveland Cavaliers vs Boston Celtics Full Game Highlights / Jan 3 / 2017-18 NBA Season,MLG Highlights,2018-01-04,1896728,8316,629,3147,CA,Sports
TRV0zLGRGnw,"Cleveland Cavaliers vs Boston Celtics - Full Game Highlights | Jan 3, 2018 | NBA Season 2017-18",Rapid Highlights,2018-01-04,446197,1399,91,515,CA,Sports
1JHY490K_A8,Kurt Angle pairs Finn Bálor with Sasha Banks for WWE Mixed Match Challenge,WWE,2018-01-04,623562,19283,606,2309,CA,Sports
4jTNG_K0SDo,Stephen A.: Paul George is better off with Lonzo Ball than Russell Westbrook | First Take | ESPN,ESPN,2018-01-04,256016,2665,192,1139,CA,Sports
WXw4Y9mSkA4,Chris Broussard reacts to the Celtics 102-88 win against LeBron and the Cavaliers | UNDISPUTED,Skip and Shannon: UNDISPUTED,2018-01-04,337534,3459,133,1692,CA,Sports
kWk5w6JPucA,"Vegas, Baby | The Steve Dangle Podcast",Steve Dangle Podcast,2018-01-04,7447,248,4,81,CA,Sports
y8hLLjfR-4Q,Gotta See It: Kadri rips out handful of Thornton’s beard,SPORTSNET,2018-01-05,20555,233,11,135,CA,Sports
n4YzfOI_LEI,Joe Thornton fights Nazem Kadri - Sharks vs Leafs (01/04/18),Torontomapleleafs951,2018-01-05,17584,50,7,45,CA,Sports
LJsbf7KNVCA,Deleted video,Torontomapleleafs951,2018-01-05,17584,50,7,45,CA,Sports
MJi9s9xhqSg,TOT vs WEST 1-1 All Goals & Highlights 04/01/2018 HD,Wrsh98,2018-01-04,413357,1544,83,342,CA,Sports
c9_Idk63F1o,Stephen Curry Game Winner vs Mavs! Splash with 3 Seconds Left! 2017-18 Season,Chris Smoove,2018-01-04,332682,10545,110,1046,CA,Sports
4z-3iiXRkQY,"Delon Wright Full Highlights 2018.01.03 at Bulls - 25 Points, 13 Rebs, 5 Asts, 4 Stls, 10-15 FGM!",FreeDawkins,2018-01-04,6393,209,4,100,CA,Sports
hU_oxkN9wsw,Keyshia Cole Would F*** Up Nick Cannon's Car | Wild 'N Out | #Wildstyle,MTV,2018-01-05,625474,20074,161,1089,CA,Sports
y8hLLjfR-4Q,Gotta See It: Kadri rips out handful of Thornton’s beard,SPORTSNET,2018-01-05,214514,495,29,263,CA,Sports
EQvdKS-QX_E,Daniel Bryan teams Jimmy Uso and Naomi in WWE Mixed Match Challenge,WWE,2018-01-05,534746,16126,173,1476,CA,Sports
n4YzfOI_LEI,Joe Thornton fights Nazem Kadri - Sharks vs Leafs (01/04/18),Torontomapleleafs951,2018-01-05,83744,148,32,138,CA,Sports
Rg-II_AAWqE,Golden State Warriors vs Houston Rockets Full Game Highlights / Jan 4 / 2017-18 NBA Season,MLG Highlights,2018-01-05,1920643,9526,473,2235,CA,Sports
fMxDCUgnaeA,Calgary Flames NHL Head Coach Glen Gulutzan Rips His Team in stick-tossing tirade,NHL Game Recaps,2018-01-05,5316,65,2,23,CA,Sports
b8xzvb130m0,01/04/18 Condensed Game: Sharks @ Maple Leafs,NHL,2018-01-05,10319,97,3,20,CA,Sports
8Pt-pk9YvKE,"Toronto Raptors vs Milwaukee Bucks - Full Game Highlights | Jan 5, 2018 | NBA Season 2017-18",Rapid Highlights,2018-01-06,52336,259,13,141,CA,Sports
-JuoCd2tocw,Andersson Throws Silver Medal into Crowd,TSN,2018-01-06,2315,44,3,38,CA,Sports
5AGyFelwyk4,LaVar Ball gets real during interview with ESPN before LiAngelo and LaMelo's first game | ESPN,ESPN,2018-01-05,262946,6366,175,1491,CA,Sports
0FH_P_maCdw,Skip and Shannon look ahead to Paul Pierce's jersey retirement in Boston | UNDISPUTED,Skip and Shannon: UNDISPUTED,2018-01-05,165383,1893,82,682,CA,Sports
y8hLLjfR-4Q,Gotta See It: Kadri rips out handful of Thornton’s beard,SPORTSNET,2018-01-05,289644,793,48,375,CA,Sports
n4YzfOI_LEI,Joe Thornton fights Nazem Kadri - Sharks vs Leafs (01/04/18),Torontomapleleafs951,2018-01-05,113632,187,45,185,CA,Sports
hU_oxkN9wsw,Keyshia Cole Would F*** Up Nick Cannon's Car | Wild 'N Out | #Wildstyle,MTV,2018-01-05,861390,24479,273,1304,CA,Sports
-JuoCd2tocw,Andersson Throws Silver Medal into Crowd,TSN,2018-01-06,68800,242,29,296,CA,Sports
8Pt-pk9YvKE,"Toronto Raptors vs Milwaukee Bucks - Full Game Highlights | Jan 5, 2018 | NBA Season 2017-18",Rapid Highlights,2018-01-06,170303,546,22,278,CA,Sports
2eoEctPNGNw,Jimmy Ma SP 2018 US Nationals,Yarotska,2018-01-05,319216,1400,86,162,CA,Sports
Agg73-6QOYo,Titans vs. Chiefs | NFL Wild Card Game Highlights,NFL,2018-01-07,491712,5088,233,3067,CA,Sports
EQvdKS-QX_E,Daniel Bryan teams Jimmy Uso and Naomi in WWE Mixed Match Challenge,WWE,2018-01-05,742624,19129,255,1704,CA,Sports
tQCGOuhfovQ,8 year old Theo's first backflip to dirt (mtb),SamJakeTheo Riddle,2017-04-27,257791,4410,53,273,CA,Sports
Rg-II_AAWqE,Golden State Warriors vs Houston Rockets Full Game Highlights / Jan 4 / 2017-18 NBA Season,MLG Highlights,2018-01-05,2130508,10082,519,2352,CA,Sports
6Bu0ECF1IME,"Byron, Price pace Canadiens to 2-1 shootout victory",NHL,2018-01-05,31464,311,15,205,CA,Sports
uOXzkdvAUv4,"LFR11 - Game 42 - Shark Shave - SJ 2, Tor 3 (SO)",SteveDangle,2018-01-05,22922,1102,11,203,CA,Sports
KZkDSdap9HM,"Canada vs Sweden | 2018 WJC GOLD MEDAL GAME | Highlights | Jan. 5, 2018",VinzyHighlights,2018-01-06,24968,215,7,168,CA,Sports
Ci4Bl07PeQk,Steph Curry Checks on Blake Griffin's Injury! Warriors vs Clippers!,HighlightsCentral312,2018-01-06,389038,2287,75,573,CA,Sports
p9zR0rWA2Sk,DER vs MNU 0-2 All goals & Highlights English Commentary (05/01/2018) HD/1080P,NIXBLACK,2018-01-05,1163819,3726,375,354,CA,Sports
G3O8xd5QYts,1/5/2018: Lias Andersson addresses throwing silver medal in stands at WJC,Mike Ashmore,2018-01-06,35275,50,15,280,CA,Sports
4FzbTOIF9mI,"Canada vs Sweden - Medal Ceremony and Celebrations (Jan. 5, 2018) (TSN)",GoCanucksGo,2018-01-06,5108,51,3,27,CA,Sports
aWk9cyQhI9k,CHez Andrew: A tour of Andrew Shaw's house (Habs Cribs),Canadiens de Montréal,2018-01-06,3549,229,2,24,CA,Sports
qpZ2b-EZjAY,Raptors Score 43 in 3rd Quarter vs Bucks! 2017-18 Season,Chris Smoove,2018-01-06,146850,5084,26,318,CA,Sports
ss6qQM054B0,Oprah Winfrey Golden Globes Cecil B. DeMille Award Acceptance Speech,Pop & Sports HQ,2018-01-08,305901,6968,494,1344,CA,Sports
LyBims8OkSY,Oprah Winfrey Receives the Cecil B. DeMille Award - Golden Globes 2018,Golden Globes,2018-01-08,220480,3420,117,370,CA,Sports
y8hLLjfR-4Q,Gotta See It: Kadri rips out handful of Thornton’s beard,SPORTSNET,2018-01-05,334922,975,61,345,CA,Sports
Agg73-6QOYo,Titans vs. Chiefs | NFL Wild Card Game Highlights,NFL,2018-01-07,1357584,9762,345,4741,CA,Sports
MpS-hg0I1x8,2018 IIHF World Junior Hockey: Canada vs. Sweden 1:45 left in 3rd period,Torontomapleleafs951,2018-01-06,110928,705,60,710,CA,Sports
54cGamoveGw,Andersson Explains why he Threw his Silver Medal Over the Glass,TSN,2018-01-07,21481,122,15,63,CA,Sports
QmmoQVcGlhc,"GS Warriors vs LA Clippers - Full Game Highlights | Jan 6, 2018 | NBA Season 2017-18",Rapid Highlights,2018-01-06,1121655,3614,229,856,CA,Sports
iyENBGyECH0,Hamilton nets game-winner with 16 seconds left in 3rd,NHL,2018-01-07,9812,89,5,36,CA,Sports
hU_oxkN9wsw,Keyshia Cole Would F*** Up Nick Cannon's Car | Wild 'N Out | #Wildstyle,MTV,2018-01-05,1018300,27029,346,1263,CA,Sports
KZkDSdap9HM,"Canada vs Sweden | 2018 WJC GOLD MEDAL GAME | Highlights | Jan. 5, 2018",VinzyHighlights,2018-01-06,29361,236,9,197,CA,Sports
p0WBr71jOEs,CURLSASK Live Stream,CURLSASK,2018-01-08,2248,16,2,0,CA,Sports
2eoEctPNGNw,Jimmy Ma SP 2018 US Nationals,Yarotska,2018-01-05,424884,2051,125,261,CA,Sports
euw4B5jq1GU,Nottingham Forest 4-2 Arsenal | Wenger Was Arrogant To Have No Insurance On The Bench! (DT),ArsenalFanTV,2018-01-07,457321,11494,331,2428,CA,Sports
Ci4Bl07PeQk,Steph Curry Checks on Blake Griffin's Injury! Warriors vs Clippers!,HighlightsCentral312,2018-01-06,951072,4659,164,971,CA,Sports
8c6-SPYAaRs,"Football Fights & Angry Moments 2017/2018 ● Neymar, Messi, C.Ronaldo, Ramos",JackieMT 2nd,2018-01-06,2416034,22005,1363,1460,CA,Sports
6jetElIwt-w,Barcelona vs Levante 3-0 - All Goals & Extended Highlights - La Liga 07/01/2018 HD,GOLAZO TV,2018-01-07,1826719,14723,646,1276,CA,Sports
GvYr8H4eUDI,FULL MATCH - Royal Rumble Match: Royal Rumble 2017 (WWE Network Exclusive),WWE,2018-01-06,1231688,34221,1523,5095,CA,Sports
3lt-Zq6DwrI,"LFR11 - Game 43 - Boeser Evil - Van 2, Tor 3 (SO)",SteveDangle,2018-01-07,22715,1208,13,297,CA,Sports
54cGamoveGw,Andersson Explains why he Threw his Silver Medal Over the Glass,TSN,2018-01-07,95791,736,73,415,CA,Sports
g1QONg2b2JQ,Overtime | Episode 1 | Dude Perfect,Dude Perfect,2018-01-08,2055743,153455,2589,30437,CA,Sports
y8hLLjfR-4Q,Gotta See It: Kadri rips out handful of Thornton’s beard,SPORTSNET,2018-01-05,361775,1054,69,355,CA,Sports
Agg73-6QOYo,Titans vs. Chiefs | NFL Wild Card Game Highlights,NFL,2018-01-07,1619662,10777,384,5160,CA,Sports
MpS-hg0I1x8,2018 IIHF World Junior Hockey: Canada vs. Sweden 1:45 left in 3rd period,Torontomapleleafs951,2018-01-06,127183,800,63,802,CA,Sports
S84rdyr9MLI,"An overzealous Jason Jordan interrupts Roman Reigns: Raw, Jan. 8, 2018",WWE,2018-01-09,426545,13149,440,2527,CA,Sports
K5QhLZRv4aM,"Cleveland Cavaliers vs Minnesota Timberwolves - Full Game Highlights | Jan 8, 2018 | NBA 2017-18",Rapid Highlights,2018-01-09,285527,1424,130,964,CA,Sports
3lt-Zq6DwrI,"LFR11 - Game 43 - Boeser Evil - Van 2, Tor 3 (SO)",SteveDangle,2018-01-07,28605,1352,16,313,CA,Sports
NNM7lllxL5U,Skip and Shannon discuss LaVar Ball's criticism of Lakers coach Luke Walton | UNDISPUTED,Skip and Shannon: UNDISPUTED,2018-01-08,280580,2743,192,1429,CA,Sports
G3O8xd5QYts,1/5/2018: Lias Andersson addresses throwing silver medal in stands at WJC,Mike Ashmore,2018-01-06,44029,59,18,295,CA,Sports
80G5ZbwWDeE,Stephen A. Smith: LaVar Ball betrayed Magic Johnson with Luke Walton comments | First Take | ESPN,ESPN,2018-01-08,448209,3390,336,1476,CA,Sports
CSy4LvMfV3o,"Maple Leafs Pre-Game: Auston Matthews - January 8, 2018",Toronto Maple Leafs,2018-01-08,2884,59,1,5,CA,Sports
6jetElIwt-w,Barcelona vs Levante 3-0 - All Goals & Extended Highlights - La Liga 07/01/2018 HD,GOLAZO TV,2018-01-07,2410559,16816,826,1410,CA,Sports
iyENBGyECH0,Hamilton nets game-winner with 16 seconds left in 3rd,NHL,2018-01-07,11476,99,5,42,CA,Sports
QP4_p9nMbJM,مباراة الزمالك vs الأهلي 0 - 3  | الجولة الـ 17 الدوري العام الممتاز 2017 - 2018,Presentation Sports,2018-01-08,989669,4470,601,89,CA,Sports
UcitOzhllG8,LaMelo Ball Brings JELLY & Gelo THROWS DOWN In First Lithuanian Game! FULL HIGHLIGHTS!,Overtime,2018-01-09,1740172,18556,689,3365,CA,Sports
g1QONg2b2JQ,Wheel Unfortunate | Dude Perfect,Dude Perfect,2018-01-08,5657263,294794,5911,48570,CA,Sports
7MSV9wL9Gqs,LaMelo Ball Gets JELLY & LiAngelo DUNKING In FIRST PRO GAME IN LITHUANIA!! Full Highlights,Ballislife,2018-01-09,994633,17514,300,1953,CA,Sports
7b3My5ncXXM,"Serge Ibaka & James Johnson both EJECTED - Raptors vs Heat | Jan 9, 2018 | 2017-18 NBA Season",Raptors HQ,2018-01-10,429513,358,22,405,CA,Sports
mFTrsEYbZRM,Anderson records 250th career victory in 4-3 win,NHL,2018-01-11,20059,144,22,82,CA,Sports
Z-m0lKqR02Y,LaMelo Ball & LiAngelo Ball Quick Q&A,BBBLithuania,2018-01-10,517244,10037,292,620,CA,Sports
ULRV66m5jCQ,Carmella finds her WWE Mixed Match Challenge New Day partner in a box of Booty-O's,WWE,2018-01-10,367170,8885,125,1037,CA,Sports
usF68C42G0s,Michael Rapaport on LaVar Ball: ‘He wishes he was a Kardashian’ | UNDISPUTED,Skip and Shannon: UNDISPUTED,2018-01-10,254284,2665,423,1407,CA,Sports
sBC9r4HuKu0,Stephen A. sides with Reggie Miller: Magic Johnson should speak up on LaVar Ball | First Take | ESPN,ESPN,2018-01-10,585239,4450,496,2691,CA,Sports
5fnQUoD0Opg,"Portland Trail Blazers vs Houston Rockets - Full Game Highlights | Jan 10, 2018 | NBA Season 2017-18",Rapid Highlights,2018-01-11,416725,1209,68,522,CA,Sports
marAZRRxLgs,Barcelona vs Celta Vigo 5-0 - All Goals & Highlights ● 11/01/2018 HD (First Half),MrMatador,2018-01-11,484639,5777,442,552,CA,Sports
UIAjHPZu2as,Lamelo Ball DEBUT game in Lithuania,Troydan Reacts,2018-01-09,432421,10839,785,1919,CA,Sports
m5ibaYmnr4A,"Cleveland Cavaliers vs Toronto Raptors - Full Game Highlights | Jan 11, 2018 | NBA Season 2017-18",Rapid Highlights,2018-01-12,785343,2676,217,1688,CA,Sports
MCurklVW3Ws,Justina Valentine Is the Wildstyle Queen | Wild 'N Out | #Wildstyle,MTV,2018-01-12,734156,23717,188,800,CA,Sports
BSkQ88u4DnU,"Cleveland Cavaliers vs Toronto Raptors - Full Game Highlights | January 11, 2018",HighlightsCentral312,2018-01-12,378639,910,168,733,CA,Sports
bN5bXVZ9vuU,"Found Money, Diamond and Ring While Underwater Metal Detecting! (Crystal Clear Water)",DALLMYD,2018-01-12,705368,29402,406,1799,CA,Sports
26AKp-_IpIU,"Cleveland Cavaliers vs. Toronto Raptors - January 11, 2018",Motion Station,2018-01-12,79544,264,46,68,CA,Sports
zKsEtGmpFXU,"Stephen A. Smith blames LeBron James, Tyronn Lue, J.R. Smith for Cavs' struggles | First Take | ESPN",ESPN,2018-01-12,454207,3621,258,2114,CA,Sports
T-xboEvg7Ho,"Toronto Raptors vs Cleveland Cavaliers - Full Game Highlights | Jan 11, 2018 | 2017-18 NBA Season",Raptors HQ,2018-01-12,48005,388,11,206,CA,Sports
8RKmNEP6mZM,الهدف الأول لـ الأهلي امام المصري وليد ازارو  كأس السوبر المصري,Presentation Sports,2018-01-12,618492,2350,212,526,CA,Sports
mLUemsYJ6l0,Nick Wright reacts to the Cavaliers losing by 34 points to the Raptors | FIRST THINGS FIRST,First Things First: Cris Carter and Nick Wright,2018-01-12,145026,1139,282,1142,CA,Sports
K4JP9oaXLMU,Skip Bayless reveals what Ty Lue's 'hidden agenda' comments mean for LeBron's Cavs | UNDISPUTED,Skip and Shannon: UNDISPUTED,2018-01-12,252687,2411,93,1030,CA,Sports
marAZRRxLgs,Barcelona vs Celta Vigo 5-0 - All Goals & Highlights ● 11/01/2018 HD (First Half),MrMatador,2018-01-11,1748168,9571,856,809,CA,Sports
KV9i17MvONI,"LFR11 - Game 45 - Broken - Ott 4, Tor 3",SteveDangle,2018-01-11,24505,1325,13,263,CA,Sports
z_rHZI7AIUo,Barcelona vs Celta Vigo 5-0 - All Goals & Extended Highlights - La Copa 11/01/2017 HD,GOLAZO TV,2018-01-11,3077931,24391,1161,2339,CA,Sports
