video_id,title,channel_title,publish_time,views,likes,dislikes,comment_count,Region,category_title
mmMPprcmJeA,Diese Schlafposition solltest Du unbedingt vermeiden! | Liebscher & Bracht,Liebscher & Bracht | Die Schmerzspezialisten,2017-11-12,109571,4357,303,357,DE,Sports
TRZPLiLl9HY,Patriots vs. Broncos | NFL Week 10 Game Highlights,NFL,2017-11-13,725042,6620,294,1283,DE,Sports
KafpNXxuw0E,Hochzeitsvorbereitungen im Central Park | Sarah Nowak l Folge 11 l Fitness Diaries,Fitness Diaries,2017-11-12,21782,134,28,17,DE,Sports
qxGkk5l3Bws,Furia Roja zu stark für Costa Rica: Spanien - Costa Rica 5:0 Highlights | Testspiel | DAZN,Goal Deutschland,2017-11-12,258207,5116,66,296,DE,Sports
ypdHIAAR1aw,Fußballchallenge GEGEN MEINE FREUNDIN (+Arschbolzen),GoalKEEPERz,2017-11-12,167162,15451,423,617,DE,Sports
cV2BUaijwT8,James Rodriguez's horrible dive against South Korea,YoungSinatra954,2017-11-10,117785,374,123,155,DE,Sports
kUFB_AseTl0,Das war knapp?! Ostdeutsche Meisterschaft! #Oldschooldiet VLOG 14.1,Johannes Luckas - Personal Training,2017-11-13,36875,3831,34,419,DE,Sports
YYOCmR5Lvbw,2017 Brazil Grand Prix: Race Highlights,FORMULA 1,2017-11-12,758492,11936,160,1472,DE,Sports
_UEk3WRixnc,Bodybuilder bekommen Platzwunden - Paintball Challenge!!,HARDGAINER CREW,2017-11-13,31500,3122,28,192,DE,Sports
ZGBZVovL3Yo,"News - Rich Pianas Autopsiebericht veröffentlicht, Hardgainer Song, Sophia Thiel Body Update",Gannikus.com,2017-11-12,30907,1766,81,311,DE,Sports
CXaufwUE_e4,Jupp Heynckes rät FC Bayern zu Knaller-Transfer | SPORT1 TRANSFERMARKT,SPORT1,2017-11-13,66652,1509,30,180,DE,Sports
LPkOkDCk_6E,Deutschland gegen Frankreich - die Tore | Sportschau,Sportschau,2017-11-14,129193,2147,43,362,DE,Sports
pIMp3saKBEM,Sensation! Italien verpasst die WM: Italien - Schweden 0:0 | Highlights | WM-Quali | DAZN,Goal Deutschland,2017-11-14,416619,7997,347,1774,DE,Sports
oP-6Z1RlaIc,"Triple H returns to join Team Raw at Survivor Series: Raw, Nov. 13, 2017",WWE,2017-11-14,2455165,47921,2236,8112,DE,Sports
mmMPprcmJeA,Diese Schlafposition solltest Du unbedingt vermeiden! | Liebscher & Bracht,Liebscher & Bracht | Die Schmerzspezialisten,2017-11-12,171518,5606,465,526,DE,Sports
dRSiXsYyo0c,Rawisode 13: Another normal biking day II,Fabio Wibmer,2017-11-14,206869,13213,107,646,DE,Sports
4aYfjEJIYzQ,Grazie Gigi! Buffon verkündet unter Tränen seinen Rücktritt | Italien - Schweden | Interview | DAZN,SPOX,2017-11-13,107238,1926,55,437,DE,Sports
CXaufwUE_e4,Jupp Heynckes rät FC Bayern zu Knaller-Transfer | SPORT1 TRANSFERMARKT,SPORT1,2017-11-13,101132,1804,39,223,DE,Sports
j9ZenoC4E5o,Dolphins vs. Panthers | NFL Week 10 Game Highlights,NFL,2017-11-14,779509,6872,280,1804,DE,Sports
oT8vMGBugoQ,BODYBUILDER will es WISSEN - WETTKAMPF *EMOTIONAL*,SMARTGAINS,2017-11-13,27778,1601,44,94,DE,Sports
v3Z-7UjIIzU,Germany vs France 2-2 - Highlights & Goals - 14 November 2017,FOOTBALL MINDS,2017-11-14,202277,919,63,607,DE,Sports
DupviAaffdk,Stephen Colbert monologue 11/13/17 : Too Much Moore !,Federica Balsamo,2017-11-14,187026,786,121,218,DE,Sports
DQZc3pM2sC8,Wenn FUßBALLLEGENDEN ihr LETZTES Tor für ihren Club schießen...,FußballZone,2017-11-14,48877,1405,16,83,DE,Sports
LPkOkDCk_6E,Deutschland gegen Frankreich - die Tore | Sportschau,Sportschau,2017-11-14,572165,6826,256,0,DE,Sports
pIMp3saKBEM,Sensation! Italien verpasst die WM: Italien - Schweden 0:0 | Highlights | WM-Quali | DAZN,Goal Deutschland,2017-11-14,499285,8825,412,2065,DE,Sports
Ehke7aPI9l0,"Kurt Angle & The Shield lead a Raw raid of SmackDown: SmackDown LIVE, Nov. 14, 2017",WWE,2017-11-15,3715529,86803,2264,11409,DE,Sports
KPV4Pac3muA,WWE Smackdown 14 November Highlights HD - WWE Smackdown 14/11/2017 Highlights HD,Wrestling Reality II,2017-11-15,1502902,11298,920,1155,DE,Sports
4aYfjEJIYzQ,Grazie Gigi! Buffon verkündet unter Tränen seinen Rücktritt | Italien - Schweden | Interview | DAZN,SPOX,2017-11-13,129543,2239,70,464,DE,Sports
twFq7B-A6kA,Ballon d’Or Gewinner geleakt! Zlatan zur WM in Russland? | KickNews,Kick11,2017-11-15,160771,8302,169,2360,DE,Sports
v3Z-7UjIIzU,Germany vs France 2-2 - Highlights & Goals - 14 November 2017,FOOTBALL MINDS,2017-11-14,697002,2526,183,1396,DE,Sports
XWRk2qDDlUw,Die Spieltags-PK vor dem Dortmund-Spiel,VfB Stuttgart,2017-11-15,5301,152,8,22,DE,Sports
uWxvtzPRB6g,Outtakes | 10 Jahre Liebscher & Bracht Special,Liebscher & Bracht | Die Schmerzspezialisten,2017-11-15,9025,526,16,60,DE,Sports
_P13_8HyzcM,Cristiano Ronaldo will angeblich weg von Real Madrid | SPORT1 TRANSFERMARKT,SPORT1,2017-11-14,131380,2606,146,279,DE,Sports
39OHaRDl9xo,"Be DiaVita - You are more, than you think!",DiaVita official,2017-11-15,11096,13,0,0,DE,Sports
41cs4r52lh0,Seenot-Übung: Selbstversuch – 12 Stunden in der Insel!,YACHT tv,2017-11-15,2237,18,0,3,DE,Sports
0KurFBcmgKc,Sensationelle Dehnübung  - Mega Stretch für die Körperrückseite,StrongandFlexTV,2017-11-15,3898,436,0,27,DE,Sports
LPkOkDCk_6E,Deutschland gegen Frankreich - die Tore | Sportschau,Sportschau,2017-11-14,662910,7641,295,0,DE,Sports
pIMp3saKBEM,Sensation! Italien verpasst die WM: Italien - Schweden 0:0 | Highlights | WM-Quali | DAZN,Goal Deutschland,2017-11-14,527078,9100,430,2144,DE,Sports
Ehke7aPI9l0,"Kurt Angle & The Shield lead a Raw raid of SmackDown: SmackDown LIVE, Nov. 14, 2017",WWE,2017-11-15,4373507,94443,2502,12173,DE,Sports
KPV4Pac3muA,WWE Smackdown 14 November Highlights HD - WWE Smackdown 14/11/2017 Highlights HD,Wrestling Reality II,2017-11-15,1762418,12532,1087,1234,DE,Sports
KYe8n1FJfJE,Pressekonferenz vor Berlin,Borussia Mönchengladbach,2017-11-16,5317,176,3,17,DE,Sports
LDzBX_zj9hg,CELEBRACIÓN CON LLANTOS DE LA SELECCIÓN PERÚ TRAS CLASIFICAR AL MUNDIAL LUEGO DE 36 AÑOS,Pasión90' Perú,2017-11-16,655537,4842,241,1366,DE,Sports
vnI41KTWxas,Der WM-Fluch von Puma! Ancelotti neuer Italien-Trainer? | KickNews,Kick11,2017-11-16,146908,6820,215,645,DE,Sports
v3Z-7UjIIzU,Germany vs France 2-2 - Highlights & Goals - 14 November 2017,FOOTBALL MINDS,2017-11-14,814260,2840,214,1596,DE,Sports
KqLA3MThm8I,Jogi Löw feiert De Rossis Einwechsel-Verweigerung | SPORT1,SPORT1,2017-11-15,63903,1033,32,47,DE,Sports
5YbDyNgk-dI,2 GEGEN 1 FUßBALL CHALLENGE!!! (ft. SPECIAL ADIDAS Predator PRO ),GoalKEEPERz,2017-11-16,63857,6106,73,309,DE,Sports
-qHx6aW6YeA,Interessante Einblicke bei Tedescos Kabinengespräch-Premiere,FC Schalke 04,2017-11-16,4610,269,4,14,DE,Sports
AtPmhHaDtKw,Peru vs Nueva Zelanda 2-0 RESUMEN PERÚ AL MUNDIAL [Goals-Highlights] Repechaje Rusia 2018,Resumen Fútbol HD,2017-11-16,1618565,7591,849,5056,DE,Sports
3UHIvJfznI8,Flat Tire Long Jump Challenge! |Sick Series #32,Fabio Wibmer,2017-11-17,221353,14169,137,677,DE,Sports
LPkOkDCk_6E,Deutschland gegen Frankreich - die Tore | Sportschau,Sportschau,2017-11-14,701541,7908,307,0,DE,Sports
FVxzk7t13HM,Titans vs. Steelers | NFL Week 11 Game Highlights,NFL,2017-11-17,960271,8827,340,1974,DE,Sports
Q8EseubDARU,Selçuk Bahtiyar Dal - Al Ömrümü | O Ses Türkiye,Turkish TV Videos,2017-11-17,173275,1467,96,149,DE,Sports
-R3ncYKcamU,Blooper Borussia Dortmund vs Stuttgart | Chadrac Akolo goal | Error de Bartra,Univision Deportes,2017-11-17,26376,124,14,13,DE,Sports
Dq7xwqokX8M,Danish Dynamite ballert sich zur WM: Irland - Dänemark 1:5 Highlights | WM-Quali | DAZN,Goal Deutschland,2017-11-15,230224,4065,97,200,DE,Sports
jKkOYEW7RvQ,Golden State Warriors vs Boston Celtics Full Game Highlights / Week 5 / 2017 NBA Season,MLG Highlights,2017-11-17,3158597,19584,995,7573,DE,Sports
oqj0oh4WRJg,14. Spieltag | SGD - FCK | Pressekonferenz vor dem Spiel,SG Dynamo Dresden e.V.,2017-11-17,3897,76,0,0,DE,Sports
5YbDyNgk-dI,2 GEGEN 1 FUßBALL CHALLENGE!!! (ft. SPECIAL ADIDAS Predator PRO ),GoalKEEPERz,2017-11-16,74859,6875,84,326,DE,Sports
vnI41KTWxas,Der WM-Fluch von Puma! Ancelotti neuer Italien-Trainer? | KickNews,Kick11,2017-11-16,164092,7288,236,702,DE,Sports
Cu1aiNRP7qQ,Malu (8) - Schleifenvideo vom 17.11.2017,Sabine Schumacher,2017-11-17,4809,226,7,23,DE,Sports
OIME_ugAQ6s,"Interview mit Julian Zietlow & Ron Bielecki - Erfahrung mit TV Sendern, Umgang mit Hate, uvm.",Gannikus.com,2017-11-16,23604,896,222,240,DE,Sports
EWcpcdxr-VY,Spoon angeln ohne Sprengring??,MikesBigTrouts,2017-11-17,3497,114,4,21,DE,Sports
3A9U4IOl7lw,¡GOL! Brekalo | Stuttgart 2-1 Dortmund,Univision Deportes,2017-11-17,143436,380,38,41,DE,Sports
QXeIakWvDQg,PSG nutzt Monacos Ausrutscher: Paris Saint-Germain - Nantes 4:1 | Highlights | La Liga | DAZN,Goal Deutschland,2017-11-18,142082,3076,79,255,DE,Sports
DY7vA_OuF2o,Huge pile up - Crash - 2017 Macau Grand Prix - FIA GT World Cup,Weber Niraschtoe,2017-11-18,294686,558,15,55,DE,Sports
3o4nRzibDwk,Neymar zu PSG-Transfer gezwungen? Verliert Katar die WM? | KickNews,Kick11,2017-11-18,217537,10296,219,1152,DE,Sports
DZDfuSmb2RM,SV Wehen Wiesbaden gegen Hansa Rostock - 16. Spieltag 17/18 - Nordmagazin,Hansa4Life1965,2017-11-18,4137,94,1,8,DE,Sports
zLfRavNWfS4,Gökhan Neden Stüdyodan Gitti? | O Ses Türkiye,Turkish TV Videos,2017-11-18,98505,411,44,21,DE,Sports
LMqX_93QFCI,MONOPOLY SGD-Edition,SG Dynamo Dresden e.V.,2017-11-18,5953,269,1,0,DE,Sports
Rrq-Kt7TK1A,Stuttgart vs Borussia Dortmund 2-1 Resumen y Goles / All Goals & Highlights | La Liga 17/11/2017,Goals & highlights,2017-11-17,35334,151,18,16,DE,Sports
3UHIvJfznI8,Flat Tire Long Jump Challenge! |Sick Series #32,Fabio Wibmer,2017-11-17,374833,18284,228,911,DE,Sports
X5sJ81nGZuc,LA Clippers vs Cleveland Cavaliers Full Game Highlights / Week 5 / 2017 NBA Season,MLG Highlights,2017-11-18,1962534,9023,509,1878,DE,Sports
qhQF5syZLiA,Modellbahn Spur N / 1:160 - Teil 39 - Module Tür und Tor - Gleise verlegen,Pin Nuckel,2017-11-18,7679,353,6,30,DE,Sports
LDVXOo_HXKU,"Best Survivor Series sole survivors - WWE Top 10, Nov. 18, 2017",WWE,2017-11-18,1188326,25951,1115,2263,DE,Sports
yNFV2x2Jjus,"3. Liga: SVWW überlegen, aber unglücklich gegen Rostock | Sportschau",Sportschau,2017-11-18,3227,77,2,14,DE,Sports
xTa4i8r4Tm8,FT Leicester 0 - 2 Manchester City,Stadium Astro,2017-11-18,128922,557,40,62,DE,Sports
FVxzk7t13HM,Titans vs. Steelers | NFL Week 11 Game Highlights,NFL,2017-11-17,1114865,9570,393,2172,DE,Sports
FclxGY5IV2M,Mega-Transfer? FC Bayern pokert offenbar um Antoine Griezmann | SPORT1,SPORT1,2017-11-16,190034,3247,89,561,DE,Sports
-PH6ATu9VNE,Napoli vs Milan 2-1 All goals & Highlights ampia sintesi ITA HD 18/11/17,FootballEmpireTM,2017-11-18,367026,3470,530,520,DE,Sports
fJ2HVQCMcNM,ThSV Eisenach vs. VfL Eintracht Hagen (2. Handballbundesliga),ThSV Eisenach,2017-11-18,1991,5,0,0,DE,Sports
CAlAtq8Fcxg,"10 GEGENTORE, die Deutschland NIEMALS vergessen wird...",FußballZone,2017-11-18,68020,1768,75,195,DE,Sports
E3inlVuLctc,Ibrahimovic-Comeback und Matchwinner Pogba: Manchester United - Newcastle 4:1 | EPL | DAZN,DAZN Premier League,2017-11-19,435483,7362,235,224,DE,Sports
3A9U4IOl7lw,¡GOL! Brekalo | Stuttgart 2-1 Dortmund,Univision Deportes,2017-11-17,167667,530,50,62,DE,Sports
QXeIakWvDQg,PSG nutzt Monacos Ausrutscher: Paris Saint-Germain - Nantes 4:1 | Highlights | Ligue 1 | DAZN,Goal Deutschland,2017-11-18,295543,4402,119,326,DE,Sports
DY7vA_OuF2o,Huge pile up - Crash - 2017 Macau Grand Prix - FIA GT World Cup,Weber Niraschtoe,2017-11-18,432274,728,22,67,DE,Sports
Rrq-Kt7TK1A,Stuttgart vs Borussia Dortmund 2-1 Resumen y Goles / All Goals & Highlights | La Liga 17/11/2017,Goals & highlights,2017-11-17,51321,206,30,26,DE,Sports
zLfRavNWfS4,Gökhan Neden Stüdyodan Gitti? | O Ses Türkiye,Turkish TV Videos,2017-11-18,271557,954,205,80,DE,Sports
JwJ2lEl63dc,Werder Bremen - Hannover 96 4:0 / Max Kruse mit Tor-Hattrick,BILD FUSSBALL,2017-11-19,40588,1234,48,201,DE,Sports
JLtleQE99FY,ULTIMATE FOOTBALL CHALLENGE vs FC Schalke Pro Footballer,freekickerz,2017-11-19,244496,11053,144,369,DE,Sports
3o4nRzibDwk,Neymar zu PSG-Transfer gezwungen? Verliert Katar die WM? | KickNews,Kick11,2017-11-18,239704,10816,234,1219,DE,Sports
-PH6ATu9VNE,Napoli vs Milan 2-1 All goals & Highlights ampia sintesi ITA HD 18/11/17,FootballEmpireTM,2017-11-18,1031352,5908,1062,891,DE,Sports
pC9dViGfJ2Q,Atletico Madrid vs Real Madrid 0-0 - Extended Match Highlights - La Liga 18/11/2017 HD,GOLAZO TV,2017-11-18,2029829,9322,764,2385,DE,Sports
5ly4eC-U4P4,Resumen de Atlético de Madrid vs Real Madrid (0-0),LaLiga Santander,2017-11-18,400462,2602,288,251,DE,Sports
FIfZbz2F2LA,British Motorcyclist Daniel Hegarty (31) Last Race | Macau Motorcycle Grand Prix | 18/11/2018,Time to Sport,2017-11-18,165131,35,87,19,DE,Sports
miKBXSCb9XA,Darum sind DIESE Faszienrollen so effektiv! | Liebscher & Bracht,Liebscher & Bracht | Die Schmerzspezialisten,2017-11-19,6934,352,20,50,DE,Sports
E3inlVuLctc,Ibrahimovic-Comeback und Matchwinner Pogba: Manchester United - Newcastle 4:1 | EPL | DAZN,DAZN Premier League,2017-11-19,570968,8900,334,297,DE,Sports
hOpaFn2iCeI,Bayern München - FC Augsburg 3:0 / Wahnsinns-Lewandowski-Doppelpack mit neuer Frisur,BILD FUSSBALL,2017-11-19,255168,5115,142,379,DE,Sports
wx-M8sxcOp8,Eagles vs. Cowboys | NFL Week 11 Game Highlights,NFL,2017-11-20,1056220,8709,509,4358,DE,Sports
WBJcaGUREqI,Abwehrfehler stürzen BVB weiter in Krise: Stuttgart - Dortmund 2:1 | Highlights | Bundesliga | DAZN,DAZN Bundesliga,2017-11-19,344097,4651,162,679,DE,Sports
_FQw3o1x4tU,Debakel für Higuain und Co.: Sampdoria Genua - Juventus 3:2 | Highlights | Serie A | DAZN,Goal Deutschland,2017-11-19,189687,3323,62,156,DE,Sports
VJwoSfTOhyM,Water Bottle Flip 2 | Dude Perfect,Dude Perfect,2017-11-20,3914524,218320,3066,19437,DE,Sports
7F0gOlP-XHA,Kusturmalı Boşnak Saksosu Diyen Rasim Ozan Kütahyalı Kör Kütük Sarhoştu,Mim Mehmet Karaman,2017-11-20,284637,376,665,707,DE,Sports
x3wiDgdQENc,"News - DMAA, DMBA in DMHA Booster gefunden, So nutzen Betrüger Youtube aus, uvm.",Gannikus.com,2017-11-19,40962,1291,65,235,DE,Sports
TbyIhYpsUDk,"Fußball-Bundesliga, 12. Spieltag: Active Arnd | ZwWdF",ZwWdF,2017-11-20,4134,90,2,8,DE,Sports
cDJP8sINnt8,Drop Shot auf Barsch - Die Beste Montage für den Herbst! | Fishing-King.de,Fishing-King,2017-11-20,5178,215,4,35,DE,Sports
fnrOXfP6d4Y,"10 kuriose Fußballregeln, die keiner kennt! | TopKickz",Kick11,2017-11-19,156044,7234,161,532,DE,Sports
JLtleQE99FY,ULTIMATE FOOTBALL CHALLENGE vs FC Schalke Pro Footballer,freekickerz,2017-11-19,299587,12684,171,400,DE,Sports
fyokX8xDFwE,Blutiger Kampf! - Michael SMOLIK verteidigt WM Titel gegen Daniel SAM,Michael Smolik,2017-11-20,110386,5115,119,757,DE,Sports
VJwoSfTOhyM,Water Bottle Flip 2 | Dude Perfect,Dude Perfect,2017-11-20,8839267,395070,6146,28049,DE,Sports
5AiPr0rTH8U,Borussia Dortmund - Tottenham Hotspur | Highlights Champions League 2017/18 - 5. Spieltag,Sky Sport HD,2017-11-21,203855,4004,139,0,DE,Sports
tEA_n4mmBok,"Paige returns to WWE alongside Raw newcomers Mandy Rose and Sonya Deville: Raw, Nov. 20, 2017",WWE,2017-11-21,2051979,44906,1642,9802,DE,Sports
WBJcaGUREqI,Abwehrfehler stürzen BVB weiter in Krise: Stuttgart - Dortmund 2:1 | Highlights | Bundesliga | DAZN,DAZN Bundesliga,2017-11-19,387589,4982,189,736,DE,Sports
oW0Mc10WxVM,Neymar flieht in Geheim-Wohnung! Coman-Verletzung wegen neuer Schuhe? | KickNews,Kick11,2017-11-21,216789,9157,145,1073,DE,Sports
hOpaFn2iCeI,Bayern München - FC Augsburg 3:0 / Wahnsinns-Lewandowski-Doppelpack mit neuer Frisur,BILD FUSSBALL,2017-11-19,281863,5415,156,418,DE,Sports
sAVTnc3evdA,14. Spieltag | SGD - FCK | Stimmen zum Spiel,SG Dynamo Dresden e.V.,2017-11-21,6809,77,14,0,DE,Sports
Jts0uiY03iY,Falcons vs. Seahawks | NFL Week 11 Game Highlights,NFL,2017-11-21,998737,8633,440,3270,DE,Sports
E3inlVuLctc,Ibrahimovic-Comeback und Matchwinner Pogba: Manchester United - Newcastle 4:1 | EPL | DAZN,DAZN Premier League,2017-11-19,608478,9188,345,334,DE,Sports
x_X4LPs3t10,Raffaels Traumtor in Berlin - mit Fohlenradio Original-Kommentar,Borussia Mönchengladbach,2017-11-21,7104,387,4,15,DE,Sports
n48TqiD_58s,WWE Monday Night RAW 11/20/2017 Highlights HD - WWE RAW 20 november 2017 Highlights HD,Classy Wrestling,2017-11-21,1425542,12001,1059,848,DE,Sports
T1EcJWBYO-0,WWE RAW 20 November 2017 Highlights HD - WWE Monday Night Raw 20/11/2017 Highlights HD,Wrestling Reality II,2017-11-21,592583,4392,351,294,DE,Sports
7F0gOlP-XHA,Kusturmalı Boşnak Saksosu Diyen Rasim Ozan Kütahyalı Kör Kütük Sarhoştu,Mim Mehmet Karaman,2017-11-20,972744,1972,2600,2100,DE,Sports
_FQw3o1x4tU,Debakel für Higuain und Co.: Sampdoria Genua - Juventus 3:2 | Highlights | Serie A | DAZN,Goal Deutschland,2017-11-19,197389,3394,64,160,DE,Sports
SWOfvy7QfBw,Temperatursturz - Welsansitz im Herbst | www.zeck-fishing.com,Carsten Zeck,2017-11-21,4080,198,7,61,DE,Sports
Os56NamXMdM,PSG muss Stars verkaufen: Draxler und Trapp vor dem Abflug? | SPORT1 -  Der Tag,SPORT1,2017-11-21,72630,1323,27,141,DE,Sports
1LvHX127qRw,Apoel Nicossia vs Real Madrid 0-6 - All Goals & Highlights - 21 November 2017,Iuonak,2017-11-21,230920,696,343,64,DE,Sports
pSv9gjPG0kM,Boston Celtics vs Dallas Mavericks - Full Game Highlights | Nov 20 | 2017-18 NBA Season,NBA Kit,2017-11-21,1060731,3876,232,1327,DE,Sports
KiM2Liqac8w,Draw My Life ♡ BodyKiss,BodyKiss,2017-11-21,26860,3051,33,154,DE,Sports
5AiPr0rTH8U,Borussia Dortmund - Tottenham Hotspur | Highlights Champions League 2017/18 - 5. Spieltag,Sky Sport HD,2017-11-21,711156,9684,376,0,DE,Sports
VJwoSfTOhyM,Water Bottle Flip 2 | Dude Perfect,Dude Perfect,2017-11-20,10552150,438806,7340,30559,DE,Sports
oW0Mc10WxVM,Neymar flieht in Geheim-Wohnung! Coman-Verletzung wegen neuer Schuhe? | KickNews,Kick11,2017-11-21,242541,9807,163,1191,DE,Sports
_VvPxOxnQ5o,Diese 3 Fehler solltest Du beim Faszienrollen unbedingt vermeiden! | Liebscher & Bracht,Liebscher & Bracht | Die Schmerzspezialisten,2017-11-22,18333,754,11,30,DE,Sports
4A6MUDEiBx8,RSC Anderlecht - FC Bayern München 1:2 (0:0) | UEFA Champions League - ZDF,ZDFsport,2017-11-22,59290,902,30,130,DE,Sports
Os56NamXMdM,PSG muss Stars verkaufen: Draxler und Trapp vor dem Abflug? | SPORT1 -  Der Tag,SPORT1,2017-11-21,97014,1518,36,156,DE,Sports
sIryfJ9Mwr4,"Ultras Chemie Leipzig vs. 1.FC Lokomotive Leipzig!! Support, choreo and Pyro!! 22.11.2017",Squeezer Drips,2017-11-22,6175,7,12,0,DE,Sports
aUrhO-yKQ4c,Coach's Corner vom 21.11.2017 (deutsch),Marcinator_2,2017-11-22,2928,85,0,7,DE,Sports
dQS6gpnR6oc,#11 YACHT-Refit Dehlya 25: Neuer Glanz für alte Dehlya,YACHT tv,2017-11-22,2951,40,0,4,DE,Sports
Jts0uiY03iY,Falcons vs. Seahawks | NFL Week 11 Game Highlights,NFL,2017-11-21,1131052,9276,495,3432,DE,Sports
pcjfvFoFTEc,RIESEN-TENNISBALL CHALLENGE (ft. Jugendprofi),GoalKEEPERz,2017-11-22,64780,7114,202,341,DE,Sports
JwJ2lEl63dc,Werder Bremen - Hannover 96 4:0 / 1. Saisonsieg dank Kruse-Hattrick,BILD FUSSBALL,2017-11-19,202081,4079,164,640,DE,Sports
rHyfGnwlBG4,All Star Wahl 2017/18 – Die Nominierten im Tor,DKB Handball-Bundesliga,2017-11-22,2301,36,0,6,DE,Sports
tEA_n4mmBok,"Paige returns to WWE alongside Raw newcomers Mandy Rose and Sonya Deville: Raw, Nov. 20, 2017",WWE,2017-11-21,2399289,48182,1870,10586,DE,Sports
WBJcaGUREqI,Abwehrfehler stürzen BVB weiter in Krise: Stuttgart - Dortmund 2:1 | Highlights | Bundesliga | DAZN,DAZN Bundesliga,2017-11-19,397798,5057,190,622,DE,Sports
dPmjenh_Hwk,1.FC Lok Leipzig - BSG Chemie Leipzig | Pyro & Randale 22.11.2017,ANTI_RB,2017-11-22,14274,50,5,22,DE,Sports
o-wGLyxfYO0,Ausschreitungen überschatten Leipziger Derby | Sport im Osten | MDR,Sport im Osten,2017-11-22,4377,36,5,4,DE,Sports
E3inlVuLctc,Ibrahimovic-Comeback und Matchwinner Pogba: Manchester United - Newcastle 4:1 | EPL | DAZN,DAZN Premier League,2017-11-19,623784,9306,349,334,DE,Sports
CccDURN0Wvo,Paris St. Germain - Celtic Glasgow 7:1 | Highlights Champions League 2017/18 - 5. Spieltag,Sky Sport HD,2017-11-22,724466,12737,452,0,DE,Sports
4A6MUDEiBx8,RSC Anderlecht - FC Bayern München 1:2 (0:0) | UEFA Champions League - ZDF,ZDFsport,2017-11-22,150279,1597,59,297,DE,Sports
VJwoSfTOhyM,Water Bottle Flip 2 | Dude Perfect,Dude Perfect,2017-11-20,11474521,457988,7923,28571,DE,Sports
85iFY84qqWw,Pressekonferenz vor Bayern München,Borussia Mönchengladbach,2017-11-23,6923,209,2,23,DE,Sports
MLG92M_1Lcs,"Sensational save by Ter Stegen, the best goalkeeper this season",All Football TV,2017-11-22,16603,54,2,2,DE,Sports
ag8qz4BhcH0,Özil schon im Winter zu Barça? Gaucho-Talent zum BVB? | TransferKickz,Kick11,2017-11-23,149907,6346,106,938,DE,Sports
pcjfvFoFTEc,RIESEN-TENNISBALL CHALLENGE (ft. Jugendprofi),GoalKEEPERz,2017-11-22,83084,8571,240,367,DE,Sports
ENZYxdKFPn0,"Golden State Warriors vs OKC Thunder - Full Game Highlights | Nov 22, 2017 | 2017-18 NBA Season",Ximo Pierto,2017-11-23,1333050,8602,356,2651,DE,Sports
_VvPxOxnQ5o,Diese 3 Fehler solltest Du beim Faszienrollen unbedingt vermeiden! | Liebscher & Bracht,Liebscher & Bracht | Die Schmerzspezialisten,2017-11-22,34141,980,28,45,DE,Sports
fDGWi4eUjRY,Chargers vs. Cowboys | NFL Week 12 Game Highlights,NFL,2017-11-24,215895,2521,174,2055,DE,Sports
NjU5wIvKMpE,Stöger und Wenger: Die PK nach dem Arsenal-Spiel,GEISSBLOG.KOELN,2017-11-23,2372,75,1,17,DE,Sports
3A-9pU1-040,"1. FC Lokomotive Leipzig 0:0 BSG Chemie Leipzig 22.11.2017 | Chroeos, Pyroshows & Support",Kurven des Ostens,2017-11-23,15824,354,17,0,DE,Sports
W65zSSENRhU,FC Basel - Manchester United 1:0 | Highlights Champions League 2017/18 - 5. Spieltag,Sky Sport HD,2017-11-22,339185,4189,131,0,DE,Sports
AcPXQHhwJOU,Boateng singt überragendes Geburtstagslied | Happy Birthday Franco und Lukas,Eintracht Frankfurt,2017-11-24,4823,184,3,22,DE,Sports
14YSzjwbtm8,Transfers bald auch für Nationalteams? Xavi wünscht sich Goretzka bei Barça! | KickNews,Kick11,2017-11-24,189272,9046,172,1034,DE,Sports
4A6MUDEiBx8,RSC Anderlecht - FC Bayern München 1:2 (0:0) | UEFA Champions League - ZDF,ZDFsport,2017-11-22,155268,1628,61,303,DE,Sports
abgtaIv0YOA,15. Spieltag | F95 - SGD | Pressekonferenz vor dem Spiel,SG Dynamo Dresden e.V.,2017-11-24,3456,64,5,0,DE,Sports
ucGGF_lOpME,ULTIMATE FREE KICK CHALLENGE vs PRO FOOTBALLER,freekickerz,2017-11-24,357103,13664,316,470,DE,Sports
PMmgzt-pquY,Giants vs. Redskins | NFL Week 12 Game Highlights,NFL,2017-11-24,568460,4341,230,1349,DE,Sports
pVvSnIlpY48,Stimmen nach Arsenal,1. FC Köln,2017-11-24,4758,301,3,11,DE,Sports
LuV6gD4ewH4,2017 Abu Dhabi Grand Prix: FP2 Highlights,FORMULA 1,2017-11-24,194962,4936,31,429,DE,Sports
_xras7Nj6-0,KSC-Stimmen nach dem 2:0 Auswärtssieg in Paderborn,Karlsruher SC,2017-11-24,1998,81,0,7,DE,Sports
rVO_kUWVvIA,Interviews nach dem 17. Spieltag,Hansa-TV,2017-11-25,5902,149,4,12,DE,Sports
1xcYehf_exI,PK. Bor. Dortmund - FC Schalke 04 4 : 4,Sport-Live e.V. Dortmund,2017-11-25,40188,239,20,115,DE,Sports
NpilpI1CTtk,Italien doch zur WM? 9 Jahre Knast für Brasilien-Star! | KickNews,Kick11,2017-11-25,220673,10000,223,1125,DE,Sports
VFcQdMCAXbk,Hansa Rostock gegen Fortuna Köln - 17. Spieltag 17/18 - Nordmagazin,Hansa4Life1965,2017-11-25,4127,81,0,6,DE,Sports
KMFuHbwPvks,1. FC Köln - FC Arsenal 1:0 | Highlights Europa League 2017/18 - 5. Spieltag,Sky Sport HD,2017-11-23,584529,10687,209,0,DE,Sports
tm4Tm0OAl-c,Manuel Charr vs Alexander Ustinov 2017-11-25,Boxing Pride,2017-11-25,21889,117,39,167,DE,Sports
ucGGF_lOpME,ULTIMATE FREE KICK CHALLENGE vs PRO FOOTBALLER,freekickerz,2017-11-24,473601,15925,374,536,DE,Sports
ts7YmLdSwmM,Manchester United vs Brighton 1-0 - All Goals & Highlights 25/11/2017 HD,Fazzer,2017-11-25,271212,843,112,71,DE,Sports
aO2Bth4t3Pc,Dortmund vs Schalke 4-4  - Goretzka und Fährmann im Interview über Rudelbildung nach Abpfiff!,Sport Time,2017-11-25,4610,26,3,6,DE,Sports
-LlK9GB5RFo,Pitch Invaders After Borussia Dortmund 4-4 Schalke Match | 25/11/2017,Time to Sport,2017-11-25,8089,15,14,1,DE,Sports
E8DwUwldHbg,Pressekonferenz 1. FC Magdeburg gegen Hallescher FC 2:1 (2:0),1. FC Magdeburg,2017-11-25,2084,27,2,5,DE,Sports
fvv4Qa8tk2A,Puh! Cristiano Ronaldo vs. Malaga-Keeper: Real Madrid - Malaga 3:2 | Highlights | La Liga | DAZN,Goal Deutschland,2017-11-25,187850,4661,125,489,DE,Sports
CnRsGKxP0QA,CHE vs LIV 1-1 All goals & Highlights English Commentary (25/11/2017) HD/1080P,NIXBLACK,2017-11-25,365628,2008,110,198,DE,Sports
WnUMWbNUFLI,مباراة الهلال واوراوا ريد دياموندز | موقع تابع كورة,Admin,2017-11-25,1112221,5324,2047,242,DE,Sports
sPQ-7mdeuHY,Real Madrid vs Malaga 3-2 - All Goals & Extended Highlights - La Liga 25/11/2017 HD,GOLAZO TV,2017-11-25,1407953,7654,959,1381,DE,Sports
l9JMLFeHf4Y,2017 Abu Dhabi Grand Prix: Qualifying Highlights,FORMULA 1,2017-11-25,275216,5640,65,632,DE,Sports
XFuQDqp5HLg,Galatasaray 2-0 A .Alanyaspor Maç Özeti,Ackean,2017-11-25,370176,1740,220,693,DE,Sports
3fI_Um3DMa4,Dortmund vs Schalke 4:4 - Tedesco überglücklich im Interview nach Mega-Aufholjagd!,Best Of Sport,2017-11-25,20196,172,7,43,DE,Sports
tCYd6cmijeg,21.Spieltag: Interviews (SV Elversberg - SV Waldhof),SV Waldhof Mannheim 07,2017-11-25,1708,34,0,7,DE,Sports
UkaeCV2uuyM,ملخص مباراة ريال مدريد وملقا 3-2 - مباراة مجنونة جدا - الدورى الاسبانى,Mr.Assist,2017-11-25,1466983,13614,1243,1359,DE,Sports
73aPg4iK010,Niki Lauda hört bei RTL auf,danielO,2017-11-26,62345,594,11,113,DE,Sports
1xcYehf_exI,PK. Bor. Dortmund - FC Schalke 04 4 : 4,Sport-Live e.V. Dortmund,2017-11-25,120924,737,54,236,DE,Sports
M73qRw35gBA,"Borussia Dortmund vs. Schalke 04, 94. Minute Naldo 4:4 live im Stadion !!!",hamude83,2017-11-26,54593,730,67,58,DE,Sports
fvv4Qa8tk2A,Puh! Cristiano Ronaldo vs. Malaga-Keeper: Real Madrid - Malaga 3:2 | Highlights | La Liga | DAZN,Goal Deutschland,2017-11-25,421634,7367,184,776,DE,Sports
TcLwpKacUag,مشاهدة مباراة برشلونة وفالنسيا بث مباشر بتاريخ 26-11-2017 الدوري الاسباني,MohamdAssi Tv,2017-11-26,604821,5937,454,2,DE,Sports
ElpbKUccCxA,50€ vs 10.000.000€ Goalkeeper Battle - Youtuber vs Pro,freekickerz,2017-11-26,540042,17299,577,1102,DE,Sports
tm4Tm0OAl-c,Manuel Charr vs Alexander Ustinov 2017-11-25,Boxing Pride,2017-11-25,90828,272,124,461,DE,Sports
n0PhX4qIZK4,BVB S04 25.11.17 Derby ABPFIFF RANGELEI UND VERABSCHIEDUNG AUSSCHREITUNGEN,Syncro24,2017-11-25,105286,231,127,306,DE,Sports
7-TImQPBn5U,PRESSEKONFERENZ NACH DEM KAMPF MANUEL CHARR VS ALEXANDER USTINOV,FightingNow,2017-11-26,9206,44,8,14,DE,Sports
0ck_2IFsLAI,Nach Derby-Wahnsinn: BVB-Boss Watzke schießt gegen Schalke | SPORT1,SPORT1,2017-11-26,22958,372,268,165,DE,Sports
v_HJ9uUGBkQ,Borussia Dortmund - FC Schalke 04 4:4 / Naldos Tor in der Nachspielzeit krönt Schalkes Aufholjagd,BILD FUSSBALL,2017-11-26,91259,4331,94,506,DE,Sports
2BOb7ZHUaCs,Fährmann: Wir werden uns immer an dieses Spiel erinnern | das aktuelle sportstudio - ZDF,ZDFsport,2017-11-26,43709,563,25,113,DE,Sports
aHf3-BdeU7o,Das 4:4  BVB vs. SCHALKE 04 aus Block 45,MrEdelsachse,2017-11-25,40196,274,13,38,DE,Sports
mZkG70m6Wx4,"M. Charr vs A. Ustinov 🥊Boxing Heavyweight Championship Fight (WBA) 🥊 Full Fight--Nov 25, 2017",Lady US Sports,2017-11-25,40607,127,31,86,DE,Sports
lY0ckUBVerA,4:4 im Revier-Derby - So feierte der Schalker Anhang in Dortmund,Tobias Weckenbrock,2017-11-25,94152,514,75,60,DE,Sports
BXREg5yPf9A,2017 Abu Dhabi Grand Prix | Race Highlights,FORMULA 1,2017-11-26,379554,7925,213,1136,DE,Sports
9GtTTpzhryc,Rautenperle.TV: Pressekonferenz nach dem 3:0-Sieg gegen Hoffenheim,Marcus Scholz,2017-11-26,3548,68,2,12,DE,Sports
PKwCawXl6Yk,Young rettet Red Devils: Manchester United - Brighton 1:0 | Highlights | Premier League | DAZN,DAZN Premier League,2017-11-26,126982,2419,39,85,DE,Sports
bFpRkIEguRw,SKY REPORTER VOR ORT IN DORTMUND NACH SCHALKE SPIEL,Football,2017-11-26,5067,22,0,2,DE,Sports
akYvT8v66LM,Watzke zur BVB-Krise: Müssen alles auf den Prüfstand stellen,SID,2017-11-26,2588,13,6,3,DE,Sports
w8XrSVAMJ1o,Hansa Rostock gegen Fortuna Köln - 17. Spieltag 17/18 - Tore,Hansa4Life1965,2017-11-25,28642,388,6,50,DE,Sports
v_HJ9uUGBkQ,Borussia Dortmund - FC Schalke 04 4:4 / Naldo der Derby-König! Hinrunden-Aus für Götze,BILD FUSSBALL,2017-11-26,422639,12273,348,1188,DE,Sports
M73qRw35gBA,"Borussia Dortmund vs. Schalke 04, 94. Minute Naldo 4:4 live im Stadion !!!",hamude83,2017-11-26,133315,2501,286,193,DE,Sports
QzfnWcHhdyQ,Packers vs. Steelers | NFL Week 12 Game Highlights,NFL,2017-11-27,1172709,11033,958,3510,DE,Sports
1xcYehf_exI,PK. Bor. Dortmund - FC Schalke 04 4 : 4,Sport-Live e.V. Dortmund,2017-11-25,145915,882,64,290,DE,Sports
fvv4Qa8tk2A,Puh! Cristiano Ronaldo vs. Malaga-Keeper: Real Madrid - Malaga 3:2 | Highlights | La Liga | DAZN,Goal Deutschland,2017-11-25,471282,7779,207,811,DE,Sports
ElpbKUccCxA,50€ vs 10.000.000€ Goalkeeper Battle - Youtuber vs Pro,freekickerz,2017-11-26,666950,19978,755,1277,DE,Sports
n0PhX4qIZK4,BVB S04 25.11.17 Derby ABPFIFF RANGELEI UND VERABSCHIEDUNG AUSSCHREITUNGEN,Syncro24,2017-11-25,133149,319,206,377,DE,Sports
tm4Tm0OAl-c,Manuel Charr vs Alexander Ustinov 2017-11-25,Boxing Pride,2017-11-25,115002,324,158,558,DE,Sports
S4iT_CS6wFc,Willian klaut Klopp drei Punkte: FC Liverpool - FC Chelsea 1:1 | Highlights | Premier League | DAZN,DAZN Premier League,2017-11-26,347039,3992,63,193,DE,Sports
trfSIOp3EcQ,2017 Abu Dhabi Grand Prix | Best Of Team Radio,FORMULA 1,2017-11-27,265149,8424,52,800,DE,Sports
rl7xh0V_4dU,"Fußball-Bundesliga, 13. Spieltag: Videoschiedsrichter Kölner Kellern | ZwWdF",ZwWdF,2017-11-27,5347,95,2,12,DE,Sports
Kd1xVG6f2No,Michael Crabtree vs. Aqib Talib Fight | Broncos vs. Raiders | NFL,Highlight Heaven,2017-11-26,1394388,5813,419,2948,DE,Sports
2BOb7ZHUaCs,Fährmann: Wir werden uns immer an dieses Spiel erinnern | das aktuelle sportstudio - ZDF,ZDFsport,2017-11-26,56312,664,28,158,DE,Sports
Tx5bQSfv_1Y,Keita und Bernardo ärgern SVW: RB Leipzig - SV Werder Bremen 2:0 | Highlights | Bundesliga | DAZN,DAZN Bundesliga,2017-11-26,61096,501,24,51,DE,Sports
TcLwpKacUag,مشاهدة مباراة برشلونة وفالنسيا بث مباشر بتاريخ 26-11-2017 الدوري الاسباني,MohamdAssi Tv,2017-11-26,617879,6011,481,15,DE,Sports
dRh3ANe4kjQ,Hüftbeuger mobilisieren - Diese Übung kann sofort helfen! | Liebscher & Bracht,Liebscher & Bracht | Die Schmerzspezialisten,2017-11-27,10511,771,5,32,DE,Sports
mZkG70m6Wx4,"M. Charr vs A. Ustinov 🥊Boxing Heavyweight Championship Fight (WBA) 🥊 Full Fight--Nov 25, 2017",Lady US Sports,2017-11-25,52394,150,45,125,DE,Sports
lY0ckUBVerA,4:4 im Revier-Derby - So feierte der Schalker Anhang in Dortmund,Tobias Weckenbrock,2017-11-25,122212,642,90,76,DE,Sports
aHf3-BdeU7o,Das 4:4  BVB vs. SCHALKE 04 aus Block 45,MrEdelsachse,2017-11-25,69101,416,22,81,DE,Sports
tuHSAz63R14,Live Bisse Barsche und Zander Schlag auf Schlag mit der Ultra Light/Texas Carolina Rute,John Chowns,2017-11-27,5285,142,17,62,DE,Sports
TX5kkcNlVjo,Borussen auf Fanclubbesuch,Borussia Mönchengladbach,2017-11-27,4059,248,2,11,DE,Sports
v_HJ9uUGBkQ,Borussia Dortmund - FC Schalke 04 4:4 / Naldo der Derby-König! Hinrunden-Aus für Götze,BILD FUSSBALL,2017-11-26,516206,14005,435,1328,DE,Sports
p2tpMtUMc7A,Heynckes-Serie reißt: Borussia M'gladbach - FC Bayern München 2:1 | Highlights | Bundesliga | DAZN,DAZN Bundesliga,2017-11-26,299613,3334,125,491,DE,Sports
M73qRw35gBA,"Borussia Dortmund vs. Schalke 04, 94. Minute Naldo 4:4 live im Stadion !!!",hamude83,2017-11-26,173500,3472,416,261,DE,Sports
r9onnlQumdI,LederBROsen  - Danny MacAskill and Martin Söderström do Germany,Continental Bicycle Tyres,2017-11-28,11593,500,5,19,DE,Sports
QzfnWcHhdyQ,Packers vs. Steelers | NFL Week 12 Game Highlights,NFL,2017-11-27,1332547,11898,1033,3678,DE,Sports
6Yheq6fVUqA,ملخص مباراة ريال مدريد وفوينلابرادا 2-2 - مباراة مجنونة جدا - كأس ملك اسبانيا,Mr.Assist,2017-11-28,947658,8613,1326,950,DE,Sports
yXCWyMg8vvQ,Jordi Alba rettet Punkt gegen Ex-Klub: Valencia CF - FC Barcelona 1:1 | Highlights | La Liga | DAZN,Goal Deutschland,2017-11-27,217618,3180,60,317,DE,Sports
1xcYehf_exI,PK. Bor. Dortmund - FC Schalke 04 4 : 4,Sport-Live e.V. Dortmund,2017-11-25,155800,944,70,306,DE,Sports
YL9sNrOlK-I,2 wingsuit flyers BASE jump into a plane in mid-air. | A Door In The Sky,Red Bull,2017-11-28,528664,9387,140,727,DE,Sports
YL9sNrOlK-I,2 wingsuit flyers BASE jump into a plane in mid-air. | A Door In The Sky,Red Bull,2017-11-28,1699436,20220,348,1314,DE,Sports
v_HJ9uUGBkQ,Borussia Dortmund - FC Schalke 04 4:4 / Naldo der Derby-König! Hinrunden-Aus für Götze,BILD FUSSBALL,2017-11-26,555536,14492,462,1349,DE,Sports
Wp4Z2CAFIE8,FT Arsenal 5 - 0 Huddersfield,Stadium Astro,2017-11-29,579931,2928,128,360,DE,Sports
p2tpMtUMc7A,Heynckes-Serie reißt: Borussia M'gladbach - FC Bayern München 2:1 | Highlights | Bundesliga | DAZN,DAZN Bundesliga,2017-11-26,326916,3624,133,548,DE,Sports
hPsTmJ3Eqho,#16 FC St. Pauli: Anlauf mit Fabian Klos,DSC Arminia Bielefeld,2017-11-29,2339,91,1,11,DE,Sports
157aM8tTqBI,Torspektakel bei United-Sieg: Watford - Manchester United 2:4 | Highlights |  Premier League | DAZN,DAZN Premier League,2017-11-29,177585,3598,55,156,DE,Sports
Dk2aUwGCvQY,Bale-Rückkehr einziger Lichtblick: Real Madrid - Fuenlabrada 2:2 | Highlights | Copa Del Rey | DAZN,Goal Deutschland,2017-11-29,214202,5140,91,607,DE,Sports
cdocFpKRxiQ,"Randy Orton vs. Kevin Owens - No Disqualification Match: SmackDown LIVE, Nov. 28, 2017",WWE,2017-11-29,1197546,19983,2501,2066,DE,Sports
eBwu6Y6RRaU,Guido Burgstaller: Ein geiles Gefühl!,FC Schalke 04,2017-11-29,6788,438,2,34,DE,Sports
6Yheq6fVUqA,ملخص مباراة ريال مدريد وفوينلابرادا 2-2 - تألق بيل - كأس ملك اسبانيا,Mr.Assist,2017-11-28,2357074,18883,2533,1594,DE,Sports
-Vq7RDB0N0U,DEL2 Highlights 21. Spieltag | Kassel Huskies vs. Bietigheim Steelers,SpradeTV,2017-11-29,2109,32,0,0,DE,Sports
M73qRw35gBA,"Borussia Dortmund vs. Schalke 04, 94. Minute Naldo 4:4 live im Stadion !!!",hamude83,2017-11-26,186172,3661,433,368,DE,Sports
NiZGtSHNB1c,Neymar macht Real Madrid Hoffnung | SPORT1 TRANSFERMARKT,SPORT1,2017-11-29,84451,1694,73,180,DE,Sports
O5vTZ30bsfc,galatasaray 5 -1 sivas belediyespor,CUMHUR ÇETİN,2017-11-28,452675,1259,244,351,DE,Sports
MqsZG_Ssi8A,Die Stöger-Pressekonferenz vor Schalke in voller Länge,GEISSBLOG.KOELN,2017-11-30,6641,81,8,23,DE,Sports
157aM8tTqBI,Torspektakel bei United-Sieg: Watford - Manchester United 2:4 | Highlights |  Premier League | DAZN,DAZN Premier League,2017-11-29,226705,4084,60,164,DE,Sports
YL9sNrOlK-I,2 wingsuit flyers BASE jump into a plane in mid-air. | A Door In The Sky,Red Bull,2017-11-28,2432670,25499,471,1749,DE,Sports
nH5vsRVWOTA,Paris St. Germain -  ES Troyes 2:0 / Neymar und Cavani treffen - Trapp wieder im Tor,BILD FUSSBALL,2017-11-30,167395,3936,51,209,DE,Sports
Dk2aUwGCvQY,Bale-Rückkehr einziger Lichtblick: Real Madrid - Fuenlabrada 2:2 | Highlights | Copa Del Rey | DAZN,Goal Deutschland,2017-11-29,289724,6044,113,692,DE,Sports
ZnJzlC980IA,Renato Sanches terrible pass vs Chelsea 11/29/2017,Shum Ball,2017-11-30,42682,77,5,12,DE,Sports
MKwsBx0o-2s,PK vor dem 18. Spieltag | Auswärtsspiel Hallescher FC,Hansa-TV,2017-11-30,3267,78,0,8,DE,Sports
yf0UKVPlg0M,Die Spieltags-PK vor dem Bremen-Spiel,VfB Stuttgart,2017-11-30,4664,141,3,19,DE,Sports
NiZGtSHNB1c,Neymar macht Real Madrid Hoffnung | SPORT1 TRANSFERMARKT,SPORT1,2017-11-29,111198,2008,91,216,DE,Sports
Em9EI37Yy9g,Redskins vs. Cowboys | NFL Week 13 Game Highlights,NFL,2017-12-01,928939,8872,505,2803,DE,Sports
tvkK4LJmtTY,Pressekonferenz vor Wolfsburg,Borussia Mönchengladbach,2017-12-01,6259,175,2,23,DE,Sports
hUqbwLwq4yg,16. Spieltag | SGD - AUE | Pressekonferenz vor dem Spiel,SG Dynamo Dresden e.V.,2017-12-01,3689,94,4,0,DE,Sports
_IZFSyxeOlw,Mesut Özil & Co. mit Spielfreude: Arsenal vs. Huddersfield 5:0 | Highlights | Premier League | DAZN,DAZN Premier League,2017-11-30,222414,3939,51,210,DE,Sports
XGSQ6roro0U,ASV Hamm-Westfalen gg. TUSEM Essen,ASV Hamm-Westfalen,2017-12-01,2273,22,0,0,DE,Sports
l_2YPwgSV_4,So kannst Du Deine Ischias-Schmerzen schnell loswerden! | Liebscher & Bracht,Liebscher & Bracht | Die Schmerzspezialisten,2017-12-01,8061,522,4,21,DE,Sports
0MJVCnEWKlc,شاهد قرعة كأس العالم روسيا 2018 ومصر تقع مع السعودية في مجموعة متوسطة (شاشة كاملة),Mahmoud Sobhy,2017-12-01,607859,3300,358,1072,DE,Sports
ev8cBPXnl18,"Your favourite roommate? | One more question, Roman Weidenfeller! | BVB",Borussia Dortmund,2017-12-01,4485,247,1,14,DE,Sports
xziYfKLIilU,Beşiktaş 3-0 Galatasaray Maç Özeti HD,BK SPORTS HD,2017-12-02,216281,734,543,615,DE,Sports
JBLFiPs7SMs,Beşiktaş 3-0 Galatasaray Maç Özeti  (02.12.2017),ÖZET TV,2017-12-02,263202,1226,251,446,DE,Sports
zyUHrM5AojM,Beşiktaş 3-0 Galatasaray Maç Özeti,Ackean,2017-12-02,684237,4971,706,1460,DE,Sports
SNBEEuO8510,ملخص مباراه لـ يفـ ربـ ول وبـ رايـ تـ ون 5-1 - تألق مـ حـ مد صـ لاح - الدوري الانجليزي,extra goal,2017-12-02,831290,6073,563,219,DE,Sports
yJcBzwE1D-4,Interviews nach dem 18. Spieltag | Auswärtsspiel Hallescher FC,Hansa-TV,2017-12-02,5057,107,1,10,DE,Sports
FjE9nhK0HgQ,Schalke vs Köln 2:2 - Stöger zufrieden im Interview nach dem Spiel!,Best Of Sport,2017-12-02,5337,50,2,7,DE,Sports
_IZFSyxeOlw,Mesut Özil & Co. mit Spielfreude: Arsenal vs. Huddersfield 5:0 | Highlights | Premier League | DAZN,DAZN Premier League,2017-11-30,256352,4249,57,229,DE,Sports
t6GS1iIk4lY,DESTROYED by PRO FOOTBALLER (US National Team),freekickerz,2017-12-01,442011,25866,323,7234,DE,Sports
UUmzDvABENY,"Hallescher FC 0:2 FC Hansa Rostock 01.12.2017 | Choreos, Pyroshows & Support",Kurven des Ostens,2017-12-01,40782,555,22,0,DE,Sports
tJELPsUhiQ8,Stephen Colbert monologue 12/1/17 : Coffee Joe Calls Trump Cuckoo !,Federica Balsamo,2017-12-02,194896,948,141,218,DE,Sports
HuP8hzmM-44,Magdeburg siegt auch in Chemnitz | Sport im Osten | MDR,Sport im Osten,2017-12-02,3153,34,6,5,DE,Sports
yCEj7uSCRyc,ThSV Eisenach vs. Dessau-Rosslauer HV 06 (2. Handballbundesliga),ThSV Eisenach,2017-12-02,1570,7,3,0,DE,Sports
Em9EI37Yy9g,Redskins vs. Cowboys | NFL Week 13 Game Highlights,NFL,2017-12-01,1128180,9876,621,2856,DE,Sports
UzmIJvdELdg,ملخص مباراة برشلونة وسيلتا فيجو 2-2 - مباراة مجنونة جدا - الدورى الاسبانى,Mr.Assist,2017-12-02,1662747,15278,1250,645,DE,Sports
wD0ELkvFams,Rasante Achterbahnfahrt zwischen Arsenal und Manchester United | Highlights | Premier League | DAZN,DAZN Premier League,2017-12-03,379928,6552,123,393,DE,Sports
1vSfs8SJ-dM,[IMPRESSIONEN] Wir ziehen um - die ersten Eindrücke | Cubilox Vlogs,Cubilox Vlogs,2017-12-03,13030,929,3,58,DE,Sports
iLwG0PltZBM,Benevento Milan 2-2 highlights Sky Sport HD 3/12/2017,Football Sintesi,2017-12-03,1459270,8669,549,1045,DE,Sports
dbROCwEHwxA,Die PK zum Stöger-Aus mit Spinner und Wehrle in voller Länge,GEISSBLOG.KOELN,2017-12-03,7000,41,95,43,DE,Sports
qBem8DO4jss,03.12.2107 die letzte Uffta vom Capo Lehmi! Dynamo gegen Wismut Aue 4:0,myDresden,2017-12-03,20184,316,18,20,DE,Sports
CCqPQVN_gUA,Beşiktaş 3 0 Galatasaray All goals & Highlights l French commentary l  FULL HD,MASTER HDTV,2017-12-02,249579,1006,154,569,DE,Sports
T_UFrzbGQrU,Karol ist NICHT der BESTE Torwart auf YouTube?!,GoalKEEPERz,2017-12-02,109502,10478,163,3231,DE,Sports
4wCxyYW4Uys,Streets Of Rage! 2017 HKT Hong Kong E-Prix Sunday Race Highlights - Formula E,FIA Formula E Championship,2017-12-03,26830,673,36,199,DE,Sports
8y5OlHzhwFc,⚡UFC 218 Alistar Overeem vs Francis Ngannou - 🔥Brutal Knockout.Don't  Blink,King of Metal,2017-12-03,826676,3710,191,2507,DE,Sports
1HyejfqFDpY,Celta Vigo und Schiri vermiesen Sieg: FC Barcelona - Celta Vigo 2:2 | Highlights | La Liga | DAZN,Goal Deutschland,2017-12-02,78623,1411,28,195,DE,Sports
KSkyxpieUI0,Alistair Overeem vs Francis Ngannou - FULL FIGHT Highlights - UFC 218 - KNOCKOUT,BLACK TIGER,2017-12-03,534912,1250,139,1084,DE,Sports
HJs0TMCWFVM,Racing Straßburg - Paris Saint-Germain 2:1 / PSG mit der ersten Saison-Pleite gegen den Aufsteiger,BILD FUSSBALL,2017-12-02,205926,5458,84,453,DE,Sports
xl3HhY2BTuU,Eagles vs. Seahawks | NFL Week 13 Game Highlights,NFL,2017-12-04,1270477,12058,620,6865,DE,Sports
AEV4RWb-yQE,TSG 1899 Hoffenheim - RB Leipzig 4:0 / Hammer 45-Meter-Tor von Gnabry,BILD FUSSBALL,2017-12-03,249221,5064,122,445,DE,Sports
UzyHsIHdjuw,16. Spieltag | SGD - AUE | Stimmen zum Spiel,SG Dynamo Dresden e.V.,2017-12-04,13501,262,10,0,DE,Sports
5lZVxmTc8HI,Reds rocken Aufsteiger: Brighton & Hove Albion - FC Liverpool | Highlights | Premier League | DAZN,DAZN Premier League,2017-12-03,246300,3189,42,98,DE,Sports
RygKC-aZlbI,"Capo Lehmi - „wenn wir zusammenhalten, können wir alles erreichen! Dynamo Dresden vs. Wismut Aue 4:0",myDresden,2017-12-04,7357,117,2,10,DE,Sports
_vWVTi_YtJY,Fußball Challenge GEGEN FREUNDIN ⚽ ❤ | (+Gewinnspiel 🎁),GoalKEEPERz,2017-12-03,69319,6666,103,2025,DE,Sports
NKphAVQRW_g,"Fußball Bundesliga, 14. Spieltag: Bye, bye, Peter Stöger! | ZwWdF",ZwWdF,2017-12-04,5658,74,1,19,DE,Sports
_8f4fsZ34tM,Die Form wird noch KRASSER - Mr. Universe! #Oldschooldiet VLOG 17.1,Johannes Luckas - Personal Training,2017-12-04,26481,2448,25,257,DE,Sports
UeUECPyoZsk,BAYERN (LEWANDOWSKI) vs DORTMUND (AUBAMEYANG) CHALLENGE | BROTATOS,STRIKERS,2017-12-03,38724,1722,86,1185,DE,Sports
VmJk2XlEoDY,Das sagt Stefan Ruthenbeck zu seiner neuen Aufgabe,GEISSBLOG.KOELN,2017-12-04,3306,112,3,11,DE,Sports
NABWLviueQQ,Steffen Mengel completely freaks out after losing a Match,ttlondon2012,2017-12-04,9436,133,6,48,DE,Sports
zOAztzPKBkw,FC Bayern München - Paris St. Germain | Highlights Champions League 2017/18 - 6. Spieltag,Sky Sport HD,2017-12-05,207920,7323,169,0,DE,Sports
y6AN6Ijzox0,Bayern Munchen vs PSG 3-1 - All Goals & Highlights 5/12/2017,Iuonak,2017-12-05,446737,1271,947,232,DE,Sports
z1FfOwjlqxU,Steelers vs. Bengals | NFL Week 13 Game Highlights,NFL,2017-12-05,993435,7388,919,3187,DE,Sports
-RmUADCWI4A,All Sports Golf Battle 2 | Dude Perfect,Dude Perfect,2017-12-04,8643326,299732,5168,23303,DE,Sports
AEV4RWb-yQE,TSG 1899 Hoffenheim - RB Leipzig 4:0 / Hammer 45-Meter-Tor von Gnabry,BILD FUSSBALL,2017-12-03,310423,5982,153,620,DE,Sports
FXNpeuDRiFc,CSKA vs MNU 1-2 All goals & Highlights English Commentary (05/12/2017) HD/1080P,NIXBLACK,2017-12-05,907518,2412,233,172,DE,Sports
j2Ho01bNJ4Y,Bayern de Munique 3 x 1 PSG - Melhores Momentos e Gols - Liga dos Campeões 05-12-2017,BDV Football,2017-12-05,462096,4835,270,1360,DE,Sports
KVJLID7awYM,"Braun Strowman dismantles Elias: Raw, Dec. 4, 2017",WWE,2017-12-05,1209323,16993,621,1523,DE,Sports
HjtYoh3lX_4,Halbangst 5 - Achterbahn (Wenn alle Träume Wahrheit wären),Otto Preetz,2017-12-05,3656,79,2,4,DE,Sports
-Dj1_JNoGvE,Fußball Challenge gegen HSV TORWART (ft.  Christian Mathenia),GoalKEEPERz,2017-12-04,73849,5305,109,481,DE,Sports
_8f4fsZ34tM,Die Form wird noch KRASSER - Mr. Universe! #Oldschooldiet VLOG 17.1,Johannes Luckas - Personal Training,2017-12-04,50534,3252,50,338,DE,Sports
kCMzQYmGWqA,Boateng sichert Auswärtssieg: Hertha BSC - Eintracht Frankfurt 1:2 | Highlights | Bundesliga | DAZN,DAZN Bundesliga,2017-12-03,164156,2386,55,98,DE,Sports
1QojkpvStGw,Vertikal auf Wels mit kleinem Schlauchboot | www.zeck-fishing.com,Carsten Zeck,2017-12-05,4449,175,6,54,DE,Sports
UeUECPyoZsk,BAYERN (LEWANDOWSKI) vs DORTMUND (AUBAMEYANG) CHALLENGE | BROTATOS,STRIKERS,2017-12-03,47439,2025,102,1435,DE,Sports
5lZVxmTc8HI,Reds rocken Aufsteiger: Brighton & Hove Albion - FC Liverpool | Highlights | Premier League | DAZN,DAZN Premier League,2017-12-03,265295,3329,44,100,DE,Sports
fOfIObhGMe0,JuJu Smith-Schuster Vicious Block on Vontaze Burfict | Steelers vs. Bengals | NFL,Highlight Heaven,2017-12-05,699479,4026,171,3975,DE,Sports
zOAztzPKBkw,FC Bayern München - Paris St. Germain | Highlights Champions League 2017/18 - 6. Spieltag,Sky Sport HD,2017-12-05,1004605,19690,504,0,DE,Sports
z1FfOwjlqxU,Steelers vs. Bengals | NFL Week 13 Game Highlights,NFL,2017-12-05,1188917,8303,1079,3363,DE,Sports
-RmUADCWI4A,All Sports Golf Battle 2 | Dude Perfect,Dude Perfect,2017-12-04,9828746,316976,5797,23221,DE,Sports
vAUOVBhh0SY,"Randy Orton vs. Sami Zayn: SmackDown LIVE, Dec. 5, 2017",WWE,2017-12-06,1083393,19158,754,1309,DE,Sports
AEV4RWb-yQE,TSG 1899 Hoffenheim - RB Leipzig 4:0 / Hammer 45-Meter-Tor von Gnabry,BILD FUSSBALL,2017-12-03,329803,6211,165,600,DE,Sports
nOb02uCJXPc,SICK INDOOR MTB SESSION mit FABIO WIBMER & ELIAS SCHWÄRZLER im RadQuartier,Lukas Knopf,2017-12-05,50133,4015,21,1356,DE,Sports
PmjZVxC40Nw,Vettel And Ricciardo Go Wheel-To-Wheel | F1 Best Overtakes of 2017,FORMULA 1,2017-12-06,32615,647,8,44,DE,Sports
XBAEO5yZYlY,Die Spieltags-PK vor dem Leverkusen-Spiel,VfB Stuttgart,2017-12-06,3586,118,3,10,DE,Sports
saTBXHWMsQw,Coach's Corner vom 05.12.2017 (deustch),Marcinator_2,2017-12-06,4882,69,2,24,DE,Sports
YJMobGCV1gs,Fußball Challenge gegen SCHALKE PROFI im STADION (ft. EMBOLO),GoalKEEPERz,2017-12-05,59662,7367,59,1857,DE,Sports
DvD3kHJYa-M,Stephen Colbert monologue 12/5/17 : A Whole Lotta Moore,Federica Balsamo,2017-12-06,177236,801,49,221,DE,Sports
Kxj31BTukIY,Real Madrid - Borussia Dortmund 3:2 | Highlights Champions League 2017/18 - 6. Spieltag,Sky Sport HD,2017-12-06,873991,13968,394,0,DE,Sports
b6XHlowAFq8,RB Leipzig - Besiktas Istanbul 1:2 (0:1) | UEFA Champions League - ZDF,ZDFsport,2017-12-06,100211,910,45,607,DE,Sports
36YWdoe0DTY,Pressekonferenz vor Schalke,Borussia Mönchengladbach,2017-12-07,7055,147,12,50,DE,Sports
UKka73nn1dk,GraceFitUk Vs Nile Wilson **Celebrity Gymnastics**,Nile Wilson,2017-12-07,154513,7499,82,432,DE,Sports
OcVUOVIHzeQ,"Vertikalsession mit Zander, Barsch und Hecht | Raubfisch Grand Slam | www.zeck-fishing.com",Carsten Zeck,2017-12-07,5129,216,9,48,DE,Sports
D65ldsDltA8,Pantomime w/ Robert Lewandowski | FC Bayern Xmas Advent Calendar #7,FC Bayern München,2017-12-07,12892,631,6,103,DE,Sports
Kxj31BTukIY,Real Madrid - Borussia Dortmund 3:2 | Highlights Champions League 2017/18 - 6. Spieltag,Sky Sport HD,2017-12-06,1049356,15475,476,0,DE,Sports
DV9Zlql87mk,17. Spieltag | FCU - SGD | Pressekonferenz vor dem Spiel,SG Dynamo Dresden e.V.,2017-12-08,4891,108,2,0,DE,Sports
-gt1BZUCqsA,Saints vs. Falcons | NFL Week 14 Game Highlights,NFL,2017-12-08,960816,8639,512,4428,DE,Sports
So2n2tSn2Gc,Delija pokušao da otme zastavu navijačima Kelna,Butasport.rs,2017-12-07,81398,162,28,75,DE,Sports
UKka73nn1dk,GraceFitUk Vs Nile Wilson **Celebrity Gymnastics**,Nile Wilson,2017-12-07,254170,9568,166,526,DE,Sports
hONq-41k0Og,Serayah Cuts the Beat & Goes In On Nick Cannon | Wild 'N Out | #Wildstyle,MTV,2017-12-08,795899,17046,221,572,DE,Sports
b6XHlowAFq8,RB Leipzig - Besiktas Istanbul 1:2 (0:1) | UEFA Champions League - ZDF,ZDFsport,2017-12-06,106563,947,49,667,DE,Sports
pv2LG9XORVo,Der BVB-Song,WUMMS,2017-12-08,40507,2063,292,214,DE,Sports
AAZyiRSkkM4,BVB-Star Aubameyang wird nach England gelockt | SPORT1 TRANSFERMARKT,SPORT1,2017-12-08,81644,1775,56,201,DE,Sports
PA7esHd2kXk,Pantomime w/ Manuel Neuer | FC Bayern Xmas Advent Calendar #8,FC Bayern München,2017-12-08,11555,535,7,88,DE,Sports
ofP1qrb-xIM,ملخص مباراه ريال مدريد واشبيلية 5-0 - ثنائية المدمر رونالدو جنون رؤوف خليف - الدوري الاسباني,extra goal,2017-12-09,1295471,15551,1037,1397,DE,Sports
Kxj31BTukIY,Real Madrid - Borussia Dortmund 3:2 | Highlights Champions League 2017/18 - 6. Spieltag,Sky Sport HD,2017-12-06,1123309,15813,494,0,DE,Sports
pv2LG9XORVo,Der BVB-Song,WUMMS,2017-12-08,110017,3869,530,370,DE,Sports
4tGVHi5I75Q,"5 Einwechslungen, die FUßBALLGESCHICHTE schrieben...",FußballZone,2017-12-09,63839,1924,33,91,DE,Sports
5LSkR6lpKJc,17. Spieltag | FCU - SGD | Stimmen zum Spiel,SG Dynamo Dresden e.V.,2017-12-09,7244,184,0,0,DE,Sports
YkRxPVwDFlk,When The Goalkeeper Takes The Penalty...,TheGoalMachine,2017-12-09,3715,49,4,3,DE,Sports
Dc6_r7WnCp0,"Weltfußballer Ronaldo | Erst Protz-Show, dann Tor-Gala | Real Madrid - FC Sevilla 5:0",BILD FUSSBALL,2017-12-09,173334,5302,171,591,DE,Sports
eVMq9KCvU_c,BEST PENALTY SHOOTOUT ON YOUTUBE!,freekickerz,2017-12-09,273741,15441,256,3119,DE,Sports
Wia7-oTLtCY,Finale – Boulder Bundesliga 2017 – 1.Liga Damen/Herren,Klettermafia,2017-12-09,2242,38,0,0,DE,Sports
AAZyiRSkkM4,BVB-Star Aubameyang wird nach England gelockt | SPORT1 TRANSFERMARKT,SPORT1,2017-12-08,97331,1929,61,203,DE,Sports
Qp-KIiGNNRE,Drawing w/ Robert Lewandowski | FC Bayern Xmas Advent Calendar #9,FC Bayern München,2017-12-09,11198,620,4,383,DE,Sports
eBJt-oTomGg,"Pressekonferenz: Willkommen in Dortmund, Peter Stöger!",Borussia Dortmund,2017-12-10,250974,4566,836,843,DE,Sports
mptt_Az4MAQ,Borussia Dortmund - Werder Bremen 1:2 / Der verrückteste Fehlschuss des Jahres!,BILD FUSSBALL,2017-12-10,96390,2391,90,254,DE,Sports
du_rb1hzfYk,FT Manchester Utd 1 - 2 Manchester City,Stadium Astro,2017-12-10,2467562,10330,969,446,DE,Sports
pv2LG9XORVo,Der BVB-Song,WUMMS,2017-12-08,193078,6638,980,613,DE,Sports
4tGVHi5I75Q,"5 Einwechslungen, die FUßBALLGESCHICHTE schrieben...",FußballZone,2017-12-09,137050,3070,62,130,DE,Sports
ofP1qrb-xIM,ملخص مباراه ريال مدريد واشبيلية 5-0 - ثنائية المدمر رونالدو جنون رؤوف خليف - الدوري الاسباني,extra goal,2017-12-09,2032435,22192,1546,1663,DE,Sports
Ia--lclOuIE,PSG meldet sich souverän zurück: Paris Saint-Germain - OSC Lille 3:1 | Highlights | Ligue 1 | DAZN,Goal Deutschland,2017-12-09,136275,2748,46,103,DE,Sports
YuKqm00ZH4Q,Spurs fegen Stoke weg: Tottenham Hotspur - Stoke City 5:1 | Highlights | Premier League,DAZN Premier League,2017-12-10,136092,2860,32,91,DE,Sports
mxpd6esNayQ,Barcelona vs Villarreal 2-0 All goals & Highlights English Commentary (10/12/2017) HD/1080P,NIXBLACK,2017-12-10,454025,1801,173,201,DE,Sports
u4AjlI49loQ,Seahawks vs. Jaguars | NFL Week 14 Game Highlights,NFL,2017-12-11,302336,2891,189,2017,DE,Sports
rurOeON7O7k,Köln 3 - 4 Freiburg - CHRISTIAN STREICH - Beitrag Match Interview 10-12-2017,MySportLiveTV,2017-12-10,13515,44,5,17,DE,Sports
e10_w1hGsok,So viele TORE!!!😱 UNGLAUBLICHES Kreisliga Spiel🔥 Krasses TRAUMTOR!⚽ Fußball Tore & Fails! PMTV,PMTV,2017-12-10,58140,3666,133,734,DE,Sports
GxYzAqUs8N0,F1: Top 10 Overtakes of 2017,FORMULA 1,2017-12-10,246327,9079,185,893,DE,Sports
x6LKJjIhUEs,Resumen de Real Madrid vs Sevilla FC (5-0),LaLiga Santander,2017-12-09,359856,2915,303,137,DE,Sports
xcuS8F4rusQ,Chemnitzer FC verliert auch in Rostock | Sport im Osten | MDR,Sport im Osten,2017-12-10,9922,106,6,8,DE,Sports
Vx-iUsdN6Fo,Borussia Dortmund: Oliver Pocher witzelt über Verpflichtung von Peter Stöger | SPORT1,SPORT1,2017-12-10,44231,735,185,201,DE,Sports
eBJt-oTomGg,Presentation of Peter Stöger as new BVB coach! | Press Conference,Borussia Dortmund,2017-12-10,296338,5196,1106,1082,DE,Sports
FRKSCKcQDJk,1. FC Köln -  SC Freiburg 3:4 / Köln verspielt 3-Tore-Führung im Schnee-Chaos,BILD FUSSBALL,2017-12-10,236331,4615,98,338,DE,Sports
kcSmQef9-xE,Ravens vs. Steelers | NFL Week 14 Game Highlights,NFL,2017-12-11,1146663,10128,463,3230,DE,Sports
tQTqNvJt8Ls,"Wenn FELDSPIELER sich als TORWART versuchen! (ft. CR7, Messi, Suarez uvm...)",GoalKEEPERz,2017-12-11,74214,8817,864,508,DE,Sports
Rc0uSZWzPaE,FT Liverpool 1 - 1 Everton,Stadium Astro,2017-12-10,693554,2579,170,209,DE,Sports
V2wDJ3fEjYM,Derby-Sieg für Guardiola: Manchester United - Manchester City 1:2 | Highlights | Premier League,DAZN Premier League,2017-12-11,298850,5490,107,368,DE,Sports
mT9PllloXpI,MANCHESTER UNITED (POGBA) vs MANCHESTER CITY (SANÉ) CHALLENGE | BROTATOS,STRIKERS,2017-12-10,61690,1815,76,1067,DE,Sports
ycVc1jsaAA0,Christmas Stereotypes,Dude Perfect,2017-12-11,4242835,238504,2718,25884,DE,Sports
xlVEIXtXaWU,Verstappen's Shock In Singapore | F1 Best Team Radio 2017,FORMULA 1,2017-12-11,27108,583,15,86,DE,Sports
0GP7ifvW5BQ,Harnik und Füllkrug trotzen Schneechaos: Hannover - Hoffenheim 2:0 | Highlights | Bundesliga | DAZN,DAZN Bundesliga,2017-12-10,56603,591,25,34,DE,Sports
o4aCgZV-o2E,ŞAMPİYONLAR LİGİ KURA ÇEKİMİ VE TEPKİLER l Beşiktaş - Bayern Münih,TARAFTAR KANALI,2017-12-11,340462,2128,160,1060,DE,Sports
N-wGjkGEphU,Ter Stegen sensationell - Messi auch: FC Villarreal - FC Barcelona 0:2 | Highlights | LaLiga | DAZN,Goal Deutschland,2017-12-11,203883,4690,97,256,DE,Sports
f392eUEg-tg,Atlaskorrektur - Diese Übungen können bei HWS-Schmerzen helfen | Liebscher & Bracht,Liebscher & Bracht | Die Schmerzspezialisten,2017-12-11,11388,693,8,18,DE,Sports
rfbF0uZxsRQ,What is Javi Martínez describing? | FC Bayern Xmas Advent Calendar #11,FC Bayern München,2017-12-11,10636,404,5,73,DE,Sports
eBJt-oTomGg,Presentation of Peter Stöger as new BVB coach! | Press Conference,Borussia Dortmund,2017-12-10,324322,5474,1258,1377,DE,Sports
ycVc1jsaAA0,Christmas Stereotypes,Dude Perfect,2017-12-11,8267018,367667,5273,33808,DE,Sports
FRKSCKcQDJk,1. FC Köln -  SC Freiburg 3:4 / Köln verspielt 3-Tore-Führung im Schnee-Chaos,BILD FUSSBALL,2017-12-10,275115,5103,114,369,DE,Sports
j7RZy2B73hw,Patriots vs. Dolphins | NFL Week 14 Game Highlights,NFL,2017-12-12,1291564,12586,654,5733,DE,Sports
V2wDJ3fEjYM,Derby-Sieg für Guardiola: Manchester United - Manchester City 1:2 | Highlights | Premier League,DAZN Premier League,2017-12-11,390053,6197,124,689,DE,Sports
c8bkGdeqwWw,"Top 10 Raw moments: WWE Top 10, December 11, 2017",WWE,2017-12-12,883915,21183,662,1371,DE,Sports
tQTqNvJt8Ls,"Wenn FELDSPIELER sich als TORWART versuchen! (ft. CR7, Messi, Suarez uvm...)",GoalKEEPERz,2017-12-11,87615,9800,1057,538,DE,Sports
N-wGjkGEphU,Ter Stegen sensationell - Messi auch: FC Villarreal - FC Barcelona 0:2 | Highlights | LaLiga | DAZN,Goal Deutschland,2017-12-11,256739,5301,118,265,DE,Sports
DcCBE5U5qnc,Ronaldo: “Bin der Beste aller Zeiten!” Kabinen-Prügelei nach Manchester-Derby! | KickNews,Kick11,2017-12-12,160852,8843,209,2379,DE,Sports
ShVltoTQybY,WWE Monday Night RAW 12/11/2017 Highlights HD - WWE RAW 11 December 2017 Highlights HD,Classy Wrestling,2017-12-12,599332,5610,445,114,DE,Sports
X_PZ_DpncJM,"FC Bayern-Pressetalk zur CL-Auslosung mit Kimmich, Süle & Müller | ReLive",FC Bayern München,2017-12-11,37880,1137,17,105,DE,Sports
8ucI8x4Z84g,Dynamo 2017 – der große Jahresrückblick | 19:53 – Der Dresdner Fußballtalk |  12. Dezember 2017,1953 - DER DRESDNER FUSSBALL-TALK,2017-12-12,1668,21,0,0,DE,Sports
eBJt-oTomGg,Presentation of Peter Stöger as new BVB coach! | Press Conference,Borussia Dortmund,2017-12-10,332251,5546,1283,1095,DE,Sports
VML2daXEp70,Bale-Siegtor nach Rückstand: Real Madrid – Al-Jazira 2:1 | Highlights | FIFA Klub-WM | DAZN,Goal Deutschland,2017-12-13,88805,3321,76,227,DE,Sports
lWmK1xQWHJQ,Pantomime w/ Niklas Süle | FC Bayern Xmas Advent Calendar #13,FC Bayern München,2017-12-13,9512,514,6,93,DE,Sports
skKSi-QTPBc,Donnarumma ablösefrei zu PSG? Giroud im Winter zum BVB? | TransferKickz,Kick11,2017-12-13,135037,6321,76,611,DE,Sports
arJhxkIbeAU,Rückenschmerzen morgens beim Aufstehen? Das kann Dir helfen!  | Liebscher & Bracht,Liebscher & Bracht | Die Schmerzspezialisten,2017-12-13,7513,445,10,11,DE,Sports
ycVc1jsaAA0,Christmas Stereotypes,Dude Perfect,2017-12-11,9387347,389347,5901,35377,DE,Sports
0DmmMopSKAQ,FT Manchester Utd 1 - 0 Bournemouth,Stadium Astro,2017-12-13,517315,1883,120,342,DE,Sports
c8bkGdeqwWw,"Top 10 Raw moments: WWE Top 10, December 11, 2017",WWE,2017-12-12,1355333,27086,941,1305,DE,Sports
FRKSCKcQDJk,1. FC Köln -  SC Freiburg 3:4 / Köln verspielt 3-Tore-Führung im Schnee-Chaos,BILD FUSSBALL,2017-12-10,291573,5272,121,450,DE,Sports
GCEWirC0k-U,BAYERN vs DORTMUND - Fußball SCHNEE Challenges + Gewinnspiel,LukasFootball,2017-12-14,40419,1323,49,81,DE,Sports
RG9x-WDAEyo,So herrlich reagiert Christian Streich auf einen Spielbericht der Badischen Zeitung,badischezeitung,2017-12-14,4296,34,1,1,DE,Sports
milQdmA7HHE,Stöger führt BVB zurück in die Erfolgsspur: Mainz - Dortmund 0:2 | Highlights | Bundesliga | DAZN,DAZN Bundesliga,2017-12-14,51867,1600,60,78,DE,Sports
JBsm4pfQ_vU,Pressekonferenz vor Kaiserslautern,CLUB TV,2017-12-14,4347,207,0,44,DE,Sports
ViLtYEdv9l4,Freue mich aufs erste Heimspiel! | Pressekonferenz mit Peter Stöger | BVB - TSG Hoffenheim,Borussia Dortmund,2017-12-14,40916,1218,32,126,DE,Sports
UHh2dYe-v-c,MANCHESTER UNITED (RASHFORD) vs MANCHESTER CITY (SANÉ) CHALLENGE | BROTATOS,Roadkickerz,2017-12-13,19009,872,12,160,DE,Sports
EB368KjyTWw,Pressekonferenz vor Hamburg,Borussia Mönchengladbach,2017-12-14,5512,143,13,32,DE,Sports
zSUXt8DenBY,ManCity schreibt Geschichte: Swansea City - Manchester City 0:4 | Highlights | Premier League | DAZN,DAZN Premier League,2017-12-14,258018,5526,92,239,DE,Sports
VML2daXEp70,Bale-Siegtor nach Rückstand: Real Madrid – Al-Jazira 2:1 | Highlights | FIFA Klub-WM | DAZN,Goal Deutschland,2017-12-13,314755,6552,213,518,DE,Sports
0uIS4FCtzLA,Zanderangeln im Fluss | Am Ufer unterwegs mit Pascal Wessel | www.zeck-fishing.com,Carsten Zeck,2017-12-14,5108,140,9,25,DE,Sports
XU6PvpDDwp8,Jahresabschlussinterview mit Dirk Zingler,1. FC Union Berlin,2017-12-14,3166,70,7,5,DE,Sports
sOHb_66LA10,What is Sebastian Rudy describing? | FC Bayern Xmas Advent Calendar #14,FC Bayern München,2017-12-14,9754,455,8,143,DE,Sports
milQdmA7HHE,Stöger führt BVB zurück in die Erfolgsspur: Mainz - Dortmund 0:2 | Highlights | Bundesliga | DAZN,DAZN Bundesliga,2017-12-14,228467,4179,150,249,DE,Sports
5ruCtRU-4vw,Ultimate Football Challenge - Loser Gives Away His Football Boots!,freekickerz,2017-12-15,201843,13395,132,4417,DE,Sports
GCEWirC0k-U,BAYERN vs DORTMUND - Fußball SCHNEE Challenges + Gewinnspiel,LukasFootball,2017-12-14,55867,1606,75,97,DE,Sports
nwh87nymS2w,Tottenham zurück ins alte Muster: Tottenham - Brighton 2:0 | Highlights | Premier League | DAZN,DAZN Premier League,2017-12-14,95406,1634,27,58,DE,Sports
d_17Lu1P6uI,Super Hacken-Treffer von di Santo | FC Schalke 04 - FC Augsburg 3:2,BILD FUSSBALL,2017-12-14,134632,2829,88,190,DE,Sports
d3jKHWYOU44,18. Spieltag | MSV - SGD | Pressekonferenz vor dem Spiel,SG Dynamo Dresden e.V.,2017-12-15,3776,85,2,0,DE,Sports
4Re0kc2AQf8,Drawing w/ Javi Martínez | FC Bayern Xmas Advent Calendar #15,FC Bayern München,2017-12-15,7695,310,3,44,DE,Sports
pH3SNqkRUug,Borussia Dortmund vs. 1899 Hoffenheim | 2017-18 Bundesliga Highlights,FOX Soccer,2017-12-16,59533,855,17,115,DE,Sports
E0rSeGP0nIg,Real Madrid CF v Gremio FBPA - FIFA CLUB WORLD CUP UAE 2017,FIFATV,2017-12-16,295807,4032,220,828,DE,Sports
hqOvshLUG6U,ThSV Eisenach vs. ASV Hamm-Westfalen (2. Handballbundesliga),ThSV Eisenach,2017-12-16,3539,8,23,0,DE,Sports
VewjIC2mqsk,Lewandowski-Goldtor gegen Tabellenschlusslicht:  Bayern - Köln 1:0 | Highlights | Bundesliga | DAZN,DAZN Bundesliga,2017-12-14,129729,1949,84,184,DE,Sports
MNa4D6TZiks,ملخص ريــال مدريـد وجــريميـــو 1-0 نهائي كــاس العــالم 16-12-2017 تعليق عصام الشوالي,كورة كول_ kora cool,2017-12-16,602579,5300,579,413,DE,Sports
5ruCtRU-4vw,Ultimate Football Challenge - Loser Gives Away His Football Boots!,freekickerz,2017-12-15,375866,18998,204,6440,DE,Sports
5m-zc-lanOE,اهداف وملخص مباراة ريال مدريد وجريميو 1-0 💪💪💪{جنون عصام الشوالي} نهائي كأس العالم 2017,اهداف وملخصات,2017-12-16,746839,4620,682,292,DE,Sports
RLwMYUsq15o,Dimitrij Ovtcharov vs Lin Gaoyuan (ITTF GRANDFINALS 2017) MS 1/2 WITHOUT 2 SETS,ttinfo,2017-12-16,21215,241,8,95,DE,Sports
ylZhSKXDMKk,Gündogan trifft bei Rekordsieg: Manchester City - Tottenham 4:1 | Highlights | Premier League | DAZN,DAZN Premier League,2017-12-17,334282,7444,111,344,DE,Sports
pH3SNqkRUug,Borussia Dortmund vs. 1899 Hoffenheim | 2017-18 Bundesliga Highlights,FOX Soccer,2017-12-16,156413,1599,30,173,DE,Sports
FnAx2bLICOo,5-a-side Scissor Kick,Freddie Lister,2017-12-17,662308,8100,923,885,DE,Sports
VpwVhRuutQ0,"Müller trifft spät, Akolo scheitert an Ulreich | VfB Stuttgart - Bayern München 0:1",BILD FUSSBALL,2017-12-17,44786,1582,51,236,DE,Sports
HnEvstCFqGU,Selkes triumphale Rückkehr zum Ex-Klub: Leipzig - Hertha BSC 2:3 | Highlights | Bundesliga | DAZN,DAZN Bundesliga,2017-12-17,40504,823,28,165,DE,Sports
4EbRsVVBvq8,"2 Tore, 2 Vorlagen: Neymar mit einem Gala-Auftritt: Rennes - PSG 1:4 | Highlights | Ligue 1 | DAZN",Goal Deutschland,2017-12-16,348565,7737,173,364,DE,Sports
PYJCfofa7OA,WORKOUT für ZUHAUSE - FIT in 15 Minuten - Trainieren ohne Langeweile - NEUE ART von HIIT - 250 WDH,BodyKiss,2017-12-17,12625,581,7,39,DE,Sports
E0rSeGP0nIg,Real Madrid CF v Gremio FBPA - FIFA CLUB WORLD CUP UAE 2017,FIFATV,2017-12-16,971439,8456,520,1289,DE,Sports
YYhmGstJQB8,"Peter Stöger: Die Mannschaft hat gezeigt, dass sie bereit ist. | BVB - TSG Hoffenheim 2:1",Borussia Dortmund,2017-12-16,59633,1659,26,248,DE,Sports
RAiqjVj3YkA,18. Spieltag | MSV - SGD | Pressekonferenz nach dem Spiel,SG Dynamo Dresden e.V.,2017-12-17,4560,62,4,0,DE,Sports
eE7dI6Dyejk,Pantomime w/ Javi Martínez | FC Bayern Xmas Advent Calendar #17,FC Bayern München,2017-12-17,9558,400,9,78,DE,Sports
3ooegKm6ozA,SMARTGYM - Wie alles begann? Teil #1 | SMARTGAINS,SMARTGAINS,2017-12-16,26306,2537,68,188,DE,Sports
bLJr-Wo6T0Y,Rams vs. Seahawks | NFL Week 15 Game Highlights,NFL,2017-12-18,272731,2971,202,1992,DE,Sports
eeytG7UjHQU,Die PK nach dem Spiel | Hannover 96 - Bayer 04 Leverkusen,HANNOVER 96,2017-12-17,3529,156,1,23,DE,Sports
Liwc5wML_Oc,90+5: Naldo machts schon wieder: Frankfurt - FC Schalke 2:2 | Highlights | Bundesliga | DAZN,DAZN Bundesliga,2017-12-17,145971,1930,52,249,DE,Sports
ylZhSKXDMKk,Gündogan trifft bei Rekordsieg: Manchester City - Tottenham 4:1 | Highlights | Premier League | DAZN,DAZN Premier League,2017-12-17,441599,8291,120,403,DE,Sports
v9wbMzkVseE,Patriots vs. Steelers | NFL Week 15 Game Highlights,NFL,2017-12-18,2078841,18220,4222,14800,DE,Sports
HT0AZw4qmBg,Die Ruthenbeck-PK vor Schalke in voller Länge,GEISSBLOG.KOELN,2017-12-18,7468,134,5,31,DE,Sports
FnAx2bLICOo,5-a-side Scissor Kick,Freddie Lister,2017-12-17,973015,11426,1368,1343,DE,Sports
pH3SNqkRUug,Borussia Dortmund vs. 1899 Hoffenheim | 2017-18 Bundesliga Highlights,FOX Soccer,2017-12-16,170608,1688,37,182,DE,Sports
LRAN9pzdwsw,Vettel and Stroll Collide After The Flag | F1 Most Dramatic Moments 2017,FORMULA 1,2017-12-18,32780,979,6,199,DE,Sports
rYLcgxKwCCk,Bodybuilder drehen völlig durch!! Synthol und kleiner Pimmel? Hardgainer Crew!,HARDGAINER CREW,2017-12-18,36537,2156,69,214,DE,Sports
4EbRsVVBvq8,"2 Tore, 2 Vorlagen: Neymar mit einem Gala-Auftritt: Rennes - PSG 1:4 | Highlights | Ligue 1 | DAZN",Goal Deutschland,2017-12-16,421494,8088,185,372,DE,Sports
q-jZm-FUbqs,"Stephanie McMahon announces the first-ever Women's Royal Rumble Match: Raw, Dec. 18, 2017",WWE,2017-12-19,1146692,23788,1527,5134,DE,Sports
QpLHm_rEmUs,1. FSV Mainz 05 - VfB Stuttgart 3:1 | Highlights DFB-Pokal 2017/18 - Achtelfinale,Sky Sport HD,2017-12-19,38840,670,19,0,DE,Sports
ZzYTmqPO9cM,Das letzte Video ...für 2017 | www.zeck-fishing.com,Carsten Zeck,2017-12-19,5384,231,8,65,DE,Sports
FYBXOgsfnCM,ManCity bietet Pep 23 Mio. € pro Jahr! Bayern plant Mega-Transfers! | KickNews,Kick11,2017-12-19,172063,8146,128,744,DE,Sports
Lfiv_cRr5Dc,Pressekonferenz vor Leverkusen,Borussia Mönchengladbach,2017-12-19,6967,202,7,29,DE,Sports
ZfriMKEp2Fs,Lewis v Münch (R1) 2018 World Championship,GC,2017-12-19,4667,62,4,18,DE,Sports
fBz5cnWYAPA,"100. Sendung mit Coach Esume, Björn Werner & NFL Week 15  | Footballerei SHOW",Footballerei,2017-12-19,4529,188,3,20,DE,Sports
6s04cc7t3uM,Oldschool VS Newschool | RÜCKENTRAINING mit Thomas Scheu & Mike Sommerfeld,Peak Performance Products,2017-12-19,3560,197,5,28,DE,Sports
WK8mVuKnME4,WHAT AN UPSET!!! WHAT A MATCH!!! Munch vs A.Lewis. World Darts Championship. Set 3+4,Darts Life,2017-12-19,14556,135,6,47,DE,Sports
sgc74nPjVoo,DFB-Pokal - Bayern München vs. Borussia Dortmund | Youtuber kommentieren live | Sportschau,Sportschau,2017-12-21,157752,9368,435,29,DE,Sports
ef-vN-SeB7A,FC Bayern München - Borussia Dortmund | Highlights DFB-Pokal 2017/18 - Achtelfinale,Sky Sport HD,2017-12-20,148693,3639,200,0,DE,Sports
AKVhIPKTEzc,Der FC Augsburg wünscht Frohe Weihnachten,FC Augsburg,2017-12-20,6405,259,1,14,DE,Sports
FZffknkC-WQ,Alte Helden: Piccolino,Deutsche Reiterliche Vereinigung e.V. (FN),2017-12-20,7353,195,1,3,DE,Sports
1_pqxNStp0g,ManCity jubelt nach Krimi | Leicester - Manchester City 3:4 n.E. | Highlights | League Cup | DAZN,DAZN Premier League,2017-12-20,355373,8744,160,217,DE,Sports
NKOEgNxvNaM,"Styles, Orton & Nakamura vs. Mahal, Owens & Zayn: SmackDown LIVE, Dec. 19, 2017",WWE,2017-12-20,903236,18896,711,1429,DE,Sports
XngG4mp9WBY,✍️ Simon Terodde wechselt zum 1. FC Köln,1. FC Köln,2017-12-20,7170,512,12,53,DE,Sports
WK8mVuKnME4,WHAT AN UPSET!!! WHAT A MATCH!!! Munch vs A.Lewis. World Darts Championship. Set 3+4,Darts Life,2017-12-19,59063,313,15,97,DE,Sports
FYBXOgsfnCM,ManCity bietet Pep 23 Mio. € pro Jahr! Bayern plant Mega-Transfers! | KickNews,Kick11,2017-12-19,194622,8642,136,804,DE,Sports
4FXYrIq9y8Y,Sensation! Kevin Münch wirft Adrian Lewis raus | SPORT1 DARTS,SPORT1,2017-12-20,41397,790,15,145,DE,Sports
ZfriMKEp2Fs,Lewis v Münch (R1) 2018 World Championship,GC,2017-12-19,36247,220,11,47,DE,Sports
fiO4vS7FUTs,Wahnsinn! KEVIN MÜNCH schlägt sensationell ADRIAN LEWIS | Highlights | PDC Darts WM 2018 | DAZN,DAZN Darts,2017-12-20,12938,166,4,17,DE,Sports
ef-vN-SeB7A,FC Bayern München - Borussia Dortmund 2:1 | Highlights DFB-Pokal 2017/18 - Achtelfinale,Sky Sport HD,2017-12-20,494963,7707,442,0,DE,Sports
sgc74nPjVoo,DFB-Pokal - Bayern München vs. Borussia Dortmund | Youtuber kommentieren live | Sportschau,Sportschau,2017-12-21,231953,11338,707,231,DE,Sports
cZVTLWJ9SKs,"Es war utopisch, Alter! | Collage zum Abschied von „Capo Lehmi“",SG Dynamo Dresden e.V.,2017-12-21,33746,995,14,0,DE,Sports
inHPT2kjiZU,Werder ist dran an einem Stürmer! Ein Kommentar von DeichStuben-Reporter Björn Knips,DeichStube,2017-12-21,6649,90,5,18,DE,Sports
YUYcxdbuyVo,Mainz 05 wünscht frohe Weihnachten!,1. FSV Mainz 05,2017-12-21,4098,238,3,26,DE,Sports
sdnRecGvOL8,Herrlichs kuriose Schwalbe: Das sah sicher blöd aus,spiegeltv,2017-12-21,6467,34,32,15,DE,Sports
UShWwieOztI,Schaffen Bodybuilder 100 Wiederholungen? Derbes Schulter Wachstum! Hardgainer Crew Challenge,HARDGAINER CREW,2017-12-21,44782,2295,27,175,DE,Sports
Yo0TDE4lv3g,Auch Saiblinge lassen sich fangen,MikesBigTrouts,2017-12-21,4823,232,6,22,DE,Sports
2BvGwIicchE,Volkswagen-Talk mit Frank Baumann,Werder Bremen,2017-12-21,4527,167,2,22,DE,Sports
8tztlrIzlyU,Seilbahn Zugspitze,Zugspitze2962,2017-12-21,23143,219,7,34,DE,Sports
YnYbQRTMfWY,Diese Schlafposition solltest Du unbedingt vermeiden 2.0 - Antwort auf die FOCUS-Kritik,Liebscher & Bracht | Die Schmerzspezialisten,2017-12-22,11569,1112,15,61,DE,Sports
lm7HrhoOv0A,Der Fortuna Düsseldorf Weihnachtsgruß 2017,Fortuna Düsseldorf,2017-12-22,6772,177,9,9,DE,Sports
Put93KsWYhY,Wegen Griezmann: Atlético zeigt Barça an! Was Mbappé wirklich bereut! | KickNews,Kick11,2017-12-22,171128,8584,109,732,DE,Sports
cZVTLWJ9SKs,"Es war utopisch, Alter! | Collage zum Abschied von „Capo Lehmi“",SG Dynamo Dresden e.V.,2017-12-21,51820,1253,31,0,DE,Sports
qxofa-X6qwg,Kylian Mbappe am 19. Geburtstag stark: PSG - Caen 3:1 | Highlights | Ligue 1 | DAZN,Goal Deutschland,2017-12-21,154504,2992,73,162,DE,Sports
EGdXJ18HlO4,اهداف مباراة ليفرربوول و ارسنااال 3-3 كاملة {صلاح يسجل وريمونتادا قوية} الدوري الانجليزي,اهداف وملخصات,2017-12-22,946285,6765,427,764,DE,Sports
YQKOcS6qsF8,I’ve come full circle - First Interview with Sandro Wagner at FC Bayern,FC Bayern München,2017-12-21,62439,2121,50,151,DE,Sports
ef-vN-SeB7A,FC Bayern München - Borussia Dortmund 2:1 | Highlights DFB-Pokal 2017/18 - Achtelfinale,Sky Sport HD,2017-12-20,553565,8141,476,0,DE,Sports
Og6CZWA_w1o,MTB Car Park Challenges |SickSeries #37,Fabio Wibmer,2017-12-22,159350,9933,131,445,DE,Sports
8tztlrIzlyU,Seilbahn Zugspitze,Zugspitze2962,2017-12-21,44542,338,17,37,DE,Sports
sgc74nPjVoo,DFB-Pokal - Bayern München vs. Borussia Dortmund | Youtuber kommentieren live | Sportschau,Sportschau,2017-12-21,248439,11666,757,273,DE,Sports
4DwPPCYZ2e0,FATİH TERİM İLE İMZA TÖRENİ | HD CANLI,Galatasaray,2017-12-22,164796,0,0,363,DE,Sports
grSI6jSac-E,Bewaffneter Raubüberfall - Wie geht es mir heute?!,BodyKiss,2017-12-21,26051,1237,184,122,DE,Sports
ssProkTd7LA,Nordtribüne Freiburg - Hinrunde 2017/2018,Nordtribuene.Org,2017-12-22,2731,109,3,7,DE,Sports
PC6M5bhy2jE,ASV Hamm-Westfalen gg. HSG Nordhorn-Lingen,ASV Hamm-Westfalen,2017-12-22,1913,19,0,0,DE,Sports
OKnL_D3bvLU,Real Madrid vs Barcelona 0-3 - All Goals & Highlights - 23/12/2017 HD,Premium Sintesi,2017-12-23,3826984,42076,2595,3657,DE,Sports
aX8Li5ks3Kc,Mesut Özil trifft bei Torspektakel: Arsenal – Liverpool 3:3 | Highlights | Premier League | DAZN,DAZN Premier League,2017-12-23,437441,8895,118,452,DE,Sports
_al3Qt2CxQo,ملخص مباراه ريال مدريد وبرشلونة 0-3 - ميسي يؤكد عقدة البرنابيو - جنون الشوالي - الدوري الاسباني,extra goal,2017-12-23,4510250,42742,7488,5561,DE,Sports
5JjPfpSrtvY,Real Madrid vs Barcelona 0-3 - All Goals & Extended Highlights - La Liga 23/12/2017 HD,GOLAZO TV,2017-12-23,2670218,27721,2100,5215,DE,Sports
O65MvYOKkQQ,Lionel Messi & Co. erobern das Bernabeu: Real Madrid – Barcelona 0:3 | Highlights | LaLiga | DAZN,Goal Deutschland,2017-12-23,261528,8479,324,786,DE,Sports
ReAM7JhiVT4,Real Madrid vs Barcelona (El Clasico) 0-3 - Highlights Resumen 23/12/2017,Iuonak,2017-12-23,1196926,4590,3336,766,DE,Sports
QAwugvwTPEs,Real Madrid Vs Barcelona 0-3 - All Goals & Highlights - Resumen y Goles 23/12/2017 HD,NugoBasilaiaa,2017-12-23,1643957,11100,942,1389,DE,Sports
BASh7eNGciw,Real Madrid vs Barcelona 0-3 All Goals & Highlights 23/12/2017 HD,Wrsh98,2017-12-23,2863226,15226,2444,1321,DE,Sports
VOj4GTXil0Y,ملخص واهداف مباراة برشلونة وريال مدريد 3-0 {الريال يسقط علي ارضه} وجنون الشوالى الدوري الاسباني 2018,اهداف وملخصات,2017-12-23,863417,0,0,812,DE,Sports
3dE_16m8B44,Die #ThoMats-Weihnachtschallenge 2017,Thomas Müller,2017-12-23,17933,2016,20,1833,DE,Sports
KHJwuSlHMAk,هدف لويس سواريز الاول في مرمي ريال مدريد #كلاسيكو الارض !!,Mohamed El Ashry,2017-12-23,491760,2123,604,630,DE,Sports
XWvhubdMsNY,"Most shocking moments of 2017: WWE Top 10, Dec. 23, 2017",WWE,2017-12-23,1494366,40970,1033,2232,DE,Sports
AjZK_mtI1ag,Demir Grup Sivasspor 2 - 1 Beşiktaş Maç Özeti 23 Aralık 2017,Maç Özetleri Türkiye,2017-12-23,443849,1161,241,766,DE,Sports
8tztlrIzlyU,Seilbahn Zugspitze,Zugspitze2962,2017-12-21,76474,512,40,41,DE,Sports
x8Q_2ReU8Yk,Taylor v Pipe (R2) 2018 World Championship Darts,GC,2017-12-23,12605,66,11,30,DE,Sports
Put93KsWYhY,Wegen Griezmann: Atlético zeigt Barça an! Was Mbappé wirklich bereut! | KickNews,Kick11,2017-12-22,200446,9265,119,762,DE,Sports
OKnL_D3bvLU,Real Madrid vs Barcelona 0-3 - All Goals & Highlights - 23/12/2017 HD,Premium Sintesi,2017-12-23,5540707,53895,3744,4644,DE,Sports
O65MvYOKkQQ,Lionel Messi & Co. erobern das Bernabeu: Real Madrid – Barcelona 0:3 | Highlights | LaLiga | DAZN,Goal Deutschland,2017-12-23,348555,9904,385,914,DE,Sports
aX8Li5ks3Kc,Mesut Özil trifft bei Torspektakel: Arsenal – Liverpool 3:3 | Highlights | Premier League | DAZN,DAZN Premier League,2017-12-23,557346,9677,137,485,DE,Sports
5JjPfpSrtvY,Real Madrid vs Barcelona 0-3 - All Goals & Extended Highlights - La Liga 23/12/2017 HD,GOLAZO TV,2017-12-23,3394865,31019,2458,5704,DE,Sports
KISQN8H7Juk,ZOBACZ JAK WYGLĄDAŁ MDLEJĄCY POPEK PO WALCE Z TOMASZEM OŚWIECIŃSKIM NA KSW 41,MMAPLtv,2017-12-24,880471,2602,338,869,DE,Sports
kZlqLudKbyw,DEUTSCHLAND (KROOS) vs BRASILIEN (NEYMAR) CHALLENGE | BROTATOS,STRIKERS,2017-12-24,49095,2590,103,869,DE,Sports
_al3Qt2CxQo,ملخص مباراه ريال مدريد وبرشلونة 0-3 - ميسي يؤكد عقدة البرنابيو - جنون الشوالي - الدوري الاسباني,extra goal,2017-12-23,5926208,51940,9313,6474,DE,Sports
BASh7eNGciw,Real Madrid vs Barcelona 0-3 All Goals & Highlights 23/12/2017 HD,Wrsh98,2017-12-23,4106045,19015,3228,1624,DE,Sports
QAwugvwTPEs,Real Madrid Vs Barcelona 0-3 - All Goals & Highlights - Resumen y Goles 23/12/2017 HD,NugoBasilaiaa,2017-12-23,2335267,13716,1308,1692,DE,Sports
vyAgIrH4l_o,رد فعل ميسي بعد ضربه رونالدو بالكرة في الرأس في الكلاسيكو اخلاق عالية,All Football TV,2017-12-24,1940445,17363,930,900,DE,Sports
VOj4GTXil0Y,ملخص واهداف مباراة برشلونة وريال مدريد 3-0 {الريال يسقط علي ارضه} وجنون الشوالى الدوري الاسباني 2018,اهداف وملخصات,2017-12-23,1025837,0,0,930,DE,Sports
L88qlDQS6yc,ThoMats #6 | Dress-Up Challenge | Müller vs. Hummels - Christmas Edition 🎅,FC Bayern München,2017-12-23,90490,4652,53,5411,DE,Sports
vWQmZyye4Sc,Galatasaray 3 - 1 Göztepe Maç Özeti 24 Aralık 2017,Maç Özetleri Türkiye,2017-12-24,462088,2219,229,964,DE,Sports
cHy-NsDKjPc,Real Madrid vs Barcelona 0-3 - Goals & Highlights 23 December 2017,Iuonak,2017-12-23,876323,4373,466,576,DE,Sports
GhxW9K-yYlQ,WEIHNACHTEN FUßBALLCHALLENGE + GEWINNSPIEL feat. Brotatos | Roadkickerz | Strikers,Locofloki,2017-12-24,7342,811,19,340,DE,Sports
JKfL6m49zfU,STRACHU po wygranej: SZPILKA to drugi POPEK,Przeglad Sportowy,2017-12-24,612393,3424,560,857,DE,Sports
jekzs98AanI,Galatasaray 3-1 Göztepe -HD Maç Özeti - 24/12/2017,Yasin Kayrancı,2017-12-24,226163,1034,202,334,DE,Sports
mvNHlcpbGO4,شاهد ردت فعل ايسكو اثناء احتفال ليونيل ميسي بعد تسجيله ركلة الجزاء !!!,مجرم كورة HD,2017-12-23,973026,7914,2648,333,DE,Sports
XWvhubdMsNY,"Most shocking moments of 2017: WWE Top 10, Dec. 23, 2017",WWE,2017-12-23,2210506,50348,1382,2754,DE,Sports
OKnL_D3bvLU,Real Madrid vs Barcelona 0-3 - All Goals & Highlights - 23/12/2017 HD,Premium Sintesi,2017-12-23,6315133,59637,4498,5192,DE,Sports
XN7KifJCvWU,Mit Sergio Agüero zum Rekord: Manchester City – Bournemouth 4:0 | Highlights | Premier League | DAZN,DAZN Premier League,2017-12-24,260714,5360,178,292,DE,Sports
kZlqLudKbyw,DEUTSCHLAND (KROOS) vs BRASILIEN (NEYMAR) CHALLENGE | BROTATOS,STRIKERS,2017-12-24,71190,3274,165,1034,DE,Sports
O65MvYOKkQQ,Lionel Messi & Co. erobern das Bernabeu: Real Madrid – Barcelona 0:3 | Highlights | LaLiga | DAZN,Goal Deutschland,2017-12-23,387364,10369,413,934,DE,Sports
COT_ZVc4kmo,What is James Rodríguez describing? | FC Bayern Xmas Advent Calendar #24,FC Bayern München,2017-12-24,48836,959,19,161,DE,Sports
yKbJKJ_whHY,Seahawks vs. Cowboys | NFL Week 16 Game Highlights,NFL,2017-12-25,792062,5988,453,3513,DE,Sports
SG5al5UTolU,"Christmas chaos: WWE Top 10, Dec. 25, 2017",WWE,2017-12-25,1367546,30023,866,1445,DE,Sports
jekzs98AanI,Galatasaray 3-1 Göztepe -HD Maç Özeti - 24/12/2017,Yasin Kayrancı,2017-12-24,514062,2261,510,683,DE,Sports
KISQN8H7Juk,ZOBACZ JAK WYGLĄDAŁ MDLEJĄCY POPEK PO WALCE Z TOMASZEM OŚWIECIŃSKIM NA KSW 41,MMAPLtv,2017-12-24,1151409,3664,527,1056,DE,Sports
5JjPfpSrtvY,Real Madrid vs Barcelona 0-3 - All Goals & Extended Highlights - La Liga 23/12/2017 HD,GOLAZO TV,2017-12-23,3668650,32163,2600,5812,DE,Sports
z5wiZRlV9I4,Cleveland Cavaliers vs Golden State Warriors Full Game Highlights / Week 11 / Dec 25,MLG Highlights,2017-12-25,1356267,7856,762,5291,DE,Sports
1Un9O8MF9yE,Christmas Special! BODYBUILDER vs WEIHNACHTEN! Hardgainer Crew! 2017 *Lustig*,HARDGAINER CREW,2017-12-25,39643,4635,64,207,DE,Sports
OKnL_D3bvLU,Real Madrid vs Barcelona 0-3 - All Goals & Highlights - 23/12/2017 HD,Premium Sintesi,2017-12-23,6932065,63972,5084,5762,DE,Sports
Z90T9riY8Xs,"Roman Reigns vs. Samoa Joe - Intercontinental Championship Match: Raw, Dec. 25, 2017",WWE,2017-12-26,1993340,35378,1729,2984,DE,Sports
9oyKePWRi8Y,Best of 2017 | Dude Perfect,Dude Perfect,2017-12-26,3185900,195414,1502,11246,DE,Sports
CeK6seVYaQk,LIV vs SWA 5-0 Highlights & Goals - 26 December 2017 HD,Team Bwowos,2017-12-26,1598333,6489,535,331,DE,Sports
uXgsMgq-V2o,مباراة  العراق وقطر - كأس الخليج العربي - خليجي 23 - جودة HD,AL_MADAR 2,2017-12-26,404647,6581,468,63,DE,Sports
U-U-MR95x6I,Galatasaray 3 - 0 Bucaspor l Maç Özeti l  Ziraat Türkiye Kupası,Sadece Galatasaray,2017-12-26,279671,1123,106,66,DE,Sports
wy05iFG7pj8,brand new life - our year 2017,fabiiiful94,2017-12-26,7409,727,3,29,DE,Sports
O3ttybJghsc,Raiders vs. Eagles | NFL Week 16 Game Highlights,NFL,2017-12-26,872301,7505,441,2845,DE,Sports
z5wiZRlV9I4,Cleveland Cavaliers vs Golden State Warriors Full Game Highlights / Week 11 / Dec 25,MLG Highlights,2017-12-25,2415334,11603,1147,6813,DE,Sports
wnNa5sA_Vkc,Lewandowski vs freekickerz ⚽ Free Kick Shootout,freekickerz,2017-12-26,311560,24373,201,5884,DE,Sports
slj6BneaLQk,ASV Hamm-Westfalen gg. HSG TV Konstanz,ASV Hamm-Westfalen,2017-12-26,2118,19,0,0,DE,Sports
kZlqLudKbyw,DEUTSCHLAND (KROOS) vs BRASILIEN (NEYMAR) CHALLENGE | BROTATOS,STRIKERS,2017-12-24,81084,3593,176,1198,DE,Sports
kSQCBFgABUY,Reds ballern Swans aus Anfield: Liverpool - Swansea 5:0 | Highlights | Premier League | DAZN,DAZN Premier League,2017-12-27,196308,4053,38,208,DE,Sports
9oyKePWRi8Y,Best of 2017 | Dude Perfect,Dude Perfect,2017-12-26,6291266,307708,2851,15199,DE,Sports
U-U-MR95x6I,Galatasaray 3 - 0 Bucaspor l Maç Özeti l  Ziraat Türkiye Kupası,Sadece Galatasaray,2017-12-26,535191,2126,267,48,DE,Sports
oqbwrcp7FKA,"AJ Styles vs. Kevin Owens: SmackDown LIVE, Dec. 26, 2017",WWE,2017-12-27,869971,16326,1038,1303,DE,Sports
P3XW3vbSZPI,How can we love with our hearts on fire | Willi 2014 - 2017,fabiiiful94,2017-12-27,4637,651,1,43,DE,Sports
K4G83dDH_KE,"Volvo Ocean Race 2017/18 - Etappe 3: Sturm, Bruch und Verletzungen",YACHT tv,2017-12-27,2750,41,1,4,DE,Sports
LhyQDlGWoY8,WWE Smackdown 26th December 2017 Highlights - WWE Smackdown 12/26/17 Highlights,Wrestling WorldZ,2017-12-27,2403321,20285,1666,1107,DE,Sports
2ni2l2Obhqg,Die Lustigsten Torwartfehler überhaupt,HaiperPeiper,2017-12-27,7706,307,10,30,DE,Sports
OKnL_D3bvLU,Real Madrid vs Barcelona 0-3 - All Goals & Highlights - 23/12/2017 HD,Premium Sintesi,2017-12-23,7386080,66568,5508,6139,DE,Sports
SF7G-BzqG4Q,Movement - Philosophie - Warum ist der Mensch körperlich so am Sack?,StrongandFlexTV,2017-12-27,3310,313,4,60,DE,Sports
kSQCBFgABUY,Reds ballern Swans aus Anfield: Liverpool - Swansea 5:0 | Highlights | Premier League | DAZN,DAZN Premier League,2017-12-27,258015,4765,49,225,DE,Sports
CVdde2ojH7E,104. Minute! Milan im Halbfinale: AC Mailand – Inter 1:0 | Highlights | Coppa Italia | DAZN,Goal Deutschland,2017-12-28,168723,3810,64,201,DE,Sports
MWWTkgZ5ZwM,Forellen im Winter - Aktiv??,MikesBigTrouts,2017-12-28,5162,220,10,24,DE,Sports
Lp4p4bqQ7Kw,Die Lustigsten Rote Karten,HaiperPeiper,2017-12-28,7135,244,13,26,DE,Sports
9oyKePWRi8Y,Best of 2017 | Dude Perfect,Dude Perfect,2017-12-26,6969112,324853,3151,16270,DE,Sports
9MC2sF3rTCQ,"Top 3 Süßigkeiten, die nicht dick machen",BODY IP by Simon Teichmann,2017-12-27,22521,935,59,94,DE,Sports
CVdde2ojH7E,104. Minute! Milan im Halbfinale: AC Mailand – Inter 1:0 | Highlights | Coppa Italia | DAZN,Goal Deutschland,2017-12-28,207639,4284,73,240,DE,Sports
kSQCBFgABUY,Reds ballern Swans aus Anfield: Liverpool - Swansea 5:0 | Highlights | Premier League | DAZN,DAZN Premier League,2017-12-27,275931,4953,51,241,DE,Sports
_F-9-dXrhjo,BEST OF 2017 - Fabio Wibmer,Fabio Wibmer,2017-12-30,181498,20194,77,1414,DE,Sports
azSAe-GTDoM,van Gerwen v Cross [SF] 2018 World Championship Darts,GC,2017-12-31,9644,115,8,15,DE,Sports
cUzm-OOmJcY,NIKE (RONALDO) vs ADIDAS (MESSI) CHALLENGE | BROTATOS,STRIKERS,2017-12-31,37291,1801,73,1795,DE,Sports
L7tJF0HF8_E,MOHAMED SALAH dreht Spiel: FC Liverpool - Leicester City 2:1 | Highlights | Premier League | DAZN,DAZN Premier League,2017-12-31,220061,4823,53,386,DE,Sports
nsJ7WvsAMLM,"Endlich schmerzfrei 2018!  Drei gute Vorsätze, mit denen Du das schaffen kannst!",Liebscher & Bracht | Die Schmerzspezialisten,2017-12-31,7433,551,4,19,DE,Sports
Vn4EVhRDaRg,WAIT I DO ROB CROSS VS VAN GERWEN LAST LEG!!!! WORLD DARTS CHAMPIONSHIP 2018 SEMI FINAL,Darts Life,2017-12-31,143218,673,48,297,DE,Sports
Dd_wRsWT01A,van Gerwen v Cross [SF] 2018 World Championship Darts,GC,2017-12-31,109900,451,40,104,DE,Sports
Cccpo0ZLCds,Effektive Übungen gegen Geierhals & Brettnacken! | Liebscher & Bracht,Liebscher & Bracht | Die Schmerzspezialisten,2018-01-01,20230,879,17,16,DE,Sports
jFzo6UCP2mI,Hard Gain - Der Film | Hardgainer Crew - 2018,HARDGAINER CREW,2018-01-01,78807,3969,600,308,DE,Sports
HuGb_GgphUQ,Fitness Guide 2018 - Fit mal einfach - KOSTENLOS - TAG 1,BodyKiss,2018-01-01,35979,1894,49,101,DE,Sports
6GPJcyzj2eM,30 Tage Yoga Challenge | Mache Yoga zu deiner Gewohnheit | #yogamitmady,Mady Morrison,2018-01-01,23201,1066,9,84,DE,Sports
8PgzSriuj2o,Taylor vs Cross | PDC Darts WM 2018 | Cross gewinnt das Dats WM Finale 2018!!!,Paul Meyer,2018-01-01,4570,82,7,25,DE,Sports
cUzm-OOmJcY,NIKE (RONALDO) vs ADIDAS (MESSI) CHALLENGE | BROTATOS,STRIKERS,2017-12-31,57775,2434,116,2441,DE,Sports
L7tJF0HF8_E,Mohamed Salah dreht Spiel: FC Liverpool - Leicester City 2:1 | Highlights | Premier League | DAZN,DAZN Premier League,2017-12-31,284202,5655,75,425,DE,Sports
qMyBtMf0JxY,Cardinals vs. Seahawks | NFL Week 17 Game Highlights,NFL,2018-01-01,417442,2717,190,1778,DE,Sports
reZrUkUJ2Po,Unsere 10 Transferprognosen für 2018! | TransferKickz Special,Kick11,2018-01-01,204032,9924,386,2374,DE,Sports
cWTp5xejawE,"Superstars looking invincible: WWE Top 10, Jan. 1, 2018",WWE,2018-01-01,946381,26088,553,1679,DE,Sports
rYcGZpSvK_s,Dubai New Year's Eve 2018 - Light Show From Burj Khalifa [FULL],BrioTV,2017-12-31,475659,2712,330,351,DE,Sports
LTuoO0uutm4,Paulo Dybala mit Doppelpack: Hellas Verona - Juventus Turin 1:3 | Highlights | Serie A | DAZN,Goal Deutschland,2017-12-31,72662,1705,21,67,DE,Sports
sqpIyLn1QCg,مباراة العراق والامارات كاملة  | مباراة عمان والبحرين كاملة,arab kora,2018-01-02,636800,9933,980,297,DE,Sports
zDz9s2AOTVE,"Brock Lesnar steps into the fire with Kane: Raw, Jan. 1, 2018",WWE,2018-01-02,3208825,51775,2723,5706,DE,Sports
Cccpo0ZLCds,Effektive Übungen gegen Geierhals & Brettnacken! | Liebscher & Bracht,Liebscher & Bracht | Die Schmerzspezialisten,2018-01-01,44894,1364,24,49,DE,Sports
eH3ZnBLDohc,مبارتات نصف نهائي  الإمارات ضد العراق  بصوت المبدع فارس  كأس الخليج 23 LIV Arabian Gulf Cup,SBTV LIVE,2018-01-03,554564,11355,1059,118,DE,Sports
4SEAkLqXbVQ,Bauchworkout - Oberkörper trainieren in 15 Minuten - HIIT Einheit zum definieren,BodyKiss,2018-01-02,11835,565,11,30,DE,Sports
7gQmyesSgiw,Sensation perfekt! ROB CROSS stürzt Altmeister PHIL TAYLOR | Highlights | PDC Darts WM 2018 | DAZN,DAZN Darts,2018-01-02,75424,1004,23,83,DE,Sports
jFzo6UCP2mI,Hard Gain - Der Film | Hardgainer Crew - 2018,HARDGAINER CREW,2018-01-01,103354,5017,859,397,DE,Sports
95BRL3EPJ8c,Last-Minute-Sieg dank Ex-Augsburger: Burnley - FC Liverpool 1:2 | Highlights | Premier League | DAZN,DAZN Premier League,2018-01-02,227115,4172,41,79,DE,Sports
R6BxUt9KTdg,Malu (8) und Chin-Chi - am 02.01.2018,Sabine Schumacher,2018-01-02,3677,149,3,22,DE,Sports
reZrUkUJ2Po,Unsere 10 Transferprognosen für 2018! | TransferKickz Special,Kick11,2018-01-01,233610,10711,425,2482,DE,Sports
MzbazqVQSf0,Wintervorbereitung - Trainingsauftakt 2018,Hansa-TV,2018-01-02,2821,128,3,15,DE,Sports
7LiCPpTTzCA,#3 Georgia vs #2 Oklahoma | 2018 Rose Bowl Game Highlights,Highlight Heaven,2018-01-02,391382,4109,119,1584,DE,Sports
wxAgFxqaw6s,Baumann: Sane hat Flieger aus privaten Gründen verpasst,DeichStube,2018-01-02,2817,78,1,9,DE,Sports
g0j5gwkKNgI,"WWE Champion AJ Styles vs. Sami Zayn: SmackDown LIVE, Jan. 2, 2018",WWE,2018-01-03,988814,18737,1527,3377,DE,Sports
mTKyVmplm8A,Endlich keine ISG-Schmerzen mehr ✅ So kannst Du das schaffen! | Liebscher & Bracht,Liebscher & Bracht | Die Schmerzspezialisten,2018-01-03,9189,577,5,14,DE,Sports
IgJutOLMloA,Blau-Weiße Nacht in Benidorm,FC Schalke 04,2018-01-03,6556,356,2,33,DE,Sports
kqbG8GSbP2Y,DynamoTV im Trainingslager in Marbella 2018,SG Dynamo Dresden e.V.,2018-01-03,4400,181,7,0,DE,Sports
wrSHl1Z04Ng,Ultimate Fail Compilation I Our best Falls and Outtakes,Majas Vlogs,2018-01-03,24834,1938,12,198,DE,Sports
s7SXBQCQMRg,ManCity mit Blitzstart: Manchester City - Watford FC 3:1 | Highlights | Premier League | DAZN,DAZN Premier League,2018-01-03,164889,3680,40,222,DE,Sports
RpOWPsJIkjI,"Portland Trail Blazers vs Cleveland Cavaliers - Full Game Highlights Jan 2, 2018 NBA Season 2017-18",Rapid Highlights,2018-01-03,605094,2029,148,405,DE,Sports
7gQmyesSgiw,Sensation perfekt! ROB CROSS stürzt Altmeister PHIL TAYLOR | Highlights | PDC Darts WM 2018 | DAZN,DAZN Darts,2018-01-02,80547,1051,24,86,DE,Sports
4d4K-K4kDrQ,Interview mit Jonas Hofmann,Borussia Mönchengladbach,2018-01-03,3835,205,2,11,DE,Sports
z6IdRnJWhbw,Ex-Bayern-Stars schießen Juve weiter: Juventus - FC Turin 2:0 | Highlights | Coppa Italia | DAZN,Goal Deutschland,2018-01-04,130695,2857,31,115,DE,Sports
4cMiKyV_ZCw,Richard Freitag Sturz Vierschanzentournee Innsbruck 2018,Special Sports Moments,2018-01-04,28405,0,0,18,DE,Sports
gk9Z7NteNgM,Roger Federer & Jack Sock FUNNY Sportsmanship - Hopman Cup 2018 (HD),Tennis Planet,2018-01-04,14204,45,1,8,DE,Sports
CSTCa5cEjoA,BEINE & PO Training für Zuhause - Brennen in Oberschenkel garantiert!,BodyKiss,2018-01-04,8040,411,3,39,DE,Sports
s7SXBQCQMRg,ManCity mit Blitzstart: Manchester City - Watford FC 3:1 | Highlights | Premier League | DAZN,DAZN Premier League,2018-01-03,211215,4145,50,224,DE,Sports
0vxHpPfge4E,Balotelli zum SSC Neapel? Pjaca zu Schalke! | TransferKickz,Kick11,2018-01-04,146650,6595,142,1108,DE,Sports
8JTz8PFL4RI,DSV-Mannschaftsarzt Dorfmüller nach Sturz von Richard Freitag,skispringen.com,2018-01-04,2590,2,0,0,DE,Sports
1JHY490K_A8,Kurt Angle pairs Finn Bálor with Sasha Banks for WWE Mixed Match Challenge,WWE,2018-01-04,623562,19283,606,2309,DE,Sports
X1rfgbHfPDc,Golden State Warriors vs Dallas Mavericks Full Game Highlights / Jan 3 / 2017-18 NBA Season,MLG Highlights,2018-01-04,1072547,6129,167,1671,DE,Sports
2Rz0QTCSALU,Mein Abnehm Geheimnis?,BODY IP by Simon Teichmann,2018-01-03,14882,786,38,87,DE,Sports
Qzvn78CBv-w,Werder-Coach Florian Kohfeldt steht Rede und Antwort,DeichStube,2018-01-04,2963,69,0,4,DE,Sports
4cMiKyV_ZCw,Richard Freitag Sturz Vierschanzentournee Innsbruck 2018,Special Sports Moments,2018-01-04,52630,0,0,67,DE,Sports
Pxb28GWtb-A,Ousmane Dembele gibt Comeback: Celta Vigo - FC Barcelona 1:1 | Highlights | Copa del Rey | DAZN,Goal Deutschland,2018-01-05,156856,3727,68,347,DE,Sports
EQvdKS-QX_E,Daniel Bryan teams Jimmy Uso and Naomi in WWE Mixed Match Challenge,WWE,2018-01-05,534746,16125,173,1476,DE,Sports
8vFAyFUEyuU,Zverev/Kerber (GER) Vs Kokkinakis/Gavrilova (AUS) - Hopman Cup 2018 RR (Highlights HD),SamTennisVids,2018-01-05,24092,173,6,41,DE,Sports
rCBnkqBrp44,Arsenal rettet Remis in Nachspielzeit: Arsenal - Chelsea 2:2 | Highlights | Premier League | DAZN,DAZN Premier League,2018-01-04,294270,7071,64,468,DE,Sports
bHaqsxRYTvQ,مباراة عمان والإمارات - نهائي خليجي 23 - جودة HD,AL_MADAR 2,2018-01-05,792907,7590,900,309,DE,Sports
H5AjtUdA63k,Messi: Das ist meine größte Schwäche! Mega-Strafe wegen Suff und Kippen! | KickNews,Kick11,2018-01-05,151179,8035,113,979,DE,Sports
0PYMudwOSMs,Home Workout für straffe Arme - Fatburner HIIT - Bauch intensiv trainieren,BodyKiss,2018-01-05,6276,348,6,35,DE,Sports
hqCve1aO_J4,"Crossbar Challenge w/ Müller, Kimmich, Rudy & Friedl 🔥⚽  | FC Bayern in Doha",FC Bayern München,2018-01-04,56159,2241,21,61,DE,Sports
q5M3mbvw3jw,"OKC Thunder vs LA Clippers - Full Game Highlights | Jan 4, 2018 | NBA Season 2017-18",Rapid Highlights,2018-01-05,576035,2066,81,499,DE,Sports
JxhfCtiWrUo,Testspiel BVB gegen Fortuna Düsseldorf,Borussia Dortmund,2018-01-06,175823,2497,232,103,DE,Sports
8c6-SPYAaRs,"Football Fights & Angry Moments 2017/2018 ● Neymar, Messi, C.Ronaldo, Ramos",JackieMT 2nd,2018-01-06,1188809,12427,633,789,DE,Sports
4cMiKyV_ZCw,Richard Freitag Sturz Vierschanzentournee Innsbruck 2018,Special Sports Moments,2018-01-04,70873,0,0,96,DE,Sports
h8w0spjslVs,Gareth Bale trifft vom Punkt: Numancia - Real Madrid 0:3 | Highlights | Copa del Rey | DAZN,Goal Deutschland,2018-01-05,196909,3997,165,557,DE,Sports
7ywl338GHGQ,Testspiel SG Dynamo Dresden gegen VfL Wolfburg,SG Dynamo Dresden e.V.,2018-01-06,36810,524,23,0,DE,Sports
GvYr8H4eUDI,FULL MATCH - Royal Rumble Match: Royal Rumble 2017 (WWE Network Exclusive),WWE,2018-01-06,751575,27213,1139,4342,DE,Sports
5u60gg0rfXk,5 Schritte zum perfekten Training - So bleibst du motiviert und machst alles richtig!,BodyKiss,2018-01-06,16432,961,8,60,DE,Sports
BYIBU7s2IRE,█▬█ █ ▀█▀  ZWYCIĘSTWO !!!!!!!  KAMIL STOCH TURNIEJ 4 SKOCZNI  - TCS BISCHOFSHOFEN (06.01.2018),Zielony StaFFi,2018-01-06,48893,413,17,62,DE,Sports
H5AjtUdA63k,Messi: Das ist meine größte Schwäche! Mega-Strafe wegen Suff und Kippen! | KickNews,Kick11,2018-01-05,173715,8718,119,1014,DE,Sports
MAiZOLGq20E,Podolski eröffnet Dönerladen in Köln: Geschichte passt zu mir,SID,2018-01-06,2118,37,12,6,DE,Sports
-uB2sezuqq8,Liverpool 2 - 1 Everton Official Highlights | Emirates FA Cup 2017/18,The Emirates FA Cup,2018-01-06,169844,1030,44,175,DE,Sports
NW77AUOHHKg,1st goal from Sandro Wagner! ⚽ FC Bayern - Al Ahly 6:0 | Highlights Friendly Match,FC Bayern München,2018-01-06,73614,2784,29,128,DE,Sports
JxhfCtiWrUo,Testspiel BVB gegen Fortuna Düsseldorf,Borussia Dortmund,2018-01-06,234013,3056,517,256,DE,Sports
8c6-SPYAaRs,"Football Fights & Angry Moments 2017/2018 ● Neymar, Messi, C.Ronaldo, Ramos",JackieMT 2nd,2018-01-06,2416034,22005,1363,1460,DE,Sports
8WRuxhmUseY,Falcons vs. Rams | NFL Wild Card Game Highlights,NFL,2018-01-07,1135251,7653,419,3850,DE,Sports
JHo-HGwQ8Zs,Kippen & Wodka Lemon“: Mario Basler brennt Sprüche-Feuerwerk ab | SPORT1 DOPPELPASS,SPORT1,2018-01-07,62211,1580,37,134,DE,Sports
7ywl338GHGQ,Testspiel SG Dynamo Dresden gegen VfL Wolfburg,SG Dynamo Dresden e.V.,2018-01-06,40445,543,27,0,DE,Sports
vN_ltBd6CAU,4 Treffer! Brillanter Ciro Immobile: SPAL - Lazio Rom 2:5 | Highlights | Serie A | DAZN,Goal Deutschland,2018-01-06,102464,2329,34,169,DE,Sports
1XwmIhZbQfM,Marcus Mariota Catches His Own Touchdown Pass! | Titans vs. Chiefs | NFL,Highlight Heaven,2018-01-06,153601,1342,36,399,DE,Sports
HFHjZNuTSJU,German Pool Masters powered by German Tour & REELIVE Final Day,REELIVE TV,2018-01-08,6181,27,1,2,DE,Sports
NW77AUOHHKg,1st goal from Sandro Wagner! ⚽ FC Bayern - Al Ahly 6:0 | Highlights Friendly Match,FC Bayern München,2018-01-06,156782,3981,85,181,DE,Sports
xJBIrSN6-0c,BVB-Medienrunde mit Marco Reus in Marbella,Ruhr Nachrichten BVB,2018-01-07,4646,119,2,15,DE,Sports
F7TSdHZJ5PM,SV Werder Bremen - FC Twente Enschede 4:0 | HIGHLIGHTS,Werder Bremen,2018-01-07,15438,640,1,55,DE,Sports
UMYKyoVJmDc,ملخص مباراه برشلونة وليفانتي 3-0 - تألق ميسي - جنون حفيظ دراجي - الدوري الاسباني,extra goal,2018-01-07,1427466,13121,1697,538,DE,Sports
9Rg6zEEpUGM,Diese Stars wurden vom FC Bayern ruiniert! | TopKickz,Kick11,2018-01-07,151306,7013,3046,2968,DE,Sports
2fuf-_nitqE,Werder-Coach Kohfeldt nach dem Testspiel-Sieg gegen Twente Enschede,DeichStube,2018-01-07,2960,91,0,7,DE,Sports
D6MJ5CW8KGI,Kamil Stoch Turniej Czterech Skoczni 2017/2018,FlyingT,2018-01-06,132860,1268,52,166,DE,Sports
QmmoQVcGlhc,"GS Warriors vs LA Clippers - Full Game Highlights | Jan 6, 2018 | NBA Season 2017-18",Rapid Highlights,2018-01-06,1121655,3614,229,856,DE,Sports
VQEevVitRug,LIVE: Testspiel | 1. FSV Mainz 05 - Bor. Mönchengladbach | 05er.tv,1. FSV Mainz 05,2018-01-07,14696,234,10,6,DE,Sports
owyh8cjtSDw,BVB - SV Zulte Waregem | Testspiel aus Marbella | ReLive,Borussia Dortmund,2018-01-08,75997,1482,120,75,DE,Sports
0OXM_PBlInw,Ronaldo & Co. verschenken Bale-Doppelpack: Celta Vigo - Real Madrid 2:2 | Highlights | LaLiga | DAZN,Goal Deutschland,2018-01-08,245224,4932,95,716,DE,Sports
1pmy-z4VwkA,Trainingslager in Spanien | Tag 4,SG Dynamo Dresden e.V.,2018-01-08,11377,243,13,0,DE,Sports
pvI5v_B-yio,Diese Schlafposition solltest Du unbedingt vermeiden 3.0: Unsere Antworten auf Eure Fragen!,Liebscher & Bracht | Die Schmerzspezialisten,2018-01-08,12390,657,10,64,DE,Sports
iM4lgtCFMGw,Panthers vs. Saints | NFL Wild Card Game Highlights,NFL,2018-01-08,1124072,8909,323,4117,DE,Sports
JHo-HGwQ8Zs,Kippen & Wodka Lemon“: Mario Basler brennt Sprüche-Feuerwerk ab | SPORT1 DOPPELPASS,SPORT1,2018-01-07,115459,2565,55,201,DE,Sports
8c6-SPYAaRs,"Football Fights & Angry Moments 2017/2018 ● Neymar, Messi, C.Ronaldo, Ramos",JackieMT 2nd,2018-01-06,2790301,24520,1573,1703,DE,Sports
NW77AUOHHKg,1st goal from Sandro Wagner! ⚽ FC Bayern - Al-Ahli 6:0 | Highlights Friendly Match,FC Bayern München,2018-01-06,206740,4440,127,225,DE,Sports
qFo5DdbYGIg,Challenge mit SELBSTGEMACHTEN 300€ FUßBALL gegen MEINE FREUNDIN ⚽!,GoalKEEPERz,2018-01-07,56804,3293,131,201,DE,Sports
czuU8M32n2A,The Incredible Story of 1.FC Magdeburg & Wrexham AFC,Wrexham AFC,2018-01-07,15575,159,6,20,DE,Sports
fsHuWgnf8r0,"Raw's funniest moments: WWE Top 10, Jan. 8, 2018",WWE,2018-01-08,451878,13310,310,766,DE,Sports
QP4_p9nMbJM,مباراة الزمالك vs الأهلي 0 - 3  | الجولة الـ 17 الدوري العام الممتاز 2017 - 2018,Presentation Sports,2018-01-08,989669,4470,601,89,DE,Sports
Aw2BKyFxeYY,Die Fairsten Fußball Elfmeter überhaupt,HaiperPeiper,2018-01-08,9654,367,16,21,DE,Sports
g1QONg2b2JQ,Overtime | Episode 1 | Dude Perfect,Dude Perfect,2018-01-08,2055743,153453,2589,30437,DE,Sports
9Rg6zEEpUGM,Diese Stars wurden vom FC Bayern ruiniert! | TopKickz,Kick11,2018-01-07,163582,7311,3196,3060,DE,Sports
SmmGAax4WnY,BVB-Trainer Peter Stöger über das Trainingslager in Marbella,Ruhr Nachrichten BVB,2018-01-08,3277,43,1,2,DE,Sports
LWWzG4NWJYA,Bolt zum BVB fix! 19jähriger ist reichster Fußballer der Welt! | KickNews,Kick11,2018-01-10,300863,14107,364,1757,DE,Sports
marAZRRxLgs,Barcelona vs Celta Vigo 5-0 - All Goals & Highlights ● 11/01/2018 HD (First Half),MrMatador,2018-01-11,484639,5777,442,552,DE,Sports
YKQt25PxGsI,Was Borussia-Fans vor dem Derby nie sagen würden...,Borussia Mönchengladbach,2018-01-11,5503,375,6,19,DE,Sports
Az-nWT5eDiE,Protein Taler,BODY IP by Simon Teichmann,2018-01-10,16329,1094,29,103,DE,Sports
ft4p5wJG88w,Enttäuschendes Real wieder nur Remis: Real Madrid - Numancia | Highlights | Copa del Rey | DAZN,Goal Deutschland,2018-01-11,127820,3267,60,287,DE,Sports
A47EHIKO05o,"AJ Styles, Randy Orton & Shinsuke Nakamura vs. Kevin Owens & Sami Zayn: SmackDown LIVE, Jan. 9, 2018",WWE,2018-01-10,1543550,25039,1218,2000,DE,Sports
K2kedWjkUrY,اطلاعات در مورد فرار محمود شاهرودی از آلمان,Mehdi Far,2018-01-11,73378,0,0,176,DE,Sports
0EwvFrY4aV8,Benjamin Stambouli: Viel Spaß und sehr viel Arbeit,FC Schalke 04,2018-01-11,4507,313,1,10,DE,Sports
2We_X9sDW7Q,Lakeside 2018 World Professional Darts Championship,BDODarts,2018-01-12,77998,317,23,5,DE,Sports
VJ8iR5rV1mQ,Markus kommentiert: Ich bin im Fernsehen - Dinner Party auf Sat.1,MarkusRuehl,2018-01-10,60323,3480,53,397,DE,Sports
5LePqAOcx6c,Piriformis-Syndrom – Was hilft Dir dagegen? | Liebscher & Bracht,Liebscher & Bracht | Die Schmerzspezialisten,2018-01-12,17686,702,11,20,DE,Sports
zX4j5PvWbk0,Lakeside 2018 World Professional Darts Championship,BDODarts,2018-01-13,94006,336,27,8,DE,Sports
3UtZIux09rI,Pressekonferenz vor Köln,Borussia Mönchengladbach,2018-01-12,7176,179,8,39,DE,Sports
marAZRRxLgs,Barcelona vs Celta Vigo 5-0 - All Goals & Highlights ● 11/01/2018 HD (First Half),MrMatador,2018-01-11,1748168,9571,856,809,DE,Sports
3JkOpJuwh_o,Wie Klopp den BVB reich machte! Team des Jahres ohne Neymar! | KickNews,Kick11,2018-01-12,157650,8132,162,1357,DE,Sports
zfGjFgoQH4k,Die PEINLICHSTEN Torwartfehler in der Bundesliga ( mit Laura Wontorra),GoalKEEPERz,2018-01-12,48019,3281,85,159,DE,Sports
hd7UIMrJvjY,Neymar macht den Schuh-Tanz: SC Amiens - PSG 0:2 | Highlights | Coupe de la Ligue | DAZN,Goal Deutschland,2018-01-11,318568,6876,141,331,DE,Sports
8RKmNEP6mZM,الهدف الأول لـ الأهلي امام المصري وليد ازارو  كأس السوبر المصري,Presentation Sports,2018-01-12,618492,2350,212,526,DE,Sports
-LDTgvy8XO8,Die Ruthenbeck-PK vor dem Derby in voller Länge,GEISSBLOG.KOELN,2018-01-12,3647,51,8,23,DE,Sports
Rdpljvo_2pg,Bayern Leverkusen vs Bayern Munich 1-3 All Goals & Highlights 2018,Brazukas _yt,2018-01-12,110265,775,41,27,DE,Sports
zRYiIieq5lo,Haben wir Investoren? Nehme ich wieder an einem Wettkampf teil? | SMARTGAINS Q&A,SMARTGAINS,2018-01-11,21666,1199,58,171,DE,Sports
TdGYtdoFSIk,Wir springen endlich wieder | Cubilox Vlogs,Cubilox Vlogs,2018-01-12,6559,557,6,35,DE,Sports
_afBcaDTP9g,Lakeside 2018 World Professional Darts Championship,BDODarts,2018-01-13,64914,275,20,3,DE,Sports
3_2sKvek42Y,Lionel Messi dreht bei Barca-Sieg auf: Barcelona - Celta Vigo 5:0 | Highlights | Copa del Rey | DAZN,Goal Deutschland,2018-01-12,310868,7978,94,467,DE,Sports
z4eonRfffRg,ملخص مباره ريال مدريد وفياريال 0-1 - مدريد يواصل السقوط - رؤوف خليف - الدوري الاسباني,extra goal,2018-01-13,1757467,16837,2037,3234,DE,Sports
WoX3Pmpl5Kk,Trainingslager in Spanien | Tag 9 | Paco-Talk,SG Dynamo Dresden e.V.,2018-01-13,6722,235,3,0,DE,Sports
Qrxw7hp3oEY,تحليل مباراة ريال مدريد وفياريال [0-1] زلزال في البرنابيو والريال يواصل السقوط [13/01/2018],Mounir Tube,2018-01-13,353352,3119,363,671,DE,Sports
zfGjFgoQH4k,Die PEINLICHSTEN Torwartfehler in der Bundesliga ( mit Laura Wontorra),GoalKEEPERz,2018-01-12,71271,4086,152,188,DE,Sports
K3HdFqSmaw8,2018 Sydney International Final | Angelique Kerber vs Ashleigh Barty | WTA Highlights,WTA,2018-01-13,22997,300,12,49,DE,Sports
nwDs1HB_fPg,Cenk Tosun'un Everton formasıyla ilk maç performansı,Mehmet Dokuyucu,2018-01-13,143001,1134,74,283,DE,Sports
JcHRqlAM7yE,Rautenperle.TV - HSV-Talk live nach dem Augsburg-Spiel,Marcus Scholz,2018-01-13,3514,118,3,14,DE,Sports
h86qezKXbZI,Interview nach dem Testspiel gegen Sønderjysk Elitesport,Hansa-TV,2018-01-13,2813,82,2,4,DE,Sports
3JkOpJuwh_o,Wie Klopp den BVB reich machte! Team des Jahres ohne Neymar! | KickNews,Kick11,2018-01-12,193115,9001,182,1500,DE,Sports
y6F27MP61Xc,FULL MATCH - Royal Rumble Match: Royal Rumble 2015 (WWE Network Exclusive),WWE,2018-01-13,545044,17589,2962,3355,DE,Sports
TyfYN4u8lJM,Manuel AKANJI 2018 • Welcome to Dortmund ? | HD,MTFilmz,2018-01-13,5863,176,1,8,DE,Sports
yewi33vUjkI,حفل افتتاح الشان (المغرب) 2018,Shahid TV,2018-01-13,208135,1955,359,531,DE,Sports
LlGXq8xjUMY,Titans vs. Patriots | NFL Divisional Round Game Highlights,NFL,2018-01-14,1447406,10080,925,4448,DE,Sports
4vxeo_5h1YY,Kölner Zaunfahnenklau an Gladbach - Platzsturm | FC Köln - BMG 2:1 | 14.01.2018,German Ultras,2018-01-14,61373,302,94,182,DE,Sports
qjQGTqjqp54,Liverpool vs Manchester City 4-3 All Goals & Highlights HD (14/01/2018),Dream Team,2018-01-14,591597,2042,311,129,DE,Sports
C9wVy1VNXmU,95. Minute! Traum-Siegtreffer von Rückkehrer Terodde | 1. FC Köln - Borussia Mönchengladbach 2:1,BILD FUSSBALL,2018-01-14,43406,1267,56,174,DE,Sports
FBoAjdPQf8s,Real Sociedad vs Barcelona 2-4 - All Goals & Highlights ● 14/01/2018 HD (First Half),MrMatador,2018-01-14,917950,3344,1769,379,DE,Sports
8hmHicIRF-c,Köln Gladbach Derby - Randale während dem Spiel - 14.01.2018,Gladbach Fans,2018-01-14,21801,20,34,46,DE,Sports
H0hHUVi1Oo4,ملخص مباراه برشلونة وريال سوسيداد 4-2 - ميسي يفك العقدة - جنون عصام الشوالي - الدوري الاسباني,extra goal,2018-01-14,1288010,19825,1256,1674,DE,Sports
jFiq9wF4Ws4,Trainingslager in Spanien | Fazit-Gespäch mit Uwe Neuhaus,SG Dynamo Dresden e.V.,2018-01-14,5308,154,2,0,DE,Sports
qqBOG1rPdpA,🔥 Derbytime: 1. FC Köln - Borussia Mönchengladbach 🔥,1. FC Köln,2018-01-14,5232,285,4,29,DE,Sports
hsNIDAsntEY,"So wird`s gemacht, Am Forellenteich auf Winter XXL Monster Forellen  Johnny Meets TFT Troutland",John Chowns,2018-01-14,5634,133,14,68,DE,Sports
CWZb8xa3tzg,Harry Kane mit Doppelpack: Tottenham Hotspur - FC Everton 4:0 | Highlights | Premier League | DAZN,DAZN Premier League,2018-01-14,191486,3897,45,226,DE,Sports
us8wkpwRaDI,1 Song YOGA FLOW - Verspannungen lösen und Körper kräftigen in 5 Minuten,BodyKiss,2018-01-14,10905,623,24,59,DE,Sports
a7Efkev5lBU,Watch a dramatic man overboard rescue on Scallywag! | Volvo Ocean Race,Volvo Ocean Race,2018-01-14,32931,199,4,28,DE,Sports
206I7JBftlk,Platzsturm nach Kölner Fahnenklau beim Niederrheinderby: 1. FC Köln - Borussia Mönchengladbach 2:1 !,TifoPyroTV,2018-01-14,21730,0,0,18,DE,Sports
7n42MS7svxU,Fornals' Traumtor stürzt Real in die Krise: Real - Villareal 0:1 | Highlights | LaLiga | DAZN,Goal Deutschland,2018-01-13,357310,8509,250,1370,DE,Sports
ofFYuMDu6wA,Torspektakel! Klopp besiegt Guardiola: Liverpool - Manchester City 4:3 | Highlights | Premier League,DAZN Premier League,2018-01-15,592313,11835,129,591,DE,Sports
5aL06wxD4lI,Saints vs. Vikings | NFL Divisional Round Game Highlights,NFL,2018-01-15,2306284,21901,960,8747,DE,Sports
Q5Wt0pd0cv4,Schiedsrichter-Skandal bei Paris Saint-Germain-Sieg: Nantes - PSG 0:1 | Highlights | Ligue 1 | DAZN,Goal Deutschland,2018-01-15,414175,6775,157,437,DE,Sports
C9wVy1VNXmU,95. Minute! Traum-Siegtreffer von Rückkehrer Terodde | 1. FC Köln - Borussia Mönchengladbach 2:1,BILD FUSSBALL,2018-01-14,178947,3444,195,504,DE,Sports
8EUK_QeP_wY,Das sagte Ruthenbeck am Tag nach dem Derbysieg,GEISSBLOG.KOELN,2018-01-15,7838,170,5,24,DE,Sports
1bUf-5054U8,Diese 3 Dinge musst Du beim Faszienrollen unbedingt beachten! | Liebscher & Bracht,Liebscher & Bracht | Die Schmerzspezialisten,2018-01-15,11535,533,10,23,DE,Sports
AwbNLs5xJH8,Slowenien 25 : 25  Deutschland Handball EM,Mein GELSENVIDEO,2018-01-15,29281,60,41,92,DE,Sports
xG0HmKgwo0c,Relive The Miracle Ending | The Vikings in the Playoffs,budleewiser,2018-01-15,1480212,13261,536,3922,DE,Sports
